abudawud24_934190	 حدثنا أبو بكر بن أبي شيبة حدثنا وكيع وحميد بن	حدثنا عبد الرحمن الرؤاسي عن مغيرة بن زياد عن عبادة بن نسى عن الأسود بن ثعلبة عن عبادة بن الصامت قال علمت ناسا من أهل الصفة الكتاب والقرآن فأهدى إلى رجل منهم قوسا فقلت ليست بمال وأرمي عنها في سبيل الله عز وجل لآتين رسول الله صلى الله عليه وسلم فلأسألنه فأتيته فقلت يا رسول الله رجل أهدى إلى قوسا ممن كنت أعلمه الكتاب والقرآن وليست بمال وأرمي عنها في سبيل الله قال إن كنت تحب أن تطوق طوقا من نار فاقبلها 	 حدثنا أبو بكر بن أبي شيبة حدثنا وكيع وحميد بن عبد الرحمن الرؤاسي عن مغيرة بن زياد عن عبادة بن نسى عن الأسود بن ثعلبة عن عبادة بن الصامت قال علمت ناسا من أهل الصفة الكتاب والقرآن فأهدى إلى رجل منهم قوسا فقلت ليست بمال وأرمي عنها في سبيل الله عز وجل لآتين رسول الله صلى الله عليه وسلم فلأسألنه فأتيته فقلت يا رسول الله رجل أهدى إلى قوسا ممن كنت أعلمه الكتاب والقرآن وليست بمال وأرمي عنها في سبيل الله قال إن كنت تحب أن تطوق طوقا من نار فاقبلها 	 Narrated Ubaydah ibn as-Samit: I taught some persons of the people of Suffah writing and the Qur'an. A man of them presented to me a bow. I said: It cannot be reckoned property; may I shoot with it in Allah's path? I must come to the Apostle of of Allah (SL3M) and ask him (about it). So I came to him and said : Messenger of Allah (SL3M), one of those whom I have been teaching writing and the Qur'an has presented me a bow, and as it cannot be reckoned property, may I shoot with it in Allah's path? He said: If you want to have a necklace of fire on you, accept it. 
abudawud24_934200	 حدثنا عمرو بن عثمان وكثير بن عبيد قالا حدثنا بقية حدثني بشر بن عبد الله بن	حدثنا يسار قال عمرو حدثني عبادة بن نسى عن جنادة بن أبي أمية عن عبادة بن الصامت نحو هذا الخبر والأول أتم فقلت ما ترى فيها يا رسول الله فقال جمرة بين كتفيك تقلدتها أو تعلقتها 	 حدثنا عمرو بن عثمان وكثير بن عبيد قالا حدثنا بقية حدثني بشر بن عبد الله بن يسار قال عمرو حدثني عبادة بن نسى عن جنادة بن أبي أمية عن عبادة بن الصامت نحو هذا الخبر والأول أتم فقلت ما ترى فيها يا رسول الله فقال جمرة بين كتفيك تقلدتها أو تعلقتها 	 A similar tradition has also been transmitted by 'Ubadah b. al-Samit through a different chain of narrators, but the former tradition is more perfect. This version has: I said: What do you think about it, Messenger of Allah? He said: A live coal between your shoulders which you have put around your neck or hanged it. 
abudawud24_934210	 حدثنا مسدد حدثنا أبو عوانة عن أبي بشر عن أبي المتوكل عن	عن أبي سعيد الخدري أن رهطا من أصحاب رسول الله صلى الله عليه وسلم انطلقوا في سفرة سافروها فنزلوا بحى من أحياء العرب فاستضافوهم فأبوا أن يضيفوهم قال فلدغ سيد ذلك الحى فشفوا له بكل شىء لا ينفعه شىء فقال بعضهم لو أتيتم هؤلاء الرهط الذين نزلوا بكم لعل أن يكون عند بعضهم شىء ينفع صاحبكم فقال بعضهم إن سيدنا لدغ فشفينا له بكل شىء فلا ينفعه شىء فهل عند أحد منكم شىء يشفي صاحبنا يعني رقية فقال رجل من القوم إني لأرقي ولكن استضفناكم فأبيتم أن تضيفونا ما أنا براق حتى تجعلوا لي جعلا فجعلوا له قطيعا من الشاء فأتاه فقرأ عليه بأم الكتاب ويتفل حتى برئ كأنما أنشط من عقال فأوفاهم جعلهم الذي صالحوه عليه فقالوا اقتسموا فقال الذي رقى لا تفعلوا حتى نأتي رسول الله صلى الله عليه وسلم فنستأمره فغدوا على رسول الله صلى الله عليه وسلم فذكروا له فقال رسول الله صلى الله عليه وسلم من أين علمتم أنها رقية أحسنتم واضربوا لي معكم بسهم 	 حدثنا مسدد حدثنا أبو عوانة عن أبي بشر عن أبي المتوكل عن أبي سعيد الخدري أن رهطا من أصحاب رسول الله صلى الله عليه وسلم انطلقوا في سفرة سافروها فنزلوا بحى من أحياء العرب فاستضافوهم فأبوا أن يضيفوهم قال فلدغ سيد ذلك الحى فشفوا له بكل شىء لا ينفعه شىء فقال بعضهم لو أتيتم هؤلاء الرهط الذين نزلوا بكم لعل أن يكون عند بعضهم شىء ينفع صاحبكم فقال بعضهم إن سيدنا لدغ فشفينا له بكل شىء فلا ينفعه شىء فهل عند أحد منكم شىء يشفي صاحبنا يعني رقية فقال رجل من القوم إني لأرقي ولكن استضفناكم فأبيتم أن تضيفونا ما أنا براق حتى تجعلوا لي جعلا فجعلوا له قطيعا من الشاء فأتاه فقرأ عليه بأم الكتاب ويتفل حتى برئ كأنما أنشط من عقال فأوفاهم جعلهم الذي صالحوه عليه فقالوا اقتسموا فقال الذي رقى لا تفعلوا حتى نأتي رسول الله صلى الله عليه وسلم فنستأمره فغدوا على رسول الله صلى الله عليه وسلم فذكروا له فقال رسول الله صلى الله عليه وسلم من أين علمتم أنها رقية أحسنتم واضربوا لي معكم بسهم 	 Narrated Abu Sa’id Al Khudri : Some of the Companions of Prophet (SL3M) went on a journey. They encamped with a clan of the Arabs and sought hospitality from them, but they refused to provide them with any hospitality. The chief of the clan was stung by a scorpion or bitten by a snake. They gave him all sorts of treatment, but nothing gave him relied. One of them said: Would that you had gone to those people who encamped with you ; some of them might have something which could give you relief to your companion. (So they went and) one of them said: Our chief has been stung by a scorpion or bitten by a snake. We administered all sorts of medicine but nothing gave him relief. Has any of you anything, i.e. charm, which gives healing to our companion. One of those people said: I shall apply charm; we sought hospitality from you, but you refused to entertain us. I am not going to apply charm until you give me some wages. So they offered them a number of sheep. He then came to and recited Faithat-al-Kitab and spat until he was cured as if he were set free from a bond. Thereafter they made payment of the wages as agreed by them. They said: Apportion (the wages). The man who applied the charm said: Do not do until we come to the Messenger of Allah (SL3M) and consult him. So they came to the Messenger of Allah (SL3M) next morning and mentioned it to him. The Messenger of Allah (SL3M) said: From where did you learn that it was a charm ? You have done right. Give me a share along with you. 
abudawud24_934220	 حدثنا الحسن بن علي حدثنا يزيد بن هارون أخبرنا هشام بن حسان عن محمد بن سيرين عن أخيه معبد بن سيرين عن أبي سعيد الخدري عن	عن النبي صلى الله عليه وسلم بهذا الحديث 	 حدثنا الحسن بن علي حدثنا يزيد بن هارون أخبرنا هشام بن حسان عن محمد بن سيرين عن أخيه معبد بن سيرين عن أبي سعيد الخدري عن النبي صلى الله عليه وسلم بهذا الحديث 	 This tradition has also been transmitted by Abu Sa'id al-Khudri form the Prophet (SL3M). 
abudawud24_934230	 حدثنا عبيد الله بن معاذ حدثنا أبي حدثنا شعبة عن عبد الله بن أبي السفر عن الشعبي عن خارجة بن الصلت عن	عن عمه أنه مر بقوم فأتوه فقالوا إنك جئت من عند هذا الرجل بخير فارق لنا هذا الرجل فأتوه برجل معتوه في القيود فرقاه بأم القرآن ثلاثة أيام غدوة وعشية كلما ختمها جمع بزاقه ثم تفل فكأنما أنشط من عقال فأعطوه شيئا فأتى النبي صلى الله عليه وسلم فذكره له فقال النبي صلى الله عليه وسلم كل فلعمري لمن أكل برقية باطل لقد أكلت برقية حق 	 حدثنا عبيد الله بن معاذ حدثنا أبي حدثنا شعبة عن عبد الله بن أبي السفر عن الشعبي عن خارجة بن الصلت عن عمه أنه مر بقوم فأتوه فقالوا إنك جئت من عند هذا الرجل بخير فارق لنا هذا الرجل فأتوه برجل معتوه في القيود فرقاه بأم القرآن ثلاثة أيام غدوة وعشية كلما ختمها جمع بزاقه ثم تفل فكأنما أنشط من عقال فأعطوه شيئا فأتى النبي صلى الله عليه وسلم فذكره له فقال النبي صلى الله عليه وسلم كل فلعمري لمن أكل برقية باطل لقد أكلت برقية حق 	 Kharijah b. al-Salt quoted his paternal uncle as saying that he passed by a clan (of the Arab) who came to him and said: You have brought what is good from this man. Then they brought a lunatic in chains. He recited Surat al-Fatihah over him three days, morning and evening. When he finished, he collected his saliva and then spat it out, (he felt relief) as if he were set free from a bond. They gave him something (as wages). He then came to the Prophet (SL3M) and mentioned it to him. The Messenger of Allah (SL3M) said: Accept it, for by my life, some accept it for a worthless charm, but you have done so far a genuine one. 
abudawud24_934240	 حدثنا موسى بن إسماعيل أخبرنا أبان عن يحيى عن إبراهيم بن عبد الله يعني ابن قارظ عن السائب بن يزيد عن رافع بن	عن خديج أن رسول الله صلى الله عليه وسلم قال كسب الحجام خبيث وثمن الكلب خبيث ومهر البغي خبيث 	 حدثنا موسى بن إسماعيل أخبرنا أبان عن يحيى عن إبراهيم بن عبد الله يعني ابن قارظ عن السائب بن يزيد عن رافع بن خديج أن رسول الله صلى الله عليه وسلم قال كسب الحجام خبيث وثمن الكلب خبيث ومهر البغي خبيث 	 Narrated Rafi' ibn Khadij: The Prophet (SL3M) said: The earnings of a cupper are impure, the price paid for a dog is impure, and the hire paid to a prostitute is impure. 
abudawud24_934250	 حدثنا عبد الله بن مسلمة القعنبي عن مالك عن ابن شهاب عن ابن محيصة عن	عن أبيه أنه استأذن رسول الله صلى الله عليه وسلم في إجارة الحجام فنهاه عنها فلم يزل يسأله ويستأذنه حتى أمره أن اعلفه ناضحك ورقيقك 	 حدثنا عبد الله بن مسلمة القعنبي عن مالك عن ابن شهاب عن ابن محيصة عن أبيه أنه استأذن رسول الله صلى الله عليه وسلم في إجارة الحجام فنهاه عنها فلم يزل يسأله ويستأذنه حتى أمره أن اعلفه ناضحك ورقيقك 	 Narrated Muhayyisah ibn Ka'b: Muhayyisah asked permission of the Messenger of Allah (SL3M) regarding hire of the cupper, but he forbade him. He kept on asking his permission, and at last he said to him: Feed your watering camel with it and feed your slave with it. 
abudawud24_934260	 حدثنا مسدد حدثنا يزيد بن زريع حدثنا خالد عن عكرمة عن	عن ابن عباس قال احتجم رسول الله صلى الله عليه وسلم وأعطى الحجام أجره ولو علمه خبيثا لم يعطه 	 حدثنا مسدد حدثنا يزيد بن زريع حدثنا خالد عن عكرمة عن ابن عباس قال احتجم رسول الله صلى الله عليه وسلم وأعطى الحجام أجره ولو علمه خبيثا لم يعطه 	 Narrated Ibn 'Abbas: The Messenger of Allah (SL3M) got him self cupped and gave the cupper his wages. Had he considered it impure, he would not have given it (wage) to him. 
abudawud24_934270	 حدثنا القعنبي عن مالك عن حميد الطويل عن أنس بن	حدثنا مالك أنه قال حجم أبو طيبة رسول الله صلى الله عليه وسلم فأمر له بصاع من تمر وأمر أهله أن يخففوا عنه من خراجه 	 حدثنا القعنبي عن مالك عن حميد الطويل عن أنس بن مالك أنه قال حجم أبو طيبة رسول الله صلى الله عليه وسلم فأمر له بصاع من تمر وأمر أهله أن يخففوا عنه من خراجه 	 Narrated Anas b. Malik : That Abu Tibah cupped the Messenger of Allah (SL3M) and he ordered that a sa' of dates be given to him, also ordering his people to remit some of his dues. 
abudawud24_934280	 حدثنا عبيد الله بن معاذ حدثنا أبي حدثنا شعبة عن محمد بن	عن جحادة قال سمعت أبا حازم سمع أبا هريرة قال نهى رسول الله صلى الله عليه وسلم عن كسب الإماء 	 حدثنا عبيد الله بن معاذ حدثنا أبي حدثنا شعبة عن محمد بن جحادة قال سمعت أبا حازم سمع أبا هريرة قال نهى رسول الله صلى الله عليه وسلم عن كسب الإماء 	 Narrated Abu Hurairah: That the Messenger of Allah (SL3M) forbade earnings of slave-girls. 
abudawud24_934290	 حدثنا هارون بن عبد الله حدثنا هاشم بن القاسم حدثنا عكرمة حدثني طارق بن	حدثنا عبد الرحمن القرشي قال جاء رافع بن رفاعة إلى مجلس الأنصار فقال لقد نهانا نبي الله صلى الله عليه وسلم اليوم فذكر أشياء ونهانا عن كسب الأمة إلا ما عملت بيدها وقال هكذا بأصابعه نحو الخبز والغزل والنفش 	 حدثنا هارون بن عبد الله حدثنا هاشم بن القاسم حدثنا عكرمة حدثني طارق بن عبد الرحمن القرشي قال جاء رافع بن رفاعة إلى مجلس الأنصار فقال لقد نهانا نبي الله صلى الله عليه وسلم اليوم فذكر أشياء ونهانا عن كسب الأمة إلا ما عملت بيدها وقال هكذا بأصابعه نحو الخبز والغزل والنفش 	 Narrated Tariq ibn AbdurRahman al-Qarash: Rafi' ibn Rifa'ah came to a meeting of the Ansar and said: The Prophet of Allah (SL3M) forbade us (from some things) today, and he mentioned some things. He forbade the earning of a slave-girl except what she earned with her hand. He indicated (some things) with his fingers such as baking, spinning, and ginning. 
abudawud24_934300	 حدثني أحمد بن صالح حدثنا ابن أبي فديك عن عبيد الله يعني ابن هرير عن أبيه عن	عن جده رافع هو ابن خديج قال نهى رسول الله صلى الله عليه وسلم عن كسب الأمة حتى يعلم من أين هو 	 حدثني أحمد بن صالح حدثنا ابن أبي فديك عن عبيد الله يعني ابن هرير عن أبيه عن جده رافع هو ابن خديج قال نهى رسول الله صلى الله عليه وسلم عن كسب الأمة حتى يعلم من أين هو 	 Narrated Rafi' b. Khadij: The Messenger of Allah (SL3M) forbade earnings of a slave-girl unless it is known from where it came. 
abudawud24_934310	 حدثنا قتيبة عن سفيان عن الزهري عن أبي بكر بن	حدثنا عبد الرحمن عن أبي مسعود عن النبي صلى الله عليه وسلم أنه نهى عن ثمن الكلب ومهر البغي وحلوان الكاهن 	 حدثنا قتيبة عن سفيان عن الزهري عن أبي بكر بن عبد الرحمن عن أبي مسعود عن النبي صلى الله عليه وسلم أنه نهى عن ثمن الكلب ومهر البغي وحلوان الكاهن 	 Narrated AbuMas'ud: The Prophet (SL3M) forbade the price paid for a dog, the hire paid to a prostitute, and the gift given to a soothsayer. 
abudawud24_934320	 حدثنا مسدد بن مسرهد حدثنا إسماعيل عن علي بن	حدثنا الحكم عن نافع عن ابن عمر قال نهى رسول الله صلى الله عليه وسلم عن عسب الفحل 	 حدثنا مسدد بن مسرهد حدثنا إسماعيل عن علي بن الحكم عن نافع عن ابن عمر قال نهى رسول الله صلى الله عليه وسلم عن عسب الفحل 	 Narrated Abdullah ibn Umar: The Messenger of Allah (SL3M) forbade (taking hire for) a stallion's covering. 
abudawud24_934330	 حدثنا موسى بن إسماعيل حدثنا حماد بن سلمة أخبرنا محمد بن إسحاق عن العلاء بن عبد الرحمن عن	أخبرنا أبي ماجدة قال قطعت من أذن غلام أو قطع من أذني فقدم علينا أبو بكر حاجا فاجتمعنا إليه فرفعنا إلى عمر بن الخطاب فقال عمر إن هذا قد بلغ القصاص ادعوا لي حجاما ليقتص منه فلما دعي الحجام قال سمعت رسول الله صلى الله عليه وسلم يقول إني وهبت لخالتي غلاما وأنا أرجو أن يبارك لها فيه فقلت لها لا تسلميه حجاما ولا صائغا ولا قصابا قال أبو داود روى عبد الأعلى عن ابن إسحاق قال ابن ماجدة رجل من بني سهم عن عمر بن الخطاب 	 حدثنا موسى بن إسماعيل حدثنا حماد بن سلمة أخبرنا محمد بن إسحاق عن العلاء بن عبد الرحمن عن أبي ماجدة قال قطعت من أذن غلام أو قطع من أذني فقدم علينا أبو بكر حاجا فاجتمعنا إليه فرفعنا إلى عمر بن الخطاب فقال عمر إن هذا قد بلغ القصاص ادعوا لي حجاما ليقتص منه فلما دعي الحجام قال سمعت رسول الله صلى الله عليه وسلم يقول إني وهبت لخالتي غلاما وأنا أرجو أن يبارك لها فيه فقلت لها لا تسلميه حجاما ولا صائغا ولا قصابا قال أبو داود روى عبد الأعلى عن ابن إسحاق قال ابن ماجدة رجل من بني سهم عن عمر بن الخطاب 	 AbuMajidah said: I cut the ear of a boy, or he cut my ear (the narrator is doubtful). AbuBakr then came to us to perform hajj and we got together with him. But he referred us to Umar ibn al-Khattab. Umar (ibn al-Khattab) said: This reached the extent of retaliation. Call a cupper to me so that he may retaliate. When the cupper was called, he (Umar) said: I heard the Messenger of Allah (SL3M) say: I gave a boy to my maternal aunt, and I hope that she will be blessed in respect of him. I said to her: Do not entrust him to a supper, nor to a goldsmith, nor to a butcher. Abu Dawud said: This tradition has also been transmitted by 'Abd al-A'la from Ibn Ishaq who said: Abu Majidah is a man of Banu Sahm narrating from 'Umar b. al-Khattab. 
abudawud24_934340	 حدثنا يوسف بن موسى حدثنا سلمة بن الفضل حدثنا ابن إسحاق عن العلاء بن عبد الرحمن الحرقي عن ابن ماجدة السهمي عن عمر بن الخطاب عن	عن النبي صلى الله عليه وسلم نحوه 	 حدثنا يوسف بن موسى حدثنا سلمة بن الفضل حدثنا ابن إسحاق عن العلاء بن عبد الرحمن الحرقي عن ابن ماجدة السهمي عن عمر بن الخطاب عن النبي صلى الله عليه وسلم نحوه 	 A similar tradition has also been transmitted by Abu Majidah al-Sahmi from 'Umar b. al-Khattab through a different chain of narrators. 
abudawud24_934350	 حدثنا الفضل بن يعقوب حدثنا عبد الأعلى عن محمد بن	حدثنا إسحاق حدثنا العلاء بن عبد الرحمن الحرقي عن ابن ماجدة السهمي عن عمر بن الخطاب رضى الله عنه عن النبي صلى الله عليه وسلم مثله 	 حدثنا الفضل بن يعقوب حدثنا عبد الأعلى عن محمد بن إسحاق حدثنا العلاء بن عبد الرحمن الحرقي عن ابن ماجدة السهمي عن عمر بن الخطاب رضى الله عنه عن النبي صلى الله عليه وسلم مثله 	 Abu Majidah quoted 'Umar b. al-Khattab as saying: I heard the Prophet (SL3M) say ... narrating the tradition to the same effect. 
abudawud24_934360	 حدثنا أحمد بن حنبل حدثنا سفيان عن الزهري عن سالم عن أبيه عن	عن النبي صلى الله عليه وسلم قال من باع عبدا وله مال فماله للبائع إلا أن يشترطه المبتاع ومن باع نخلا مؤبرا فالثمرة للبائع إلا أن يشترط المبتاع 	 حدثنا أحمد بن حنبل حدثنا سفيان عن الزهري عن سالم عن أبيه عن النبي صلى الله عليه وسلم قال من باع عبدا وله مال فماله للبائع إلا أن يشترطه المبتاع ومن باع نخلا مؤبرا فالثمرة للبائع إلا أن يشترط المبتاع 	 Narrated Ibn 'Umar: The Prophet (SL3M) as saying: If anyone buys a slave who possesses property. his property belongs to the seller unless buyer makes a provision and if anyone buys palm-trees after they have been fecundated, the fruit belongs to the seller unless the buyer make a provision. 
abudawud24_934370	 حدثنا القعنبي عن مالك عن نافع عن ابن عمر عن عمر عن	عن رسول الله صلى الله عليه وسلم بقصة العبد وعن نافع عن ابن عمر عن النبي صلى الله عليه وسلم بقصة النخل قال أبو داود واختلف الزهري ونافع في أربعة أحاديث هذا أحدها 	 حدثنا القعنبي عن مالك عن نافع عن ابن عمر عن عمر عن رسول الله صلى الله عليه وسلم بقصة العبد وعن نافع عن ابن عمر عن النبي صلى الله عليه وسلم بقصة النخل قال أبو داود واختلف الزهري ونافع في أربعة أحاديث هذا أحدها 	 This tradition has also been narrated by 'Umar from the Messenger of Allah (SL3M) through a different chain of narrators. It mentions only the sale of the slave. It has also been transmitted by Nafi' on the authority of Ibn 'Umar from the Prophet (SL3M) indicating only the sale of palm-trees. Abu Dawud said: Al-Zuhri and Nafi' differed among themselves in four traditions. This is one of them. 
abudawud24_934380	 حدثنا مسدد حدثنا يحيى عن سفيان حدثني سلمة بن	حدثنا كهيل حدثني من سمع جابر بن عبد الله يقول قال رسول الله صلى الله عليه وسلم من باع عبدا وله مال فماله للبائع إلا أن يشترط المبتاع 	 حدثنا مسدد حدثنا يحيى عن سفيان حدثني سلمة بن كهيل حدثني من سمع جابر بن عبد الله يقول قال رسول الله صلى الله عليه وسلم من باع عبدا وله مال فماله للبائع إلا أن يشترط المبتاع 	 Narrated Jabir ibn Abdullah: The Prophet (SL3M) said: If anyone buys a slave who possesses property, his property belongs to the seller unless the buyer makes a proviso. 
