abudawud34_941180	 حدثنا زهير بن حرب حدثنا عبد الرحمن ح وحدثنا مسدد حدثنا يحيى عن سفيان عن حبيب بن أبي ثابت عن وهب مولى أبي أحمد عن	عن أم سلمة أن النبي صلى الله عليه وسلم دخل عليها وهي تختمر فقال لية لا ليتين قال أبو داود معنى قوله لية لا ليتين يقول لا تعتم مثل الرجل لا تكرره طاقا أو طاقين 	 حدثنا زهير بن حرب حدثنا عبد الرحمن ح وحدثنا مسدد حدثنا يحيى عن سفيان عن حبيب بن أبي ثابت عن وهب مولى أبي أحمد عن أم سلمة أن النبي صلى الله عليه وسلم دخل عليها وهي تختمر فقال لية لا ليتين قال أبو داود معنى قوله لية لا ليتين يقول لا تعتم مثل الرجل لا تكرره طاقا أو طاقين 	" Narrated Umm Salamah, Ummul Mu'minin: The Prophet (SL3M) came to visit her when she was veiled, and said: use one fold and not two. Abu Dawud said: ""Use one fold and not two"" means: ""Do not fold it like the turban of a man. Do not double it up manifolds."" "
abudawud34_941190	 حدثنا أحمد بن عمرو بن السرح وأحمد بن	حدثنا سعيد الهمداني قالا أخبرنا ابن وهب أخبرنا ابن لهيعة عن موسى بن جبير أن عبيد الله بن عباس حدثه عن خالد بن يزيد بن معاوية عن دحية بن خليفة الكلبي أنه قال أتي رسول الله صلى الله عليه وسلم بقباطي فأعطاني منها قبطية فقال اصدعها صدعين فاقطع أحدهما قميصا وأعط الآخر امرأتك تختمر به فلما أدبر قال وأمر امرأتك أن تجعل تحته ثوبا لا يصفها قال أبو داود رواه يحيى بن أيوب فقال عباس بن عبيد الله بن عباس 	 حدثنا أحمد بن عمرو بن السرح وأحمد بن سعيد الهمداني قالا أخبرنا ابن وهب أخبرنا ابن لهيعة عن موسى بن جبير أن عبيد الله بن عباس حدثه عن خالد بن يزيد بن معاوية عن دحية بن خليفة الكلبي أنه قال أتي رسول الله صلى الله عليه وسلم بقباطي فأعطاني منها قبطية فقال اصدعها صدعين فاقطع أحدهما قميصا وأعط الآخر امرأتك تختمر به فلما أدبر قال وأمر امرأتك أن تجعل تحته ثوبا لا يصفها قال أبو داود رواه يحيى بن أيوب فقال عباس بن عبيد الله بن عباس 	 Narrated Dihyah ibn Khalifah al-Kalbi: The Messenger of Allah (SL3M) was brought some pieces of fine Egyptian linen and he gave me one and said: Divide it into two; cut one of the pieces into a shirt and give the other to your wife for veil. Then when he turned away, he said: And order your wife to wear a garment below it and not show her figure. Abu Dawud said: Yahya b. Ayyub transmitted it and said: 'Abbas b. 'Ubaid Allah b. 'Abbas 
abudawud34_941200	 حدثنا عبد الله بن مسلمة عن مالك عن أبي بكر بن نافع عن أبيه عن	عن صفية بنت أبي عبيد أنها أخبرته أن أم سلمة زوج النبي صلى الله عليه وسلم قالت لرسول الله صلى الله عليه وسلم حين ذكر الإزار فالمرأة يا رسول الله قال ترخي شبرا قالت أم سلمة إذا ينكشف عنها قال فذراعا لا تزيد عليه 	 حدثنا عبد الله بن مسلمة عن مالك عن أبي بكر بن نافع عن أبيه عن صفية بنت أبي عبيد أنها أخبرته أن أم سلمة زوج النبي صلى الله عليه وسلم قالت لرسول الله صلى الله عليه وسلم حين ذكر الإزار فالمرأة يا رسول الله قال ترخي شبرا قالت أم سلمة إذا ينكشف عنها قال فذراعا لا تزيد عليه 	 Safiyyah, daughter of AbuUbayd, said: When the Messenger of Allah (SL3M) mentioned lower garment, Umm Salamah, wife of the Messenger of Allah (SL3M), asked him: And a woman, Messenger of Allah? He replied: She may hang down a span. Umm Salamah said: Still it (foot) will be uncovered. He said: Then a forearm's length, nor exceeding it. 
abudawud34_941210	 حدثنا إبراهيم بن موسى أخبرنا عيسى عن عبيد الله عن نافع عن سليمان بن يسار عن أم سلمة عن	عن النبي صلى الله عليه وسلم بهذا الحديث قال أبو داود رواه ابن إسحاق وأيوب بن موسى عن نافع عن صفية 	 حدثنا إبراهيم بن موسى أخبرنا عيسى عن عبيد الله عن نافع عن سليمان بن يسار عن أم سلمة عن النبي صلى الله عليه وسلم بهذا الحديث قال أبو داود رواه ابن إسحاق وأيوب بن موسى عن نافع عن صفية 	 The tradition mentioned above has also been transmitted by Umm Salamah from the Prophet (SL3M) through a different chain of narrators. Abu Dawud said: Ibn Ishaq and Ayyub b. Musa transmitted it from Nafi' from Safiyyah. 
abudawud34_941220	 حدثنا مسدد حدثنا يحيى بن سعيد عن سفيان أخبرني زيد العمي عن أبي الصديق الناجي عن	عن ابن عمر قال رخص رسول الله صلى الله عليه وسلم لأمهات المؤمنين في الذيل شبرا ثم استزدنه فزادهن شبرا فكن يرسلن إلينا فنذرع لهن ذراعا 	 حدثنا مسدد حدثنا يحيى بن سعيد عن سفيان أخبرني زيد العمي عن أبي الصديق الناجي عن ابن عمر قال رخص رسول الله صلى الله عليه وسلم لأمهات المؤمنين في الذيل شبرا ثم استزدنه فزادهن شبرا فكن يرسلن إلينا فنذرع لهن ذراعا 	 Narrated Abdullah ibn Umar: The Messenger of Allah (SL3M) gave licence to others of the believers (i.e. the wives of the Prophet) to hang down their lower garment a span. Then they asked him to increase it, and he increased one span for them. They would send (the garment) to us and we would measure it one forearm's length for them. 
abudawud34_941230	 حدثنا مسدد ووهب بن بيان وعثمان بن	حدثنا أبي شيبة وابن أبي خلف قالوا حدثنا سفيان عن الزهري عن عبيد الله بن عبد الله عن ابن عباس قال مسدد ووهب عن ميمونة قالت أهدي لمولاة لنا شاة من الصدقة فماتت فمر بها النبي صلى الله عليه وسلم فقال ألا دبغتم إهابها فاستمتعتم به قالوا يا رسول الله إنها ميتة قال إنما حرم أكلها 	 حدثنا مسدد ووهب بن بيان وعثمان بن أبي شيبة وابن أبي خلف قالوا حدثنا سفيان عن الزهري عن عبيد الله بن عبد الله عن ابن عباس قال مسدد ووهب عن ميمونة قالت أهدي لمولاة لنا شاة من الصدقة فماتت فمر بها النبي صلى الله عليه وسلم فقال ألا دبغتم إهابها فاستمتعتم به قالوا يا رسول الله إنها ميتة قال إنما حرم أكلها 	 Ibn 'Abbas said - (Musaddad and Wahb transmitted from Maimunah) Maimunah said: A sheep was given in alms to a female client of ours, but it died. The Prophet (SL3M) passed it and said: Why did you not tan its skin and get some good out of it ? They replied: Messenger of Allah, it died a natural death. He said: It is only the eating of it that is prohibited. 
abudawud34_941240	 حدثنا مسدد حدثنا يزيد حدثنا معمر عن	حدثنا الزهري بهذا الحديث لم يذكر ميمونة قال فقال ألا انتفعتم بإهابها ثم ذكر معناه لم يذكر الدباغ 	 حدثنا مسدد حدثنا يزيد حدثنا معمر عن الزهري بهذا الحديث لم يذكر ميمونة قال فقال ألا انتفعتم بإهابها ثم ذكر معناه لم يذكر الدباغ 	 The tradition mentioned above has also been transmitted by al-Zuhri who did not mention Maimunah. This version has: He said: Why did you not make use of it ? He then mentioned the rest of the tradition to the same effect but did not mention tanning. 
abudawud34_941250	 حدثنا محمد بن يحيى بن فارس حدثنا	حدثنا عبد الرزاق قال قال معمر وكان الزهري ينكر الدباغ ويقول يستمتع به على كل حال قال أبو داود لم يذكر الأوزاعي ويونس وعقيل في حديث الزهري الدباغ وذكره الزبيدي وسعيد بن عبد العزيز وحفص بن الوليد ذكروا الدباغ 	 حدثنا محمد بن يحيى بن فارس حدثنا عبد الرزاق قال قال معمر وكان الزهري ينكر الدباغ ويقول يستمتع به على كل حال قال أبو داود لم يذكر الأوزاعي ويونس وعقيل في حديث الزهري الدباغ وذكره الزبيدي وسعيد بن عبد العزيز وحفص بن الوليد ذكروا الدباغ 	 Ma'mar said: Al-Zuhri used to deny tanning and say: Some good can be got out of it in any condition Abu Dawud said: Al-Auza'i, Yunus and 'Uqail did not mention tanning. al-Zubaidi, Sa'id b. 'Abd al-Aziz and Hafs b. 'Abd al-'Aziz mentioned tanning. 
abudawud34_941260	 حدثنا محمد بن كثير أخبرنا سفيان عن زيد بن	حدثنا أسلم عن عبد الرحمن بن وعلة عن ابن عباس قال سمعت رسول الله صلى الله عليه وسلم يقول إذا دبغ الإهاب فقد طهر 	 حدثنا محمد بن كثير أخبرنا سفيان عن زيد بن أسلم عن عبد الرحمن بن وعلة عن ابن عباس قال سمعت رسول الله صلى الله عليه وسلم يقول إذا دبغ الإهاب فقد طهر 	 Narrated Ibn 'Abbas: That he heard the Messenger of Allah (SL3M) say: When a skin is tanned, it is pure. 
abudawud34_941270	 حدثنا عبد الله بن مسلمة عن مالك عن يزيد بن	حدثنا عبد الله بن قسيط عن محمد بن عبد الرحمن بن ثوبان عن أمه عن عائشة زوج النبي صلى الله عليه وسلم أن رسول الله صلى الله عليه وسلم أمر أن يستمتع بجلود الميتة إذا دبغت 	 حدثنا عبد الله بن مسلمة عن مالك عن يزيد بن عبد الله بن قسيط عن محمد بن عبد الرحمن بن ثوبان عن أمه عن عائشة زوج النبي صلى الله عليه وسلم أن رسول الله صلى الله عليه وسلم أمر أن يستمتع بجلود الميتة إذا دبغت 	 Narrated Aisha, Ummul Mu'minin: The Prophet (SL3M) ordered that the skins of the animals which had died a natural death should be used when they are tanned. 
abudawud34_941280	 حدثنا حفص بن عمر وموسى بن إسماعيل قالا حدثنا همام عن قتادة عن الحسن عن جون بن	حدثنا قتادة عن سلمة بن المحبق أن رسول الله صلى الله عليه وسلم في غزوة تبوك أتى على بيت فإذا قربة معلقة فسأل الماء فقالوا يا رسول الله إنها ميتة فقال دباغها طهورها 	 حدثنا حفص بن عمر وموسى بن إسماعيل قالا حدثنا همام عن قتادة عن الحسن عن جون بن قتادة عن سلمة بن المحبق أن رسول الله صلى الله عليه وسلم في غزوة تبوك أتى على بيت فإذا قربة معلقة فسأل الماء فقالوا يا رسول الله إنها ميتة فقال دباغها طهورها 	 Narrated Salamah ibn al-Muhabbaq: On the expedition of Tabuk the Messenger of Allah (SL3M) came to a household and, seeing a bucket hanging, asked for water. They said: Messenger of Allah, the animal died a natural death. He replied; Its tanning is its purification. 
abudawud34_941290	 حدثنا أحمد بن صالح حدثنا ابن وهب أخبرني عمرو يعني ابن الحارث عن كثير بن فرقد عن عبد الله بن مالك بن	عن حذافة حدثه عن أمه العالية بنت سبيع أنها قالت كان لي غنم بأحد فوقع فيها الموت فدخلت على ميمونة زوج النبي صلى الله عليه وسلم فذكرت ذلك لها فقالت لي ميمونة لو أخذت جلودها فانتفعت بها فقالت أويحل ذلك قالت نعم مر على رسول الله صلى الله عليه وسلم رجال من قريش يجرون شاة لهم مثل الحمار فقال لهم رسول الله صلى الله عليه وسلم لو أخذتم إهابها قالوا إنها ميتة فقال رسول الله صلى الله عليه وسلم يطهرها الماء والقرظ 	 حدثنا أحمد بن صالح حدثنا ابن وهب أخبرني عمرو يعني ابن الحارث عن كثير بن فرقد عن عبد الله بن مالك بن حذافة حدثه عن أمه العالية بنت سبيع أنها قالت كان لي غنم بأحد فوقع فيها الموت فدخلت على ميمونة زوج النبي صلى الله عليه وسلم فذكرت ذلك لها فقالت لي ميمونة لو أخذت جلودها فانتفعت بها فقالت أويحل ذلك قالت نعم مر على رسول الله صلى الله عليه وسلم رجال من قريش يجرون شاة لهم مثل الحمار فقال لهم رسول الله صلى الله عليه وسلم لو أخذتم إهابها قالوا إنها ميتة فقال رسول الله صلى الله عليه وسلم يطهرها الماء والقرظ 	 Al-Aliyah, daughter of Subay', said: I had some sheep at Uhud, and they began to die. I then entered upon Maymunah, wife of the Prophet (SL3M), and mentioned it to her. Maymunah said to me: If you took their skins and made use of them, (that would be better for you). She asked: Is that lawful? She replied, Yes. Some people of the Quraysh passed by the Messenger of Allah (SL3M) dragging a sheep of theirs as big as an ass. The Messenger of Allah (SL3M) said to them: Would that you took its skin. They said: It died a natural death. The Messenger of Allah (SL3M) said: Water and leaves of the mimosa flava purify it. 
abudawud34_941300	 حدثنا حفص بن عمر حدثنا شعبة عن الحكم عن عبد الرحمن بن أبي ليلى عن عبد الله بن	عن عكيم قال قرئ علينا كتاب رسول الله صلى الله عليه وسلم بأرض جهينة وأنا غلام شاب أن لا تستمتعوا من الميتة بإهاب ولا عصب 	 حدثنا حفص بن عمر حدثنا شعبة عن الحكم عن عبد الرحمن بن أبي ليلى عن عبد الله بن عكيم قال قرئ علينا كتاب رسول الله صلى الله عليه وسلم بأرض جهينة وأنا غلام شاب أن لا تستمتعوا من الميتة بإهاب ولا عصب 	 Narrated Abdullah ibn Ukaym: The letter of the Messenger of Allah (SL3M) was read out to us in the territory of Juhaynah when I was a young boy: Do not make use of the skin or sinew of an animal which died a natural death. 
abudawud34_941310	 حدثنا محمد بن إسماعيل مولى بني هاشم حدثنا الثقفي عن خالد عن الحكم بن	عن عتيبة أنه انطلق هو وناس معه إلى عبد الله بن عكيم رجل من جهينة قال الحكم فدخلوا وقعدت على الباب فخرجوا إلى فأخبروني أن عبد الله بن عكيم أخبرهم أن رسول الله صلى الله عليه وسلم كتب إلى جهينة قبل موته بشهر أن لا ينتفعوا من الميتة بإهاب ولا عصب قال أبو داود فإذا دبغ لا يقال له إهاب إنما يسمى شنا وقربة قال النضر بن شميل يسمى إهابا ما لم يدبغ 	 حدثنا محمد بن إسماعيل مولى بني هاشم حدثنا الثقفي عن خالد عن الحكم بن عتيبة أنه انطلق هو وناس معه إلى عبد الله بن عكيم رجل من جهينة قال الحكم فدخلوا وقعدت على الباب فخرجوا إلى فأخبروني أن عبد الله بن عكيم أخبرهم أن رسول الله صلى الله عليه وسلم كتب إلى جهينة قبل موته بشهر أن لا ينتفعوا من الميتة بإهاب ولا عصب قال أبو داود فإذا دبغ لا يقال له إهاب إنما يسمى شنا وقربة قال النضر بن شميل يسمى إهابا ما لم يدبغ 	 Al-Hakam ibn Uyaynah said that he went along with some people to Abdullah ibn Ukaym, a man of Juhaynah. al-Hakam said: They entered and I sat at the door. Then they came out and told me that Abdullah ibn Ukaym had informed them that the Messenger of Allah (SL3M) had written to Juhaynah one month before his death: Do not make use of the skin or sinew of an animal which died a natural death. Abu Dawud said: Al-Nadr b. Shumail said: The skin is called ihab when it is not tanned and when it is tanned, it not called ihab but na,es shann and qirbah (tanned skin or leather). 
abudawud34_941320	 حدثنا هناد بن السري عن وكيع عن أبي المعتمر عن ابن سيرين عن	عن معاوية قال قال رسول الله صلى الله عليه وسلم لا تركبوا الخز ولا النمار قال وكان معاوية لا يتهم في الحديث عن رسول الله صلى الله عليه وسلم قال لنا أبو سعيد قال لنا أبو داود أبو المعتمر اسمه يزيد بن طهمان كان ينزل الحيرة 	 حدثنا هناد بن السري عن وكيع عن أبي المعتمر عن ابن سيرين عن معاوية قال قال رسول الله صلى الله عليه وسلم لا تركبوا الخز ولا النمار قال وكان معاوية لا يتهم في الحديث عن رسول الله صلى الله عليه وسلم قال لنا أبو سعيد قال لنا أبو داود أبو المعتمر اسمه يزيد بن طهمان كان ينزل الحيرة 	 Narrated Mu'awiyah: The Prophet (SL3M) said: Do not ride on silk stuff and panther skins. AbuSa'id said to us: AbuDawud said to us: The name of AbulMu'tamir is Yazid ibn Tahman. He lived in al-Hirah. 
abudawud34_941330	 حدثنا محمد بن بشار حدثنا أبو داود حدثنا عمران عن قتادة عن زرارة عن أبي هريرة عن	عن النبي صلى الله عليه وسلم قال لا تصحب الملائكة رفقة فيها جلد نمر 	 حدثنا محمد بن بشار حدثنا أبو داود حدثنا عمران عن قتادة عن زرارة عن أبي هريرة عن النبي صلى الله عليه وسلم قال لا تصحب الملائكة رفقة فيها جلد نمر 	 Narrated Abu Hurairah: The Prophet (SL3M) as saying: The angels do not accompany those fellow travellers who have panther skin. 
abudawud34_941340	 حدثنا عمرو بن عثمان بن سعيد الحمصي حدثنا بقية عن بحير عن خالد قال وفد المقدام بن	عن معديكرب وعمرو بن الأسود ورجل من بني أسد من أهل قنسرين إلى معاوية بن أبي سفيان فقال معاوية للمقدام أعلمت أن الحسن بن علي توفي فرجع المقدام فقال له رجل أتراها مصيبة قال له ولم لا أراها مصيبة وقد وضعه رسول الله صلى الله عليه وسلم في حجره فقال هذا مني وحسين من علي فقال الأسدي جمرة أطفأها الله عز وجل قال فقال المقدام أما أنا فلا أبرح اليوم حتى أغيظك وأسمعك ما تكره ثم قال يا معاوية إن أنا صدقت فصدقني وإن أنا كذبت فكذبني قال أفعل قال فأنشدك بالله هل تعلم أن رسول الله صلى الله عليه وسلم نهى عن لبس الذهب قال نعم قال فأنشدك بالله هل سمعت رسول الله صلى الله عليه وسلم ينهى عن لبس الحرير قال نعم قال فأنشدك بالله هل تعلم أن رسول الله صلى الله عليه وسلم نهى عن لبس جلود السباع والركوب عليها قال نعم قال فوالله لقد رأيت هذا كله في بيتك يا معاوية فقال معاوية قد علمت أني لن أنجو منك يا مقدام قال خالد فأمر له معاوية بما لم يأمر لصاحبيه وفرض لابنه في المائتين ففرقها المقدام في أصحابه قال ولم يعط الأسدي أحدا شيئا مما أخذ فبلغ ذلك معاوية فقال أما المقدام فرجل كريم بسط يده وأما الأسدي فرجل حسن الإمساك لشيئه 	 حدثنا عمرو بن عثمان بن سعيد الحمصي حدثنا بقية عن بحير عن خالد قال وفد المقدام بن معديكرب وعمرو بن الأسود ورجل من بني أسد من أهل قنسرين إلى معاوية بن أبي سفيان فقال معاوية للمقدام أعلمت أن الحسن بن علي توفي فرجع المقدام فقال له رجل أتراها مصيبة قال له ولم لا أراها مصيبة وقد وضعه رسول الله صلى الله عليه وسلم في حجره فقال هذا مني وحسين من علي فقال الأسدي جمرة أطفأها الله عز وجل قال فقال المقدام أما أنا فلا أبرح اليوم حتى أغيظك وأسمعك ما تكره ثم قال يا معاوية إن أنا صدقت فصدقني وإن أنا كذبت فكذبني قال أفعل قال فأنشدك بالله هل تعلم أن رسول الله صلى الله عليه وسلم نهى عن لبس الذهب قال نعم قال فأنشدك بالله هل سمعت رسول الله صلى الله عليه وسلم ينهى عن لبس الحرير قال نعم قال فأنشدك بالله هل تعلم أن رسول الله صلى الله عليه وسلم نهى عن لبس جلود السباع والركوب عليها قال نعم قال فوالله لقد رأيت هذا كله في بيتك يا معاوية فقال معاوية قد علمت أني لن أنجو منك يا مقدام قال خالد فأمر له معاوية بما لم يأمر لصاحبيه وفرض لابنه في المائتين ففرقها المقدام في أصحابه قال ولم يعط الأسدي أحدا شيئا مما أخذ فبلغ ذلك معاوية فقال أما المقدام فرجل كريم بسط يده وأما الأسدي فرجل حسن الإمساك لشيئه 	" Khalid said: Al-Miqdam ibn Ma'dikarib and a man of Banu Asad from the people of Qinnisrin went to Mu'awiyah ibn AbuSufyan. Mu'awiyah said to al-Miqdam: Do you know that al-Hasan ibn Ali has died? Al-Miqdam recited the Qur'anic verse ""We belong to Allah and to Him we shall return."" A man asked him: Do you think it a calamity? He replied: Why should I not consider it a calamity when it is a fact that the Messenger of Allah (SL3M) used to take him on his lap, saying: This belongs to me and Husayn belongs to Ali? The man of Banu Asad said: (He was) a live coal which Allah has extinguished. Al-Miqdam said: Today I shall continue to make you angry and make you hear what you dislike. He then said: Mu'awiyah, if I speak the truth, declare me true, and if I tell a lie, declare me false. He said: Do so. He said: I adjure you by Allah, did you hear the Messenger of Allah (SL3M) forbidding use to wear gold? He replied: Yes. He said: I adjure you by Allah, do you know that the Messenger of Allah (SL3M) prohibited the wearing of silk? He replied: Yes. He said: I adjure you by Allah, do you know that the Messenger of Allah (SL3M) prohibited the wearing of the skins of beasts of prey and riding on them? He said: Yes. He said: I swear by Allah, I saw all this in your house, O Mu'awiyah. Mu'awiyah said: I know that I cannot be saved from you, O Miqdam. Khalid said: Mu'awiyah then ordered to give him what he did not order to give to his two companions, and gave a stipend of two hundred (dirhams) to his son. Al-Miqdam then divided it among his companions, and the man of Banu Asad did not give anything to anyone from the property he received. When Mu'awiyah was informed about it, he said: Al-Miqdam is a generous man; he has an open hand (for generosity). The man of Banu Asad withholds his things in a good manner. "
