abudawud24_935240	 حدثنا سليمان بن داود حدثنا عبد الله يعني ابن وهب أخبرني يونس عن ابن شهاب قال أخبرني أبو بكر بن	عن عبد الرحمن بن الحارث بن هشام أن رسول الله صلى الله عليه وسلم فذكر معنى حديث مالك زاد وإن قضى من ثمنها شيئا فهو أسوة الغرماء فيها 	 حدثنا سليمان بن داود حدثنا عبد الله يعني ابن وهب أخبرني يونس عن ابن شهاب قال أخبرني أبو بكر بن عبد الرحمن بن الحارث بن هشام أن رسول الله صلى الله عليه وسلم فذكر معنى حديث مالك زاد وإن قضى من ثمنها شيئا فهو أسوة الغرماء فيها 	" The tradition mentioned above has also been transmitted by Abu Bakr b. 'Adb al-Rahman b. al-Harith b. Hisham from Messenger of Allah (SL3M) through a different chain of narrators to the same effect as narrated by Malik. This version adds: ""If he paid something from the price (of the property), then he will be equal to the creditors in it."" "
abudawud24_935250	 حدثنا محمد بن عوف الطائي حدثنا عبد الله بن	حدثنا عبد الجبار يعني الخبائري حدثنا إسماعيل يعني ابن عياش عن الزبيدي قال أبو داود وهو محمد بن الوليد أبو الهذيل الحمصي عن الزهري عن أبي بكر بن عبد الرحمن عن أبي هريرة عن النبي صلى الله عليه وسلم نحوه قال فإن كان قضاه من ثمنها شيئا فما بقي فهو أسوة الغرماء وأيما امرئ هلك وعنده متاع امرئ بعينه اقتضى منه شيئا أو لم يقتض فهو أسوة الغرماء قال أبو داود حديث مالك أصح 	 حدثنا محمد بن عوف الطائي حدثنا عبد الله بن عبد الجبار يعني الخبائري حدثنا إسماعيل يعني ابن عياش عن الزبيدي قال أبو داود وهو محمد بن الوليد أبو الهذيل الحمصي عن الزهري عن أبي بكر بن عبد الرحمن عن أبي هريرة عن النبي صلى الله عليه وسلم نحوه قال فإن كان قضاه من ثمنها شيئا فما بقي فهو أسوة الغرماء وأيما امرئ هلك وعنده متاع امرئ بعينه اقتضى منه شيئا أو لم يقتض فهو أسوة الغرماء قال أبو داود حديث مالك أصح 	 A similar tradition (to the No. 3513) has been transmitted by AbuHurayrah from the Prophet (SL3M). This version has: If he paid something from its price, then he will be equal to the creditors in the remaining price. If a man dies and he has the very property of a man (i.e. seller), he is equal to the creditors whether he (the buyer) pays him (the price) or not. Abu Dawud said: Malik's version of this tradition is sounder. 
abudawud24_935260	 حدثنا محمد بن بشار حدثنا أبو داود هو الطيالسي حدثنا ابن أبي ذئب عن أبي المعتمر عن عمر بن	حدثنا خلدة قال أتينا أبا هريرة في صاحب لنا أفلس فقال لأقضين فيكم بقضاء رسول الله صلى الله عليه وسلم من أفلس أو مات فوجد رجل متاعه بعينه فهو أحق به 	 حدثنا محمد بن بشار حدثنا أبو داود هو الطيالسي حدثنا ابن أبي ذئب عن أبي المعتمر عن عمر بن خلدة قال أتينا أبا هريرة في صاحب لنا أفلس فقال لأقضين فيكم بقضاء رسول الله صلى الله عليه وسلم من أفلس أو مات فوجد رجل متاعه بعينه فهو أحق به 	 Umar ibn Khaldah said: We came to AbuHurayrah who had become insolvent. He said: I shall decide between you on the basis of the decision of the Messenger of Allah (SL3M): If anyone becomes insolvent or dies and the man (the seller) finds his very property with him, he is more entitled to it (than others). 
abudawud24_935270	 حدثنا موسى بن إسماعيل حدثنا حماد ح وحدثنا موسى حدثنا أبان عن عبيد الله بن حميد بن	حدثنا عبد الرحمن الحميري عن الشعبي قال عن أبان أن عامرا الشعبي حدثه أن رسول الله صلى الله عليه وسلم قال من وجد دابة قد عجز عنها أهلها أن يعلفوها فسيبوها فأخذها فأحياها فهي له قال في حديث أبان قال عبيد الله فقلت عمن قال عن غير واحد من أصحاب النبي صلى الله عليه وسلم قال أبو داود وهذا حديث حماد وهو أبين وأتم 	 حدثنا موسى بن إسماعيل حدثنا حماد ح وحدثنا موسى حدثنا أبان عن عبيد الله بن حميد بن عبد الرحمن الحميري عن الشعبي قال عن أبان أن عامرا الشعبي حدثه أن رسول الله صلى الله عليه وسلم قال من وجد دابة قد عجز عنها أهلها أن يعلفوها فسيبوها فأخذها فأحياها فهي له قال في حديث أبان قال عبيد الله فقلت عمن قال عن غير واحد من أصحاب النبي صلى الله عليه وسلم قال أبو داود وهذا حديث حماد وهو أبين وأتم 	 Narrated Amir ash-Sha'bi: The Prophet (SL3M) said: If anyone finds an animal whose owners were helpless to provide fodder to it and so they turned it out (of their house), and he took it and looked after it, it will belong to him. Abu Dawud said: This is the tradition of Hammad. It is more plain and perfect. 
abudawud24_935280	 حدثنا محمد بن عبيد عن حماد يعني ابن زيد عن خالد الحذاء عن عبيد الله بن حميد بن	عن عبد الرحمن عن الشعبي يرفع الحديث إلى النبي صلى الله عليه وسلم أنه قال من ترك دابة بمهلك فأحياها رجل فهي لمن أحياها 	 حدثنا محمد بن عبيد عن حماد يعني ابن زيد عن خالد الحذاء عن عبيد الله بن حميد بن عبد الرحمن عن الشعبي يرفع الحديث إلى النبي صلى الله عليه وسلم أنه قال من ترك دابة بمهلك فأحياها رجل فهي لمن أحياها 	 Narrated ash-Sha'bi: The Prophet (SL3M) said: If anyone leaves an animal at a place of perishing and another man brings it to life, it belongs to him who brings it to life. 
abudawud24_935290	 حدثنا هناد عن ابن المبارك عن زكرياء عن الشعبي عن أبي هريرة عن	عن النبي صلى الله عليه وسلم قال لبن الدر يحلب بنفقته إذا كان مرهونا والظهر يركب بنفقته إذا كان مرهونا وعلى الذي يركب ويحلب النفقة قال أبو داود وهو عندنا صحيح 	 حدثنا هناد عن ابن المبارك عن زكرياء عن الشعبي عن أبي هريرة عن النبي صلى الله عليه وسلم قال لبن الدر يحلب بنفقته إذا كان مرهونا والظهر يركب بنفقته إذا كان مرهونا وعلى الذي يركب ويحلب النفقة قال أبو داود وهو عندنا صحيح 	 Narrated Abu Hurairah: The Prophet (SL3M) as saying: The milk of milch camels may be drunk for payment when in pledge, and the animal may be ridden for payment when it is pledge; payment being made by the one who rides and the one who drinks. Abu Dawud said: In our opinion this is correct. 
abudawud24_935300	 حدثنا زهير بن حرب وعثمان بن أبي شيبة قالا حدثنا جرير عن عمارة بن القعقاع عن أبي زرعة بن	حدثنا عمرو بن جرير أن عمر بن الخطاب قال قال النبي صلى الله عليه وسلم إن من عباد الله لأناسا ما هم بأنبياء ولا شهداء يغبطهم الأنبياء والشهداء يوم القيامة بمكانهم من الله تعالى قالوا يا رسول الله تخبرنا من هم قال هم قوم تحابوا بروح الله على غير أرحام بينهم ولا أموال يتعاطونها فوالله إن وجوههم لنور وإنهم على نور لا يخافون إذا خاف الناس ولا يحزنون إذا حزن الناس وقرأ هذه الآية { ألا إن أولياء الله لا خوف عليهم ولا هم يحزنون } 	 حدثنا زهير بن حرب وعثمان بن أبي شيبة قالا حدثنا جرير عن عمارة بن القعقاع عن أبي زرعة بن عمرو بن جرير أن عمر بن الخطاب قال قال النبي صلى الله عليه وسلم إن من عباد الله لأناسا ما هم بأنبياء ولا شهداء يغبطهم الأنبياء والشهداء يوم القيامة بمكانهم من الله تعالى قالوا يا رسول الله تخبرنا من هم قال هم قوم تحابوا بروح الله على غير أرحام بينهم ولا أموال يتعاطونها فوالله إن وجوههم لنور وإنهم على نور لا يخافون إذا خاف الناس ولا يحزنون إذا حزن الناس وقرأ هذه الآية { ألا إن أولياء الله لا خوف عليهم ولا هم يحزنون } 	" Narrated Umar ibn al-Khattab: reported the Prophet (SL3M) as saying: There are people from the servants of Allah who are neither prophets nor martyrs; the prophets and martyrs will envy them on the Day of Resurrection for their rank from Allah, the Most High. They (the people) asked: Tell us, Messenger of Allah, who are they? He replied: They are people who love one another for the spirit of Allah (i.e. the Qur'an), without having any mutual kinship and giving property to one. I swear by Allah, their faces will glow and they will be (sitting) in (pulpits of) light. They will have no fear (on the Day) when the people will have fear, and they will not grieve when the people will grieve. He then recited the following Qur'anic verse: ""Behold! Verily for the friends of Allah there is no fear, nor shall they grieve."" "
abudawud24_935310	 حدثنا محمد بن كثير أخبرنا سفيان عن منصور عن إبراهيم عن عمارة بن عمير عن	عن عمته أنها سألت عائشة رضى الله عنها في حجري يتيم أفآكل من ماله فقالت قال رسول الله صلى الله عليه وسلم إن من أطيب ما أكل الرجل من كسبه وولده من كسبه 	 حدثنا محمد بن كثير أخبرنا سفيان عن منصور عن إبراهيم عن عمارة بن عمير عن عمته أنها سألت عائشة رضى الله عنها في حجري يتيم أفآكل من ماله فقالت قال رسول الله صلى الله عليه وسلم إن من أطيب ما أكل الرجل من كسبه وولده من كسبه 	 Narrated Aisha, Ummul Mu'minin: The aunt of Umarah ibn Umayr asked Aisha: I have an orphan in my guardianship. May I enjoy from his property? She said: The Messenger of Allah (SL3M) said: The pleasantest things a man enjoys come from what he earns, and his child comes from what he earns. 
abudawud24_935320	 حدثنا عبيد الله بن عمر بن ميسرة وعثمان بن	حدثنا أبي شيبة المعنى قالا حدثنا محمد بن جعفر عن شعبة عن الحكم عن عمارة بن عمير عن أمه عن عائشة عن النبي صلى الله عليه وسلم أنه قال ولد الرجل من كسبه من أطيب كسبه فكلوا من أموالهم قال أبو داود حماد بن أبي سليمان زاد فيه إذا احتجتم وهو منكر 	 حدثنا عبيد الله بن عمر بن ميسرة وعثمان بن أبي شيبة المعنى قالا حدثنا محمد بن جعفر عن شعبة عن الحكم عن عمارة بن عمير عن أمه عن عائشة عن النبي صلى الله عليه وسلم أنه قال ولد الرجل من كسبه من أطيب كسبه فكلوا من أموالهم قال أبو داود حماد بن أبي سليمان زاد فيه إذا احتجتم وهو منكر 	" Narrated Aisha, Ummul Mu'minin: The Prophet (SL3M) Said: The children of a man come from what he earns, rather they are his pleasantest earning; so enjoy from their property. Abu Dawud said: Hammad b. Abi Sulaiman added in his version: ""When you need."" But this (addition) is munkar (not authoritative). "
abudawud24_935330	 حدثنا محمد بن المنهال حدثنا يزيد بن زريع حدثنا حبيب المعلم عن عمرو بن شعيب عن أبيه عن	حدثنا جده أن رجلا أتى النبي صلى الله عليه وسلم فقال يا رسول الله إن لي مالا وولدا وإن والدي يجتاح مالي قال أنت ومالك لوالدك إن أولادكم من أطيب كسبكم فكلوا من كسب أولادكم 	 حدثنا محمد بن المنهال حدثنا يزيد بن زريع حدثنا حبيب المعلم عن عمرو بن شعيب عن أبيه عن جده أن رجلا أتى النبي صلى الله عليه وسلم فقال يا رسول الله إن لي مالا وولدا وإن والدي يجتاح مالي قال أنت ومالك لوالدك إن أولادكم من أطيب كسبكم فكلوا من كسب أولادكم 	 Narrated Abdullah ibn Amr ibn al-'As: A man came to the Prophet (SL3M) and said: Messenger of Allah, I have property and children, and my father finishes my property. He replied; You and your property belong to your father; your children come from the pleasantest of what you earn; so enjoy from the earning of your children. 
abudawud24_935340	 حدثنا عمرو بن عون حدثنا هشيم عن موسى بن	حدثنا السائب عن قتادة عن الحسن عن سمرة بن جندب قال قال رسول الله صلى الله عليه وسلم من وجد عين ماله عند رجل فهو أحق به ويتبع البيع من باعه 	 حدثنا عمرو بن عون حدثنا هشيم عن موسى بن السائب عن قتادة عن الحسن عن سمرة بن جندب قال قال رسول الله صلى الله عليه وسلم من وجد عين ماله عند رجل فهو أحق به ويتبع البيع من باعه 	 Narrated Samurah ibn Jundub: The Prophet (SL3M) said: If anyone finds his very property with a man, he is more entitled to it (than anyone else), and the buyer should pursue the one who sold it. 
abudawud24_935350	 حدثنا أحمد بن يونس حدثنا زهير حدثنا هشام بن	حدثنا عروة عن عروة عن عائشة أن هندا أم معاوية جاءت رسول الله صلى الله عليه وسلم فقالت إن أبا سفيان رجل شحيح وإنه لا يعطيني ما يكفيني وبني فهل على جناح أن آخذ من ماله شيئا قال خذي ما يكفيك وبنيك بالمعروف 	 حدثنا أحمد بن يونس حدثنا زهير حدثنا هشام بن عروة عن عروة عن عائشة أن هندا أم معاوية جاءت رسول الله صلى الله عليه وسلم فقالت إن أبا سفيان رجل شحيح وإنه لا يعطيني ما يكفيني وبني فهل على جناح أن آخذ من ماله شيئا قال خذي ما يكفيك وبنيك بالمعروف 	 Narrated 'Aishah: Hind, the mother of Mu'awiyah, came to the Messenger of Allah (SL3M) and said: 'Abu Sufyan is a stingy person. He does not give me as much (money) as suffices me and my children. Is there any harm to me if I take something from his property ? He said: Take as much as suffices you and your children according to the custom. 
abudawud24_935360	 حدثنا خشيش بن أصرم حدثنا عبد الرزاق حدثنا معمر عن الزهري عن عروة عن	عن عائشة قالت جاءت هند إلى النبي صلى الله عليه وسلم فقالت يا رسول الله إن أبا سفيان رجل ممسك فهل على من حرج أن أنفق على عياله من ماله بغير إذنه فقال النبي صلى الله عليه وسلم لا حرج عليك أن تنفقي عليهم بالمعروف 	 حدثنا خشيش بن أصرم حدثنا عبد الرزاق حدثنا معمر عن الزهري عن عروة عن عائشة قالت جاءت هند إلى النبي صلى الله عليه وسلم فقالت يا رسول الله إن أبا سفيان رجل ممسك فهل على من حرج أن أنفق على عياله من ماله بغير إذنه فقال النبي صلى الله عليه وسلم لا حرج عليك أن تنفقي عليهم بالمعروف 	 Narrated 'Aishah: Hind came to the Prophet (SL3M) and said: Messenger of Allah, Abu Sufyan is a stingy person. Is there any harm to me if I spend on his dependants from his property without his permission ? The Prophet (SL3M) replied: There is no harm to you if you spend according to the custom. 
abudawud24_935370	 حدثنا أبو كامل أن يزيد بن زريع حدثهم حدثنا حميد يعني الطويل عن يوسف بن	حدثنا ماهك المكي قال كنت أكتب لفلان نفقة أيتام كان وليهم فغالطوه بألف درهم فأداها إليهم فأدركت لهم من مالهم مثليها قال قلت أقبض الألف الذي ذهبوا به منك قال لا حدثني أبي أنه سمع رسول الله صلى الله عليه وسلم يقول أد الأمانة إلى من ائتمنك ولا تخن من خانك 	 حدثنا أبو كامل أن يزيد بن زريع حدثهم حدثنا حميد يعني الطويل عن يوسف بن ماهك المكي قال كنت أكتب لفلان نفقة أيتام كان وليهم فغالطوه بألف درهم فأداها إليهم فأدركت لهم من مالهم مثليها قال قلت أقبض الألف الذي ذهبوا به منك قال لا حدثني أبي أنه سمع رسول الله صلى الله عليه وسلم يقول أد الأمانة إلى من ائتمنك ولا تخن من خانك 	 Narrated Yusuf ibn Malik al-Makki: I used to write (the account of) the expenditure incurred on orphans who were under the guardianship of so-and-so. They cheated him by one thousand dirhams and he paid these (this amount) to them. I then got double the property which they deserved. I said (to the man: Take one thousand (dirhams) which they have taken from you (by cheating). He said: No, my father has told me that he heard the Messenger of Allah (SL3M) say: Pay the deposit to him who deposited it with you, and do not betray him who betrays you. 
abudawud24_935380	 حدثنا محمد بن العلاء وأحمد بن إبراهيم قالا حدثنا طلق بن غنام عن شريك قال ابن العلاء وقيس عن أبي حصين عن أبي صالح عن	عن أبي هريرة قال قال رسول الله صلى الله عليه وسلم أد الأمانة إلى من ائتمنك ولا تخن من خانك 	 حدثنا محمد بن العلاء وأحمد بن إبراهيم قالا حدثنا طلق بن غنام عن شريك قال ابن العلاء وقيس عن أبي حصين عن أبي صالح عن أبي هريرة قال قال رسول الله صلى الله عليه وسلم أد الأمانة إلى من ائتمنك ولا تخن من خانك 	 Narrated AbuHurayrah: The Prophet (SL3M) said: Pay the deposit to him who deposited it with you, and do not betray him who betrayed you. 
abudawud24_935390	 حدثنا علي بن بحر وعبد الرحيم بن	حدثنا مطرف الرؤاسي قالا حدثنا عيسى وهو ابن يونس بن أبي إسحاق السبيعي عن هشام بن عروة عن أبيه عن عائشة رضى الله عنها أن النبي صلى الله عليه وسلم كان يقبل الهدية ويثيب عليها 	 حدثنا علي بن بحر وعبد الرحيم بن مطرف الرؤاسي قالا حدثنا عيسى وهو ابن يونس بن أبي إسحاق السبيعي عن هشام بن عروة عن أبيه عن عائشة رضى الله عنها أن النبي صلى الله عليه وسلم كان يقبل الهدية ويثيب عليها 	 Narrated 'Aishah: That the Prophet (SL3M) used to accept a gift and make return for it. 
abudawud24_935400	 حدثنا محمد بن عمرو الرازي حدثنا سلمة يعني ابن الفضل حدثني محمد بن إسحاق عن سعيد بن أبي سعيد المقبري عن أبيه عن	عن أبي هريرة قال قال رسول الله صلى الله عليه وسلم وايم الله لا أقبل بعد يومي هذا من أحد هدية إلا أن يكون مهاجرا قرشيا أو أنصاريا أو دوسيا أو ثقفيا 	 حدثنا محمد بن عمرو الرازي حدثنا سلمة يعني ابن الفضل حدثني محمد بن إسحاق عن سعيد بن أبي سعيد المقبري عن أبيه عن أبي هريرة قال قال رسول الله صلى الله عليه وسلم وايم الله لا أقبل بعد يومي هذا من أحد هدية إلا أن يكون مهاجرا قرشيا أو أنصاريا أو دوسيا أو ثقفيا 	 Narrated AbuHurayrah: The Prophet (SL3M) said: I swear by Allah, I shall not accept gift from anyone after this day except from an immigrant Qarashi, an Ansari a Dawsi or a Thaqafi. 
abudawud24_935410	 حدثنا مسلم بن إبراهيم حدثنا أبان وهمام وشعبة قالوا حدثنا قتادة عن سعيد بن المسيب عن ابن عباس عن	حدثنا النبي صلى الله عليه وسلم قال العائد في هبته كالعائد في قيئه قال همام وقال قتادة ولا نعلم القىء إلا حراما 	 حدثنا مسلم بن إبراهيم حدثنا أبان وهمام وشعبة قالوا حدثنا قتادة عن سعيد بن المسيب عن ابن عباس عن النبي صلى الله عليه وسلم قال العائد في هبته كالعائد في قيئه قال همام وقال قتادة ولا نعلم القىء إلا حراما 	" Narrated Ibn 'Abbas: The Prophet (SL3M) as saying: One who seeks to take back a gift like the one who returns to it vomit. Hammam said: ""And Qatadah said: We regard vomiting as unlawful."" "
abudawud24_935420	 حدثنا مسدد حدثنا يزيد يعني ابن زريع حدثنا حسين المعلم عن عمرو بن شعيب عن طاوس عن ابن عمر وابن عباس عن	عن النبي صلى الله عليه وسلم قال لا يحل لرجل أن يعطي عطية أو يهب هبة فيرجع فيها إلا الوالد فيما يعطي ولده ومثل الذي يعطي العطية ثم يرجع فيها كمثل الكلب يأكل فإذا شبع قاء ثم عاد في قيئه 	 حدثنا مسدد حدثنا يزيد يعني ابن زريع حدثنا حسين المعلم عن عمرو بن شعيب عن طاوس عن ابن عمر وابن عباس عن النبي صلى الله عليه وسلم قال لا يحل لرجل أن يعطي عطية أو يهب هبة فيرجع فيها إلا الوالد فيما يعطي ولده ومثل الذي يعطي العطية ثم يرجع فيها كمثل الكلب يأكل فإذا شبع قاء ثم عاد في قيئه 	 Narrated Abdullah Ibn Umar ; Abdullah Ibn Abbas: The Prophet (SL3M) said: It is not lawful for a man to make a donation or give a gift and then take it back, except a father regarding what he gives his child. One who gives a gift and then takes it back is like a dog which eats and vomits when it is full, then returns to its vomit. 
abudawud24_935430	 حدثنا سليمان بن داود المهري أخبرنا ابن وهب أخبرني أسامة بن زيد أن عمرو بن	أخبرنا شعيب حدثه عن أبيه عن عبد الله بن عمرو عن رسول الله صلى الله عليه وسلم قال مثل الذي يسترد ما وهب كمثل الكلب يقيء فيأكل قيئه فإذا استرد الواهب فليوقف فليعرف بما استرد ثم ليدفع إليه ما وهب 	 حدثنا سليمان بن داود المهري أخبرنا ابن وهب أخبرني أسامة بن زيد أن عمرو بن شعيب حدثه عن أبيه عن عبد الله بن عمرو عن رسول الله صلى الله عليه وسلم قال مثل الذي يسترد ما وهب كمثل الكلب يقيء فيأكل قيئه فإذا استرد الواهب فليوقف فليعرف بما استرد ثم ليدفع إليه ما وهب 	 Narrated Abdullah ibn Amr ibn al-'As: The Prophet (SL3M) said: The similitude of the one who takes back what he gifted is like that of a dog which vomits and then it eats vomit. When a donor seeks to take back (his gift), it should be made known and he informed why he sought to take it back. Then whatever he donated should be returned to him. 
