abudawud11_917240	 حدثنا زهير بن حرب وعثمان بن	حدثنا أبي شيبة المعنى قالا حدثنا يزيد بن هارون عن سفيان بن حسين عن الزهري عن أبي سنان عن ابن عباس أن الأقرع بن حابس سأل النبي صلى الله عليه وسلم فقال يا رسول الله الحج في كل سنة أو مرة واحدة قال بل مرة واحدة فمن زاد فهو تطوع قال أبو داود هو أبو سنان الدؤلي كذا قال عبد الجليل بن حميد وسليمان بن كثير جميعا عن الزهري وقال عقيل عن سنان 	 حدثنا زهير بن حرب وعثمان بن أبي شيبة المعنى قالا حدثنا يزيد بن هارون عن سفيان بن حسين عن الزهري عن أبي سنان عن ابن عباس أن الأقرع بن حابس سأل النبي صلى الله عليه وسلم فقال يا رسول الله الحج في كل سنة أو مرة واحدة قال بل مرة واحدة فمن زاد فهو تطوع قال أبو داود هو أبو سنان الدؤلي كذا قال عبد الجليل بن حميد وسليمان بن كثير جميعا عن الزهري وقال عقيل عن سنان 	" Narrated Aqra' ibn Habib: Ibn Abbas said: Aqra' ibn Habis asked the Prophet (SL3M) saying: Messenger of Allah hajj is to be performed annually or only once? He replied: Only once, and if anyone performs it more often, he performs a supererogatory act. Abu Dawud said: The narrator Abu Sinan is Abu Sinan al-Du'wail. The same has been reported by both 'Abd al-Jalil bin Humaid and Sulaiman bin Kathir from al-Zuhri. The narrator 'Uqail reported the name ""Sinan"". "
abudawud11_917250	 حدثنا النفيلي حدثنا عبد العزيز بن محمد عن زيد بن	حدثنا أسلم عن ابن لأبي واقد الليثي عن أبيه قال سمعت رسول الله صلى الله عليه وسلم يقول لأزواجه في حجة الوداع هذه ثم ظهور الحصر 	 حدثنا النفيلي حدثنا عبد العزيز بن محمد عن زيد بن أسلم عن ابن لأبي واقد الليثي عن أبيه قال سمعت رسول الله صلى الله عليه وسلم يقول لأزواجه في حجة الوداع هذه ثم ظهور الحصر 	 Narrated Abu Waqid al-Laythi: I heard the Messenger of Allah (SL3M) saying to his wives during the Farewell Pilgrimage: This (is the pilgrimage for you); afterwards stick to the surface of the mats (i.e. should stay at home). 
abudawud11_917260	 حدثنا قتيبة بن سعيد الثقفي حدثنا الليث بن سعد عن سعيد بن أبي سعيد عن	عن أبيه أن أبا هريرة قال قال رسول الله صلى الله عليه وسلم لا يحل لامرأة مسلمة تسافر مسيرة ليلة إلا ومعها رجل ذو حرمة منها 	 حدثنا قتيبة بن سعيد الثقفي حدثنا الليث بن سعد عن سعيد بن أبي سعيد عن أبيه أن أبا هريرة قال قال رسول الله صلى الله عليه وسلم لا يحل لامرأة مسلمة تسافر مسيرة ليلة إلا ومعها رجل ذو حرمة منها 	 Abu Huraira reported : The Messenger of Allah (SWAS) as saying : A muslim woman must not make a journey of a night unless she is accompanied by a man who is within the prohibited degrees. 
abudawud11_917270	 حدثنا عبد الله بن مسلمة والنفيلي عن مالك ح وحدثنا الحسن بن علي حدثنا بشر بن	عن عمر حدثني مالك عن سعيد بن أبي سعيد قال الحسن في حديثه عن أبيه ثم اتفقوا عن أبي هريرة عن النبي صلى الله عليه وسلم قال لا يحل لامرأة تؤمن بالله واليوم الآخر أن تسافر يوما وليلة فذكر معناه قال أبو داود ولم يذكر القعنبي والنفيلي عن أبيه رواه ابن وهب وعثمان بن عمر عن مالك كما قال القعنبي 	 حدثنا عبد الله بن مسلمة والنفيلي عن مالك ح وحدثنا الحسن بن علي حدثنا بشر بن عمر حدثني مالك عن سعيد بن أبي سعيد قال الحسن في حديثه عن أبيه ثم اتفقوا عن أبي هريرة عن النبي صلى الله عليه وسلم قال لا يحل لامرأة تؤمن بالله واليوم الآخر أن تسافر يوما وليلة فذكر معناه قال أبو داود ولم يذكر القعنبي والنفيلي عن أبيه رواه ابن وهب وعثمان بن عمر عن مالك كما قال القعنبي 	 Abu Hurairah reported the Prophet (SWAS) as saying : A woman who believes in Allah and the last Day must not make a journey of a day and a night. He then narrated the rest of the tradition to the same effect (as above). The narrator al-Nufaili said : Malik narrated us. Abu Dawud said : The narrators al-Nufail and al_Qa’nabi did not mention the words “from his father”. Ibn Wahb and ‘Uthman bin ‘Umr narrated from Malik the same words as narrated by al-Qa’nabi (i.e. omitted the words “from his father”). 
abudawud11_917280	 حدثنا يوسف بن موسى عن جرير عن سهيل عن سعيد بن أبي سعيد عن	عن أبي هريرة قال قال رسول الله صلى الله عليه وسلم فذكر نحوه إلا أنه قال بريدا 	 حدثنا يوسف بن موسى عن جرير عن سهيل عن سعيد بن أبي سعيد عن أبي هريرة قال قال رسول الله صلى الله عليه وسلم فذكر نحوه إلا أنه قال بريدا 	 Abu Hurairah reported the Messenger of Allah (SWAS) as saying : He then reported the same tradition as mentioned above but he mentioned (in this version) the word “mail post”. 
abudawud11_917290	 حدثنا عثمان بن	حدثنا أبي شيبة وهناد أن أبا معاوية ووكيعا حدثاهم عن الأعمش عن أبي صالح عن أبي سعيد قال قال رسول الله صلى الله عليه وسلم لا يحل لامرأة تؤمن بالله واليوم الآخر أن تسافر سفرا فوق ثلاثة أيام فصاعدا إلا ومعها أبوها أو أخوها أو زوجها أو ابنها أو ذو محرم منها 	 حدثنا عثمان بن أبي شيبة وهناد أن أبا معاوية ووكيعا حدثاهم عن الأعمش عن أبي صالح عن أبي سعيد قال قال رسول الله صلى الله عليه وسلم لا يحل لامرأة تؤمن بالله واليوم الآخر أن تسافر سفرا فوق ثلاثة أيام فصاعدا إلا ومعها أبوها أو أخوها أو زوجها أو ابنها أو ذو محرم منها 	 Abu Sa’id reported The Apostel of Allah (SWAS) as saying: A woman who believes in Allah and the Last Day must not make a journey of more than three days unless she is accompanied by her father or her brother, or her husband or her son or her relative who is within the prohibited degree. 
abudawud11_917300	 حدثنا أحمد بن حنبل حدثنا يحيى بن سعيد عن عبيد الله قال حدثني نافع عن ابن عمر عن	عن النبي صلى الله عليه وسلم قال لا تسافر المرأة ثلاثا إلا ومعها ذو محرم 	 حدثنا أحمد بن حنبل حدثنا يحيى بن سعيد عن عبيد الله قال حدثني نافع عن ابن عمر عن النبي صلى الله عليه وسلم قال لا تسافر المرأة ثلاثا إلا ومعها ذو محرم 	 Ibn `Umr reported the Prophet (SWAS) as saying : A woman must not make a journey of three days unless she is accompanied by a man who is within the prohibited degree. 
abudawud11_917310	 حدثنا نصر بن علي حدثنا أبو أحمد حدثنا سفيان عن عبيد الله عن	عن نافع أن ابن عمر كان يردف مولاة له يقال لها صفية تسافر معه إلى مكة 	 حدثنا نصر بن علي حدثنا أبو أحمد حدثنا سفيان عن عبيد الله عن نافع أن ابن عمر كان يردف مولاة له يقال لها صفية تسافر معه إلى مكة 	 Nafi` said : Ibn `Umr used to seat his slave girl called Safiyyah behind him(on the Camel) and thus she travelled to Makkah in his company. 
abudawud11_917320	 حدثنا عثمان بن أبي شيبة حدثنا أبو خالد يعني سليمان بن حيان الأحمر عن ابن جريج عن عمر بن عطاء عن عكرمة عن	عن ابن عباس قال قال رسول الله صلى الله عليه وسلم لا صرورة في الإسلام 	 حدثنا عثمان بن أبي شيبة حدثنا أبو خالد يعني سليمان بن حيان الأحمر عن ابن جريج عن عمر بن عطاء عن عكرمة عن ابن عباس قال قال رسول الله صلى الله عليه وسلم لا صرورة في الإسلام 	 Narrated Abdullah ibn Abbas: The Prophet (SL3M) said: Islam does not allow for failure to perform the hajj. 
abudawud11_917330	 حدثنا أحمد بن الفرات يعني أبا مسعود الرازي ومحمد بن	حدثنا عبد الله المخرمي وهذا لفظه قالا حدثنا شبابة عن ورقاء عن عمرو بن دينار عن عكرمة عن ابن عباس قال كانوا يحجون ولا يتزودون قال أبو مسعود كان أهل اليمن أو ناس من أهل اليمن يحجون ولا يتزودون ويقولون نحن المتوكلون فأنزل الله سبحانه { وتزودوا فإن خير الزاد التقوى } الآية 	 حدثنا أحمد بن الفرات يعني أبا مسعود الرازي ومحمد بن عبد الله المخرمي وهذا لفظه قالا حدثنا شبابة عن ورقاء عن عمرو بن دينار عن عكرمة عن ابن عباس قال كانوا يحجون ولا يتزودون قال أبو مسعود كان أهل اليمن أو ناس من أهل اليمن يحجون ولا يتزودون ويقولون نحن المتوكلون فأنزل الله سبحانه { وتزودوا فإن خير الزاد التقوى } الآية 	 Ibn `Abbas said : People used to perform Hajj and not bring provisions with them. Abu Mas’ud said the inhabitants of Yemen or people of Yemen used to perform Hajj and not bring provisions with them. They would declare we put our trust in Allah. So Allah most high sent down “ and bring provisions, but the best provision is piety”. 
abudawud11_917340	 حدثنا يوسف بن موسى حدثنا جرير عن يزيد بن	حدثنا أبي زياد عن مجاهد عن عبد الله بن عباس قال قرأ هذه الآية { ليس عليكم جناح أن تبتغوا فضلا من ربكم } قال كانوا لا يتجرون بمنى فأمروا بالتجارة إذا أفاضوا من عرفات 	 حدثنا يوسف بن موسى حدثنا جرير عن يزيد بن أبي زياد عن مجاهد عن عبد الله بن عباس قال قرأ هذه الآية { ليس عليكم جناح أن تبتغوا فضلا من ربكم } قال كانوا لا يتجرون بمنى فأمروا بالتجارة إذا أفاضوا من عرفات 	 Narrated Abdullah ibn Abbas: Ibn Abbas recited this verse: 'It is no sin for you that you seek the bounty of your Lord', and said: The people would not trade in Mina (during the hajj), so they were commanded to trade when they proceeded from Arafat. 
abudawud11_917350	 حدثنا مسدد حدثنا أبو معاوية محمد بن خازم عن الأعمش عن الحسن بن عمرو عن مهران أبي صفوان عن	عن ابن عباس قال قال رسول الله صلى الله عليه وسلم من أراد الحج فليتعجل 	 حدثنا مسدد حدثنا أبو معاوية محمد بن خازم عن الأعمش عن الحسن بن عمرو عن مهران أبي صفوان عن ابن عباس قال قال رسول الله صلى الله عليه وسلم من أراد الحج فليتعجل 	 Narrated Abdullah ibn Abbas: The Prophet (SL3M) said: He who intends to perform hajj should hasten to do so. 
abudawud11_917360	 حدثنا مسدد حدثنا عبد الواحد بن زياد حدثنا العلاء بن	حدثنا المسيب حدثنا أبو أمامة التيمي قال كنت رجلا أكري في هذا الوجه وكان ناس يقولون لي إنه ليس لك حج فلقيت ابن عمر فقلت يا أبا عبد الرحمن إني رجل أكري في هذا الوجه وإن ناسا يقولون لي إنه ليس لك حج فقال ابن عمر أليس تحرم وتلبي وتطوف بالبيت وتفيض من عرفات وترمي الجمار قال قلت بلى قال فإن لك حجا جاء رجل إلى النبي صلى الله عليه وسلم فسأله عن مثل ما سألتني عنه فسكت عنه رسول الله صلى الله عليه وسلم فلم يجبه حتى نزلت هذه الآية { ليس عليكم جناح أن تبتغوا فضلا من ربكم } فأرسل إليه رسول الله صلى الله عليه وسلم وقرأ عليه هذه الآية وقال لك حج 	 حدثنا مسدد حدثنا عبد الواحد بن زياد حدثنا العلاء بن المسيب حدثنا أبو أمامة التيمي قال كنت رجلا أكري في هذا الوجه وكان ناس يقولون لي إنه ليس لك حج فلقيت ابن عمر فقلت يا أبا عبد الرحمن إني رجل أكري في هذا الوجه وإن ناسا يقولون لي إنه ليس لك حج فقال ابن عمر أليس تحرم وتلبي وتطوف بالبيت وتفيض من عرفات وترمي الجمار قال قلت بلى قال فإن لك حجا جاء رجل إلى النبي صلى الله عليه وسلم فسأله عن مثل ما سألتني عنه فسكت عنه رسول الله صلى الله عليه وسلم فلم يجبه حتى نزلت هذه الآية { ليس عليكم جناح أن تبتغوا فضلا من ربكم } فأرسل إليه رسول الله صلى الله عليه وسلم وقرأ عليه هذه الآية وقال لك حج 	" AbuUmamah at-Taymi said: I was a man who used to give (riding-beasts) on hire for this purpose (for travelling during the pilgrimage) and the people would tell (me): Your hajj is not valid. So I met Ibn Umar and told him: AbuAbdurRahman, I am a man who gives (riding-beast) on hire for this purpose (i.e. for hajj), and the people tell me: Your hajj is not valid. Ibn Umar replied: Do you not put on ihram (the pilgrim dress), call the talbiyah (labbayk), circumambulate the Ka'bah, return from Arafat and lapidate jamrahs? I said: Why not? Then he said: Your hajj is valid. a man came to the Prophet (SL3M) and asked him the same question you have asked me. The Messenger of Allah (SL3M) kept silence and did not answer him till this verse came down: ""It is no sin for you that you seek the bounty of your Lord."" The Messenger of Allah (SL3M) sent for him and recited this verse to him and said: Your hajj is valid. "
abudawud11_917370	 حدثنا محمد بن بشار حدثنا حماد بن مسعدة حدثنا ابن أبي ذئب عن عطاء بن أبي رباح عن عبيد بن عمير عن عبد الله بن	عن عباس أن الناس في أول الحج كانوا يتبايعون بمنى وعرفة وسوق ذي المجاز ومواسم الحج فخافوا البيع وهم حرم فأنزل الله سبحانه { ليس عليكم جناح أن تبتغوا فضلا من ربكم } في مواسم الحج قال فحدثني عبيد بن عمير أنه كان يقرأها في المصحف 	 حدثنا محمد بن بشار حدثنا حماد بن مسعدة حدثنا ابن أبي ذئب عن عطاء بن أبي رباح عن عبيد بن عمير عن عبد الله بن عباس أن الناس في أول الحج كانوا يتبايعون بمنى وعرفة وسوق ذي المجاز ومواسم الحج فخافوا البيع وهم حرم فأنزل الله سبحانه { ليس عليكم جناح أن تبتغوا فضلا من ربكم } في مواسم الحج قال فحدثني عبيد بن عمير أنه كان يقرأها في المصحف 	" Narrated Abdullah ibn Abbas: The people used to trade, in the beginning, at Mina, Arafat, the market place of Dhul-Majaz, and during the season of hajj. But (later on) they became afraid of trading while they were putting on ihram. So Allah, glory be to Him, sent down this verse: ""It is no sin for you that you seek the bounty of your Lord during the seasons of hajj."" Ubayd ibn Umayr told me that he (Ibn Abbas) used to recite this verse in his codex. "
abudawud11_917380	 حدثنا أحمد بن صالح حدثنا ابن أبي فديك أخبرني ابن أبي ذئب عن عبيد بن عمير قال أحمد بن	عن صالح كلاما معناه أنه مولى ابن عباس عن عبد الله بن عباس أن الناس في أول ما كان الحج كانوا يبيعون فذكر معناه إلى قوله مواسم الحج 	 حدثنا أحمد بن صالح حدثنا ابن أبي فديك أخبرني ابن أبي ذئب عن عبيد بن عمير قال أحمد بن صالح كلاما معناه أنه مولى ابن عباس عن عبد الله بن عباس أن الناس في أول ما كان الحج كانوا يبيعون فذكر معناه إلى قوله مواسم الحج 	 `Abd Allah bin `Abbas said : In the beginning when Hajj was prescribed, people used to trade during Hajj. The narrator then narrated the rest of the tradition upto the words, `season of Hajj’. 
abudawud11_917390	 حدثنا أحمد بن حنبل حدثنا سفيان بن عيينة عن إبراهيم بن عقبة عن كريب عن	عن ابن عباس قال كان رسول الله صلى الله عليه وسلم بالروحاء فلقي ركبا فسلم عليهم فقال من القوم فقالوا المسلمون فقالوا فمن أنتم قالوا رسول الله صلى الله عليه وسلم ففزعت امرأة فأخذت بعضد صبي فأخرجته من محفتها فقالت يا رسول الله هل لهذا حج قال نعم ولك أجر 	 حدثنا أحمد بن حنبل حدثنا سفيان بن عيينة عن إبراهيم بن عقبة عن كريب عن ابن عباس قال كان رسول الله صلى الله عليه وسلم بالروحاء فلقي ركبا فسلم عليهم فقال من القوم فقالوا المسلمون فقالوا فمن أنتم قالوا رسول الله صلى الله عليه وسلم ففزعت امرأة فأخذت بعضد صبي فأخرجته من محفتها فقالت يا رسول الله هل لهذا حج قال نعم ولك أجر 	 Ibn `Abbas said the Messenger of Allah (SWAS) was at al-Rawha. There he met some riders. He saluted them and asked who they were. They replied that they were Muslims. They asked who are you. They (the companions) replied he is the Messenger of Allah (SWAS). A woman became upset : she took her child by his arm and lifted him from her litter at the camel. She said Messenger of Allah (SWAS) can this (child) be credited with having performed Hajj. He replied Yes, and you will have a reward. 
abudawud11_917400	 حدثنا القعنبي عن مالك ح وحدثنا أحمد بن يونس حدثنا مالك عن نافع عن	حدثنا ابن عمر قال وقت رسول الله صلى الله عليه وسلم لأهل المدينة ذا الحليفة ولأهل الشام الجحفة ولأهل نجد قرنا وبلغني أنه وقت لأهل اليمن يلملم 	 حدثنا القعنبي عن مالك ح وحدثنا أحمد بن يونس حدثنا مالك عن نافع عن ابن عمر قال وقت رسول الله صلى الله عليه وسلم لأهل المدينة ذا الحليفة ولأهل الشام الجحفة ولأهل نجد قرنا وبلغني أنه وقت لأهل اليمن يلملم 	 Ibn Umar said : The Messenger of Allah (SWAS) appointed the following places for putting on Ihram : Dhul al-Hulaifah for the people of Madina, al-Juhfah for the people of Syria and al-Qarn for the people of Najd and have been told that appointed Yalamlam for the people of Yemen. 
abudawud11_917410	 حدثنا سليمان بن حرب حدثنا حماد عن عمرو بن	حدثنا دينار عن طاوس عن ابن عباس وعن ابن طاوس عن أبيه قالا وقت رسول الله صلى الله عليه وسلم بمعناه قال أحدهما ولأهل اليمن يلملم وقال أحدهما ألملم قال فهن لهم ولمن أتى عليهن من غير أهلهن ممن كان يريد الحج والعمرة ومن كان دون ذلك قال ابن طاوس من حيث أنشأ قال وكذلك حتى أهل مكة يهلون منها 	 حدثنا سليمان بن حرب حدثنا حماد عن عمرو بن دينار عن طاوس عن ابن عباس وعن ابن طاوس عن أبيه قالا وقت رسول الله صلى الله عليه وسلم بمعناه قال أحدهما ولأهل اليمن يلملم وقال أحدهما ألملم قال فهن لهم ولمن أتى عليهن من غير أهلهن ممن كان يريد الحج والعمرة ومن كان دون ذلك قال ابن طاوس من حيث أنشأ قال وكذلك حتى أهل مكة يهلون منها 	 Ibn `Abbas and Tawus reported : The Messenger of Allah (SWAS) appointed places for putting on Ihram and narrated the rest of the tradition to the same effect (as mentioned above). One of them said and Yalamlam for the people of Yemen. The other narrator said Alamlam. These (places for Ihram) are appointed for these regions and for people of other regions who come to them intending to perform Hajj and `Umrah. The place where those who live nearer to Makkah should put on Ihram from where they start and so on up to the inhabitants of Makkah itself who put on Ihram in it. This is the version of Ibn Tawus. 
abudawud11_917420	 حدثنا هشام بن بهرام المدائني حدثنا المعافى بن عمران عن أفلح يعني ابن حميد عن القاسم بن محمد عن	عن عائشة رضى الله عنها أن رسول الله صلى الله عليه وسلم وقت لأهل العراق ذات عرق 	 حدثنا هشام بن بهرام المدائني حدثنا المعافى بن عمران عن أفلح يعني ابن حميد عن القاسم بن محمد عن عائشة رضى الله عنها أن رسول الله صلى الله عليه وسلم وقت لأهل العراق ذات عرق 	 Narrated Aisha, Ummul Mu'minin: The Messenger of Allah (SL3M) appointed Dhat Irq as the place for putting on ihram for the people of Iraq. 
abudawud11_917430	 حدثنا أحمد بن محمد بن حنبل حدثنا وكيع حدثنا سفيان عن يزيد بن أبي زياد عن محمد بن	حدثنا علي بن عبد الله بن عباس عن ابن عباس قال وقت رسول الله صلى الله عليه وسلم لأهل المشرق العقيق 	 حدثنا أحمد بن محمد بن حنبل حدثنا وكيع حدثنا سفيان عن يزيد بن أبي زياد عن محمد بن علي بن عبد الله بن عباس عن ابن عباس قال وقت رسول الله صلى الله عليه وسلم لأهل المشرق العقيق 	 Narrated Abdullah ibn Abbas: The Messenger of Allah (SL3M) appointed al-Aqiq as the place for putting on ihram for the people of East. 
