abudawud29_938990	 حدثنا مسدد حدثنا يحيى عن زكريا قال حدثني عامر عن خارجة بن الصلت التميمي عن	عن عمه أنه أتى رسول الله صلى الله عليه وسلم فأسلم ثم أقبل راجعا من عنده فمر على قوم عندهم رجل مجنون موثق بالحديد فقال أهله إنا حدثنا أن صاحبكم هذا قد جاء بخير فهل عندك شىء تداويه فرقيته بفاتحة الكتاب فبرأ فأعطوني مائة شاة فأتيت رسول الله صلى الله عليه وسلم فأخبرته فقال هل إلا هذا وقال مسدد في موضع آخر هل قلت غير هذا قلت لا قال خذها فلعمري لمن أكل برقية باطل لقد أكلت برقية حق 	 حدثنا مسدد حدثنا يحيى عن زكريا قال حدثني عامر عن خارجة بن الصلت التميمي عن عمه أنه أتى رسول الله صلى الله عليه وسلم فأسلم ثم أقبل راجعا من عنده فمر على قوم عندهم رجل مجنون موثق بالحديد فقال أهله إنا حدثنا أن صاحبكم هذا قد جاء بخير فهل عندك شىء تداويه فرقيته بفاتحة الكتاب فبرأ فأعطوني مائة شاة فأتيت رسول الله صلى الله عليه وسلم فأخبرته فقال هل إلا هذا وقال مسدد في موضع آخر هل قلت غير هذا قلت لا قال خذها فلعمري لمن أكل برقية باطل لقد أكلت برقية حق 	 Narrated Alaqah ibn Sahar at-Tamimi: Alaqah came to the Messenger of Allah (SL3M) and embraced Islam. He then came back from him and passed some people who had a lunatic fettered in chains. His people said: We are told that your companion has brought some good. Have you something with which you can cure him? I then recited Surat al-Fatihah and he was cured. They gave me one hundred sheep. I then came to the Messenger of Allah (SL3M) and informed him of it. He asked: Is it only this? The narrator, Musaddad, said in his other version: Did you say anything other than this? I said: No. He said: Take it, for by my life, some accept if for a worthless chain, but you have done so for a genuine one. 
abudawud29_939000	 حدثنا عبيد الله بن معاذ حدثنا أبي ح وحدثنا ابن بشار حدثنا ابن جعفر حدثنا شعبة عن عبد الله بن أبي السفر عن الشعبي عن خارجة بن الصلت عن	عن عمه أنه مر قال فرقاه بفاتحة الكتاب ثلاثة أيام غدوة وعشية كلما ختمها جمع بزاقه ثم تفل فكأنما أنشط من عقال فأعطوه شيئا فأتى النبي صلى الله عليه وسلم ثم ذكر معنى حديث مسدد 	 حدثنا عبيد الله بن معاذ حدثنا أبي ح وحدثنا ابن بشار حدثنا ابن جعفر حدثنا شعبة عن عبد الله بن أبي السفر عن الشعبي عن خارجة بن الصلت عن عمه أنه مر قال فرقاه بفاتحة الكتاب ثلاثة أيام غدوة وعشية كلما ختمها جمع بزاقه ثم تفل فكأنما أنشط من عقال فأعطوه شيئا فأتى النبي صلى الله عليه وسلم ثم ذكر معنى حديث مسدد 	 Kharijah b. al-Salt quoted his parental uncle as saying that he passed (some people) : He recited Surat al-Fatihah over him for three days morning and evening. Whenever he finished it, he collected some of his saliva and spat it out, and he seemed as if he were set free from a bond. They gave him something as payment. He then came to the Prophet (SL3M). He then transmitted the rest of the tradition to the same effect as Musaddad narrated. 
abudawud29_939010	 حدثنا أحمد بن يونس حدثنا زهير حدثنا سهيل بن	حدثنا أبي صالح عن أبيه قال سمعت رجلا من أسلم قال كنت جالسا عند رسول الله صلى الله عليه وسلم فجاء رجل من أصحابه فقال يا رسول الله لدغت الليلة فلم أنم حتى أصبحت قال ماذا قال عقرب قال أما إنك لو قلت حين أمسيت أعوذ بكلمات الله التامات من شر ما خلق لم تضرك إن شاء الله 	 حدثنا أحمد بن يونس حدثنا زهير حدثنا سهيل بن أبي صالح عن أبيه قال سمعت رجلا من أسلم قال كنت جالسا عند رسول الله صلى الله عليه وسلم فجاء رجل من أصحابه فقال يا رسول الله لدغت الليلة فلم أنم حتى أصبحت قال ماذا قال عقرب قال أما إنك لو قلت حين أمسيت أعوذ بكلمات الله التامات من شر ما خلق لم تضرك إن شاء الله 	" Narrated AbuSalih Zakwan as-Samman: A man from Aslam tribe said: I was sitting with the Messenger of Allah (SL3M). A man from among his Companions came and said: Messenger of Allah! I have been stung last night, and I could not sleep till morning. He asked: What was that? He replied: A scorpion. He said: Oh, had you said in the evening: ""I take refuge in the perfect words of Allah from the evil of what He created,"" nothing would have harmed you, Allah willing. "
abudawud29_939020	 حدثنا حيوة بن شريح حدثنا بقية حدثني الزبيدي عن الزهري عن طارق يعني ابن مخاشن عن	عن أبي هريرة قال أتي النبي صلى الله عليه وسلم بلديغ لدغته عقرب قال فقال لو قال أعوذ بكلمات الله التامة من شر ما خلق لم يلدغ أو لم تضره 	 حدثنا حيوة بن شريح حدثنا بقية حدثني الزبيدي عن الزهري عن طارق يعني ابن مخاشن عن أبي هريرة قال أتي النبي صلى الله عليه وسلم بلديغ لدغته عقرب قال فقال لو قال أعوذ بكلمات الله التامة من شر ما خلق لم يلدغ أو لم تضره 	" Narrated AbuHurayrah: A man who was stung by a scorpion was brought to the Prophet (SL3M). He said: Had he said the word: ""I seek refuge in the perfect words of Allah from the evil of what He created, ""he would not have been stung, or he said, ""It would not have harmed him."" "
abudawud29_939030	 حدثنا مسدد حدثنا أبو عوانة عن أبي بشر عن أبي المتوكل عن	عن أبي سعيد الخدري أن رهطا من أصحاب النبي صلى الله عليه وسلم انطلقوا في سفرة سافروها فنزلوا بحى من أحياء العرب فقال بعضهم إن سيدنا لدغ فهل عند أحد منكم شىء ينفع صاحبنا فقال رجل من القوم نعم والله إني لأرقي ولكن استضفناكم فأبيتم أن تضيفونا ما أنا براق حتى تجعلوا لي جعلا فجعلوا له قطيعا من الشاء فأتاه فقرأ عليه أم الكتاب ويتفل حتى برأ كأنما أنشط من عقال قال فأوفاهم جعلهم الذي صالحوهم عليه فقالوا اقتسموا فقال الذي رقى لا تفعلوا حتى نأتي رسول الله صلى الله عليه وسلم فنستأمره فغدوا على رسول الله صلى الله عليه وسلم فذكروا له فقال رسول الله صلى الله عليه وسلم من أين علمتم أنها رقية أحسنتم اقتسموا واضربوا لي معكم بسهم 	 حدثنا مسدد حدثنا أبو عوانة عن أبي بشر عن أبي المتوكل عن أبي سعيد الخدري أن رهطا من أصحاب النبي صلى الله عليه وسلم انطلقوا في سفرة سافروها فنزلوا بحى من أحياء العرب فقال بعضهم إن سيدنا لدغ فهل عند أحد منكم شىء ينفع صاحبنا فقال رجل من القوم نعم والله إني لأرقي ولكن استضفناكم فأبيتم أن تضيفونا ما أنا براق حتى تجعلوا لي جعلا فجعلوا له قطيعا من الشاء فأتاه فقرأ عليه أم الكتاب ويتفل حتى برأ كأنما أنشط من عقال قال فأوفاهم جعلهم الذي صالحوهم عليه فقالوا اقتسموا فقال الذي رقى لا تفعلوا حتى نأتي رسول الله صلى الله عليه وسلم فنستأمره فغدوا على رسول الله صلى الله عليه وسلم فذكروا له فقال رسول الله صلى الله عليه وسلم من أين علمتم أنها رقية أحسنتم اقتسموا واضربوا لي معكم بسهم 	 Abu Sa’d al-KHudri said : Some of the Companions of the Prophet (SL3M) went on a journey. They alighted with a certain clan of the Arabs. Someone of them said : Our chief has been stung by a scorpion or bitten by a snake. Has any of you something which gives relief to our chief? A man of the people said : Yes, I swear by Allah. I shall apply charm ; but we asked you for hospitality and you denied it to us. I shall not apply charm until you give me some payment. So they promised to give some sheep to him. He came to him and recited Surat al-Fatihah over him and spat till he was cured, and ha seemed as if he were set free from a bond. So they gave him the payment that was agreed between them. They said : Apportion them. The man who applied charm said : Do not do it until we approach the Apostle of allah (SL3M) said: From where did you learn that it was a charm ? you have done right. Apportion them, and give me a share along with you. 
abudawud29_939040	 حدثنا عبيد الله بن معاذ حدثنا أبي ح وحدثنا ابن بشار حدثنا محمد بن	حدثنا جعفر قال حدثنا شعبة عن عبد الله بن أبي السفر عن الشعبي عن خارجة بن الصلت التميمي عن عمه قال أقبلنا من عند رسول الله صلى الله عليه وسلم فأتينا على حى من العرب فقالوا إنا أنبئنا أنكم جئتم من عند هذا الرجل بخير فهل عندكم من دواء أو رقية فإن عندنا معتوها في القيود قال فقلنا نعم قال فجاءوا بمعتوه في القيود قال فقرأت عليه فاتحة الكتاب ثلاثة أيام غدوة وعشية كلما ختمتها أجمع بزاقي ثم أتفل فكأنما نشط من عقال قال فأعطوني جعلا فقلت لا حتى أسأل رسول الله صلى الله عليه وسلم فقال كل فلعمري من أكل برقية باطل لقد أكلت برقية حق 	 حدثنا عبيد الله بن معاذ حدثنا أبي ح وحدثنا ابن بشار حدثنا محمد بن جعفر قال حدثنا شعبة عن عبد الله بن أبي السفر عن الشعبي عن خارجة بن الصلت التميمي عن عمه قال أقبلنا من عند رسول الله صلى الله عليه وسلم فأتينا على حى من العرب فقالوا إنا أنبئنا أنكم جئتم من عند هذا الرجل بخير فهل عندكم من دواء أو رقية فإن عندنا معتوها في القيود قال فقلنا نعم قال فجاءوا بمعتوه في القيود قال فقرأت عليه فاتحة الكتاب ثلاثة أيام غدوة وعشية كلما ختمتها أجمع بزاقي ثم أتفل فكأنما نشط من عقال قال فأعطوني جعلا فقلت لا حتى أسأل رسول الله صلى الله عليه وسلم فقال كل فلعمري من أكل برقية باطل لقد أكلت برقية حق 	 Narrated Alaqah ibn Sahar at-Tamimi: We proceeded from the Messenger of Allah (SL3M) and came to a clan of the Arabs. They said: We have been told that you have brought what is good from this man. Have you any medicine or a charm, for we have a lunatic in chains? We said: Yes. Then they brought a lunatic in chains. He said: I recited Surat al-Fatihah over him for three days, morning and evening. Whenever I finished it, I would collect my saliva and spit it out, and he seemed as if he were set free from a bond. He said: They gave me some payment, but I said: No, not until I ask the Messenger of Allah (SL3M). He (the Prophet) said: Accept it, for, by my life, some accept it for a worthless charm, but you have done so for a genuine one. 
abudawud29_939050	 حدثنا القعنبي عن مالك عن ابن شهاب عن عروة عن	حدثنا عائشة زوج النبي صلى الله عليه وسلم أن رسول الله صلى الله عليه وسلم كان إذا اشتكى يقرأ في نفسه بالمعوذات وينفث فلما اشتد وجعه كنت أقرأ عليه وأمسح عليه بيده رجاء بركتها 	 حدثنا القعنبي عن مالك عن ابن شهاب عن عروة عن عائشة زوج النبي صلى الله عليه وسلم أن رسول الله صلى الله عليه وسلم كان إذا اشتكى يقرأ في نفسه بالمعوذات وينفث فلما اشتد وجعه كنت أقرأ عليه وأمسح عليه بيده رجاء بركتها 	 Narrated A'ishah: the wife of Prophet (SL3M) said: When the Messenger of Allah (SL3M) suffered from some pain, he recited mu'awwadhat in his heart and blew (them over him). When the pain became severe, I recited (them) over him and wiped him with his hand in the hope of its blessing. 
abudawud29_939060	 حدثنا محمد بن يحيى بن فارس حدثنا نوح بن	حدثنا يزيد بن سيار حدثنا إبراهيم بن سعد عن محمد بن إسحاق عن هشام بن عروة عن أبيه عن عائشة رضى الله عنها قالت أرادت أمي أن تسمني لدخولي على رسول الله صلى الله عليه وسلم فلم أقبل عليها بشىء مما تريد حتى أطعمتني القثاء بالرطب فسمنت عليه كأحسن السمن 	 حدثنا محمد بن يحيى بن فارس حدثنا نوح بن يزيد بن سيار حدثنا إبراهيم بن سعد عن محمد بن إسحاق عن هشام بن عروة عن أبيه عن عائشة رضى الله عنها قالت أرادت أمي أن تسمني لدخولي على رسول الله صلى الله عليه وسلم فلم أقبل عليها بشىء مما تريد حتى أطعمتني القثاء بالرطب فسمنت عليه كأحسن السمن 	 Narrated Aisha, Ummul Mu'minin: My mother intended to make me gain weight to send me to the (house of) the Messenger of Allah (SL3M). But nothing which she desired benefited me till she gave me cucumber with fresh dates to eat. Then I gained as much weight (as she desired). 
