abudawud24_934600	 حدثنا مسدد حدثنا حماد عن جميل بن مرة عن	حدثنا أبي الوضيء قال غزونا غزوة لنا فنزلنا منزلا فباع صاحب لنا فرسا بغلام ثم أقاما بقية يومهما وليلتهما فلما أصبحا من الغد حضر الرحيل فقام إلى فرسه يسرجه فندم فأتى الرجل وأخذه بالبيع فأبى الرجل أن يدفعه إليه فقال بيني وبينك أبو برزة صاحب النبي صلى الله عليه وسلم فأتيا أبا برزة في ناحية العسكر فقالا له هذه القصة فقال أترضيان أن أقضي بينكما بقضاء رسول الله صلى الله عليه وسلم قال رسول الله صلى الله عليه وسلم البيعان بالخيار ما لم يتفرقا قال هشام بن حسان حدث جميل أنه قال ما أراكما افترقتما 	 حدثنا مسدد حدثنا حماد عن جميل بن مرة عن أبي الوضيء قال غزونا غزوة لنا فنزلنا منزلا فباع صاحب لنا فرسا بغلام ثم أقاما بقية يومهما وليلتهما فلما أصبحا من الغد حضر الرحيل فقام إلى فرسه يسرجه فندم فأتى الرجل وأخذه بالبيع فأبى الرجل أن يدفعه إليه فقال بيني وبينك أبو برزة صاحب النبي صلى الله عليه وسلم فأتيا أبا برزة في ناحية العسكر فقالا له هذه القصة فقال أترضيان أن أقضي بينكما بقضاء رسول الله صلى الله عليه وسلم قال رسول الله صلى الله عليه وسلم البيعان بالخيار ما لم يتفرقا قال هشام بن حسان حدث جميل أنه قال ما أراكما افترقتما 	" Narrated AbulWadi': We fought one of our battle, and encamped at a certain place. One of our companions sold a horse for a slave. After that they remained there for the rest of day and night. When the next morning came, they prepared themselves for departure. The buyer of the horse began to saddle it, but the seller was ashamed (of the transaction). He went to the man (buyer) and asked him to annul the transaction. The man refused to hand it over (the horse) to him. He said: AbuBarzah, the companion of the Prophet (SL3M), is to decide between me and you. They went to AbuBarzah in the corner of the army. They related this story to him. He said: Do you agree that I make a decision between you on the basis of the decision of the Messenger of Allah (SL3M)? The Messenger of Allah (SL3M) said: Both parties in a business transaction have an option (right) to annul it so long as they have not separated. Hisham to Hassan said that Jamil said in his version: ""I do not think that you separated."" "
abudawud24_934610	 حدثنا محمد بن حاتم الجرجرائي قال مروان الفزاري أخبرنا عن يحيى بن	عن أيوب قال كان أبو زرعة إذا بايع رجلا خيره قال ثم يقول خيرني ويقول سمعت أبا هريرة يقول قال رسول الله صلى الله عليه وسلم لا يفترقن اثنان إلا عن تراض 	 حدثنا محمد بن حاتم الجرجرائي قال مروان الفزاري أخبرنا عن يحيى بن أيوب قال كان أبو زرعة إذا بايع رجلا خيره قال ثم يقول خيرني ويقول سمعت أبا هريرة يقول قال رسول الله صلى الله عليه وسلم لا يفترقن اثنان إلا عن تراض 	 Narrated Yahya b. Ayyub: When Abu Zur'ah made a business transaction with a man, he gave him the right of option. He then would tell him: Give me the right of option (to annul the bargain). He said: I heard AbuHurayrah say: The Messenger of Allah (SL3M) said: Two people must separate only by mutual consent. 
abudawud24_934620	 حدثنا أبو الوليد الطيالسي حدثنا شعبة عن قتادة عن أبي الخليل عن عبد الله بن الحارث عن حكيم بن	عن حزام أن رسول الله صلى الله عليه وسلم قال البيعان بالخيار ما لم يفترقا فإن صدقا وبينا بورك لهما في بيعهما وإن كتما وكذبا محقت البركة من بيعهما قال أبو داود وكذلك رواه سعيد بن أبي عروبة وحماد وأما همام فقال حتى يتفرقا أو يختار ثلاث مرار 	 حدثنا أبو الوليد الطيالسي حدثنا شعبة عن قتادة عن أبي الخليل عن عبد الله بن الحارث عن حكيم بن حزام أن رسول الله صلى الله عليه وسلم قال البيعان بالخيار ما لم يفترقا فإن صدقا وبينا بورك لهما في بيعهما وإن كتما وكذبا محقت البركة من بيعهما قال أبو داود وكذلك رواه سعيد بن أبي عروبة وحماد وأما همام فقال حتى يتفرقا أو يختار ثلاث مرار 	 Narrated Hakim b. Hizam: The Messenger of Allah (SL3M) as saying: Both parties in a business transaction have a right of option (to annul it) so long as they are not separated ; and if they tell the truth and make everything clear, they will be blessed in their transaction, but it they conceal anything and lie, the blessing on their transaction will be blotted out. Abu Dawud said: A similar tradition has also been transmitted by Sa'id b. Abi 'Arubah and Hammad. As regards with Hammam, he said in his version: Until they separate or exercise the right of option (to annul the transaction), saying the words of option three times. 
abudawud24_934630	 حدثنا يحيى بن معين حدثنا حفص عن الأعمش عن أبي صالح عن	عن أبي هريرة قال قال رسول الله صلى الله عليه وسلم من أقال مسلما أقاله الله عثرته 	 حدثنا يحيى بن معين حدثنا حفص عن الأعمش عن أبي صالح عن أبي هريرة قال قال رسول الله صلى الله عليه وسلم من أقال مسلما أقاله الله عثرته 	 Narrated AbuHurayrah: The Prophet (SL3M) said: If anyone rescinds a sale with a Muslim, Allah will cancel his slip, on the Day of Resurrection. 
abudawud24_934640	 حدثنا أبو بكر بن أبي شيبة عن يحيى بن	حدثنا زكريا عن محمد بن عمرو عن أبي سلمة عن أبي هريرة قال قال النبي صلى الله عليه وسلم من باع بيعتين في بيعة فله أوكسهما أو الربا 	 حدثنا أبو بكر بن أبي شيبة عن يحيى بن زكريا عن محمد بن عمرو عن أبي سلمة عن أبي هريرة قال قال النبي صلى الله عليه وسلم من باع بيعتين في بيعة فله أوكسهما أو الربا 	 Narrated AbuHurayrah: The Prophet (SL3M) said: If anyone makes two transactions combined in one bargain, he should have the lesser of the two or it will involve usury. 
abudawud24_934650	 حدثنا سليمان بن داود المهري أخبرنا ابن وهب أخبرني حيوة بن	أخبرنا شريح ح وحدثنا جعفر بن مسافر التنيسي حدثنا عبد الله بن يحيى البرلسي حدثنا حيوة بن شريح عن إسحاق أبي عبد الرحمن قال سليمان عن أبي عبد الرحمن الخراساني أن عطاء الخراساني حدثه أن نافعا حدثه عن ابن عمر قال سمعت رسول الله صلى الله عليه وسلم يقول إذا تبايعتم بالعينة وأخذتم أذناب البقر ورضيتم بالزرع وتركتم الجهاد سلط الله عليكم ذلا لا ينزعه حتى ترجعوا إلى دينكم قال أبو داود الإخبار لجعفر وهذا لفظه 	 حدثنا سليمان بن داود المهري أخبرنا ابن وهب أخبرني حيوة بن شريح ح وحدثنا جعفر بن مسافر التنيسي حدثنا عبد الله بن يحيى البرلسي حدثنا حيوة بن شريح عن إسحاق أبي عبد الرحمن قال سليمان عن أبي عبد الرحمن الخراساني أن عطاء الخراساني حدثه أن نافعا حدثه عن ابن عمر قال سمعت رسول الله صلى الله عليه وسلم يقول إذا تبايعتم بالعينة وأخذتم أذناب البقر ورضيتم بالزرع وتركتم الجهاد سلط الله عليكم ذلا لا ينزعه حتى ترجعوا إلى دينكم قال أبو داود الإخبار لجعفر وهذا لفظه 	 Narrated Abdullah ibn Umar: I heard the Messenger of Allah, (SL3M) say: When you enter into the inah transaction, hold the tails of oxen, are pleased with agriculture, and give up conducting jihad (struggle in the way of Allah). Allah will make disgrace prevail over you, and will not withdraw it until you return to your original religion. 
abudawud24_934660	 حدثنا عبد الله بن محمد النفيلي حدثنا سفيان عن ابن أبي نجيح عن عبد الله بن كثير عن أبي المنهال عن	عن ابن عباس قال قدم رسول الله صلى الله عليه وسلم وهم يسلفون في التمر السنة والسنتين والثلاثة فقال رسول الله صلى الله عليه وسلم من أسلف في تمر فليسلف في كيل معلوم ووزن معلوم إلى أجل معلوم 	 حدثنا عبد الله بن محمد النفيلي حدثنا سفيان عن ابن أبي نجيح عن عبد الله بن كثير عن أبي المنهال عن ابن عباس قال قدم رسول الله صلى الله عليه وسلم وهم يسلفون في التمر السنة والسنتين والثلاثة فقال رسول الله صلى الله عليه وسلم من أسلف في تمر فليسلف في كيل معلوم ووزن معلوم إلى أجل معلوم 	 Narrated Ibn 'Abbas: When the Messenger of Allah (SL3M) came to Medina, they were paying one, two and three years in advance for fruits, so he said: Those who pay in advance for anything, must do for a specified measure and weight with a specified time fixed. 
abudawud24_934670	 حدثنا حفص بن عمر حدثنا شعبة ح وحدثنا ابن كثير أخبرنا شعبة أخبرني محمد أو عبد الله بن	أخبرنا مجالد قال اختلف عبد الله بن شداد وأبو بردة في السلف فبعثوني إلى ابن أبي أوفى فسألته فقال إن كنا نسلف على عهد رسول الله صلى الله عليه وسلم وأبي بكر وعمر في الحنطة والشعير والتمر والزبيب زاد ابن كثير إلى قوم ما هو عندهم ثم اتفقا وسألت ابن أبزى فقال مثل ذلك 	 حدثنا حفص بن عمر حدثنا شعبة ح وحدثنا ابن كثير أخبرنا شعبة أخبرني محمد أو عبد الله بن مجالد قال اختلف عبد الله بن شداد وأبو بردة في السلف فبعثوني إلى ابن أبي أوفى فسألته فقال إن كنا نسلف على عهد رسول الله صلى الله عليه وسلم وأبي بكر وعمر في الحنطة والشعير والتمر والزبيب زاد ابن كثير إلى قوم ما هو عندهم ثم اتفقا وسألت ابن أبزى فقال مثل ذلك 	" Muhammad or 'Abd Allah b. Mujahid said: 'Abd Allah b. Shaddad and Abu Burdah disputed over salaf (payment in advance). They sent me to Ibn Abi Awfa and I asked him (about it) and he replied: We used to pay in advance (salaf) during the time of the Messenger of Allah (SL3M), Abu Bakr and 'Umar in wheat, barley, dates and raisins. Ibn Kathir added: ""to those people who did not possess these things."" The agreed version then goes: I then asked Ibn Abza who gave a similar reply. "
abudawud24_934680	 حدثنا محمد بن بشار حدثنا يحيى وابن مهدي قالا حدثنا شعبة عن عبد الله بن	حدثنا أبي المجالد وقال عبد الرحمن عن ابن أبي المجالد بهذا الحديث قال عند قوم ما هو عندهم قال أبو داود الصواب ابن أبي المجالد وشعبة أخطأ فيه 	 حدثنا محمد بن بشار حدثنا يحيى وابن مهدي قالا حدثنا شعبة عن عبد الله بن أبي المجالد وقال عبد الرحمن عن ابن أبي المجالد بهذا الحديث قال عند قوم ما هو عندهم قال أبو داود الصواب ابن أبي المجالد وشعبة أخطأ فيه 	" The tradition mentioned above has also been transmitted by Ibn Abi al-Mujahid through a different chain of narrators. This version has: ""to those people who did not possess these things."" Abu Dawud said: What is correct is Ibn Abi al-Mujahid. Shu'bah made a mistake in it. "
abudawud24_934690	 حدثنا محمد بن المصفى حدثنا أبو المغيرة حدثنا عبد الملك بن أبي غنية حدثني أبو إسحاق عن عبد الله بن	عن أبي أوفى الأسلمي قال غزونا مع رسول الله صلى الله عليه وسلم الشام فكان يأتينا أنباط من أنباط الشام فنسلفهم في البر والزيت سعرا معلوما وأجلا معلوما فقيل له ممن له ذلك قال ما كنا نسألهم 	 حدثنا محمد بن المصفى حدثنا أبو المغيرة حدثنا عبد الملك بن أبي غنية حدثني أبو إسحاق عن عبد الله بن أبي أوفى الأسلمي قال غزونا مع رسول الله صلى الله عليه وسلم الشام فكان يأتينا أنباط من أنباط الشام فنسلفهم في البر والزيت سعرا معلوما وأجلا معلوما فقيل له ممن له ذلك قال ما كنا نسألهم 	 Narrated Abdullah ibn AbuAwfa ibn AbuAwfa al-Aslami: We made a journey to Syria on an expedition along with the Messenger of Allah (SL3M). The Nabateans of Syria came to us and we paid in advance to them (in a salam contract) in wheat and olive oil at a specified rate and for a specified time. He asked (by the people): you might have contracted with him who had these things in his possession? He replied: We did not ask them. 
abudawud24_934700	 حدثنا محمد بن كثير أخبرنا سفيان عن أبي إسحاق عن رجل نجراني عن	عن ابن عمر أن رجلا أسلف رجلا في نخل فلم تخرج تلك السنة شيئا فاختصما إلى النبي صلى الله عليه وسلم فقال بم تستحل ماله اردد عليه ماله ثم قال لا تسلفوا في النخل حتى يبدو صلاحه 	 حدثنا محمد بن كثير أخبرنا سفيان عن أبي إسحاق عن رجل نجراني عن ابن عمر أن رجلا أسلف رجلا في نخل فلم تخرج تلك السنة شيئا فاختصما إلى النبي صلى الله عليه وسلم فقال بم تستحل ماله اردد عليه ماله ثم قال لا تسلفوا في النخل حتى يبدو صلاحه 	 Narrated Abdullah ibn Umar: A man paid in advance for a palm-tree. It did not bear fruit that year. They brought their case for decision to the Prophet (SL3M). He said: for which do you make his property lawful? He then said: Do not pay in advance for a palm-tree till they (the fruits) were clearly in good condition. 
abudawud24_934710	 حدثنا محمد بن عيسى حدثنا أبو بدر عن زياد بن	حدثنا خيثمة عن سعد يعني الطائي عن عطية بن سعد عن أبي سعيد الخدري قال قال رسول الله صلى الله عليه وسلم من أسلف في شىء فلا يصرفه إلى غيره 	 حدثنا محمد بن عيسى حدثنا أبو بدر عن زياد بن خيثمة عن سعد يعني الطائي عن عطية بن سعد عن أبي سعيد الخدري قال قال رسول الله صلى الله عليه وسلم من أسلف في شىء فلا يصرفه إلى غيره 	 Narrated AbuSa'id al-Khudri: The Prophet (SL3M) said: If anyone pays in advance he must not transfer it to someone else before he receives it. 
abudawud24_934720	 حدثنا قتيبة بن سعيد حدثنا الليث عن بكير عن عياض بن عبد الله عن	عن أبي سعيد الخدري أنه قال أصيب رجل في عهد رسول الله صلى الله عليه وسلم في ثمار ابتاعها فكثر دينه فقال رسول الله صلى الله عليه وسلم تصدقوا عليه فتصدق الناس عليه فلم يبلغ ذلك وفاء دينه فقال رسول الله صلى الله عليه وسلم خذوا ما وجدتم وليس لكم إلا ذلك 	 حدثنا قتيبة بن سعيد حدثنا الليث عن بكير عن عياض بن عبد الله عن أبي سعيد الخدري أنه قال أصيب رجل في عهد رسول الله صلى الله عليه وسلم في ثمار ابتاعها فكثر دينه فقال رسول الله صلى الله عليه وسلم تصدقوا عليه فتصدق الناس عليه فلم يبلغ ذلك وفاء دينه فقال رسول الله صلى الله عليه وسلم خذوا ما وجدتم وليس لكم إلا ذلك 	 Narrated Abu Sa’id Al Khudri : In the time of the Messenger of Allah (SL3M) a man suffered loss affecting fruits he had bought and owed a large debt, so the Messenger of Allah (SL3M) said: Give him sadaqah (alms). So the people gave him sadaqah (alms), but as that was not enough to pay the debt in full, the Messenger of Allah (SL3M) said: Take what you find. But that is all you may have. 
abudawud24_934730	 حدثنا سليمان بن داود المهري وأحمد بن	حدثنا سعيد الهمداني قالا أخبرنا ابن وهب قال أخبرني ابن جريج ح وحدثنا محمد بن معمر حدثنا أبو عاصم عن ابن جريج المعنى أن أبا الزبير المكي أخبره عن جابر بن عبد الله أن رسول الله صلى الله عليه وسلم قال إن بعت من أخيك تمرا فأصابتها جائحة فلا يحل لك أن تأخذ منه شيئا بم تأخذ مال أخيك بغير حق 	 حدثنا سليمان بن داود المهري وأحمد بن سعيد الهمداني قالا أخبرنا ابن وهب قال أخبرني ابن جريج ح وحدثنا محمد بن معمر حدثنا أبو عاصم عن ابن جريج المعنى أن أبا الزبير المكي أخبره عن جابر بن عبد الله أن رسول الله صلى الله عليه وسلم قال إن بعت من أخيك تمرا فأصابتها جائحة فلا يحل لك أن تأخذ منه شيئا بم تأخذ مال أخيك بغير حق 	 Narrated Jabir bin ‘Abdullah : The Messenger of Allah (SL3M) as saying: If you were to sell dried dates to your brother and they were smitten by blight, it will not be allowable for you to take your brother's property unjustly. 
abudawud24_934740	 حدثنا سليمان بن داود المهري أخبرنا ابن وهب أخبرني عثمان بن الحكم عن ابن جريج عن	عن عطاء قال الجوائح كل ظاهر مفسد من مطر أو برد أو جراد أو ريح أو حريق 	 حدثنا سليمان بن داود المهري أخبرنا ابن وهب أخبرني عثمان بن الحكم عن ابن جريج عن عطاء قال الجوائح كل ظاهر مفسد من مطر أو برد أو جراد أو ريح أو حريق 	 'Ata said: Blight means anything which obviously damages (the crop), by rain, hail, locust, blast of wind, or fire. 
abudawud24_934750	 حدثنا سليمان بن داود أخبرنا ابن وهب أخبرني عثمان بن	حدثنا الحكم عن يحيى بن سعيد أنه قال لا جائحة فيما أصيب دون ثلث رأس المال قال يحيى وذلك في سنة المسلمين 	 حدثنا سليمان بن داود أخبرنا ابن وهب أخبرني عثمان بن الحكم عن يحيى بن سعيد أنه قال لا جائحة فيما أصيب دون ثلث رأس المال قال يحيى وذلك في سنة المسلمين 	 Yahya b. Sa'id said: Blight is not effective when less than one-third of goods are damaged. Yayha said: That has been the established practice of Muslims. 
abudawud24_934760	 حدثنا عثمان بن أبي شيبة حدثنا جرير عن الأعمش عن أبي صالح عن	عن أبي هريرة قال قال رسول الله صلى الله عليه وسلم لا يمنع فضل الماء ليمنع به الكلأ 	 حدثنا عثمان بن أبي شيبة حدثنا جرير عن الأعمش عن أبي صالح عن أبي هريرة قال قال رسول الله صلى الله عليه وسلم لا يمنع فضل الماء ليمنع به الكلأ 	 Narrated Abu Hurairah: The Messenger of Allah (SL3M) as saying: Excess water should not be withheld so as to prevent (cattle) by it from grass. 
abudawud24_934770	 حدثنا أبو بكر بن أبي شيبة حدثنا وكيع حدثنا الأعمش عن أبي صالح عن	حدثنا أبي هريرة قال قال رسول الله صلى الله عليه وسلم ثلاثة لا يكلمهم الله يوم القيامة رجل منع ابن السبيل فضل ماء عنده ورجل حلف على سلعة بعد العصر يعني كاذبا ورجل بايع إماما فإن أعطاه وفى له وإن لم يعطه لم يف له 	 حدثنا أبو بكر بن أبي شيبة حدثنا وكيع حدثنا الأعمش عن أبي صالح عن أبي هريرة قال قال رسول الله صلى الله عليه وسلم ثلاثة لا يكلمهم الله يوم القيامة رجل منع ابن السبيل فضل ماء عنده ورجل حلف على سلعة بعد العصر يعني كاذبا ورجل بايع إماما فإن أعطاه وفى له وإن لم يعطه لم يف له 	 Narrated Abu Hurairah: The Messenger of Allah (SL3M) as saying: There are three people who Allah will not address on the Day of Judgement: a man who prevents traveller from the excess water which he has with him; and a man who swears for the goods (for sale) after the afternoon prayer, that is, (he swears) falsely; and a man who takes the oath of allegiance to a ruler (imam); if he gives him (something), he fullfils (the oath of allegiance) to him, if he does not give him (anything), he does not fulfill it. 
abudawud24_934780	 حدثنا عثمان بن أبي شيبة حدثنا جرير عن	حدثنا الأعمش بإسناده ومعناه قال ولا يزكيهم ولهم عذاب أليم وقال في السلعة بالله لقد أعطي بها كذا وكذا فصدقه الآخر فأخذها 	 حدثنا عثمان بن أبي شيبة حدثنا جرير عن الأعمش بإسناده ومعناه قال ولا يزكيهم ولهم عذاب أليم وقال في السلعة بالله لقد أعطي بها كذا وكذا فصدقه الآخر فأخذها 	" The tradition mentioned above has also been related by al-'Amash to the same effect through a different chain of narrators. This version adds: ""He used: 'Not purify them ; grievously will be their penalty.'"" He said about (selling) the goods: I swear by Allah, I was given (the price) so and so for it. The other man considered it to be correct and bought it. "
