abudawud11_919490	 حدثنا محمد بن يحيى بن فارس أن الحكم بن	حدثنا نافع حدثهم حدثنا شعيب عن الزهري حدثني حميد بن عبد الرحمن أن أبا هريرة قال بعثني أبو بكر فيمن يؤذن يوم النحر بمنى أن لا يحج بعد العام مشرك ولا يطوف بالبيت عريان ويوم الحج الأكبر يوم النحر والحج الأكبر الحج 	 حدثنا محمد بن يحيى بن فارس أن الحكم بن نافع حدثهم حدثنا شعيب عن الزهري حدثني حميد بن عبد الرحمن أن أبا هريرة قال بعثني أبو بكر فيمن يؤذن يوم النحر بمنى أن لا يحج بعد العام مشرك ولا يطوف بالبيت عريان ويوم الحج الأكبر يوم النحر والحج الأكبر الحج 	 Narrated Abu Hurairah: Abu Bakr sent me among those who proclaim at Mina that no polytheist should perform Hajj after this year and no naked person should go round the House (the Ka'bah), and that the day of greater Hajj is the day of sacrifice, and the greater Hajj is the Hajj. 
abudawud11_919500	 حدثنا مسدد حدثنا إسماعيل حدثنا أيوب عن محمد عن ابن أبي بكرة عن	عن أبي بكرة أن النبي صلى الله عليه وسلم خطب في حجته فقال إن الزمان قد استدار كهيئته يوم خلق الله السموات والأرض السنة اثنا عشر شهرا منها أربعة حرم ثلاث متواليات ذو القعدة و ذو الحجة والمحرم ورجب مضر الذي بين جمادى وشعبان 	 حدثنا مسدد حدثنا إسماعيل حدثنا أيوب عن محمد عن ابن أبي بكرة عن أبي بكرة أن النبي صلى الله عليه وسلم خطب في حجته فقال إن الزمان قد استدار كهيئته يوم خلق الله السموات والأرض السنة اثنا عشر شهرا منها أربعة حرم ثلاث متواليات ذو القعدة و ذو الحجة والمحرم ورجب مضر الذي بين جمادى وشعبان 	 Narrated AbuBakrah: The Prophet (SL3M) gave a sermon during his hajj and said: Time has completed a cycle and assumed the form of the day when Allah created the heavens and the earth. The year contains twelve months of which four are sacred, three of them consecutive, viz. Dhul-Qa'dah, Dhul-Hijjah and Muharram and also Rajab of Mudar which comes between Jumadah and Sha'ban. 
abudawud11_919510	 حدثنا محمد بن يحيى بن فياض حدثنا عبد الوهاب حدثنا أيوب السختياني عن محمد بن سيرين عن ابن أبي بكرة عن أبي بكرة عن	عن النبي صلى الله عليه وسلم بمعناه قال أبو داود سماه ابن عون فقال عن عبد الرحمن بن أبي بكرة عن أبي بكرة في هذا الحديث 	 حدثنا محمد بن يحيى بن فياض حدثنا عبد الوهاب حدثنا أيوب السختياني عن محمد بن سيرين عن ابن أبي بكرة عن أبي بكرة عن النبي صلى الله عليه وسلم بمعناه قال أبو داود سماه ابن عون فقال عن عبد الرحمن بن أبي بكرة عن أبي بكرة في هذا الحديث 	 The aforesaid tradition has also been transmitted by Abu Bakrah through a different chain of narrators. Abu Dawud said: Ibn 'Awn has mentioned his ('Abu Bakrah's) name and narrated this tradition: From 'Abd al-Rahman b. Abi Bakrah on the authority of Abu Bakrah. 
abudawud11_919520	 حدثنا محمد بن كثير حدثنا سفيان حدثني بكير بن	حدثنا عطاء عن عبد الرحمن بن أبي يعمر الديلي قال أتيت النبي صلى الله عليه وسلم وهو بعرفة فجاء ناس أو نفر من أهل نجد فأمروا رجلا فنادى رسول الله صلى الله عليه وسلم كيف الحج فأمر رسول الله صلى الله عليه وسلم رجلا فنادى الحج الحج يوم عرفة من جاء قبل صلاة الصبح من ليلة جمع فتم حجه أيام منى ثلاثة فمن تعجل في يومين فلا إثم عليه ومن تأخر فلا إثم عليه قال ثم أردف رجلا خلفه فجعل ينادي بذلك قال أبو داود وكذلك رواه مهران عن سفيان قال الحج الحج مرتين ورواه يحيى بن سعيد القطان عن سفيان قال الحج مرة 	 حدثنا محمد بن كثير حدثنا سفيان حدثني بكير بن عطاء عن عبد الرحمن بن أبي يعمر الديلي قال أتيت النبي صلى الله عليه وسلم وهو بعرفة فجاء ناس أو نفر من أهل نجد فأمروا رجلا فنادى رسول الله صلى الله عليه وسلم كيف الحج فأمر رسول الله صلى الله عليه وسلم رجلا فنادى الحج الحج يوم عرفة من جاء قبل صلاة الصبح من ليلة جمع فتم حجه أيام منى ثلاثة فمن تعجل في يومين فلا إثم عليه ومن تأخر فلا إثم عليه قال ثم أردف رجلا خلفه فجعل ينادي بذلك قال أبو داود وكذلك رواه مهران عن سفيان قال الحج الحج مرتين ورواه يحيى بن سعيد القطان عن سفيان قال الحج مرة 	 Narrated AbdurRahman Ya'mar ad-Dayli: I came to the Holy Prophet (SL3M) when he was in Arafat. Some people or a group of people came from Najd. They commanded someone (to ask the Prophet about hajj). So he called the Messenger of Allah (SL3M), saying: How is the hajj done? He (the Prophet) ordered a man (to reply). He shouted loudly: The hajj, the hajj is on the day of Arafah. If anyone comes over there before the dawn prayer on the night of al-Muzdalifah, his hajj will be complete. The period of halting at Mina is three days. Then whoever hastens (his departure) by two days, it is no sin for him, and whoever delays it there is no sin for him. The narrator said: He (the Prophet) then put a man behind him on the camel. He began to proclaim this loudly. Abu Dawud said: This tradition has been narrated by Mahran from Sufyan in a similar way. This version adds: The Hajj, the Hajj, twice. The version narrated by Yaya b. Sa'id al-Qattan has the words: The Hajj only once. 
abudawud11_919530	 حدثنا مسدد حدثنا يحيى عن إسماعيل حدثنا عامر أخبرني عروة بن	حدثنا مضرس الطائي قال أتيت رسول الله صلى الله عليه وسلم بالموقف يعني بجمع قلت جئت يا رسول الله من جبل طيئ أكللت مطيتي وأتعبت نفسي والله ما تركت من جبل إلا وقفت عليه فهل لي من حج فقال رسول الله صلى الله عليه وسلم من أدرك معنا هذه الصلاة وأتى عرفات قبل ذلك ليلا أو نهارا فقد تم حجه وقضى تفثه 	 حدثنا مسدد حدثنا يحيى عن إسماعيل حدثنا عامر أخبرني عروة بن مضرس الطائي قال أتيت رسول الله صلى الله عليه وسلم بالموقف يعني بجمع قلت جئت يا رسول الله من جبل طيئ أكللت مطيتي وأتعبت نفسي والله ما تركت من جبل إلا وقفت عليه فهل لي من حج فقال رسول الله صلى الله عليه وسلم من أدرك معنا هذه الصلاة وأتى عرفات قبل ذلك ليلا أو نهارا فقد تم حجه وقضى تفثه 	 Narrated Urwah ibn Mudarris at-Ta'i: I came to the Messenger of Allah (SL3M) at the place of halting, that is, al-Muzdalifah. I said: I have come from the mountains of Tayy. I fatigued my mount and fatigued myself. By Allah, I found no hill (on my way) but I halted there. Have I completed my hajj? The Messenger of Allah (SL3M) said: Anyone who offers this prayer along with us and comes over to Arafat before it by night or day will complete his hajj and he may wash away the dirt (of his body). 
abudawud11_919540	 حدثنا أحمد بن حنبل حدثنا عبد الرزاق أخبرنا معمر عن حميد الأعرج عن محمد بن إبراهيم التيمي عن عبد الرحمن بن معاذ عن	عن رجل من أصحاب النبي صلى الله عليه وسلم قال خطب النبي صلى الله عليه وسلم الناس بمنى ونزلهم منازلهم فقال لينزل المهاجرون ها هنا وأشار إلى ميمنة القبلة والأنصار ها هنا وأشار إلى ميسرة القبلة ثم لينزل الناس حولهم 	 حدثنا أحمد بن حنبل حدثنا عبد الرزاق أخبرنا معمر عن حميد الأعرج عن محمد بن إبراهيم التيمي عن عبد الرحمن بن معاذ عن رجل من أصحاب النبي صلى الله عليه وسلم قال خطب النبي صلى الله عليه وسلم الناس بمنى ونزلهم منازلهم فقال لينزل المهاجرون ها هنا وأشار إلى ميمنة القبلة والأنصار ها هنا وأشار إلى ميسرة القبلة ثم لينزل الناس حولهم 	 AbdurRahman ibn Mu'adh said that he heard a man from the Companions of the Prophet (SL3M) say: The Prophet (SL3M) addressed the people at Mina and he made them stay in their dwellings. He then said: The Muhajirun (Emigrants) should stay here, and he made a sign to the right side of the qiblah, and the Ansar (the Helpers) here, and he made a sign to the left side of the qiblah; the people should stay around them. 
abudawud11_919550	 حدثنا محمد بن العلاء حدثنا ابن المبارك عن إبراهيم بن	حدثنا نافع عن ابن أبي نجيح عن أبيه عن رجلين من بني بكر قالا رأينا رسول الله صلى الله عليه وسلم يخطب بين أوسط أيام التشريق ونحن عند راحلته وهي خطبة رسول الله صلى الله عليه وسلم التي خطب بمنى 	 حدثنا محمد بن العلاء حدثنا ابن المبارك عن إبراهيم بن نافع عن ابن أبي نجيح عن أبيه عن رجلين من بني بكر قالا رأينا رسول الله صلى الله عليه وسلم يخطب بين أوسط أيام التشريق ونحن عند راحلته وهي خطبة رسول الله صلى الله عليه وسلم التي خطب بمنى 	 Ibn AbuNajih reported from his father on the authority of two men from Banu Bakr who said: We saw the Messenger of Allah (SL3M) addressing (the people) in the middle of the tashriq days when we were staying near his mount. This is the address of the Messenger of Allah (SL3M) which he gave at Mina. 
abudawud11_919560	 حدثنا محمد بن بشار حدثنا أبو عاصم حدثنا ربيعة بن	حدثنا عبد الرحمن بن حصن حدثتني جدتي سراء بنت نبهان وكانت ربة بيت في الجاهلية قالت خطبنا رسول الله صلى الله عليه وسلم يوم الرءوس فقال أى يوم هذا قلنا الله ورسوله أعلم قال أليس أوسط أيام التشريق قال أبو داود وكذلك قال عم أبي حرة الرقاشي إنه خطب أوسط أيام التشريق 	 حدثنا محمد بن بشار حدثنا أبو عاصم حدثنا ربيعة بن عبد الرحمن بن حصن حدثتني جدتي سراء بنت نبهان وكانت ربة بيت في الجاهلية قالت خطبنا رسول الله صلى الله عليه وسلم يوم الرءوس فقال أى يوم هذا قلنا الله ورسوله أعلم قال أليس أوسط أيام التشريق قال أبو داود وكذلك قال عم أبي حرة الرقاشي إنه خطب أوسط أيام التشريق 	 Narrated Sarra' daughter of Nabhan: She was mistress of a temple in pre-Islamic days. She said: The prophet (SL3M) addressed us on the second day of sacrifice (yawm ar-ru'us) and said: Which is this day? We said: Allah and His Apostle are better aware. He said: Is this not the middle of the tashriq days? 
abudawud11_919570	 حدثنا هارون بن عبد الله حدثنا هشام بن	حدثنا عبد الملك حدثنا عكرمة حدثني الهرماس بن زياد الباهلي قال رأيت النبي صلى الله عليه وسلم يخطب الناس على ناقته العضباء يوم الأضحى بمنى 	 حدثنا هارون بن عبد الله حدثنا هشام بن عبد الملك حدثنا عكرمة حدثني الهرماس بن زياد الباهلي قال رأيت النبي صلى الله عليه وسلم يخطب الناس على ناقته العضباء يوم الأضحى بمنى 	 Narrated Harmas ibn Ziyad al-Bahili: I saw the Prophet (SL3M) addressing the people on his she-camel al-Adba', on the day of sacrifice at Mina. 
abudawud11_919580	 حدثنا مؤمل يعني ابن الفضل الحراني حدثنا الوليد حدثنا ابن جابر حدثنا سليم بن	حدثنا عامر الكلاعي سمعت أبا أمامة يقول سمعت خطبة رسول الله صلى الله عليه وسلم بمنى يوم النحر 	 حدثنا مؤمل يعني ابن الفضل الحراني حدثنا الوليد حدثنا ابن جابر حدثنا سليم بن عامر الكلاعي سمعت أبا أمامة يقول سمعت خطبة رسول الله صلى الله عليه وسلم بمنى يوم النحر 	 Narrated Abu Umamah: I heard the address of the Messenger of Allah (SL3M) at Mina on the day of sacrifice. 
abudawud11_919590	 حدثنا عبد الوهاب بن عبد الرحيم الدمشقي حدثنا مروان عن هلال بن عامر المزني حدثني رافع بن	عن عمرو المزني قال رأيت رسول الله صلى الله عليه وسلم يخطب الناس بمنى حين ارتفع الضحى على بغلة شهباء وعلي رضى الله عنه يعبر عنه والناس بين قاعد وقائم 	 حدثنا عبد الوهاب بن عبد الرحيم الدمشقي حدثنا مروان عن هلال بن عامر المزني حدثني رافع بن عمرو المزني قال رأيت رسول الله صلى الله عليه وسلم يخطب الناس بمنى حين ارتفع الضحى على بغلة شهباء وعلي رضى الله عنه يعبر عنه والناس بين قاعد وقائم 	 Narrated Rafi' ibn Amr al-Muzani: I saw the Messenger of Allah (SL3M) addressing the people at Mina (on the day of sacrifice) when the sun rose high (i.e. in the forenoon) on a white mule, and Ali (Allah be pleased with him) was interpreting on his behalf; some people were standing and some sitting. 
abudawud11_919600	 حدثنا مسدد حدثنا عبد الوارث عن حميد الأعرج عن محمد بن إبراهيم التيمي عن عبد الرحمن بن	عن معاذ التيمي قال خطبنا رسول الله صلى الله عليه وسلم ونحن بمنى ففتحت أسماعنا حتى كنا نسمع ما يقول ونحن في منازلنا فطفق يعلمهم مناسكهم حتى بلغ الجمار فوضع أصبعيه السبابتين في أذنيه ثم قال بحصى الخذف ثم أمر المهاجرين فنزلوا في مقدم المسجد وأمر الأنصار فنزلوا من وراء المسجد ثم نزل الناس بعد ذلك 	 حدثنا مسدد حدثنا عبد الوارث عن حميد الأعرج عن محمد بن إبراهيم التيمي عن عبد الرحمن بن معاذ التيمي قال خطبنا رسول الله صلى الله عليه وسلم ونحن بمنى ففتحت أسماعنا حتى كنا نسمع ما يقول ونحن في منازلنا فطفق يعلمهم مناسكهم حتى بلغ الجمار فوضع أصبعيه السبابتين في أذنيه ثم قال بحصى الخذف ثم أمر المهاجرين فنزلوا في مقدم المسجد وأمر الأنصار فنزلوا من وراء المسجد ثم نزل الناس بعد ذلك 	 Narrated AbdurRahman ibn Mu'adh at-Taymi: The Messenger of Allah (SL3M) addressed us when we were at Mina. Our ears were open and we were listening to what he was saying, while we were in our dwellings. He began to teach them the rites of hajj till he reached the injunction of throwing pebbles at the Jamrahs (pillars at Mina). He put his forefingers in his ears and said: (Throw small pebbles. He then commanded the Emigrants (Muhajirun) to station themselves. They stationed themselves before the mosque. He then commanded the Helpers (Ansar) to encamp. They encamped behind the mosque. Thereafter the people encamped. 
abudawud11_919610	 حدثنا أبو بكر محمد بن خلاد الباهلي حدثنا يحيى عن ابن جريج حدثني	عن حريز أو أبو حريز الشك من يحيى أنه سمع عبد الرحمن بن فروخ يسأل ابن عمر قال إنا نتبايع بأموال الناس فيأتي أحدنا مكة فيبيت على المال فقال أما رسول الله صلى الله عليه وسلم فبات بمنى وظل 	 حدثنا أبو بكر محمد بن خلاد الباهلي حدثنا يحيى عن ابن جريج حدثني حريز أو أبو حريز الشك من يحيى أنه سمع عبد الرحمن بن فروخ يسأل ابن عمر قال إنا نتبايع بأموال الناس فيأتي أحدنا مكة فيبيت على المال فقال أما رسول الله صلى الله عليه وسلم فبات بمنى وظل 	 Ibn Jurayj asked Ibn Umar: We sell the property of the people; so one of us goes to Mecca and passes the night there with the property (during the stay at Mina). He said: The Messenger of Allah (SL3M) used to pass night and day at Mina. 
abudawud11_919620	 حدثنا عثمان بن أبي شيبة حدثنا ابن نمير وأبو أسامة عن عبيد الله عن نافع عن	عن ابن عمر قال استأذن العباس رسول الله صلى الله عليه وسلم أن يبيت بمكة ليالي منى من أجل سقايته فأذن له 	 حدثنا عثمان بن أبي شيبة حدثنا ابن نمير وأبو أسامة عن عبيد الله عن نافع عن ابن عمر قال استأذن العباس رسول الله صلى الله عليه وسلم أن يبيت بمكة ليالي منى من أجل سقايته فأذن له 	 Narrated Ibn 'Umar: Al-'Abbas sought permission from the Messenger of Allah (SL3M) to pass the night at Mecca during the period of his stay at Mina for distributing water among the people. He gave him permission. 
abudawud11_919630	 حدثنا مسدد أن أبا معاوية وحفص بن	حدثنا غياث حدثاه وحديث أبي معاوية أتم عن الأعمش عن إبراهيم عن عبد الرحمن بن يزيد قال صلى عثمان بمنى أربعا فقال عبد الله صليت مع النبي صلى الله عليه وسلم ركعتين ومع أبي بكر ركعتين ومع عمر ركعتين زاد عن حفص ومع عثمان صدرا من إمارته ثم أتمها زاد من ها هنا عن أبي معاوية ثم تفرقت بكم الطرق فلوددت أن لي من أربع ركعات ركعتين متقبلتين قال الأعمش فحدثني معاوية بن قرة عن أشياخه أن عبد الله صلى أربعا قال فقيل له عبت على عثمان ثم صليت أربعا قال الخلاف شر 	 حدثنا مسدد أن أبا معاوية وحفص بن غياث حدثاه وحديث أبي معاوية أتم عن الأعمش عن إبراهيم عن عبد الرحمن بن يزيد قال صلى عثمان بمنى أربعا فقال عبد الله صليت مع النبي صلى الله عليه وسلم ركعتين ومع أبي بكر ركعتين ومع عمر ركعتين زاد عن حفص ومع عثمان صدرا من إمارته ثم أتمها زاد من ها هنا عن أبي معاوية ثم تفرقت بكم الطرق فلوددت أن لي من أربع ركعات ركعتين متقبلتين قال الأعمش فحدثني معاوية بن قرة عن أشياخه أن عبد الله صلى أربعا قال فقيل له عبت على عثمان ثم صليت أربعا قال الخلاف شر 	 Narrated 'Abd al-Rahman b. Zaid: 'Uthman prayed four rak'ahs at Mina. 'Abd Allah (b. Mas'ud) said: I prayed two rak'ahs along with the Prophet (SL3M) and two rak'ahs along with 'Umar. The version of Hafs added: And along with 'Uthman during the early period of his caliphate. He ('Uthman) began to offer complete prayer (i.e. four rak'ahs) later on. The version of Abu Mu'awiyah added: Then your modes of action varied. I would like to pray two rak'ahs acceptable to Allah instead of four rak'ahs. Al-A'mash said: Mu'awiyah b. Qurrah reported to me from his teachers: 'Abd Allah (b. Mas'ud) once prayed four rak'ahs. He was told: You criticized 'Uthman but you yourself prayed four ? He replied: Dissension is evil. 
abudawud11_919640	 حدثنا محمد بن العلاء أخبرنا ابن المبارك عن معمر عن	حدثنا الزهري أن عثمان إنما صلى بمنى أربعا لأنه أجمع على الإقامة بعد الحج 	 حدثنا محمد بن العلاء أخبرنا ابن المبارك عن معمر عن الزهري أن عثمان إنما صلى بمنى أربعا لأنه أجمع على الإقامة بعد الحج 	 Narrated Az-Zuhri: Uthman prayed four rak'ahs at Mina because he resolved to stay there after hajj. 
abudawud11_919650	 حدثنا هناد بن السري عن أبي الأحوص عن المغيرة عن	حدثنا إبراهيم قال إن عثمان صلى أربعا لأنه اتخذها وطنا 	 حدثنا هناد بن السري عن أبي الأحوص عن المغيرة عن إبراهيم قال إن عثمان صلى أربعا لأنه اتخذها وطنا 	 Narrated Ibrahim: Uthman prayed four rak'ahs (at Mina) for he made it his home (for settlement). 
abudawud11_919660	 حدثنا محمد بن العلاء أخبرنا ابن المبارك عن يونس عن	حدثنا الزهري قال لما اتخذ عثمان الأموال بالطائف وأراد أن يقيم بها صلى أربعا قال ثم أخذ به الأئمة بعده 	 حدثنا محمد بن العلاء أخبرنا ابن المبارك عن يونس عن الزهري قال لما اتخذ عثمان الأموال بالطائف وأراد أن يقيم بها صلى أربعا قال ثم أخذ به الأئمة بعده 	 Narrated Az-Zuhri: When Uthman placed his property at at-Ta'if and intended to settle there, he prayed four rak'ahs. The rulers after him followed the same practice. 
abudawud11_919670	 حدثنا موسى بن إسماعيل حدثنا حماد عن أيوب عن الزهري أن عثمان بن	عن عفان أتم الصلاة بمنى من أجل الأعراب لأنهم كثروا عامئذ فصلى بالناس أربعا ليعلمهم أن الصلاة أربع 	 حدثنا موسى بن إسماعيل حدثنا حماد عن أيوب عن الزهري أن عثمان بن عفان أتم الصلاة بمنى من أجل الأعراب لأنهم كثروا عامئذ فصلى بالناس أربعا ليعلمهم أن الصلاة أربع 	 Narrated Az-Zuhri: Uthman offered complete prayer at Mina for the sake of bedouins who attended (hajj) in large numbers that year. He led the people four rak'ahs in prayer in order to teach them that the prayer (i.e. noon or afternoon prayer) essentially contained four rak'ahs. 
abudawud11_919680	 حدثنا النفيلي حدثنا زهير حدثنا أبو إسحاق حدثني حارثة بن	حدثنا وهب الخزاعي وكانت أمه تحت عمر فولدت له عبيد الله بن عمر قال صليت خلف رسول الله صلى الله عليه وسلم بمنى والناس أكثر ما كانوا فصلى بنا ركعتين في حجة الوداع قال أبو داود حارثة من خزاعة ودارهم بمكة 	 حدثنا النفيلي حدثنا زهير حدثنا أبو إسحاق حدثني حارثة بن وهب الخزاعي وكانت أمه تحت عمر فولدت له عبيد الله بن عمر قال صليت خلف رسول الله صلى الله عليه وسلم بمنى والناس أكثر ما كانوا فصلى بنا ركعتين في حجة الوداع قال أبو داود حارثة من خزاعة ودارهم بمكة 	 Narrated Harithah ibn Wahb al-Khuza'i,: I prayed along with the Messenger of Allah (SL3M) at Mina and the people gathered there in large numbers. He led us two rak'ahs in prayer in the Farewell Pilgrimage. Abu Dawud said: Harithah belonged to the tribe of Khuza'ah, and they had their houses in Mecca. 
