abudawud29_938810	 حدثنا أحمد بن يونس حدثنا زهير حدثنا عبد الله بن	حدثنا عثمان بن خثيم عن سعيد بن جبير عن ابن عباس قال قال رسول الله صلى الله عليه وسلم البسوا من ثيابكم البياض فإنها من خير ثيابكم وكفنوا فيها موتاكم وإن خير أكحالكم الإثمد يجلو البصر وينبت الشعر 	 حدثنا أحمد بن يونس حدثنا زهير حدثنا عبد الله بن عثمان بن خثيم عن سعيد بن جبير عن ابن عباس قال قال رسول الله صلى الله عليه وسلم البسوا من ثيابكم البياض فإنها من خير ثيابكم وكفنوا فيها موتاكم وإن خير أكحالكم الإثمد يجلو البصر وينبت الشعر 	 Narrated Abdullah ibn Abbas: The Prophet (SL3M) said: Wear your white garments, for they are among your best garments, and shroud your dead in them. Among the best types of collyrium you use is antimony (ithmid): it clears the vision and makes the hair sprout. 
abudawud29_938820	 حدثنا أحمد بن حنبل حدثنا عبد الرزاق حدثنا معمر عن همام بن منبه قال هذا ما حدثنا أبو هريرة عن	حدثنا رسول الله صلى الله عليه وسلم قال العين حق 	 حدثنا أحمد بن حنبل حدثنا عبد الرزاق حدثنا معمر عن همام بن منبه قال هذا ما حدثنا أبو هريرة عن رسول الله صلى الله عليه وسلم قال العين حق 	 Abu Hurairah reported the Messenger of Allah (SL3M) as saying : The evil is genuine. 
abudawud29_938830	 حدثنا عثمان بن أبي شيبة حدثنا جرير عن الأعمش عن إبراهيم عن الأسود عن	عن عائشة رضى الله عنها قالت كان يؤمر العائن فيتوضأ ثم يغتسل منه المعين 	 حدثنا عثمان بن أبي شيبة حدثنا جرير عن الأعمش عن إبراهيم عن الأسود عن عائشة رضى الله عنها قالت كان يؤمر العائن فيتوضأ ثم يغتسل منه المعين 	 Narrated Aisha, Ummul Mu'minin: The man casting evil would be commanded to perform ablution, and then the man affected was washed with it. 
abudawud29_938840	 حدثنا الربيع بن نافع أبو توبة حدثنا محمد بن	حدثنا مهاجر عن أبيه عن أسماء بنت يزيد بن السكن قالت سمعت رسول الله صلى الله عليه وسلم يقول لا تقتلوا أولادكم سرا فإن الغيل يدرك الفارس فيدعثره عن فرسه 	 حدثنا الربيع بن نافع أبو توبة حدثنا محمد بن مهاجر عن أبيه عن أسماء بنت يزيد بن السكن قالت سمعت رسول الله صلى الله عليه وسلم يقول لا تقتلوا أولادكم سرا فإن الغيل يدرك الفارس فيدعثره عن فرسه 	 Narrated Asma', daughter of Yazid ibn as-Sakan,: I heard the Messenger of Allah (SL3M) as saying: Do not kill your children secretly, for the milk, with which a child is suckled while his mother is pregnant, overtakes the horseman and throws him from his horse. 
abudawud29_938850	 حدثنا القعنبي عن مالك عن محمد بن عبد الرحمن بن	حدثنا نوفل أخبرني عروة بن الزبير عن عائشة زوج النبي صلى الله عليه وسلم عن جدامة الأسدية أنها سمعت رسول الله صلى الله عليه وسلم يقول لقد هممت أن أنهى عن الغيلة حتى ذكرت أن الروم وفارس يفعلون ذلك فلا يضر أولادهم قال مالك الغيلة أن يمس الرجل امرأته وهي ترضع 	 حدثنا القعنبي عن مالك عن محمد بن عبد الرحمن بن نوفل أخبرني عروة بن الزبير عن عائشة زوج النبي صلى الله عليه وسلم عن جدامة الأسدية أنها سمعت رسول الله صلى الله عليه وسلم يقول لقد هممت أن أنهى عن الغيلة حتى ذكرت أن الروم وفارس يفعلون ذلك فلا يضر أولادهم قال مالك الغيلة أن يمس الرجل امرأته وهي ترضع 	 Judamat al-Asadiyyah said that she heard the Messenger of Allah (May peace be upon him) Say: I intended to prohibit suckling during pregnancy (ghailah), but I considered the Greeks and the Persians and saw that they practiced it, without any injury being caused to their children thereby. Malik said : Ghailah means that a man has intercourse with a women while she is suckling a child. 
abudawud29_938860	 حدثنا محمد بن العلاء حدثنا أبو معاوية حدثنا الأعمش عن عمرو بن مرة عن يحيى بن الجزار عن ابن أخي زينب امرأة عبد الله عن زينب امرأة عبد الله عن	عن عبد الله قال سمعت رسول الله صلى الله عليه وسلم يقول إن الرقى والتمائم والتولة شرك قالت قلت لم تقول هذا والله لقد كانت عيني تقذف وكنت أختلف إلى فلان اليهودي يرقيني فإذا رقاني سكنت فقال عبد الله إنما ذاك عمل الشيطان كان ينخسها بيده فإذا رقاها كف عنها إنما كان يكفيك أن تقولي كما كان رسول الله صلى الله عليه وسلم يقول أذهب الباس رب الناس اشف أنت الشافي لا شفاء إلا شفاؤك شفاء لا يغادر سقما 	 حدثنا محمد بن العلاء حدثنا أبو معاوية حدثنا الأعمش عن عمرو بن مرة عن يحيى بن الجزار عن ابن أخي زينب امرأة عبد الله عن زينب امرأة عبد الله عن عبد الله قال سمعت رسول الله صلى الله عليه وسلم يقول إن الرقى والتمائم والتولة شرك قالت قلت لم تقول هذا والله لقد كانت عيني تقذف وكنت أختلف إلى فلان اليهودي يرقيني فإذا رقاني سكنت فقال عبد الله إنما ذاك عمل الشيطان كان ينخسها بيده فإذا رقاها كف عنها إنما كان يكفيك أن تقولي كما كان رسول الله صلى الله عليه وسلم يقول أذهب الباس رب الناس اشف أنت الشافي لا شفاء إلا شفاؤك شفاء لا يغادر سقما 	 Narrated Abdullah ibn Mas'ud: Zaynab, the wife of Abdullah ibn Mas'ud, told that Abdullah said: I heard the Messenger of Allah (SL3M) saying: spells, charms and love-potions are polytheism. I asked: Why do you say this? I swear by Allah, when my eye was discharging I used to go to so-and-so, the Jew, who applied a spell to me. When he applied the spell to me, it calmed down. Abdullah said: That was just the work of the Devil who was picking it with his hand, and when he uttered the spell on it, he desisted. All you need to do is to say as the Messenger of Allah (SL3M) used to say: Remove the harm, O Lord of men, and heal. Thou art the Healer. There is no remedy but Thine which leaves no disease behind. 
abudawud29_938870	 حدثنا مسدد حدثنا عبد الله بن داود عن مالك بن	حدثنا مغول عن حصين عن الشعبي عن عمران بن حصين عن النبي صلى الله عليه وسلم قال لا رقية إلا من عين أو حمة 	 حدثنا مسدد حدثنا عبد الله بن داود عن مالك بن مغول عن حصين عن الشعبي عن عمران بن حصين عن النبي صلى الله عليه وسلم قال لا رقية إلا من عين أو حمة 	 Narrated Imran ibn Husayn: The Prophet (SL3M) said: No spell is to be used except for the evil eye or a scorpion sting. 
abudawud29_938880	 حدثنا أحمد بن صالح وابن السرح قال أحمد حدثنا ابن وهب وقال ابن السرح أخبرنا ابن وهب حدثنا داود بن عبد الرحمن عن عمرو بن يحيى عن يوسف بن محمد وقال ابن صالح محمد بن	عن يوسف بن ثابت بن قيس بن شماس عن أبيه عن جده عن رسول الله صلى الله عليه وسلم أنه دخل على ثابت بن قيس قال أحمد وهو مريض فقال اكشف الباس رب الناس عن ثابت بن قيس ثم أخذ ترابا من بطحان فجعله في قدح ثم نفث عليه بماء وصبه عليه قال أبو داود قال ابن السرح يوسف بن محمد وهو الصواب 	 حدثنا أحمد بن صالح وابن السرح قال أحمد حدثنا ابن وهب وقال ابن السرح أخبرنا ابن وهب حدثنا داود بن عبد الرحمن عن عمرو بن يحيى عن يوسف بن محمد وقال ابن صالح محمد بن يوسف بن ثابت بن قيس بن شماس عن أبيه عن جده عن رسول الله صلى الله عليه وسلم أنه دخل على ثابت بن قيس قال أحمد وهو مريض فقال اكشف الباس رب الناس عن ثابت بن قيس ثم أخذ ترابا من بطحان فجعله في قدح ثم نفث عليه بماء وصبه عليه قال أبو داود قال ابن السرح يوسف بن محمد وهو الصواب 	 Narrated Thabit ibn Qays ibn Shammas: The Messenger of Allah (SL3M) entered upon Thabit ibn Qays. The version of Ahmad (ibn Salih) has: When he was ill He (the Prophet) said: Remove the harm, O Lord of men, from Thabit ibn Qays ibn Shammas. He then took some dust of Bathan, and put it in a bowel, and then mixed it with water and blew in it, and poured it on him. Abu Dawud said: Ibn al-Sarh said: Yusuf bin Muhammad is correct (and not Muhammad bin Yusuf) 
abudawud29_938890	 حدثنا أحمد بن صالح حدثنا ابن وهب أخبرني معاوية عن عبد الرحمن بن جبير عن أبيه عن عوف بن	عن مالك قال كنا نرقي في الجاهلية فقلنا يا رسول الله كيف ترى في ذلك فقال اعرضوا على رقاكم لا بأس بالرقى ما لم تكن شركا 	 حدثنا أحمد بن صالح حدثنا ابن وهب أخبرني معاوية عن عبد الرحمن بن جبير عن أبيه عن عوف بن مالك قال كنا نرقي في الجاهلية فقلنا يا رسول الله كيف ترى في ذلك فقال اعرضوا على رقاكم لا بأس بالرقى ما لم تكن شركا 	 ‘Awf b. Malik said : In the pre-Islamic period we used to apply spells and we asked: Messenger of Allah ! how do you look upon it ? He replied : Submit your spells to me. There is no harm in spells so long as they involve no polytheism. 
abudawud29_938900	 حدثنا إبراهيم بن مهدي المصيصي حدثنا علي بن مسهر عن عبد العزيز بن عمر بن عبد العزيز عن صالح بن كيسان عن أبي بكر بن سليمان بن	عن أبي حثمة عن الشفاء بنت عبد الله قالت دخل على رسول الله صلى الله عليه وسلم وأنا عند حفصة فقال لي ألا تعلمين هذه رقية النملة كما علمتيها الكتابة 	 حدثنا إبراهيم بن مهدي المصيصي حدثنا علي بن مسهر عن عبد العزيز بن عمر بن عبد العزيز عن صالح بن كيسان عن أبي بكر بن سليمان بن أبي حثمة عن الشفاء بنت عبد الله قالت دخل على رسول الله صلى الله عليه وسلم وأنا عند حفصة فقال لي ألا تعلمين هذه رقية النملة كما علمتيها الكتابة 	 Narrated Ash-Shifa', daughter of Abdullah,: The Messenger of Allah (SL3M) entered when I was with Hafsah, and he said to me: Why do you not teach this one the spell for skin eruptions as you taught her writing. 
abudawud29_938910	 حدثنا مسدد حدثنا عبد الواحد بن زياد حدثنا عثمان بن	حدثنا حكيم حدثتني جدتي الرباب قالت سمعت سهل بن حنيف يقول مررنا بسيل فدخلت فاغتسلت فيه فخرجت محموما فنمي ذلك إلى رسول الله صلى الله عليه وسلم فقال مروا أبا ثابت يتعوذ قالت فقلت يا سيدي والرقى صالحة فقال لا رقية إلا في نفس أو حمة أو لدغة قال أبو داود الحمة من الحيات وما يلسع 	 حدثنا مسدد حدثنا عبد الواحد بن زياد حدثنا عثمان بن حكيم حدثتني جدتي الرباب قالت سمعت سهل بن حنيف يقول مررنا بسيل فدخلت فاغتسلت فيه فخرجت محموما فنمي ذلك إلى رسول الله صلى الله عليه وسلم فقال مروا أبا ثابت يتعوذ قالت فقلت يا سيدي والرقى صالحة فقال لا رقية إلا في نفس أو حمة أو لدغة قال أبو داود الحمة من الحيات وما يلسع 	 Narrated Sahl ibn Hunayf: I passed by a river. I entered it and took a bath in it. When I came out, I had fever. The Messenger of Allah (SL3M) was informed about it. He said: Ask AbuThabit to seek refuge in Allah from that I asked: O my Lord, will the spell be useful? He replied: No, the spell is to be used except for the evil eye or a snake bite or a scorpion sting. Abu Dawud said: Humah means the biting of snakes and sting of the poisonous insects. 
abudawud29_938920	 حدثنا سليمان بن داود حدثنا شريك ح وحدثنا العباس العنبري حدثنا يزيد بن	حدثنا هارون أخبرنا شريك عن العباس بن ذريح عن الشعبي قال العباس عن أنس قال قال رسول الله صلى الله عليه وسلم لا رقية إلا من عين أو حمة أو دم يرقأ لم يذكر العباس العين وهذا لفظ سليمان بن داود 	 حدثنا سليمان بن داود حدثنا شريك ح وحدثنا العباس العنبري حدثنا يزيد بن هارون أخبرنا شريك عن العباس بن ذريح عن الشعبي قال العباس عن أنس قال قال رسول الله صلى الله عليه وسلم لا رقية إلا من عين أو حمة أو دم يرقأ لم يذكر العباس العين وهذا لفظ سليمان بن داود 	 Anas reported the Prophet (SL3M) as saying : No spell is to be used except for the evil eye, or sting of poisonous insects, or bleeding. The narrator al-‘Abhas did mention the words “evil eye”. The is the version of Sulaiman b. Dawud. 
abudawud29_938930	 حدثنا مسدد حدثنا عبد الوارث عن عبد العزيز بن	حدثنا صهيب قال قال أنس يعني لثابت ألا أرقيك برقية رسول الله قال بلى قال فقال اللهم رب الناس مذهب الباس اشف أنت الشافي لا شافي إلا أنت اشفه شفاء لا يغادر سقما 	 حدثنا مسدد حدثنا عبد الوارث عن عبد العزيز بن صهيب قال قال أنس يعني لثابت ألا أرقيك برقية رسول الله قال بلى قال فقال اللهم رب الناس مذهب الباس اشف أنت الشافي لا شافي إلا أنت اشفه شفاء لا يغادر سقما 	 Anas said to Thabit : Should I not use the spell of the Messenger of Allah (SL3M) for you ? He said : Yes. He then said : O Allah, Lord of men, Remover of the harm, heal, Thou art the healer. There is no healer but Thou; given him a remedy which leaves no disease behind. 
abudawud29_938940	 حدثنا عبد الله القعنبي عن مالك عن يزيد بن	حدثنا خصيفة أن عمرو بن عبد الله بن كعب السلمي أخبره أن نافع بن جبير أخبره عن عثمان بن أبي العاص أنه أتى النبي صلى الله عليه وسلم قال عثمان وبي وجع قد كاد يهلكني قال فقال رسول الله صلى الله عليه وسلم امسحه بيمينك سبع مرات وقل أعوذ بعزة الله وقدرته من شر ما أجد قال ففعلت ذلك فأذهب الله عز وجل ما كان بي فلم أزل آمر به أهلي وغيرهم 	 حدثنا عبد الله القعنبي عن مالك عن يزيد بن خصيفة أن عمرو بن عبد الله بن كعب السلمي أخبره أن نافع بن جبير أخبره عن عثمان بن أبي العاص أنه أتى النبي صلى الله عليه وسلم قال عثمان وبي وجع قد كاد يهلكني قال فقال رسول الله صلى الله عليه وسلم امسحه بيمينك سبع مرات وقل أعوذ بعزة الله وقدرته من شر ما أجد قال ففعلت ذلك فأذهب الله عز وجل ما كان بي فلم أزل آمر به أهلي وغيرهم 	 ‘Uthman b. Abl al-As said that he came to the Messenger of Allah (SL3M). ‘Uthman said : I had a pain which was about to destroy me. So the Prophet (SL3M) said : Wipe it with your right hand seven times and say : “I seek refuge in the dominance of Allah, and His might from the evil of what I find.” Then I did it. Allah removed (the pain) that I had, and I kept on suggesting it to my family and to others. 
abudawud29_938950	 حدثنا يزيد بن خالد بن موهب الرملي حدثنا الليث عن زياد بن محمد عن محمد بن كعب القرظي عن فضالة بن عبيد عن	عن أبي الدرداء قال سمعت رسول الله صلى الله عليه وسلم يقول من اشتكى منكم شيئا أو اشتكاه أخ له فليقل ربنا الله الذي في السماء تقدس اسمك أمرك في السماء والأرض كما رحمتك في السماء فاجعل رحمتك في الأرض اغفر لنا حوبنا وخطايانا أنت رب الطيبين أنزل رحمة من رحمتك وشفاء من شفائك على هذا الوجع فيبرأ 	 حدثنا يزيد بن خالد بن موهب الرملي حدثنا الليث عن زياد بن محمد عن محمد بن كعب القرظي عن فضالة بن عبيد عن أبي الدرداء قال سمعت رسول الله صلى الله عليه وسلم يقول من اشتكى منكم شيئا أو اشتكاه أخ له فليقل ربنا الله الذي في السماء تقدس اسمك أمرك في السماء والأرض كما رحمتك في السماء فاجعل رحمتك في الأرض اغفر لنا حوبنا وخطايانا أنت رب الطيبين أنزل رحمة من رحمتك وشفاء من شفائك على هذا الوجع فيبرأ 	 Narrated AbudDarda': I heard the Messenger of Allah (SL3M) say: If any of you is suffering from anything or his brother is suffering, he should say: Our Lord is Allah Who is in the heaven, holy is Thy name, Thy command reigns supreme in the heaven and the earth, as Thy mercy in the heaven, make Thy mercy in the earth; forgive us our sins, and our errors; Thou art the Lord of good men; send down mercy from Thy mercy, and remedy, and remedy from Thy remedy on this pain so that it is healed up. 
abudawud29_938960	 حدثنا موسى بن إسماعيل حدثنا حماد عن محمد بن	حدثنا إسحاق عن عمرو بن شعيب عن أبيه عن جده أن رسول الله صلى الله عليه وسلم كان يعلمهم من الفزع كلمات أعوذ بكلمات الله التامة من غضبه وشر عباده ومن همزات الشياطين وأن يحضرون وكان عبد الله بن عمرو يعلمهن من عقل من بنيه ومن لم يعقل كتبه فأعلقه عليه 	 حدثنا موسى بن إسماعيل حدثنا حماد عن محمد بن إسحاق عن عمرو بن شعيب عن أبيه عن جده أن رسول الله صلى الله عليه وسلم كان يعلمهم من الفزع كلمات أعوذ بكلمات الله التامة من غضبه وشر عباده ومن همزات الشياطين وأن يحضرون وكان عبد الله بن عمرو يعلمهن من عقل من بنيه ومن لم يعقل كتبه فأعلقه عليه 	 Narrated Abdullah ibn Amr ibn al-'As: The Messenger of Allah (SL3M) sued to teach them the following words in the case of alarm: I seek refuge in Allah's perfect words from His anger, the evil of His servants, the evil suggestions of the devils and their presence. Abdullah ibn Amr used to teach them to those of his children who had reached puberty, and he wrote them down (on some material) and hung on the child who had not reached puberty. 
abudawud29_938970	 حدثنا أحمد بن أبي سريج الرازي أخبرنا مكي بن	حدثنا إبراهيم حدثنا يزيد بن أبي عبيد قال رأيت أثر ضربة في ساق سلمة فقلت ما هذه قال أصابتني يوم خيبر فقال الناس أصيب سلمة فأتي بي رسول الله صلى الله عليه وسلم فنفث في ثلاث نفثات فما اشتكيتها حتى الساعة 	 حدثنا أحمد بن أبي سريج الرازي أخبرنا مكي بن إبراهيم حدثنا يزيد بن أبي عبيد قال رأيت أثر ضربة في ساق سلمة فقلت ما هذه قال أصابتني يوم خيبر فقال الناس أصيب سلمة فأتي بي رسول الله صلى الله عليه وسلم فنفث في ثلاث نفثات فما اشتكيتها حتى الساعة 	 Yazid b. Abi ‘Ubaid said : I saw a sign of injury in the shin of Salamah. I asked : What is this ? He replied : I was afflicted. I was afflicted by it on the day of Khaibar. The people said : Salamah has been afflicted. I was then brought to the Prophet (SL3M). He blew on me three times. I did not feel any pain up till now. 
abudawud29_938980	 حدثنا زهير بن حرب وعثمان بن أبي شيبة قالا حدثنا سفيان بن عيينة عن عبد ربه يعني ابن سعيد عن عمرة عن	عن عائشة قالت كان النبي صلى الله عليه وسلم يقول للإنسان إذا اشتكى يقول بريقه ثم قال به في التراب تربة أرضنا بريقة بعضنا يشفى سقيمنا بإذن ربنا 	 حدثنا زهير بن حرب وعثمان بن أبي شيبة قالا حدثنا سفيان بن عيينة عن عبد ربه يعني ابن سعيد عن عمرة عن عائشة قالت كان النبي صلى الله عليه وسلم يقول للإنسان إذا اشتكى يقول بريقه ثم قال به في التراب تربة أرضنا بريقة بعضنا يشفى سقيمنا بإذن ربنا 	 ‘A’ishah said : When a man complained of pain the Prophet (SL3M) said to him pointing to his saliva and mixing it with dust :(This is) the dust of our earth, mixed with saliva of us, so that our sick is remedied with the permission of our lord. 
