abudawud25_935940	 حدثنا عبد الله بن محمد النفيلي حدثنا محمد بن	حدثنا سلمة عن محمد بن إسحاق عن داود بن الحصين عن عكرمة عن ابن عباس قال لما نزلت هذه الآية { فإن جاءوك فاحكم بينهم أو أعرض عنهم } { وإن حكمت فاحكم بينهم بالقسط } الآية قال كان بنو النضير إذا قتلوا من بني قريظة أدوا نصف الدية وإذا قتل بنو قريظة من بني النضير أدوا إليهم الدية كاملة فسوى رسول الله صلى الله عليه وسلم بينهم 	 حدثنا عبد الله بن محمد النفيلي حدثنا محمد بن سلمة عن محمد بن إسحاق عن داود بن الحصين عن عكرمة عن ابن عباس قال لما نزلت هذه الآية { فإن جاءوك فاحكم بينهم أو أعرض عنهم } { وإن حكمت فاحكم بينهم بالقسط } الآية قال كان بنو النضير إذا قتلوا من بني قريظة أدوا نصف الدية وإذا قتل بنو قريظة من بني النضير أدوا إليهم الدية كاملة فسوى رسول الله صلى الله عليه وسلم بينهم 	" Narrated Abdullah ibn Abbas: When this verse was revealed: ""If they do come to thee, either judge between them, or decline to interfere....If thou judge, judge in equity between them."" Banu an-Nadir used to pay half blood-money if they killed any-one from Banu Qurayzah. When Banu Qurayzah killed anyone from Banu an-Nadir, they would pay full blood-money. So the Messenger of Allah (SL3M) made it equal between them. "
abudawud25_935950	 حدثنا حفص بن عمر عن شعبة عن أبي عون عن الحارث بن عمرو بن أخي المغيرة بن شعبة عن أناس من أهل حمص من أصحاب معاذ بن	عن جبل أن رسول الله صلى الله عليه وسلم لما أراد أن يبعث معاذا إلى اليمن قال كيف تقضي إذا عرض لك قضاء قال أقضي بكتاب الله قال فإن لم تجد في كتاب الله قال فبسنة رسول الله صلى الله عليه وسلم قال فإن لم تجد في سنة رسول الله صلى الله عليه وسلم ولا في كتاب الله قال أجتهد رأيي ولا آلو فضرب رسول الله صلى الله عليه وسلم صدره وقال الحمد لله الذي وفق رسول رسول الله لما يرضي رسول الله 	 حدثنا حفص بن عمر عن شعبة عن أبي عون عن الحارث بن عمرو بن أخي المغيرة بن شعبة عن أناس من أهل حمص من أصحاب معاذ بن جبل أن رسول الله صلى الله عليه وسلم لما أراد أن يبعث معاذا إلى اليمن قال كيف تقضي إذا عرض لك قضاء قال أقضي بكتاب الله قال فإن لم تجد في كتاب الله قال فبسنة رسول الله صلى الله عليه وسلم قال فإن لم تجد في سنة رسول الله صلى الله عليه وسلم ولا في كتاب الله قال أجتهد رأيي ولا آلو فضرب رسول الله صلى الله عليه وسلم صدره وقال الحمد لله الذي وفق رسول رسول الله لما يرضي رسول الله 	 Some companions of Mu'adh ibn Jabal said: When the Messenger of Allah (SL3M) intended to send Mu'adh ibn Jabal to the Yemen, he asked: How will you judge when the occasion of deciding a case arises? He replied: I shall judge in accordance with Allah's Book. He asked: (What will you do) if you do not find any guidance in Allah's Book? He replied: (I shall act) in accordance with the Sunnah of the Messenger of Allah (SL3M). He asked: (What will you do) if you do not find any guidance in the Sunnah of the Messenger of Allah (SL3M) and in Allah's Book? He replied: I shall do my best to form an opinion and I shall spare no effort. The Messenger of Allah (SL3M) then patted him on the breast and said: Praise be to Allah Who has helped the messenger of the Messenger of Allah to find something which pleases the Messenger of Allah. 
abudawud25_935960	 حدثنا مسدد حدثنا يحيى عن شعبة حدثني أبو عون عن الحارث بن عمرو عن ناس من أصحاب معاذ عن معاذ بن	عن جبل أن رسول الله صلى الله عليه وسلم لما بعثه إلى اليمن فذكر معناه 	 حدثنا مسدد حدثنا يحيى عن شعبة حدثني أبو عون عن الحارث بن عمرو عن ناس من أصحاب معاذ عن معاذ بن جبل أن رسول الله صلى الله عليه وسلم لما بعثه إلى اليمن فذكر معناه 	 Mu'adh bin Jabal said that when the Messenger of Allah (SL3M) sent him to the Yemen... He then narrated the rest of the tradition to the same effect. 
abudawud25_935970	 حدثنا سليمان بن داود المهري أخبرنا ابن وهب أخبرني سليمان بن	أخبرنا بلال ح وحدثنا أحمد بن عبد الواحد الدمشقي حدثنا مروان يعني ابن محمد حدثنا سليمان بن بلال أو عبد العزيز بن محمد شك الشيخ عن كثير بن زيد عن الوليد بن رباح عن أبي هريرة قال قال رسول الله صلى الله عليه وسلم الصلح جائز بين المسلمين زاد أحمد إلا صلحا أحل حراما أو حرم حلالا وزاد سليمان بن داود وقال رسول الله صلى الله عليه وسلم المسلمون على شروطهم 	 حدثنا سليمان بن داود المهري أخبرنا ابن وهب أخبرني سليمان بن بلال ح وحدثنا أحمد بن عبد الواحد الدمشقي حدثنا مروان يعني ابن محمد حدثنا سليمان بن بلال أو عبد العزيز بن محمد شك الشيخ عن كثير بن زيد عن الوليد بن رباح عن أبي هريرة قال قال رسول الله صلى الله عليه وسلم الصلح جائز بين المسلمين زاد أحمد إلا صلحا أحل حراما أو حرم حلالا وزاد سليمان بن داود وقال رسول الله صلى الله عليه وسلم المسلمون على شروطهم 	" Narrated AbuHurayrah: The Prophet (SL3M) said: Conciliation between Muslims is permissible. The narrator Ahmad added in his version: ""except the conciliation which makes lawful unlawful and unlawful lawful."" Sulayman ibn Dawud added: The Messenger of Allah (SL3M) said: Muslims are on (i.e. stick to) their conditions. "
abudawud25_935980	 حدثنا أحمد بن صالح حدثنا ابن وهب أخبرني يونس عن ابن شهاب أخبرني عبد الله بن كعب بن	عن مالك أن كعب بن مالك أخبره أنه تقاضى ابن أبي حدرد دينا كان له عليه في عهد رسول الله صلى الله عليه وسلم في المسجد فارتفعت أصواتهما حتى سمعهما رسول الله صلى الله عليه وسلم وهو في بيته فخرج إليهما رسول الله صلى الله عليه وسلم حتى كشف سجف حجرته ونادى كعب بن مالك فقال يا كعب فقال لبيك يا رسول الله فأشار له بيده أن ضع الشطر من دينك قال كعب قد فعلت يا رسول الله قال النبي صلى الله عليه وسلم قم فاقضه 	 حدثنا أحمد بن صالح حدثنا ابن وهب أخبرني يونس عن ابن شهاب أخبرني عبد الله بن كعب بن مالك أن كعب بن مالك أخبره أنه تقاضى ابن أبي حدرد دينا كان له عليه في عهد رسول الله صلى الله عليه وسلم في المسجد فارتفعت أصواتهما حتى سمعهما رسول الله صلى الله عليه وسلم وهو في بيته فخرج إليهما رسول الله صلى الله عليه وسلم حتى كشف سجف حجرته ونادى كعب بن مالك فقال يا كعب فقال لبيك يا رسول الله فأشار له بيده أن ضع الشطر من دينك قال كعب قد فعلت يا رسول الله قال النبي صلى الله عليه وسلم قم فاقضه 	" Ka'b bin Malik said that in the time of the Messenger of Allah (SL3M) he made demand in the mosque for payment of a debt due to him from Ibn Abi Hadrad, and their voices rose till the Messenger of Allah (SL3M), who was in his house, heard them. The Messenger of Allah (SL3M) then went out to them and, removing the curtain of his apartment, he called to Ka'b bin Malik, addressing: ""Ka'b!"" He said: ""At your service, Messenger of Allah."" Thereupon he made a gesture with is hand indicating: Remit half the debt due to you. Ka'b said: ""I shall do so, Messenger of Allah."" The Prophet (SL3M) then said: ""Get up and discharge"" "
abudawud25_935990	 حدثنا أحمد بن سعيد الهمداني وأحمد بن السرح قالا أخبرنا ابن وهب أخبرني مالك بن أنس عن عبد الله بن أبي بكر أن أباه أخبره أن عبد الله بن عمرو بن عثمان بن	أخبره عفان أخبره أن عبد الرحمن بن أبي عمرة الأنصاري أخبره أن زيد بن خالد الجهني أخبره أن رسول الله صلى الله عليه وسلم قال ألا أخبركم بخير الشهداء الذي يأتي بشهادته أو يخبر بشهادته قبل أن يسألها شك عبد الله بن أبي بكر أيتهما قال قال أبو داود قال مالك الذي يخبر بشهادته ولا يعلم بها الذي هي له قال الهمداني ويرفعها إلى السلطان قال ابن السرح أو يأتي بها الإمام والإخبار في حديث الهمداني قال ابن السرح ابن أبي عمرة لم يقل عبد الرحمن 	 حدثنا أحمد بن سعيد الهمداني وأحمد بن السرح قالا أخبرنا ابن وهب أخبرني مالك بن أنس عن عبد الله بن أبي بكر أن أباه أخبره أن عبد الله بن عمرو بن عثمان بن عفان أخبره أن عبد الرحمن بن أبي عمرة الأنصاري أخبره أن زيد بن خالد الجهني أخبره أن رسول الله صلى الله عليه وسلم قال ألا أخبركم بخير الشهداء الذي يأتي بشهادته أو يخبر بشهادته قبل أن يسألها شك عبد الله بن أبي بكر أيتهما قال قال أبو داود قال مالك الذي يخبر بشهادته ولا يعلم بها الذي هي له قال الهمداني ويرفعها إلى السلطان قال ابن السرح أو يأتي بها الإمام والإخبار في حديث الهمداني قال ابن السرح ابن أبي عمرة لم يقل عبد الرحمن 	" Zaid bin Khalid al-Juhani reported the Messenger of Allah (SL3M) as saying: ""Shall I not tell you of the best witnesses ? He is the one who produces his deposition or gives his evidence (the narrator is doubtful) before he is asked for it."" 'Abd Allah bin Abi Bakr dobted which of them he said. Abu Dawud said: Malis said: This refers to a man gives his evidence, but he does not know for whom it is meant. Al-Hamdani said: ""He should inform the authorities. Ibn al-Sarh said: ""He should give it to the ruler. The work ikhbar (inform) occurs in the version of al-Hamdani."" Ibn al-Sarh said: ""Ibn Abi 'Amrah and not 'Abd al-Rahman."" "
abudawud25_936000	 حدثنا أحمد بن يونس حدثنا زهير حدثنا عمارة بن	حدثنا غزية عن يحيى بن راشد قال جلسنا لعبد الله بن عمر فخرج إلينا فجلس فقال سمعت رسول الله صلى الله عليه وسلم يقول من حالت شفاعته دون حد من حدود الله فقد ضاد الله ومن خاصم في باطل وهو يعلمه لم يزل في سخط الله حتى ينزع عنه ومن قال في مؤمن ما ليس فيه أسكنه الله ردغة الخبال حتى يخرج مما قال 	 حدثنا أحمد بن يونس حدثنا زهير حدثنا عمارة بن غزية عن يحيى بن راشد قال جلسنا لعبد الله بن عمر فخرج إلينا فجلس فقال سمعت رسول الله صلى الله عليه وسلم يقول من حالت شفاعته دون حد من حدود الله فقد ضاد الله ومن خاصم في باطل وهو يعلمه لم يزل في سخط الله حتى ينزع عنه ومن قال في مؤمن ما ليس فيه أسكنه الله ردغة الخبال حتى يخرج مما قال 	 Yahya ibn Rashid said: We were sitting waiting for Abdullah ibn Umar who came out to us and sat. He then said: I heard the Messenger of Allah (SL3M) as saying: If anyone's intercession intervenes as an obstacle to one of the punishments prescribed by Allah, he has opposed Allah; if anyone disputes knowingly about something which is false, he remains in the displeasure of Allah till he desists, and if anyone makes an untruthful accusation against a Muslim, he will be made by Allah to dwell in the corrupt fluid flowing from the inhabitants of Hell till he retracts his statement. 
abudawud25_936010	 حدثنا علي بن الحسين بن إبراهيم حدثنا عمر بن	حدثنا يونس حدثنا عاصم بن محمد بن زيد العمري حدثني المثنى بن يزيد عن مطر الوراق عن نافع عن ابن عمر عن النبي صلى الله عليه وسلم بمعناه قال ومن أعان على خصومة بظلم فقد باء بغضب من الله عز وجل 	 حدثنا علي بن الحسين بن إبراهيم حدثنا عمر بن يونس حدثنا عاصم بن محمد بن زيد العمري حدثني المثنى بن يزيد عن مطر الوراق عن نافع عن ابن عمر عن النبي صلى الله عليه وسلم بمعناه قال ومن أعان على خصومة بظلم فقد باء بغضب من الله عز وجل 	" The tradition mentioned above has also been transmitted by Ibn 'Umar from the Prophet (SL3M) through different chain of narrators to the same effect. In this version he also said: ""He who assits in a dispute unjustly deserves the anger of Allah, Most High. "
abudawud25_936020	 حدثنا يحيى بن موسى البلخي حدثنا محمد بن عبيد حدثني سفيان يعني العصفري عن أبيه عن حبيب بن	حدثني النعمان الأسدي عن خريم بن فاتك قال صلى رسول الله صلى الله عليه وسلم صلاة الصبح فلما انصرف قام قائما فقال عدلت شهادة الزور بالإشراك بالله ثلاث مرار ثم قرأ { فاجتنبوا الرجس من الأوثان واجتنبوا قول الزور * حنفاء لله غير مشركين به } 	 حدثنا يحيى بن موسى البلخي حدثنا محمد بن عبيد حدثني سفيان يعني العصفري عن أبيه عن حبيب بن النعمان الأسدي عن خريم بن فاتك قال صلى رسول الله صلى الله عليه وسلم صلاة الصبح فلما انصرف قام قائما فقال عدلت شهادة الزور بالإشراك بالله ثلاث مرار ثم قرأ { فاجتنبوا الرجس من الأوثان واجتنبوا قول الزور * حنفاء لله غير مشركين به } 	" Narrated Khuraym Ibn Fatik: The Messenger of Allah (SL3M) offered the morning prayer. When he finished it, he stood up and said three times: False witness has been made equivalent to attributing a partner to Allah. He then recited: ""So avoid the abomination of idols and avoid speaking falsehood as people pure of faith to Allah, not associating anything with Him. "
abudawud25_936030	 حدثنا حفص بن عمر حدثنا محمد بن راشد حدثنا سليمان بن موسى عن عمرو بن شعيب عن أبيه عن	عن جده أن رسول الله صلى الله عليه وسلم رد شهادة الخائن والخائنة وذي الغمر على أخيه ورد شهادة القانع لأهل البيت وأجازها لغيرهم قال أبو داود الغمر الحنة والشحناء والقانع الأجير التابع مثل الأجير الخاص 	 حدثنا حفص بن عمر حدثنا محمد بن راشد حدثنا سليمان بن موسى عن عمرو بن شعيب عن أبيه عن جده أن رسول الله صلى الله عليه وسلم رد شهادة الخائن والخائنة وذي الغمر على أخيه ورد شهادة القانع لأهل البيت وأجازها لغيرهم قال أبو داود الغمر الحنة والشحناء والقانع الأجير التابع مثل الأجير الخاص 	 'Amr bin Shu'aib on his father's authority told that his grandfather said: The Messenger of Allah (SL3M) rejected the testimony of a deceitful man and woman, of one who harbours rancour against his brother, and he rejected the testimony of one who is dependent on a family, and he allowed his testimony for other. Abu Dawud said: Ghimr means malice and enimity ; qani (dependant), a subordinate servant like a special servant. 
abudawud25_936040	 حدثنا محمد بن خلف بن طارق الرازي حدثنا زيد بن	حدثنا يحيى بن عبيد الخزاعي حدثنا سعيد بن عبد العزيز عن سليمان بن موسى بإسناده قال قال رسول الله صلى الله عليه وسلم لا تجوز شهادة خائن ولا خائنة ولا زان ولا زانية ولا ذي غمر على أخيه 	 حدثنا محمد بن خلف بن طارق الرازي حدثنا زيد بن يحيى بن عبيد الخزاعي حدثنا سعيد بن عبد العزيز عن سليمان بن موسى بإسناده قال قال رسول الله صلى الله عليه وسلم لا تجوز شهادة خائن ولا خائنة ولا زان ولا زانية ولا ذي غمر على أخيه 	 The tradition mentioned above (No. 3593) has also been transmitted by Sulayman ibn Musa through a different chain of narrators. This version has: The Messenger of Allah (SL3M) said: The testimony of a deceitful man or woman, of an adulterer and adulteress, and of one who harbours rancour against his brother is not allowable. 
abudawud25_936050	 حدثنا أحمد بن سعيد الهمداني أخبرنا ابن وهب أخبرني يحيى بن أيوب ونافع بن	أخبرنا يزيد عن ابن الهاد عن محمد بن عمرو بن عطاء عن عطاء بن يسار عن أبي هريرة أنه سمع رسول الله صلى الله عليه وسلم يقول لا تجوز شهادة بدوي على صاحب قرية 	 حدثنا أحمد بن سعيد الهمداني أخبرنا ابن وهب أخبرني يحيى بن أيوب ونافع بن يزيد عن ابن الهاد عن محمد بن عمرو بن عطاء عن عطاء بن يسار عن أبي هريرة أنه سمع رسول الله صلى الله عليه وسلم يقول لا تجوز شهادة بدوي على صاحب قرية 	 Narrated AbuHurayrah: The Prophet (SL3M) said: The testimony of a nomad Arab against a townsman is not allowable. 
abudawud25_936060	 حدثنا سليمان بن حرب حدثنا حماد بن زيد عن أيوب عن ابن أبي مليكة حدثني عقبة بن	عن الحارث وحدثنيه صاحب لي عنه وأنا لحديث صاحبي أحفظ قال تزوجت أم يحيى بنت أبي إهاب فدخلت علينا امرأة سوداء فزعمت أنها أرضعتنا جميعا فأتيت النبي صلى الله عليه وسلم فذكرت ذلك له فأعرض عني فقلت يا رسول الله إنها لكاذبة قال وما يدريك وقد قالت ما قالت دعها عنك 	 حدثنا سليمان بن حرب حدثنا حماد بن زيد عن أيوب عن ابن أبي مليكة حدثني عقبة بن الحارث وحدثنيه صاحب لي عنه وأنا لحديث صاحبي أحفظ قال تزوجت أم يحيى بنت أبي إهاب فدخلت علينا امرأة سوداء فزعمت أنها أرضعتنا جميعا فأتيت النبي صلى الله عليه وسلم فذكرت ذلك له فأعرض عني فقلت يا رسول الله إنها لكاذبة قال وما يدريك وقد قالت ما قالت دعها عنك 	" 'Uqbah bin al-Harith said: ""I married Umm Yahya daughter of Abu Ihab. A black woman entered upon us. She said that she had suckled both of us. So I came to the Prophet (SL3M), and amentioned it to him. He turned away from me. I said (to him): Messenger of Allah! she is a liar. He said: What do you know? She has said what she has said. Separate yourself from her (wife). "
abudawud25_936070	 حدثنا أحمد بن أبي شعيب الحراني حدثنا الحارث بن	حدثنا عمير البصري ح وحدثنا عثمان بن أبي شيبة حدثنا إسماعيل ابن علية كلاهما عن أيوب عن ابن أبي مليكة عن عبيد بن أبي مريم عن عقبة بن الحارث وقد سمعته من عقبة ولكني لحديث عبيد أحفظ فذكر معناه قال أبو داود نظر حماد بن زيد إلى الحارث بن عمير فقال هذا من ثقات أصحاب أيوب 	 حدثنا أحمد بن أبي شعيب الحراني حدثنا الحارث بن عمير البصري ح وحدثنا عثمان بن أبي شيبة حدثنا إسماعيل ابن علية كلاهما عن أيوب عن ابن أبي مليكة عن عبيد بن أبي مريم عن عقبة بن الحارث وقد سمعته من عقبة ولكني لحديث عبيد أحفظ فذكر معناه قال أبو داود نظر حماد بن زيد إلى الحارث بن عمير فقال هذا من ثقات أصحاب أيوب 	 The tradition mentioned above has also been transmitted by 'Uqbah bin al-Harith to the same effect through a different chain of narrators. Abu Dawud said: Hammad bin Zaid looked at al-Harith bin 'Umair and said: He is from reliable narrators from Ayyub. 
abudawud25_936080	 حدثنا زياد بن أيوب حدثنا هشيم أخبرنا زكريا عن	حدثنا الشعبي أن رجلا من المسلمين حضرته الوفاة بدقوقاء هذه ولم يجد أحدا من المسلمين يشهده على وصيته فأشهد رجلين من أهل الكتاب فقدما الكوفة فأتيا أبا موسى الأشعري فأخبراه وقدما بتركته ووصيته فقال الأشعري هذا أمر لم يكن بعد الذي كان في عهد رسول الله صلى الله عليه وسلم فأحلفهما بعد العصر بالله ما خانا ولا كذبا ولا بدلا ولا كتما ولا غيرا وإنها لوصية الرجل وتركته فأمضى شهادتهما 	 حدثنا زياد بن أيوب حدثنا هشيم أخبرنا زكريا عن الشعبي أن رجلا من المسلمين حضرته الوفاة بدقوقاء هذه ولم يجد أحدا من المسلمين يشهده على وصيته فأشهد رجلين من أهل الكتاب فقدما الكوفة فأتيا أبا موسى الأشعري فأخبراه وقدما بتركته ووصيته فقال الأشعري هذا أمر لم يكن بعد الذي كان في عهد رسول الله صلى الله عليه وسلم فأحلفهما بعد العصر بالله ما خانا ولا كذبا ولا بدلا ولا كتما ولا غيرا وإنها لوصية الرجل وتركته فأمضى شهادتهما 	 Ash-Sha'bi said: A Muslim was about to die at Daquqa', but he did not find any Muslim to call him for witness to his will. So he called two men of the people of the Book for witness. Then they came to Kufah, and approaching AbuMusa al-Ash'ari they informed him (about his) will. They brought his inheritance and will. Al-Ash'ari said: This is an incident (like) which happened in the time of the Messenger of Allah (SL3M) and never occurred after him. So he made them to swear by Allah after the afternoon prayer to the effect that they had not misappropriated, nor told a lie, nor changed, nor concealed, nor altered, and that it was the will of the man and his inheritance. He then executed their witness. 
