abudawud11_918920	 حدثنا محمد بن سليمان الأنباري حدثنا يحيى بن سليم عن ابن خثيم عن أبي الطفيل عن	عن ابن عباس أن النبي صلى الله عليه وسلم اضطبع فاستلم وكبر ثم رمل ثلاثة أطواف وكانوا إذا بلغوا الركن اليماني وتغيبوا من قريش مشوا ثم يطلعون عليهم يرملون تقول قريش كأنهم الغزلان قال ابن عباس فكانت سنة 	 حدثنا محمد بن سليمان الأنباري حدثنا يحيى بن سليم عن ابن خثيم عن أبي الطفيل عن ابن عباس أن النبي صلى الله عليه وسلم اضطبع فاستلم وكبر ثم رمل ثلاثة أطواف وكانوا إذا بلغوا الركن اليماني وتغيبوا من قريش مشوا ثم يطلعون عليهم يرملون تقول قريش كأنهم الغزلان قال ابن عباس فكانت سنة 	" Narrated Abdullah ibn Abbas: The Prophet (SL3M) wore the mantle under his right armpit with the end over his left shoulder, and touched the corner (Black Stone), then uttered ""Allah is most great"" and walked proudly in three circuits of circumambulation. When they (the Companions) reached the Yamani corner, and disappeared from the eyes of the Quraysh, they walked as usual; When they appeared before them, they walked proudly with rapid strides. Thereupon the Quraysh said: They look to be the deer (that are jumping). Ibn Abbas said: Hence this became the sunnah (model behaviour of the Prophet). "
abudawud11_918930	 حدثنا موسى بن إسماعيل حدثنا حماد أخبرنا عبد الله بن	حدثنا عثمان بن خثيم عن أبي الطفيل عن ابن عباس أن رسول الله صلى الله عليه وسلم وأصحابه اعتمروا من الجعرانة فرملوا بالبيت ثلاثا ومشوا أربعا 	 حدثنا موسى بن إسماعيل حدثنا حماد أخبرنا عبد الله بن عثمان بن خثيم عن أبي الطفيل عن ابن عباس أن رسول الله صلى الله عليه وسلم وأصحابه اعتمروا من الجعرانة فرملوا بالبيت ثلاثا ومشوا أربعا 	 Narrated Abdullah ibn Abbas: The Messenger of Allah (SL3M) and his Companions performed umrah from al-Ji'ranah and walked proudly with rapid strides round the House (the Ka'bah) in three circuits and walked as usual in four circuits. 
abudawud11_918940	 حدثنا أبو كامل حدثنا سليم بن أخضر حدثنا عبيد الله عن	حدثنا نافع أن ابن عمر رمل من الحجر إلى الحجر وذكر أن رسول الله صلى الله عليه وسلم فعل ذلك 	 حدثنا أبو كامل حدثنا سليم بن أخضر حدثنا عبيد الله عن نافع أن ابن عمر رمل من الحجر إلى الحجر وذكر أن رسول الله صلى الله عليه وسلم فعل ذلك 	 Nafi’ said Ibn ‘Umar walked proudly (ramal) from the corner (Black Stone) to the corner (Black Stone) and mentioned that the Apostle of Allaah (SL3M) had done so. 
abudawud11_918950	 حدثنا مسدد حدثنا عيسى بن يونس حدثنا ابن جريج عن يحيى بن عبيد عن أبيه عن عبد الله بن	عن السائب قال سمعت رسول الله صلى الله عليه وسلم يقول ما بين الركنين { ربنا آتنا في الدنيا حسنة وفي الآخرة حسنة وقنا عذاب النار } 	 حدثنا مسدد حدثنا عيسى بن يونس حدثنا ابن جريج عن يحيى بن عبيد عن أبيه عن عبد الله بن السائب قال سمعت رسول الله صلى الله عليه وسلم يقول ما بين الركنين { ربنا آتنا في الدنيا حسنة وفي الآخرة حسنة وقنا عذاب النار } 	 Narrated Abdullah ibn as-Sa'ib: I heard the Messenger of Allah (SL3M) say between the two corners: O Allah, bring us a blessing in this world and a blessing in the next and guard us from punishment of Hell. 
abudawud11_918960	 حدثنا قتيبة بن سعيد حدثنا يعقوب عن موسى بن	حدثنا عقبة عن نافع عن ابن عمر أن رسول الله صلى الله عليه وسلم كان إذا طاف في الحج والعمرة أول ما يقدم فإنه يسعى ثلاثة أطواف ويمشي أربعا ثم يصلي سجدتين 	 حدثنا قتيبة بن سعيد حدثنا يعقوب عن موسى بن عقبة عن نافع عن ابن عمر أن رسول الله صلى الله عليه وسلم كان إذا طاف في الحج والعمرة أول ما يقدم فإنه يسعى ثلاثة أطواف ويمشي أربعا ثم يصلي سجدتين 	 Ibn ‘Umar said When the Apostle of Allaah(SL3M) observed the circumambulation at hajj and ‘Umrah on his arrival, he ran three circuits and walked four, then he made two prostrations. 
abudawud11_918970	 حدثنا ابن السرح والفضل بن يعقوب وهذا لفظه قالا حدثنا سفيان عن أبي الزبير عن عبد الله بن	حدثنا باباه عن جبير بن مطعم يبلغ به النبي صلى الله عليه وسلم قال لا تمنعوا أحدا يطوف بهذا البيت ويصلي أى ساعة شاء من ليل أو نهار قال الفضل إن رسول الله صلى الله عليه وسلم قال يا بني عبد مناف لا تمنعوا أحدا 	 حدثنا ابن السرح والفضل بن يعقوب وهذا لفظه قالا حدثنا سفيان عن أبي الزبير عن عبد الله بن باباه عن جبير بن مطعم يبلغ به النبي صلى الله عليه وسلم قال لا تمنعوا أحدا يطوف بهذا البيت ويصلي أى ساعة شاء من ليل أو نهار قال الفضل إن رسول الله صلى الله عليه وسلم قال يا بني عبد مناف لا تمنعوا أحدا 	 Narrated Jubayr ibn Mut'im: The Prophet (SL3M) said: Do not prevent anyone from going round this House (the Ka'bah) and from praying any moment he desires by day or by night. The narrator Fadl (ibn Ya'qub) said: The Messenger of Allah (SL3M) said: Banu Abdu Munaf, do not stop anyone. 
abudawud11_918980	 حدثنا ابن حنبل حدثنا يحيى عن	حدثنا ابن جريج قال أخبرني أبو الزبير قال سمعت جابر بن عبد الله يقول لم يطف النبي صلى الله عليه وسلم ولا أصحابه بين الصفا والمروة إلا طوافا واحدا طوافه الأول 	 حدثنا ابن حنبل حدثنا يحيى عن ابن جريج قال أخبرني أبو الزبير قال سمعت جابر بن عبد الله يقول لم يطف النبي صلى الله عليه وسلم ولا أصحابه بين الصفا والمروة إلا طوافا واحدا طوافه الأول 	 Jabir bin ‘Abdallah said “Neither the Prophet (SL3M) nor his Companions ran between Al Safa’ and Al Marwah except once and that was his first running.” 
abudawud11_918990	 حدثنا قتيبة بن سعيد حدثنا مالك بن أنس عن ابن شهاب عن عروة عن	عن عائشة أن أصحاب رسول الله صلى الله عليه وسلم الذين كانوا معه لم يطوفوا حتى رموا الجمرة 	 حدثنا قتيبة بن سعيد حدثنا مالك بن أنس عن ابن شهاب عن عروة عن عائشة أن أصحاب رسول الله صلى الله عليه وسلم الذين كانوا معه لم يطوفوا حتى رموا الجمرة 	 Narrated Aisha, Ummul Mu'minin: The Companions of the Messenger of Allah (SL3M) who accompanied him did not go round the Ka'bah till they threw pebbles at the Jamrah (pillar at Mina). 
abudawud11_919000	 حدثنا الربيع بن سليمان المؤذن أخبرني الشافعي عن ابن عيينة عن ابن أبي نجيح عن عطاء عن	عن عائشة أن النبي صلى الله عليه وسلم قال لها طوافك بالبيت وبين الصفا والمروة يكفيك لحجتك وعمرتك قال الشافعي كان سفيان ربما قال عن عطاء عن عائشة وربما قال عن عطاء أن النبي صلى الله عليه وسلم قال لعائشة رضى الله عنها 	 حدثنا الربيع بن سليمان المؤذن أخبرني الشافعي عن ابن عيينة عن ابن أبي نجيح عن عطاء عن عائشة أن النبي صلى الله عليه وسلم قال لها طوافك بالبيت وبين الصفا والمروة يكفيك لحجتك وعمرتك قال الشافعي كان سفيان ربما قال عن عطاء عن عائشة وربما قال عن عطاء أن النبي صلى الله عليه وسلم قال لعائشة رضى الله عنها 	 ‘Ata said The Prophet (SL3M) said to A’ishah Your observance of circumambulation of the Ka’bah and your running between Al Safa’ and al Marwah (only once) are sufficient for your Hajj and your ‘Umrah. Al Shafi’i said The narrator Sufyan has transmitted this tradition from ‘Ata on the authority of A’ishah and also narrated it on the authority of ‘Ata stating that the Prophet (SL3M) said to A’ishah(may Allah be pleased with her). 
abudawud11_919010	 حدثنا عثمان بن أبي شيبة حدثنا جرير بن	حدثنا عبد الحميد عن يزيد بن أبي زياد عن مجاهد عن عبد الرحمن بن صفوان قال لما فتح رسول الله صلى الله عليه وسلم مكة قلت لألبسن ثيابي وكانت داري على الطريق فلأنظرن كيف يصنع رسول الله صلى الله عليه وسلم فانطلقت فرأيت النبي صلى الله عليه وسلم قد خرج من الكعبة هو وأصحابه وقد استلموا البيت من الباب إلى الحطيم وقد وضعوا خدودهم على البيت ورسول الله صلى الله عليه وسلم وسطهم 	 حدثنا عثمان بن أبي شيبة حدثنا جرير بن عبد الحميد عن يزيد بن أبي زياد عن مجاهد عن عبد الرحمن بن صفوان قال لما فتح رسول الله صلى الله عليه وسلم مكة قلت لألبسن ثيابي وكانت داري على الطريق فلأنظرن كيف يصنع رسول الله صلى الله عليه وسلم فانطلقت فرأيت النبي صلى الله عليه وسلم قد خرج من الكعبة هو وأصحابه وقد استلموا البيت من الباب إلى الحطيم وقد وضعوا خدودهم على البيت ورسول الله صلى الله عليه وسلم وسطهم 	 Narrated AbdurRahman ibn Safwan: When the Messenger of Allah (SL3M) conquered Mecca, I said (to myself): I shall put on my clothes, and my house lay on the way, I shall watch how the Messenger of Allah (SL3M) behaves. So I went out. I saw that the Prophet (SL3M) and his Companions had come out from the Ka'bah and embraced the House (the Ka'bah) from its entrance (al-Bab) to al-Hatim. They placed their cheek on the House (the Ka'bah) while the Messenger of Allah (SL3M) was amongst them. 
abudawud11_919020	 حدثنا مسدد حدثنا عيسى بن يونس حدثنا المثنى بن	حدثنا الصباح عن عمرو بن شعيب عن أبيه قال طفت مع عبد الله فلما جئنا دبر الكعبة قلت ألا تتعوذ قال نعوذ بالله من النار ثم مضى حتى استلم الحجر وأقام بين الركن والباب فوضع صدره ووجهه وذراعيه وكفيه هكذا وبسطهما بسطا ثم قال هكذا رأيت رسول الله صلى الله عليه وسلم يفعله 	 حدثنا مسدد حدثنا عيسى بن يونس حدثنا المثنى بن الصباح عن عمرو بن شعيب عن أبيه قال طفت مع عبد الله فلما جئنا دبر الكعبة قلت ألا تتعوذ قال نعوذ بالله من النار ثم مضى حتى استلم الحجر وأقام بين الركن والباب فوضع صدره ووجهه وذراعيه وكفيه هكذا وبسطهما بسطا ثم قال هكذا رأيت رسول الله صلى الله عليه وسلم يفعله 	 Amr b. Shu'aib reported on the authority of his father: I went round the Ka'bah along with Abdullah ibn Amr. When we came behind the Ka'bah I asked: Do you not seek refuge? He uttered the words: I seek refuge in Allah from the Hell-fire. He then went (farther) and touched the Black Stone, and stood between the corner (Black Stone) and the entrance of the Ka'bah. He then placed his breast, his face, his hands and his palms in this manner, and he spread them, and said: I saw the apostle of Allah (SL3M) doing like this. 
abudawud11_919030	 حدثنا عبيد الله بن عمر بن ميسرة حدثنا يحيى بن	حدثنا سعيد حدثنا السائب بن عمر المخزومي حدثني محمد بن عبد الله بن السائب عن أبيه أنه كان يقود ابن عباس فيقيمه عند الشقة الثالثة مما يلي الركن الذي يلي الحجر مما يلي الباب فيقول له ابن عباس أنبئت أن رسول الله صلى الله عليه وسلم كان يصلي ها هنا فيقول نعم فيقوم فيصلي 	 حدثنا عبيد الله بن عمر بن ميسرة حدثنا يحيى بن سعيد حدثنا السائب بن عمر المخزومي حدثني محمد بن عبد الله بن السائب عن أبيه أنه كان يقود ابن عباس فيقيمه عند الشقة الثالثة مما يلي الركن الذي يلي الحجر مما يلي الباب فيقول له ابن عباس أنبئت أن رسول الله صلى الله عليه وسلم كان يصلي ها هنا فيقول نعم فيقوم فيصلي 	 Abdullah ibn as-Sa'ib reported on the authority of his father as-Sa'ib that he used to lead Ibn Abbas (when he become blind) and make him stand in the third corner that was adjacent to the corner (Black Stone) near the entrance of the Ka'bah. Ibn Abbas used to say: Has it been reported to you that the Messenger of Allah (SL3M) would pray in this place. He would reply: Yes. He then used to stand (there) and pray. 
abudawud11_919040	 حدثنا القعنبي عن مالك عن هشام بن	حدثنا عروة ح وحدثنا ابن السرح حدثنا ابن وهب عن مالك عن هشام بن عروة عن أبيه أنه قال قلت لعائشة زوج النبي صلى الله عليه وسلم وأنا يومئذ حديث السن أرأيت قول الله تعالى { إن الصفا والمروة من شعائر الله } فما أرى على أحد شيئا أن لا يطوف بهما قالت عائشة كلا لو كان كما تقول كانت فلا جناح عليه أن لا يطوف بهما إنما أنزلت هذه الآية في الأنصار كانوا يهلون لمناة وكانت مناة حذو قديد وكانوا يتحرجون أن يطوفوا بين الصفا والمروة فلما جاء الإسلام سألوا رسول الله صلى الله عليه وسلم عن ذلك فأنزل الله تعالى { إن الصفا والمروة من شعائر الله } 	 حدثنا القعنبي عن مالك عن هشام بن عروة ح وحدثنا ابن السرح حدثنا ابن وهب عن مالك عن هشام بن عروة عن أبيه أنه قال قلت لعائشة زوج النبي صلى الله عليه وسلم وأنا يومئذ حديث السن أرأيت قول الله تعالى { إن الصفا والمروة من شعائر الله } فما أرى على أحد شيئا أن لا يطوف بهما قالت عائشة كلا لو كان كما تقول كانت فلا جناح عليه أن لا يطوف بهما إنما أنزلت هذه الآية في الأنصار كانوا يهلون لمناة وكانت مناة حذو قديد وكانوا يتحرجون أن يطوفوا بين الصفا والمروة فلما جاء الإسلام سألوا رسول الله صلى الله عليه وسلم عن ذلك فأنزل الله تعالى { إن الصفا والمروة من شعائر الله } 	 ‘Urwa bin Al Zubair said I said to A’ishah, wife of the Prophet(SL3M) while I was a boy. What do you think about the pronouncement of Allaah, the Exalted “Lo! (The Mountains) Al Safa’ and Al Marwah are among the indications of Allaah. “I think there is no harm for anyone if he does not run between them. A’ishah(may Allah be pleased with her) said Nay, had it been so as you said, it would have been thus. It is no sin on him not to go around them. This verse was revealed about the Ansaar, they used to perform hajj for Manat. Manat was erected in front of Qudaid. Hence they used to avoid going around Al Safa and Al Marwah. When Islam came, they asked the Apostle of Allaah(SL3M) about it. Allaah, the Exalted therefore revealed the verse “Lo! (The Mountains) Al Safa’ and Al Marwah are among the indications of Allaah. 
abudawud11_919050	 حدثنا مسدد حدثنا خالد بن عبد الله حدثنا إسماعيل بن	حدثنا أبي خالد عن عبد الله بن أبي أوفى أن رسول الله صلى الله عليه وسلم اعتمر فطاف بالبيت وصلى خلف المقام ركعتين ومعه من يستره من الناس فقيل لعبد الله أدخل رسول الله صلى الله عليه وسلم الكعبة قال لا 	 حدثنا مسدد حدثنا خالد بن عبد الله حدثنا إسماعيل بن أبي خالد عن عبد الله بن أبي أوفى أن رسول الله صلى الله عليه وسلم اعتمر فطاف بالبيت وصلى خلف المقام ركعتين ومعه من يستره من الناس فقيل لعبد الله أدخل رسول الله صلى الله عليه وسلم الكعبة قال لا 	 ‘Abd Allaah bin Abi Aufa said the Apostle of Allaah(SL3M) performed ‘Umrah and went round the House(the Ka’bah) and prayed behind the station (Maqam Ibrahim) two rak’ahs and he was accompanied by so many people that he was hidden by them. ‘Abd Allaah bin Abi Aufa was asked Did the Apostle of Allaah(SL3M) enter the Ka’bah ? He replied “No”. 
abudawud11_919060	 حدثنا تميم بن المنتصر أخبرنا إسحاق بن يوسف أخبرنا شريك عن إسماعيل بن	أخبرنا أبي خالد قال سمعت عبد الله بن أبي أوفى بهذا الحديث زاد ثم أتى الصفا والمروة فسعى بينهما سبعا ثم حلق رأسه 	 حدثنا تميم بن المنتصر أخبرنا إسحاق بن يوسف أخبرنا شريك عن إسماعيل بن أبي خالد قال سمعت عبد الله بن أبي أوفى بهذا الحديث زاد ثم أتى الصفا والمروة فسعى بينهما سبعا ثم حلق رأسه 	 Isma’il bin Abi Khalid said I heard ‘Abd Allaah bin Abi Aufa narrated this tradition. His version added “He then came to Al Safa’ and Al Marwah and ran between them seven times and then shaved his head. 
abudawud11_919070	 حدثنا النفيلي حدثنا زهير حدثنا عطاء بن السائب عن كثير بن جمهان أن رجلا قال لعبد الله بن	عن عمر بين الصفا والمروة يا أبا عبد الرحمن إني أراك تمشي والناس يسعون قال إن أمش فقد رأيت رسول الله صلى الله عليه وسلم يمشي وإن أسع فقد رأيت رسول الله صلى الله عليه وسلم يسعى وأنا شيخ كبير 	 حدثنا النفيلي حدثنا زهير حدثنا عطاء بن السائب عن كثير بن جمهان أن رجلا قال لعبد الله بن عمر بين الصفا والمروة يا أبا عبد الرحمن إني أراك تمشي والناس يسعون قال إن أمش فقد رأيت رسول الله صلى الله عليه وسلم يمشي وإن أسع فقد رأيت رسول الله صلى الله عليه وسلم يسعى وأنا شيخ كبير 	 Kathir ibn Jamhan said: A man asked Abdullah ibn Umar between as-Safa and al-Marwah: AbdurRahman, I see you walking while the people are running (between as-Safa and al-Marwah)? He replied: If I walk, I saw the Messenger of Allah (SL3M) running. I am too old. 
