abudawud25_936090	 حدثنا الحسن بن علي حدثنا يحيى بن آدم حدثنا ابن أبي زائدة عن محمد بن أبي القاسم عن عبد الملك بن سعيد بن جبير عن أبيه عن	عن ابن عباس قال خرج رجل من بني سهم مع تميم الداري وعدي بن بداء فمات السهمي بأرض ليس بها مسلم فلما قدما بتركته فقدوا جام فضة مخوصا بالذهب فأحلفهما رسول الله صلى الله عليه وسلم ثم وجد الجام بمكة فقالوا اشتريناه من تميم وعدي فقام رجلان من أولياء السهمي فحلفا لشهادتنا أحق من شهادتهما وإن الجام لصاحبهم قال فنزلت فيهم { يا أيها الذين آمنوا شهادة بينكم إذا حضر أحدكم الموت } الآية 	 حدثنا الحسن بن علي حدثنا يحيى بن آدم حدثنا ابن أبي زائدة عن محمد بن أبي القاسم عن عبد الملك بن سعيد بن جبير عن أبيه عن ابن عباس قال خرج رجل من بني سهم مع تميم الداري وعدي بن بداء فمات السهمي بأرض ليس بها مسلم فلما قدما بتركته فقدوا جام فضة مخوصا بالذهب فأحلفهما رسول الله صلى الله عليه وسلم ثم وجد الجام بمكة فقالوا اشتريناه من تميم وعدي فقام رجلان من أولياء السهمي فحلفا لشهادتنا أحق من شهادتهما وإن الجام لصاحبهم قال فنزلت فيهم { يا أيها الذين آمنوا شهادة بينكم إذا حضر أحدكم الموت } الآية 	" Narrated Abdullah Ibn Abbas: A man from Banu Sahm went out with Tamim ad-Dari and Adi ibn Badda'. The man of Banu Sahm died in the land where no Muslim was present. When they returned with his inheritance, they (the heirs) did not find a silver cup with lines of gold (in his property). The Messenger of Allah (SL3M) administered on oath to them. The cup was then found (with someone) at Mecca. They said: We have bought it from Tamim and Adi. Then two men from the heirs of the man of Banu Sahm got up and swore saying: Our witness is more reliable than their witness. They said that the cup belonged to their man. He (Ibn Abbas) said: The following verse was revealed about them: ""O ye who believe! when death approaches any of you....."" "
abudawud25_936100	 حدثنا محمد بن يحيى بن فارس أن الحكم بن	حدثنا نافع حدثهم أخبرنا شعيب عن الزهري عن عمارة بن خزيمة أن عمه حدثه وهو من أصحاب النبي صلى الله عليه وسلم أن النبي صلى الله عليه وسلم ابتاع فرسا من أعرابي فاستتبعه النبي صلى الله عليه وسلم ليقضيه ثمن فرسه فأسرع رسول الله صلى الله عليه وسلم المشى وأبطأ الأعرابي فطفق رجال يعترضون الأعرابي فيساومونه بالفرس ولا يشعرون أن النبي صلى الله عليه وسلم ابتاعه فنادى الأعرابي رسول الله صلى الله عليه وسلم فقال إن كنت مبتاعا هذا الفرس وإلا بعته فقام النبي صلى الله عليه وسلم حين سمع نداء الأعرابي فقال أوليس قد ابتعته منك فقال الأعرابي لا والله ما بعتكه فقال النبي صلى الله عليه وسلم بلى قد ابتعته منك فطفق الأعرابي يقول هلم شهيدا فقال خزيمة بن ثابت أنا أشهد أنك قد بايعته فأقبل النبي صلى الله عليه وسلم على خزيمة فقال بم تشهد فقال بتصديقك يا رسول الله فجعل رسول الله صلى الله عليه وسلم شهادة خزيمة بشهادة رجلين 	 حدثنا محمد بن يحيى بن فارس أن الحكم بن نافع حدثهم أخبرنا شعيب عن الزهري عن عمارة بن خزيمة أن عمه حدثه وهو من أصحاب النبي صلى الله عليه وسلم أن النبي صلى الله عليه وسلم ابتاع فرسا من أعرابي فاستتبعه النبي صلى الله عليه وسلم ليقضيه ثمن فرسه فأسرع رسول الله صلى الله عليه وسلم المشى وأبطأ الأعرابي فطفق رجال يعترضون الأعرابي فيساومونه بالفرس ولا يشعرون أن النبي صلى الله عليه وسلم ابتاعه فنادى الأعرابي رسول الله صلى الله عليه وسلم فقال إن كنت مبتاعا هذا الفرس وإلا بعته فقام النبي صلى الله عليه وسلم حين سمع نداء الأعرابي فقال أوليس قد ابتعته منك فقال الأعرابي لا والله ما بعتكه فقال النبي صلى الله عليه وسلم بلى قد ابتعته منك فطفق الأعرابي يقول هلم شهيدا فقال خزيمة بن ثابت أنا أشهد أنك قد بايعته فأقبل النبي صلى الله عليه وسلم على خزيمة فقال بم تشهد فقال بتصديقك يا رسول الله فجعل رسول الله صلى الله عليه وسلم شهادة خزيمة بشهادة رجلين 	 Narrated Uncle of Umarah ibn Khuzaymah: The Prophet (SL3M) bought a horse from a Bedouin. The Prophet (SL3M) took him with him to pay him the price of his horse. The Messenger of Allah (SL3M) walked quickly and the Bedouin walked slowly. The people stopped the Bedouin and began to bargain with him for the horse as and they did not know that the Prophet (SL3M) had bought it. The Bedouin called the Messenger of Allah (SL3M) saying: If you want this horse, (then buy it), otherwise I shall sell it. The Prophet (SL3M) stopped when he heard the call of the Bedouin, and said: Have I not bought it from you? The Bedouin said: I swear by Allah, I have not sold it to you. The Prophet (SL3M) said: Yes, I have bought it from you. The Bedouin began to say: Bring a witness. Khuzaymah ibn Thabit then said: I bear witness that you have bought it. The Prophet (SL3M) turned to Khuzaymah and said: On what (grounds) do you bear witness? He said: By considering you trustworthy, Messenger of Allah (SL3M)! The Prophet (SL3M) made the witness of Khuzaymah equivalent to the witness of two people. 
abudawud25_936110	 حدثنا عثمان بن أبي شيبة والحسن بن	حدثنا علي أن زيد بن الحباب حدثهم حدثنا سيف المكي قال عثمان سيف بن سليمان عن قيس بن سعد عن عمرو بن دينار عن ابن عباس أن رسول الله صلى الله عليه وسلم قضى بيمين وشاهد 	 حدثنا عثمان بن أبي شيبة والحسن بن علي أن زيد بن الحباب حدثهم حدثنا سيف المكي قال عثمان سيف بن سليمان عن قيس بن سعد عن عمرو بن دينار عن ابن عباس أن رسول الله صلى الله عليه وسلم قضى بيمين وشاهد 	 Ibn 'Abbas said: The Messenger of Allah (SL3M) gave a decision on the basis of an oath and a single witness. 
abudawud25_936120	 حدثنا محمد بن يحيى وسلمة بن شبيب قالا حدثنا عبد الرزاق أخبرنا محمد بن مسلم عن عمرو بن	حدثنا دينار بإسناده ومعناه قال سلمة في حديثه قال عمرو في الحقوق 	 حدثنا محمد بن يحيى وسلمة بن شبيب قالا حدثنا عبد الرزاق أخبرنا محمد بن مسلم عن عمرو بن دينار بإسناده ومعناه قال سلمة في حديثه قال عمرو في الحقوق 	 The tradition mentioned above has also been transmitted by 'Amr bin Dinar through a different chain of narrators and to the same effect. Salamah has in his version: 'Amr said: In the rights (of the people). 
abudawud25_936130	 حدثنا أحمد بن أبي بكر أبو مصعب الزهري حدثنا الدراوردي عن ربيعة بن أبي عبد الرحمن عن سهيل بن أبي صالح عن أبيه عن	عن أبي هريرة أن النبي صلى الله عليه وسلم قضى باليمين مع الشاهد قال أبو داود وزادني الربيع بن سليمان المؤذن في هذا الحديث قال أخبرني الشافعي عن عبد العزيز قال فذكرت ذلك لسهيل فقال أخبرني ربيعة وهو عندي ثقة أني حدثته إياه ولا أحفظه قال عبد العزيز وقد كان أصابت سهيلا علة أذهبت بعض عقله ونسي بعض حديثه فكان سهيل بعد يحدثه عن ربيعة عنه عن أبيه 	 حدثنا أحمد بن أبي بكر أبو مصعب الزهري حدثنا الدراوردي عن ربيعة بن أبي عبد الرحمن عن سهيل بن أبي صالح عن أبيه عن أبي هريرة أن النبي صلى الله عليه وسلم قضى باليمين مع الشاهد قال أبو داود وزادني الربيع بن سليمان المؤذن في هذا الحديث قال أخبرني الشافعي عن عبد العزيز قال فذكرت ذلك لسهيل فقال أخبرني ربيعة وهو عندي ثقة أني حدثته إياه ولا أحفظه قال عبد العزيز وقد كان أصابت سهيلا علة أذهبت بعض عقله ونسي بعض حديثه فكان سهيل بعد يحدثه عن ربيعة عنه عن أبيه 	 Narrated AbuHurayrah: The Prophet (SL3M) gave a decision on the basis of an oath and a single witness. Abu Dawud said: Al-Rabi' bin Sulaiman al-Mu'adhdhin told me some additional words in this tradition: Al-Shafi'i told me from 'Abd al-'Aziz. I then mentioned it fo Suhail who said: Rabi'ah told me - and he is reliable in my opinion - that I told him this (tradition) and I do not remember it. 'Abd al-'Aziz said: Suhail suffered from some disease which caused him to lose a little of his intelligence, and he forgot some of his traditions. Thereafter Suhail would narrate traditions from Rabi'ah on the authority of his father. 
abudawud25_936140	 حدثنا محمد بن داود الإسكندراني حدثنا زياد يعني ابن يونس حدثني سليمان بن بلال عن	حدثنا ربيعة بإسناد أبي مصعب ومعناه قال سليمان فلقيت سهيلا فسألته عن هذا الحديث فقال ما أعرفه فقلت له إن ربيعة أخبرني به عنك قال فإن كان ربيعة أخبرك عني فحدث به عن ربيعة عني 	 حدثنا محمد بن داود الإسكندراني حدثنا زياد يعني ابن يونس حدثني سليمان بن بلال عن ربيعة بإسناد أبي مصعب ومعناه قال سليمان فلقيت سهيلا فسألته عن هذا الحديث فقال ما أعرفه فقلت له إن ربيعة أخبرني به عنك قال فإن كان ربيعة أخبرك عني فحدث به عن ربيعة عني 	 The tradition mentioned above has also been transmitted by Rabi'ah through the chain of Abu Mus'ab and to the same effect. Sulaiman said: I then met Suhail and asked him about this tradition. He said: I do not know it. I said to him: Rabi'ah transmitted it to me from you. He said: If Rabi'ah transmitted it to you from me, then retransmit it from Rabi'ah on my authority. 
abudawud25_936150	 حدثنا أحمد بن عبدة حدثنا عمار بن شعيب بن	حدثنا عبد الله بن الزبيب العنبري حدثني أبي قال سمعت جدي الزبيب يقول بعث نبي الله صلى الله عليه وسلم جيشا إلى بني العنبر فأخذوهم بركبة من ناحية الطائف فاستاقوهم إلى نبي الله صلى الله عليه وسلم فركبت فسبقتهم إلى النبي صلى الله عليه وسلم فقلت السلام عليك يا نبي الله ورحمة الله وبركاته أتانا جندك فأخذونا وقد كنا أسلمنا وخضرمنا آذان النعم فلما قدم بلعنبر قال لي نبي الله صلى الله عليه وسلم هل لكم بينة على أنكم أسلمتم قبل أن تؤخذوا في هذه الأيام قلت نعم قال من بينتك قلت سمرة رجل من بني العنبر ورجل آخر سماه له فشهد الرجل وأبى سمرة أن يشهد فقال نبي الله صلى الله عليه وسلم قد أبى أن يشهد لك فتحلف مع شاهدك الآخر قلت نعم فاستحلفني فحلفت بالله لقد أسلمنا يوم كذا وكذا وخضرمنا آذان النعم فقال نبي الله صلى الله عليه وسلم اذهبوا فقاسموهم أنصاف الأموال ولا تمسوا ذراريهم لولا أن الله لا يحب ضلالة العمل ما رزيناكم عقالا قال الزبيب فدعتني أمي فقالت هذا الرجل أخذ زربيتي فانصرفت إلى النبي صلى الله عليه وسلم يعني فأخبرته فقال لي احبسه فأخذت بتلبيبه وقمت معه مكاننا ثم نظر إلينا نبي الله صلى الله عليه وسلم قائمين فقال ما تريد بأسيرك فأرسلته من يدي فقام نبي الله صلى الله عليه وسلم فقال للرجل رد على هذا زربية أمه التي أخذت منها فقال يا نبي الله إنها خرجت من يدي قال فاختلع نبي الله صلى الله عليه وسلم سيف الرجل فأعطانيه وقال للرجل اذهب فزده آصعا من طعام قال فزادني آصعا من شعير 	 حدثنا أحمد بن عبدة حدثنا عمار بن شعيب بن عبد الله بن الزبيب العنبري حدثني أبي قال سمعت جدي الزبيب يقول بعث نبي الله صلى الله عليه وسلم جيشا إلى بني العنبر فأخذوهم بركبة من ناحية الطائف فاستاقوهم إلى نبي الله صلى الله عليه وسلم فركبت فسبقتهم إلى النبي صلى الله عليه وسلم فقلت السلام عليك يا نبي الله ورحمة الله وبركاته أتانا جندك فأخذونا وقد كنا أسلمنا وخضرمنا آذان النعم فلما قدم بلعنبر قال لي نبي الله صلى الله عليه وسلم هل لكم بينة على أنكم أسلمتم قبل أن تؤخذوا في هذه الأيام قلت نعم قال من بينتك قلت سمرة رجل من بني العنبر ورجل آخر سماه له فشهد الرجل وأبى سمرة أن يشهد فقال نبي الله صلى الله عليه وسلم قد أبى أن يشهد لك فتحلف مع شاهدك الآخر قلت نعم فاستحلفني فحلفت بالله لقد أسلمنا يوم كذا وكذا وخضرمنا آذان النعم فقال نبي الله صلى الله عليه وسلم اذهبوا فقاسموهم أنصاف الأموال ولا تمسوا ذراريهم لولا أن الله لا يحب ضلالة العمل ما رزيناكم عقالا قال الزبيب فدعتني أمي فقالت هذا الرجل أخذ زربيتي فانصرفت إلى النبي صلى الله عليه وسلم يعني فأخبرته فقال لي احبسه فأخذت بتلبيبه وقمت معه مكاننا ثم نظر إلينا نبي الله صلى الله عليه وسلم قائمين فقال ما تريد بأسيرك فأرسلته من يدي فقام نبي الله صلى الله عليه وسلم فقال للرجل رد على هذا زربية أمه التي أخذت منها فقال يا نبي الله إنها خرجت من يدي قال فاختلع نبي الله صلى الله عليه وسلم سيف الرجل فأعطانيه وقال للرجل اذهب فزده آصعا من طعام قال فزادني آصعا من شعير 	 Narrated Zubayb ibn Tha'labah al-Anbari: The Messenger of Allah (SL3M) sent an army to Banu al-Anbar. They captured them at Rukbah in the suburbs of at-Ta'if and drove them to the Holy Prophet (SL3M). I rode hurriedly to the Holy Prophet (SL3M) and said: Peace be on you, Messenger of Allah, and the mercy of Allah and His blessings. Your contingent came to us and arrested us, but we had already embraced Islam and cut the sides of the ears of our cattle. When Banu al-Anbar arrived, the Holy Prophet (SL3M) said to me: Have you any evidence that you had embraced Islam before you were captured today? I said: Yes. He said: Who is your witness? I said: Samurah, a man from Banu al-Anbar, and another man whom he named. The man testified but Samurah refused to testify. The Holy Prophet (SL3M) said: He (Samurah) has refused to testify for you, so take an oath with your other witness. I said: Yes. He then dictated an oath to me and I swore to the effect that we had embraced Islam on a certain day, and that we had cut the sides of the ears of the cattle. The Holy Prophet (SL3M) said: Go and divide half of their property, but do not touch their children. Had Allah not disliked the wastage of action, we should not have taxed you even a rope. Zubayb said: My mother called me and said: This man has taken my mattress. I then went to the Holy Prophet (SL3M) and informed him. He said to me: Detain him. So I caught him with a garment around his neck, and stood there with him . Then the Holy Prophet (SL3M) looked at us standing there. He asked: What do you intend (doing) with your captive? I said: I shall let him go free if he returns to this (man) the mattress of his mother which he has taken from her. He said: Prophet of Allah (SL3M), I no longer have it. He said: The Holy Prophet (SL3M) took the sword of the man and gave it to me, and said to him: Go and give him some sa's of cereal. So he gave me some sa's of barley. 
abudawud25_936160	 حدثنا محمد بن منهال الضرير حدثنا يزيد بن زريع حدثنا ابن أبي عروبة عن قتادة عن سعيد بن	حدثنا أبي بردة عن أبيه عن جده أبي موسى الأشعري أن رجلين ادعيا بعيرا أو دابة إلى النبي صلى الله عليه وسلم ليست لواحد منهما بينة فجعله النبي صلى الله عليه وسلم بينهما 	 حدثنا محمد بن منهال الضرير حدثنا يزيد بن زريع حدثنا ابن أبي عروبة عن قتادة عن سعيد بن أبي بردة عن أبيه عن جده أبي موسى الأشعري أن رجلين ادعيا بعيرا أو دابة إلى النبي صلى الله عليه وسلم ليست لواحد منهما بينة فجعله النبي صلى الله عليه وسلم بينهما 	 Narrated AbuMusa al-Ash'ari: Two men claimed a camel or an animal and brought the case to the Holy Prophet (SL3M). But as neither of them produced any proof, the Holy Prophet (SL3M) declared that they should share it equally. 
abudawud25_936170	 حدثنا الحسن بن علي حدثنا يحيى بن آدم حدثنا عبد الرحيم بن سليمان عن	حدثنا سعيد بإسناده ومعناه 	 حدثنا الحسن بن علي حدثنا يحيى بن آدم حدثنا عبد الرحيم بن سليمان عن سعيد بإسناده ومعناه 	 The tradition mentioned above has also been transmitted by Sa'id through a different chain of narrators to the same effect. 
abudawud25_936180	 حدثنا محمد بن بشار حدثنا حجاج بن منهال حدثنا همام عن	حدثنا قتادة بمعنى إسناده أن رجلين ادعيا بعيرا على عهد النبي صلى الله عليه وسلم فبعث كل واحد منهما شاهدين فقسمه النبي صلى الله عليه وسلم بينهما نصفين 	 حدثنا محمد بن بشار حدثنا حجاج بن منهال حدثنا همام عن قتادة بمعنى إسناده أن رجلين ادعيا بعيرا على عهد النبي صلى الله عليه وسلم فبعث كل واحد منهما شاهدين فقسمه النبي صلى الله عليه وسلم بينهما نصفين 	 The tradition mentioned above has also been transmitted by Qatadah through a different chain of narrators to the effect that two men laid claim camel and both of them produced witness so the prophet (peace be upon him) divided it in halves between them. 
abudawud25_936190	 حدثنا محمد بن منهال حدثنا يزيد بن زريع حدثنا ابن أبي عروبة عن قتادة عن خلاس عن أبي رافع عن	عن أبي هريرة أن رجلين اختصما في متاع إلى النبي صلى الله عليه وسلم ليس لواحد منهما بينة فقال النبي صلى الله عليه وسلم استهما على اليمين ما كان أحبا ذلك أو كرها 	 حدثنا محمد بن منهال حدثنا يزيد بن زريع حدثنا ابن أبي عروبة عن قتادة عن خلاس عن أبي رافع عن أبي هريرة أن رجلين اختصما في متاع إلى النبي صلى الله عليه وسلم ليس لواحد منهما بينة فقال النبي صلى الله عليه وسلم استهما على اليمين ما كان أحبا ذلك أو كرها 	 Narrated AbuHurayrah: Two men disputed about some property and brought the case to the Holy Prophet (SL3M), but neither of them could produce any proof. So the Holy Prophet (SL3M) said: Cast lots about the oath whatever it may be, whether they like it or dislike it. 
abudawud25_936200	 حدثنا أحمد بن حنبل وسلمة بن شبيب قالا حدثنا عبد الرزاق قال أحمد قال حدثنا معمر عن همام بن منبه عن أبي هريرة عن	عن النبي صلى الله عليه وسلم قال إذا كره الاثنان اليمين أو استحباها فليستهما عليها قال سلمة قال أخبرنا معمر وقال إذا أكره الاثنان على اليمين 	 حدثنا أحمد بن حنبل وسلمة بن شبيب قالا حدثنا عبد الرزاق قال أحمد قال حدثنا معمر عن همام بن منبه عن أبي هريرة عن النبي صلى الله عليه وسلم قال إذا كره الاثنان اليمين أو استحباها فليستهما عليها قال سلمة قال أخبرنا معمر وقال إذا أكره الاثنان على اليمين 	 Abu hurairah reported the holy prophet (peace be upon him) as saying: When two men dislike the oath or like it,lots will be cost about it. Salamah said on the authority of Ma’mar who said: when the two are compelled to take an oath. 
abudawud25_936210	 حدثنا أبو بكر بن أبي شيبة حدثنا خالد بن	حدثنا الحارث عن سعيد بن أبي عروبة بإسناد ابن منهال مثله قال في دابة وليس لهما بينة فأمرهما رسول الله صلى الله عليه وسلم أن يستهما على اليمين 	 حدثنا أبو بكر بن أبي شيبة حدثنا خالد بن الحارث عن سعيد بن أبي عروبة بإسناد ابن منهال مثله قال في دابة وليس لهما بينة فأمرهما رسول الله صلى الله عليه وسلم أن يستهما على اليمين 	 The tradition mentioned above has also been transmitted by sa’id b. ‘Urubah through the chain as narrated by Ibn Minhal. This version has : About an animal and they had no proof. So the Messenger of Allah (SL3M) ordered to cast lots about the oath. 
abudawud25_936220	 حدثنا عبد الله بن مسلمة القعنبي حدثنا نافع بن	حدثنا عمر عن ابن أبي مليكة قال كتب إلى ابن عباس أن رسول الله صلى الله عليه وسلم قضى باليمين على المدعى عليه 	 حدثنا عبد الله بن مسلمة القعنبي حدثنا نافع بن عمر عن ابن أبي مليكة قال كتب إلى ابن عباس أن رسول الله صلى الله عليه وسلم قضى باليمين على المدعى عليه 	 Ibn Abi Mulaikah said: Ibn ‘Abbas wrote to me that the Messenger of Allah (SL3M)had defendant should take an oath. 
