bukhari92_161880	 حدثنا عبد الله بن يوسف أخبرنا مالك عن نافع عن عبد الله بن	عن عمر رضى الله عنهما أن رسول الله صلى الله عليه وسلم قال من حمل علينا السلاح فليس منا 	 حدثنا عبد الله بن يوسف أخبرنا مالك عن نافع عن عبد الله بن عمر رضى الله عنهما أن رسول الله صلى الله عليه وسلم قال من حمل علينا السلاح فليس منا 	" Narrated `Abdullah bin `Umar: Allah's Messenger (SL3M) said, ""Whoever takes up arms against us, is not from us."" "
bukhari92_161890	 حدثنا محمد بن العلاء حدثنا أبو أسامة عن بريد عن أبي بردة عن أبي موسى عن	عن النبي صلى الله عليه وسلم قال من حمل علينا السلاح فليس منا 	 حدثنا محمد بن العلاء حدثنا أبو أسامة عن بريد عن أبي بردة عن أبي موسى عن النبي صلى الله عليه وسلم قال من حمل علينا السلاح فليس منا 	" Narrated Abu Musa: The Prophet (SL3M) said, ""Whoever takes up arms against us, is not from us."" "
bukhari92_161900	 حدثنا محمد أخبرنا عبد الرزاق عن معمر عن همام سمعت أبا هريرة عن	عن النبي صلى الله عليه وسلم قال لا يشير أحدكم على أخيه بالسلاح فإنه لا يدري لعل الشيطان ينزع في يده فيقع في حفرة من النار 	 حدثنا محمد أخبرنا عبد الرزاق عن معمر عن همام سمعت أبا هريرة عن النبي صلى الله عليه وسلم قال لا يشير أحدكم على أخيه بالسلاح فإنه لا يدري لعل الشيطان ينزع في يده فيقع في حفرة من النار 	" Narrated Abu Huraira: The Prophet (SL3M) said, ""None of you should point out towards his Muslim brother with a weapon, for he does not know, Satan may tempt him to hit him and thus he would fall into a pit of fire (Hell)"" "
bukhari92_161910	 حدثنا علي بن عبد الله حدثنا	حدثنا سفيان قال قلت لعمرو يا أبا محمد سمعت جابر بن عبد الله يقول مر رجل بسهام في المسجد فقال له رسول الله صلى الله عليه وسلم أمسك بنصالها قال نعم 	 حدثنا علي بن عبد الله حدثنا سفيان قال قلت لعمرو يا أبا محمد سمعت جابر بن عبد الله يقول مر رجل بسهام في المسجد فقال له رسول الله صلى الله عليه وسلم أمسك بنصالها قال نعم 	" Narrated Sufyan: I said to `Amr, ""O Abu Muhammad! Did you hear Jabir bin `Abdullah saying, 'A man carrying arrows passed through the mosque and Allah's Messenger (SL3M) said to him, 'Hold the arrows by their heads! ""`Amr replied, ""Yes."" "
bukhari92_161920	 حدثنا أبو النعمان حدثنا حماد بن زيد عن عمرو بن	حدثنا دينار عن جابر أن رجلا مر في المسجد بأسهم قد أبدى نصولها فأمر أن يأخذ بنصولها لا يخدش مسلما 	 حدثنا أبو النعمان حدثنا حماد بن زيد عن عمرو بن دينار عن جابر أن رجلا مر في المسجد بأسهم قد أبدى نصولها فأمر أن يأخذ بنصولها لا يخدش مسلما 	 Narrated Jabir: A man passed through the mosque and he was carrying arrows, the heads of which were exposed (protruding). The man was ordered (by the Prophet) to hold the iron heads so that it might not scratch (injure) any Muslim. 
bukhari92_161930	 حدثنا محمد بن العلاء حدثنا أبو أسامة عن بريد عن أبي بردة عن أبي موسى عن	عن النبي صلى الله عليه وسلم قال إذا مر أحدكم في مسجدنا أو في سوقنا ومعه نبل فليمسك على نصالها أو قال فليقبض بكفه أن يصيب أحدا من المسلمين منها شىء 	 حدثنا محمد بن العلاء حدثنا أبو أسامة عن بريد عن أبي بردة عن أبي موسى عن النبي صلى الله عليه وسلم قال إذا مر أحدكم في مسجدنا أو في سوقنا ومعه نبل فليمسك على نصالها أو قال فليقبض بكفه أن يصيب أحدا من المسلمين منها شىء 	" Narrated Abu Musa: The Prophet (SL3M) said, ""If anyone of you passed through our mosque or through our market while carrying arrows, he should hold the iron heads,"" or said, ""..... he should hold (their heads) firmly with his hand lest he should injure one of the Muslims with it."" "
bukhari92_161940	 حدثنا عمر بن حفص حدثني أبي حدثنا الأعمش حدثنا	حدثنا شقيق قال قال عبد الله قال النبي صلى الله عليه وسلم سباب المسلم فسوق وقتاله كفر 	 حدثنا عمر بن حفص حدثني أبي حدثنا الأعمش حدثنا شقيق قال قال عبد الله قال النبي صلى الله عليه وسلم سباب المسلم فسوق وقتاله كفر 	" Narrated `Abdullah: The Prophet, said, ""Abusing a Muslim is Fusuq (evil doing) and killing him is Kufr (disbelief). "
bukhari92_161950	 حدثنا حجاج بن منهال حدثنا شعبة أخبرني واقد عن أبيه عن	عن ابن عمر أنه سمع النبي صلى الله عليه وسلم يقول لا ترجعوا بعدي كفارا يضرب بعضكم رقاب بعض 	 حدثنا حجاج بن منهال حدثنا شعبة أخبرني واقد عن أبيه عن ابن عمر أنه سمع النبي صلى الله عليه وسلم يقول لا ترجعوا بعدي كفارا يضرب بعضكم رقاب بعض 	" Narrated Ibn `Umar: I heard the Prophet (SL3M) saying, ""Do not revert to disbelief after me by striking (cutting) the necks of one another."" "
bukhari92_161960	 حدثنا مسدد حدثنا يحيى حدثنا قرة بن خالد حدثنا ابن سيرين عن عبد الرحمن بن أبي بكرة عن	حدثنا أبي بكرة وعن رجل آخر هو أفضل في نفسي من عبد الرحمن بن أبي بكرة عن أبي بكرة أن رسول الله صلى الله عليه وسلم خطب الناس فقال ألا تدرون أى يوم هذا قالوا الله ورسوله أعلم قال حتى ظننا أنه سيسميه بغير اسمه فقال أليس بيوم النحر قلنا بلى يا رسول الله قال أى بلد هذا أليست بالبلدة قلنا بلى يا رسول الله قال فإن دماءكم وأموالكم وأعراضكم وأبشاركم عليكم حرام كحرمة يومكم هذا في شهركم هذا في بلدكم هذا ألا هل بلغت قلنا نعم قال اللهم اشهد فليبلغ الشاهد الغائب فإنه رب مبلغ يبلغه من هو أوعى له فكان كذلك قال لا ترجعوا بعدي كفارا يضرب بعضكم رقاب بعض فلما كان يوم حرق ابن الحضرمي حين حرقه جارية بن قدامة قال أشرفوا على أبي بكرة فقالوا هذا أبو بكرة يراك قال عبد الرحمن فحدثتني أمي عن أبي بكرة أنه قال لو دخلوا على ما بهشت بقصبة 	 حدثنا مسدد حدثنا يحيى حدثنا قرة بن خالد حدثنا ابن سيرين عن عبد الرحمن بن أبي بكرة عن أبي بكرة وعن رجل آخر هو أفضل في نفسي من عبد الرحمن بن أبي بكرة عن أبي بكرة أن رسول الله صلى الله عليه وسلم خطب الناس فقال ألا تدرون أى يوم هذا قالوا الله ورسوله أعلم قال حتى ظننا أنه سيسميه بغير اسمه فقال أليس بيوم النحر قلنا بلى يا رسول الله قال أى بلد هذا أليست بالبلدة قلنا بلى يا رسول الله قال فإن دماءكم وأموالكم وأعراضكم وأبشاركم عليكم حرام كحرمة يومكم هذا في شهركم هذا في بلدكم هذا ألا هل بلغت قلنا نعم قال اللهم اشهد فليبلغ الشاهد الغائب فإنه رب مبلغ يبلغه من هو أوعى له فكان كذلك قال لا ترجعوا بعدي كفارا يضرب بعضكم رقاب بعض فلما كان يوم حرق ابن الحضرمي حين حرقه جارية بن قدامة قال أشرفوا على أبي بكرة فقالوا هذا أبو بكرة يراك قال عبد الرحمن فحدثتني أمي عن أبي بكرة أنه قال لو دخلوا على ما بهشت بقصبة 	" Narrated Abu Bakra: Allah's Messenger (SL3M) addressed the people saying, ""Don't you know what is the day today?"" They replied, ""Allah and His Apostle know better."" We thought that he might give that day another name. The Prophet said, ""Isn't it the day of An-Nahr?"" We replied, ""Yes. O Allah's Messenger (SL3M)."" He then said, ""What town is this? Isn't it the forbidden (Sacred) Town (Mecca)?"" We replied, ""Yes, O Allah's Messenger (SL3M)."" He then said, ""Your blood, your properties, your honors and your skins (i.e., bodies) are as sacred to one another like the sanctity of this day of yours in this month of yours in this town of yours. (Listen) Haven't I conveyed Allah's message to you?"" We replied, ""Yes"" He said, ""O Allah! Be witness (for it). So it is incumbent upon those who are present to convey it (this message of mine) to those who are absent because the informed one might comprehend what I have said better than the present audience who will convey it to him.)"" The narrator added: In fact, it was like that. The Prophet (SL3M) added, ""Beware! Do not renegade as disbelievers after me by striking (cutting) the necks of one another."" "
bukhari92_161970	 حدثنا أحمد بن إشكاب حدثنا محمد بن فضيل عن أبيه عن عكرمة عن	عن ابن عباس رضى الله عنهما قال قال النبي صلى الله عليه وسلم لا ترتدوا بعدي كفارا يضرب بعضكم رقاب بعض 	 حدثنا أحمد بن إشكاب حدثنا محمد بن فضيل عن أبيه عن عكرمة عن ابن عباس رضى الله عنهما قال قال النبي صلى الله عليه وسلم لا ترتدوا بعدي كفارا يضرب بعضكم رقاب بعض 	" Narrated Ibn `Abbas: The Prophet (SL3M) said, ""Beware! Do not renegade as (disbelievers) after me by striking (cutting) the necks of one another."" "
bukhari92_161980	 حدثنا سليمان بن حرب حدثنا شعبة عن علي بن	حدثنا مدرك سمعت أبا زرعة بن عمرو بن جرير عن جده جرير قال قال لي رسول الله صلى الله عليه وسلم في حجة الوداع استنصت الناس ثم قال لا ترجعوا بعدي كفارا يضرب بعضكم رقاب بعض 	 حدثنا سليمان بن حرب حدثنا شعبة عن علي بن مدرك سمعت أبا زرعة بن عمرو بن جرير عن جده جرير قال قال لي رسول الله صلى الله عليه وسلم في حجة الوداع استنصت الناس ثم قال لا ترجعوا بعدي كفارا يضرب بعضكم رقاب بعض 	" Narrated Jarir: The Prophet (SL3M) said to me during Hajjat-al-Wada`, ""Let the people keep quiet and listen."" Then he said (addressing the people), ""Beware! Do not renegade as disbelievers after me by striking (cutting) the necks of one another."" "
bukhari92_161990	 حدثنا محمد بن عبيد الله حدثنا إبراهيم بن سعد عن أبيه عن أبي سلمة بن عبد الرحمن عن أبي هريرة قال إبراهيم وحدثني صالح بن كيسان عن ابن شهاب عن سعيد بن المسيب عن	عن أبي هريرة قال قال رسول الله صلى الله عليه وسلم ستكون فتن القاعد فيها خير من القائم والقائم فيها خير من الماشي والماشي فيها خير من الساعي من تشرف لها تستشرفه فمن وجد فيها ملجأ أو معاذا فليعذ به 	 حدثنا محمد بن عبيد الله حدثنا إبراهيم بن سعد عن أبيه عن أبي سلمة بن عبد الرحمن عن أبي هريرة قال إبراهيم وحدثني صالح بن كيسان عن ابن شهاب عن سعيد بن المسيب عن أبي هريرة قال قال رسول الله صلى الله عليه وسلم ستكون فتن القاعد فيها خير من القائم والقائم فيها خير من الماشي والماشي فيها خير من الساعي من تشرف لها تستشرفه فمن وجد فيها ملجأ أو معاذا فليعذ به 	" Narrated Abu Huraira: Allah's Messenger (SL3M) said, ""There will be afflictions (in the near future) during which a sitting person will be better than a standing one, and the standing one will be better than the walking one, and the walking one will be better than the running one, and whoever will expose himself to these afflictions, they will destroy him. So whoever can find a place of protection or refuge from them, should take shelter in it."" "
bukhari92_162000	 حدثنا أبو اليمان أخبرنا شعيب عن الزهري أخبرني أبو سلمة بن	عن عبد الرحمن أن أبا هريرة قال قال رسول الله صلى الله عليه وسلم ستكون فتن القاعد فيها خير من القائم والقائم خير من الماشي والماشي فيها خير من الساعي من تشرف لها تستشرفه فمن وجد ملجأ أو معاذا فليعذ به 	 حدثنا أبو اليمان أخبرنا شعيب عن الزهري أخبرني أبو سلمة بن عبد الرحمن أن أبا هريرة قال قال رسول الله صلى الله عليه وسلم ستكون فتن القاعد فيها خير من القائم والقائم خير من الماشي والماشي فيها خير من الساعي من تشرف لها تستشرفه فمن وجد ملجأ أو معاذا فليعذ به 	" Narrated Abu Huraira: Allah's Messenger (SL3M) said, ""There will be afflictions (in the near future) during which a sitting person will be better than a standing one, and the standing one will be better than a walking one, and the walking one will be better than a running one, and whoever will expose himself to these afflictions, they will destroy him. So whoever can find a place of protection or refuge from them, should take shelter in it."" "
bukhari92_162010	 حدثنا عبد الله بن عبد الوهاب حدثنا حماد عن رجل لم يسمه عن	عن الحسن قال خرجت بسلاحي ليالي الفتنة فاستقبلني أبو بكرة فقال أين تريد قلت أريد نصرة ابن عم رسول الله صلى الله عليه وسلم قال قال رسول الله صلى الله عليه وسلم إذا تواجه المسلمان بسيفيهما فكلاهما من أهل النار قيل فهذا القاتل فما بال المقتول قال إنه أراد قتل صاحبه قال حماد بن زيد فذكرت هذا الحديث لأيوب ويونس بن عبيد وأنا أريد أن يحدثاني به فقالا إنما روى هذا الحديث الحسن عن الأحنف بن قيس عن أبي بكرة حدثنا سليمان حدثنا حماد بهذا وقال مؤمل حدثنا حماد بن زيد حدثنا أيوب ويونس وهشام ومعلى بن زياد عن الحسن عن الأحنف عن أبي بكرة عن النبي صلى الله عليه وسلم ورواه معمر عن أيوب ورواه بكار بن عبد العزيز عن أبيه عن أبي بكرة وقال غندر حدثنا شعبة عن منصور عن ربعي بن حراش عن أبي بكرة عن النبي صلى الله عليه وسلم ولم يرفعه سفيان عن منصور 	 حدثنا عبد الله بن عبد الوهاب حدثنا حماد عن رجل لم يسمه عن الحسن قال خرجت بسلاحي ليالي الفتنة فاستقبلني أبو بكرة فقال أين تريد قلت أريد نصرة ابن عم رسول الله صلى الله عليه وسلم قال قال رسول الله صلى الله عليه وسلم إذا تواجه المسلمان بسيفيهما فكلاهما من أهل النار قيل فهذا القاتل فما بال المقتول قال إنه أراد قتل صاحبه قال حماد بن زيد فذكرت هذا الحديث لأيوب ويونس بن عبيد وأنا أريد أن يحدثاني به فقالا إنما روى هذا الحديث الحسن عن الأحنف بن قيس عن أبي بكرة حدثنا سليمان حدثنا حماد بهذا وقال مؤمل حدثنا حماد بن زيد حدثنا أيوب ويونس وهشام ومعلى بن زياد عن الحسن عن الأحنف عن أبي بكرة عن النبي صلى الله عليه وسلم ورواه معمر عن أيوب ورواه بكار بن عبد العزيز عن أبيه عن أبي بكرة وقال غندر حدثنا شعبة عن منصور عن ربعي بن حراش عن أبي بكرة عن النبي صلى الله عليه وسلم ولم يرفعه سفيان عن منصور 	" Narrated Al-Hasan: (Al-Ahnaf said:) I went out carrying my arms during the nights of the affliction (i.e. the war between `Ali and `Aisha) and Abu Bakra met me and asked, ""Where are you going?"" I replied, ""I intend to help the cousin of Allah's Messenger (SL3M) (i.e.,`Ali)."" Abu Bakra said, ""Allah's Messenger (SL3M) said, 'If two Muslims take out their swords to fight each other, then both of them will be from amongst the people of the Hell- Fire.' It was said to the Prophet, 'It is alright for the killer but what about the killed one?' He replied, 'The killed one had the intention to kill his opponent.'"" (See Hadith No. 30, Vol. 1) Narrated Al-Ahnaf: Abu Bakra said: The Prophet (SL3M) said (as above, 204). "
bukhari92_162040	 حدثنا محمد بن المثنى حدثنا الوليد بن مسلم حدثنا ابن جابر حدثني بسر بن	حدثنا عبيد الله الحضرمي أنه سمع أبا إدريس الخولاني أنه سمع حذيفة بن اليمان يقول كان الناس يسألون رسول الله صلى الله عليه وسلم عن الخير وكنت أسأله عن الشر مخافة أن يدركني فقلت يا رسول الله إنا كنا في جاهلية وشر فجاءنا الله بهذا الخير فهل بعد هذا الخير من شر قال نعم قلت وهل بعد ذلك الشر من خير قال نعم وفيه دخن قلت وما دخنه قال قوم يهدون بغير هدى تعرف منهم وتنكر قلت فهل بعد ذلك الخير من شر قال نعم دعاة على أبواب جهنم من أجابهم إليها قذفوه فيها قلت يا رسول الله صفهم لنا قال هم من جلدتنا ويتكلمون بألسنتنا قلت فما تأمرني إن أدركني ذلك قال تلزم جماعة المسلمين وإمامهم قلت فإن لم يكن لهم جماعة ولا إمام قال فاعتزل تلك الفرق كلها ولو أن تعض بأصل شجرة حتى يدركك الموت وأنت على ذلك 	 حدثنا محمد بن المثنى حدثنا الوليد بن مسلم حدثنا ابن جابر حدثني بسر بن عبيد الله الحضرمي أنه سمع أبا إدريس الخولاني أنه سمع حذيفة بن اليمان يقول كان الناس يسألون رسول الله صلى الله عليه وسلم عن الخير وكنت أسأله عن الشر مخافة أن يدركني فقلت يا رسول الله إنا كنا في جاهلية وشر فجاءنا الله بهذا الخير فهل بعد هذا الخير من شر قال نعم قلت وهل بعد ذلك الشر من خير قال نعم وفيه دخن قلت وما دخنه قال قوم يهدون بغير هدى تعرف منهم وتنكر قلت فهل بعد ذلك الخير من شر قال نعم دعاة على أبواب جهنم من أجابهم إليها قذفوه فيها قلت يا رسول الله صفهم لنا قال هم من جلدتنا ويتكلمون بألسنتنا قلت فما تأمرني إن أدركني ذلك قال تلزم جماعة المسلمين وإمامهم قلت فإن لم يكن لهم جماعة ولا إمام قال فاعتزل تلك الفرق كلها ولو أن تعض بأصل شجرة حتى يدركك الموت وأنت على ذلك 	" Narrated Hudhaifa bin Al-Yaman: The people used to ask Allah's Messenger (SL3M) about the good but I used to ask him about the evil lest I should be overtaken by them. So I said, ""O Allah's Messenger (SL3M)! We were living in ignorance and in an (extremely) worst atmosphere, then Allah brought to us this good (i.e., Islam); will there be any evil after this good?"" He said, ""Yes."" I said, 'Will there be any good after that evil?"" He replied, ""Yes, but it will be tainted (not pure.)'' I asked, ""What will be its taint?"" He replied, ""(There will be) some people who will guide others not according to my tradition? You will approve of some of their deeds and disapprove of some others."" I asked, ""Will there be any evil after that good?"" He replied, ""Yes, (there will be) some people calling at the gates of the (Hell) Fire, and whoever will respond to their call, will be thrown by them into the (Hell) Fire."" I said, ""O Allah s Apostle! Will you describe them to us?"" He said, ""They will be from our own people and will speak our language."" I said, ""What do you order me to do if such a state should take place in my life?"" He said, ""Stick to the group of Muslims and their Imam (ruler)."" I said, ""If there is neither a group of Muslims nor an Imam (ruler)?"" He said, ""Then turn away from all those sects even if you were to bite (eat) the roots of a tree till death overtakes you while you are in that state."" "
bukhari92_162050	 حدثنا عبد الله بن يزيد حدثنا حيوة وغيره قالا حدثنا أبو الأسود وقال الليث عن	حدثنا أبي الأسود قال قطع على أهل المدينة بعث فاكتتبت فيه فلقيت عكرمة فأخبرته فنهاني أشد النهى ثم قال أخبرني ابن عباس أن أناسا من المسلمين كانوا مع المشركين يكثرون سواد المشركين على رسول الله صلى الله عليه وسلم فيأتي السهم فيرمى فيصيب أحدهم فيقتله أو يضربه فيقتله فأنزل الله تعالى {إن الذين توفاهم الملائكة ظالمي أنفسهم} 	 حدثنا عبد الله بن يزيد حدثنا حيوة وغيره قالا حدثنا أبو الأسود وقال الليث عن أبي الأسود قال قطع على أهل المدينة بعث فاكتتبت فيه فلقيت عكرمة فأخبرته فنهاني أشد النهى ثم قال أخبرني ابن عباس أن أناسا من المسلمين كانوا مع المشركين يكثرون سواد المشركين على رسول الله صلى الله عليه وسلم فيأتي السهم فيرمى فيصيب أحدهم فيقتله أو يضربه فيقتله فأنزل الله تعالى {إن الذين توفاهم الملائكة ظالمي أنفسهم} 	" Narrated Abu Al-Aswad: An army unit was being recruited from the people of Medina and my name was written among them. Then I met `Ikrima, and when I informed him about it, he discouraged me very strongly and said, ""Ibn `Abbas told me that there were some Muslims who were with the pagans to increase their number against Allah's Messenger (SL3M) (and the Muslim army) so arrows (from the Muslim army) would hit one of them and kill him or a Muslim would strike him (with his sword) and kill him. So Allah revealed:-- 'Verily! As for those whom the angels take (in death) while they are wronging themselves (by staying among the disbelievers).' (4.97) "
