bukhari55_126920	 حدثنا عبيد بن إسماعيل حدثنا أبو أسامة عن هشام عن أبيه عن	عن عائشة رضى الله عنها – {ومن كان غنيا فليستعفف ومن كان فقيرا فليأكل بالمعروف} قالت أنزلت في والي اليتيم أن يصيب من ماله إذا كان محتاجا بقدر ماله بالمعروف 	 حدثنا عبيد بن إسماعيل حدثنا أبو أسامة عن هشام عن أبيه عن عائشة رضى الله عنها – {ومن كان غنيا فليستعفف ومن كان فقيرا فليأكل بالمعروف} قالت أنزلت في والي اليتيم أن يصيب من ماله إذا كان محتاجا بقدر ماله بالمعروف 	" Narrated `Aisha: The following Verse:-- ""If a guardian is well-off, let him claim no remuneration (i.e. wages), but if he is poor, let him have for himself what is just and reasonable."" (4.6) was revealed in connection with the guardian of an orphan, and it means that if he is poor he can have for himself (from the orphan's wealth) what is just and reasonable according to the orphan's share of the inheritance. "
bukhari55_126930	 حدثنا عبد العزيز بن عبد الله قال حدثني سليمان بن	حدثنا بلال عن ثور بن زيد المدني عن أبي الغيث عن أبي هريرة رضى الله عنه عن النبي صلى الله عليه وسلم قال اجتنبوا السبع الموبقات قالوا يا رسول الله وما هن قال الشرك بالله والسحر وقتل النفس التي حرم الله إلا بالحق وأكل الربا وأكل مال اليتيم والتولي يوم الزحف وقذف المحصنات المؤمنات الغافلات 	 حدثنا عبد العزيز بن عبد الله قال حدثني سليمان بن بلال عن ثور بن زيد المدني عن أبي الغيث عن أبي هريرة رضى الله عنه عن النبي صلى الله عليه وسلم قال اجتنبوا السبع الموبقات قالوا يا رسول الله وما هن قال الشرك بالله والسحر وقتل النفس التي حرم الله إلا بالحق وأكل الربا وأكل مال اليتيم والتولي يوم الزحف وقذف المحصنات المؤمنات الغافلات 	" Narrated Abu Huraira: The Prophet (SL3M) said, ""Avoid the seven great destructive sins."" The people enquire, ""O Allah's Messenger (SL3M)! What are they? ""He said, ""To join others in worship along with Allah, to practice sorcery, to kill the life which Allah has forbidden except for a just cause, (according to Islamic law), to eat up Riba (usury), to eat up an orphan's wealth, to give back to the enemy and fleeing from the battlefield at the time of fighting, and to accuse, chaste women, who never even think of anything touching chastity and are good believers. "
bukhari55_126940	not identified	 وقال لنا سليمان حدثنا حماد عن أيوب عن نافع قال ما رد ابن عمر على أحد وصية وكان ابن سيرين أحب الأشياء إليه في مال اليتيم أن يجتمع إليه نصحاؤه وأولياؤه فينظروا الذي هو خير له وكان طاوس إذا سئل عن شىء من أمر اليتامى قرأ {والله يعلم المفسد من المصلح} وقال عطاء في يتامى الصغير والكبير ينفق الولي على كل إنسان بقدره من حصته 	 وقال لنا سليمان حدثنا حماد عن أيوب عن نافع قال ما رد ابن عمر على أحد وصية وكان ابن سيرين أحب الأشياء إليه في مال اليتيم أن يجتمع إليه نصحاؤه وأولياؤه فينظروا الذي هو خير له وكان طاوس إذا سئل عن شىء من أمر اليتامى قرأ {والله يعلم المفسد من المصلح} وقال عطاء في يتامى الصغير والكبير ينفق الولي على كل إنسان بقدره من حصته 	" Nafi' said: ""Ibn 'Umar never refused to be appointed as guardian."" The most beloved thing to Ibn Sirin concerning an orphan's wealth was that the orphan's advisor and guardians would assemble to decide what is best for him. When Tawus was asked about something concerning an orphan's affairs, he would recite: '...And Allah knows him who means mischief from him who means good...' (V 2:220). 'Ata said concerning some orphans, ""The guardian is to provide for the young and the old orphans according to their needs from their shares."" "
bukhari55_126950	 حدثنا يعقوب بن إبراهيم بن كثير حدثنا ابن علية حدثنا عبد العزيز عن	حدثنا أنس رضى الله عنه قال قدم رسول الله صلى الله عليه وسلم المدينة ليس له خادم فأخذ أبو طلحة بيدي فانطلق بي إلى رسول الله صلى الله عليه وسلم فقال يا رسول الله إن أنسا غلام كيس فليخدمك قال فخدمته في السفر والحضر ما قال لي لشىء صنعته لم صنعت هذا هكذا ولا لشىء لم أصنعه لم لم تصنع هذا هكذا 	 حدثنا يعقوب بن إبراهيم بن كثير حدثنا ابن علية حدثنا عبد العزيز عن أنس رضى الله عنه قال قدم رسول الله صلى الله عليه وسلم المدينة ليس له خادم فأخذ أبو طلحة بيدي فانطلق بي إلى رسول الله صلى الله عليه وسلم فقال يا رسول الله إن أنسا غلام كيس فليخدمك قال فخدمته في السفر والحضر ما قال لي لشىء صنعته لم صنعت هذا هكذا ولا لشىء لم أصنعه لم لم تصنع هذا هكذا 	" Narrated Anas: When Allah's Messenger (SL3M) came to Medina; he did not have any servant. Abu Talha (Anas' step-father) took me to Allah's Messenger (SL3M) and said, ""O Allah's Messenger (SL3M)! Anas is a wise boy, so let him serve you."" So, I served him at home and on journeys. If I did anything, he never asked me why I did it, and if I refrained from doing anything, he never asked me why I refrained from doing it. "
bukhari55_126960	 حدثنا عبد الله بن مسلمة عن مالك عن إسحاق بن	حدثنا عبد الله بن أبي طلحة أنه سمع أنس بن مالك رضى الله عنه يقول كان أبو طلحة أكثر أنصاري بالمدينة مالا من نخل وكان أحب ماله إليه بيرحاء مستقبلة المسجد وكان النبي صلى الله عليه وسلم يدخلها ويشرب من ماء فيها طيب قال أنس فلما نزلت {لن تنالوا البر حتى تنفقوا مما تحبون} قام أبو طلحة فقال يا رسول الله إن الله يقول {لن تنالوا البر حتى تنفقوا مما تحبون} وإن أحب أموالي إلى بيرحاء وإنها صدقة لله أرجو برها وذخرها عند الله فضعها حيث أراك الله فقال بخ ذلك مال رابح أو رايح شك ابن مسلمة وقد سمعت ما قلت وإني أرى أن تجعلها في الأقربين قال أبو طلحة أفعل ذلك يا رسول الله فقسمها أبو طلحة في أقاربه وفي بني عمه وقال إسماعيل وعبد الله بن يوسف ويحيى بن يحيى عن مالك رايح 	 حدثنا عبد الله بن مسلمة عن مالك عن إسحاق بن عبد الله بن أبي طلحة أنه سمع أنس بن مالك رضى الله عنه يقول كان أبو طلحة أكثر أنصاري بالمدينة مالا من نخل وكان أحب ماله إليه بيرحاء مستقبلة المسجد وكان النبي صلى الله عليه وسلم يدخلها ويشرب من ماء فيها طيب قال أنس فلما نزلت {لن تنالوا البر حتى تنفقوا مما تحبون} قام أبو طلحة فقال يا رسول الله إن الله يقول {لن تنالوا البر حتى تنفقوا مما تحبون} وإن أحب أموالي إلى بيرحاء وإنها صدقة لله أرجو برها وذخرها عند الله فضعها حيث أراك الله فقال بخ ذلك مال رابح أو رايح شك ابن مسلمة وقد سمعت ما قلت وإني أرى أن تجعلها في الأقربين قال أبو طلحة أفعل ذلك يا رسول الله فقسمها أبو طلحة في أقاربه وفي بني عمه وقال إسماعيل وعبد الله بن يوسف ويحيى بن يحيى عن مالك رايح 	" Narrated Anas bin Malik: Abu Talha had the greatest wealth of date-palms amongst the Ansar in Medina, and he prized above all his wealth (his garden) Bairuha', which was situated opposite the Mosque (of the Prophet (SL3M) ). The Prophet used to enter It and drink from its fresh water. When the following Divine Verse came:-- ""By no means shall you attain piety until you spend of what you love,"" (3.92) Abu Talha got up saying. ""O Allah's Messenger (SL3M)! Allah says, 'You will not attain piety until you spend of what you love,' and I prize above al I my wealth, Bairuha' which I want to give in charity for Allah's Sake, hoping for its reward from Allah. So you can use it as Allah directs you."" On that the Prophet (SL3M) said, ""Bravo! It is a profitable (or perishable) property. (Ibn Maslama is not sure as to which word is right, i.e. profitable or perishable.) I have heard what you have said, and I recommend that you distribute this amongst your relatives."" On that Abu Talha said, ""O Allah's Messenger (SL3M)! I will do (as you have suggested)."" So, Abu Talha distributed that garden amongst his relatives and cousins. "
bukhari55_126970	 حدثنا محمد بن عبد الرحيم أخبرنا روح بن عبادة حدثنا زكرياء بن إسحاق قال حدثني عمرو بن دينار عن عكرمة عن	عن ابن عباس رضى الله عنهما أن رجلا قال لرسول الله صلى الله عليه وسلم إن أمه توفيت أينفعها إن تصدقت عنها قال نعم قال فإن لي مخرافا وأشهدك أني قد تصدقت عنها 	 حدثنا محمد بن عبد الرحيم أخبرنا روح بن عبادة حدثنا زكرياء بن إسحاق قال حدثني عمرو بن دينار عن عكرمة عن ابن عباس رضى الله عنهما أن رجلا قال لرسول الله صلى الله عليه وسلم إن أمه توفيت أينفعها إن تصدقت عنها قال نعم قال فإن لي مخرافا وأشهدك أني قد تصدقت عنها 	" Narrated Ibn `Abbas: A man said to Allah's Messenger (SL3M) , ""My mother died, will it benefit her if I give in charity on her behalf?"" The Prophet (SL3M) replied in the affirmative. The man said, ""I have a garden and I make you a witness that I give it in charity on her behalf."" "
bukhari55_126980	 حدثنا مسدد حدثنا عبد الوارث عن أبي التياح عن	حدثنا أنس رضى الله عنه قال أمر النبي صلى الله عليه وسلم ببناء المسجد فقال يا بني النجار ثامنوني بحائطكم هذا قالوا لا والله لا نطلب ثمنه إلا إلى الله 	 حدثنا مسدد حدثنا عبد الوارث عن أبي التياح عن أنس رضى الله عنه قال أمر النبي صلى الله عليه وسلم ببناء المسجد فقال يا بني النجار ثامنوني بحائطكم هذا قالوا لا والله لا نطلب ثمنه إلا إلى الله 	" Narrated Anas: When the Prophet (SL3M) ordered that the mosque be built, he said, ""O Bani An-Najjar! Suggest to me a price for this garden of yours."" They replied, ""By Allah! We will demand its price from none but Allah."" "
bukhari55_126990	 حدثنا مسدد حدثنا يزيد بن زريع حدثنا ابن عون عن نافع عن	عن ابن عمر رضى الله عنهما قال أصاب عمر بخيبر أرضا فأتى النبي صلى الله عليه وسلم فقال أصبت أرضا لم أصب مالا قط أنفس منه فكيف تأمرني به قال إن شئت حبست أصلها وتصدقت بها فتصدق عمر أنه لا يباع أصلها ولا يوهب ولا يورث في الفقراء والقربى والرقاب وفي سبيل الله والضيف وابن السبيل ولا جناح على من وليها أن يأكل منها بالمعروف أو يطعم صديقا غير متمول فيه 	 حدثنا مسدد حدثنا يزيد بن زريع حدثنا ابن عون عن نافع عن ابن عمر رضى الله عنهما قال أصاب عمر بخيبر أرضا فأتى النبي صلى الله عليه وسلم فقال أصبت أرضا لم أصب مالا قط أنفس منه فكيف تأمرني به قال إن شئت حبست أصلها وتصدقت بها فتصدق عمر أنه لا يباع أصلها ولا يوهب ولا يورث في الفقراء والقربى والرقاب وفي سبيل الله والضيف وابن السبيل ولا جناح على من وليها أن يأكل منها بالمعروف أو يطعم صديقا غير متمول فيه 	" Narrated Ibn `Umar: When `Umar got a piece of land in Khaibar, he came to the Prophet (SL3M) saying, ""I have got a piece of land, better than which I have never got. So what do you advise me regarding it?"" The Prophet (SL3M) said, ""If you wish you can keep it as an endowment to be used for charitable purposes."" So, `Umar gave the land in charity (i.e. as an endowments on the condition that the land would neither be sold nor given as a present, nor bequeathed, (and its yield) would be used for the poor, the kinsmen, the emancipation of slaves, Jihad, and for guests and travelers; and its administrator could eat in a reasonable just manner, and he also could feed his friends without intending to be wealthy by its means."" "
bukhari55_127000	 حدثنا أبو عاصم حدثنا ابن عون عن نافع عن	حدثنا ابن عمر أن عمر رضى الله عنه وجد مالا بخيبر فأتى النبي صلى الله عليه وسلم فأخبره قال إن شئت تصدقت بها فتصدق بها في الفقراء والمساكين وذي القربى والضيف 	 حدثنا أبو عاصم حدثنا ابن عون عن نافع عن ابن عمر أن عمر رضى الله عنه وجد مالا بخيبر فأتى النبي صلى الله عليه وسلم فأخبره قال إن شئت تصدقت بها فتصدق بها في الفقراء والمساكين وذي القربى والضيف 	" Narrated Ibn `Umar: `Umar got some property in Khaibar and he came to the Prophet (SL3M) and informed him about it. The Prophet said to him, ""If you wish you can give it in charity."" So `Umar gave it in charity (i.e. as an endowment) the yield of which was to be used for the good of the poor, the needy, the kinsmen and the guests. "
bukhari55_127010	 حدثنا إسحاق حدثنا عبد الصمد قال سمعت أبي حدثنا أبو التياح قال حدثني أنس بن	حدثنا مالك رضى الله عنه لما قدم رسول الله صلى الله عليه وسلم المدينة أمر بالمسجد وقال يا بني النجار ثامنوني بحائطكم هذا قالوا لا والله لا نطلب ثمنه إلا إلى الله 	 حدثنا إسحاق حدثنا عبد الصمد قال سمعت أبي حدثنا أبو التياح قال حدثني أنس بن مالك رضى الله عنه لما قدم رسول الله صلى الله عليه وسلم المدينة أمر بالمسجد وقال يا بني النجار ثامنوني بحائطكم هذا قالوا لا والله لا نطلب ثمنه إلا إلى الله 	" Narrated Anas bin Malik: When Allah's Messenger (SL3M) came to Medina, he ordered that a mosque be built. He said, ""O Bani An- Najjar! Suggest me a price for the garden of yours."" They replied, ""By Allah, we will not ask its price except from Allah."" "
bukhari55_127020	 حدثنا مسدد حدثنا يحيى حدثنا عبيد الله قال حدثني نافع عن	حدثني ابن عمر رضى الله عنهما أن عمر حمل على فرس له في سبيل الله أعطاها رسول الله صلى الله عليه وسلم ليحمل عليها رجلا فأخبر عمر أنه قد وقفها يبيعها فسأل رسول الله صلى الله عليه وسلم أن يبتاعها فقال لا تبتعها ولا ترجعن في صدقتك 	 حدثنا مسدد حدثنا يحيى حدثنا عبيد الله قال حدثني نافع عن ابن عمر رضى الله عنهما أن عمر حمل على فرس له في سبيل الله أعطاها رسول الله صلى الله عليه وسلم ليحمل عليها رجلا فأخبر عمر أنه قد وقفها يبيعها فسأل رسول الله صلى الله عليه وسلم أن يبتاعها فقال لا تبتعها ولا ترجعن في صدقتك 	" Narrated Ibn `Umar: Once `Umar gave a horse in charity to be used in holy fighting. It had been given to him by Allah's Apostle . `Umar gave it to another man to ride. Then `Umar was informed that the man put the horse for sale, so he asked Allah's Messenger (SL3M) whether he could buy it. Allah's Messenger (SL3M) replied, ""You should not buy it, for you should not take back what you have given in charity."" "
bukhari55_127030	 حدثنا عبد الله بن يوسف أخبرنا مالك عن أبي الزناد عن الأعرج عن	عن أبي هريرة رضى الله عنه أن رسول الله صلى الله عليه وسلم قال لا يقتسم ورثتي دينارا ما تركت بعد نفقة نسائي ومئونة عاملي فهو صدقة 	 حدثنا عبد الله بن يوسف أخبرنا مالك عن أبي الزناد عن الأعرج عن أبي هريرة رضى الله عنه أن رسول الله صلى الله عليه وسلم قال لا يقتسم ورثتي دينارا ما تركت بعد نفقة نسائي ومئونة عاملي فهو صدقة 	" Narrated Abu Huraira: Allah's Messenger (SL3M) said, ""My heirs will not inherit a Dinar or a Dirham (i.e. money), for whatever I leave (excluding the adequate support of my wives and the wages of my employees) is given in charity."" "
bukhari55_127040	 حدثنا قتيبة بن سعيد حدثنا حماد عن أيوب عن نافع عن	عن ابن عمر رضى الله عنهما أن عمر اشترط في وقفه أن يأكل من وليه ويوكل صديقه غير متمول مالا 	 حدثنا قتيبة بن سعيد حدثنا حماد عن أيوب عن نافع عن ابن عمر رضى الله عنهما أن عمر اشترط في وقفه أن يأكل من وليه ويوكل صديقه غير متمول مالا 	 Narrated Ibn `Umar: When `Umar founded an endowment he stipulated that its administrator could eat from it and also feed his friend on the condition that he would not store anything for himself from it. 
bukhari55_127050	not identified	 وقال عبدان أخبرني أبي عن شعبة عن أبي إسحاق عن أبي عبد الرحمن أن عثمان رضى الله عنه حيث حوصر أشرف عليهم وقال أنشدكم ولا أنشد إلا أصحاب النبي صلى الله عليه وسلم ألستم تعلمون أن رسول الله صلى الله عليه وسلم قال من حفر رومة فله الجنة فحفرتها ألستم تعلمون أنه قال من جهز جيش العسرة فله الجنة فجهزتهم قال فصدقوه بما قال وقال عمر في وقفه لا جناح على من وليه أن يأكل وقد يليه الواقف وغيره فهو واسع لكل 	 وقال عبدان أخبرني أبي عن شعبة عن أبي إسحاق عن أبي عبد الرحمن أن عثمان رضى الله عنه حيث حوصر أشرف عليهم وقال أنشدكم ولا أنشد إلا أصحاب النبي صلى الله عليه وسلم ألستم تعلمون أن رسول الله صلى الله عليه وسلم قال من حفر رومة فله الجنة فحفرتها ألستم تعلمون أنه قال من جهز جيش العسرة فله الجنة فجهزتهم قال فصدقوه بما قال وقال عمر في وقفه لا جناح على من وليه أن يأكل وقد يليه الواقف وغيره فهو واسع لكل 	" Abu 'Abdur-Rahman narrated: When 'Uthman (ra) was circled (by the rebels), he looked upon them from above and said, ""Ias you by Allah, I ask nobody but the Companions of the Prophet (SL3M) (SL3M), dont you know that Allah's Messenger (SL3M) said, 'Whoever will (buy and) dig the well of Ruma will be granted Paradise,' and I (bought and) dug it? Don't you know that he said. 'Whoever equip the army of 'Usra (i.e., Tabuk's Ghazwa) will be granted Paradise,' and I equipped it ?"" They attested whatever he said.When 'Umar founded his endowment he said, ""Its administrator can eat from it."" The management of the endowment can be taken over by the founder himself or any other person, for both cases are permissible. "
bukhari55_127060	 حدثنا مسدد حدثنا عبد الوارث عن أبي التياح عن	حدثنا أنس رضى الله عنه قال النبي صلى الله عليه وسلم يا بني النجار ثامنوني بحائطكم قالوا لا نطلب ثمنه إلا إلى الله 	 حدثنا مسدد حدثنا عبد الوارث عن أبي التياح عن أنس رضى الله عنه قال النبي صلى الله عليه وسلم يا بني النجار ثامنوني بحائطكم قالوا لا نطلب ثمنه إلا إلى الله 	" Narrated Anas: The Prophet (SL3M) said (at the time of building the Mosque), ""O Ban, An-Najjar! Suggest to me a price for your garden."" They replied, ""We do not ask its price except from Allah."" "
bukhari55_127070	not identified	 وقال لي علي بن عبد الله حدثنا يحيى بن آدم حدثنا ابن أبي زائدة عن محمد بن أبي القاسم عن عبد الملك بن سعيد بن جبير عن أبيه عن ابن عباس رضى الله عنهما قال خرج رجل من بني سهم مع تميم الداري وعدي بن بداء فمات السهمي بأرض ليس بها مسلم فلما قدما بتركته فقدوا جاما من فضة مخوصا من ذهب فأحلفهما رسول الله صلى الله عليه وسلم ثم وجد الجام بمكة فقالوا ابتعناه من تميم وعدي فقام رجلان من أوليائه فحلفا لشهادتنا أحق من شهادتهما وإن الجام لصاحبهم قال وفيهم نزلت هذه الآية {يا أيها الذين آمنوا شهادة بينكم إذا حضر أحدكم الموت} 	 وقال لي علي بن عبد الله حدثنا يحيى بن آدم حدثنا ابن أبي زائدة عن محمد بن أبي القاسم عن عبد الملك بن سعيد بن جبير عن أبيه عن ابن عباس رضى الله عنهما قال خرج رجل من بني سهم مع تميم الداري وعدي بن بداء فمات السهمي بأرض ليس بها مسلم فلما قدما بتركته فقدوا جاما من فضة مخوصا من ذهب فأحلفهما رسول الله صلى الله عليه وسلم ثم وجد الجام بمكة فقالوا ابتعناه من تميم وعدي فقام رجلان من أوليائه فحلفا لشهادتنا أحق من شهادتهما وإن الجام لصاحبهم قال وفيهم نزلت هذه الآية {يا أيها الذين آمنوا شهادة بينكم إذا حضر أحدكم الموت} 	" Ibn 'Abbas (ra) said, ""A man from the tribe of Bani Sahm went out in the company of Tamim Ad-Dari and 'Adi bin Badda'. The man of Bani Sahm died in a land where there was no Muslim. When Tamim and 'Adi returned conveying the property of the deceased, they claimed that they had lost a silver bowl with gold engraving. Allah's Messenger (SL3M) made them take an oath (to confirm their claim), and then the bowl was found in Makkah with some people who claimed that they had bought it from Tamim and 'Adu, Then two witnesses from the relatives of the deceased got up and swore that their witnesses were more valid than the witnesses of 'Adi and Tamim, and that the bowl belonged to their deceased fellow. So, this verse was revealed in connection with this case ; 'O you who believe! When death approached any of you ...',"" (V 5: 106) "
