bukhari30_118400	 حدثنا محمد بن المثنى حدثنا يحيى عن هشام قال أخبرني أبي عن عائشة عن	عن النبي صلى الله عليه وسلم ح وحدثنا عبد الله بن مسلمة عن مالك عن هشام عن أبيه عن عائشة رضى الله عنها قالت إن كان رسول الله صلى الله عليه وسلم ليقبل بعض أزواجه وهو صائم ثم ضحكت 	 حدثنا محمد بن المثنى حدثنا يحيى عن هشام قال أخبرني أبي عن عائشة عن النبي صلى الله عليه وسلم ح وحدثنا عبد الله بن مسلمة عن مالك عن هشام عن أبيه عن عائشة رضى الله عنها قالت إن كان رسول الله صلى الله عليه وسلم ليقبل بعض أزواجه وهو صائم ثم ضحكت 	" Narrated Hisham's father: Aisha said, ""Allah's Messenger (SL3M) used to kiss some of his wives while he was fasting,"" and then she smiled. "
bukhari30_118410	 حدثنا مسدد حدثنا يحيى عن هشام بن	حدثنا أبي عبد الله حدثنا يحيى بن أبي كثير عن أبي سلمة عن زينب ابنة أم سلمة عن أمها رضى الله عنهما قالت بينما أنا مع رسول الله صلى الله عليه وسلم في الخميلة إذ حضت فانسللت فأخذت ثياب حيضتي فقال ما لك أنفست قلت نعم فدخلت معه في الخميلة وكانت هي ورسول الله صلى الله عليه وسلم يغتسلان من إناء واحد وكان يقبلها وهو صائم 	 حدثنا مسدد حدثنا يحيى عن هشام بن أبي عبد الله حدثنا يحيى بن أبي كثير عن أبي سلمة عن زينب ابنة أم سلمة عن أمها رضى الله عنهما قالت بينما أنا مع رسول الله صلى الله عليه وسلم في الخميلة إذ حضت فانسللت فأخذت ثياب حيضتي فقال ما لك أنفست قلت نعم فدخلت معه في الخميلة وكانت هي ورسول الله صلى الله عليه وسلم يغتسلان من إناء واحد وكان يقبلها وهو صائم 	" Narrated Zainab: (daughter of Um Salama) that her mother said, ""While I was (lying) with Allah's Messenger (SL3M) underneath a woolen sheet, I got the menstruation, and then slipped away and put on the clothes (which I used to wear) in menses. He asked, ""What is the matter? Did you get your menses?"" I replied in the affirmative and then entered underneath that woolen sheet. I and Allah's Messenger (SL3M) used to take a bath from one water pot and he used to kiss me while he was fasting."" "
bukhari30_118420	 حدثنا أحمد بن صالح حدثنا ابن وهب حدثنا يونس عن ابن شهاب عن	عن عروة وأبي بكر قالت عائشة رضى الله عنها كان النبي صلى الله عليه وسلم يدركه الفجر {جنبا} في رمضان من غير حلم فيغتسل ويصوم 	 حدثنا أحمد بن صالح حدثنا ابن وهب حدثنا يونس عن ابن شهاب عن عروة وأبي بكر قالت عائشة رضى الله عنها كان النبي صلى الله عليه وسلم يدركه الفجر {جنبا} في رمضان من غير حلم فيغتسل ويصوم 	 Narrated `Aisha: (At times) in Ramadan the Prophet (SL3M) used to take a bath in the morning not because of a wet dream and would continue his fast. 
bukhari30_118430	 حدثنا إسماعيل قال حدثني مالك عن سمى مولى أبي بكر بن عبد الرحمن بن	عن الحارث بن هشام بن المغيرة أنه سمع أبا بكر بن عبد الرحمن كنت أنا وأبي فذهبت معه حتى دخلنا على عائشة رضى الله عنها قالت أشهد على رسول الله صلى الله عليه وسلم إن كان ليصبح جنبا من جماع غير احتلام ثم يصومه ثم دخلنا على أم سلمة فقالت مثل ذلك 	 حدثنا إسماعيل قال حدثني مالك عن سمى مولى أبي بكر بن عبد الرحمن بن الحارث بن هشام بن المغيرة أنه سمع أبا بكر بن عبد الرحمن كنت أنا وأبي فذهبت معه حتى دخلنا على عائشة رضى الله عنها قالت أشهد على رسول الله صلى الله عليه وسلم إن كان ليصبح جنبا من جماع غير احتلام ثم يصومه ثم دخلنا على أم سلمة فقالت مثل ذلك 	" Narrated Abu Bakr bin `Abdur-Rahman: My father and I went to `Aisha and she said, ""I testify that Allah's Messenger (SL3M) at times used to get up in the morning in a state of Janaba from sexual intercourse, not from a wet dream and then he would fast that day."" Then he went to Um Salama and she also narrated a similar thing. "
bukhari30_118440	 حدثنا عبدان أخبرنا يزيد بن زريع حدثنا هشام حدثنا ابن سيرين عن أبي هريرة رضى الله عنه عن	حدثنا النبي صلى الله عليه وسلم قال إذا نسي فأكل وشرب فليتم صومه فإنما أطعمه الله وسقاه 	 حدثنا عبدان أخبرنا يزيد بن زريع حدثنا هشام حدثنا ابن سيرين عن أبي هريرة رضى الله عنه عن النبي صلى الله عليه وسلم قال إذا نسي فأكل وشرب فليتم صومه فإنما أطعمه الله وسقاه 	" Narrated Abu Huraira: The Prophet (SL3M) said, ""If somebody eats or drinks forgetfully then he should complete his fast, for what he has eaten or drunk, has been given to him by Allah."" "
bukhari30_118450	 حدثنا عبدان أخبرنا عبد الله أخبرنا معمر قال حدثني الزهري عن عطاء بن يزيد عن	حدثني حمران رأيت عثمان رضى الله عنه توضأ فأفرغ على يديه ثلاثا ثم تمضمض واستنثر ثم غسل وجهه ثلاثا ثم غسل يده اليمنى إلى المرفق ثلاثا ثم غسل يده اليسرى إلى المرفق ثلاثا ثم مسح برأسه ثم غسل رجله اليمنى ثلاثا ثم اليسرى ثلاثا ثم قال رأيت رسول الله صلى الله عليه وسلم توضأ نحو وضوئي هذا ثم قال من توضأ وضوئي هذا ثم يصلي ركعتين لا يحدث نفسه فيهما بشىء إلا غفر له ما تقدم من ذنبه 	 حدثنا عبدان أخبرنا عبد الله أخبرنا معمر قال حدثني الزهري عن عطاء بن يزيد عن حمران رأيت عثمان رضى الله عنه توضأ فأفرغ على يديه ثلاثا ثم تمضمض واستنثر ثم غسل وجهه ثلاثا ثم غسل يده اليمنى إلى المرفق ثلاثا ثم غسل يده اليسرى إلى المرفق ثلاثا ثم مسح برأسه ثم غسل رجله اليمنى ثلاثا ثم اليسرى ثلاثا ثم قال رأيت رسول الله صلى الله عليه وسلم توضأ نحو وضوئي هذا ثم قال من توضأ وضوئي هذا ثم يصلي ركعتين لا يحدث نفسه فيهما بشىء إلا غفر له ما تقدم من ذنبه 	" Narrated Humran: I saw `Uthman performing ablution; he washed his hands thrice, rinsed his mouth and then washed his nose, by putting water in it and then blowing it out, and washed his face thrice, and then washed his right forearm up to the elbow thrice, and then the left-forearm up to the elbow thrice, then smeared his head with water, washed his right foot thrice, and then his left foot thrice and said, ""I saw Allah's Apostle performing ablution similar to my present ablution, and then he said, 'Whoever performs ablution like my present ablution and then offers two rak`at in which he does not think of worldly things, all his previous sins will be forgiven."" "
bukhari30_118460	 حدثنا عبد الله بن منير سمع يزيد بن هارون حدثنا يحيى هو ابن سعيد أن عبد الرحمن بن	حدثنا القاسم أخبره عن محمد بن جعفر بن الزبير بن العوام بن خويلد عن عباد بن عبد الله بن الزبير أخبره أنه سمع عائشة رضى الله عنها تقول إن رجلا أتى النبي صلى الله عليه وسلم فقال إنه احترق قال مالك قال أصبت أهلي في رمضان فأتي النبي صلى الله عليه وسلم بمكتل يدعى العرق فقال أين المحترق قال أنا قال تصدق بهذا 	 حدثنا عبد الله بن منير سمع يزيد بن هارون حدثنا يحيى هو ابن سعيد أن عبد الرحمن بن القاسم أخبره عن محمد بن جعفر بن الزبير بن العوام بن خويلد عن عباد بن عبد الله بن الزبير أخبره أنه سمع عائشة رضى الله عنها تقول إن رجلا أتى النبي صلى الله عليه وسلم فقال إنه احترق قال مالك قال أصبت أهلي في رمضان فأتي النبي صلى الله عليه وسلم بمكتل يدعى العرق فقال أين المحترق قال أنا قال تصدق بهذا 	" Narrated `Aisha: A man came to the Prophet (SL3M) and said that he had been burnt (ruined). The Prophet (SL3M) asked him what was the matter. He replied, ""I had sexual intercourse with my wife in Ramadan (while I was fasting)."" Then a basket full of dates was brought to the Prophet (SL3M) and he asked, ""Where is the burnt (ruined) man?"" He replied, ""I am present."" The Prophet (SL3M) told him to give that basket in charity (as expiation). "
bukhari30_118470	 حدثنا أبو اليمان أخبرنا شعيب عن الزهري قال أخبرني حميد بن	عن عبد الرحمن أن أبا هريرة رضى الله عنه قال بينما نحن جلوس عند النبي صلى الله عليه وسلم إذ جاءه رجل فقال يا رسول الله هلكت قال ما لك قال وقعت على امرأتي وأنا صائم فقال رسول الله صلى الله عليه وسلم هل تجد رقبة تعتقها قال لا قال فهل تستطيع أن تصوم شهرين متتابعين قال لا فقال فهل تجد إطعام ستين مسكينا قال لا قال فمكث النبي صلى الله عليه وسلم فبينا نحن على ذلك أتي النبي صلى الله عليه وسلم بعرق فيها تمر والعرق المكتل قال أين السائل فقال أنا قال خذها فتصدق به فقال الرجل أعلى أفقر مني يا رسول الله فوالله ما بين لابتيها يريد الحرتين أهل بيت أفقر من أهل بيتي فضحك النبي صلى الله عليه وسلم حتى بدت أنيابه ثم قال أطعمه أهلك 	 حدثنا أبو اليمان أخبرنا شعيب عن الزهري قال أخبرني حميد بن عبد الرحمن أن أبا هريرة رضى الله عنه قال بينما نحن جلوس عند النبي صلى الله عليه وسلم إذ جاءه رجل فقال يا رسول الله هلكت قال ما لك قال وقعت على امرأتي وأنا صائم فقال رسول الله صلى الله عليه وسلم هل تجد رقبة تعتقها قال لا قال فهل تستطيع أن تصوم شهرين متتابعين قال لا فقال فهل تجد إطعام ستين مسكينا قال لا قال فمكث النبي صلى الله عليه وسلم فبينا نحن على ذلك أتي النبي صلى الله عليه وسلم بعرق فيها تمر والعرق المكتل قال أين السائل فقال أنا قال خذها فتصدق به فقال الرجل أعلى أفقر مني يا رسول الله فوالله ما بين لابتيها يريد الحرتين أهل بيت أفقر من أهل بيتي فضحك النبي صلى الله عليه وسلم حتى بدت أنيابه ثم قال أطعمه أهلك 	" Narrated Abu Huraira: While we were sitting with the Prophet (SL3M) a man came and said, ""O Allah's Messenger (SL3M)! I have been ruined."" Allah's Messenger (SL3M) asked what was the matter with him. He replied ""I had sexual intercourse with my wife while I was fasting."" Allah's Messenger (SL3M) asked him, ""Can you afford to manumit a slave?"" He replied in the negative. Allah's Messenger (SL3M) asked him, ""Can you fast for two successive months?"" He replied in the negative. The Prophet (SL3M) asked him, ""Can you afford to feed sixty poor persons?"" He replied in the negative. The Prophet (SL3M) kept silent and while we were in that state, a big basket full of dates was brought to the Prophet (SL3M) . He asked, ""Where is the questioner?"" He replied, ""I (am here)."" The Prophet (SL3M) said (to him), ""Take this (basket of dates) and give it in charity."" The man said, ""Should I give it to a person poorer than I? By Allah; there is no family between its (i.e. Medina's) two mountains who are poorer than I."" The Prophet (SL3M) smiled till his premolar teeth became visible and then said, 'Feed your family with it."" "
bukhari30_118480	 حدثنا عثمان بن أبي شيبة حدثنا جرير عن منصور عن الزهري عن حميد بن عبد الرحمن عن	عن أبي هريرة رضى الله عنه جاء رجل إلى النبي صلى الله عليه وسلم فقال إن الأخر وقع على امرأته في رمضان فقال أتجد ما تحرر رقبة قال لا قال فتستطيع أن تصوم شهرين متتابعين قال لا قال أفتجد ما تطعم به ستين مسكينا قال لا قال فأتي النبي صلى الله عليه وسلم بعرق فيه تمر وهو الزبيل قال أطعم هذا عنك قال على أحوج منا ما بين لابتيها أهل بيت أحوج منا قال فأطعمه أهلك 	 حدثنا عثمان بن أبي شيبة حدثنا جرير عن منصور عن الزهري عن حميد بن عبد الرحمن عن أبي هريرة رضى الله عنه جاء رجل إلى النبي صلى الله عليه وسلم فقال إن الأخر وقع على امرأته في رمضان فقال أتجد ما تحرر رقبة قال لا قال فتستطيع أن تصوم شهرين متتابعين قال لا قال أفتجد ما تطعم به ستين مسكينا قال لا قال فأتي النبي صلى الله عليه وسلم بعرق فيه تمر وهو الزبيل قال أطعم هذا عنك قال على أحوج منا ما بين لابتيها أهل بيت أحوج منا قال فأطعمه أهلك 	" Narrated Abu Huraira: A man came to the Prophet (SL3M) and said, ""I had sexual intercourse with my wife on Ramadan (while fasting)."" The Prophet (SL3M) asked him, ""Can you afford to manumit a slave?"" He replied in the negative. The Prophet (SL3M) asked him, ""Can you fast for two successive months?"" He replied in the negative. He asked him, ""Can you afford to feed sixty poor persons?"" He replied in the negative. (Abu Huraira added): Then a basket full of dates was brought to the Prophet (SL3M) and he said (to that man), ""Feed (poor people) with this by way of atonement."" He said, ""(Should I feed it) to poorer people than we? There is no poorer house than ours between its (Medina's) mountains."" The Prophet (SL3M) said, ""Then feed your family with it."" "
bukhari30_118500	 حدثنا معلى بن أسد حدثنا وهيب عن أيوب عن عكرمة عن	عن ابن عباس رضى الله عنهما أن النبي صلى الله عليه وسلم احتجم وهو محرم واحتجم وهو صائم 	 حدثنا معلى بن أسد حدثنا وهيب عن أيوب عن عكرمة عن ابن عباس رضى الله عنهما أن النبي صلى الله عليه وسلم احتجم وهو محرم واحتجم وهو صائم 	 Narrated Ibn `Abbas: The Prophet (SL3M) was cupped while he was in the state of lhram, and also while he was observing a fast. 
bukhari30_118510	 حدثنا أبو معمر حدثنا عبد الوارث حدثنا أيوب عن عكرمة عن	عن ابن عباس رضى الله عنهما قال احتجم النبي صلى الله عليه وسلم وهو صائم 	 حدثنا أبو معمر حدثنا عبد الوارث حدثنا أيوب عن عكرمة عن ابن عباس رضى الله عنهما قال احتجم النبي صلى الله عليه وسلم وهو صائم 	 Narrated Ibn `Abbas: The Prophet (SL3M) was cupped while he was fasting. 
bukhari30_118520	 حدثنا آدم بن أبي إياس حدثنا شعبة قال سمعت ثابتا البناني يسأل أنس بن	حدثنا مالك رضى الله عنه أكنتم تكرهون الحجامة للصائم قال لا إلا من أجل الضعف وزاد شبابة حدثنا شعبة على عهد النبي صلى الله عليه وسلم 	 حدثنا آدم بن أبي إياس حدثنا شعبة قال سمعت ثابتا البناني يسأل أنس بن مالك رضى الله عنه أكنتم تكرهون الحجامة للصائم قال لا إلا من أجل الضعف وزاد شبابة حدثنا شعبة على عهد النبي صلى الله عليه وسلم 	" Narrated Thabit Al-Bunani: Anas bin Malik was asked whether they disliked the cupping for a fasting person. He replied in the negative and said, ""Only if it causes weakness."" "
bukhari30_118530	 حدثنا علي بن عبد الله حدثنا سفيان عن	حدثنا أبي إسحاق الشيباني سمع ابن أبي أوفى رضى الله عنه قال كنا مع رسول الله صلى الله عليه وسلم في سفر فقال لرجل انزل فاجدح لي قال يا رسول الله الشمس قال انزل فاجدح لي قال يا رسول الله الشمس قال انزل فاجدح لي فنزل فجدح له فشرب ثم رمى بيده ها هنا ثم قال إذا رأيتم الليل أقبل من ها هنا فقد أفطر الصائم تابعه جرير وأبو بكر بن عياش عن الشيباني عن ابن أبي أوفى قال كنت مع النبي صلى الله عليه وسلم في سفر 	 حدثنا علي بن عبد الله حدثنا سفيان عن أبي إسحاق الشيباني سمع ابن أبي أوفى رضى الله عنه قال كنا مع رسول الله صلى الله عليه وسلم في سفر فقال لرجل انزل فاجدح لي قال يا رسول الله الشمس قال انزل فاجدح لي قال يا رسول الله الشمس قال انزل فاجدح لي فنزل فجدح له فشرب ثم رمى بيده ها هنا ثم قال إذا رأيتم الليل أقبل من ها هنا فقد أفطر الصائم تابعه جرير وأبو بكر بن عياش عن الشيباني عن ابن أبي أوفى قال كنت مع النبي صلى الله عليه وسلم في سفر 	" Narrated Ibn Abi `Aufa: We were in the company of Allah's Messenger (SL3M) on a journey. He said to a man, ""Get down and mix Sawiq (powdered barley) with water for me."" The man said, ""The sun (has not set yet), O Allah's Messenger (SL3M)."" The Prophet (SL3M) again said to him, ""Get down and mix Sawiq with water for me."" The man again said, ""O Allah's Messenger (SL3M)! The sun!"" The Prophet (SL3M) said to him (for the third time) ""Get down and mix Sawiq with water for me."" The man dismounted and mixed Sawiq with water for him. The Prophet (SL3M) drank it and then beckoned with his hand (towards the East) and said, ""When you see the night falling from this side, then a fasting person should break his fast."" "
bukhari30_118540	 حدثنا مسدد حدثنا يحيى عن هشام قال حدثني أبي عن عائشة أن حمزة بن	عن عمرو الأسلمي قال يا رسول الله إني أسرد الصوم 	 حدثنا مسدد حدثنا يحيى عن هشام قال حدثني أبي عن عائشة أن حمزة بن عمرو الأسلمي قال يا رسول الله إني أسرد الصوم 	" Narrated `Aisha: Hamza bin `Amr Al-Aslami said, ""O Allah's Messenger (SL3M)! I fast continuously."" "
bukhari30_118550	 حدثنا عبد الله بن يوسف أخبرنا مالك عن هشام بن	حدثنا عروة عن أبيه عن عائشة رضى الله عنها زوج النبي صلى الله عليه وسلم أن حمزة بن عمرو الأسلمي قال للنبي صلى الله عليه وسلم أأصوم في السفر وكان كثير الصيام فقال إن شئت فصم وإن شئت فأفطر 	 حدثنا عبد الله بن يوسف أخبرنا مالك عن هشام بن عروة عن أبيه عن عائشة رضى الله عنها زوج النبي صلى الله عليه وسلم أن حمزة بن عمرو الأسلمي قال للنبي صلى الله عليه وسلم أأصوم في السفر وكان كثير الصيام فقال إن شئت فصم وإن شئت فأفطر 	" Narrated `Aisha: (the wife of the Prophet) Hamza bin `Amr Al-Aslami asked the Prophet, ""Should I fast while traveling?"" The Prophet (SL3M) replied, ""You may fast if you wish, and you may not fast if you wish."" "
bukhari30_118560	 حدثنا عبد الله بن يوسف أخبرنا مالك عن ابن شهاب عن عبيد الله بن عبد الله بن	عن عتبة عن ابن عباس رضى الله عنهما أن رسول الله صلى الله عليه وسلم خرج إلى مكة في رمضان فصام حتى بلغ الكديد أفطر فأفطر الناس قال أبو عبد الله والكديد ماء بين عسفان وقديد 	 حدثنا عبد الله بن يوسف أخبرنا مالك عن ابن شهاب عن عبيد الله بن عبد الله بن عتبة عن ابن عباس رضى الله عنهما أن رسول الله صلى الله عليه وسلم خرج إلى مكة في رمضان فصام حتى بلغ الكديد أفطر فأفطر الناس قال أبو عبد الله والكديد ماء بين عسفان وقديد 	" Narrated Ibn `Abbas: Allah's Messenger (SL3M) set out for Mecca in Ramadan and he fasted, and when he reached Al-Kadid, he broke his fast and the people (with him) broke their fast too. (Abu `Abdullah said, ""Al-Kadid is a land covered with water between Usfan and Qudaid."") "
bukhari30_118570	 حدثنا عبد الله بن يوسف حدثنا يحيى بن حمزة عن عبد الرحمن بن يزيد بن جابر أن إسماعيل بن	عن عبيد الله حدثه عن أم الدرداء عن أبي الدرداء رضى الله عنه قال خرجنا مع النبي صلى الله عليه وسلم في بعض أسفاره في يوم حار حتى يضع الرجل يده على رأسه من شدة الحر وما فينا صائم إلا ما كان من النبي صلى الله عليه وسلم وابن رواحة 	 حدثنا عبد الله بن يوسف حدثنا يحيى بن حمزة عن عبد الرحمن بن يزيد بن جابر أن إسماعيل بن عبيد الله حدثه عن أم الدرداء عن أبي الدرداء رضى الله عنه قال خرجنا مع النبي صلى الله عليه وسلم في بعض أسفاره في يوم حار حتى يضع الرجل يده على رأسه من شدة الحر وما فينا صائم إلا ما كان من النبي صلى الله عليه وسلم وابن رواحة 	 Narrated Abu Ad-Darda: We set out with Allah's Messenger (SL3M) on one of his journeys on a very hot day, and it was so hot that one had to put his hand over his head because of the severity of heat. None of us was fasting except the Prophet and Ibn Rawaha. 
bukhari30_118580	 حدثنا آدم حدثنا شعبة حدثنا محمد بن	حدثنا عبد الرحمن الأنصاري قال سمعت محمد بن عمرو بن الحسن بن علي عن جابر بن عبد الله رضى الله عنهم قال كان رسول الله صلى الله عليه وسلم في سفر فرأى زحاما ورجلا قد ظلل عليه فقال ما هذا فقالوا صائم فقال ليس من البر الصوم في السفر 	 حدثنا آدم حدثنا شعبة حدثنا محمد بن عبد الرحمن الأنصاري قال سمعت محمد بن عمرو بن الحسن بن علي عن جابر بن عبد الله رضى الله عنهم قال كان رسول الله صلى الله عليه وسلم في سفر فرأى زحاما ورجلا قد ظلل عليه فقال ما هذا فقالوا صائم فقال ليس من البر الصوم في السفر 	" Narrated Jabir bin `Abdullah: Allah's Messenger (SL3M) was on a journey and saw a crowd of people, and a man was being shaded (by them). He asked, ""What is the matter?"" They said, ""He (the man) is fasting."" The Prophet (SL3M) said, ""It is not righteousness that you fast on a journey."" "
