bukhari79_153430	 حدثنا إسحاق أخبرنا يعقوب حدثنا أبي عن صالح عن ابن شهاب قال أخبرني عروة بن	عن الزبير أن عائشة رضى الله عنها زوج النبي صلى الله عليه وسلم قالت كان عمر بن الخطاب يقول لرسول الله صلى الله عليه وسلم احجب نساءك قالت فلم يفعل وكان أزواج النبي صلى الله عليه وسلم يخرجن ليلا إلى ليل قبل المناصع خرجت سودة بنت زمعة وكانت امرأة طويلة فرآها عمر بن الخطاب وهو في المجلس فقال عرفتك يا سودة حرصا على أن ينزل الحجاب قالت فأنزل الله عز وجل آية الحجاب 	 حدثنا إسحاق أخبرنا يعقوب حدثنا أبي عن صالح عن ابن شهاب قال أخبرني عروة بن الزبير أن عائشة رضى الله عنها زوج النبي صلى الله عليه وسلم قالت كان عمر بن الخطاب يقول لرسول الله صلى الله عليه وسلم احجب نساءك قالت فلم يفعل وكان أزواج النبي صلى الله عليه وسلم يخرجن ليلا إلى ليل قبل المناصع خرجت سودة بنت زمعة وكانت امرأة طويلة فرآها عمر بن الخطاب وهو في المجلس فقال عرفتك يا سودة حرصا على أن ينزل الحجاب قالت فأنزل الله عز وجل آية الحجاب 	" Narrated `Aisha: (the wife of the Prophet) `Umar bin Al-Khattab used to say to Allah's Messenger (SL3M) ""Let your wives be veiled"" But he did not do so. The wives of the Prophet (SL3M) used to go out to answer the call of nature at night only at Al-Manasi.' Once Sauda, the daughter of Zam`a went out and she was a tall woman. `Umar bin Al-Khattab saw her while he was in a gathering, and said, ""I have recognized you, O Sauda!"" He (`Umar) said so as he was anxious for some Divine orders regarding the veil (the veiling of women.) So Allah revealed the Verse of veiling. (Al-Hijab; a complete body cover excluding the eyes). (See Hadith No. 148, Vol. 1) "
bukhari79_153440	 حدثنا علي بن عبد الله حدثنا سفيان قال الزهري حفظته كما أنك ها هنا عن سهل بن	عن سعد قال اطلع رجل من جحر في حجر النبي صلى الله عليه وسلم ومع النبي صلى الله عليه وسلم مدرى يحك به رأسه فقال لو أعلم أنك تنظر لطعنت به في عينك إنما جعل الاستئذان من أجل البصر 	 حدثنا علي بن عبد الله حدثنا سفيان قال الزهري حفظته كما أنك ها هنا عن سهل بن سعد قال اطلع رجل من جحر في حجر النبي صلى الله عليه وسلم ومع النبي صلى الله عليه وسلم مدرى يحك به رأسه فقال لو أعلم أنك تنظر لطعنت به في عينك إنما جعل الاستئذان من أجل البصر 	" Narrated Sahl bin Sa`d: A man peeped through a round hole into the dwelling place of the Prophet, while the Prophet (SL3M) had a Midray (an iron comb) with which he was scratching his head. the Prophet (SL3M) said, "" Had known you were looking (through the hole), I would have pierced your eye with it (i.e., the comb)."" Verily! The order of taking permission to enter has been enjoined because of that sight, (that one should not look unlawfully at the state of others). (See Hadith No. 807, Vol. 7) "
bukhari79_153450	 حدثنا مسدد حدثنا حماد بن زيد عن عبيد الله بن	حدثنا أبي بكر عن أنس بن مالك أن رجلا اطلع من بعض حجر النبي صلى الله عليه وسلم فقام إليه النبي صلى الله عليه وسلم بمشقص أو بمشاقص فكأني أنظر إليه يختل الرجل ليطعنه 	 حدثنا مسدد حدثنا حماد بن زيد عن عبيد الله بن أبي بكر عن أنس بن مالك أن رجلا اطلع من بعض حجر النبي صلى الله عليه وسلم فقام إليه النبي صلى الله عليه وسلم بمشقص أو بمشاقص فكأني أنظر إليه يختل الرجل ليطعنه 	 Narrated Anas bin Malik: A man peeped into a room of the Prophet. The Prophet (SL3M) stood up, holding an arrow head. It is as if I am just looking at him, trying to stab the man. 
bukhari79_153460	 حدثنا الحميدي حدثنا سفيان عن ابن طاوس عن أبيه عن	حدثنا ابن عباس رضى الله عنهما قال لم أر شيئا أشبه باللمم من قول أبي هريرة حدثني محمود أخبرنا عبد الرزاق أخبرنا معمر عن ابن طاوس عن أبيه عن ابن عباس قال ما رأيت شيئا أشبه باللمم مما قال أبو هريرة عن النبي صلى الله عليه وسلم إن الله كتب على ابن آدم حظه من الزنا أدرك ذلك لا محالة فزنا العين النظر وزنا اللسان المنطق والنفس تمنى وتشتهي والفرج يصدق ذلك كله ويكذبه 	 حدثنا الحميدي حدثنا سفيان عن ابن طاوس عن أبيه عن ابن عباس رضى الله عنهما قال لم أر شيئا أشبه باللمم من قول أبي هريرة حدثني محمود أخبرنا عبد الرزاق أخبرنا معمر عن ابن طاوس عن أبيه عن ابن عباس قال ما رأيت شيئا أشبه باللمم مما قال أبو هريرة عن النبي صلى الله عليه وسلم إن الله كتب على ابن آدم حظه من الزنا أدرك ذلك لا محالة فزنا العين النظر وزنا اللسان المنطق والنفس تمنى وتشتهي والفرج يصدق ذلك كله ويكذبه 	" Narrated Ibn `Abbas: I have not seen a thing resembling 'lamam' (minor sins) than what Abu Huraira 'narrated from the Prophet who said ""Allah has written for Adam's son his share of adultery which he commits inevitably. The adultery of the eyes is the sight (to gaze at a forbidden thing), the adultery of the tongue is the talk, and the inner self wishes and desires and the private parts testify all this or deny it."" "
bukhari79_153470	 حدثنا إسحاق أخبرنا عبد الصمد حدثنا عبد الله بن	حدثنا المثنى حدثنا ثمامة بن عبد الله عن أنس رضى الله عنه أن رسول الله صلى الله عليه وسلم كان إذا سلم سلم ثلاثا وإذا تكلم بكلمة أعادها ثلاثا 	 حدثنا إسحاق أخبرنا عبد الصمد حدثنا عبد الله بن المثنى حدثنا ثمامة بن عبد الله عن أنس رضى الله عنه أن رسول الله صلى الله عليه وسلم كان إذا سلم سلم ثلاثا وإذا تكلم بكلمة أعادها ثلاثا 	 Narrated Anas: Whenever Allah's Messenger (SL3M) greeted somebody, he used to greet him three times, and if he spoke a sentence, he used to repeat it thrice. 
bukhari79_153480	 حدثنا علي بن عبد الله حدثنا سفيان حدثنا يزيد بن	حدثنا خصيفة عن بسر بن سعيد عن أبي سعيد الخدري قال كنت في مجلس من مجالس الأنصار إذ جاء أبو موسى كأنه مذعور فقال استأذنت على عمر ثلاثا فلم يؤذن لي فرجعت فقال ما منعك قلت استأذنت ثلاثا فلم يؤذن لي فرجعت وقال رسول الله صلى الله عليه وسلم إذا استأذن أحدكم ثلاثا فلم يؤذن له فليرجع فقال والله لتقيمن عليه ببينة أمنكم أحد سمعه من النبي صلى الله عليه وسلم فقال أبى بن كعب والله لا يقوم معك إلا أصغر القوم فكنت أصغر القوم فقمت معه فأخبرت عمر أن النبي صلى الله عليه وسلم قال ذلك وقال ابن المبارك أخبرني ابن عيينة حدثني يزيد عن بسر سمعت أبا سعيد بهذا 	 حدثنا علي بن عبد الله حدثنا سفيان حدثنا يزيد بن خصيفة عن بسر بن سعيد عن أبي سعيد الخدري قال كنت في مجلس من مجالس الأنصار إذ جاء أبو موسى كأنه مذعور فقال استأذنت على عمر ثلاثا فلم يؤذن لي فرجعت فقال ما منعك قلت استأذنت ثلاثا فلم يؤذن لي فرجعت وقال رسول الله صلى الله عليه وسلم إذا استأذن أحدكم ثلاثا فلم يؤذن له فليرجع فقال والله لتقيمن عليه ببينة أمنكم أحد سمعه من النبي صلى الله عليه وسلم فقال أبى بن كعب والله لا يقوم معك إلا أصغر القوم فكنت أصغر القوم فقمت معه فأخبرت عمر أن النبي صلى الله عليه وسلم قال ذلك وقال ابن المبارك أخبرني ابن عيينة حدثني يزيد عن بسر سمعت أبا سعيد بهذا 	" Narrated Abu Sa`id Al-Khudri: While I was present in one of the gatherings of the Ansar, Abu Musa came as if he was scared, and said, ""I asked permission to enter upon `Umar three times, but I was not given the permission, so I returned."" (When `Umar came to know about it) he said to Abu Musa, ""Why did you not enter?'. Abu Musa replied, ""I asked permission three times, and I was not given it, so I returned, for Allah's Messenger (SL3M) said, ""If anyone of you asks the permission to enter thrice, and the permission is not given, then he should return.' "" `Umar said, ""By Allah! We will ask Abu Musa to bring witnesses for it."" (Abu Musa went to a gathering of the Ansar and said). ""Did anyone of you hear this from the Prophet (SL3M) ?"" Ubai bin Ka`b said, ""By Allah, none will go with you but the youngest of the people (as a witness)."" (Abu Sa`id) was the youngest of them, so I went with Abu Musa and informed `Umar that the Prophet (SL3M) had said so. (See Hadith No. 277, Vol. 3) "
bukhari79_153500	 حدثنا أبو نعيم حدثنا عمر بن ذر وحدثنا محمد بن	حدثنا مقاتل أخبرنا عبد الله أخبرنا عمر بن ذر أخبرنا مجاهد عن أبي هريرة رضى الله عنه قال دخلت مع رسول الله صلى الله عليه وسلم فوجد لبنا في قدح فقال أبا هر الحق أهل الصفة فادعهم إلى قال فأتيتهم فدعوتهم فأقبلوا فاستأذنوا فأذن لهم فدخلوا 	 حدثنا أبو نعيم حدثنا عمر بن ذر وحدثنا محمد بن مقاتل أخبرنا عبد الله أخبرنا عمر بن ذر أخبرنا مجاهد عن أبي هريرة رضى الله عنه قال دخلت مع رسول الله صلى الله عليه وسلم فوجد لبنا في قدح فقال أبا هر الحق أهل الصفة فادعهم إلى قال فأتيتهم فدعوتهم فأقبلوا فاستأذنوا فأذن لهم فدخلوا 	" Narrated Abu Huraira: I entered (the house) along with Allah's Messenger (SL3M) . There he found milk in a basin. He said, ""O Abu Hirr! Go and call the people of Suffa to me."" I went to them and invited them. They came and asked permission to enter, and when it was given, they entered. (See Hadith No. 459 for details) "
bukhari79_153510	 حدثنا علي بن الجعد أخبرنا شعبة عن سيار عن ثابت البناني عن أنس بن	عن مالك رضى الله عنه أنه مر على صبيان فسلم عليهم وقال كان النبي صلى الله عليه وسلم يفعله 	 حدثنا علي بن الجعد أخبرنا شعبة عن سيار عن ثابت البناني عن أنس بن مالك رضى الله عنه أنه مر على صبيان فسلم عليهم وقال كان النبي صلى الله عليه وسلم يفعله 	" Narrated Anas bin Malik: that he passed by a group of boys and greeted them and said, ""The Prophet (SL3M) used to do so."" "
bukhari79_153520	 حدثنا عبد الله بن مسلمة حدثنا ابن أبي حازم عن أبيه عن	عن سهل قال كنا نفرح يوم الجمعة قلت ولم قال كانت لنا عجوز ترسل إلى بضاعة قال ابن مسلمة نخل بالمدينة فتأخذ من أصول السلق فتطرحه في قدر وتكركر حبات من شعير فإذا صلينا الجمعة انصرفنا ونسلم عليها فتقدمه إلينا فنفرح من أجله وما كنا نقيل ولا نتغدى إلا بعد الجمعة 	 حدثنا عبد الله بن مسلمة حدثنا ابن أبي حازم عن أبيه عن سهل قال كنا نفرح يوم الجمعة قلت ولم قال كانت لنا عجوز ترسل إلى بضاعة قال ابن مسلمة نخل بالمدينة فتأخذ من أصول السلق فتطرحه في قدر وتكركر حبات من شعير فإذا صلينا الجمعة انصرفنا ونسلم عليها فتقدمه إلينا فنفرح من أجله وما كنا نقيل ولا نتغدى إلا بعد الجمعة 	" Narrated Abu Hazim: Sahl said, ""We used to feel happy on Fridays."" I asked Sahl, ""Why?"" He said, ""There was an old woman of our acquaintance who used to send somebody to Buda'a (Ibn Maslama said, ""Buda'a was a garden of date-palms at Medina). She used to pull out the silq (a kind of vegetable) from its roots and put it in a cooking pot, adding some powdered barley over it (and cook it). After finishing the Jumua (Friday) prayer we used to (pass by her and) greet her, whereupon she would present us with that meal, so we used to feel happy because of that. We used to have neither a midday nap, nor meals, except after the Friday prayer."" (See Hadith No. 60, Vol.2) "
bukhari79_153530	 حدثنا ابن مقاتل أخبرنا عبد الله أخبرنا معمر عن الزهري عن أبي سلمة بن عبد الرحمن عن	عن عائشة رضى الله عنها قالت قال رسول الله صلى الله عليه وسلم يا عائشة هذا جبريل يقرأ عليك السلام قالت قلت وعليه السلام ورحمة الله ترى ما لا نرى تريد رسول الله صلى الله عليه وسلم تابعه شعيب وقال يونس والنعمان عن الزهري وبركاته 	 حدثنا ابن مقاتل أخبرنا عبد الله أخبرنا معمر عن الزهري عن أبي سلمة بن عبد الرحمن عن عائشة رضى الله عنها قالت قال رسول الله صلى الله عليه وسلم يا عائشة هذا جبريل يقرأ عليك السلام قالت قلت وعليه السلام ورحمة الله ترى ما لا نرى تريد رسول الله صلى الله عليه وسلم تابعه شعيب وقال يونس والنعمان عن الزهري وبركاته 	" Narrated `Aisha: Allah's Messenger (SL3M) said, ""O `Aisha! This is Gabriel sending his greetings to you."" I said, ""Peace, and Allah's Mercy be on him (Gabriel). You see what we do not see."" (She was addressing Allah's Apostle). "
bukhari79_153540	 حدثنا أبو الوليد هشام بن عبد الملك حدثنا شعبة عن محمد بن	عن المنكدر قال سمعت جابرا رضى الله عنه يقول أتيت النبي صلى الله عليه وسلم في دين كان على أبي فدققت الباب فقال من ذا فقلت أنا فقال أنا أنا كأنه كرهها 	 حدثنا أبو الوليد هشام بن عبد الملك حدثنا شعبة عن محمد بن المنكدر قال سمعت جابرا رضى الله عنه يقول أتيت النبي صلى الله عليه وسلم في دين كان على أبي فدققت الباب فقال من ذا فقلت أنا فقال أنا أنا كأنه كرهها 	" Narrated Jabir: I came to the Prophet (SL3M) in order to consult him regarding my father's debt. When I knocked on the door, he asked, ""Who is that?"" I replied, ""I"" He said, ""I, I?"" He repeated it as if he disliked it. "
bukhari79_153550	 حدثنا إسحاق بن منصور أخبرنا عبد الله بن نمير حدثنا عبيد الله عن سعيد بن أبي سعيد المقبري عن	حدثنا أبي هريرة رضى الله عنه أن رجلا دخل المسجد ورسول الله صلى الله عليه وسلم جالس في ناحية المسجد فصلى ثم جاء فسلم عليه فقال له رسول الله صلى الله عليه وسلم وعليك السلام ارجع فصل فإنك لم تصل فرجع فصلى ثم جاء فسلم فقال وعليك السلام فارجع فصل فإنك لم تصل فقال في الثانية أو في التي بعدها علمني يا رسول الله فقال إذا قمت إلى الصلاة فأسبغ الوضوء ثم استقبل القبلة فكبر ثم اقرأ بما تيسر معك من القرآن ثم اركع حتى تطمئن راكعا ثم ارفع حتى تستوي قائما ثم اسجد حتى تطمئن ساجدا ثم ارفع حتى تطمئن جالسا ثم اسجد حتى تطمئن ساجدا ثم ارفع حتى تطمئن جالسا ثم افعل ذلك في صلاتك كلها وقال أبو أسامة في الأخير حتى تستوي قائما 	 حدثنا إسحاق بن منصور أخبرنا عبد الله بن نمير حدثنا عبيد الله عن سعيد بن أبي سعيد المقبري عن أبي هريرة رضى الله عنه أن رجلا دخل المسجد ورسول الله صلى الله عليه وسلم جالس في ناحية المسجد فصلى ثم جاء فسلم عليه فقال له رسول الله صلى الله عليه وسلم وعليك السلام ارجع فصل فإنك لم تصل فرجع فصلى ثم جاء فسلم فقال وعليك السلام فارجع فصل فإنك لم تصل فقال في الثانية أو في التي بعدها علمني يا رسول الله فقال إذا قمت إلى الصلاة فأسبغ الوضوء ثم استقبل القبلة فكبر ثم اقرأ بما تيسر معك من القرآن ثم اركع حتى تطمئن راكعا ثم ارفع حتى تستوي قائما ثم اسجد حتى تطمئن ساجدا ثم ارفع حتى تطمئن جالسا ثم اسجد حتى تطمئن ساجدا ثم ارفع حتى تطمئن جالسا ثم افعل ذلك في صلاتك كلها وقال أبو أسامة في الأخير حتى تستوي قائما 	" Narrated Abu Huraira: A man entered the mosque while Allah's Messenger (SL3M) was sitting in one side of the mosque. The man prayed, came, and greeted the Prophet. Allah's Messenger (SL3M) said to him, ""Wa 'Alaikas Salam (returned his greeting). Go back and pray as you have not prayed (properly)."" The man returned, repeated his prayer, came back and greeted the Prophet. The Prophet (SL3M) said, ""Wa alaika-s-Salam (returned his greeting). Go back and pray again as you have not prayed (properly)."" The man said at the second or third time, ""O Allah's Messenger (SL3M)! Kindly teach me how to pray"". The Prophet (SL3M) said, ""When you stand for prayer, perform ablution properly and then face the Qibla and say Takbir (Allahu-Akbar), and then recite what you know from the Qur'an, and then bow with calmness till you feel at ease then rise from bowing, till you stand straight, and then prostrate calmly (and remain in prostration) till you feel at ease, and then raise (your head) and sit with calmness till you feel at ease and then prostrate with calmness (and remain in prostration) till you feel at ease, and then raise (your head) and sit with calmness till you feel at ease in the sitting position, and do likewise in whole of your prayer."" And Abu Usama added, ""Till you stand straight."" (See Hadith No. 759, Vol.1) "
bukhari79_153560	 حدثنا ابن بشار قال حدثني يحيى عن عبيد الله حدثني سعيد عن أبيه عن	حدثني أبي هريرة قال قال النبي صلى الله عليه وسلم ثم ارفع حتى تطمئن جالسا 	 حدثنا ابن بشار قال حدثني يحيى عن عبيد الله حدثني سعيد عن أبيه عن أبي هريرة قال قال النبي صلى الله عليه وسلم ثم ارفع حتى تطمئن جالسا 	" Narrated Abu Huraira: The Prophet (SL3M) said (in the above narration No. 268), ""And then raise your head till you feel at ease while sitting. "" "
bukhari79_153570	 حدثنا أبو نعيم حدثنا زكرياء قال سمعت عامرا يقول حدثني أبو سلمة بن	حدثني عبد الرحمن أن عائشة رضى الله عنها حدثته أن النبي صلى الله عليه وسلم قال لها إن جبريل يقرئك السلام قالت وعليه السلام ورحمة الله 	 حدثنا أبو نعيم حدثنا زكرياء قال سمعت عامرا يقول حدثني أبو سلمة بن عبد الرحمن أن عائشة رضى الله عنها حدثته أن النبي صلى الله عليه وسلم قال لها إن جبريل يقرئك السلام قالت وعليه السلام ورحمة الله 	" Narrated `Aisha: That the Prophet (SL3M) said to her, ""Gabriel sends Salam (greetings) to you."" She replied, ""Wa 'alaihi-s- Salam Wa Rahmatu-l-lah."" (Peace and Allah's Mercy be on him). "
