bukhari23_112060	 حدثنا عبد الله بن يوسف حدثنا الليث حدثنا سعيد عن	حدثنا أبيه أنه سمع أبا سعيد الخدري رضى الله عنه قال كان النبي صلى الله عليه وسلم يقول إذا وضعت الجنازة فاحتملها الرجال على أعناقهم فإن كانت صالحة قالت قدموني وإن كانت غير صالحة قالت لأهلها يا ويلها أين يذهبون بها يسمع صوتها كل شىء إلا الإنسان ولو سمع الإنسان لصعق 	 حدثنا عبد الله بن يوسف حدثنا الليث حدثنا سعيد عن أبيه أنه سمع أبا سعيد الخدري رضى الله عنه قال كان النبي صلى الله عليه وسلم يقول إذا وضعت الجنازة فاحتملها الرجال على أعناقهم فإن كانت صالحة قالت قدموني وإن كانت غير صالحة قالت لأهلها يا ويلها أين يذهبون بها يسمع صوتها كل شىء إلا الإنسان ولو سمع الإنسان لصعق 	" Narrated Abu Sa`id Al-Khudri: The Prophet (SL3M) said, ""When a funeral is ready and the men carry the deceased on their necks (shoulders), if it was pious then it will say, 'Present me quickly', and if it was not pious, then it will say, 'Woe to it (me), where are they taking it (me)?' And its voice is heard by everything except mankind and if he heard it he would fall unconscious."" "
bukhari23_112070	 حدثنا مسدد عن أبي عوانة عن قتادة عن عطاء عن جابر بن	عن عبد الله رضى الله عنهما أن رسول الله صلى الله عليه وسلم صلى على النجاشي فكنت في الصف الثاني أو الثالث 	 حدثنا مسدد عن أبي عوانة عن قتادة عن عطاء عن جابر بن عبد الله رضى الله عنهما أن رسول الله صلى الله عليه وسلم صلى على النجاشي فكنت في الصف الثاني أو الثالث 	 Narrated Jabir bin `Abdullah: Allah's Messenger (SL3M) offered the funeral prayer for An-Najashi and I was in the second or third row. 
bukhari23_112080	 حدثنا مسدد حدثنا يزيد بن زريع حدثنا معمر عن الزهري عن سعيد عن	عن أبي هريرة رضى الله عنه قال نعى النبي صلى الله عليه وسلم إلى أصحابه النجاشي ثم تقدم فصفوا خلفه فكبر أربعا 	 حدثنا مسدد حدثنا يزيد بن زريع حدثنا معمر عن الزهري عن سعيد عن أبي هريرة رضى الله عنه قال نعى النبي صلى الله عليه وسلم إلى أصحابه النجاشي ثم تقدم فصفوا خلفه فكبر أربعا 	 Narrated Abu Huraira: The Prophet (SL3M) (p.b.u.h) informed his companions about the death of An-Najashi and then he went ahead (to lead the prayer) and the people lined up behind him in rows and he said four Takbir. 
bukhari23_112090	 حدثنا مسلم حدثنا شعبة حدثنا الشيباني عن	حدثنا الشعبي قال أخبرني من شهد النبي صلى الله عليه وسلم أنه أتى على قبر منبوذ فصفهم وكبر أربعا قلت من حدثك قال ابن عباس رضى الله عنهما 	 حدثنا مسلم حدثنا شعبة حدثنا الشيباني عن الشعبي قال أخبرني من شهد النبي صلى الله عليه وسلم أنه أتى على قبر منبوذ فصفهم وكبر أربعا قلت من حدثك قال ابن عباس رضى الله عنهما 	" Narrated Ash-Shaibani: Ash Shu`bi said, ""I was informed by a man who had seen the Prophet (SL3M) going to a grave that was separate from the other graves and he aligned the people in rows and said four Takbir."" I said, ""O Abu `Amr! who narrated (that) to you""? He said, ""Ibn `Abbas. "" "
bukhari23_112100	 حدثنا إبراهيم بن موسى أخبرنا هشام بن	حدثنا يوسف أن ابن جريج أخبرهم قال أخبرني عطاء أنه سمع جابر بن عبد الله رضى الله عنهما يقول قال النبي صلى الله عليه وسلم قد توفي اليوم رجل صالح من الحبش فهلم فصلوا عليه قال فصففنا فصلى النبي صلى الله عليه وسلم عليه ونحن صفوف قال أبو الزبير عن جابر كنت في الصف الثاني 	 حدثنا إبراهيم بن موسى أخبرنا هشام بن يوسف أن ابن جريج أخبرهم قال أخبرني عطاء أنه سمع جابر بن عبد الله رضى الله عنهما يقول قال النبي صلى الله عليه وسلم قد توفي اليوم رجل صالح من الحبش فهلم فصلوا عليه قال فصففنا فصلى النبي صلى الله عليه وسلم عليه ونحن صفوف قال أبو الزبير عن جابر كنت في الصف الثاني 	" Narrated Jabir bin `Abdullah: The Prophet (SL3M) said, ""Today a pious man from Ethiopia (i.e. An Najashi) has expired, come on to offer the funeral prayer."" (Jabir said): We lined up in rows and after that the Prophet (SL3M) led the prayer and we were in rows. Jabir added, I was in the second row."" "
bukhari23_112110	 حدثنا موسى بن إسماعيل حدثنا عبد الواحد حدثنا الشيباني عن عامر عن	عن ابن عباس رضى الله عنهما أن رسول الله صلى الله عليه وسلم مر بقبر قد دفن ليلا فقال متى دفن هذا قالوا البارحة قال أفلا آذنتموني قالوا دفناه في ظلمة الليل فكرهنا أن نوقظك فقام فصففنا خلفه قال ابن عباس وأنا فيهم فصلى عليه 	 حدثنا موسى بن إسماعيل حدثنا عبد الواحد حدثنا الشيباني عن عامر عن ابن عباس رضى الله عنهما أن رسول الله صلى الله عليه وسلم مر بقبر قد دفن ليلا فقال متى دفن هذا قالوا البارحة قال أفلا آذنتموني قالوا دفناه في ظلمة الليل فكرهنا أن نوقظك فقام فصففنا خلفه قال ابن عباس وأنا فيهم فصلى عليه 	" Narrated Ibn `Abbas: Allah's Messenger (SL3M) passed by a grave of a deceased who had been buried at night. He said, ""When was this (deceased) buried?"" The people said, ""Yesterday."" He said, ""Why did you not inform me?"" They said, ""We buried him when it was dark and so we disliked to wake you up."" He stood up and we lined up behind him. (Ibn `Abbas said): I was one of them, and the Prophet (SL3M) offered the funeral prayer. "
bukhari23_112120	 حدثنا سليمان بن حرب حدثنا شعبة عن الشيباني عن	حدثنا الشعبي قال أخبرني من مر مع نبيكم صلى الله عليه وسلم على قبر منبوذ فأمنا فصففنا خلفه فقلنا يا أبا عمرو من حدثك قال ابن عباس رضى الله عنهما 	 حدثنا سليمان بن حرب حدثنا شعبة عن الشيباني عن الشعبي قال أخبرني من مر مع نبيكم صلى الله عليه وسلم على قبر منبوذ فأمنا فصففنا خلفه فقلنا يا أبا عمرو من حدثك قال ابن عباس رضى الله عنهما 	" Narrated Ash-Shaibani: Ash-Shu`bi said, ""Somebody who passed along with your Prophet (p.b.u.h) by a grave that was separate from the other graves informed me (saying), ""The Prophet (SL3M) led us (in the prayer) and we aligned behind him."" We said, ""O Abu `Amr! Who told you this narration?"" He replied, ""Ibn `Abbas."" "
bukhari23_112131	 حدثنا أبو النعمان حدثنا جرير بن	حدثنا حازم قال سمعت نافعا يقول حدث ابن عمر أن أبا هريرة رضى الله عنهم يقول من تبع جنازة فله قيراط فقال أكثر أبو هريرة علينا فصدقت يعني عائشة أبا هريرة وقالت سمعت رسول الله صلى الله عليه وسلم يقوله فقال ابن عمر رضى الله عنهما لقد فرطنا في قراريط كثيرة {فرطت} ضيعت من أمر الله 	 حدثنا أبو النعمان حدثنا جرير بن حازم قال سمعت نافعا يقول حدث ابن عمر أن أبا هريرة رضى الله عنهم يقول من تبع جنازة فله قيراط فقال أكثر أبو هريرة علينا فصدقت يعني عائشة أبا هريرة وقالت سمعت رسول الله صلى الله عليه وسلم يقوله فقال ابن عمر رضى الله عنهما لقد فرطنا في قراريط كثيرة {فرطت} ضيعت من أمر الله 	" Narrated Nafi`: Ibn `Umar was told that Abu Huraira said, ""Whoever accompanies the funeral procession will have a reward equal to one Qirat."" Ibn `Umar said, ""Abu Huraira talks of a too enormous reward."" Aisha attested Abu Huraira's narration and said, ""I heard Allah's Messenger (SL3M) saying like that."" Ibn `Umar said, ""We have lost numerous Qirats."" "
bukhari23_112151	 حدثنا عبد الله بن	حدثنا مسلمة قال قرأت على ابن أبي ذئب عن سعيد بن أبي سعيد المقبري عن أبيه أنه سأل أبا هريرة رضى الله عنه فقال سمعت النبي صلى الله عليه وسلم حدثنا أحمد بن شبيب بن سعيد قال حدثني أبي حدثنا يونس قال ابن شهاب وحدثني عبد الرحمن الأعرج أن أبا هريرة رضى الله عنه قال قال رسول الله صلى الله عليه وسلم من شهد الجنازة حتى يصلي عليها فله قيراط ومن شهد حتى تدفن كان له قيراطان قيل وما القيراطان قال مثل الجبلين العظيمين 	 حدثنا عبد الله بن مسلمة قال قرأت على ابن أبي ذئب عن سعيد بن أبي سعيد المقبري عن أبيه أنه سأل أبا هريرة رضى الله عنه فقال سمعت النبي صلى الله عليه وسلم حدثنا أحمد بن شبيب بن سعيد قال حدثني أبي حدثنا يونس قال ابن شهاب وحدثني عبد الرحمن الأعرج أن أبا هريرة رضى الله عنه قال قال رسول الله صلى الله عليه وسلم من شهد الجنازة حتى يصلي عليها فله قيراط ومن شهد حتى تدفن كان له قيراطان قيل وما القيراطان قال مثل الجبلين العظيمين 	" Narrated Abu Huraira: that Allah's Messenger (SL3M) (p.b.u.h) said, ""Whoever attends the funeral procession till he offers the funeral prayer for it, will get a reward equal to one Qirat, and whoever accompanies it till burial, will get a reward equal to two Qirats."" It was asked, ""What are two Qirats?"" He replied, ""Like two huge mountains."" "
bukhari23_112170	 حدثنا يعقوب بن إبراهيم حدثنا يحيى بن أبي بكير حدثنا زائدة حدثنا أبو إسحاق الشيباني عن عامر عن	حدثنا ابن عباس رضى الله عنهما قال أتى رسول الله صلى الله عليه وسلم قبرا فقالوا هذا دفن أو دفنت البارحة قال ابن عباس رضى الله عنهما فصفنا خلفه ثم صلى عليها 	 حدثنا يعقوب بن إبراهيم حدثنا يحيى بن أبي بكير حدثنا زائدة حدثنا أبو إسحاق الشيباني عن عامر عن ابن عباس رضى الله عنهما قال أتى رسول الله صلى الله عليه وسلم قبرا فقالوا هذا دفن أو دفنت البارحة قال ابن عباس رضى الله عنهما فصفنا خلفه ثم صلى عليها 	" Narrated 'Amir: Ibn `Abbas (who was at that time a boy) said, ""Allah's Messenger (SL3M) came to a grave and the people said, 'He or she was buried yesterday.' "" Ibn `Abbas added, ""We aligned behind the Prophet (SL3M) and he led the funeral prayer of the deceased."" "
bukhari23_112181	 حدثنا يحيى بن بكير حدثنا الليث عن عقيل عن ابن شهاب عن سعيد بن	عن المسيب وأبي سلمة أنهما حدثاه عن أبي هريرة رضى الله عنه قال نعى لنا رسول الله صلى الله عليه وسلم النجاشي صاحب الحبشة يوم الذي مات فيه فقال استغفروا لأخيكم وعن ابن شهاب قال حدثني سعيد بن المسيب أن أبا هريرة رضى الله عنه قال إن النبي صلى الله عليه وسلم صف بهم بالمصلى فكبر عليه أربعا 	 حدثنا يحيى بن بكير حدثنا الليث عن عقيل عن ابن شهاب عن سعيد بن المسيب وأبي سلمة أنهما حدثاه عن أبي هريرة رضى الله عنه قال نعى لنا رسول الله صلى الله عليه وسلم النجاشي صاحب الحبشة يوم الذي مات فيه فقال استغفروا لأخيكم وعن ابن شهاب قال حدثني سعيد بن المسيب أن أبا هريرة رضى الله عنه قال إن النبي صلى الله عليه وسلم صف بهم بالمصلى فكبر عليه أربعا 	" Narrated Abu Huraira: Allah's Messenger (SL3M) informed about the news of the death of An-Najash (King of Ethiopia) on the day he expired. He said, ""Ask Allah's forgiveness for your brother. "" Narrated Abu Huraira: The Prophet (SL3M) made them align in rows at the Musalla and said four Takbir. "
bukhari23_112200	 حدثنا إبراهيم بن المنذر حدثنا أبو ضمرة حدثنا موسى بن	حدثنا عقبة عن نافع عن عبد الله بن عمر رضى الله عنهما أن اليهود جاءوا إلى النبي صلى الله عليه وسلم برجل منهم وامرأة زنيا فأمر بهما فرجما قريبا من موضع الجنائز عند المسجد 	 حدثنا إبراهيم بن المنذر حدثنا أبو ضمرة حدثنا موسى بن عقبة عن نافع عن عبد الله بن عمر رضى الله عنهما أن اليهود جاءوا إلى النبي صلى الله عليه وسلم برجل منهم وامرأة زنيا فأمر بهما فرجما قريبا من موضع الجنائز عند المسجد 	" Narrated `Abdullah bin `Umar: The Jew brought to the Prophet (SL3M) a man and a woman from amongst them who have committed (adultery) illegal sexual intercourse. He ordered both of them to be stoned (to death), near the place of offering the funeral prayers beside the mosque."" "
bukhari23_112210	 حدثنا عبيد الله بن موسى عن شيبان عن هلال هو الوزان عن عروة عن عائشة رضى الله عنها عن	عن النبي صلى الله عليه وسلم قال في مرضه الذي مات فيه لعن الله اليهود والنصارى اتخذوا قبور أنبيائهم مسجدا قالت ولولا ذلك لأبرزوا قبره غير أني أخشى أن يتخذ مسجدا 	 حدثنا عبيد الله بن موسى عن شيبان عن هلال هو الوزان عن عروة عن عائشة رضى الله عنها عن النبي صلى الله عليه وسلم قال في مرضه الذي مات فيه لعن الله اليهود والنصارى اتخذوا قبور أنبيائهم مسجدا قالت ولولا ذلك لأبرزوا قبره غير أني أخشى أن يتخذ مسجدا 	" Narrated `Urwa: Aisha said, ""The Prophet (SL3M) in his fatal illness said, 'Allah cursed the Jews and the Christians because they took the graves of their Prophets as places for praying.""' Aisha added, ""Had it not been for that, the grave of the Prophet (SL3M) (p.b.u.h) would have been made prominent but I am afraid it might be taken (as a) place for praying. "
bukhari23_112220	 حدثنا مسدد حدثنا يزيد بن زريع حدثنا حسين حدثنا عبد الله بن بريدة عن	حدثنا سمرة رضى الله عنه قال صليت وراء النبي صلى الله عليه وسلم على امرأة ماتت في نفاسها فقام عليها وسطها 	 حدثنا مسدد حدثنا يزيد بن زريع حدثنا حسين حدثنا عبد الله بن بريدة عن سمرة رضى الله عنه قال صليت وراء النبي صلى الله عليه وسلم على امرأة ماتت في نفاسها فقام عليها وسطها 	 Narrated Samura bin Jundab: I offered the funeral prayer behind the Prophet (SL3M) for a woman who had died during childbirth and he stood up by the middle of the coffin. 
bukhari23_112230	 حدثنا عمران بن ميسرة حدثنا عبد الوارث حدثنا حسين عن ابن بريدة حدثنا سمرة بن	عن جندب رضى الله عنه قال صليت وراء النبي صلى الله عليه وسلم على امرأة ماتت في نفاسها فقام عليها وسطها 	 حدثنا عمران بن ميسرة حدثنا عبد الوارث حدثنا حسين عن ابن بريدة حدثنا سمرة بن جندب رضى الله عنه قال صليت وراء النبي صلى الله عليه وسلم على امرأة ماتت في نفاسها فقام عليها وسطها 	 Narrated Samura bin Jundab: I offered the funeral prayer behind the Prophet (SL3M) for a woman who had died during childbirth and he stood up by the middle of the coffin. 
bukhari23_112240	 حدثنا عبد الله بن يوسف أخبرنا مالك عن ابن شهاب عن سعيد بن المسيب عن	عن أبي هريرة رضى الله عنه أن رسول الله صلى الله عليه وسلم نعى النجاشي في اليوم الذي مات فيه وخرج بهم إلى المصلى فصف بهم وكبر عليه أربع تكبيرات 	 حدثنا عبد الله بن يوسف أخبرنا مالك عن ابن شهاب عن سعيد بن المسيب عن أبي هريرة رضى الله عنه أن رسول الله صلى الله عليه وسلم نعى النجاشي في اليوم الذي مات فيه وخرج بهم إلى المصلى فصف بهم وكبر عليه أربع تكبيرات 	 Narrated Abu Huraira: Allah's Messenger (SL3M) informed about the news of the death of An-Najash on the day he died. He went out with us to the Musalla and we aligned in rows and he said four Takbirs for An-Najashi's funeral prayer. 
bukhari23_112250	 حدثنا محمد بن سنان حدثنا سليم بن حيان حدثنا سعيد بن ميناء عن	حدثنا جابر رضى الله عنه أن النبي صلى الله عليه وسلم صلى على أصحمة النجاشي فكبر أربعا وقال يزيد بن هارون وعبد الصمد عن سليم أصحمة وتابعه عبد الصمد 	 حدثنا محمد بن سنان حدثنا سليم بن حيان حدثنا سعيد بن ميناء عن جابر رضى الله عنه أن النبي صلى الله عليه وسلم صلى على أصحمة النجاشي فكبر أربعا وقال يزيد بن هارون وعبد الصمد عن سليم أصحمة وتابعه عبد الصمد 	 Narrated Jabir: The Prophet (SL3M) offered the funeral prayer of As-Hama An-Najash and said four Takbir. 
bukhari23_112260	 حدثنا محمد بن بشار حدثنا غندر حدثنا شعبة عن سعد عن	عن طلحة قال صليت خلف ابن عباس رضى الله عنهما حدثنا محمد بن كثير أخبرنا سفيان عن سعد بن إبراهيم عن طلحة بن عبد الله بن عوف قال صليت خلف ابن عباس رضى الله عنهما على جنازة فقرأ بفاتحة الكتاب قال ليعلموا أنها سنة 	 حدثنا محمد بن بشار حدثنا غندر حدثنا شعبة عن سعد عن طلحة قال صليت خلف ابن عباس رضى الله عنهما حدثنا محمد بن كثير أخبرنا سفيان عن سعد بن إبراهيم عن طلحة بن عبد الله بن عوف قال صليت خلف ابن عباس رضى الله عنهما على جنازة فقرأ بفاتحة الكتاب قال ليعلموا أنها سنة 	" Narrated Talha bin `Abdullah bin `Auf: I offered the funeral prayer behind Ibn `Abbas and he recited Al-Fatiha and said, ""You should know that it (i.e. recitation of Al-Fatiha) is the tradition of the Prophet (SL3M) Muhammad. "
bukhari23_112270	 حدثنا حجاج بن منهال حدثنا شعبة قال حدثني	حدثنا سليمان الشيباني قال سمعت الشعبي قال أخبرني من مر مع النبي صلى الله عليه وسلم على قبر منبوذ فأمهم وصلوا خلفه قلت من حدثك هذا يا أبا عمرو قال ابن عباس رضى الله عنهما 	 حدثنا حجاج بن منهال حدثنا شعبة قال حدثني سليمان الشيباني قال سمعت الشعبي قال أخبرني من مر مع النبي صلى الله عليه وسلم على قبر منبوذ فأمهم وصلوا خلفه قلت من حدثك هذا يا أبا عمرو قال ابن عباس رضى الله عنهما 	" Narrated Sulaiman Ash-Shaibani: I heard Ash-Shu`bi saying, ""I was told by a man who had passed with the Prophet (SL3M) (p.b.u.h) by a grave that was separate from the other graves that he (the Prophet (SL3M) ) led them in the prayer and they prayed behind him."" I said, ""O Abu `Amr! Who narrated that to you?"" He replied, ""Ibn `Abbas."" "
bukhari23_112280	 حدثنا محمد بن الفضل حدثنا حماد بن زيد عن ثابت عن أبي رافع عن	عن أبي هريرة رضى الله عنه أن أسود رجلا أو امرأة كان يقم المسجد فمات ولم يعلم النبي صلى الله عليه وسلم بموته فذكره ذات يوم فقال ما فعل ذلك الإنسان قالوا مات يا رسول الله قال أفلا آذنتموني فقالوا إنه كان كذا وكذا قصته قال فحقروا شأنه قال فدلوني على قبره فأتى قبره فصلى عليه 	 حدثنا محمد بن الفضل حدثنا حماد بن زيد عن ثابت عن أبي رافع عن أبي هريرة رضى الله عنه أن أسود رجلا أو امرأة كان يقم المسجد فمات ولم يعلم النبي صلى الله عليه وسلم بموته فذكره ذات يوم فقال ما فعل ذلك الإنسان قالوا مات يا رسول الله قال أفلا آذنتموني فقالوا إنه كان كذا وكذا قصته قال فحقروا شأنه قال فدلوني على قبره فأتى قبره فصلى عليه 	" Narrated Abu Huraira: A black person, a male or a female used to clean the Mosque and then died. The Prophet (SL3M) (p.b.u.h) did not know about it . One day the Prophet (SL3M) remembered him and said, ""What happened to that person?"" The people replied, ""O Allah's Messenger (SL3M)! He died."" He said, ""Why did you not inform me?"" They said, ""His story was so and so (i.e. regarded him as insignificant)."" He said, ""Show me his grave."" He then went to his grave and offered the funeral prayer. "
