bukhari92_161660	 حدثنا علي بن عبد الله حدثنا بشر بن السري حدثنا نافع بن عمر عن ابن أبي مليكة قال قالت أسماء عن	عن النبي صلى الله عليه وسلم قال أنا على حوضي أنتظر من يرد على فيؤخذ بناس من دوني فأقول أمتي فيقول لا تدري مشوا على القهقرى قال ابن أبي مليكة اللهم إنا نعوذ بك أن نرجع على أعقابنا أو نفتن 	 حدثنا علي بن عبد الله حدثنا بشر بن السري حدثنا نافع بن عمر عن ابن أبي مليكة قال قالت أسماء عن النبي صلى الله عليه وسلم قال أنا على حوضي أنتظر من يرد على فيؤخذ بناس من دوني فأقول أمتي فيقول لا تدري مشوا على القهقرى قال ابن أبي مليكة اللهم إنا نعوذ بك أن نرجع على أعقابنا أو نفتن 	" Narrated Asma': The Prophet (SL3M) said, ""I will be at my Lake-Fount (Kauthar) waiting for whoever will come to me. Then some people will be taken away from me whereupon I will say, 'My followers!' It will be said, 'You do not know they turned Apostates as renegades (deserted their religion).'"" (Ibn Abi Mulaika said, ""Allah, we seek refuge with You from turning on our heels from the (Islamic) religion and from being put to trial""). "
bukhari92_161670	 حدثنا موسى بن إسماعيل حدثنا أبو عوانة عن مغيرة عن	حدثنا أبي وائل قال قال عبد الله قال النبي صلى الله عليه وسلم أنا فرطكم على الحوض ليرفعن إلى رجال منكم حتى إذا أهويت لأناولهم اختلجوا دوني فأقول أى رب أصحابي يقول لا تدري ما أحدثوا بعدك 	 حدثنا موسى بن إسماعيل حدثنا أبو عوانة عن مغيرة عن أبي وائل قال قال عبد الله قال النبي صلى الله عليه وسلم أنا فرطكم على الحوض ليرفعن إلى رجال منكم حتى إذا أهويت لأناولهم اختلجوا دوني فأقول أى رب أصحابي يقول لا تدري ما أحدثوا بعدك 	" Narrated `Abdullah: The Prophet (SL3M) said, ""I am your predecessor at the Lake-Fount (Kauthar) and some men amongst you will be brought to me, and when I will try to hand them some water, they will be pulled away from me by force whereupon I will say, 'O Lord, my companions!' Then the Almighty will say, 'You do not know what they did after you left, they introduced new things into the religion after you.'"" "
bukhari92_161680	 حدثنا يحيى بن بكير حدثنا يعقوب بن عبد الرحمن عن أبي حازم قال سمعت سهل بن	عن سعد يقول سمعت النبي صلى الله عليه وسلم يقول أنا فرطكم على الحوض من ورده شرب منه ومن شرب منه لم يظمأ بعده أبدا ليرد على أقوام أعرفهم ويعرفوني ثم يحال بيني وبينهم 	 حدثنا يحيى بن بكير حدثنا يعقوب بن عبد الرحمن عن أبي حازم قال سمعت سهل بن سعد يقول سمعت النبي صلى الله عليه وسلم يقول أنا فرطكم على الحوض من ورده شرب منه ومن شرب منه لم يظمأ بعده أبدا ليرد على أقوام أعرفهم ويعرفوني ثم يحال بيني وبينهم 	" Narrated Sahl bin Sa`d: I heard the Prophet (SL3M) saying, ""I am your predecessor at the Lake-Fount (Kauthar), and whoever will come to it, will drink from it, and whoever will drink from it, will never become thirsty after that. There will come to me some people whom I know and they know me, and then a barrier will be set up between me and them."" "
bukhari92_161690	not identified	 قال أبو حازم فسمعني النعمان بن أبي عياش وأنا أحدثهم هذا فقال هكذا سمعت سهلا فقلت نعم قال وأنا أشهد على أبي سعيد الخدري لسمعته يزيد فيه قال إنهم مني فيقال إنك لا تدري ما بدلوا بعدك فأقول سحقا سحقا لمن بدل بعدي 	 قال أبو حازم فسمعني النعمان بن أبي عياش وأنا أحدثهم هذا فقال هكذا سمعت سهلا فقلت نعم قال وأنا أشهد على أبي سعيد الخدري لسمعته يزيد فيه قال إنهم مني فيقال إنك لا تدري ما بدلوا بعدك فأقول سحقا سحقا لمن بدل بعدي 	" Abu Sa`id Al-Khudri added that the Prophet (SL3M) further said: ""I will say those people are from me. It will be said, 'You do not know what changes and new things they did after you.' Then I will say, 'Far removed (from mercy), far removed (from mercy), those who changed (the religion) after me!"" "
bukhari92_161700	 حدثنا مسدد حدثنا يحيى بن سعيد حدثنا الأعمش حدثنا زيد بن	حدثنا وهب سمعت عبد الله قال قال لنا رسول الله صلى الله عليه وسلم إنكم سترون بعدي أثرة وأمورا تنكرونها قالوا فما تأمرنا يا رسول الله قال أدوا إليهم حقهم وسلوا الله حقكم 	 حدثنا مسدد حدثنا يحيى بن سعيد حدثنا الأعمش حدثنا زيد بن وهب سمعت عبد الله قال قال لنا رسول الله صلى الله عليه وسلم إنكم سترون بعدي أثرة وأمورا تنكرونها قالوا فما تأمرنا يا رسول الله قال أدوا إليهم حقهم وسلوا الله حقكم 	" Narrated `Abdullah: Allah's Messenger (SL3M) said to us, ""You will see after me, selfishness (on the part of other people) and other matters that you will disapprove of."" They asked, ""What do you order us to do, O Allah's Messenger (SL3M)? (under such circumstances)?"" He said, ""Pay their rights to them (to the rulers) and ask your right from Allah."" "
bukhari92_161710	 حدثنا مسدد عن عبد الوارث عن الجعد عن أبي رجاء عن ابن عباس عن	عن النبي صلى الله عليه وسلم قال من كره من أميره شيئا فليصبر فإنه من خرج من السلطان شبرا مات ميتة جاهلية 	 حدثنا مسدد عن عبد الوارث عن الجعد عن أبي رجاء عن ابن عباس عن النبي صلى الله عليه وسلم قال من كره من أميره شيئا فليصبر فإنه من خرج من السلطان شبرا مات ميتة جاهلية 	" Narrated Ibn `Abbas: The Prophet (SL3M) said, ""Whoever disapproves of something done by his ruler then he should be patient, for whoever disobeys the ruler even a little (little = a span) will die as those who died in the Pre-lslamic Period of Ignorance. (i.e. as rebellious Sinners). "
bukhari92_161720	 حدثنا أبو النعمان حدثنا حماد بن زيد عن الجعد أبي عثمان حدثني	عن أبو رجاء العطاردي قال سمعت ابن عباس رضى الله عنهما عن النبي صلى الله عليه وسلم قال من رأى من أميره شيئا يكرهه فليصبر عليه فإنه من فارق الجماعة شبرا فمات إلا مات ميتة جاهلية 	 حدثنا أبو النعمان حدثنا حماد بن زيد عن الجعد أبي عثمان حدثني أبو رجاء العطاردي قال سمعت ابن عباس رضى الله عنهما عن النبي صلى الله عليه وسلم قال من رأى من أميره شيئا يكرهه فليصبر عليه فإنه من فارق الجماعة شبرا فمات إلا مات ميتة جاهلية 	" Narrated Ibn `Abbas: The Prophet (SL3M) said, ""Whoever notices something which he dislikes done by his ruler, then he should be patient, for whoever becomes separate from the company of the Muslims even for a span and then dies, he will die as those who died in the Pre-lslamic period of Ignorance (as rebellious sinners). (Fath-ul-Bari page 112, Vol. 16) "
bukhari92_161731	 حدثنا إسماعيل حدثني ابن وهب عن عمرو عن بكير عن بسر بن سعيد عن جنادة بن	عن أبي أمية قال دخلنا على عبادة بن الصامت وهو مريض قلنا أصلحك الله حدث بحديث ينفعك الله به سمعته من النبي صلى الله عليه وسلم قال دعانا النبي صلى الله عليه وسلم فبايعناه فقال فيما أخذ علينا أن بايعنا على السمع والطاعة في منشطنا ومكرهنا وعسرنا ويسرنا وأثرة علينا وأن لا ننازع الأمر أهله إلا أن تروا كفرا بواحا عندكم من الله فيه برهان 	 حدثنا إسماعيل حدثني ابن وهب عن عمرو عن بكير عن بسر بن سعيد عن جنادة بن أبي أمية قال دخلنا على عبادة بن الصامت وهو مريض قلنا أصلحك الله حدث بحديث ينفعك الله به سمعته من النبي صلى الله عليه وسلم قال دعانا النبي صلى الله عليه وسلم فبايعناه فقال فيما أخذ علينا أن بايعنا على السمع والطاعة في منشطنا ومكرهنا وعسرنا ويسرنا وأثرة علينا وأن لا ننازع الأمر أهله إلا أن تروا كفرا بواحا عندكم من الله فيه برهان 	" Narrated Junada bin Abi Umaiya: We entered upon 'Ubada bin As-Samit while he was sick. We said, ""May Allah make you healthy. Will you tell us a Hadith you heard from the Prophet (SL3M) and by which Allah may make you benefit?"" He said, ""The Prophet (SL3M) called us and we gave him the Pledge of allegiance for Islam, and among the conditions on which he took the Pledge from us, was that we were to listen and obey (the orders) both at the time when we were active and at the time when we were tired, and at our difficult time and at our ease and to be obedient to the ruler and give him his right even if he did not give us our right, and not to fight against him unless we noticed him having open Kufr (disbelief) for which we would have a proof with us from Allah."" "
bukhari92_161750	 حدثنا محمد بن عرعرة حدثنا شعبة عن قتادة عن أنس بن مالك عن أسيد بن	عن حضير أن رجلا أتى النبي صلى الله عليه وسلم فقال يا رسول الله استعملت فلانا ولم تستعملني قال إنكم سترون بعدي أثرة فاصبروا حتى تلقوني 	 حدثنا محمد بن عرعرة حدثنا شعبة عن قتادة عن أنس بن مالك عن أسيد بن حضير أن رجلا أتى النبي صلى الله عليه وسلم فقال يا رسول الله استعملت فلانا ولم تستعملني قال إنكم سترون بعدي أثرة فاصبروا حتى تلقوني 	" Narrated Usaid bin Hudair: A man came to the Prophet (SL3M) and said, ""O Allah's Messenger (SL3M)! You appointed such-and-such person and you did not appoint me?"" The Prophet (SL3M) said, ""After me you will see rulers not giving you your right (but you should give them their right) and be patient till you meet me."" "
bukhari92_161760	 حدثنا موسى بن إسماعيل حدثنا عمرو بن يحيى بن	حدثنا سعيد بن عمرو بن سعيد قال أخبرني جدي قال كنت جالسا مع أبي هريرة في مسجد النبي صلى الله عليه وسلم بالمدينة ومعنا مروان قال أبو هريرة سمعت الصادق المصدوق يقول هلكة أمتي على يدى غلمة من قريش فقال مروان لعنة الله عليهم غلمة فقال أبو هريرة لو شئت أن أقول بني فلان وبني فلان لفعلت فكنت أخرج مع جدي إلى بني مروان حين ملكوا بالشأم فإذا رآهم غلمانا أحداثا قال لنا عسى هؤلاء أن يكونوا منهم قلنا أنت أعلم 	 حدثنا موسى بن إسماعيل حدثنا عمرو بن يحيى بن سعيد بن عمرو بن سعيد قال أخبرني جدي قال كنت جالسا مع أبي هريرة في مسجد النبي صلى الله عليه وسلم بالمدينة ومعنا مروان قال أبو هريرة سمعت الصادق المصدوق يقول هلكة أمتي على يدى غلمة من قريش فقال مروان لعنة الله عليهم غلمة فقال أبو هريرة لو شئت أن أقول بني فلان وبني فلان لفعلت فكنت أخرج مع جدي إلى بني مروان حين ملكوا بالشأم فإذا رآهم غلمانا أحداثا قال لنا عسى هؤلاء أن يكونوا منهم قلنا أنت أعلم 	" Narrated Abu Huraira: I heard the truthful and trusted by Allah (i.e., the Prophet (SL3M) ) saying, ""The destruction of my followers will be through the hands of young men from Quraish."" "
bukhari92_161770	 حدثنا مالك بن إسماعيل حدثنا ابن عيينة أنه سمع الزهري عن عروة عن زينب بنت أم سلمة عن أم حبيبة عن	عن زينب ابنة جحش رضى الله عنهن أنها قالت استيقظ النبي صلى الله عليه وسلم من النوم محمرا وجهه يقول لا إله إلا الله ويل للعرب من شر قد اقترب فتح اليوم من ردم ياجوج وماجوج مثل هذه وعقد سفيان تسعين أو مائة قيل أنهلك وفينا الصالحون قال نعم إذا كثر الخبث 	 حدثنا مالك بن إسماعيل حدثنا ابن عيينة أنه سمع الزهري عن عروة عن زينب بنت أم سلمة عن أم حبيبة عن زينب ابنة جحش رضى الله عنهن أنها قالت استيقظ النبي صلى الله عليه وسلم من النوم محمرا وجهه يقول لا إله إلا الله ويل للعرب من شر قد اقترب فتح اليوم من ردم ياجوج وماجوج مثل هذه وعقد سفيان تسعين أو مائة قيل أنهلك وفينا الصالحون قال نعم إذا كثر الخبث 	" Narrated Zainab bint Jahsh: The Prophet (SL3M) got up from his sleep with a flushed red face and said, ""None has the right to be worshipped but Allah. Woe to the Arabs, from the Great evil that is nearly approaching them. Today a gap has been made in the wall of Gog and Magog like this."" (Sufyan illustrated by this forming the number 90 or 100 with his fingers.) It was asked, ""Shall we be destroyed though there are righteous people among us?"" The Prophet (SL3M) said, ""Yes, if evil increased."" "
bukhari92_161780	 حدثنا أبو نعيم حدثنا ابن عيينة عن الزهري وحدثني محمود أخبرنا عبد الرزاق أخبرنا معمر عن الزهري عن عروة عن أسامة بن	عن زيد رضى الله عنهما قال أشرف النبي صلى الله عليه وسلم على أطم من آطام المدينة فقال هل ترون ما أرى قالوا لا قال فإني لأرى الفتن تقع خلال بيوتكم كوقع القطر 	 حدثنا أبو نعيم حدثنا ابن عيينة عن الزهري وحدثني محمود أخبرنا عبد الرزاق أخبرنا معمر عن الزهري عن عروة عن أسامة بن زيد رضى الله عنهما قال أشرف النبي صلى الله عليه وسلم على أطم من آطام المدينة فقال هل ترون ما أرى قالوا لا قال فإني لأرى الفتن تقع خلال بيوتكم كوقع القطر 	" Narrated Usama bin Zaid: Once the Prophet (SL3M) stood over one of the high buildings of Medina and then said (to the people), ""Do you see what I see?"" They said, ""No."" He said, ""I see afflictions falling among your houses as rain drops fall."" "
bukhari92_161790	 حدثنا عياش بن الوليد أخبرنا عبد الأعلى حدثنا معمر عن الزهري عن سعيد عن أبي هريرة عن	عن النبي صلى الله عليه وسلم قال يتقارب الزمان وينقص العمل ويلقى الشح وتظهر الفتن ويكثر الهرج قالوا يا رسول الله أيم هو قال القتل القتل وقال شعيب ويونس والليث وابن أخي الزهري عن الزهري عن حميد عن أبي هريرة عن النبي صلى الله عليه وسلم 	 حدثنا عياش بن الوليد أخبرنا عبد الأعلى حدثنا معمر عن الزهري عن سعيد عن أبي هريرة عن النبي صلى الله عليه وسلم قال يتقارب الزمان وينقص العمل ويلقى الشح وتظهر الفتن ويكثر الهرج قالوا يا رسول الله أيم هو قال القتل القتل وقال شعيب ويونس والليث وابن أخي الزهري عن الزهري عن حميد عن أبي هريرة عن النبي صلى الله عليه وسلم 	" Narrated Abu Huraira: The Prophet (SL3M) said, ""Time will pass rapidly, good deeds will decrease, miserliness will be thrown (in the hearts of the people) afflictions will appear and there will be much 'Al-Harj."" They said, ""O Allah's Apostle! What is ""Al-Harj?"" He said, ""Killing! Killing!"" (See Hadith No. 63, Vol. 8) "
bukhari92_161810	 حدثنا عبيد الله بن موسى عن الأعمش عن	حدثنا شقيق قال كنت مع عبد الله وأبي موسى فقالا قال النبي صلى الله عليه وسلم إن بين يدى الساعة لأياما ينزل فيها الجهل ويرفع فيها العلم ويكثر فيها الهرج والهرج القتل 	 حدثنا عبيد الله بن موسى عن الأعمش عن شقيق قال كنت مع عبد الله وأبي موسى فقالا قال النبي صلى الله عليه وسلم إن بين يدى الساعة لأياما ينزل فيها الجهل ويرفع فيها العلم ويكثر فيها الهرج والهرج القتل 	" Narrated `Abdullah and Abu Musa: The Prophet (SL3M) said, ""Near the establishment of the Hour there will be days during which Religious ignorance will spread, knowledge will be taken away (vanish) and there will be much Al-Harj, and Al- Harj means killing."" "
bukhari92_161820	 حدثنا عمر بن حفص حدثنا أبي حدثنا الأعمش حدثنا	حدثنا شقيق قال جلس عبد الله وأبو موسى فتحدثا فقال أبو موسى قال النبي صلى الله عليه وسلم إن بين يدى الساعة أياما يرفع فيها العلم وينزل فيها الجهل ويكثر فيها الهرج والهرج القتل 	 حدثنا عمر بن حفص حدثنا أبي حدثنا الأعمش حدثنا شقيق قال جلس عبد الله وأبو موسى فتحدثا فقال أبو موسى قال النبي صلى الله عليه وسلم إن بين يدى الساعة أياما يرفع فيها العلم وينزل فيها الجهل ويكثر فيها الهرج والهرج القتل 	" Narrated Abu Musa: The Prophet (SL3M) said, ""Near the establishment of the Hour there will be days during which (religious) knowledge will be taken away (vanish) and general ignorance will spread, and there will be Al-Harj in abundance, and Al-Harj means killing."" "
bukhari92_161830	 حدثنا قتيبة حدثنا جرير عن الأعمش عن	حدثنا أبي وائل قال إني لجالس مع عبد الله وأبي موسى رضى الله عنهما فقال أبو موسى سمعت النبي صلى الله عليه وسلم مثله والهرج بلسان الحبشة القتل 	 حدثنا قتيبة حدثنا جرير عن الأعمش عن أبي وائل قال إني لجالس مع عبد الله وأبي موسى رضى الله عنهما فقال أبو موسى سمعت النبي صلى الله عليه وسلم مثله والهرج بلسان الحبشة القتل 	 Narrated Abu Musa: The Prophet (SL3M) said...(as above, 185). And Harj, in the Ethiopian language, means killing. 
bukhari92_161840	 حدثنا محمد حدثنا غندر حدثنا شعبة عن واصل عن أبي وائل عن	عن عبد الله وأحسبه رفعه قال بين يدى الساعة أيام الهرج يزول العلم ويظهر فيها الجهل قال أبو موسى والهرج القتل بلسان الحبشة 	 حدثنا محمد حدثنا غندر حدثنا شعبة عن واصل عن أبي وائل عن عبد الله وأحسبه رفعه قال بين يدى الساعة أيام الهرج يزول العلم ويظهر فيها الجهل قال أبو موسى والهرج القتل بلسان الحبشة 	" Narrated `Abdullah: The Prophet (SL3M) said, ""Near the establishment of the Hour, there will be the days of Al-Harj, and the religious knowledge will be taken away (vanish i.e. by the death of Religious scholars) and general ignorance will spread."" Abu Musa said, ""Al-Harj, in the Ethiopian language, means killing."" "
bukhari92_161850	not identified	 وقال أبو عوانة عن عاصم عن أبي وائل عن الأشعري أنه قال لعبد الله تعلم الأيام التي ذكر النبي صلى الله عليه وسلم أيام الهرج نحوه قال ابن مسعود سمعت النبي صلى الله عليه وسلم يقول من شرار الناس من تدركهم الساعة وهم أحياء 	 وقال أبو عوانة عن عاصم عن أبي وائل عن الأشعري أنه قال لعبد الله تعلم الأيام التي ذكر النبي صلى الله عليه وسلم أيام الهرج نحوه قال ابن مسعود سمعت النبي صلى الله عليه وسلم يقول من شرار الناس من تدركهم الساعة وهم أحياء 	" Ibn Mas`ud added: I heard Allah's Messenger (SL3M) saying; (It will be) from among the most wicked people who will be living at the time when the Hour will be established."" "
bukhari92_161860	 حدثنا محمد بن يوسف حدثنا سفيان عن الزبير بن	حدثنا عدي قال أتينا أنس بن مالك فشكونا إليه ما نلقى من الحجاج فقال اصبروا فإنه لا يأتي عليكم زمان إلا الذي بعده شر منه حتى تلقوا ربكم سمعته من نبيكم صلى الله عليه وسلم 	 حدثنا محمد بن يوسف حدثنا سفيان عن الزبير بن عدي قال أتينا أنس بن مالك فشكونا إليه ما نلقى من الحجاج فقال اصبروا فإنه لا يأتي عليكم زمان إلا الذي بعده شر منه حتى تلقوا ربكم سمعته من نبيكم صلى الله عليه وسلم 	" Narrated Az-Zubair bin `Adi: We went to Anas bin Malik and complained about the wrong we were suffering at the hand of Al- Hajjaj. Anas bin Malik said, ""Be patient till you meet your Lord, for no time will come upon you but the time following it will be worse than it. I heard that from the Prophet."" "
bukhari92_161870	 حدثنا أبو اليمان أخبرنا شعيب عن الزهري ح وحدثنا إسماعيل حدثني أخي عن سليمان عن محمد بن أبي عتيق عن ابن شهاب عن	عن هند بنت الحارث الفراسية أن أم سلمة زوج النبي صلى الله عليه وسلم قالت استيقظ رسول الله صلى الله عليه وسلم ليلة فزعا يقول سبحان الله ماذا أنزل الله من الخزائن وماذا أنزل من الفتن من يوقظ صواحب الحجرات يريد أزواجه لكى يصلين رب كاسية في الدنيا عارية في الآخرة 	 حدثنا أبو اليمان أخبرنا شعيب عن الزهري ح وحدثنا إسماعيل حدثني أخي عن سليمان عن محمد بن أبي عتيق عن ابن شهاب عن هند بنت الحارث الفراسية أن أم سلمة زوج النبي صلى الله عليه وسلم قالت استيقظ رسول الله صلى الله عليه وسلم ليلة فزعا يقول سبحان الله ماذا أنزل الله من الخزائن وماذا أنزل من الفتن من يوقظ صواحب الحجرات يريد أزواجه لكى يصلين رب كاسية في الدنيا عارية في الآخرة 	" Narrated Um Salama: (the wife of the Prophet) Allah's Messenger (SL3M) woke up one night in a state of terror and said, ""Subhan Allah, How many treasures Allah has sent down! And how many afflictions have been sent down! Who will go and wake the lady dwellers (wives of the Prophet) up of these rooms (for prayers)?"" He meant his wives, so that they might pray. He added, ""A well-dressed (soul) in this world may be naked in the Hereafter."" "
