bukhari39_122100	not identified	 وقال أبو الزناد عن محمد بن حمزة بن عمرو الأسلمي عن أبيه أن عمر رضى الله عنه بعثه مصدقا فوقع رجل على جارية امرأته فأخذ حمزة من الرجل كفيلا حتى قدم على عمر وكان عمر قد جلده مائة جلدة فصدقهم وعذره بالجهالة وقال جرير والأشعث لعبد الله بن مسعود في المرتدين استتبهم وكفلهم فتابوا وكفلهم عشائرهم وقال حماد إذا تكفل بنفس فمات فلا شىء عليه وقال الحكم يضمن 	 وقال أبو الزناد عن محمد بن حمزة بن عمرو الأسلمي عن أبيه أن عمر رضى الله عنه بعثه مصدقا فوقع رجل على جارية امرأته فأخذ حمزة من الرجل كفيلا حتى قدم على عمر وكان عمر قد جلده مائة جلدة فصدقهم وعذره بالجهالة وقال جرير والأشعث لعبد الله بن مسعود في المرتدين استتبهم وكفلهم فتابوا وكفلهم عشائرهم وقال حماد إذا تكفل بنفس فمات فلا شىء عليه وقال الحكم يضمن 	" Narrated Muhammad bin 'Amr Al-Aslami that his father Hamza said: 'Umar (ra) sent him (i.e. Hamza) as a Sadaqa / Zakat collector. A man had committed illegal sexual intercourse with the slave girl of his wife. Hamza took (personal) sureties for the adulterer till they came to 'Umar. 'Umar had lashed the adulterer one hundred lashes. 'Umar confirmed their claim (that the adulterer had already been punished) and excused him because of being Ignorant.Jarir Al-Ash'ath said to Ibn Mas'ud regarding renegades (i.e., those who became infidels after embracing Islam), ""Let them repent and take (personal) sureties for them."" They repented and their relatives stood sureties for them.According to Hammad, if somebody stands surety for another person and that person dies, the person giving surety will be released from responsibility. According to Al-Hakam, his responsibilities continues. "
bukhari39_122110	not identified	 قال أبو عبد الله وقال الليث حدثني جعفر بن ربيعة عن عبد الرحمن بن هرمز عن أبي هريرة رضى الله عنه عن رسول الله صلى الله عليه وسلم أنه ذكر رجلا من بني إسرائيل سأل بعض بني إسرائيل أن يسلفه ألف دينار فقال ائتني بالشهداء أشهدهم فقال كفى بالله شهيدا قال فأتني بالكفيل قال كفى بالله كفيلا قال صدقت فدفعها إليه إلى أجل مسمى فخرج في البحر فقضى حاجته ثم التمس مركبا يركبها يقدم عليه للأجل الذي أجله فلم يجد مركبا فأخذ خشبة فنقرها فأدخل فيها ألف دينار وصحيفة منه إلى صاحبه ثم زجج موضعها ثم أتى بها إلى البحر فقال اللهم إنك تعلم أني كنت تسلفت فلانا ألف دينار فسألني كفيلا فقلت كفى بالله كفيلا فرضي بك وسألني شهيدا فقلت كفى بالله شهيدا فرضي بك وأني جهدت أن أجد مركبا أبعث إليه الذي له فلم أقدر وإني أستودعكها فرمى بها في البحر حتى ولجت فيه ثم انصرف وهو في ذلك يلتمس مركبا يخرج إلى بلده فخرج الرجل الذي كان أسلفه ينظر لعل مركبا قد جاء بماله فإذا بالخشبة التي فيها المال فأخذها لأهله حطبا فلما نشرها وجد المال والصحيفة ثم قدم الذي كان أسلفه فأتى بالألف دينار فقال والله ما زلت جاهدا في طلب مركب لآتيك بمالك فما وجدت مركبا قبل الذي أتيت فيه قال هل كنت بعثت إلى بشىء قال أخبرك أني لم أجد مركبا قبل الذي جئت فيه قال فإن الله قد أدى عنك الذي بعثت في الخشبة فانصرف بالألف الدينار راشدا 	 قال أبو عبد الله وقال الليث حدثني جعفر بن ربيعة عن عبد الرحمن بن هرمز عن أبي هريرة رضى الله عنه عن رسول الله صلى الله عليه وسلم أنه ذكر رجلا من بني إسرائيل سأل بعض بني إسرائيل أن يسلفه ألف دينار فقال ائتني بالشهداء أشهدهم فقال كفى بالله شهيدا قال فأتني بالكفيل قال كفى بالله كفيلا قال صدقت فدفعها إليه إلى أجل مسمى فخرج في البحر فقضى حاجته ثم التمس مركبا يركبها يقدم عليه للأجل الذي أجله فلم يجد مركبا فأخذ خشبة فنقرها فأدخل فيها ألف دينار وصحيفة منه إلى صاحبه ثم زجج موضعها ثم أتى بها إلى البحر فقال اللهم إنك تعلم أني كنت تسلفت فلانا ألف دينار فسألني كفيلا فقلت كفى بالله كفيلا فرضي بك وسألني شهيدا فقلت كفى بالله شهيدا فرضي بك وأني جهدت أن أجد مركبا أبعث إليه الذي له فلم أقدر وإني أستودعكها فرمى بها في البحر حتى ولجت فيه ثم انصرف وهو في ذلك يلتمس مركبا يخرج إلى بلده فخرج الرجل الذي كان أسلفه ينظر لعل مركبا قد جاء بماله فإذا بالخشبة التي فيها المال فأخذها لأهله حطبا فلما نشرها وجد المال والصحيفة ثم قدم الذي كان أسلفه فأتى بالألف دينار فقال والله ما زلت جاهدا في طلب مركب لآتيك بمالك فما وجدت مركبا قبل الذي أتيت فيه قال هل كنت بعثت إلى بشىء قال أخبرك أني لم أجد مركبا قبل الذي جئت فيه قال فإن الله قد أدى عنك الذي بعثت في الخشبة فانصرف بالألف الدينار راشدا 	" Narrated Abu Huraira: The Prophet (SL3M) said, ""An Israeli man asked another Israeli to lend him one thousand Dinars. The second man required witnesses. The former replied, 'Allah is sufficient as a witness.' The second said, 'I want a surety.' The former replied, 'Allah is sufficient as a surety.' The second said, 'You are right,' and lent him the money for a certain period. The debtor went across the sea. When he finished his job, he searched for a conveyance so that he might reach in time for the repayment of the debt, but he could not find any. So, he took a piece of wood and made a hole in it, inserted in it one thousand Dinars and a letter to the lender and then closed (i.e. sealed) the hole tightly. He took the piece of wood to the sea and said. 'O Allah! You know well that I took a loan of one thousand Dinars from so-and-so. He demanded a surety from me but I told him that Allah's Guarantee was sufficient and he accepted Your guarantee. He then asked for a witness and I told him that Allah was sufficient as a Witness, and he accepted You as a Witness. No doubt, I tried hard to find a conveyance so that I could pay his money but could not find, so I hand over this money to You.' Saying that, he threw the piece of wood into the sea till it went out far into it, and then he went away. Meanwhile he started searching for a conveyance in order to reach the creditor's country. One day the lender came out of his house to see whether a ship had arrived bringing his money, and all of a sudden he saw the piece of wood in which his money had been deposited. He took it home to use for fire. When he sawed it, he found his money and the letter inside it. Shortly after that, the debtor came bringing one thousand Dinars to him and said, 'By Allah, I had been trying hard to get a boat so that I could bring you your money, but failed to get one before the one I have come by.' The lender asked, 'Have you sent something to me?' The debtor replied, 'I have told you I could not get a boat other than the one I have come by.' The lender said, 'Allah has delivered on your behalf the money you sent in the piece of wood. So, you may keep your one thousand Dinars and depart guided on the right path.' "" "
bukhari39_122120	 حدثنا الصلت بن محمد حدثنا أبو أسامة عن إدريس عن طلحة بن مصرف عن سعيد بن جبير عن	عن ابن عباس رضى الله عنهما – {ولكل جعلنا موالي} قال ورثة {والذين عقدت أيمانكم} قال كان المهاجرون لما قدموا المدينة يرث المهاجر الأنصاري دون ذوي رحمه للأخوة التي آخى النبي صلى الله عليه وسلم بينهم فلما نزلت {ولكل جعلنا موالي} نسخت ثم قال {والذين عقدت أيمانكم } إلا النصر والرفادة والنصيحة وقد ذهب الميراث ويوصي له 	 حدثنا الصلت بن محمد حدثنا أبو أسامة عن إدريس عن طلحة بن مصرف عن سعيد بن جبير عن ابن عباس رضى الله عنهما – {ولكل جعلنا موالي} قال ورثة {والذين عقدت أيمانكم} قال كان المهاجرون لما قدموا المدينة يرث المهاجر الأنصاري دون ذوي رحمه للأخوة التي آخى النبي صلى الله عليه وسلم بينهم فلما نزلت {ولكل جعلنا موالي} نسخت ثم قال {والذين عقدت أيمانكم } إلا النصر والرفادة والنصيحة وقد ذهب الميراث ويوصي له 	" Narrated Sa`id bin Jubair: Ibn `Abbas said, ""In the verse: To every one We have appointed ' (Muwaliya Muwaliya means one's) heirs (4.33).' (And regarding the verse) 'And those with whom your right hands have made a pledge.' Ibn `Abbas said, ""When the emigrants came to the Prophet (SL3M) in Medina, the emigrant would inherit the Ansari while the latter's relatives would not inherit him because of the bond of brotherhood which the Prophet established between them (i.e. the emigrants and the Ansar). When the verse: 'And to everyone We have appointed heirs' (4.33) was revealed, it canceled (the bond (the pledge) of brotherhood regarding inheritance)."" Then he said, ""The verse: To those also to whom your right hands have pledged, remained valid regarding cooperation and mutual advice, while the matter of inheritance was excluded and it became permissible to assign something in one's testament to the person who had the right of inheriting before. "
bukhari39_122130	 حدثنا قتيبة حدثنا إسماعيل بن جعفر عن حميد عن	حدثنا أنس رضى الله عنه قال قدم علينا عبد الرحمن بن عوف فآخى رسول الله صلى الله عليه وسلم بينه وبين سعد بن الربيع 	 حدثنا قتيبة حدثنا إسماعيل بن جعفر عن حميد عن أنس رضى الله عنه قال قدم علينا عبد الرحمن بن عوف فآخى رسول الله صلى الله عليه وسلم بينه وبين سعد بن الربيع 	 Narrated Anas: `Abdur-Rahman bin `Auf came to us and Allah's Messenger (SL3M) established a bond of brotherhood between him and Sa`d bin Rabi`a. 
bukhari39_122140	 حدثنا محمد بن الصباح حدثنا إسماعيل بن زكرياء حدثنا	حدثنا عاصم قال قلت لأنس رضى الله عنه أبلغك أن النبي صلى الله عليه وسلم قال لا حلف في الإسلام فقال قد حالف النبي صلى الله عليه وسلم بين قريش والأنصار في داري 	 حدثنا محمد بن الصباح حدثنا إسماعيل بن زكرياء حدثنا عاصم قال قلت لأنس رضى الله عنه أبلغك أن النبي صلى الله عليه وسلم قال لا حلف في الإسلام فقال قد حالف النبي صلى الله عليه وسلم بين قريش والأنصار في داري 	" Narrated `Asim: I heard Anas bin Malik, ""Have you ever heard that the Prophet (SL3M) said, 'There is no alliance in Islam?' "" He replied, ""The Prophet (SL3M) made alliance between Quraish and the Ansar in my house."" "
bukhari39_122150	 حدثنا أبو عاصم عن يزيد بن أبي عبيد عن سلمة بن	عن الأكوع رضى الله عنه أن النبي صلى الله عليه وسلم أتي بجنازة ليصلي عليها فقال هل عليه من دين قالوا لا فصلى عليه ثم أتي بجنازة أخرى فقال هل عليه من دين قالوا نعم قال صلوا على صاحبكم قال أبو قتادة على دينه يا رسول الله فصلى عليه 	 حدثنا أبو عاصم عن يزيد بن أبي عبيد عن سلمة بن الأكوع رضى الله عنه أن النبي صلى الله عليه وسلم أتي بجنازة ليصلي عليها فقال هل عليه من دين قالوا لا فصلى عليه ثم أتي بجنازة أخرى فقال هل عليه من دين قالوا نعم قال صلوا على صاحبكم قال أبو قتادة على دينه يا رسول الله فصلى عليه 	" Narrated Salama bin Al-Akwa`: A dead person was brought to the Prophet (SL3M) so that he might lead the funeral prayer for him. He asked, ""Is he in debt?"" When the people replied in the negative, he led the funeral prayer. Another dead person was brought and he asked, ""Is he in debt?"" They said, ""Yes."" He (refused to lead the prayer and) said, ""Lead the prayer of your friend."" Abu Qatada said, ""O Allah's Messenger (SL3M)! I undertake to pay his debt."" Allah's Messenger (SL3M) then led his funeral prayer. "
bukhari39_122160	 حدثنا علي بن عبد الله حدثنا سفيان حدثنا عمرو سمع محمد بن علي عن جابر بن	حدثنا عبد الله رضى الله عنهم قال قال النبي صلى الله عليه وسلم لو قد جاء مال البحرين قد أعطيتك هكذا وهكذا وهكذا فلم يجئ مال البحرين حتى قبض النبي صلى الله عليه وسلم فلما جاء مال البحرين أمر أبو بكر فنادى من كان له عند النبي صلى الله عليه وسلم عدة أو دين فليأتنا فأتيته فقلت إن النبي صلى الله عليه وسلم قال لي كذا وكذا فحثى لي حثية فعددتها فإذا هي خمسمائة وقال خذ مثليها 	 حدثنا علي بن عبد الله حدثنا سفيان حدثنا عمرو سمع محمد بن علي عن جابر بن عبد الله رضى الله عنهم قال قال النبي صلى الله عليه وسلم لو قد جاء مال البحرين قد أعطيتك هكذا وهكذا وهكذا فلم يجئ مال البحرين حتى قبض النبي صلى الله عليه وسلم فلما جاء مال البحرين أمر أبو بكر فنادى من كان له عند النبي صلى الله عليه وسلم عدة أو دين فليأتنا فأتيته فقلت إن النبي صلى الله عليه وسلم قال لي كذا وكذا فحثى لي حثية فعددتها فإذا هي خمسمائة وقال خذ مثليها 	" Narrated Jabir bin `Abdullah: Once the Prophet (SL3M) said (to me), ""If the money of Bahrain comes, I will give you a certain amount of it."" The Prophet (SL3M) had breathed his last before the money of Bahrain arrived. When the money of Bahrain reached, Abu Bakr announced, ""Whoever was promised by the Prophet (SL3M) should come to us."" I went to Abu Bakr and said, ""The Prophet (SL3M) promised me so and so."" Abu Bakr gave me a handful of coins and when I counted them, they were five-hundred in number. Abu Bakr then said, ""Take twice the amount you have taken (besides). "
