bukhari23_111630	 حدثنا إسماعيل قال حدثني مالك عن هشام بن عروة عن أبيه عن	عن عائشة رضى الله عنها أن رسول الله صلى الله عليه وسلم كفن في ثلاثة أثواب بيض سحولية ليس فيها قميص ولا عمامة 	 حدثنا إسماعيل قال حدثني مالك عن هشام بن عروة عن أبيه عن عائشة رضى الله عنها أن رسول الله صلى الله عليه وسلم كفن في ثلاثة أثواب بيض سحولية ليس فيها قميص ولا عمامة 	 Narrated Aisha: Allah's Messenger (SL3M) was shrouded in three pieces of cloth which were made of white Suhul and neither a shirt nor a turban were used. 
bukhari23_111640	 حدثنا أحمد بن محمد المكي حدثنا إبراهيم بن سعد عن سعد عن أبيه قال أتي عبد الرحمن بن	عن عوف رضى الله عنه يوما بطعامه فقال قتل مصعب بن عمير وكان خيرا مني فلم يوجد له ما يكفن فيه إلا بردة وقتل حمزة أو رجل آخر خير مني فلم يوجد له ما يكفن فيه إلا بردة لقد خشيت أن يكون قد عجلت لنا طيباتنا في حياتنا الدنيا ثم جعل يبكي 	 حدثنا أحمد بن محمد المكي حدثنا إبراهيم بن سعد عن سعد عن أبيه قال أتي عبد الرحمن بن عوف رضى الله عنه يوما بطعامه فقال قتل مصعب بن عمير وكان خيرا مني فلم يوجد له ما يكفن فيه إلا بردة وقتل حمزة أو رجل آخر خير مني فلم يوجد له ما يكفن فيه إلا بردة لقد خشيت أن يكون قد عجلت لنا طيباتنا في حياتنا الدنيا ثم جعل يبكي 	" Narrated Sa`d from his father: Once the meal of `Abdur-Rahman bin `Auf was brought in front of him, and he said, ""Mustab bin `Umar was martyred and he was better than I, and he had nothing except his Burd (a black square narrow dress) to be shrouded in. Hamza or another person was martyred and he was also better than I and he had nothing to be shrouded in except his Burd. No doubt, I fear that the rewards of my deeds might have been given early in this world."" Then he started weeping. "
bukhari23_111650	 حدثنا محمد بن مقاتل أخبرنا عبد الله أخبرنا شعبة عن سعد بن إبراهيم عن أبيه إبراهيم أن عبد الرحمن بن	عن عوف رضى الله عنه أتي بطعام وكان صائما فقال قتل مصعب بن عمير وهو خير مني كفن في بردة إن غطي رأسه بدت رجلاه وإن غطي رجلاه بدا رأسه وأراه قال وقتل حمزة وهو خير مني ثم بسط لنا من الدنيا ما بسط أو قال أعطينا من الدنيا ما أعطينا وقد خشينا أن تكون حسناتنا عجلت لنا ثم جعل يبكي حتى ترك الطعام 	 حدثنا محمد بن مقاتل أخبرنا عبد الله أخبرنا شعبة عن سعد بن إبراهيم عن أبيه إبراهيم أن عبد الرحمن بن عوف رضى الله عنه أتي بطعام وكان صائما فقال قتل مصعب بن عمير وهو خير مني كفن في بردة إن غطي رأسه بدت رجلاه وإن غطي رجلاه بدا رأسه وأراه قال وقتل حمزة وهو خير مني ثم بسط لنا من الدنيا ما بسط أو قال أعطينا من الدنيا ما أعطينا وقد خشينا أن تكون حسناتنا عجلت لنا ثم جعل يبكي حتى ترك الطعام 	" Narrated Ibrahim: Once a meal was brought to `Abdur-Rahman bin `Auf and he was fasting. He said, ""Mustab bin `Umar was martyred and he was better than I and was shrouded in his Burd and when his head was covered with it, his legs became bare, and when his legs were covered his head got uncovered. Hamza was martyred and was better than I. Now the worldly wealth have been bestowed upon us (or said a similar thing). No doubt, I fear that the rewards of my deeds might have been given earlier in this world."" Then he started weeping and left his food. "
bukhari23_111660	 حدثنا عمر بن حفص بن غياث حدثنا أبي حدثنا الأعمش حدثنا شقيق حدثنا	حدثنا خباب رضى الله عنه قال هاجرنا مع النبي صلى الله عليه وسلم نلتمس وجه الله فوقع أجرنا على الله فمنا من مات لم يأكل من أجره شيئا منهم مصعب بن عمير ومنا من أينعت له ثمرته فهو يهدبها قتل يوم أحد فلم نجد ما نكفنه إلا بردة إذا غطينا بها رأسه خرجت رجلاه وإذا غطينا رجليه خرج رأسه فأمرنا النبي صلى الله عليه وسلم أن نغطي رأسه وأن نجعل على رجليه من الإذخر 	 حدثنا عمر بن حفص بن غياث حدثنا أبي حدثنا الأعمش حدثنا شقيق حدثنا خباب رضى الله عنه قال هاجرنا مع النبي صلى الله عليه وسلم نلتمس وجه الله فوقع أجرنا على الله فمنا من مات لم يأكل من أجره شيئا منهم مصعب بن عمير ومنا من أينعت له ثمرته فهو يهدبها قتل يوم أحد فلم نجد ما نكفنه إلا بردة إذا غطينا بها رأسه خرجت رجلاه وإذا غطينا رجليه خرج رأسه فأمرنا النبي صلى الله عليه وسلم أن نغطي رأسه وأن نجعل على رجليه من الإذخر 	 Narrated Khabbab: We emigrated with the Prophet (SL3M) (p.b.u.h) in Allah's cause, and so our reward was then surely incumbent on Allah. Some of us died and they did not take anything from their rewards in this world, and amongst them was Mustab bin `Umar; and the others were those who got their rewards. Mustab bin `Umar was martyred on the day of the Battle of Uhud and we could get nothing except his Burd to shroud him in. And when we covered his head his feet became bare and vice versa. So the Prophet (SL3M) ordered us to cover his head only and to put idhkhir (a kind of shrub) over his feet. 
bukhari23_111670	 حدثنا عبد الله بن مسلمة حدثنا ابن أبي حازم عن أبيه عن	عن سهل رضى الله عنه أن امرأة جاءت النبي صلى الله عليه وسلم ببردة منسوجة فيها حاشيتها أتدرون ما البردة قالوا الشملة قال نعم قالت نسجتها بيدي فجئت لأكسوكها فأخذها النبي صلى الله عليه وسلم محتاجا إليها فخرج إلينا وإنها إزاره فحسنها فلان فقال اكسنيها ما أحسنها قال القوم ما أحسنت لبسها النبي صلى الله عليه وسلم محتاجا إليها ثم سألته وعلمت أنه لا يرد قال إني والله ما سألته لألبسها إنما سألته لتكون كفني قال سهل فكانت كفنه 	 حدثنا عبد الله بن مسلمة حدثنا ابن أبي حازم عن أبيه عن سهل رضى الله عنه أن امرأة جاءت النبي صلى الله عليه وسلم ببردة منسوجة فيها حاشيتها أتدرون ما البردة قالوا الشملة قال نعم قالت نسجتها بيدي فجئت لأكسوكها فأخذها النبي صلى الله عليه وسلم محتاجا إليها فخرج إلينا وإنها إزاره فحسنها فلان فقال اكسنيها ما أحسنها قال القوم ما أحسنت لبسها النبي صلى الله عليه وسلم محتاجا إليها ثم سألته وعلمت أنه لا يرد قال إني والله ما سألته لألبسها إنما سألته لتكون كفني قال سهل فكانت كفنه 	" Narrated Sahl: A woman brought a woven Burda (sheet) having edging (border) to the Prophet, Then Sahl asked them whether they knew what is Burda, they said that Burda is a cloak and Sahl confirmed their reply. Then the woman said, ""I have woven it with my own hands and I have brought it so that you may wear it."" The Prophet (SL3M) accepted it, and at that time he was in need of it. So he came out wearing it as his waist-sheet. A man praised it and said, ""Will you give it to me? How nice it is!"" The other people said, ""You have not done the right thing as the Prophet (SL3M) is in need of it and you have asked for it when you know that he never turns down anybody's request."" The man replied, ""By Allah, I have not asked for it to wear it but to make it my shroud."" Later it was his shroud. "
bukhari23_111680	 حدثنا قبيصة بن عقبة حدثنا سفيان عن خالد الحذاء عن أم الهذيل عن أم عطية رضى الله عنها قالت نهينا عن	عن اتباع الجنائز ولم يعزم علينا 	 حدثنا قبيصة بن عقبة حدثنا سفيان عن خالد الحذاء عن أم الهذيل عن أم عطية رضى الله عنها قالت نهينا عن اتباع الجنائز ولم يعزم علينا 	 Narrated Um 'Atiyya: We were forbidden to accompany funeral processions but not strictly. 
bukhari23_111690	 حدثنا مسدد حدثنا بشر بن المفضل حدثنا سلمة بن	حدثنا علقمة عن محمد بن سيرين قال توفي ابن لأم عطية رضى الله عنها فلما كان اليوم الثالث دعت بصفرة فتمسحت به وقالت نهينا أن نحد أكثر من ثلاث إلا بزوج 	 حدثنا مسدد حدثنا بشر بن المفضل حدثنا سلمة بن علقمة عن محمد بن سيرين قال توفي ابن لأم عطية رضى الله عنها فلما كان اليوم الثالث دعت بصفرة فتمسحت به وقالت نهينا أن نحد أكثر من ثلاث إلا بزوج 	" Narrated Muhammad bin Seereen: One of the sons of Um 'Atiyya died, and when it was the third day she asked for a yellow perfume and put it over her body, and said, ""We were forbidden to mourn for more than three days except for our husbands."" "
bukhari23_111700	 حدثنا الحميدي حدثنا سفيان حدثنا أيوب بن	حدثنا موسى قال أخبرني حميد بن نافع عن زينب ابنة أبي سلمة قالت لما جاء نعى أبي سفيان من الشأم دعت أم حبيبة رضى الله عنها بصفرة في اليوم الثالث فمسحت عارضيها وذراعيها وقالت إني كنت عن هذا لغنية لولا أني سمعت النبي صلى الله عليه وسلم يقول لا يحل لامرأة تؤمن بالله واليوم الآخر أن تحد على ميت فوق ثلاث إلا على زوج فإنها تحد عليه أربعة أشهر وعشرا 	 حدثنا الحميدي حدثنا سفيان حدثنا أيوب بن موسى قال أخبرني حميد بن نافع عن زينب ابنة أبي سلمة قالت لما جاء نعى أبي سفيان من الشأم دعت أم حبيبة رضى الله عنها بصفرة في اليوم الثالث فمسحت عارضيها وذراعيها وقالت إني كنت عن هذا لغنية لولا أني سمعت النبي صلى الله عليه وسلم يقول لا يحل لامرأة تؤمن بالله واليوم الآخر أن تحد على ميت فوق ثلاث إلا على زوج فإنها تحد عليه أربعة أشهر وعشرا 	" Narrated Zainab bint Abi Salama: When the news of the death of Abu Sufyan reached from Sham, Um Habiba on the third day, asked for a yellow perfume and scented her cheeks and forearms and said, ""No doubt, I would not have been in need of this, had I not heard the Prophet (SL3M) saying: ""It is not legal for a woman who believes in Allah and the Last Day to mourn for more than three days for any dead person except her husband, for whom she should mourn for four months and ten days."" "
bukhari23_111711	 حدثنا إسماعيل حدثني مالك عن عبد الله بن	حدثنا أبي بكر بن محمد بن عمرو بن حزم عن حميد بن نافع عن زينب بنت أبي سلمة أخبرته قالت دخلت على أم حبيبة زوج النبي صلى الله عليه وسلم فقالت سمعت رسول الله صلى الله عليه وسلم يقول لا يحل لامرأة تؤمن بالله واليوم الآخر تحد على ميت فوق ثلاث إلا على زوج أربعة أشهر وعشرا ثم دخلت على زينب بنت جحش حين توفي أخوها فدعت بطيب فمست ثم قالت ما لي بالطيب من حاجة غير أني سمعت رسول الله صلى الله عليه وسلم على المنبر يقول لا يحل لامرأة تؤمن بالله واليوم الآخر تحد على ميت فوق ثلاث إلا على زوج أربعة أشهر وعشرا 	 حدثنا إسماعيل حدثني مالك عن عبد الله بن أبي بكر بن محمد بن عمرو بن حزم عن حميد بن نافع عن زينب بنت أبي سلمة أخبرته قالت دخلت على أم حبيبة زوج النبي صلى الله عليه وسلم فقالت سمعت رسول الله صلى الله عليه وسلم يقول لا يحل لامرأة تؤمن بالله واليوم الآخر تحد على ميت فوق ثلاث إلا على زوج أربعة أشهر وعشرا ثم دخلت على زينب بنت جحش حين توفي أخوها فدعت بطيب فمست ثم قالت ما لي بالطيب من حاجة غير أني سمعت رسول الله صلى الله عليه وسلم على المنبر يقول لا يحل لامرأة تؤمن بالله واليوم الآخر تحد على ميت فوق ثلاث إلا على زوج أربعة أشهر وعشرا 	" Narrated Zainab bint Abi Salama: I went to Um Habiba, the wife of Prophet, who said, ""I heard the Prophets saying, 'It is not legal for a woman who believes in Allah and the Last Day to mourn for any dead person for more than three days except for her husband, (for whom she should mourn) for four months and ten days'."" Later I went to Zainab bint Jahsh when her brother died; she asked for some scent, and after using it she said, ""I am not in need of scent but I heard Allah's Messenger (SL3M) saying, 'It is not legal for a woman who believes in Allah and the Last Day to mourn for more than three days for any dead person except her husband, (for whom she should mourn) for four months and ten days.' "" "
bukhari23_111730	 حدثنا آدم حدثنا شعبة حدثنا ثابت عن أنس بن	حدثنا مالك رضى الله عنه قال مر النبي صلى الله عليه وسلم بامرأة تبكي عند قبر فقال اتقي الله واصبري قالت إليك عني فإنك لم تصب بمصيبتي ولم تعرفه فقيل لها إنه النبي صلى الله عليه وسلم فأتت باب النبي صلى الله عليه وسلم فلم تجد عنده بوابين فقالت لم أعرفك فقال إنما الصبر عند الصدمة الأولى 	 حدثنا آدم حدثنا شعبة حدثنا ثابت عن أنس بن مالك رضى الله عنه قال مر النبي صلى الله عليه وسلم بامرأة تبكي عند قبر فقال اتقي الله واصبري قالت إليك عني فإنك لم تصب بمصيبتي ولم تعرفه فقيل لها إنه النبي صلى الله عليه وسلم فأتت باب النبي صلى الله عليه وسلم فلم تجد عنده بوابين فقالت لم أعرفك فقال إنما الصبر عند الصدمة الأولى 	" Narrated Anas bin Malik: The Prophet (SL3M) passed by a woman who was weeping beside a grave. He told her to fear Allah and be patient. She said to him, ""Go away, for you have not been afflicted with a calamity like mine."" And she did not recognize him. Then she was informed that he was the Prophet (SL3M) . so she went to the house of the Prophet (SL3M) and there she did not find any guard. Then she said to him, ""I did not recognize you."" He said, ""Verily, the patience is at the first stroke of a calamity."" "
bukhari23_111740	 حدثنا عبدان ومحمد قالا أخبرنا عبد الله أخبرنا عاصم بن	حدثنا سليمان عن أبي عثمان قال حدثني أسامة بن زيد رضى الله عنهما قال أرسلت ابنة النبي صلى الله عليه وسلم إليه إن ابنا لي قبض فائتنا فأرسل يقرئ السلام ويقول إن لله ما أخذ وله ما أعطى وكل عنده بأجل مسمى فلتصبر ولتحتسب فأرسلت إليه تقسم عليه ليأتينها فقام ومعه سعد بن عبادة ومعاذ بن جبل وأبى بن كعب وزيد بن ثابت ورجال فرفع إلى رسول الله صلى الله عليه وسلم الصبي ونفسه تتقعقع قال حسبته أنه قال كأنها شن ففاضت عيناه فقال سعد يا رسول الله ما هذا فقال هذه رحمة جعلها الله في قلوب عباده وإنما يرحم الله من عباده الرحماء 	 حدثنا عبدان ومحمد قالا أخبرنا عبد الله أخبرنا عاصم بن سليمان عن أبي عثمان قال حدثني أسامة بن زيد رضى الله عنهما قال أرسلت ابنة النبي صلى الله عليه وسلم إليه إن ابنا لي قبض فائتنا فأرسل يقرئ السلام ويقول إن لله ما أخذ وله ما أعطى وكل عنده بأجل مسمى فلتصبر ولتحتسب فأرسلت إليه تقسم عليه ليأتينها فقام ومعه سعد بن عبادة ومعاذ بن جبل وأبى بن كعب وزيد بن ثابت ورجال فرفع إلى رسول الله صلى الله عليه وسلم الصبي ونفسه تتقعقع قال حسبته أنه قال كأنها شن ففاضت عيناه فقال سعد يا رسول الله ما هذا فقال هذه رحمة جعلها الله في قلوب عباده وإنما يرحم الله من عباده الرحماء 	" Narrated Usama bin Zaid: The daughter of the Prophet (SL3M) (p.b.u.h) sent (a messenger) to the Prophet (SL3M) requesting him to come as her child was dying (or was gasping), but the Prophet (SL3M) returned the messenger and told him to convey his greeting to her and say: ""Whatever Allah takes is for Him and whatever He gives, is for Him, and everything with Him has a limited fixed term (in this world) and so she should be patient and hope for Allah's reward."" She again sent for him, swearing that he should come. The Prophet (SL3M) got up, and so did Sa`d bin 'Ubada, Mu`adh bin Jabal, Ubai bin Ka`b, Zaid bin Thabit and some other men. The child was brought to Allah's Messenger (SL3M) while his breath was disturbed in his chest (the sub-narrator thinks that Usama added: ) as if it was a leather water-skin. On that the eyes of the Prophet (SL3M) (p.b.u.h) started shedding tears. Sa`d said, ""O Allah's Messenger (SL3M)! What is this?"" He replied, ""It is mercy which Allah has lodged in the hearts of His slaves, and Allah is merciful only to those of His slaves who are merciful (to others). "
bukhari23_111750	 حدثنا عبد الله بن محمد حدثنا أبو عامر حدثنا فليح بن سليمان عن هلال بن علي عن أنس بن	عن مالك رضى الله عنه قال شهدنا بنتا لرسول الله صلى الله عليه وسلم قال ورسول الله صلى الله عليه وسلم جالس على القبر قال فرأيت عينيه تدمعان قال فقال هل منكم رجل لم يقارف الليلة فقال أبو طلحة أنا قال فانزل قال فنزل في قبرها 	 حدثنا عبد الله بن محمد حدثنا أبو عامر حدثنا فليح بن سليمان عن هلال بن علي عن أنس بن مالك رضى الله عنه قال شهدنا بنتا لرسول الله صلى الله عليه وسلم قال ورسول الله صلى الله عليه وسلم جالس على القبر قال فرأيت عينيه تدمعان قال فقال هل منكم رجل لم يقارف الليلة فقال أبو طلحة أنا قال فانزل قال فنزل في قبرها 	" Narrated Anas bin Malik: We were (in the funeral procession) of one of the daughters of the Prophet (SL3M) and he was sitting by the side of the grave. I saw his eyes shedding tears. He said, ""Is there anyone among you who did not have sexual relations with his wife last night?"" Abu Talha replied in the affirmative. And so the Prophet told him to get down in the grave. And so he got down in her grave. "
