bukhari20_110750	 حدثنا حفص بن عمر حدثنا شعبة قال أخبرني عبد الملك بن عمير عن	حدثنا قزعة قال سمعت أبا سعيد رضى الله عنه أربعا قال سمعت من النبي صلى الله عليه وسلم وكان غزا مع النبي صلى الله عليه وسلم ثنتى عشرة غزوة ح 	 حدثنا حفص بن عمر حدثنا شعبة قال أخبرني عبد الملك بن عمير عن قزعة قال سمعت أبا سعيد رضى الله عنه أربعا قال سمعت من النبي صلى الله عليه وسلم وكان غزا مع النبي صلى الله عليه وسلم ثنتى عشرة غزوة ح 	" Narrated Quza'a: I heard Abu Said saying four words. He said, ""I heard the Prophet (SL3M) (saying the following narrative)."" He had participated in twelve holy battles with the Prophet. "
bukhari20_110760	 حدثنا علي حدثنا سفيان عن الزهري عن سعيد عن أبي هريرة رضى الله عنه عن	عن النبي صلى الله عليه وسلم قال لا تشد الرحال إلا إلى ثلاثة مساجد المسجد الحرام ومسجد الرسول صلى الله عليه وسلم ومسجد الأقصى 	 حدثنا علي حدثنا سفيان عن الزهري عن سعيد عن أبي هريرة رضى الله عنه عن النبي صلى الله عليه وسلم قال لا تشد الرحال إلا إلى ثلاثة مساجد المسجد الحرام ومسجد الرسول صلى الله عليه وسلم ومسجد الأقصى 	" Narrated Abu Huraira: The Prophet (SL3M) said, ""Do not set out on a journey except for three Mosques i.e. Al-Masjid-AI-Haram, the Mosque of Allah's Messenger (SL3M) , and the Mosque of Al-Aqsa, (Mosque of Jerusalem)."" "
bukhari20_110770	 حدثنا عبد الله بن يوسف قال أخبرنا مالك عن زيد بن رباح وعبيد الله بن	عن أبي عبد الله الأغر عن أبي عبد الله الأغر عن أبي هريرة رضى الله عنه أن النبي صلى الله عليه وسلم قال صلاة في مسجدي هذا خير من ألف صلاة فيما سواه إلا المسجد الحرام 	 حدثنا عبد الله بن يوسف قال أخبرنا مالك عن زيد بن رباح وعبيد الله بن أبي عبد الله الأغر عن أبي عبد الله الأغر عن أبي هريرة رضى الله عنه أن النبي صلى الله عليه وسلم قال صلاة في مسجدي هذا خير من ألف صلاة فيما سواه إلا المسجد الحرام 	" Narrated Abu Huraira: Allah's Messenger (SL3M) said, ""One prayer in my Mosque is better than one thousand prayers in any other mosque excepting Al-Masjid-AI-Haram."" "
bukhari20_110781	 حدثنا يعقوب بن إبراهيم هو الدورقي حدثنا ابن علية أخبرنا أيوب عن	أخبرنا نافع أن ابن عمر رضى الله عنهما كان لا يصلي من الضحى إلا في يومين يوم يقدم بمكة فإنه كان يقدمها ضحى فيطوف بالبيت ثم يصلي ركعتين خلف المقام ويوم يأتي مسجد قباء فإنه كان يأتيه كل سبت فإذا دخل المسجد كره أن يخرج منه حتى يصلي فيه قال وكان يحدث أن رسول الله صلى الله عليه وسلم كان يزوره راكبا وماشيا قال وكان يقول إنما أصنع كما رأيت أصحابي يصنعون ولا أمنع أحدا أن يصلي في أى ساعة شاء من ليل أو نهار غير أن لا تتحروا طلوع الشمس ولا غروبها 	 حدثنا يعقوب بن إبراهيم هو الدورقي حدثنا ابن علية أخبرنا أيوب عن نافع أن ابن عمر رضى الله عنهما كان لا يصلي من الضحى إلا في يومين يوم يقدم بمكة فإنه كان يقدمها ضحى فيطوف بالبيت ثم يصلي ركعتين خلف المقام ويوم يأتي مسجد قباء فإنه كان يأتيه كل سبت فإذا دخل المسجد كره أن يخرج منه حتى يصلي فيه قال وكان يحدث أن رسول الله صلى الله عليه وسلم كان يزوره راكبا وماشيا قال وكان يقول إنما أصنع كما رأيت أصحابي يصنعون ولا أمنع أحدا أن يصلي في أى ساعة شاء من ليل أو نهار غير أن لا تتحروا طلوع الشمس ولا غروبها 	" Narrated Nafi`: Ibn `Umar never offered the Duha prayer except on two occasions: (1) Whenever he reached Mecca; and he always used to reach Mecca in the forenoon. He would perform Tawaf round the Ka`ba and then offer two rak`at at the rear of Maqam Ibrahim. (2) Whenever he visited Quba, for he used to visit it every Saturday. When he entered the Mosque, he disliked to leave it without offering a prayer. Ibn `Umar narrated that Allah's Messenger (SL3M) used to visit the Mosque of Quba (sometime) walking and (sometime) riding. And he (i.e. Ibn `Umar) used to say, ""I do only what my companions used to do and I don't forbid anybody to pray at any time during the day or night except that one should not intend to pray at sunrise or sunset."" "
bukhari20_110800	 حدثنا موسى بن إسماعيل حدثنا عبد العزيز بن مسلم عن عبد الله بن دينار عن	عن ابن عمر رضى الله عنهما قال كان النبي صلى الله عليه وسلم يأتي مسجد قباء كل سبت ماشيا وراكبا وكان عبد الله رضى الله عنهما يفعله 	 حدثنا موسى بن إسماعيل حدثنا عبد العزيز بن مسلم عن عبد الله بن دينار عن ابن عمر رضى الله عنهما قال كان النبي صلى الله عليه وسلم يأتي مسجد قباء كل سبت ماشيا وراكبا وكان عبد الله رضى الله عنهما يفعله 	" Narrated `Abdullah bin Dinar: Ibn `Umar said, ""The Prophet (SL3M) used to go to the Mosque of Quba every Saturday (sometimes) walking and (sometimes) riding."" `Abdullah (Ibn `Umar) used to do the same. "
bukhari20_110810	 حدثنا مسدد حدثنا يحيى عن عبيد الله قال حدثني نافع عن	حدثني ابن عمر رضى الله عنهما قال كان النبي صلى الله عليه وسلم يأتي قباء راكبا وماشيا زاد ابن نمير حدثنا عبيد الله عن نافع فيصلي فيه ركعتين 	 حدثنا مسدد حدثنا يحيى عن عبيد الله قال حدثني نافع عن ابن عمر رضى الله عنهما قال كان النبي صلى الله عليه وسلم يأتي قباء راكبا وماشيا زاد ابن نمير حدثنا عبيد الله عن نافع فيصلي فيه ركعتين 	" Narrated Ibn `Umar: The Prophet (SL3M) used to go to the Mosque of Quba (sometimes) walking and sometimes riding. Added Nafi` (in another narration), ""He then would offer two rak`at (in the Mosque of Quba)."" "
bukhari20_110820	 حدثنا عبد الله بن يوسف أخبرنا مالك عن عبد الله بن أبي بكر عن عباد بن	عن تميم عن عبد الله بن زيد المازني رضى الله عنه أن رسول الله صلى الله عليه وسلم قال ما بين بيتي ومنبري روضة من رياض الجنة 	 حدثنا عبد الله بن يوسف أخبرنا مالك عن عبد الله بن أبي بكر عن عباد بن تميم عن عبد الله بن زيد المازني رضى الله عنه أن رسول الله صلى الله عليه وسلم قال ما بين بيتي ومنبري روضة من رياض الجنة 	" Narrated `Abdullah bin Zaid Al-Mazini: Allah's Messenger (SL3M) said, ""Between my house and the pulpit there is a garden of the gardens of Paradise."" "
bukhari20_110830	 حدثنا مسدد عن يحيى عن عبيد الله قال حدثني خبيب بن عبد الرحمن عن حفص بن عاصم عن أبي هريرة رضى الله عنه عن	عن النبي صلى الله عليه وسلم قال ما بين بيتي ومنبري روضة من رياض الجنة ومنبري على حوضي 	 حدثنا مسدد عن يحيى عن عبيد الله قال حدثني خبيب بن عبد الرحمن عن حفص بن عاصم عن أبي هريرة رضى الله عنه عن النبي صلى الله عليه وسلم قال ما بين بيتي ومنبري روضة من رياض الجنة ومنبري على حوضي 	" Narrated Abu Huraira: The Prophet (SL3M) said, ""Between my house and my pulpit there is a garden of the gardens of Paradise, and my pulpit is on my fountain tank (i.e. Al-Kauthar)."" "
bukhari20_110840	 حدثنا أبو الوليد حدثنا شعبة عن	حدثنا عبد الملك سمعت قزعة مولى زياد قال سمعت أبا سعيد الخدري رضى الله عنه يحدث بأربع عن النبي صلى الله عليه وسلم فأعجبنني وآنقنني قال لا تسافر المرأة يومين إلا معها زوجها أو ذو محرم ولا صوم في يومين الفطر والأضحى ولا صلاة بعد صلاتين بعد الصبح حتى تطلع الشمس وبعد العصر حتى تغرب ولا تشد الرحال إلا إلى ثلاثة مساجد مسجد الحرام ومسجد الأقصى ومسجدي 	 حدثنا أبو الوليد حدثنا شعبة عن عبد الملك سمعت قزعة مولى زياد قال سمعت أبا سعيد الخدري رضى الله عنه يحدث بأربع عن النبي صلى الله عليه وسلم فأعجبنني وآنقنني قال لا تسافر المرأة يومين إلا معها زوجها أو ذو محرم ولا صوم في يومين الفطر والأضحى ولا صلاة بعد صلاتين بعد الصبح حتى تطلع الشمس وبعد العصر حتى تغرب ولا تشد الرحال إلا إلى ثلاثة مساجد مسجد الحرام ومسجد الأقصى ومسجدي 	" Narrated Qaza'a Maula: (freed slave of) Ziyad: I heard Abu Sa`id Al-khudri narrating four things from the Prophet (SL3M) and I appreciated them very much. He said, conveying the words of the Prophet. (1) ""A woman should not go on a two day journey except with her husband or a Dhi-Mahram. (2) No fasting is permissible on two days: `Id-ul-Fitr and `Id-ul-Adha. (3) No prayer after two prayers, i.e. after the Fajr prayer till the sunrises and after the `Asr prayer till the sun sets. (4) Do not prepare yourself for a journey except to three Mosques, i.e. Al-Masjid-AI-Haram, the Mosque of Aqsa (Jerusalem) and my Mosque."" "
