bukhari55_126790	 حدثنا عبد الله بن يوسف أخبرنا مالك عن إسحاق بن	حدثنا عبد الله بن أبي طلحة أنه سمع أنسا رضى الله عنه قال قال النبي صلى الله عليه وسلم لأبي طلحة أرى أن تجعلها في الأقربين قال أبو طلحة أفعل يا رسول الله فقسمها أبو طلحة في أقاربه وبني عمه وقال ابن عباس لما نزلت {وأنذر عشيرتك الأقربين} جعل النبي صلى الله عليه وسلم ينادي يا بني فهر يا بني عدي لبطون قريش وقال أبو هريرة لما نزلت {وأنذر عشيرتك الأقربين} قال النبي صلى الله عليه وسلم يا معشر قريش 	 حدثنا عبد الله بن يوسف أخبرنا مالك عن إسحاق بن عبد الله بن أبي طلحة أنه سمع أنسا رضى الله عنه قال قال النبي صلى الله عليه وسلم لأبي طلحة أرى أن تجعلها في الأقربين قال أبو طلحة أفعل يا رسول الله فقسمها أبو طلحة في أقاربه وبني عمه وقال ابن عباس لما نزلت {وأنذر عشيرتك الأقربين} جعل النبي صلى الله عليه وسلم ينادي يا بني فهر يا بني عدي لبطون قريش وقال أبو هريرة لما نزلت {وأنذر عشيرتك الأقربين} قال النبي صلى الله عليه وسلم يا معشر قريش 	" Narrated Anas: The Prophet (SL3M) said to Abu Talha, ""I recommend that you divide (this garden) amongst your relatives."" Abu Talha said, ""O Allah's Messenger (SL3M)! I will do the same."" So Abu Talha divided it among his relatives and cousins. Ibn 'Abbes said, ""When the Qur'anic Verse: ""Warn your nearest kinsmen."" (26.214) Was revealed, the Prophet (SL3M) started calling the various big families of Quraish, ""O Bani Fihr! O Bani Adi!"". Abu Huraira said, ""When the Verse: ""Warn your nearest kinsmen"" was revealed, the Prophet (SL3M) said (in a loud voice), ""O people of Quraish!"" "
bukhari55_126800	 حدثنا أبو اليمان أخبرنا شعيب عن الزهري قال أخبرني سعيد بن المسيب وأبو سلمة بن	عن عبد الرحمن أن أبا هريرة رضى الله عنه قال قام رسول الله صلى الله عليه وسلم حين أنزل الله عز وجل {وأنذر عشيرتك الأقربين } قال يا معشر قريش أو كلمة نحوها اشتروا أنفسكم لا أغني عنكم من الله شيئا يا بني عبد مناف لا أغني عنكم من الله شيئا يا عباس بن عبد المطلب لا أغني عنك من الله شيئا ويا صفية عمة رسول الله لا أغني عنك من الله شيئا ويا فاطمة بنت محمد سليني ما شئت من مالي لا أغني عنك من الله شيئا تابعه أصبغ عن ابن وهب عن يونس عن ابن شهاب 	 حدثنا أبو اليمان أخبرنا شعيب عن الزهري قال أخبرني سعيد بن المسيب وأبو سلمة بن عبد الرحمن أن أبا هريرة رضى الله عنه قال قام رسول الله صلى الله عليه وسلم حين أنزل الله عز وجل {وأنذر عشيرتك الأقربين } قال يا معشر قريش أو كلمة نحوها اشتروا أنفسكم لا أغني عنكم من الله شيئا يا بني عبد مناف لا أغني عنكم من الله شيئا يا عباس بن عبد المطلب لا أغني عنك من الله شيئا ويا صفية عمة رسول الله لا أغني عنك من الله شيئا ويا فاطمة بنت محمد سليني ما شئت من مالي لا أغني عنك من الله شيئا تابعه أصبغ عن ابن وهب عن يونس عن ابن شهاب 	" Narrated Abu Huraira: When Allah revealed the Verse: ""Warn your nearest kinsmen,"" Allah's Messenger (SL3M) got up and said, ""O people of Quraish (or said similar words)! Buy (i.e. save) yourselves (from the Hellfire) as I cannot save you from Allah's Punishment; O Bani `Abd Manaf! I cannot save you from Allah's Punishment, O Safiya, the Aunt of Allah's Messenger (SL3M)! I cannot save you from Allah's Punishment; O Fatima bint Muhammad! Ask me anything from my wealth, but I cannot save you from Allah's Punishment."" "
bukhari55_126810	 حدثنا قتيبة بن سعيد حدثنا أبو عوانة عن قتادة عن	حدثنا أنس رضى الله عنه أن النبي صلى الله عليه وسلم رأى رجلا يسوق بدنة فقال له اركبها فقال يا رسول الله إنها بدنة قال في الثالثة أو الرابعة اركبها ويلك أو ويحك 	 حدثنا قتيبة بن سعيد حدثنا أبو عوانة عن قتادة عن أنس رضى الله عنه أن النبي صلى الله عليه وسلم رأى رجلا يسوق بدنة فقال له اركبها فقال يا رسول الله إنها بدنة قال في الثالثة أو الرابعة اركبها ويلك أو ويحك 	" Narrated Anas: The Prophet (SL3M) saw a man driving a Badana (i.e. camel for sacrifice) and said to him, ""Ride on it."" The man said, ""O Allah's Messenger (SL3M)! It is a Bandana."" (The Prophet (SL3M) repeated his order) and on the third or fourth time he said, ""Ride it, (woe to you"" or said: ""May Allah be merciful to you). "
bukhari55_126820	 حدثنا إسماعيل حدثنا مالك عن أبي الزناد عن الأعرج عن	حدثنا أبي هريرة رضى الله عنه أن رسول الله صلى الله عليه وسلم رأى رجلا يسوق بدنة فقال اركبها قال يا رسول الله إنها بدنة قال اركبها ويلك في الثانية أو في الثالثة 	 حدثنا إسماعيل حدثنا مالك عن أبي الزناد عن الأعرج عن أبي هريرة رضى الله عنه أن رسول الله صلى الله عليه وسلم رأى رجلا يسوق بدنة فقال اركبها قال يا رسول الله إنها بدنة قال اركبها ويلك في الثانية أو في الثالثة 	" Narrated Abu Huraira: Allah's Messenger (SL3M) saw a man driving a Badana and said to him, ""Ride on it,"" and on the second or the third time he added, ""Woe to you."" "
bukhari55_126830	 حدثنا محمد أخبرنا مخلد بن يزيد أخبرنا	حدثنا ابن جريج قال أخبرني يعلى أنه سمع عكرمة يقول أنبأنا ابن عباس رضى الله عنهما أن سعد بن عبادة رضى الله عنه توفيت أمه وهو غائب عنها فقال يا رسول الله إن أمي توفيت وأنا غائب عنها أينفعها شىء إن تصدقت به عنها قال نعم قال فإني أشهدك أن حائطي المخراف صدقة عليها 	 حدثنا محمد أخبرنا مخلد بن يزيد أخبرنا ابن جريج قال أخبرني يعلى أنه سمع عكرمة يقول أنبأنا ابن عباس رضى الله عنهما أن سعد بن عبادة رضى الله عنه توفيت أمه وهو غائب عنها فقال يا رسول الله إن أمي توفيت وأنا غائب عنها أينفعها شىء إن تصدقت به عنها قال نعم قال فإني أشهدك أن حائطي المخراف صدقة عليها 	" Narrated Ibn `Abbas: The mother of Sa`d bin 'Ubada died in his absence. He said, ""O Allah's Messenger (SL3M)! My mother died in my absence; will it be of any benefit for her if I give Sadaqa on her behalf?"" The Prophet (SL3M) said, ""Yes,"" Sa`d said, ""I make you a witness that I gave my garden called Al Makhraf in charity on her behalf."" "
bukhari55_126840	 حدثنا يحيى بن بكير حدثنا الليث عن عقيل عن ابن شهاب قال أخبرني عبد الرحمن بن	عن عبد الله بن كعب أن عبد الله بن كعب قال سمعت كعب بن مالك رضى الله عنه قلت يا رسول الله إن من توبتي أن أنخلع من مالي صدقة إلى الله وإلى رسوله صلى الله عليه وسلم قال أمسك عليك بعض مالك فهو خير لك قلت فإني أمسك سهمي الذي بخيبر 	 حدثنا يحيى بن بكير حدثنا الليث عن عقيل عن ابن شهاب قال أخبرني عبد الرحمن بن عبد الله بن كعب أن عبد الله بن كعب قال سمعت كعب بن مالك رضى الله عنه قلت يا رسول الله إن من توبتي أن أنخلع من مالي صدقة إلى الله وإلى رسوله صلى الله عليه وسلم قال أمسك عليك بعض مالك فهو خير لك قلت فإني أمسك سهمي الذي بخيبر 	" Narrated Ka`b bin Malik: I said, ""O Allah's Messenger (SL3M)! For the acceptance of my repentance I wish to give all my property in charity for Allah's sake through His Apostle ."" He said, ""It is better for you to keep some of the property for yourself."" I said, ""Then I will keep my share in Khaibar."" "
bukhari55_126850	not identified	 وقال إسماعيل أخبرني عبد العزيز بن عبد الله بن أبي سلمة عن إسحاق بن عبد الله بن أبي طلحة لا أعلمه إلا عن أنس رضى الله عنه قال لما نزلت {لن تنالوا البر حتى تنفقوا مما تحبون} جاء أبو طلحة إلى رسول الله صلى الله عليه وسلم فقال يا رسول الله يقول الله تبارك وتعالى في كتابه {لن تنالوا البر حتى تنفقوا مما تحبون} وإن أحب أموالي إلى بيرحاء قال وكانت حديقة كان رسول الله صلى الله عليه وسلم يدخلها ويستظل بها ويشرب من مائها فهي إلى الله عز وجل وإلى رسوله صلى الله عليه وسلم أرجو بره وذخره فضعها أى رسول الله حيث أراك الله فقال رسول الله صلى الله عليه وسلم بخ يا أبا طلحة ذلك مال رابح قبلناه منك ورددناه عليك فاجعله في الأقربين فتصدق به أبو طلحة على ذوي رحمه قال وكان منهم أبى وحسان قال وباع حسان حصته منه من معاوية فقيل له تبيع صدقة أبي طلحة فقال ألا أبيع صاعا من تمر بصاع من دراهم قال وكانت تلك الحديقة في موضع قصر بني حديلة الذي بناه معاوية 	 وقال إسماعيل أخبرني عبد العزيز بن عبد الله بن أبي سلمة عن إسحاق بن عبد الله بن أبي طلحة لا أعلمه إلا عن أنس رضى الله عنه قال لما نزلت {لن تنالوا البر حتى تنفقوا مما تحبون} جاء أبو طلحة إلى رسول الله صلى الله عليه وسلم فقال يا رسول الله يقول الله تبارك وتعالى في كتابه {لن تنالوا البر حتى تنفقوا مما تحبون} وإن أحب أموالي إلى بيرحاء قال وكانت حديقة كان رسول الله صلى الله عليه وسلم يدخلها ويستظل بها ويشرب من مائها فهي إلى الله عز وجل وإلى رسوله صلى الله عليه وسلم أرجو بره وذخره فضعها أى رسول الله حيث أراك الله فقال رسول الله صلى الله عليه وسلم بخ يا أبا طلحة ذلك مال رابح قبلناه منك ورددناه عليك فاجعله في الأقربين فتصدق به أبو طلحة على ذوي رحمه قال وكان منهم أبى وحسان قال وباع حسان حصته منه من معاوية فقيل له تبيع صدقة أبي طلحة فقال ألا أبيع صاعا من تمر بصاع من دراهم قال وكانت تلك الحديقة في موضع قصر بني حديلة الذي بناه معاوية 	" Narrated Anas (ra): When the Holy Verse: 'By no means shall you attain Al-Birr (piety, righteousness, it means here Allah's Reward i.e., Paradise), unless you spend of that which you love..', (V 3:92) was revealed, Abu Talha went to Allah's Messenger (SL3M) and said, ""O Allah's Messenger ! Allah, the Blessed, the Superior stated in His book: 'By no means shall you attain Birr, unless you spend of that which you love....' (V 3:92) and the most beloved property to me is Bairuha' (which was a garden where Allah's Messenger (SL3M) used to go to sit in its shade and drink from its water). I gave it to the Allah and His Messenger (SL3M) hoping for Allah's Reward in the Hereafter. So, Ao Allah's Messenger ! Use it as Allah orders you to use it."" Allah's Messenger (SL3M) said, ""Bravo! O Abu Talha, it is fruitful property. We have accepted it from you and now we return it to you. Distribute it amongst you relatives."" So, Abu Talha distributed it amongst his relatives, amongst whom were Ubai and Hassan. When Hassan sold his share of that garden to Mu'awiyya, he was asked, ""How do you see Abu Talha's Sadaqa?"" He replied, ""Who should not I sell a Sa' of date for Sa' of money ?"" The garden was situated on the courtyard of the palace of Bani Jadila built by Mu'awiya. "
bukhari55_126860	 حدثنا محمد بن الفضل أبو النعمان حدثنا أبو عوانة عن أبي بشر عن سعيد بن جبير عن	عن ابن عباس رضى الله عنهما قال إن ناسا يزعمون أن هذه الآية نسخت ولا والله ما نسخت ولكنها مما تهاون الناس هما واليان وال يرث وذاك الذي يرزق ووال لا يرث فذاك الذي يقول بالمعروف يقول لا أملك لك أن أعطيك 	 حدثنا محمد بن الفضل أبو النعمان حدثنا أبو عوانة عن أبي بشر عن سعيد بن جبير عن ابن عباس رضى الله عنهما قال إن ناسا يزعمون أن هذه الآية نسخت ولا والله ما نسخت ولكنها مما تهاون الناس هما واليان وال يرث وذاك الذي يرزق ووال لا يرث فذاك الذي يقول بالمعروف يقول لا أملك لك أن أعطيك 	" Narrated Ibn `Abbas: Some people claim that the order in the above Verse is cancelled, by Allah, it is not cancelled, but the people have stopped acting on it. There are two kinds of guardians (who are in charge of the inheritance): One is that who inherits; such a person should give (of what he inherits to the relatives, the orphans and the needy, etc.), the other is that who does not inherit (e.g. the guardian of the orphans): such a person should speak kindly and say (to those who are present at the time of distribution), ""I can not give it to you (as the wealth belongs to the orphans). "
bukhari55_126870	 حدثنا إسماعيل قال حدثني مالك عن هشام عن أبيه عن	حدثنا عائشة رضى الله عنها أن رجلا قال للنبي صلى الله عليه وسلم إن أمي افتلتت نفسها وأراها لو تكلمت تصدقت أفأتصدق عنها قال نعم تصدق عنها 	 حدثنا إسماعيل قال حدثني مالك عن هشام عن أبيه عن عائشة رضى الله عنها أن رجلا قال للنبي صلى الله عليه وسلم إن أمي افتلتت نفسها وأراها لو تكلمت تصدقت أفأتصدق عنها قال نعم تصدق عنها 	" Narrated `Aisha: A man said to the Prophet, ""My mother died suddenly, and I think that if she could speak, she would have given in charity. May I give in charity on her behalf?"" He said, ""Yes! Give in charity on her behalf."" "
bukhari55_126880	 حدثنا عبد الله بن يوسف أخبرنا مالك عن ابن شهاب عن عبيد الله بن عبد الله عن ابن عباس رضى الله عنهما أن سعد بن	عن عبادة رضى الله عنه استفتى رسول الله صلى الله عليه وسلم فقال إن أمي ماتت وعليها نذر فقال اقضه عنها 	 حدثنا عبد الله بن يوسف أخبرنا مالك عن ابن شهاب عن عبيد الله بن عبد الله عن ابن عباس رضى الله عنهما أن سعد بن عبادة رضى الله عنه استفتى رسول الله صلى الله عليه وسلم فقال إن أمي ماتت وعليها نذر فقال اقضه عنها 	" Narrated Ibn `Abbas: Sa`d bin Ubada consulted Allah's Messenger (SL3M) saying, ""My mother died and she had an unfulfilled vow."" The Prophet (SL3M) said, ""Fulfill it on her behalf."" "
bukhari55_126890	 حدثنا إبراهيم بن موسى أخبرنا هشام بن	حدثنا يوسف أن ابن جريج أخبرهم قال أخبرني يعلى أنه سمع عكرمة مولى ابن عباس يقول أنبأنا ابن عباس أن سعد بن عبادة رضى الله عنهم أخا بني ساعدة توفيت أمه وهو غائب فأتى النبي صلى الله عليه وسلم فقال يا رسول الله إن أمي توفيت وأنا غائب عنها فهل ينفعها شىء إن تصدقت به عنها قال نعم قال فإني أشهدك أن حائطي المخراف صدقة عليها 	 حدثنا إبراهيم بن موسى أخبرنا هشام بن يوسف أن ابن جريج أخبرهم قال أخبرني يعلى أنه سمع عكرمة مولى ابن عباس يقول أنبأنا ابن عباس أن سعد بن عبادة رضى الله عنهم أخا بني ساعدة توفيت أمه وهو غائب فأتى النبي صلى الله عليه وسلم فقال يا رسول الله إن أمي توفيت وأنا غائب عنها فهل ينفعها شىء إن تصدقت به عنها قال نعم قال فإني أشهدك أن حائطي المخراف صدقة عليها 	" Narrated Ibn `Abbas: That the mother of Sa`d bin Ubada the brother of Bani Saida died in Sa`d's absence, so he came to the Prophet saying, ""O Allah's Messenger (SL3M)! My mother died in my absence, will it benefit her if I give in charity on her behalf?"" The Prophet (SL3M) said, ""Yes."" Sa`d said, ""I take you as my witness that I give my garden Al-Makhraf in charity on her behalf."" "
bukhari55_126900	 حدثنا أبو اليمان أخبرنا شعيب عن الزهري قال كان عروة بن	عن الزبير يحدث أنه سأل عائشة رضى الله عنها – {وإن خفتم أن لا تقسطوا في اليتامى فانكحوا ما طاب لكم من النساء} قالت هي اليتيمة في حجر وليها فيرغب في جمالها ومالها ويريد أن يتزوجها بأدنى من سنة نسائها فنهوا عن نكاحهن إلا أن يقسطوا لهن في إكمال الصداق وأمروا بنكاح من سواهن من النساء قالت عائشة ثم استفتى الناس رسول الله صلى الله عليه وسلم بعد فأنزل الله عز وجل {ويستفتونك في النساء قل الله يفتيكم فيهن} قالت فبين الله في هذه أن اليتيمة إذا كانت ذات جمال ومال رغبوا في نكاحها ولم يلحقوها بسنتها بإكمال الصداق فإذا كانت مرغوبة عنها في قلة المال والجمال تركوها والتمسوا غيرها من النساء قال فكما يتركونها حين يرغبون عنها فليس لهم أن ينكحوها إذا رغبوا فيها إلا أن يقسطوا لها الأوفى من الصداق ويعطوها حقها 	 حدثنا أبو اليمان أخبرنا شعيب عن الزهري قال كان عروة بن الزبير يحدث أنه سأل عائشة رضى الله عنها – {وإن خفتم أن لا تقسطوا في اليتامى فانكحوا ما طاب لكم من النساء} قالت هي اليتيمة في حجر وليها فيرغب في جمالها ومالها ويريد أن يتزوجها بأدنى من سنة نسائها فنهوا عن نكاحهن إلا أن يقسطوا لهن في إكمال الصداق وأمروا بنكاح من سواهن من النساء قالت عائشة ثم استفتى الناس رسول الله صلى الله عليه وسلم بعد فأنزل الله عز وجل {ويستفتونك في النساء قل الله يفتيكم فيهن} قالت فبين الله في هذه أن اليتيمة إذا كانت ذات جمال ومال رغبوا في نكاحها ولم يلحقوها بسنتها بإكمال الصداق فإذا كانت مرغوبة عنها في قلة المال والجمال تركوها والتمسوا غيرها من النساء قال فكما يتركونها حين يرغبون عنها فليس لهم أن ينكحوها إذا رغبوا فيها إلا أن يقسطوا لها الأوفى من الصداق ويعطوها حقها 	" Narrated Az-Zuhri: `Urwa bin Az-Zubair said that he asked `Aisha about the meaning of the Qur'anic Verse:-- ""And if you fear that you will not deal fairly with the orphan girls then marry (other) women of your choice."" (4.2-3) Aisha said, ""It is about a female orphan under the guardianship of her guardian who is inclined towards her because of her beauty and wealth, and likes to marry her with a Mahr less than what is given to women of her standard. So they (i.e. guardians) were forbidden to marry the orphans unless they paid them a full appropriate Mahr (otherwise) they were ordered to marry other women instead of them. Later on the people asked Allah's Messenger (SL3M) about it. So Allah revealed the following Verse:-- ""They ask your instruction (O Muhammad!) regarding women. Say: Allah instructs you regarding them..."" (4.127) and in this Verse Allah indicated that if the orphan girl was beautiful and wealthy, her guardian would have the desire to marry her without giving her an appropriate Mahr equal to what her peers could get, but if she was undesirable for lack of beauty or wealth, then he would not marry her, but seek to marry some other woman instead of her. So, since he did not marry her when he had no inclination towards her, he had not the right to marry her when he had an interest in her, unless he treated her justly by giving her a full Mahr and securing all her rights. "
bukhari55_126910	 حدثنا هارون حدثنا أبو سعيد مولى بني هاشم حدثنا صخر بن جويرية عن نافع عن	حدثنا ابن عمر رضى الله عنهما أن عمر تصدق بمال له على عهد رسول الله صلى الله عليه وسلم وكان يقال له ثمغ وكان نخلا فقال عمر يا رسول الله إني استفدت مالا وهو عندي نفيس فأردت أن أتصدق به فقال النبي صلى الله عليه وسلم تصدق بأصله لا يباع ولا يوهب ولا يورث ولكن ينفق ثمره فتصدق به عمر فصدقته ذلك في سبيل الله وفي الرقاب والمساكين والضيف وابن السبيل ولذي القربى ولا جناح على من وليه أن يأكل منه بالمعروف أو يوكل صديقه غير متمول به 	 حدثنا هارون حدثنا أبو سعيد مولى بني هاشم حدثنا صخر بن جويرية عن نافع عن ابن عمر رضى الله عنهما أن عمر تصدق بمال له على عهد رسول الله صلى الله عليه وسلم وكان يقال له ثمغ وكان نخلا فقال عمر يا رسول الله إني استفدت مالا وهو عندي نفيس فأردت أن أتصدق به فقال النبي صلى الله عليه وسلم تصدق بأصله لا يباع ولا يوهب ولا يورث ولكن ينفق ثمره فتصدق به عمر فصدقته ذلك في سبيل الله وفي الرقاب والمساكين والضيف وابن السبيل ولذي القربى ولا جناح على من وليه أن يأكل منه بالمعروف أو يوكل صديقه غير متمول به 	" Narrated Ibn `Umar: In the lifetime of Allah's Messenger (SL3M) , `Umar gave in charity some of his property, a garden of date-palms called Thamgh. `Umar said, ""O Allah's Messenger (SL3M)! I have some property which I prize highly and I want to give it in charity."" The Prophet; said, ""Give it in charity (i.e. as an endowment) with its land and trees on the condition that the land and trees will neither be sold nor given as a present, nor bequeathed, but the fruits are to be spent in charity."" So `Umar gave it in charity, and it was for Allah's Cause, the emancipation of slaves, for the poor, for guests, for travelers, and for kinsmen. The person acting as its administrator could eat from it reasonably and fairly, and could let a friend of his eat from it provided he had no intention of becoming wealthy by its means. "
