bukhari58_128950	 حدثنا محمد بن كثير أخبرنا سفيان عن الأعمش عن إبراهيم التيمي عن أبيه عن علي رضى الله عنه قال ما كتبنا عن	عن النبي صلى الله عليه وسلم إلا القرآن وما في هذه الصحيفة قال النبي صلى الله عليه وسلم المدينة حرام ما بين عائر إلى كذا فمن أحدث حدثا أو آوى محدثا فعليه لعنة الله والملائكة والناس أجمعين لا يقبل منه عدل ولا صرف وذمة المسلمين واحدة يسعى بها أدناهم فمن أخفر مسلما فعليه لعنة الله والملائكة والناس أجمعين لا يقبل منه صرف ولا عدل ومن والى قوما بغير إذن مواليه فعليه لعنة الله والملائكة والناس أجمعين لا يقبل منه صرف ولا عدل 	 حدثنا محمد بن كثير أخبرنا سفيان عن الأعمش عن إبراهيم التيمي عن أبيه عن علي رضى الله عنه قال ما كتبنا عن النبي صلى الله عليه وسلم إلا القرآن وما في هذه الصحيفة قال النبي صلى الله عليه وسلم المدينة حرام ما بين عائر إلى كذا فمن أحدث حدثا أو آوى محدثا فعليه لعنة الله والملائكة والناس أجمعين لا يقبل منه عدل ولا صرف وذمة المسلمين واحدة يسعى بها أدناهم فمن أخفر مسلما فعليه لعنة الله والملائكة والناس أجمعين لا يقبل منه صرف ولا عدل ومن والى قوما بغير إذن مواليه فعليه لعنة الله والملائكة والناس أجمعين لا يقبل منه صرف ولا عدل 	" Narrated `Ali: We did not, write anything from the Prophet (SL3M) except the Qur'an and what is written in this paper, (wherein) the Prophet (SL3M) said, ""Medina is a sanctuary from (the mountain of) Air to so and-so, therefore, whoever innovates (in it) an heresy or commits a sin, or gives shelter to such an innovator, will incur the Curse of Allah. the angels and all the people; and none of his compulsory or optional good deeds of worship will be accepted And the asylum granted by any Muslim Is to be secured by all the Muslims even if it is granted by one of the lowest social status among them. And whoever betrays a Muslim in this respect will incur the Curse of Allah, the angels and all the people, and his compulsory and optional good deeds of worship will not be accepted. And any freed slave will take as masters (befriends) people other than his own real masters who freed him without taking the permission of the latter, will incur the Curse of Allah, the angels and all the people, and his compulsory and optional good deeds of worship will not be accepted."" "
bukhari58_128960	not identified	 قال أبو موسى حدثنا هاشم بن القاسم حدثنا إسحاق بن سعيد عن أبيه عن أبي هريرة رضى الله عنه قال كيف أنتم إذا لم تجتبوا دينارا ولا درهما فقيل له وكيف ترى ذلك كائنا يا أبا هريرة قال إي والذي نفس أبي هريرة بيده عن قول الصادق المصدوق قالوا عم ذاك قال تنتهك ذمة الله وذمة رسوله صلى الله عليه وسلم فيشد الله عز وجل قلوب أهل الذمة فيمنعون ما في أيديهم 	 قال أبو موسى حدثنا هاشم بن القاسم حدثنا إسحاق بن سعيد عن أبيه عن أبي هريرة رضى الله عنه قال كيف أنتم إذا لم تجتبوا دينارا ولا درهما فقيل له وكيف ترى ذلك كائنا يا أبا هريرة قال إي والذي نفس أبي هريرة بيده عن قول الصادق المصدوق قالوا عم ذاك قال تنتهك ذمة الله وذمة رسوله صلى الله عليه وسلم فيشد الله عز وجل قلوب أهل الذمة فيمنعون ما في أيديهم 	" Narrated Sa`id: Abu Huraira once said (to the people), ""What will your state be when you can get no Dinar or Dirhan (i.e. taxes from the Dhimmis)?"" on that someone asked him, ""What makes you know that this state will take place, O Abu- Hu raira?"" He said, ""By Him in Whose Hands Abu Huraira's life is, I know it through the statement of the true and truly inspired one (i.e. the Prophet)."" The people asked, ""What does the Statement say?"" He replied, ""Allah and His Apostle's asylum granted to Dhimmis, i.e. non-Muslims living in a Muslim territory) will be outraged, and so Allah will make the hearts of these Dhimmis so daring that they will refuse to pay the Jizya they will be supposed to pay."" "
bukhari58_128970	 حدثنا عبدان أخبرنا	حدثنا أبو حمزة قال سمعت الأعمش قال سألت أبا وائل شهدت صفين قال نعم فسمعت سهل بن حنيف يقول اتهموا رأيكم رأيتني يوم أبي جندل ولو أستطيع أن أرد أمر النبي صلى الله عليه وسلم لرددته وما وضعنا أسيافنا على عواتقنا لأمر يفظعنا إلا أسهلن بنا إلى أمر نعرفه غير أمرنا هذا 	 حدثنا عبدان أخبرنا أبو حمزة قال سمعت الأعمش قال سألت أبا وائل شهدت صفين قال نعم فسمعت سهل بن حنيف يقول اتهموا رأيكم رأيتني يوم أبي جندل ولو أستطيع أن أرد أمر النبي صلى الله عليه وسلم لرددته وما وضعنا أسيافنا على عواتقنا لأمر يفظعنا إلا أسهلن بنا إلى أمر نعرفه غير أمرنا هذا 	" Narrated Al-A`mash: I asked Abu Wail, ""Did you take part in the battle of Siffin?"" He said, 'Yes, and I heard Sahl bin Hunaif (when he was blamed for lack of zeal for fighting) saying, ""You'd better blame your wrong opinions. I wish you had seen me on the day of Abu Jandal. If I had the courage to disobey the Prophet's orders, I would have done so. We had kept out swords on our necks and shoulders, for a thing which frightened us. And we did so, we found it easier for us, except in the case of the above battle (of ours).' "" "
bukhari58_128980	 حدثنا عبد الله بن محمد حدثنا يحيى بن آدم حدثنا يزيد بن عبد العزيز عن أبيه حدثنا حبيب بن	حدثنا أبي ثابت قال حدثني أبو وائل قال كنا بصفين فقام سهل بن حنيف فقال أيها الناس اتهموا أنفسكم فإنا كنا مع رسول الله صلى الله عليه وسلم يوم الحديبية ولو نرى قتالا لقاتلنا فجاء عمر بن الخطاب فقال يا رسول الله ألسنا على الحق وهم على الباطل فقال بلى فقال أليس قتلانا في الجنة وقتلاهم في النار قال بلى قال فعلى ما نعطي الدنية في ديننا أنرجع ولما يحكم الله بيننا وبينهم فقال ابن الخطاب إني رسول الله ولن يضيعني الله أبدا فانطلق عمر إلى أبي بكر فقال له مثل ما قال للنبي صلى الله عليه وسلم فقال إنه رسول الله ولن يضيعه الله أبدا فنزلت سورة الفتح فقرأها رسول الله صلى الله عليه وسلم على عمر إلى آخرها فقال عمر يا رسول الله أوفتح هو قال نعم 	 حدثنا عبد الله بن محمد حدثنا يحيى بن آدم حدثنا يزيد بن عبد العزيز عن أبيه حدثنا حبيب بن أبي ثابت قال حدثني أبو وائل قال كنا بصفين فقام سهل بن حنيف فقال أيها الناس اتهموا أنفسكم فإنا كنا مع رسول الله صلى الله عليه وسلم يوم الحديبية ولو نرى قتالا لقاتلنا فجاء عمر بن الخطاب فقال يا رسول الله ألسنا على الحق وهم على الباطل فقال بلى فقال أليس قتلانا في الجنة وقتلاهم في النار قال بلى قال فعلى ما نعطي الدنية في ديننا أنرجع ولما يحكم الله بيننا وبينهم فقال ابن الخطاب إني رسول الله ولن يضيعني الله أبدا فانطلق عمر إلى أبي بكر فقال له مثل ما قال للنبي صلى الله عليه وسلم فقال إنه رسول الله ولن يضيعه الله أبدا فنزلت سورة الفتح فقرأها رسول الله صلى الله عليه وسلم على عمر إلى آخرها فقال عمر يا رسول الله أوفتح هو قال نعم 	" Narrated Abu Wail: We were in Siffin and Sahl bin Hunaif got up and said, ""O people! Blame yourselves! We were with the Prophet (SL3M) on the day of Hudaibiya, and if we had been called to fight, we would have fought. But `Umar bin Al Khatab came and said, 'O Allah's Messenger (SL3M)! Aren't we in the right and our opponents in the wrongs' Allah's Messenger (SL3M) said, 'Yes.' `Umar said, 'Aren't our killed persons in Paradise and their's in Hell?' He said, 'Yes.' `Umar said, 'Then why should we accept hard terms in matters concerning our religion? Shall we return before Allah judges between us and them?' Allah's Messenger (SL3M) said, 'O Ibn Al- Khattab! I am the Apostle of Allah and Allah will never degrade me. Then `Umar went to Abu Bakr and told him the same as he had told the Prophet. On that Abu Bakr said (to `Umar). 'He is the Apostle of Allah and Allah will never degrade him.' Then Surat-al-Fath (i.e. Victory) was revealed and Allah's Messenger (SL3M) recited it to the end in front of `Umar. On that `Umar asked, 'O Allah's Messenger (SL3M)! Was it (i.e. the Hudaibiya Treaty) a victory?' Allah's Messenger (SL3M) said, ""Yes"". "
bukhari58_128990	 حدثنا قتيبة بن سعيد حدثنا حاتم عن هشام بن	حدثنا عروة عن أبيه عن أسماء ابنة أبي بكر رضى الله عنهما قالت قدمت على أمي وهى مشركة في عهد قريش إذ عاهدوا رسول الله صلى الله عليه وسلم ومدتهم مع أبيها فاستفتت رسول الله صلى الله عليه وسلم فقالت يا رسول الله إن أمي قدمت على وهى راغبة أفأصلها قال نعم صليها 	 حدثنا قتيبة بن سعيد حدثنا حاتم عن هشام بن عروة عن أبيه عن أسماء ابنة أبي بكر رضى الله عنهما قالت قدمت على أمي وهى مشركة في عهد قريش إذ عاهدوا رسول الله صلى الله عليه وسلم ومدتهم مع أبيها فاستفتت رسول الله صلى الله عليه وسلم فقالت يا رسول الله إن أمي قدمت على وهى راغبة أفأصلها قال نعم صليها 	" Narrated Asma 'bint Abi Bakr: During the period of the peace treaty of Quraish with Allah's Messenger (SL3M), my mother, accompanied by her father, came to visit me, and she was a pagan. I consulted Allah's Messenger (SL3M), ""O Allah's Messenger (SL3M)! My mother has come to me and she desires to receive a reward from me, shall I keep good relation with her?"" He said, ""Yes, keep good relation with her."" "
bukhari58_129000	 حدثنا أحمد بن عثمان بن حكيم حدثنا شريح بن	حدثنا مسلمة حدثنا إبراهيم بن يوسف بن أبي إسحاق قال حدثني أبي عن أبي إسحاق قال حدثني البراء رضى الله عنه أن النبي صلى الله عليه وسلم لما أراد أن يعتمر أرسل إلى أهل مكة يستأذنهم ليدخل مكة فاشترطوا عليه أن لا يقيم بها إلا ثلاث ليال ولا يدخلها إلا بجلبان السلاح ولا يدعو منهم أحدا قال فأخذ يكتب الشرط بينهم علي بن أبي طالب فكتب هذا ما قاضى عليه محمد رسول الله فقالوا لو علمنا أنك رسول الله لم نمنعك ولبايعناك ولكن اكتب هذا ما قاضى عليه محمد بن عبد الله فقال أنا والله محمد بن عبد الله وأنا والله رسول الله قال وكان لا يكتب قال فقال لعلي امح رسول الله فقال علي والله لا أمحاه أبدا قال فأرنيه قال فأراه إياه فمحاه النبي صلى الله عليه وسلم بيده فلما دخل ومضى الأيام أتوا عليا فقالوا مر صاحبك فليرتحل فذكر ذلك لرسول الله صلى الله عليه وسلم فقال نعم ثم ارتحل 	 حدثنا أحمد بن عثمان بن حكيم حدثنا شريح بن مسلمة حدثنا إبراهيم بن يوسف بن أبي إسحاق قال حدثني أبي عن أبي إسحاق قال حدثني البراء رضى الله عنه أن النبي صلى الله عليه وسلم لما أراد أن يعتمر أرسل إلى أهل مكة يستأذنهم ليدخل مكة فاشترطوا عليه أن لا يقيم بها إلا ثلاث ليال ولا يدخلها إلا بجلبان السلاح ولا يدعو منهم أحدا قال فأخذ يكتب الشرط بينهم علي بن أبي طالب فكتب هذا ما قاضى عليه محمد رسول الله فقالوا لو علمنا أنك رسول الله لم نمنعك ولبايعناك ولكن اكتب هذا ما قاضى عليه محمد بن عبد الله فقال أنا والله محمد بن عبد الله وأنا والله رسول الله قال وكان لا يكتب قال فقال لعلي امح رسول الله فقال علي والله لا أمحاه أبدا قال فأرنيه قال فأراه إياه فمحاه النبي صلى الله عليه وسلم بيده فلما دخل ومضى الأيام أتوا عليا فقالوا مر صاحبك فليرتحل فذكر ذلك لرسول الله صلى الله عليه وسلم فقال نعم ثم ارتحل 	" Narrated Al-Bara: When the Prophet (SL3M) intended to perform the `Umra he sent a person to the people of Mecca asking their permission to enter Mecca. They stipulated that he would not stay for more than three days and would not enter it except with sheathed arms and would not preach (Islam) to any of them. So `Ali bin Abi- Talib started writing the treaty between them. He wrote, ""This is what Muhammad, Apostle of Allah has agreed to."" The (Meccans) said, ""If we knew that you (Muhammad) are the Apostle of Allah, then we would not have prevented you and would have followed you. But write, 'This is what Muhammad bin `Abdullah has agreed to..' "" On that Allah's Messenger (SL3M) said, ""By Allah, I am Muhammad bin `Abdullah, and, by Allah, I am Apostle of 'Allah."" Allah's Messenger (SL3M) used not to write; so he asked `Ali to erase the expression of Apostle of Allah. On that `Ali said, ""By Allah I will never erase it."" Allah's Apostle said (to `Ali), ""Let me see the paper."" When `Ali showed him the paper, the Prophet (SL3M) erased the expression with his own hand. When Allah's Messenger (SL3M) had entered Mecca and three days had elapsed, the Meccans came to `Ali and said, ""Let your friend (i.e. the Prophet) quit Mecca."" `Ali informed Allah's Messenger (SL3M) about it and Allah's Messenger (SL3M) said, ""Yes,"" and then he departed. "
bukhari58_129010	 حدثنا عبدان بن عثمان قال أخبرني أبي عن شعبة عن أبي إسحاق عن عمرو بن ميمون عن	عن عبد الله رضى الله عنه قال بينا رسول الله صلى الله عليه وسلم ساجد وحوله ناس من قريش من المشركين إذ جاء عقبة بن أبي معيط بسلى جزور فقذفه على ظهر النبي صلى الله عليه وسلم فلم يرفع رأسه حتى جاءت فاطمة عليها السلام فأخذت من ظهره ودعت على من صنع ذلك فقال النبي صلى الله عليه وسلم اللهم عليك الملأ من قريش اللهم عليك أبا جهل بن هشام وعتبة بن ربيعة وشيبة بن ربيعة وعقبة بن أبي معيط وأمية بن خلف أو أبى بن خلف فلقد رأيتهم قتلوا يوم بدر فألقوا في بئر غير أمية أو أبى فإنه كان رجلا ضخما فلما جروه تقطعت أوصاله قبل أن يلقى في البئر 	 حدثنا عبدان بن عثمان قال أخبرني أبي عن شعبة عن أبي إسحاق عن عمرو بن ميمون عن عبد الله رضى الله عنه قال بينا رسول الله صلى الله عليه وسلم ساجد وحوله ناس من قريش من المشركين إذ جاء عقبة بن أبي معيط بسلى جزور فقذفه على ظهر النبي صلى الله عليه وسلم فلم يرفع رأسه حتى جاءت فاطمة عليها السلام فأخذت من ظهره ودعت على من صنع ذلك فقال النبي صلى الله عليه وسلم اللهم عليك الملأ من قريش اللهم عليك أبا جهل بن هشام وعتبة بن ربيعة وشيبة بن ربيعة وعقبة بن أبي معيط وأمية بن خلف أو أبى بن خلف فلقد رأيتهم قتلوا يوم بدر فألقوا في بئر غير أمية أو أبى فإنه كان رجلا ضخما فلما جروه تقطعت أوصاله قبل أن يلقى في البئر 	" Narrated `Abdullah: While the Prophet (SL3M) was in the state of prostration, surrounded by a group of people from Quraish pagans. `Uqba bin Abi Mu'ait came and brought the intestines of a camel and threw them on the back of the Prophet (SL3M) . The Prophet (SL3M) did not raise his head from prostration till Fatima (i.e. his daughter) came and removed those intestines from his back, and invoked evil on whoever had done (the evil deed). The Prophet (SL3M) said, ""O Allah! Destroy the chiefs of Quraish, O Allah! Destroy Abu Jahl bin Hisham, `Utba bin Rabi`a, Shaiba bin Rabi`a, `Uqba bin Abi Mu'ait, Umaiya bin Khalaf (or Ubai bin Kalaf)."" Later on I saw all of them killed during the battle of Badr and their bodies were thrown into a well except the body of Umaiya or Ubai, because he was a fat person, and when he was pulled, the parts of his body got separated before he was thrown into the well. "
bukhari58_129021	 حدثنا أبو الوليد حدثنا شعبة عن سليمان الأعمش عن أبي وائل عن عبد اللهوعن ثابت عن أنس عن	عن النبي صلى الله عليه وسلم قال لكل غادر لواء يوم القيامة قال أحدهما ينصب وقال الآخر يرى يوم القيامة يعرف به 	 حدثنا أبو الوليد حدثنا شعبة عن سليمان الأعمش عن أبي وائل عن عبد اللهوعن ثابت عن أنس عن النبي صلى الله عليه وسلم قال لكل غادر لواء يوم القيامة قال أحدهما ينصب وقال الآخر يرى يوم القيامة يعرف به 	" Narrated Anas: The Prophet (SL3M) said, ''Every betrayer will have a flag on the Day of Resurrection"" One of the two subnarrators said that the flag would be fixed, and the other said that it would be shown on the Day of Resurrection, so that the betrayer might be recognized by it. "
bukhari58_129040	 حدثنا سليمان بن حرب حدثنا حماد عن أيوب عن نافع عن	عن ابن عمر رضى الله عنهما قال سمعت النبي صلى الله عليه وسلم يقول لكل غادر لواء ينصب لغدرته 	 حدثنا سليمان بن حرب حدثنا حماد عن أيوب عن نافع عن ابن عمر رضى الله عنهما قال سمعت النبي صلى الله عليه وسلم يقول لكل غادر لواء ينصب لغدرته 	" Narrated Ibn `Umar: The Prophet (SL3M) said, ""Every betrayer will have a flag which will be fixed on the Day of Resurrection, and the flag's prominence will be made in order to show the betrayal he committed."" "
bukhari58_129050	 حدثنا علي بن عبد الله حدثنا جرير عن منصور عن مجاهد عن طاوس عن	عن ابن عباس رضى الله عنهما قال قال رسول الله صلى الله عليه وسلم يوم فتح مكة لا هجرة ولكن جهاد ونية وإذا استنفرتم فانفروا وقال يوم فتح مكة إن هذا البلد حرمه الله يوم خلق السموات والأرض فهو حرام بحرمة الله إلى يوم القيامة وإنه لم يحل القتال فيه لأحد قبلي ولم يحل لي إلا ساعة من نهار فهو حرام بحرمة الله إلى يوم القيامة لا يعضد شوكه ولا ينفر صيده ولا يلتقط لقطته إلا من عرفها ولا يختلى خلاه فقال العباس يا رسول الله إلا الإذخر فإنه لقينهم ولبيوتهم قال إلا الإذخر 	 حدثنا علي بن عبد الله حدثنا جرير عن منصور عن مجاهد عن طاوس عن ابن عباس رضى الله عنهما قال قال رسول الله صلى الله عليه وسلم يوم فتح مكة لا هجرة ولكن جهاد ونية وإذا استنفرتم فانفروا وقال يوم فتح مكة إن هذا البلد حرمه الله يوم خلق السموات والأرض فهو حرام بحرمة الله إلى يوم القيامة وإنه لم يحل القتال فيه لأحد قبلي ولم يحل لي إلا ساعة من نهار فهو حرام بحرمة الله إلى يوم القيامة لا يعضد شوكه ولا ينفر صيده ولا يلتقط لقطته إلا من عرفها ولا يختلى خلاه فقال العباس يا رسول الله إلا الإذخر فإنه لقينهم ولبيوتهم قال إلا الإذخر 	" Narrated Ibn `Abbas: Allah's Messenger (SL3M) said on the day of the conquest of Mecca, ""There is no migration now, but there is Jihad (i.e.. holy battle) and good intentions. And when you are called for Jihad, you should come out at once"" Allah's Messenger (SL3M) also said, on the day of the conquest of Mecca, ""Allah has made this town a sanctuary since the day He created the Heavens and the Earth. So, it is a sanctuary by Allah's Decree till the Day of Resurrection. Fighting in it was not legal for anyone before me, and it was made legal for me only for an hour by daytime. So, it (i.e. Mecca) is a sanctuary by Allah's Decree till the Day of Resurrection. Its thorny bushes should not be cut, and its game should not be chased, its fallen property (i.e. Luqata) should not be picked up except by one who will announce it publicly; and its grass should not be uprooted,"" On that Al-`Abbas said, ""O Allah's Messenger (SL3M)! Except the Idhkhir, because it is used by the goldsmiths and by the people for their houses."" On that the Prophet (SL3M) said, ""Except the Idhkhir."" "
