bukhari30_118790	 حدثنا أبو اليمان أخبرنا شعيب عن الزهري قال حدثني أبو سلمة بن	حدثني عبد الرحمن أن أبا هريرة رضى الله عنه قال نهى رسول الله صلى الله عليه وسلم عن الوصال في الصوم فقال له رجل من المسلمين إنك تواصل يا رسول الله قال وأيكم مثلي إني أبيت يطعمني ربي ويسقين فلما أبوا أن ينتهوا عن الوصال واصل بهم يوما ثم يوما ثم رأوا الهلال فقال لو تأخر لزدتكم كالتنكيل لهم حين أبوا أن ينتهوا 	 حدثنا أبو اليمان أخبرنا شعيب عن الزهري قال حدثني أبو سلمة بن عبد الرحمن أن أبا هريرة رضى الله عنه قال نهى رسول الله صلى الله عليه وسلم عن الوصال في الصوم فقال له رجل من المسلمين إنك تواصل يا رسول الله قال وأيكم مثلي إني أبيت يطعمني ربي ويسقين فلما أبوا أن ينتهوا عن الوصال واصل بهم يوما ثم يوما ثم رأوا الهلال فقال لو تأخر لزدتكم كالتنكيل لهم حين أبوا أن ينتهوا 	" Narrated Abu Huraira: Allah's Messenger (SL3M) forbade Al-Wisal in fasting. So, one of the Muslims said to him, ""But you practice Al- Wisal. O Allah's Messenger (SL3M)!"" The Prophet (SL3M) replied, ""Who amongst you is similar to me? I am given food and drink during my sleep by my Lord."" So, when the people refused to stop Al-Wisal (fasting continuously), the Prophet (SL3M) fasted day and night continuously along with them for a day and then another day and then they saw the crescent moon (of the month of Shawwal). The Prophet (SL3M) said to them (angrily), ""If It (the crescent) had not appeared, I would have made you fast for a longer period."" That was as a punishment for them when they refused to stop (practicing Al-Wisal). "
bukhari30_118800	 حدثنا يحيى حدثنا عبد الرزاق عن معمر عن همام أنه سمع أبا هريرة رضى الله عنه عن	عن النبي صلى الله عليه وسلم قال إياكم والوصال مرتين قيل إنك تواصل قال إني أبيت يطعمني ربي ويسقين فاكلفوا من العمل ما تطيقون 	 حدثنا يحيى حدثنا عبد الرزاق عن معمر عن همام أنه سمع أبا هريرة رضى الله عنه عن النبي صلى الله عليه وسلم قال إياكم والوصال مرتين قيل إنك تواصل قال إني أبيت يطعمني ربي ويسقين فاكلفوا من العمل ما تطيقون 	" Narrated Abu Huraira: The Prophet (SL3M) said twice, ""(O you people) Be cautious! Do not practice Al-Wisal."" The people said to him, ""But you practice Al-Wisal?"" The Prophet (SL3M) replied, ""My Lord gives me food and drink during my sleep. Do that much of deeds which is within your ability."" "
bukhari30_118810	 حدثنا إبراهيم بن حمزة حدثني ابن أبي حازم عن يزيد عن عبد الله بن خباب عن	عن أبي سعيد الخدري رضى الله عنه أنه سمع رسول الله صلى الله عليه وسلم يقول لا تواصلوا فأيكم أراد أن يواصل فليواصل حتى السحر قالوا فإنك تواصل يا رسول الله قال لست كهيئتكم إني أبيت لي مطعم يطعمني وساق يسقين 	 حدثنا إبراهيم بن حمزة حدثني ابن أبي حازم عن يزيد عن عبد الله بن خباب عن أبي سعيد الخدري رضى الله عنه أنه سمع رسول الله صلى الله عليه وسلم يقول لا تواصلوا فأيكم أراد أن يواصل فليواصل حتى السحر قالوا فإنك تواصل يا رسول الله قال لست كهيئتكم إني أبيت لي مطعم يطعمني وساق يسقين 	" Narrated Abu Sa`id Al-Khudri: Allah's Messenger (SL3M) said, ""Do not fast continuously day and night (practice Al-Wisal) and if anyone of you intends to fast continuously day and night, he should continue till the Suhur time."" They said, ""But you practice Al-Wisal, O Allah's Messenger (SL3M)!"" The Prophet (SL3M) said, ""I am not similar to you;. during my sleep I have One Who makes me eat and drink."" "
bukhari30_118820	 حدثنا محمد بن بشار حدثنا جعفر بن عون حدثنا أبو العميس عن عون بن أبي جحيفة عن	حدثنا أبيه قال آخى النبي صلى الله عليه وسلم بين سلمان وأبي الدرداء فزار سلمان أبا الدرداء فرأى أم الدرداء متبذلة فقال لها ما شأنك قالت أخوك أبو الدرداء ليس له حاجة في الدنيا فجاء أبو الدرداء فصنع له طعاما فقال كل قال فإني صائم قال ما أنا بآكل حتى تأكل قال فأكل فلما كان الليل ذهب أبو الدرداء يقوم قال نم فنام ثم ذهب يقوم فقال نم فلما كان من آخر الليل قال سلمان قم الآن فصليا فقال له سلمان إن لربك عليك حقا ولنفسك عليك حقا ولأهلك عليك حقا فأعط كل ذي حق حقه فأتى النبي صلى الله عليه وسلم فذكر ذلك له فقال النبي صلى الله عليه وسلم صدق سلمان 	 حدثنا محمد بن بشار حدثنا جعفر بن عون حدثنا أبو العميس عن عون بن أبي جحيفة عن أبيه قال آخى النبي صلى الله عليه وسلم بين سلمان وأبي الدرداء فزار سلمان أبا الدرداء فرأى أم الدرداء متبذلة فقال لها ما شأنك قالت أخوك أبو الدرداء ليس له حاجة في الدنيا فجاء أبو الدرداء فصنع له طعاما فقال كل قال فإني صائم قال ما أنا بآكل حتى تأكل قال فأكل فلما كان الليل ذهب أبو الدرداء يقوم قال نم فنام ثم ذهب يقوم فقال نم فلما كان من آخر الليل قال سلمان قم الآن فصليا فقال له سلمان إن لربك عليك حقا ولنفسك عليك حقا ولأهلك عليك حقا فأعط كل ذي حق حقه فأتى النبي صلى الله عليه وسلم فذكر ذلك له فقال النبي صلى الله عليه وسلم صدق سلمان 	" Narrated Abu Juhaifa: The Prophet (SL3M) made a bond of brotherhood between Salman and Abu Ad-Darda.' Salman paid a visit to Abu Ad-Darda' and found Um Ad-Darda' dressed in shabby clothes and asked her why she was in that state. She replied, ""Your brother Abu Ad-Darda' is not interested in (the luxuries of) this world."" In the meantime Abu Ad-Darda' came and prepared a meal for Salman. Salman requested Abu Ad- Darda' to eat (with him), but Abu Ad-Darda' said, ""I am fasting."" Salman said, ""I am not going to eat unless you eat."" So, Abu Ad-Darda' ate (with Salman). When it was night and (a part of the night passed), Abu Ad-Darda' got up (to offer the night prayer), but Salman told him to sleep and Abu Ad- Darda' slept. After sometime Abu Ad-Darda' again got up but Salman told him to sleep. When it was the last hours of the night, Salman told him to get up then, and both of them offered the prayer. Salman told Abu Ad-Darda', ""Your Lord has a right on you, your soul has a right on you, and your family has a right on you; so you should give the rights of all those who has a right on you."" Abu Ad- Darda' came to the Prophet (SL3M) and narrated the whole story. The Prophet (SL3M) said, ""Salman has spoken the truth."" "
bukhari30_118830	 حدثنا عبد الله بن يوسف أخبرنا مالك عن أبي النضر عن أبي سلمة عن	عن عائشة رضى الله عنها قالت كان رسول الله صلى الله عليه وسلم يصوم حتى نقول لا يفطر ويفطر حتى نقول لا يصوم فما رأيت رسول الله صلى الله عليه وسلم استكمل صيام شهر إلا رمضان وما رأيته أكثر صياما منه في شعبان 	 حدثنا عبد الله بن يوسف أخبرنا مالك عن أبي النضر عن أبي سلمة عن عائشة رضى الله عنها قالت كان رسول الله صلى الله عليه وسلم يصوم حتى نقول لا يفطر ويفطر حتى نقول لا يصوم فما رأيت رسول الله صلى الله عليه وسلم استكمل صيام شهر إلا رمضان وما رأيته أكثر صياما منه في شعبان 	 Narrated `Aisha: Allah's Messenger (SL3M) used to fast till one would say that he would never stop fasting, and he would abandon fasting till one would say that he would never fast. I never saw Allah's Messenger (SL3M) fasting for a whole month except the month of Ramadan, and did not see him fasting in any month more than in the month of Sha'ban. 
bukhari30_118840	 حدثنا معاذ بن فضالة حدثنا هشام عن يحيى عن	حدثنا أبي سلمة أن عائشة رضى الله عنها حدثته قالت لم يكن النبي صلى الله عليه وسلم يصوم شهرا أكثر من شعبان فإنه كان يصوم شعبان كله وكان يقول خذوا من العمل ما تطيقون فإن الله لا يمل حتى تملوا وأحب الصلاة إلى النبي صلى الله عليه وسلم ما دووم عليه وإن قلت وكان إذا صلى صلاة داوم عليها 	 حدثنا معاذ بن فضالة حدثنا هشام عن يحيى عن أبي سلمة أن عائشة رضى الله عنها حدثته قالت لم يكن النبي صلى الله عليه وسلم يصوم شهرا أكثر من شعبان فإنه كان يصوم شعبان كله وكان يقول خذوا من العمل ما تطيقون فإن الله لا يمل حتى تملوا وأحب الصلاة إلى النبي صلى الله عليه وسلم ما دووم عليه وإن قلت وكان إذا صلى صلاة داوم عليها 	" Narrated `Aisha: The Prophet (SL3M) never fasted in any month more than in the month of Sha'ban. He used to say, ""Do those deeds which you can do easily, as Allah will not get tired (of giving rewards) till you get bored and tired (of performing religious deeds)."" The most beloved prayer to the Prophet (SL3M) was the one that was done regularly (throughout the life) even if it were little. And whenever the Prophet (SL3M) offered a prayer he used to offer it regularly . "
bukhari30_118850	 حدثنا موسى بن إسماعيل حدثنا أبو عوانة عن أبي بشر عن سعيد عن	عن ابن عباس رضى الله عنهما قال ما صام النبي صلى الله عليه وسلم شهرا كاملا قط غير رمضان ويصوم حتى يقول القائل لا والله لا يفطر ويفطر حتى يقول القائل لا والله لا يصوم 	 حدثنا موسى بن إسماعيل حدثنا أبو عوانة عن أبي بشر عن سعيد عن ابن عباس رضى الله عنهما قال ما صام النبي صلى الله عليه وسلم شهرا كاملا قط غير رمضان ويصوم حتى يقول القائل لا والله لا يفطر ويفطر حتى يقول القائل لا والله لا يصوم 	" Narrated Ibn `Abbas: The Prophet (SL3M) never fasted a full month except the month of Ramadan, and he used to fast till one could say, ""By Allah, he will never stop fasting,"" and he would abandon fasting till one would say, ""By Allah, he will never fast."" "
bukhari30_118860	 حدثني عبد العزيز بن عبد الله قال حدثني محمد بن	حدثني جعفر عن حميد أنه سمع أنسا رضى الله عنه يقول كان رسول الله صلى الله عليه وسلم يفطر من الشهر حتى نظن أن لا يصوم منه ويصوم حتى نظن أن لا يفطر منه شيئا وكان لا تشاء تراه من الليل مصليا إلا رأيته ولا نائما إلا رأيته وقال سليمان عن حميد أنه سأل أنسا في الصوم 	 حدثني عبد العزيز بن عبد الله قال حدثني محمد بن جعفر عن حميد أنه سمع أنسا رضى الله عنه يقول كان رسول الله صلى الله عليه وسلم يفطر من الشهر حتى نظن أن لا يصوم منه ويصوم حتى نظن أن لا يفطر منه شيئا وكان لا تشاء تراه من الليل مصليا إلا رأيته ولا نائما إلا رأيته وقال سليمان عن حميد أنه سأل أنسا في الصوم 	 Narrated Anas: Allah's Messenger (SL3M) used to leave fasting in a certain month till we thought that he would not fast in that month, and he used to fast in another month till we thought he would not stop fasting at all in that month. And if one wanted to see him praying at night, one could see him (in that condition), and if one wanted to see him sleeping at night, one could see him (in that condition) too. 
bukhari30_118870	 حدثني محمد أخبرنا أبو خالد الأحمر أخبرنا حميد قال سألت أنسا رضى الله عنه عن	أخبرنا صيام النبي صلى الله عليه وسلم فقال ما كنت أحب أن أراه من الشهر صائما إلا رأيته ولا مفطرا إلا رأيته ولا من الليل قائما إلا رأيته ولا نائما إلا رأيته ولا مسست خزة ولا حريرة ألين من كف رسول الله صلى الله عليه وسلم ولا شممت مسكة ولا عبيرة أطيب رائحة من رائحة رسول الله صلى الله عليه وسلم 	 حدثني محمد أخبرنا أبو خالد الأحمر أخبرنا حميد قال سألت أنسا رضى الله عنه عن صيام النبي صلى الله عليه وسلم فقال ما كنت أحب أن أراه من الشهر صائما إلا رأيته ولا مفطرا إلا رأيته ولا من الليل قائما إلا رأيته ولا نائما إلا رأيته ولا مسست خزة ولا حريرة ألين من كف رسول الله صلى الله عليه وسلم ولا شممت مسكة ولا عبيرة أطيب رائحة من رائحة رسول الله صلى الله عليه وسلم 	" Narrated Humaid: I asked Anas about the fasting of the Prophet. He said ""Whenever I liked to see the Prophet (SL3M) fasting in any month, I could see that, and whenever I liked to see him not fasting, I could see that too, and if I liked to see him praying in any night, I could see that, and if I liked to see him sleeping, I could see that, too."" Anas further said, ""I never touched silk or velvet softer than the hand of Allah's Messenger (SL3M) and never smelled musk or perfumed smoke more pleasant than the smell of Allah's Messenger (SL3M)."" "
bukhari30_118880	 حدثنا إسحاق أخبرنا هارون بن إسماعيل حدثنا علي حدثنا يحيى قال حدثني أبو سلمة قال حدثني عبد الله بن عمرو بن	حدثني العاص رضى الله عنهما قال دخل على رسول الله صلى الله عليه وسلم فذكر الحديث يعني إن لزورك عليك حقا وإن لزوجك عليك حقا فقلت وما صوم داود قال نصف الدهر 	 حدثنا إسحاق أخبرنا هارون بن إسماعيل حدثنا علي حدثنا يحيى قال حدثني أبو سلمة قال حدثني عبد الله بن عمرو بن العاص رضى الله عنهما قال دخل على رسول الله صلى الله عليه وسلم فذكر الحديث يعني إن لزورك عليك حقا وإن لزوجك عليك حقا فقلت وما صوم داود قال نصف الدهر 	" Narrated `Abdullah bin `Amr bin Al-`As: ""Once Allah's Messenger (SL3M) came to me,"" and then he narrated the whole narration, i.e. your guest has a right on you, and your wife has a right on you. I then asked about the fasting of David. The Prophet (SL3M) replied, ""Half of the year,"" (i.e. he used to fast on every alternate day). "
bukhari30_118890	 حدثنا ابن مقاتل أخبرنا عبد الله أخبرنا الأوزاعي قال حدثني يحيى بن أبي كثير قال حدثني أبو سلمة بن	حدثني عبد الرحمن قال حدثني عبد الله بن عمرو بن العاص رضى الله عنهما قال لي رسول الله صلى الله عليه وسلم يا عبد الله ألم أخبر أنك تصوم النهار وتقوم الليل فقلت بلى يا رسول الله قال فلا تفعل صم وأفطر وقم ونم فإن لجسدك عليك حقا وإن لعينك عليك حقا وإن لزوجك عليك حقا وإن لزورك عليك حقا وإن بحسبك أن تصوم كل شهر ثلاثة أيام فإن لك بكل حسنة عشر أمثالها فإن ذلك صيام الدهر كله فشددت فشدد على قلت يا رسول الله إني أجد قوة قال فصم صيام نبي الله داود عليه السلام ولا تزد عليه قلت وما كان صيام نبي الله داود عليه السلام قال نصف الدهر فكان عبد الله يقول بعد ما كبر يا ليتني قبلت رخصة النبي صلى الله عليه وسلم 	 حدثنا ابن مقاتل أخبرنا عبد الله أخبرنا الأوزاعي قال حدثني يحيى بن أبي كثير قال حدثني أبو سلمة بن عبد الرحمن قال حدثني عبد الله بن عمرو بن العاص رضى الله عنهما قال لي رسول الله صلى الله عليه وسلم يا عبد الله ألم أخبر أنك تصوم النهار وتقوم الليل فقلت بلى يا رسول الله قال فلا تفعل صم وأفطر وقم ونم فإن لجسدك عليك حقا وإن لعينك عليك حقا وإن لزوجك عليك حقا وإن لزورك عليك حقا وإن بحسبك أن تصوم كل شهر ثلاثة أيام فإن لك بكل حسنة عشر أمثالها فإن ذلك صيام الدهر كله فشددت فشدد على قلت يا رسول الله إني أجد قوة قال فصم صيام نبي الله داود عليه السلام ولا تزد عليه قلت وما كان صيام نبي الله داود عليه السلام قال نصف الدهر فكان عبد الله يقول بعد ما كبر يا ليتني قبلت رخصة النبي صلى الله عليه وسلم 	" Narrated `Abdullah bin `Amr bin Al-`As: Allah's Messenger (SL3M) said to me, ""O `Abdullah! Have I not been informed that you fast during the day and offer prayers all the night."" `Abdullah replied, ""Yes, O Allah's Messenger (SL3M)!"" The Prophet (SL3M) said, ""Don't do that; fast for few days and then give it up for few days, offer prayers and also sleep at night, as your body has a right on you, and your wife has a right on you, and your guest has a right on you. And it is sufficient for you to fast three days in a month, as the reward of a good deed is multiplied ten times, so it will be like fasting throughout the year."" I insisted (on fasting) and so I was given a hard instruction. I said, ""O Allah's Messenger (SL3M)! I have power."" The Prophet (SL3M) said, ""Fast like the fasting of the Prophet (SL3M) David and do not fast more than that."" I said, ""How was the fasting of the Prophet (SL3M) of Allah, David?"" He said, ""Half of the year,"" (i.e. he used to fast on every alternate day). Afterwards when `Abdullah became old, he used to say, ""It would have been better for me if I had accepted the permission of the Prophet (SL3M) (which he gave me i.e. to fast only three days a month). "
bukhari30_118900	 حدثنا أبو اليمان أخبرنا شعيب عن الزهري قال أخبرني سعيد بن المسيب وأبو سلمة بن	عن عبد الرحمن أن عبد الله بن عمرو قال أخبر رسول الله صلى الله عليه وسلم أني أقول والله لأصومن النهار ولأقومن الليل ما عشت فقلت له قد قلته بأبي أنت وأمي قال فإنك لا تستطيع ذلك فصم وأفطر وقم ونم وصم من الشهر ثلاثة أيام فإن الحسنة بعشر أمثالها وذلك مثل صيام الدهر قلت إني أطيق أفضل من ذلك قال فصم يوما وأفطر يومين قلت إني أطيق أفضل من ذلك قال فصم يوما وأفطر يوما فذلك صيام داود عليه السلام وهو أفضل الصيام فقلت إني أطيق أفضل من ذلك فقال النبي صلى الله عليه وسلم لا أفضل من ذلك 	 حدثنا أبو اليمان أخبرنا شعيب عن الزهري قال أخبرني سعيد بن المسيب وأبو سلمة بن عبد الرحمن أن عبد الله بن عمرو قال أخبر رسول الله صلى الله عليه وسلم أني أقول والله لأصومن النهار ولأقومن الليل ما عشت فقلت له قد قلته بأبي أنت وأمي قال فإنك لا تستطيع ذلك فصم وأفطر وقم ونم وصم من الشهر ثلاثة أيام فإن الحسنة بعشر أمثالها وذلك مثل صيام الدهر قلت إني أطيق أفضل من ذلك قال فصم يوما وأفطر يومين قلت إني أطيق أفضل من ذلك قال فصم يوما وأفطر يوما فذلك صيام داود عليه السلام وهو أفضل الصيام فقلت إني أطيق أفضل من ذلك فقال النبي صلى الله عليه وسلم لا أفضل من ذلك 	" Narrated `Abdullah bin `Amr: Allah's Messenger (SL3M) was informed that I had taken an oath to fast daily and to pray (every night) all the night throughout my life (so Allah's Messenger (SL3M) came to me and asked whether it was correct): I replied, ""Let my parents be sacrificed for you! I said so."" The Prophet (SL3M) said, ""You can not do that. So, fast for few days and give it up for few days, r ray and sleep. Fast three days a month as the reward of good deeds is multiplied ten times and that will be equal to one year of fasting."" I replied, ""I can do better than that."" The Prophet (SL3M) said to me, ""Fast one day and give up fasting for a day and that is the fasting of Prophet David and that is the best fasting."" I said, ""I have the power to fast better (more) than that."" The Prophet (SL3M) said, ""There is no better fasting than that."" "
