bukhari79_153830	 حدثنا يحيى بن جعفر حدثنا يزيد عن شعبة عن مغيرة عن إبراهيم عن علقمة أنه قدم الشأم وحدثنا أبو الوليد حدثنا شعبة عن مغيرة عن	حدثنا إبراهيم قال ذهب علقمة إلى الشأم فأتى المسجد فصلى ركعتين فقال اللهم ارزقني جليسا فقعد إلى أبي الدرداء فقال ممن أنت قال من أهل الكوفة قال أليس فيكم صاحب السر الذي كان لا يعلمه غيره يعني حذيفة أليس فيكم أو كان فيكم الذي أجاره الله على لسان رسوله صلى الله عليه وسلم من الشيطان يعني عمارا أوليس فيكم صاحب السواك والوساد يعني ابن مسعود كيف كان عبد الله يقرأ {والليل إذا يغشى} قال {والذكر والأنثى} فقال ما زال هؤلاء حتى كادوا يشككوني وقد سمعتها من رسول الله صلى الله عليه وسلم 	 حدثنا يحيى بن جعفر حدثنا يزيد عن شعبة عن مغيرة عن إبراهيم عن علقمة أنه قدم الشأم وحدثنا أبو الوليد حدثنا شعبة عن مغيرة عن إبراهيم قال ذهب علقمة إلى الشأم فأتى المسجد فصلى ركعتين فقال اللهم ارزقني جليسا فقعد إلى أبي الدرداء فقال ممن أنت قال من أهل الكوفة قال أليس فيكم صاحب السر الذي كان لا يعلمه غيره يعني حذيفة أليس فيكم أو كان فيكم الذي أجاره الله على لسان رسوله صلى الله عليه وسلم من الشيطان يعني عمارا أوليس فيكم صاحب السواك والوساد يعني ابن مسعود كيف كان عبد الله يقرأ {والليل إذا يغشى} قال {والذكر والأنثى} فقال ما زال هؤلاء حتى كادوا يشككوني وقد سمعتها من رسول الله صلى الله عليه وسلم 	" Narrated Ibrahim: 'Alaqama went to Sham and came to the mosque and offered a two-rak`at prayer, and invoked Allah: ""O Allah! Bless me with a (pious) good companion."" So he sat beside Abu Ad-Darda' who asked, ""From where are you?"" He said, ""From the people of Kufa."" Abu Darda' said, ""Wasn't there among you the person who keeps the secrets (of the Prophet (SL3M) ) which nobody knew except him (i.e., Hudhaifa (bin Al-Yaman)). And isn't there among you the person whom Allah gave refuge from Satan through the request (tongue) of Allah's Messenger (SL3M)? (i.e., `Ammar). Isn't there among you the one who used to carry the Siwak and the cushion (or pillows (of the Prophets)? (i.e., Ibn Mas`ud). How did Ibn Mas`ud use to recite 'By the night as it conceals (the light)?"" (Sura 92). 'Alqama said, ""Wadhdhakari Wal Untha' (And by male and female."") Abu Ad-Darda added. 'These people continued to argue with me regarding it till they were about to cause me to have doubts although I heard it from Allah's Messenger (SL3M)."" "
bukhari79_153840	 حدثنا محمد بن كثير حدثنا سفيان عن أبي حازم عن سهل بن	عن سعد قال كنا نقيل ونتغدى بعد الجمعة 	 حدثنا محمد بن كثير حدثنا سفيان عن أبي حازم عن سهل بن سعد قال كنا نقيل ونتغدى بعد الجمعة 	 Narrated Sahl bin Sa`d: We used to have a midday nap and take our meals after the Jumua (prayer). 
bukhari79_153850	 حدثنا قتيبة بن سعيد حدثنا عبد العزيز بن	حدثنا أبي حازم عن أبي حازم عن سهل بن سعد قال ما كان لعلي اسم أحب إليه من أبي تراب وإن كان ليفرح به إذا دعي بها جاء رسول الله صلى الله عليه وسلم بيت فاطمة عليها السلام فلم يجد عليا في البيت فقال أين ابن عمك فقالت كان بيني وبينه شىء فغاضبني فخرج فلم يقل عندي فقال رسول الله صلى الله عليه وسلم لإنسان انظر أين هو فجاء فقال يا رسول الله هو في المسجد راقد فجاء رسول الله صلى الله عليه وسلم وهو مضطجع قد سقط رداؤه عن شقه فأصابه تراب فجعل رسول الله صلى الله عليه وسلم يمسحه عنه وهو يقول قم أبا تراب قم أبا تراب 	 حدثنا قتيبة بن سعيد حدثنا عبد العزيز بن أبي حازم عن أبي حازم عن سهل بن سعد قال ما كان لعلي اسم أحب إليه من أبي تراب وإن كان ليفرح به إذا دعي بها جاء رسول الله صلى الله عليه وسلم بيت فاطمة عليها السلام فلم يجد عليا في البيت فقال أين ابن عمك فقالت كان بيني وبينه شىء فغاضبني فخرج فلم يقل عندي فقال رسول الله صلى الله عليه وسلم لإنسان انظر أين هو فجاء فقال يا رسول الله هو في المسجد راقد فجاء رسول الله صلى الله عليه وسلم وهو مضطجع قد سقط رداؤه عن شقه فأصابه تراب فجعل رسول الله صلى الله عليه وسلم يمسحه عنه وهو يقول قم أبا تراب قم أبا تراب 	" Narrated Sahl bin Sa`d: There was no name dearer to `Ali than his nickname Abu Turab (the father of dust). He used to feel happy whenever he was called by this name. Once Allah's Messenger (SL3M) came to the house of Fatima but did not find `Ali in the house. So he asked ""Where is your cousin?"" She replied, ""There was something (a quarrel) between me and him whereupon he got angry with me and went out without having a midday nap in my house."" Allah's Messenger (SL3M) asked a person to look for him. That person came, and said, ""O Allah's Messenger (SL3M)! He (Ali) is sleeping in the mosque."" So Allah's Messenger (SL3M) went there and found him lying. His upper body cover had fallen off to one side of his body, and so he was covered with dust. Allah's Messenger (SL3M) started cleaning the dust from him, saying, ""Get up, O Abu Turab! Get up, Abu Turab!"" (See Hadith No. 432, Vol 1) "
bukhari79_153860	 حدثنا قتيبة بن سعيد حدثنا محمد بن	حدثنا عبد الله الأنصاري قال حدثني أبي عن ثمامة عن أنس أن أم سليم كانت تبسط للنبي صلى الله عليه وسلم نطعا فيقيل عندها على ذلك النطع قال فإذا نام النبي صلى الله عليه وسلم أخذت من عرقه وشعره فجمعته في قارورة ثم جمعته في سك قال فلما حضر أنس بن مالك الوفاة أوصى أن يجعل في حنوطه من ذلك السك قال فجعل في حنوطه 	 حدثنا قتيبة بن سعيد حدثنا محمد بن عبد الله الأنصاري قال حدثني أبي عن ثمامة عن أنس أن أم سليم كانت تبسط للنبي صلى الله عليه وسلم نطعا فيقيل عندها على ذلك النطع قال فإذا نام النبي صلى الله عليه وسلم أخذت من عرقه وشعره فجمعته في قارورة ثم جمعته في سك قال فلما حضر أنس بن مالك الوفاة أوصى أن يجعل في حنوطه من ذلك السك قال فجعل في حنوطه 	" Narrated Thumama: Anas said, ""Um Sulaim used to spread a leather sheet for the Prophet (SL3M) and he used to take a midday nap on that leather sheet at her home."" Anas added, ""When the Prophet (SL3M) had slept, she would take some of his sweat and hair and collect it (the sweat) in a bottle and then mix it with Suk (a kind of perfume) while he was still sleeping. ""When the death of Anas bin Malik approached, he advised that some of that Suk be mixed with his Hanut (perfume for embalming the dead body), and it was mixed with his Hanut. "
bukhari79_153870	 حدثنا إسماعيل قال حدثني مالك عن إسحاق بن	حدثنا عبد الله بن أبي طلحة عن أنس بن مالك رضى الله عنه أنه سمعه يقول كان رسول الله صلى الله عليه وسلم إذا ذهب إلى قباء يدخل على أم حرام بنت ملحان فتطعمه وكانت تحت عبادة بن الصامت فدخل يوما فأطعمته فنام رسول الله صلى الله عليه وسلم ثم استيقظ يضحك قالت فقلت ما يضحكك يا رسول الله فقال ناس من أمتي عرضوا على غزاة في سبيل الله يركبون ثبج هذا البحر ملوكا على الأسرة أو قال مثل الملوك على الأسرة شك إسحاق قلت ادع الله أن يجعلني منهم فدعا ثم وضع رأسه فنام ثم استيقظ يضحك فقلت ما يضحكك يا رسول الله قال ناس من أمتي عرضوا على غزاة في سبيل الله يركبون ثبج هذا البحر ملوكا على الأسرة أو مثل الملوك على الأسرة فقلت ادع الله أن يجعلني منهم قال أنت من الأولين فركبت البحر زمان معاوية فصرعت عن دابتها حين خرجت من البحر فهلكت 	 حدثنا إسماعيل قال حدثني مالك عن إسحاق بن عبد الله بن أبي طلحة عن أنس بن مالك رضى الله عنه أنه سمعه يقول كان رسول الله صلى الله عليه وسلم إذا ذهب إلى قباء يدخل على أم حرام بنت ملحان فتطعمه وكانت تحت عبادة بن الصامت فدخل يوما فأطعمته فنام رسول الله صلى الله عليه وسلم ثم استيقظ يضحك قالت فقلت ما يضحكك يا رسول الله فقال ناس من أمتي عرضوا على غزاة في سبيل الله يركبون ثبج هذا البحر ملوكا على الأسرة أو قال مثل الملوك على الأسرة شك إسحاق قلت ادع الله أن يجعلني منهم فدعا ثم وضع رأسه فنام ثم استيقظ يضحك فقلت ما يضحكك يا رسول الله قال ناس من أمتي عرضوا على غزاة في سبيل الله يركبون ثبج هذا البحر ملوكا على الأسرة أو مثل الملوك على الأسرة فقلت ادع الله أن يجعلني منهم قال أنت من الأولين فركبت البحر زمان معاوية فصرعت عن دابتها حين خرجت من البحر فهلكت 	" Narrated Anas bin Malik: Whenever Allah's Messenger (SL3M) went to Quba, he used to visit Um Haram bint Milhan who would offer him meals; and she was the wife of 'Ubada bin As-samit. One day he went to her house and she offered him a meal, and after that he slept, and then woke up smiling. She (Um Haram) said, ""I asked him, 'What makes you laugh, O Allah's Messenger (SL3M)?' He said, 'Some people of my followers were displayed before me as warriors fighting for Allah's Cause and sailing over this sea, kings on thrones,' or said, 'like kings on thrones.' (The narrator, 'Is-haq is in doubt about it.) I (Um Haram) said, 'O Allah's Apostle! Invoke Allah that He may make me one of them.' He invoked (Allah) for her and then lay his head and slept again and then woke up smiling. I asked, 'What makes you laugh, O Allah's Messenger (SL3M)?' He said, 'Some people of my followers were displayed before me as warriors fighting for Allah's Cause and sailing over this sea, kings on the thrones,' or said, 'like kings on the thrones.' I (Um Haram) said, 'O Allah's Messenger (SL3M)! Invoke Allah that He may make me one of them.' He said, You will be amongst the first ones."" It is said that Um Haram sailed over the sea at the time of Muawiya, and on coming out of the sea, she fell down from her riding animal and died. "
bukhari79_153880	 حدثنا علي بن عبد الله حدثنا سفيان عن الزهري عن عطاء بن يزيد الليثي عن	عن أبي سعيد الخدري رضى الله عنه قال نهى النبي صلى الله عليه وسلم عن لبستين وعن بيعتين اشتمال الصماء والاحتباء في ثوب واحد ليس على فرج الإنسان منه شىء والملامسة والمنابذة تابعه معمر ومحمد بن أبي حفصة وعبد الله بن بديل عن الزهري 	 حدثنا علي بن عبد الله حدثنا سفيان عن الزهري عن عطاء بن يزيد الليثي عن أبي سعيد الخدري رضى الله عنه قال نهى النبي صلى الله عليه وسلم عن لبستين وعن بيعتين اشتمال الصماء والاحتباء في ثوب واحد ليس على فرج الإنسان منه شىء والملامسة والمنابذة تابعه معمر ومحمد بن أبي حفصة وعبد الله بن بديل عن الزهري 	 Narrated Abu Sa`id Al-Khudri: The Prophet (SL3M) forbade two kinds of dresses and two kinds of bargains; Ishtimal As-Samma and Al- Ihtiba in one garment with no part of it covering one's private parts. (The two kinds of bargains were:) Al-Mulamasa and Al-Munabadha. 
bukhari79_153891	 حدثنا موسى عن أبي عوانة حدثنا فراس عن عامر عن مسروق حدثتني	عن عائشة أم المؤمنين قالت إنا كنا أزواج النبي صلى الله عليه وسلم عنده جميعا لم تغادر منا واحدة فأقبلت فاطمة عليها السلام تمشي لا والله ما تخفى مشيتها من مشية رسول الله صلى الله عليه وسلم فلما رآها رحب قال مرحبا بابنتي ثم أجلسها عن يمينه أو عن شماله ثم سارها فبكت بكاء شديدا فلما رأى حزنها سارها الثانية إذا هي تضحك فقلت لها أنا من بين نسائه خصك رسول الله صلى الله عليه وسلم بالسر من بيننا ثم أنت تبكين فلما قام رسول الله صلى الله عليه وسلم سألتها عما سارك قالت ما كنت لأفشي على رسول الله صلى الله عليه وسلم سره فلما توفي قلت لها عزمت عليك بما لي عليك من الحق لما أخبرتني قالت أما الآن فنعم فأخبرتني قالت أما حين سارني في الأمر الأول فإنه أخبرني أن جبريل كان يعارضه بالقرآن كل سنة مرة وإنه قد عارضني به العام مرتين ولا أرى الأجل إلا قد اقترب فاتقي الله واصبري فإني نعم السلف أنا لك قالت فبكيت بكائي الذي رأيت فلما رأى جزعي سارني الثانية قال يا فاطمة ألا ترضين أن تكوني سيدة نساء المؤمنين أو سيدة نساء هذه الأمة 	 حدثنا موسى عن أبي عوانة حدثنا فراس عن عامر عن مسروق حدثتني عائشة أم المؤمنين قالت إنا كنا أزواج النبي صلى الله عليه وسلم عنده جميعا لم تغادر منا واحدة فأقبلت فاطمة عليها السلام تمشي لا والله ما تخفى مشيتها من مشية رسول الله صلى الله عليه وسلم فلما رآها رحب قال مرحبا بابنتي ثم أجلسها عن يمينه أو عن شماله ثم سارها فبكت بكاء شديدا فلما رأى حزنها سارها الثانية إذا هي تضحك فقلت لها أنا من بين نسائه خصك رسول الله صلى الله عليه وسلم بالسر من بيننا ثم أنت تبكين فلما قام رسول الله صلى الله عليه وسلم سألتها عما سارك قالت ما كنت لأفشي على رسول الله صلى الله عليه وسلم سره فلما توفي قلت لها عزمت عليك بما لي عليك من الحق لما أخبرتني قالت أما الآن فنعم فأخبرتني قالت أما حين سارني في الأمر الأول فإنه أخبرني أن جبريل كان يعارضه بالقرآن كل سنة مرة وإنه قد عارضني به العام مرتين ولا أرى الأجل إلا قد اقترب فاتقي الله واصبري فإني نعم السلف أنا لك قالت فبكيت بكائي الذي رأيت فلما رأى جزعي سارني الثانية قال يا فاطمة ألا ترضين أن تكوني سيدة نساء المؤمنين أو سيدة نساء هذه الأمة 	" Narrated `Aisha: Mother of the Believers: We, the wives of the Prophet (SL3M) were all sitting with the Prophet (SL3M) and none of us had left when Fatima came walking, and by Allah, her gait was very similar to that of Allah's Messenger (SL3M) .' When he saw her, he welcomed her, saying, ""Welcome, O my daughter!"" Then he made her sit on his right or his left, confided something to her, whereupon she wept bitterly. When he noticed her sorrow, he confided something else to her for the second time, and she started laughing. Only I from among the Prophet's wives said to her, ""(O Fatima), Allah's Messenger (SL3M) selected you from among us for the secret talk and still you weep?"" When Allah's Messenger (SL3M) got up (and went away), I asked her, ""What did he confide to you?"" She said, ""I wouldn't disclose the secrets of Allah's Messenger (SL3M)"" But when he died I asked her, ""I beseech you earnestly by what right I have on you, to tell me (that secret talk which the Prophet had with you)"" She said, ""As you ask me now, yes, (I will tell you)."" She informed me, saying, ""When he talked to me secretly the first time, he said that Gabriel used to review the Qur'an with him once every year. He added, 'But this year he reviewed it with me twice, and therefore I think that my time of death has approached. So, be afraid of Allah, and be patient, for I am the best predecessor for you (in the Hereafter).' "" Fatima added, ""So I wept as you (`Aisha) witnessed. And when the Prophet (SL3M) saw me in this sorrowful state, he confided the second secret to me saying, 'O Fatima! Will you not be pleased that you will be chief of all the believing women (or chief of the women of this nation i.e. my followers?"") "
bukhari79_153910	 حدثنا علي بن عبد الله حدثنا سفيان حدثنا الزهري قال أخبرني عباد بن تميم عن	حدثنا عمه قال رأيت رسول الله صلى الله عليه وسلم في المسجد مستلقيا واضعا إحدى رجليه على الأخرى 	 حدثنا علي بن عبد الله حدثنا سفيان حدثنا الزهري قال أخبرني عباد بن تميم عن عمه قال رأيت رسول الله صلى الله عليه وسلم في المسجد مستلقيا واضعا إحدى رجليه على الأخرى 	 Narrated the uncle of `Abbas bin Tamim: I saw Allah's Messenger (SL3M) lying on his back in the mosque and putting one of his legs over the other. 
bukhari79_153920	 حدثنا عبد الله بن يوسف أخبرنا مالك وحدثنا إسماعيل قال حدثني مالك عن نافع عن	أخبرنا عبد الله رضى الله عنه أن رسول الله صلى الله عليه وسلم قال إذا كانوا ثلاثة فلا يتناجى اثنان دون الثالث 	 حدثنا عبد الله بن يوسف أخبرنا مالك وحدثنا إسماعيل قال حدثني مالك عن نافع عن عبد الله رضى الله عنه أن رسول الله صلى الله عليه وسلم قال إذا كانوا ثلاثة فلا يتناجى اثنان دون الثالث 	" Narrated `Abdullah: the Prophet (SL3M) said ""When three persons are together, then no two of them should hold secret counsel excluding the third person."" "
bukhari79_153930	 حدثنا عبد الله بن صباح حدثنا معتمر بن	حدثنا سليمان قال سمعت أبي قال سمعت أنس بن مالك أسر إلى النبي صلى الله عليه وسلم سرا فما أخبرت به أحدا بعده ولقد سألتني أم سليم فما أخبرتها به 	 حدثنا عبد الله بن صباح حدثنا معتمر بن سليمان قال سمعت أبي قال سمعت أنس بن مالك أسر إلى النبي صلى الله عليه وسلم سرا فما أخبرت به أحدا بعده ولقد سألتني أم سليم فما أخبرتها به 	 Narrated Anas bin Malik: The Prophet (SL3M) confided to me a secret which I did not disclose to anybody after him. And Um Sulaim asked me (about that secret) but I did not tell her. 
bukhari79_153940	 حدثنا عثمان حدثنا جرير عن منصور عن أبي وائل عن	حدثنا عبد الله رضى الله عنه قال النبي صلى الله عليه وسلم {إذا كنتم ثلاثة فلا يتناجى رجلان دون الآخر حتى تختلطوا بالناس أجل أن يحزنه} 	 حدثنا عثمان حدثنا جرير عن منصور عن أبي وائل عن عبد الله رضى الله عنه قال النبي صلى الله عليه وسلم {إذا كنتم ثلاثة فلا يتناجى رجلان دون الآخر حتى تختلطوا بالناس أجل أن يحزنه} 	" Narrated `Abdullah: The Prophet (SL3M) said, ""When you are three persons sitting together, then no two of you should hold secret counsel excluding the third person until you are with some other people too, for that would grieve him."" "
bukhari79_153950	 حدثنا عبدان عن أبي حمزة عن الأعمش عن شقيق عن	حدثنا عبد الله قال قسم النبي صلى الله عليه وسلم يوما قسمة فقال رجل من الأنصار إن هذه لقسمة ما أريد بها وجه الله قلت أما والله لآتين النبي صلى الله عليه وسلم فأتيته وهو في ملأ فساررته فغضب حتى احمر وجهه ثم قال رحمة الله على موسى أوذي بأكثر من هذا فصبر 	 حدثنا عبدان عن أبي حمزة عن الأعمش عن شقيق عن عبد الله قال قسم النبي صلى الله عليه وسلم يوما قسمة فقال رجل من الأنصار إن هذه لقسمة ما أريد بها وجه الله قلت أما والله لآتين النبي صلى الله عليه وسلم فأتيته وهو في ملأ فساررته فغضب حتى احمر وجهه ثم قال رحمة الله على موسى أوذي بأكثر من هذا فصبر 	" Narrated `Abdullah: One day the Prophet (SL3M) divided and distributed something amongst the people whereupon an Ansari man said, ""In this division Allah's Countenance has not been sought."" I said, ""By Allah! I will go (and inform) the Prophet."" So I went to him while he was with a group of people, and I secretly informed him of that, whereupon he became so angry that his face became red, and he then said, ""May Allah bestow His Mercy on Moses (for) he was hurt more than that, yet he remained patient."" "
bukhari79_153960	 حدثنا محمد بن بشار حدثنا محمد بن جعفر حدثنا شعبة عن عبد العزيز عن	حدثنا أنس رضى الله عنه قال أقيمت الصلاة ورجل يناجي رسول الله صلى الله عليه وسلم فما زال يناجيه حتى نام أصحابه ثم قام فصلى 	 حدثنا محمد بن بشار حدثنا محمد بن جعفر حدثنا شعبة عن عبد العزيز عن أنس رضى الله عنه قال أقيمت الصلاة ورجل يناجي رسول الله صلى الله عليه وسلم فما زال يناجيه حتى نام أصحابه ثم قام فصلى 	 Narrated Anas: The Iqama for the prayer was announced while a man was talking to Allah's Messenger (SL3M) privately. He continued talking in that way till the Prophet's companions slept, and afterwards the Prophet (SL3M) got up and offered the prayer with them. 
bukhari79_153970	 حدثنا أبو نعيم حدثنا ابن عيينة عن الزهري عن سالم عن أبيه عن	عن النبي صلى الله عليه وسلم قال {لا تتركوا النار في بيوتكم حين تنامون} 	 حدثنا أبو نعيم حدثنا ابن عيينة عن الزهري عن سالم عن أبيه عن النبي صلى الله عليه وسلم قال {لا تتركوا النار في بيوتكم حين تنامون} 	" Narrated Salim's father: The Prophet (SL3M) said, ""Do not keep the fire burning in your houses when you go to bed."" "
