bukhari15_109190	 حدثنا محمد بن مقاتل قال أخبرنا عبد الله بن	حدثنا المبارك قال أخبرنا الأوزاعي قال حدثنا إسحاق بن عبد الله بن أبي طلحة الأنصاري قال حدثني أنس بن مالك قال أصابت الناس سنة على عهد رسول الله صلى الله عليه وسلم فبينا رسول الله صلى الله عليه وسلم يخطب على المنبر يوم الجمعة قام أعرابي فقال يا رسول الله هلك المال وجاع العيال فادع الله لنا أن يسقينا قال فرفع رسول الله صلى الله عليه وسلم يديه وما في السماء قزعة قال فثار سحاب أمثال الجبال ثم لم ينزل عن منبره حتى رأيت المطر يتحادر على لحيته قال فمطرنا يومنا ذلك وفي الغد ومن بعد الغد والذي يليه إلى الجمعة الأخرى فقام ذلك الأعرابي أو رجل غيره فقال يا رسول الله تهدم البناء وغرق المال فادع الله لنا فرفع رسول الله صلى الله عليه وسلم يديه وقال اللهم حوالينا ولا علينا قال فما جعل يشير بيده إلى ناحية من السماء إلا تفرجت حتى صارت المدينة في مثل الجوبة حتى سال الوادي وادي قناة شهرا قال فلم يجئ أحد من ناحية إلا حدث بالجود 	 حدثنا محمد بن مقاتل قال أخبرنا عبد الله بن المبارك قال أخبرنا الأوزاعي قال حدثنا إسحاق بن عبد الله بن أبي طلحة الأنصاري قال حدثني أنس بن مالك قال أصابت الناس سنة على عهد رسول الله صلى الله عليه وسلم فبينا رسول الله صلى الله عليه وسلم يخطب على المنبر يوم الجمعة قام أعرابي فقال يا رسول الله هلك المال وجاع العيال فادع الله لنا أن يسقينا قال فرفع رسول الله صلى الله عليه وسلم يديه وما في السماء قزعة قال فثار سحاب أمثال الجبال ثم لم ينزل عن منبره حتى رأيت المطر يتحادر على لحيته قال فمطرنا يومنا ذلك وفي الغد ومن بعد الغد والذي يليه إلى الجمعة الأخرى فقام ذلك الأعرابي أو رجل غيره فقال يا رسول الله تهدم البناء وغرق المال فادع الله لنا فرفع رسول الله صلى الله عليه وسلم يديه وقال اللهم حوالينا ولا علينا قال فما جعل يشير بيده إلى ناحية من السماء إلا تفرجت حتى صارت المدينة في مثل الجوبة حتى سال الوادي وادي قناة شهرا قال فلم يجئ أحد من ناحية إلا حدث بالجود 	" Narrated Anas bin Malik: In the lifetime of Allah's Messenger (SL3M) (p.b.u.h) the people were afflicted with a (famine) year. While the Prophet was delivering the Khutba (sermon) on the pulpit on a Friday, a Bedouin stood up and said, ""O Allah's Messenger (SL3M)! The livestock are dying and the families (offspring) are hungry: please pray to Allah to bless us with rain."" Allah's Messenger (SL3M) raised both his hands towards the sky and at that time there was not a trace of cloud in they sky. Then the clouds started gathering like mountains. Before he got down from the pulpit I saw rainwater trickling down his beard. It rained that day, the next day, the third day, the fourth day and till the next Friday, when the same Bedouin or some other person stood up (during the Friday Khutba) and said, ""O Allah's Messenger (SL3M)! The houses have collapsed and the livestock are drowned. Please invoke Allah for us."" So Allah's Messenger (SL3M) raised both his hands and said, ""O Allah! Around us and not on us."" Whichever side the Prophet (SL3M) directed his hand, the clouds dispersed from there till a hole (in the clouds) was formed over Medina. The valley of Qanat remained flowing (with water) for one month and none, came from outside who didn't talk about the abundant rain. "
bukhari15_109200	 حدثنا سعيد بن أبي مريم قال أخبرنا محمد بن	حدثنا جعفر قال أخبرني حميد أنه سمع أنسا يقول كانت الريح الشديدة إذا هبت عرف ذلك في وجه النبي صلى الله عليه وسلم 	 حدثنا سعيد بن أبي مريم قال أخبرنا محمد بن جعفر قال أخبرني حميد أنه سمع أنسا يقول كانت الريح الشديدة إذا هبت عرف ذلك في وجه النبي صلى الله عليه وسلم 	 Narrated Anas: Whenever a strong wind blew, anxiety appeared on the face of the Prophet (SL3M) (fearing that wind might be a sign of Allah's wrath). 
bukhari15_109210	 حدثنا مسلم قال حدثنا شعبة عن الحكم عن مجاهد عن	حدثنا ابن عباس أن النبي صلى الله عليه وسلم قال نصرت بالصبا وأهلكت عاد بالدبور 	 حدثنا مسلم قال حدثنا شعبة عن الحكم عن مجاهد عن ابن عباس أن النبي صلى الله عليه وسلم قال نصرت بالصبا وأهلكت عاد بالدبور 	" Narrated Ibn `Abbas: The Prophet (SL3M) said, ""I was granted victory with As-Saba and the nation of 'Ad was destroyed by Ad- Dabur (westerly wind) . "
bukhari15_109220	 حدثنا أبو اليمان قال أخبرنا شعيب قال أخبرنا أبو الزناد عن عبد الرحمن الأعرج عن	أخبرنا أبي هريرة قال قال النبي صلى الله عليه وسلم لا تقوم الساعة حتى يقبض العلم وتكثر الزلازل ويتقارب الزمان وتظهر الفتن ويكثر الهرج وهو القتل القتل حتى يكثر فيكم المال فيفيض 	 حدثنا أبو اليمان قال أخبرنا شعيب قال أخبرنا أبو الزناد عن عبد الرحمن الأعرج عن أبي هريرة قال قال النبي صلى الله عليه وسلم لا تقوم الساعة حتى يقبض العلم وتكثر الزلازل ويتقارب الزمان وتظهر الفتن ويكثر الهرج وهو القتل القتل حتى يكثر فيكم المال فيفيض 	" Narrated Abu Huraira: The Prophet (SL3M) said, ""The Hour (Last Day) will not be established until (religious) knowledge will be taken away (by the death of religious learned men), earthquakes will be very frequent, time will pass quickly, afflictions will appear, murders will increase and money will overflow amongst you."" (See Hadith No. 85 Vol 1). "
bukhari15_109230	 حدثنا محمد بن المثنى قال حدثنا حسين بن	حدثنا الحسن قال حدثنا ابن عون عن نافع عن ابن عمر قال اللهم بارك لنا في شامنا وفي يمننا قال قالوا وفي نجدنا قال قال اللهم بارك لنا في شامنا وفي يمننا قال قالوا وفي نجدنا قال قال هناك الزلازل والفتن وبها يطلع قرن الشيطان 	 حدثنا محمد بن المثنى قال حدثنا حسين بن الحسن قال حدثنا ابن عون عن نافع عن ابن عمر قال اللهم بارك لنا في شامنا وفي يمننا قال قالوا وفي نجدنا قال قال اللهم بارك لنا في شامنا وفي يمننا قال قالوا وفي نجدنا قال قال هناك الزلازل والفتن وبها يطلع قرن الشيطان 	" Narrated Ibn `Umar: (The Prophet) said, ""O Allah! Bless our Sham and our Yemen."" People said, ""Our Najd as well."" The Prophet again said, ""O Allah! Bless our Sham and Yemen."" They said again, ""Our Najd as well."" On that the Prophet (SL3M) said, ""There will appear earthquakes and afflictions, and from there will come out the side of the head of Satan."" "
bukhari15_109240	 حدثنا إسماعيل حدثني مالك عن صالح بن كيسان عن عبيد الله بن عبد الله بن عتبة بن	عن مسعود عن زيد بن خالد الجهني أنه قال صلى لنا رسول الله صلى الله عليه وسلم صلاة الصبح بالحديبية على إثر سماء كانت من الليلة فلما انصرف النبي صلى الله عليه وسلم أقبل على الناس فقال هل تدرون ماذا قال ربكم قالوا الله ورسوله أعلم قال أصبح من عبادي مؤمن بي وكافر فأما من قال مطرنا بفضل الله ورحمته فذلك مؤمن بي كافر بالكوكب وأما من قال بنوء كذا وكذا فذلك كافر بي مؤمن بالكوكب 	 حدثنا إسماعيل حدثني مالك عن صالح بن كيسان عن عبيد الله بن عبد الله بن عتبة بن مسعود عن زيد بن خالد الجهني أنه قال صلى لنا رسول الله صلى الله عليه وسلم صلاة الصبح بالحديبية على إثر سماء كانت من الليلة فلما انصرف النبي صلى الله عليه وسلم أقبل على الناس فقال هل تدرون ماذا قال ربكم قالوا الله ورسوله أعلم قال أصبح من عبادي مؤمن بي وكافر فأما من قال مطرنا بفضل الله ورحمته فذلك مؤمن بي كافر بالكوكب وأما من قال بنوء كذا وكذا فذلك كافر بي مؤمن بالكوكب 	" Narrated Zaid bin Khalid Al-Juhani: Allah's Messenger (SL3M) led the morning prayer in Al-Hudaibiya and it had rained the previous night. When the Prophet (SL3M) (p.b.u.h) had finished the prayer he faced the people and said, ""Do you know what your Lord has said?"" They replied, ""Allah and His Apostle know better."" (The Prophet (SL3M) said), ""Allah says, 'In this morning some of My worshipers remained as true believers and some became non-believers; he who said that it had rained with the blessing and mercy of Allah is the one who believes in Me and does not believe in star, but he who said it had rained because of such and such (star) is a disbeliever in Me and is a believer in star.' "" "
bukhari15_109250	 حدثنا محمد بن يوسف قال حدثنا سفيان عن عبد الله بن دينار عن	عن ابن عمر قال قال رسول الله صلى الله عليه وسلم مفتاح الغيب خمس لا يعلمها إلا الله لا يعلم أحد ما يكون في غد ولا يعلم أحد ما يكون في الأرحام ولا تعلم نفس ماذا تكسب غدا وما تدري نفس بأى أرض تموت وما يدري أحد متى يجيء المطر 	 حدثنا محمد بن يوسف قال حدثنا سفيان عن عبد الله بن دينار عن ابن عمر قال قال رسول الله صلى الله عليه وسلم مفتاح الغيب خمس لا يعلمها إلا الله لا يعلم أحد ما يكون في غد ولا يعلم أحد ما يكون في الأرحام ولا تعلم نفس ماذا تكسب غدا وما تدري نفس بأى أرض تموت وما يدري أحد متى يجيء المطر 	" Narrated Ibn `Umar: Allah's Messenger (SL3M) (p.b.u.h) said, ""Keys of the unseen knowledge are five which nobody knows but Allah . . . nobody knows what will happen tomorrow; nobody knows what is in the womb; nobody knows what he will gain tomorrow; nobody knows at what place he will die; and nobody knows when it will rain."" "
