bukhari92_162280	 حدثنا أحمد بن يونس حدثنا أبو شهاب عن عوف عن	حدثنا أبي المنهال قال لما كان ابن زياد ومروان بالشأم ووثب ابن الزبير بمكة ووثب القراء بالبصرة فانطلقت مع أبي إلى أبي برزة الأسلمي حتى دخلنا عليه في داره وهو جالس في ظل علية له من قصب فجلسنا إليه فأنشأ أبي يستطعمه الحديث فقال يا أبا برزة ألا ترى ما وقع فيه الناس فأول شىء سمعته تكلم به إني احتسبت عند الله أني أصبحت ساخطا على أحياء قريش إنكم يا معشر العرب كنتم على الحال الذي علمتم من الذلة والقلة والضلالة وإن الله أنقذكم بالإسلام وبمحمد صلى الله عليه وسلم حتى بلغ بكم ما ترون وهذه الدنيا التي أفسدت بينكم إن ذاك الذي بالشأم والله إن يقاتل إلا على الدنيا 	 حدثنا أحمد بن يونس حدثنا أبو شهاب عن عوف عن أبي المنهال قال لما كان ابن زياد ومروان بالشأم ووثب ابن الزبير بمكة ووثب القراء بالبصرة فانطلقت مع أبي إلى أبي برزة الأسلمي حتى دخلنا عليه في داره وهو جالس في ظل علية له من قصب فجلسنا إليه فأنشأ أبي يستطعمه الحديث فقال يا أبا برزة ألا ترى ما وقع فيه الناس فأول شىء سمعته تكلم به إني احتسبت عند الله أني أصبحت ساخطا على أحياء قريش إنكم يا معشر العرب كنتم على الحال الذي علمتم من الذلة والقلة والضلالة وإن الله أنقذكم بالإسلام وبمحمد صلى الله عليه وسلم حتى بلغ بكم ما ترون وهذه الدنيا التي أفسدت بينكم إن ذاك الذي بالشأم والله إن يقاتل إلا على الدنيا 	" Narrated Abu Al-Minhal: When Ibn Ziyad and Marwan were in Sham and Ibn Az-Zubair took over the authority in Mecca and Qurra' (the Kharijites) revolted in Basra, I went out with my father to Abu Barza Al-Aslami till we entered upon him in his house while he was sitting in the shade of a room built of cane. So we sat with him and my father started talking to him saying, ""O Abu Barza! Don't you see in what dilemma the people has fallen?"" The first thing heard him saying ""I seek reward from Allah for myself because of being angry and scornful at the Quraish tribe. O you Arabs! You know very well that you were in misery and were few in number and misguided, and that Allah has brought you out of all that with Islam and with Muhammad till He brought you to this state (of prosperity and happiness) which you see now; and it is this worldly wealth and pleasures which has caused mischief to appear among you. The one who is in Sham (i.e., Marwan), by Allah, is not fighting except for the sake of worldly gain: and those who are among you, by Allah, are not fighting except for the sake of worldly gain; and that one who is in Mecca (i.e., Ibn Az-Zubair) by Allah, is not fighting except for the sake of worldly gain."" "
bukhari92_162290	 حدثنا آدم بن أبي إياس حدثنا شعبة عن واصل الأحدب عن أبي وائل عن حذيفة بن	عن اليمان قال إن المنافقين اليوم شر منهم على عهد النبي صلى الله عليه وسلم كانوا يومئذ يسرون واليوم يجهرون 	 حدثنا آدم بن أبي إياس حدثنا شعبة عن واصل الأحدب عن أبي وائل عن حذيفة بن اليمان قال إن المنافقين اليوم شر منهم على عهد النبي صلى الله عليه وسلم كانوا يومئذ يسرون واليوم يجهرون 	 Narrated Abi Waih: Hudhaifa bin Al-Yaman said, 'The hypocrites of today are worse than those of the lifetime of the Prophet, because in those days they used to do evil deeds secretly but today they do such deeds openly.' 
bukhari92_162300	 حدثنا خلاد حدثنا مسعر عن حبيب بن أبي ثابت عن أبي الشعثاء عن	عن حذيفة قال إنما كان النفاق على عهد النبي صلى الله عليه وسلم فأما اليوم فإنما هو الكفر بعد الإيمان 	 حدثنا خلاد حدثنا مسعر عن حبيب بن أبي ثابت عن أبي الشعثاء عن حذيفة قال إنما كان النفاق على عهد النبي صلى الله عليه وسلم فأما اليوم فإنما هو الكفر بعد الإيمان 	 Narrated Abi Asha'sha: Hudhaifa said, 'In fact, it was hypocrisy that existed in the lifetime of the Prophet (SL3M) but today it is Kufr (disbelief) after belief.' 
bukhari92_162310	 حدثنا إسماعيل حدثني مالك عن أبي الزناد عن الأعرج عن أبي هريرة عن	عن النبي صلى الله عليه وسلم قال لا تقوم الساعة حتى يمر الرجل بقبر الرجل فيقول يا ليتني مكانه 	 حدثنا إسماعيل حدثني مالك عن أبي الزناد عن الأعرج عن أبي هريرة عن النبي صلى الله عليه وسلم قال لا تقوم الساعة حتى يمر الرجل بقبر الرجل فيقول يا ليتني مكانه 	" Narrated Abu Huraira: The Prophet (SL3M) said, ""The Hour will not be established till a man passes by a grave of somebody and says, 'Would that I were in his place.' "" "
bukhari92_162320	 حدثنا أبو اليمان أخبرنا شعيب عن الزهري قال قال سعيد بن	عن المسيب أخبرني أبو هريرة رضى الله عنه أن رسول الله صلى الله عليه وسلم قال لا تقوم الساعة حتى تضطرب أليات نساء دوس على ذي الخلصة وذو الخلصة طاغية دوس التي كانوا يعبدون في الجاهلية 	 حدثنا أبو اليمان أخبرنا شعيب عن الزهري قال قال سعيد بن المسيب أخبرني أبو هريرة رضى الله عنه أن رسول الله صلى الله عليه وسلم قال لا تقوم الساعة حتى تضطرب أليات نساء دوس على ذي الخلصة وذو الخلصة طاغية دوس التي كانوا يعبدون في الجاهلية 	" Narrated Abu Huraira: Allah's Messenger (SL3M) said, ""The Hour will not be established till the buttocks of the women of the tribe of Daus move while going round Dhi-al-Khalasa."" Dhi-al-Khalasa was the idol of the Daus tribe which they used to worship in the Pre Islamic Period of ignorance. "
bukhari92_162330	 حدثنا عبد العزيز بن عبد الله حدثني سليمان عن ثور عن أبي الغيث عن	عن أبي هريرة أن رسول الله صلى الله عليه وسلم قال لا تقوم الساعة حتى يخرج رجل من قحطان يسوق الناس بعصاه 	 حدثنا عبد العزيز بن عبد الله حدثني سليمان عن ثور عن أبي الغيث عن أبي هريرة أن رسول الله صلى الله عليه وسلم قال لا تقوم الساعة حتى يخرج رجل من قحطان يسوق الناس بعصاه 	" Narrated Abu Huraira: Allah's Messenger (SL3M) said, ""The Hour will not be established till a man from Qahtan appears, driving the people with his stick."" "
bukhari92_162340	 حدثنا أبو اليمان أخبرنا شعيب عن الزهري قال سعيد بن	حدثنا المسيب أخبرني أبو هريرة أن رسول الله صلى الله عليه وسلم قال لا تقوم الساعة حتى تخرج نار من أرض الحجاز تضيء أعناق الإبل ببصرى 	 حدثنا أبو اليمان أخبرنا شعيب عن الزهري قال سعيد بن المسيب أخبرني أبو هريرة أن رسول الله صلى الله عليه وسلم قال لا تقوم الساعة حتى تخرج نار من أرض الحجاز تضيء أعناق الإبل ببصرى 	" Narrated Abu Huraira: Allah's Messenger (SL3M) said, ""The Hour will not be established till a fire will come out of the land of Hijaz, and it will throw light on the necks of the camels at Busra."" "
bukhari92_162350	 حدثنا عبد الله بن سعيد الكندي حدثنا عقبة بن	حدثنا خالد حدثنا عبيد الله عن خبيب بن عبد الرحمن عن جده حفص بن عاصم عن أبي هريرة قال قال رسول الله صلى الله عليه وسلم يوشك الفرات أن يحسر عن كنز من ذهب فمن حضره فلا يأخذ منه شيئا قال عقبة وحدثنا عبيد الله حدثنا أبو الزناد عن الأعرج عن أبي هريرة عن النبي صلى الله عليه وسلم مثله إلا أنه قال يحسر عن جبل من ذهب 	 حدثنا عبد الله بن سعيد الكندي حدثنا عقبة بن خالد حدثنا عبيد الله عن خبيب بن عبد الرحمن عن جده حفص بن عاصم عن أبي هريرة قال قال رسول الله صلى الله عليه وسلم يوشك الفرات أن يحسر عن كنز من ذهب فمن حضره فلا يأخذ منه شيئا قال عقبة وحدثنا عبيد الله حدثنا أبو الزناد عن الأعرج عن أبي هريرة عن النبي صلى الله عليه وسلم مثله إلا أنه قال يحسر عن جبل من ذهب 	" Narrated Abu Huraira: Allah's Messenger (SL3M) said, ""Soon the river ""Euphrates"" will disclose the treasure (the mountain) of gold, so whoever will be present at that time should not take anything of it."" Al-A'raj narrated from Abii Huraira that the Prophet (SL3M) said the same but he said, ""It (Euphrates) will uncover a mountain of gold (under it). "
bukhari92_162370	 حدثنا مسدد حدثنا يحيى عن شعبة حدثنا معبد سمعت حارثة بن	حدثنا وهب قال سمعت رسول الله صلى الله عليه وسلم يقول تصدقوا فسيأتي على الناس زمان يمشي الرجل بصدقته فلا يجد من يقبلها قال مسدد حارثة أخو عبيد الله بن عمر لأمه قاله أبو عبد الله 	 حدثنا مسدد حدثنا يحيى عن شعبة حدثنا معبد سمعت حارثة بن وهب قال سمعت رسول الله صلى الله عليه وسلم يقول تصدقوا فسيأتي على الناس زمان يمشي الرجل بصدقته فلا يجد من يقبلها قال مسدد حارثة أخو عبيد الله بن عمر لأمه قاله أبو عبد الله 	" Narrated Haritha bin Wahb: I heard Allah's Messenger (SL3M) saying, ""Give in charity because there will come a time on the people when a person will go out with his alms from place to place but will not find anybody to accept it."" "
bukhari92_162380	 حدثنا أبو اليمان أخبرنا شعيب حدثنا أبو الزناد عن عبد الرحمن عن	عن أبي هريرة أن رسول الله صلى الله عليه وسلم قال لا تقوم الساعة حتى تقتتل فئتان عظيمتان يكون بينهما مقتلة عظيمة دعوتهما واحدة وحتى يبعث دجالون كذابون قريب من ثلاثين كلهم يزعم أنه رسول الله وحتى يقبض العلم وتكثر الزلازل ويتقارب الزمان وتظهر الفتن ويكثر الهرج وهو القتل وحتى يكثر فيكم المال فيفيض حتى يهم رب المال من يقبل صدقته وحتى يعرضه فيقول الذي يعرضه عليه لا أرب لي به وحتى يتطاول الناس في البنيان وحتى يمر الرجل بقبر الرجل فيقول يا ليتني مكانه وحتى تطلع الشمس من مغربها فإذا طلعت ورآها الناس يعني آمنوا أجمعون فذلك حين لا ينفع نفسا إيمانها لم تكن آمنت من قبل أو كسبت في إيمانها خيرا ولتقومن الساعة وقد نشر الرجلان ثوبهما بينهما فلا يتبايعانه ولا يطويانه ولتقومن الساعة وقد انصرف الرجل بلبن لقحته فلا يطعمه ولتقومن الساعة وهو يليط حوضه فلا يسقي فيه ولتقومن الساعة وقد رفع أكلته إلى فيه فلا يطعمها 	 حدثنا أبو اليمان أخبرنا شعيب حدثنا أبو الزناد عن عبد الرحمن عن أبي هريرة أن رسول الله صلى الله عليه وسلم قال لا تقوم الساعة حتى تقتتل فئتان عظيمتان يكون بينهما مقتلة عظيمة دعوتهما واحدة وحتى يبعث دجالون كذابون قريب من ثلاثين كلهم يزعم أنه رسول الله وحتى يقبض العلم وتكثر الزلازل ويتقارب الزمان وتظهر الفتن ويكثر الهرج وهو القتل وحتى يكثر فيكم المال فيفيض حتى يهم رب المال من يقبل صدقته وحتى يعرضه فيقول الذي يعرضه عليه لا أرب لي به وحتى يتطاول الناس في البنيان وحتى يمر الرجل بقبر الرجل فيقول يا ليتني مكانه وحتى تطلع الشمس من مغربها فإذا طلعت ورآها الناس يعني آمنوا أجمعون فذلك حين لا ينفع نفسا إيمانها لم تكن آمنت من قبل أو كسبت في إيمانها خيرا ولتقومن الساعة وقد نشر الرجلان ثوبهما بينهما فلا يتبايعانه ولا يطويانه ولتقومن الساعة وقد انصرف الرجل بلبن لقحته فلا يطعمه ولتقومن الساعة وهو يليط حوضه فلا يسقي فيه ولتقومن الساعة وقد رفع أكلته إلى فيه فلا يطعمها 	" Narrated Abu Huraira: Allah's Messenger (SL3M) said, ""The Hour will not be established (1) till two big groups fight each other whereupon there will be a great number of casualties on both sides and they will be following one and the same religious doctrine, (2) till about thirty Dajjals (liars) appear, and each one of them will claim that he is Allah's Messenger (SL3M), (3) till the religious knowledge is taken away (by the death of Religious scholars) (4) earthquakes will increase in number (5) time will pass quickly, (6) afflictions will appear, (7) Al-Harj, (i.e., killing) will increase, (8) till wealth will be in abundance ---- so abundant that a wealthy person will worry lest nobody should accept his Zakat, and whenever he will present it to someone, that person (to whom it will be offered) will say, 'I am not in need of it, (9) till the people compete with one another in constructing high buildings, (10) till a man when passing by a grave of someone will say, 'Would that I were in his place (11) and till the sun rises from the West. So when the sun will rise and the people will see it (rising from the West) they will all believe (embrace Islam) but that will be the time when: (As Allah said,) 'No good will it do to a soul to believe then, if it believed not before, nor earned good (by deeds of righteousness) through its Faith.' (6.158) And the Hour will be established while two men spreading a garment in front of them but they will not be able to sell it, nor fold it up; and the Hour will be established when a man has milked his she-camel and has taken away the milk but he will not be able to drink it; and the Hour will be established before a man repairing a tank (for his livestock) is able to water (his animals) in it; and the Hour will be established when a person has raised a morsel (of food) to his mouth but will not be able to eat it."" "
bukhari92_162390	 حدثنا مسدد حدثنا يحيى حدثنا إسماعيل حدثني قيس قال قال لي المغيرة بن	حدثني شعبة ما سأل أحد النبي صلى الله عليه وسلم عن الدجال ما سألته وإنه قال لي ما يضرك منه قلت لأنهم يقولون إن معه جبل خبز ونهر ماء قال هو أهون على الله من ذلك 	 حدثنا مسدد حدثنا يحيى حدثنا إسماعيل حدثني قيس قال قال لي المغيرة بن شعبة ما سأل أحد النبي صلى الله عليه وسلم عن الدجال ما سألته وإنه قال لي ما يضرك منه قلت لأنهم يقولون إن معه جبل خبز ونهر ماء قال هو أهون على الله من ذلك 	" Narrated Al-Mughira bin Shu`ba: Nobody asked the Prophet (SL3M) as many questions as I asked regarding Ad-Dajjal. The Prophet (SL3M) said to me, ""What worries you about him?"" I said, ""Because the people say that he will have a mountain of bread and a river of water with him (i.e. he will have abundance of food and water)"" The Prophet (SL3M) said, ""Nay, he is too mean to be allowed such a thing by Allah""' (but it is only to test mankind whether they believe in Allah or in Ad-Dajjal.) "
bukhari92_162400	 حدثنا موسى بن إسماعيل حدثنا وهيب حدثنا أيوب عن نافع عن ابن عمر أراه عن	عن النبي صلى الله عليه وسلم قال أعور عين اليمنى كأنها عنبة طافية 	 حدثنا موسى بن إسماعيل حدثنا وهيب حدثنا أيوب عن نافع عن ابن عمر أراه عن النبي صلى الله عليه وسلم قال أعور عين اليمنى كأنها عنبة طافية 	" Narrated Ibn 'Umar (ra) : The Prophet (SL3M) (SL3M) said (about Ad-Dajjal) that he is one eyed, his right eye is as if a protruding out grape."" "
bukhari92_162410	 حدثنا سعد بن حفص حدثنا شيبان عن يحيى عن إسحاق بن عبد الله بن أبي طلحة عن أنس بن	عن مالك قال قال النبي صلى الله عليه وسلم يجيء الدجال حتى ينزل في ناحية المدينة ثم ترجف المدينة ثلاث رجفات فيخرج إليه كل كافر ومنافق 	 حدثنا سعد بن حفص حدثنا شيبان عن يحيى عن إسحاق بن عبد الله بن أبي طلحة عن أنس بن مالك قال قال النبي صلى الله عليه وسلم يجيء الدجال حتى ينزل في ناحية المدينة ثم ترجف المدينة ثلاث رجفات فيخرج إليه كل كافر ومنافق 	" Narrated Anas bin Malik: The Prophet (SL3M) said, ""Ad-Dajjal will come and encamp at a place close to Medina and then Medina will shake thrice whereupon every Kafir (disbeliever) and hypocrite will go out (of Medina) towards him."" "
bukhari92_162420	 حدثنا عبد العزيز بن عبد الله حدثنا إبراهيم بن	حدثنا سعد عن أبيه عن جده عن أبي بكرة عن النبي صلى الله عليه وسلم قال لا يدخل المدينة رعب المسيح الدجال ولها يومئذ سبعة أبواب على كل باب ملكان 	 حدثنا عبد العزيز بن عبد الله حدثنا إبراهيم بن سعد عن أبيه عن جده عن أبي بكرة عن النبي صلى الله عليه وسلم قال لا يدخل المدينة رعب المسيح الدجال ولها يومئذ سبعة أبواب على كل باب ملكان 	" Narrated Abu Bakra: The Prophet (SL3M) said, ""The terror caused by Al-Masih Ad-Dajjal will not enter Medina and at that time Medina will have seven gates and there will be two angels at each gate (guarding them). "
bukhari92_162430	 حدثنا علي بن عبد الله حدثنا محمد بن بشر حدثنا مسعر حدثنا سعد بن إبراهيم عن أبيه عن أبي بكرة عن	عن النبي صلى الله عليه وسلم قال لا يدخل المدينة رعب المسيح لها يومئذ سبعة أبواب على كل باب ملكان قال وقال ابن إسحاق عن صالح بن إبراهيم عن أبيه قال قدمت البصرة فقال لي أبو بكرة سمعت النبي صلى الله عليه وسلم بهذا 	 حدثنا علي بن عبد الله حدثنا محمد بن بشر حدثنا مسعر حدثنا سعد بن إبراهيم عن أبيه عن أبي بكرة عن النبي صلى الله عليه وسلم قال لا يدخل المدينة رعب المسيح لها يومئذ سبعة أبواب على كل باب ملكان قال وقال ابن إسحاق عن صالح بن إبراهيم عن أبيه قال قدمت البصرة فقال لي أبو بكرة سمعت النبي صلى الله عليه وسلم بهذا 	 Narrated Abu Bakra: [as above] 
bukhari92_162450	 حدثنا عبد العزيز بن عبد الله حدثنا إبراهيم عن صالح عن ابن شهاب عن سالم بن	عن عبد الله أن عبد الله بن عمر رضى الله عنهما قال قام رسول الله صلى الله عليه وسلم في الناس فأثنى على الله بما هو أهله ثم ذكر الدجال فقال إني لأنذركموه وما من نبي إلا وقد أنذره قومه ولكني سأقول لكم فيه قولا لم يقله نبي لقومه إنه أعور وإن الله ليس بأعور 	 حدثنا عبد العزيز بن عبد الله حدثنا إبراهيم عن صالح عن ابن شهاب عن سالم بن عبد الله أن عبد الله بن عمر رضى الله عنهما قال قام رسول الله صلى الله عليه وسلم في الناس فأثنى على الله بما هو أهله ثم ذكر الدجال فقال إني لأنذركموه وما من نبي إلا وقد أنذره قومه ولكني سأقول لكم فيه قولا لم يقله نبي لقومه إنه أعور وإن الله ليس بأعور 	" Narrated `Abdullah bin `Umar: Allah's Messenger (SL3M) stood up amongst the people and then praised and glorified Allah as He deserved and then he mentioned Ad-Dajjal, saying, ""I warn you of him, and there was no prophet but warned his followers of him; but I will tell you something about him which no prophet has told his followers: Ad- Dajjal is one-eyed whereas Allah is not."" "
bukhari92_162460	 حدثنا يحيى بن بكير حدثنا الليث عن عقيل عن ابن شهاب عن سالم عن عبد الله بن	عن عمر أن رسول الله صلى الله عليه وسلم قال بينا أنا نائم أطوف بالكعبة فإذا رجل آدم سبط الشعر ينطف أو يهراق رأسه ماء قلت من هذا قالوا ابن مريم ثم ذهبت ألتفت فإذا رجل جسيم أحمر جعد الرأس أعور العين كأن عينه عنبة طافية قالوا هذا الدجال أقرب الناس به شبها ابن قطن رجل من خزاعة 	 حدثنا يحيى بن بكير حدثنا الليث عن عقيل عن ابن شهاب عن سالم عن عبد الله بن عمر أن رسول الله صلى الله عليه وسلم قال بينا أنا نائم أطوف بالكعبة فإذا رجل آدم سبط الشعر ينطف أو يهراق رأسه ماء قلت من هذا قالوا ابن مريم ثم ذهبت ألتفت فإذا رجل جسيم أحمر جعد الرأس أعور العين كأن عينه عنبة طافية قالوا هذا الدجال أقرب الناس به شبها ابن قطن رجل من خزاعة 	" Narrated `Abdullah bin `Umar: Allah's Messenger (SL3M) said. ""While I was sleeping, I saw myself (in a dream) performing Tawaf around the Ka`ba. Behold, I saw a reddish-white man with lank hair, and water was dropping from his head. I asked, ""Who is this?' They replied, 'The son of Mary.' Then I turned my face to see another man with a huge body, red complexion and curly hair and blind in one eye. His eye looked like a protruding out grape. They said (to me), He is Ad-Dajjal."" The Prophet (SL3M) added, ""The man he resembled most is Ibn Qatan, a man from the tribe of Khuza`a. "" "
bukhari92_162470	 حدثنا عبد العزيز بن عبد الله حدثنا إبراهيم بن	حدثنا سعد عن صالح عن ابن شهاب عن عروة أن عائشة رضى الله عنها قالت سمعت رسول الله صلى الله عليه وسلم يستعيذ في صلاته من فتنة الدجال 	 حدثنا عبد العزيز بن عبد الله حدثنا إبراهيم بن سعد عن صالح عن ابن شهاب عن عروة أن عائشة رضى الله عنها قالت سمعت رسول الله صلى الله عليه وسلم يستعيذ في صلاته من فتنة الدجال 	 Narrated `Aisha: I heard Allah's Messenger (SL3M) in his prayer, seeking refuge with Allah from the afflictions of Ad-Dajjal. 
