ibnmajah26_1332400	 حدثنا نصر بن علي الجهضمي حدثني أبي ح وحدثنا محمد بن بشار حدثنا محمد بن	حدثني جعفر قالا حدثنا شعبة سمعت قتادة يحدث عن أنس بن مالك أن رسول الله صلى الله عليه وسلم كان يضحي بكبشين أملحين أقرنين ويسمي ويكبر ولقد رأيته يذبح بيده واضعا قدمه على صفاحهما 	 حدثنا نصر بن علي الجهضمي حدثني أبي ح وحدثنا محمد بن بشار حدثنا محمد بن جعفر قالا حدثنا شعبة سمعت قتادة يحدث عن أنس بن مالك أن رسول الله صلى الله عليه وسلم كان يضحي بكبشين أملحين أقرنين ويسمي ويكبر ولقد رأيته يذبح بيده واضعا قدمه على صفاحهما 	 It wasnarrated from Anas bin Malik: “The Messenger of Allah (SL3M)used tosacrifice two horned, black-and-white rams and he would saythe Nameof Allah and pronounce His greatness. I saw him slaughteringthemwith his own hand, putting his foot on their sides.” 
ibnmajah26_1332410	 حدثنا هشام بن عمار حدثنا إسماعيل بن عياش حدثنا محمد بن إسحاق عن يزيد بن أبي حبيب عن أبي عياش الزرقي عن جابر بن	عن عبد الله قال ضحى رسول الله صلى الله عليه وسلم يوم عيد بكبشين فقال حين وجههما إني وجهت وجهي للذي فطر السموات والأرض حنيفا وما أنا من المشركين إن صلاتي ونسكي ومحياى ومماتي لله رب العالمين لا شريك له وبذلك أمرت وأنا أول المسلمين اللهم منك ولك عن محمد وأمته 	 حدثنا هشام بن عمار حدثنا إسماعيل بن عياش حدثنا محمد بن إسحاق عن يزيد بن أبي حبيب عن أبي عياش الزرقي عن جابر بن عبد الله قال ضحى رسول الله صلى الله عليه وسلم يوم عيد بكبشين فقال حين وجههما إني وجهت وجهي للذي فطر السموات والأرض حنيفا وما أنا من المشركين إن صلاتي ونسكي ومحياى ومماتي لله رب العالمين لا شريك له وبذلك أمرت وأنا أول المسلمين اللهم منك ولك عن محمد وأمته 	 It wasnarrated that Jabir bin ‘Abdullah said: “The Messenger ofAllah(SL3M) sacrificed two rams on the Day of ‘Eid. When he turnedthemto face towards the prayer direction he said: ‘Verily, I haveturned my face towards Him Who has created the heavens and the earth,as a monotheist, and I am not of the polytheists. Verily, my prayer,my sacrifice, my living, and my dying are for Allah, the Lord of allthat exists. He has no partner. And of this I have been commanded,andI am the first of the Muslims. [6:79,162-163] O Allah, from YoutoYou, on behalf of Muhammad and his nation.’” 
ibnmajah26_1332420	 حدثنا محمد بن يحيى حدثنا عبد الرزاق أنبأنا سفيان الثوري عن عبد الله بن	حدثنا محمد بن عقيل عن أبي سلمة عن عائشة وعن أبي هريرة أن رسول الله صلى الله عليه وسلم كان إذا أراد أن يضحي اشترى كبشين عظيمين سمينين أقرنين أملحين موجوءين فذبح أحدهما عن أمته لمن شهد لله بالتوحيد وشهد له بالبلاغ وذبح الآخر عن محمد وعن آل محمد صلى الله عليه وسلم 	 حدثنا محمد بن يحيى حدثنا عبد الرزاق أنبأنا سفيان الثوري عن عبد الله بن محمد بن عقيل عن أبي سلمة عن عائشة وعن أبي هريرة أن رسول الله صلى الله عليه وسلم كان إذا أراد أن يضحي اشترى كبشين عظيمين سمينين أقرنين أملحين موجوءين فذبح أحدهما عن أمته لمن شهد لله بالتوحيد وشهد له بالبلاغ وذبح الآخر عن محمد وعن آل محمد صلى الله عليه وسلم 	 It wasnarrated from ‘Aishah and Abu Hurairah that when the MessengerofAllah (SL3M) wanted to offer a sacrifice, he brought two large, fat,horned, black-and-white, castrated rams. He slaughtered one on behalfof his nation, for whoever testified to Allah with monotheism andthathe had conveyed (the Message), and he slaughtered the other onbehalfof Muhammad and the family of Muhammad (SL3M). 
ibnmajah26_1332430	 حدثنا أبو بكر بن أبي شيبة حدثنا زيد بن	حدثنا الحباب حدثنا عبد الله بن عياش عن عبد الرحمن الأعرج عن أبي هريرة أن رسول الله صلى الله عليه وسلم قال من كان له سعة ولم يضح فلا يقربن مصلانا 	 حدثنا أبو بكر بن أبي شيبة حدثنا زيد بن الحباب حدثنا عبد الله بن عياش عن عبد الرحمن الأعرج عن أبي هريرة أن رسول الله صلى الله عليه وسلم قال من كان له سعة ولم يضح فلا يقربن مصلانا 	 It wasnarrated from Abu Hurairah that the Messenger of Allah (SL3M)said: “Whoever can afford it, but does not offer a sacrifice, let himnotcome near our prayer place.” 
ibnmajah26_1332440	 حدثنا هشام بن عمار حدثنا إسماعيل بن عياش حدثنا ابن عون عن محمد بن	حدثنا سيرين قال سألت ابن عمر عن الضحايا أواجبة هي قال ضحى رسول الله صلى الله عليه وسلم والمسلمون من بعده وجرت به السنة 	 حدثنا هشام بن عمار حدثنا إسماعيل بن عياش حدثنا ابن عون عن محمد بن سيرين قال سألت ابن عمر عن الضحايا أواجبة هي قال ضحى رسول الله صلى الله عليه وسلم والمسلمون من بعده وجرت به السنة 	 It wasnarrated that Muhammad bin Sirin said: “I asked Ibn ‘Umaraboutsacrifices and whether they are obligatory. He said: ‘TheMessengerof Allah (SL3M) and the Muslims after him offered sacrifices,and thisis the Sunnah.’” 
ibnmajah26_1332450	 حدثنا هشام بن عمار حدثنا إسماعيل بن عياش حدثنا الحجاج بن أرطاة حدثنا جبلة بن	حدثنا سحيم قال سألت ابن عمر فذكر مثله سواء 	 حدثنا هشام بن عمار حدثنا إسماعيل بن عياش حدثنا الحجاج بن أرطاة حدثنا جبلة بن سحيم قال سألت ابن عمر فذكر مثله سواء 	 
ibnmajah26_1332460	 حدثنا أبو بكر بن أبي شيبة حدثنا معاذ بن	حدثنا معاذ عن ابن عون قال أنبأنا أبو رملة عن مخنف بن سليم قال كنا وقوفا عند النبي صلى الله عليه وسلم بعرفة فقال يا أيها الناس إن على كل أهل بيت في كل عام أضحية وعتيرة أتدرون ما العتيرة هي التي يسميها الناس الرجبية 	 حدثنا أبو بكر بن أبي شيبة حدثنا معاذ بن معاذ عن ابن عون قال أنبأنا أبو رملة عن مخنف بن سليم قال كنا وقوفا عند النبي صلى الله عليه وسلم بعرفة فقال يا أيها الناس إن على كل أهل بيت في كل عام أضحية وعتيرة أتدرون ما العتيرة هي التي يسميها الناس الرجبية 	 It wasnarrated that Mikhnaf bin Sulaim said: “We were standing with theProphet (SL3M) at ‘Arafat and he said: ‘O people, each family,each year, must offer Udhiyah and ‘Atirah.’ 
ibnmajah26_1332470	 حدثنا عبد الرحمن بن إبراهيم الدمشقي حدثنا عبد الله بن	حدثنا نافع حدثني أبو المثنى عن هشام بن عروة عن أبيه عن عائشة أن النبي صلى الله عليه وسلم قال ما عمل ابن آدم يوم النحر عملا أحب إلى الله عز وجل من هراقة دم وإنه ليأتي يوم القيامة بقرونها وأظلافها وأشعارها وإن الدم ليقع من الله عز وجل بمكان قبل أن يقع على الأرض فطيبوا بها نفسا 	 حدثنا عبد الرحمن بن إبراهيم الدمشقي حدثنا عبد الله بن نافع حدثني أبو المثنى عن هشام بن عروة عن أبيه عن عائشة أن النبي صلى الله عليه وسلم قال ما عمل ابن آدم يوم النحر عملا أحب إلى الله عز وجل من هراقة دم وإنه ليأتي يوم القيامة بقرونها وأظلافها وأشعارها وإن الدم ليقع من الله عز وجل بمكان قبل أن يقع على الأرض فطيبوا بها نفسا 	 It wasnarrated from ’Aishah that the Prophet (SL3M) said: “The son ofAdam does not do any deed on the Day of Sacrifice that is dearer toAllah than shedding blood. It will come on the Day of Resurrectionwith its horns and cloven hoofs and hair. Its blood is accepted byAllah before it reaches the ground. So be content when you do it.” 
ibnmajah26_1332480	 حدثنا محمد بن خلف العسقلاني حدثنا آدم بن	حدثنا أبي إياس حدثنا سلام بن مسكين حدثنا عائذ الله عن أبي داود عن زيد بن أرقم قال قال أصحاب رسول الله صلى الله عليه وسلم يا رسول الله ما هذه الأضاحي قال سنة أبيكم إبراهيم قالوا فما لنا فيها يا رسول الله قال بكل شعرة حسنة قالوا فالصوف يا رسول الله قال بكل شعرة من الصوف حسنة 	 حدثنا محمد بن خلف العسقلاني حدثنا آدم بن أبي إياس حدثنا سلام بن مسكين حدثنا عائذ الله عن أبي داود عن زيد بن أرقم قال قال أصحاب رسول الله صلى الله عليه وسلم يا رسول الله ما هذه الأضاحي قال سنة أبيكم إبراهيم قالوا فما لنا فيها يا رسول الله قال بكل شعرة حسنة قالوا فالصوف يا رسول الله قال بكل شعرة من الصوف حسنة 	 It wasnarrated that Zaid bin Arqam said: “The Companions of theMessengerof Allah (SL3M) said: ‘O Messenger of Allah, what are thesesacrifices?’ He said: ‘The Sunnah of your father Ibrahim.’ Theysaid:‘What is there for us in them, O Messenger of Allah?’ Hesaid: ‘Forevery hair, one merit.’ They said: ‘What about wool,O Messenger ofAllah?’ He said: ‘For every hair of wool, onemerit.’” 
ibnmajah26_1332490	 حدثنا محمد بن عبد الله بن نمير حدثنا حفص بن	حدثنا غياث عن جعفر بن محمد عن أبيه عن أبي سعيد قال ضحى رسول الله صلى الله عليه وسلم بكبش أقرن فحيل يأكل في سواد ويمشي في سواد وينظر في سواد 	 حدثنا محمد بن عبد الله بن نمير حدثنا حفص بن غياث عن جعفر بن محمد عن أبيه عن أبي سعيد قال ضحى رسول الله صلى الله عليه وسلم بكبش أقرن فحيل يأكل في سواد ويمشي في سواد وينظر في سواد 	 It wasnarrated that Abu Sa’eed said: “The Messenger of Allah (SL3M)sacrificed a horned, defectless ram with a black stomach, black feetand black around its eyes.” 
ibnmajah26_1332500	 حدثنا عبد الرحمن بن إبراهيم حدثنا محمد بن	حدثنا شعيب أخبرني سعيد بن عبد العزيز حدثنا يونس بن ميسرة بن حلبس قال خرجنا مع أبي سعيد الزرقي صاحب رسول الله صلى الله عليه وسلم إلى شراء الضحايا قال يونس فأشار أبو سعيد إلى كبش أدغم ليس بالمرتفع ولا المتضع في جسمه فقال لي اشتر لي هذا كأنه شبهه بكبش رسول الله صلى الله عليه وسلم 	 حدثنا عبد الرحمن بن إبراهيم حدثنا محمد بن شعيب أخبرني سعيد بن عبد العزيز حدثنا يونس بن ميسرة بن حلبس قال خرجنا مع أبي سعيد الزرقي صاحب رسول الله صلى الله عليه وسلم إلى شراء الضحايا قال يونس فأشار أبو سعيد إلى كبش أدغم ليس بالمرتفع ولا المتضع في جسمه فقال لي اشتر لي هذا كأنه شبهه بكبش رسول الله صلى الله عليه وسلم 	 Yunusbin Maisarah bin Halbas said: “I went out with Abu Sa’eedAz-Zuraqi, the Companion of the Messenger of Allah (SL3M), to buyanimalsor sacrifice.” Yunus said: “Abu Sa’eed pointed to a ramthat had someblackness around its ears and jaw, and was neither toobig nor toosmall, and said to me: ‘Buy this one for them, as itseems to resemblethe ram of the Messenger of Allah (SL3M).’” 
ibnmajah26_1332510	 حدثنا العباس بن عثمان الدمشقي حدثنا الوليد بن مسلم حدثنا أبو عائذ أنه سمع سليم بن عامر يحدث عن	حدثنا أبي أمامة الباهلي أن رسول الله صلى الله عليه وسلم قال خير الكفن الحلة وخير الضحايا الكبش الأقرن 	 حدثنا العباس بن عثمان الدمشقي حدثنا الوليد بن مسلم حدثنا أبو عائذ أنه سمع سليم بن عامر يحدث عن أبي أمامة الباهلي أن رسول الله صلى الله عليه وسلم قال خير الكفن الحلة وخير الضحايا الكبش الأقرن 	 It wasnarrated from Abu Umamah Al-Bahili that the Messenger of Allah(SL3M)said: “The best of shrouds is a two piece Najrani garment andthebest of sacrifices is a horned ram.” 
ibnmajah26_1332520	 حدثنا هدية بن عبد الوهاب أنبأنا الفضل بن	حدثنا موسى أنبأنا الحسين بن واقد عن علباء بن أحمر عن عكرمة عن ابن عباس قال كنا مع رسول الله صلى الله عليه وسلم في سفر فحضر الأضحى فاشتركنا في الجزور عن عشرة والبقرة عن سبعة 	 حدثنا هدية بن عبد الوهاب أنبأنا الفضل بن موسى أنبأنا الحسين بن واقد عن علباء بن أحمر عن عكرمة عن ابن عباس قال كنا مع رسول الله صلى الله عليه وسلم في سفر فحضر الأضحى فاشتركنا في الجزور عن عشرة والبقرة عن سبعة 	 it wasnarrated that Ibn ‘Abbas said: “We were with the Messenger ofAllah (SL3M) on a journey, and the (day of) Al-Adha came. We(sacrificed) one camel on behalf of ten (people) and one cow onbehalfof seven.” 
ibnmajah26_1332530	 حدثنا محمد بن يحيى حدثنا عبد الرزاق عن مالك بن	حدثنا أنس عن أبي الزبير عن جابر قال نحرنا بالحديبية مع النبي صلى الله عليه وسلم البدنة عن سبعة والبقرة عن سبعة 	 حدثنا محمد بن يحيى حدثنا عبد الرزاق عن مالك بن أنس عن أبي الزبير عن جابر قال نحرنا بالحديبية مع النبي صلى الله عليه وسلم البدنة عن سبعة والبقرة عن سبعة 	 It wasnarrated that Jabir said: “We offered sacrifices at Al-Hudaibiyahwith the Prophet (SL3M), a camel on behalf of seven (people)and a cowon behalf of seven.” 
ibnmajah26_1332540	 حدثنا عبد الرحمن بن إبراهيم حدثنا الوليد بن مسلم حدثنا الأوزاعي عن يحيى بن أبي كثير عن أبي سلمة عن	عن أبي هريرة قال ذبح رسول الله صلى الله عليه وسلم عمن اعتمر من نسائه في حجة الوداع بقرة بينهن 	 حدثنا عبد الرحمن بن إبراهيم حدثنا الوليد بن مسلم حدثنا الأوزاعي عن يحيى بن أبي كثير عن أبي سلمة عن أبي هريرة قال ذبح رسول الله صلى الله عليه وسلم عمن اعتمر من نسائه في حجة الوداع بقرة بينهن 	 It wasnarrated that Abu Hurairah said: “The Messenger of Allah (SL3M)slaughtered a cow on behalf of all his wives who had performed‘Umrah,during the Farewell Pilgrimage.” 
ibnmajah26_1332550	 حدثنا هناد بن السري حدثنا أبو بكر بن عياش عن عمرو بن ميمون عن أبي حاضر الأزدي عن	عن ابن عباس قال قلت الإبل على عهد رسول الله صلى الله عليه وسلم فأمرهم أن ينحروا البقر 	 حدثنا هناد بن السري حدثنا أبو بكر بن عياش عن عمرو بن ميمون عن أبي حاضر الأزدي عن ابن عباس قال قلت الإبل على عهد رسول الله صلى الله عليه وسلم فأمرهم أن ينحروا البقر 	 It wasnarrated that Ibn ‘Abbas said: “Camels became scarce at thetimeof the Messenger of Allah (SL3M), so he commanded them tosacrificecows.” 
ibnmajah26_1332560	 حدثنا أحمد بن عمرو بن	حدثنا السرح المصري أبو طاهر أنبأنا ابن وهب أنبأنا يونس عن ابن شهاب عن عمرة عن عائشة أن رسول الله صلى الله عليه وسلم نحر عن آل محمد صلى الله عليه وسلم في حجة الوداع بقرة واحدة 	 حدثنا أحمد بن عمرو بن السرح المصري أبو طاهر أنبأنا ابن وهب أنبأنا يونس عن ابن شهاب عن عمرة عن عائشة أن رسول الله صلى الله عليه وسلم نحر عن آل محمد صلى الله عليه وسلم في حجة الوداع بقرة واحدة 	 It wasnarrated from ‘Aishah that the Messenger of Allah (SL3M)sacrificedone cow during the Farewell Pilgrimage on behalf of thefamily ofMuhammad (SL3M). 
ibnmajah26_1332570	 حدثنا محمد بن معمر حدثنا محمد بن بكر البرساني حدثنا ابن جريج قال قال عطاء الخراساني عن	حدثنا ابن عباس أن النبي صلى الله عليه وسلم أتاه رجل فقال إن على بدنة وأنا موسر بها ولا أجدها فأشتريها فأمره النبي صلى الله عليه وسلم أن يبتاع سبع شياه فيذبحهن 	 حدثنا محمد بن معمر حدثنا محمد بن بكر البرساني حدثنا ابن جريج قال قال عطاء الخراساني عن ابن عباس أن النبي صلى الله عليه وسلم أتاه رجل فقال إن على بدنة وأنا موسر بها ولا أجدها فأشتريها فأمره النبي صلى الله عليه وسلم أن يبتاع سبع شياه فيذبحهن 	 It wasnarrated from Ibn ‘Abbas that a man came to the Prophet (SL3M)andsaid: “I have to offer a sacrifice and I can afford it, but Icannot find (a camel) to buy.” The Prophet (SL3M) told him to buysevensheep and slaughter them. 
ibnmajah26_1332580	 حدثنا أبو كريب حدثنا المحاربي وعبد الرحيم عن سفيان الثوري عن سعيد بن مسروق وحدثنا الحسين بن	عن علي عن زائدة عن سعيد بن مسروق عن عباية بن رفاعة عن رافع بن خديج قال كنا مع رسول الله صلى الله عليه وسلم ونحن بذي الحليفة من تهامة فأصبنا إبلا وغنما فعجل القوم فأغلينا القدور قبل أن تقسم فأتانا رسول الله صلى الله عليه وسلم فأمر بها فأكفئت ثم عدل الجزور بعشرة من الغنم 	 حدثنا أبو كريب حدثنا المحاربي وعبد الرحيم عن سفيان الثوري عن سعيد بن مسروق وحدثنا الحسين بن علي عن زائدة عن سعيد بن مسروق عن عباية بن رفاعة عن رافع بن خديج قال كنا مع رسول الله صلى الله عليه وسلم ونحن بذي الحليفة من تهامة فأصبنا إبلا وغنما فعجل القوم فأغلينا القدور قبل أن تقسم فأتانا رسول الله صلى الله عليه وسلم فأمر بها فأكفئت ثم عدل الجزور بعشرة من الغنم 	 It wasnarrated that Rafi’ bin Khadij said: “We were with theMessengerof Allah (SL3M) in Dhul-Hulaifah in (the land of) Tihamah. Weacquiredsheep and camels and the people hastened to put cooking potson thefires before they had been distributed. The Messenger of Allah(SL3M)came to us and ordered that they be overturned,* then he madeonecamel equivalent to ten sheep.” 
ibnmajah26_1332590	 حدثنا محمد بن رمح أنبأنا الليث بن سعد عن يزيد بن أبي حبيب عن أبي الخير عن عقبة بن	عن عامر الجهني أن رسول الله صلى الله عليه وسلم أعطاه غنما فقسمها على أصحابه ضحايا فبقي عتود فذكره لرسول الله صلى الله عليه وسلم فقال ضح به أنت 	 حدثنا محمد بن رمح أنبأنا الليث بن سعد عن يزيد بن أبي حبيب عن أبي الخير عن عقبة بن عامر الجهني أن رسول الله صلى الله عليه وسلم أعطاه غنما فقسمها على أصحابه ضحايا فبقي عتود فذكره لرسول الله صلى الله عليه وسلم فقال ضح به أنت 	 It wasnarrated from ‘Uqbah bin ‘Amir Al-Juhani that the Messenger ofAllah (SL3M) gave him some sheep, and he distributed them among hisCompanions to be sacrificed. There remained an ‘Atud.* He mentionedthat to the Messenger of Allah (SL3M) and he said: “You sacrifice ityourself.” 
ibnmajah26_1332600	 حدثنا عبد الرحمن بن إبراهيم الدمشقي حدثنا أنس بن	حدثنا عياض حدثني محمد بن أبي يحيى مولى الأسلميين عن أمه قالت حدثتني أم بلال بنت هلال عن أبيها أن رسول الله صلى الله عليه وسلم قال يجوز الجذع من الضأن أضحية 	 حدثنا عبد الرحمن بن إبراهيم الدمشقي حدثنا أنس بن عياض حدثني محمد بن أبي يحيى مولى الأسلميين عن أمه قالت حدثتني أم بلال بنت هلال عن أبيها أن رسول الله صلى الله عليه وسلم قال يجوز الجذع من الضأن أضحية 	 UmmBilal bint Hilal narrated from her father that the Messenger ofAllah(SL3M) said: “It is permissible to offer a Jadha’a* among sheepasa sacrifice.” 
ibnmajah26_1332610	 حدثنا محمد بن يحيى حدثنا عبد الرزاق أنبأنا الثوري عن عاصم بن كليب عن	عن أبيه قال كنا مع رجل من أصحاب رسول الله صلى الله عليه وسلم يقال له مجاشع من بني سليم فعزت الغنم فأمر مناديا فنادى أن رسول الله صلى الله عليه وسلم كان يقول إن الجذع يوفي مما توفي منه الثنية 	 حدثنا محمد بن يحيى حدثنا عبد الرزاق أنبأنا الثوري عن عاصم بن كليب عن أبيه قال كنا مع رجل من أصحاب رسول الله صلى الله عليه وسلم يقال له مجاشع من بني سليم فعزت الغنم فأمر مناديا فنادى أن رسول الله صلى الله عليه وسلم كان يقول إن الجذع يوفي مما توفي منه الثنية 	 It wasnarrated from ‘Asim bin Kulaib that his father said: “We werewith a man from among the Companions of the Messenger of Allah (SL3M)who was called Mujashi’, from Banu Sulaim, and sheep became scarce.Heordered a caller to call out that the Messenger of Allah (SL3M)used tosay: ‘A Jadha’a suffices for whatever a two-year-oldsheep suffices.’” 
ibnmajah26_1332620	 حدثنا هارون بن حيان حدثنا عبد الرحمن بن	حدثنا عبد الله أنبأنا زهير عن أبي الزبير عن جابر قال قال رسول الله صلى الله عليه وسلم لا تذبحوا إلا مسنة إلا أن يعسر عليكم فتذبحوا جذعة من الضأن 	 حدثنا هارون بن حيان حدثنا عبد الرحمن بن عبد الله أنبأنا زهير عن أبي الزبير عن جابر قال قال رسول الله صلى الله عليه وسلم لا تذبحوا إلا مسنة إلا أن يعسر عليكم فتذبحوا جذعة من الضأن 	 It wasnarrated from Jabir that the Messenger of Allah (SL3M) said: ‘Do notslaughter anything but a Musinnah,* unless there is noneavailable,in which case you can slaughter a Jadha’a among sheep.” 
