ibnmajah26_1332630	 حدثنا محمد بن الصباح حدثنا أبو بكر بن عياش عن أبي إسحاق عن شريح بن النعمان عن	عن علي قال نهى رسول الله صلى الله عليه وسلم أن يضحى بمقابلة أو مدابرة أو شرقاء أو خرقاء أو جدعاء 	 حدثنا محمد بن الصباح حدثنا أبو بكر بن عياش عن أبي إسحاق عن شريح بن النعمان عن علي قال نهى رسول الله صلى الله عليه وسلم أن يضحى بمقابلة أو مدابرة أو شرقاء أو خرقاء أو جدعاء 	 It wasnarrated that ‘Ali said: “The Messenger of Allah (SL3M) forbadesacrificing the Muqabalah, the Mudabarah, the Sharqa’, the Kharqa’andthe Jad’a’.”* 
ibnmajah26_1332640	 حدثنا أبو بكر بن أبي شيبة حدثنا وكيع حدثنا سفيان عن سلمة بن كهيل عن حجية بن	حدثنا عدي عن علي قال أمرنا رسول الله صلى الله عليه وسلم أن نستشرف العين والأذن 	 حدثنا أبو بكر بن أبي شيبة حدثنا وكيع حدثنا سفيان عن سلمة بن كهيل عن حجية بن عدي عن علي قال أمرنا رسول الله صلى الله عليه وسلم أن نستشرف العين والأذن 	 It wasnarrated that ‘Ali said: “The Messenger of Allah (SL3M)commandedus to examine the eyes and ears.”* 
ibnmajah26_1332650	 حدثنا محمد بن بشار حدثنا يحيى بن سعيد ومحمد بن	حدثنا جعفر وعبد الرحمن وأبو داود وابن أبي عدي وأبو الوليد قالوا حدثنا شعبة سمعت سليمان بن عبد الرحمن قال سمعت عبيد بن فيروز قال قلت للبراء بن عازب حدثني بما كره أو نهى عنه رسول الله صلى الله عليه وسلم من الأضاحي فقال قال رسول الله صلى الله عليه وسلم هكذا بيده ويدي أقصر من يده أربع لا تجزئ في الأضاحي العوراء البين عورها والمريضة البين مرضها والعرجاء البين ظلعها والكسيرة التي لا تنقي قال فإني أكره أن يكون نقص في الأذن قال فما كرهت منه فدعه ولا تحرمه على أحد 	 حدثنا محمد بن بشار حدثنا يحيى بن سعيد ومحمد بن جعفر وعبد الرحمن وأبو داود وابن أبي عدي وأبو الوليد قالوا حدثنا شعبة سمعت سليمان بن عبد الرحمن قال سمعت عبيد بن فيروز قال قلت للبراء بن عازب حدثني بما كره أو نهى عنه رسول الله صلى الله عليه وسلم من الأضاحي فقال قال رسول الله صلى الله عليه وسلم هكذا بيده ويدي أقصر من يده أربع لا تجزئ في الأضاحي العوراء البين عورها والمريضة البين مرضها والعرجاء البين ظلعها والكسيرة التي لا تنقي قال فإني أكره أن يكون نقص في الأذن قال فما كرهت منه فدعه ولا تحرمه على أحد 	 Sulaimanbin ‘Abdur-Rahman said: “I heard ‘Ubaid bin Fairuz say: ‘Isaid to Bara’ bin ‘Azib: “Tell us of the sacrificial animalsthat theMessenger of Allah (SL3M) disliked or forbade.” He said:“Allah’sMessenger (SL3M) said like this with his hand. And myhand is shorterthan his hand:* ‘There are four that will not beaccepted assacrifices: The one-eyed animal that is obviously blindin one eye;the sick animal that is obviously sick; the lame animalwith anobvious limp; and the animal that is so emaciated that it isas ifthere is no marrow in its bones.’” He said:** “And Idislike that theanimal should have some fault in its ears.” Hesaid: “What youdislike, forget about it and do not make itforbidden to anyone.” 
ibnmajah26_1332660	 حدثنا حميد بن مسعدة حدثنا خالد بن الحارث حدثنا سعيد عن قتادة أنه ذكر أنه سمع جرى بن	حدثنا كليب يحدث أنه سمع عليا يحدث أن رسول الله صلى الله عليه وسلم نهى أن يضحى بأعضب القرن والأذن 	 حدثنا حميد بن مسعدة حدثنا خالد بن الحارث حدثنا سعيد عن قتادة أنه ذكر أنه سمع جرى بن كليب يحدث أنه سمع عليا يحدث أن رسول الله صلى الله عليه وسلم نهى أن يضحى بأعضب القرن والأذن 	 It wasnarrated from Qatadah that he said that he heard Juray binKulaibnarrate that he heard ‘Ali narrate that the Messenger of Allah(SL3M) forbade sacrificing animals with broken horns and ears. 
ibnmajah26_1332670	 حدثنا محمد بن يحيى ومحمد بن	حدثنا عبد الملك أبو بكر قالا حدثنا عبد الرزاق عن الثوري عن جابر بن يزيد عن محمد بن قرظة الأنصاري عن أبي سعيد الخدري قال ابتعنا كبشا نضحي به فأصاب الذئب من أليته أو أذنه فسألنا النبي صلى الله عليه وسلم فأمرنا أن نضحي به 	 حدثنا محمد بن يحيى ومحمد بن عبد الملك أبو بكر قالا حدثنا عبد الرزاق عن الثوري عن جابر بن يزيد عن محمد بن قرظة الأنصاري عن أبي سعيد الخدري قال ابتعنا كبشا نضحي به فأصاب الذئب من أليته أو أذنه فسألنا النبي صلى الله عليه وسلم فأمرنا أن نضحي به 	 It wasnarrated that Abu Sa’eed Al-Khudri said: “We bought a ram forsacrifice, then a wolf tore some flesh from its rump and ears. Weasked the Prophet (SL3M) and he told us to offer it as a sacrifice.” 
ibnmajah26_1332680	 حدثنا عبد الرحمن بن إبراهيم حدثنا ابن أبي فديك حدثني الضحاك بن عثمان عن عمارة بن عبد الله بن	حدثني صياد عن عطاء بن يسار قال سألت أبا أيوب الأنصاري كيف كانت الضحايا فيكم على عهد رسول الله صلى الله عليه وسلم قال كان الرجل في عهد النبي صلى الله عليه وسلم يضحي بالشاة عنه وعن أهل بيته فيأكلون ويطعمون ثم تباهى الناس فصار كما ترى 	 حدثنا عبد الرحمن بن إبراهيم حدثنا ابن أبي فديك حدثني الضحاك بن عثمان عن عمارة بن عبد الله بن صياد عن عطاء بن يسار قال سألت أبا أيوب الأنصاري كيف كانت الضحايا فيكم على عهد رسول الله صلى الله عليه وسلم قال كان الرجل في عهد النبي صلى الله عليه وسلم يضحي بالشاة عنه وعن أهل بيته فيأكلون ويطعمون ثم تباهى الناس فصار كما ترى 	 It wasnarrated that ‘Ata’ bin Yasar said: “I asked Abu AyyubAl-Ansari: ‘How were sacrifices offered among you at the time oftheMessenger of Allah (SL3M)?’ He said: ‘At the time of theProphet (SL3M),a man would sacrifice a sheep on behalf of himself andthe members ofhis household, and they would eat some of it and givesome to others.Then people started to compete and it because as yousee (nowadays).’” 
ibnmajah26_1332690	 حدثنا إسحاق بن منصور أنبأنا عبد الرحمن بن	حدثنا مهدي ومحمد بن يوسف ح وحدثنا محمد بن يحيى حدثنا عبد الرزاق جميعا عن سفيان الثوري عن بيان عن الشعبي عن أبي سريحة قال حملني أهلي على الجفاء بعدما علمت من السنة كان أهل البيت يضحون بالشاة والشاتين والآن يبخلنا جيراننا 	 حدثنا إسحاق بن منصور أنبأنا عبد الرحمن بن مهدي ومحمد بن يوسف ح وحدثنا محمد بن يحيى حدثنا عبد الرزاق جميعا عن سفيان الثوري عن بيان عن الشعبي عن أبي سريحة قال حملني أهلي على الجفاء بعدما علمت من السنة كان أهل البيت يضحون بالشاة والشاتين والآن يبخلنا جيراننا 	 It wasnarrated that Abu Sarihah said: “My family started to putpressureon me after I came to know the Sunnah. People used tosacrifice oneor two sheep, but now our neighbors call us stingy.” 
ibnmajah26_1332700	 حدثنا هارون بن عبد الله الحمال حدثنا سفيان بن	حدثنا عيينة عن عبد الرحمن بن حميد بن عبد الرحمن بن عوف عن سعيد بن المسيب عن أم سلمة أن النبي صلى الله عليه وسلم قال إذا دخل العشر وأراد أحدكم أن يضحي فلا يمس من شعره ولا بشره شيئا 	 حدثنا هارون بن عبد الله الحمال حدثنا سفيان بن عيينة عن عبد الرحمن بن حميد بن عبد الرحمن بن عوف عن سعيد بن المسيب عن أم سلمة أن النبي صلى الله عليه وسلم قال إذا دخل العشر وأراد أحدكم أن يضحي فلا يمس من شعره ولا بشره شيئا 	 It wasnarrated from Umm Salamah that the Prophet (SL3M) said: “Whentheten days (of Dhul-Hijjah) begin, and one of you wants to offer asacrifice, let him not remove anything from his hair or skin.” 
ibnmajah26_1332710	 حدثنا حاتم بن بكر الضبي أبو عمرو حدثنا محمد بن	حدثنا بكر البرساني ح وحدثنا محمد بن سعيد بن يزيد بن إبراهيم حدثنا أبو قتيبة ويحيى بن كثير قالوا حدثنا شعبة عن مالك بن أنس عن عمرو بن مسلم عن سعيد بن المسيب عن أم سلمة قالت قال رسول الله صلى الله عليه وسلم من رأى منكم هلال ذي الحجة فأراد أن يضحي فلا يقربن له شعرا ولا ظفرا 	 حدثنا حاتم بن بكر الضبي أبو عمرو حدثنا محمد بن بكر البرساني ح وحدثنا محمد بن سعيد بن يزيد بن إبراهيم حدثنا أبو قتيبة ويحيى بن كثير قالوا حدثنا شعبة عن مالك بن أنس عن عمرو بن مسلم عن سعيد بن المسيب عن أم سلمة قالت قال رسول الله صلى الله عليه وسلم من رأى منكم هلال ذي الحجة فأراد أن يضحي فلا يقربن له شعرا ولا ظفرا 	 It wasnarrated from Umm Salamah that the Messenger of Allah (SL3M)said: “Whoever among you sees the new crescent of Dhul-Hijjah andwantsto offer a sacrifice, let him not take anything from his hair ornails.” 
ibnmajah26_1332720	 حدثنا عثمان بن أبي شيبة حدثنا إسماعيل ابن علية عن أيوب عن محمد بن سيرين عن أنس بن	عن مالك أن رجلا ذبح يوم النحر قبل الصلاة فأمره النبي صلى الله عليه وسلم أن يعيد 	 حدثنا عثمان بن أبي شيبة حدثنا إسماعيل ابن علية عن أيوب عن محمد بن سيرين عن أنس بن مالك أن رجلا ذبح يوم النحر قبل الصلاة فأمره النبي صلى الله عليه وسلم أن يعيد 	 It wasnarrated from Anas bin Malik that a man slaughtered on the DayofSacrifice, (meaning) before the ‘Eid prayer, and the Prophet (SL3M)ordered him to do it again. 
ibnmajah26_1332730	 حدثنا هشام بن عمار حدثنا سفيان بن عيينة عن الأسود بن قيس عن	عن جندب البجلي أنه سمعه يقول شهدت الأضحى مع رسول الله صلى الله عليه وسلم فذبح أناس قبل الصلاة فقال النبي صلى الله عليه وسلم من كان ذبح منكم قبل الصلاة فليعد أضحيته ومن لا فليذبح على اسم الله 	 حدثنا هشام بن عمار حدثنا سفيان بن عيينة عن الأسود بن قيس عن جندب البجلي أنه سمعه يقول شهدت الأضحى مع رسول الله صلى الله عليه وسلم فذبح أناس قبل الصلاة فقال النبي صلى الله عليه وسلم من كان ذبح منكم قبل الصلاة فليعد أضحيته ومن لا فليذبح على اسم الله 	 It wasnarrated from Aswad bin Qais that he heard Jundub Al-Bajalisay: “Iwas present on Adha day with the Messenger of Allah (SL3M), andsomepeople slaughtered before the prayer. The Prophet (SL3M) said:‘Whoever among you has slaughtered before the prayer, let himrepeathis sacrifice, and whoever has not, let him offer hissacrifice in theName of Allah.’” 
ibnmajah26_1332740	 حدثنا أبو بكر بن أبي شيبة حدثنا أبو خالد الأحمر عن يحيى بن سعيد عن عباد بن تميم عن عويمر بن	عن أشقر أنه ذبح قبل الصلاة فذكره للنبي صلى الله عليه وسلم فقال أعد أضحيتك 	 حدثنا أبو بكر بن أبي شيبة حدثنا أبو خالد الأحمر عن يحيى بن سعيد عن عباد بن تميم عن عويمر بن أشقر أنه ذبح قبل الصلاة فذكره للنبي صلى الله عليه وسلم فقال أعد أضحيتك 	 It wasnarrated from ‘Uwaimir bin Ashqar that he slaughtered beforetheprayer, and he mentioned that to the Prophet (SL3M) who said: “Repeatyour sacrifice.” 
ibnmajah26_1332750	 حدثنا أبو بكر بن أبي شيبة حدثنا عبد الأعلى عن خالد الحذاء عن أبي قلابة عن	عن أبي زيد قال أبو بكر وقال غير عبد الأعلى عن عمرو بن بجدان عن أبي زيد ح وحدثنا محمد بن المثنى أبو موسى حدثنا عبد الصمد بن عبد الوارث حدثنا أبي عن خالد الحذاء عن أبي قلابة عن عمرو بن بجدان عن أبي زيد الأنصاري قال مر رسول الله صلى الله عليه وسلم بدار من دور الأنصار فوجد ريح قتار فقال من هذا الذي ذبح فخرج إليه رجل منا فقال أنا يا رسول الله ذبحت قبل أن أصلي لأطعم أهلي وجيراني فأمره أن يعيد فقال لا والله الذي لا إله إلا هو ما عندي إلا جذع أو حمل من الضأن قال اذبحها ولن تجزئ جذعة عن أحد بعدك 	 حدثنا أبو بكر بن أبي شيبة حدثنا عبد الأعلى عن خالد الحذاء عن أبي قلابة عن أبي زيد قال أبو بكر وقال غير عبد الأعلى عن عمرو بن بجدان عن أبي زيد ح وحدثنا محمد بن المثنى أبو موسى حدثنا عبد الصمد بن عبد الوارث حدثنا أبي عن خالد الحذاء عن أبي قلابة عن عمرو بن بجدان عن أبي زيد الأنصاري قال مر رسول الله صلى الله عليه وسلم بدار من دور الأنصار فوجد ريح قتار فقال من هذا الذي ذبح فخرج إليه رجل منا فقال أنا يا رسول الله ذبحت قبل أن أصلي لأطعم أهلي وجيراني فأمره أن يعيد فقال لا والله الذي لا إله إلا هو ما عندي إلا جذع أو حمل من الضأن قال اذبحها ولن تجزئ جذعة عن أحد بعدك 	 It wasnarrated that Abu Zaid Al-Ansari said: “The Messenger of Allah(SL3M) passed by one of the houses of the Ansar and noticed the smellof a cooking pot. He said: ‘Who is this who has slaughtered?’ Amanfrom among us came out and said: ‘It is me, O Messenger ofAllah, Islaughtered before the prayer so that I could feed my familyandneighbors.’ He commanded him to repeat it. He said: ‘No, bythe Onebesides Whom there is none worthy of worship, I do not haveanythingbut a one-year-old sheep or a lamb.’ He (SL3M) said:‘Sacrifice it, buta one-year-old sheep will not do for anyoneafter you.’” 
ibnmajah26_1332760	 حدثنا محمد بن بشار حدثنا محمد بن جعفر حدثنا شعبة سمعت قتادة يحدث عن أنس بن	حدثنا مالك قال لقد رأيت رسول الله صلى الله عليه وسلم يذبح أضحيته بيده واضعا قدمه على صفاحها 	 حدثنا محمد بن بشار حدثنا محمد بن جعفر حدثنا شعبة سمعت قتادة يحدث عن أنس بن مالك قال لقد رأيت رسول الله صلى الله عليه وسلم يذبح أضحيته بيده واضعا قدمه على صفاحها 	 It wasnarrated that Anas bin Malik said: “I saw the Messenger ofAllah(SL3M) slaughter his sacrifice with his own hand, placing hisfoot onits side.” 
ibnmajah26_1332770	 حدثنا هشام بن عمار حدثنا عبد الرحمن بن سعد بن	حدثنا عمار بن سعد مؤذن رسول الله صلى الله عليه وسلم حدثني أبي عن أبيه عن جده أن رسول الله صلى الله عليه وسلم ذبح أضحيته عند طرف الزقاق طريق بني زريق بيده بشفرة 	 حدثنا هشام بن عمار حدثنا عبد الرحمن بن سعد بن عمار بن سعد مؤذن رسول الله صلى الله عليه وسلم حدثني أبي عن أبيه عن جده أن رسول الله صلى الله عليه وسلم ذبح أضحيته عند طرف الزقاق طريق بني زريق بيده بشفرة 	 ‘Abdur-Rahman bin Sa’d bin ‘Ammar bin Sa’d, the Mu’adhdhinof theMessenger of Allah (SL3M), told us: “My father told me, frommygrandfather, that the Messenger of Allah (SL3M) slaughtered hissacrifice at the side of an alley, on the road of Banu Zuraiq, withhis own hand, using a blade.” 
ibnmajah26_1332780	 حدثنا محمد بن معمر حدثنا محمد بن	حدثنا بكر البرساني أنبأنا ابن جريج أخبرني الحسن بن مسلم أن مجاهدا أخبره أن عبد الرحمن بن أبي ليلى أخبره أن علي بن أبي طالب أخبره أن رسول الله صلى الله عليه وسلم أمره أن يقسم بدنه كلها لحومها وجلودها وجلالها للمساكين 	 حدثنا محمد بن معمر حدثنا محمد بن بكر البرساني أنبأنا ابن جريج أخبرني الحسن بن مسلم أن مجاهدا أخبره أن عبد الرحمن بن أبي ليلى أخبره أن علي بن أبي طالب أخبره أن رسول الله صلى الله عليه وسلم أمره أن يقسم بدنه كلها لحومها وجلودها وجلالها للمساكين 	 ‘Alibin Abu Talib narrated that the Messenger of Allah (SL3M)commandedhim to distribute the entire sacrificial camel – its meat,skin andcovers – among the poor. 
ibnmajah26_1332790	 حدثنا هشام بن عمار حدثنا سفيان بن عيينة عن جعفر بن محمد عن أبيه عن جابر بن	عن عبد الله أن رسول الله صلى الله عليه وسلم أمر من كل جزور ببضعة فجعلت في قدر فأكلوا من اللحم وحسوا من المرق 	 حدثنا هشام بن عمار حدثنا سفيان بن عيينة عن جعفر بن محمد عن أبيه عن جابر بن عبد الله أن رسول الله صلى الله عليه وسلم أمر من كل جزور ببضعة فجعلت في قدر فأكلوا من اللحم وحسوا من المرق 	 It wasnarrated from Jabir bin ‘Abdullah that the Messenger of Allah(SL3M)ordered that a piece from every camel that had been slaughteredbebrought and placed in a pot, then they ate from its meat and dranksome of the broth. 
ibnmajah26_1332800	 حدثنا أبو بكر بن أبي شيبة حدثنا وكيع عن سفيان عن عبد الرحمن بن عابس عن أبيه عن	عن عائشة قالت إنما نهى رسول الله صلى الله عليه وسلم عن لحوم الأضاحي لجهد الناس ثم رخص فيها 	 حدثنا أبو بكر بن أبي شيبة حدثنا وكيع عن سفيان عن عبد الرحمن بن عابس عن أبيه عن عائشة قالت إنما نهى رسول الله صلى الله عليه وسلم عن لحوم الأضاحي لجهد الناس ثم رخص فيها 	 It wasnarrated that ‘Aishah said: “The Messenger of Allah (SL3M) onlyforbade storing the meat of the sacrifices because the people werefacing hardship. Then later he permitted that.” 
ibnmajah26_1332810	 حدثنا أبو بكر بن أبي شيبة حدثنا عبد الأعلى بن	حدثنا عبد الأعلى عن خالد الحذاء عن أبي المليح عن نبيشة أن رسول الله صلى الله عليه وسلم قال كنت نهيتكم عن لحوم الأضاحي فوق ثلاثة أيام فكلوا وادخروا 	 حدثنا أبو بكر بن أبي شيبة حدثنا عبد الأعلى بن عبد الأعلى عن خالد الحذاء عن أبي المليح عن نبيشة أن رسول الله صلى الله عليه وسلم قال كنت نهيتكم عن لحوم الأضاحي فوق ثلاثة أيام فكلوا وادخروا 	 It wasnarrated from Nubaishah that the Messenger of Allah (SL3M)said: “Iused to forbid you to store the meat of the sacrifices formore thanthree days, but (now) eat some and store some.” 
ibnmajah26_1332820	 حدثنا محمد بن بشار حدثنا أبو بكر الحنفي حدثنا أسامة بن زيد عن نافع عن ابن عمر عن	حدثنا النبي صلى الله عليه وسلم أنه كان يذبح بالمصلى 	 حدثنا محمد بن بشار حدثنا أبو بكر الحنفي حدثنا أسامة بن زيد عن نافع عن ابن عمر عن النبي صلى الله عليه وسلم أنه كان يذبح بالمصلى 	 It wasnarrated from Ibn ‘Umar that the Prophet (SL3M) used toslaughter atthe prayer place (of the ‘Eid congregation). 
