muslim44_365950	 حدثنا أبو بكر بن أبي شيبة وعمرو الناقد وزهير بن	حدثنا حرب وإسحاق بن إبراهيم وابن أبي عمر واللفظ لعمرو قال إسحاق أخبرنا وقال الآخرون حدثنا سفيان بن عيينة عن عمرو عن الحسن بن محمد أخبرني عبيد الله بن أبي رافع وهو كاتب علي قال سمعت عليا رضى الله عنه وهو يقول بعثنا رسول الله صلى الله عليه وسلم أنا والزبير والمقداد فقال ائتوا روضة خاخ فإن بها ظعينة معها كتاب فخذوه منها فانطلقنا تعادى بنا خيلنا فإذا نحن بالمرأة فقلنا أخرجي الكتاب فقالت ما معي كتاب فقلنا لتخرجن الكتاب أو لتلقين الثياب فأخرجته من عقاصها فأتينا به رسول الله صلى الله عليه وسلم فإذا فيه من حاطب بن أبي بلتعة إلى ناس من المشركين من أهل مكة يخبرهم ببعض أمر رسول الله صلى الله عليه وسلم فقال رسول الله صلى الله عليه وسلم يا حاطب ما هذا قال لا تعجل على يا رسول الله إني كنت امرأ ملصقا في قريش قال سفيان كان حليفا لهم ولم يكن من أنفسها وكان ممن كان معك من المهاجرين لهم قرابات يحمون بها أهليهم فأحببت إذ فاتني ذلك من النسب فيهم أن أتخذ فيهم يدا يحمون بها قرابتي ولم أفعله كفرا ولا ارتدادا عن ديني ولا رضا بالكفر بعد الإسلام فقال النبي صلى الله عليه وسلم صدق فقال عمر دعني يا رسول الله أضرب عنق هذا المنافق فقال إنه قد شهد بدرا وما يدريك لعل الله اطلع على أهل بدر فقال اعملوا ما شئتم فقد غفرت لكم فأنزل الله عز وجل { يا أيها الذين آمنوا لا تتخذوا عدوي وعدوكم أولياء} وليس في حديث أبي بكر وزهير ذكر الآية وجعلها إسحاق في روايته من تلاوة سفيان 	 حدثنا أبو بكر بن أبي شيبة وعمرو الناقد وزهير بن حرب وإسحاق بن إبراهيم وابن أبي عمر واللفظ لعمرو قال إسحاق أخبرنا وقال الآخرون حدثنا سفيان بن عيينة عن عمرو عن الحسن بن محمد أخبرني عبيد الله بن أبي رافع وهو كاتب علي قال سمعت عليا رضى الله عنه وهو يقول بعثنا رسول الله صلى الله عليه وسلم أنا والزبير والمقداد فقال ائتوا روضة خاخ فإن بها ظعينة معها كتاب فخذوه منها فانطلقنا تعادى بنا خيلنا فإذا نحن بالمرأة فقلنا أخرجي الكتاب فقالت ما معي كتاب فقلنا لتخرجن الكتاب أو لتلقين الثياب فأخرجته من عقاصها فأتينا به رسول الله صلى الله عليه وسلم فإذا فيه من حاطب بن أبي بلتعة إلى ناس من المشركين من أهل مكة يخبرهم ببعض أمر رسول الله صلى الله عليه وسلم فقال رسول الله صلى الله عليه وسلم يا حاطب ما هذا قال لا تعجل على يا رسول الله إني كنت امرأ ملصقا في قريش قال سفيان كان حليفا لهم ولم يكن من أنفسها وكان ممن كان معك من المهاجرين لهم قرابات يحمون بها أهليهم فأحببت إذ فاتني ذلك من النسب فيهم أن أتخذ فيهم يدا يحمون بها قرابتي ولم أفعله كفرا ولا ارتدادا عن ديني ولا رضا بالكفر بعد الإسلام فقال النبي صلى الله عليه وسلم صدق فقال عمر دعني يا رسول الله أضرب عنق هذا المنافق فقال إنه قد شهد بدرا وما يدريك لعل الله اطلع على أهل بدر فقال اعملوا ما شئتم فقد غفرت لكم فأنزل الله عز وجل { يا أيها الذين آمنوا لا تتخذوا عدوي وعدوكم أولياء} وليس في حديث أبي بكر وزهير ذكر الآية وجعلها إسحاق في روايته من تلاوة سفيان 	" Ubaidullah b. Rafi', who was the scribe of 'All, reported: I heard 'Ali (Allah be pleased with him) as saying: Allah's Messenger (SL3M) sent me and Zubair and Miqdad saying: Go to the garden of, Khakh [it is a place between Medina and Mecca at a distance of twelve miles from Medina] and there you will find a woman riding a camel. She would be in possession of a letter, which you must get from her. So we rushed on horses and when we met that woman, we asked her to deliver that letter to us. She said: There is no letter with me. We said: Either bring out that letter or we would take off your clothes. She brought out that letter from (the plaited hair of) her head. We delivered that letter to Allah's Messenger (SL3M) in which Hatib b. Abu Balta'a had informed some people amongst the polytheists of Mecca about the affairs of Allah's Messenger (SL3M). Allah's Messenger (SL3M) said: Hatib, what is this? He said: Allah's messenger, do not be hasty in judging my intention. I was a person attached to the Quraish. Sufyan said: He was their ally but had no relationship with them. (Hatib further said): Those who are with you amongst the emigrants have blood-relationship with them (the Quraish) and thus they would protect their families. I wished that when I had no blood-relationship with them I should find some supporters from (amongst them) who would help my family. I have not done this because of any unbelief or apostasy and I have no liking for the unbelief after I have (accepted) Islam. Thereupon Allah's Apostle (SL3M) said: You have told the truth. 'Umar said: Allah's Messenger, permit me to strike the neck of this hypocrite. But he (the Holy Prophet) said: He was a participant in Badr and you little know that Allah revealed about the people of Badr: Do what you like for there is forgiveness for you. And Allah, the Exalted and Glorious, said:"" O you who believe, do not take My enemy and your enemy for friends"" (lx. 1). And there is no mention of this verse in the hadith transmitted on the authority of Abu Bakr and Zubair and Ishaq has in his narration made a mention of the recitation of this verse by Sufyan. "
muslim44_365960	 حدثنا أبو بكر بن أبي شيبة حدثنا محمد بن	حدثنا فضيل ح وحدثنا إسحاق بن إبراهيم أخبرنا عبد الله بن إدريس ح وحدثنا رفاعة بن الهيثم الواسطي حدثنا خالد يعني ابن عبد الله كلهم عن حصين عن سعد بن عبيدة عن أبي عبد الرحمن السلمي عن علي قال بعثني رسول الله صلى الله عليه وسلم وأبا مرثد الغنوي والزبير بن العوام وكلنا فارس فقال انطلقوا حتى تأتوا روضة خاخ فإن بها امرأة من المشركين معها كتاب من حاطب إلى المشركين فذكر بمعنى حديث عبيد الله بن أبي رافع عن علي 	 حدثنا أبو بكر بن أبي شيبة حدثنا محمد بن فضيل ح وحدثنا إسحاق بن إبراهيم أخبرنا عبد الله بن إدريس ح وحدثنا رفاعة بن الهيثم الواسطي حدثنا خالد يعني ابن عبد الله كلهم عن حصين عن سعد بن عبيدة عن أبي عبد الرحمن السلمي عن علي قال بعثني رسول الله صلى الله عليه وسلم وأبا مرثد الغنوي والزبير بن العوام وكلنا فارس فقال انطلقوا حتى تأتوا روضة خاخ فإن بها امرأة من المشركين معها كتاب من حاطب إلى المشركين فذكر بمعنى حديث عبيد الله بن أبي رافع عن علي 	 'Ali reported that Allah's Messenger (SL3M) sent me and Abu Marthad al-Ghitnavi and Zubair b. 'Awwam and we were all riders, and he said: Ride on until you reach the garden of Khakh for there is a woman amongst the polytheists and there is a letter with her sent by Hatib to the polytheists; the rest of the hadith is the same. 
muslim44_365970	 حدثنا قتيبة بن سعيد حدثنا ليث ح وحدثنا محمد بن	حدثنا رمح أخبرنا الليث عن أبي الزبير عن جابر أن عبدا لحاطب جاء رسول الله صلى الله عليه وسلم يشكو حاطبا فقال يا رسول الله ليدخلن حاطب النار فقال رسول الله صلى الله عليه وسلم كذبت لا يدخلها فإنه شهد بدرا والحديبية 	 حدثنا قتيبة بن سعيد حدثنا ليث ح وحدثنا محمد بن رمح أخبرنا الليث عن أبي الزبير عن جابر أن عبدا لحاطب جاء رسول الله صلى الله عليه وسلم يشكو حاطبا فقال يا رسول الله ليدخلن حاطب النار فقال رسول الله صلى الله عليه وسلم كذبت لا يدخلها فإنه شهد بدرا والحديبية 	 Jabir reported that a slave of Hatib came to Allah's Messenger (SL3M) complaining against Hatib and said: Hatib will definitely go to Hell. (But) Allah's Messenger (SL3M) said: You tell a lie; he would not get into that for he had taken part in Badr and in (the expedition of) Hudaibiya. 
muslim44_365980	 حدثني هارون بن عبد الله حدثنا حجاج بن	حدثني محمد قال قال ابن جريج أخبرني أبو الزبير أنه سمع جابر بن عبد الله يقول أخبرتني أم مبشر أنها سمعت النبي صلى الله عليه وسلم يقول عند حفصة لا يدخل النار إن شاء الله من أصحاب الشجرة أحد الذين بايعوا تحتها قالت بلى يا رسول الله فانتهرها فقالت حفصة { وإن منكم إلا واردها} فقال النبي صلى الله عليه وسلم قد قال الله عز وجل { ثم ننجي الذين اتقوا ونذر الظالمين فيها جثيا} 	 حدثني هارون بن عبد الله حدثنا حجاج بن محمد قال قال ابن جريج أخبرني أبو الزبير أنه سمع جابر بن عبد الله يقول أخبرتني أم مبشر أنها سمعت النبي صلى الله عليه وسلم يقول عند حفصة لا يدخل النار إن شاء الله من أصحاب الشجرة أحد الذين بايعوا تحتها قالت بلى يا رسول الله فانتهرها فقالت حفصة { وإن منكم إلا واردها} فقال النبي صلى الله عليه وسلم قد قال الله عز وجل { ثم ننجي الذين اتقوا ونذر الظالمين فيها جثيا} 	 Umm Mubashshir reported that she heard Allah's Apostle (SL3M) as saying in presence of Hafsa: God willing, the people of the Tree would never enter the fire of Hell one amongst those who owed allegiance under that. She said: Allah's Messenger, why not? He scolded her. Hafsa said: And there is none amongst you but shall have to pass over that (narrow Bridge). Thereupon Allah's Apostle (SL3M) said: Allah, the Exalted and Glorious, has said: We would rescue those persons who are God-conscious and we would leave the tyrants to their fate there (xix. 72). 
muslim44_365990	 حدثنا أبو عامر الأشعري وأبو كريب جميعا عن أبي أسامة قال أبو عامر حدثنا أبو أسامة حدثنا بريد عن جده أبي بردة عن	حدثنا أبي موسى قال كنت عند النبي صلى الله عليه وسلم وهو نازل بالجعرانة بين مكة والمدينة ومعه بلال فأتى رسول الله صلى الله عليه وسلم رجل أعرابي فقال ألا تنجز لي يا محمد ما وعدتني فقال له رسول الله صلى الله عليه وسلم أبشر فقال له الأعرابي أكثرت على من أبشر فأقبل رسول الله صلى الله عليه وسلم على أبي موسى وبلال كهيئة الغضبان فقال إن هذا قد رد البشرى فاقبلا أنتما فقالا قبلنا يا رسول الله ثم دعا رسول الله صلى الله عليه وسلم بقدح فيه ماء فغسل يديه ووجهه فيه ومج فيه ثم قال اشربا منه وأفرغا على وجوهكما ونحوركما وأبشرا فأخذا القدح ففعلا ما أمرهما به رسول الله صلى الله عليه وسلم فنادتهما أم سلمة من وراء الستر أفضلا لأمكما مما في إنائكما فأفضلا لها منه طائفة 	 حدثنا أبو عامر الأشعري وأبو كريب جميعا عن أبي أسامة قال أبو عامر حدثنا أبو أسامة حدثنا بريد عن جده أبي بردة عن أبي موسى قال كنت عند النبي صلى الله عليه وسلم وهو نازل بالجعرانة بين مكة والمدينة ومعه بلال فأتى رسول الله صلى الله عليه وسلم رجل أعرابي فقال ألا تنجز لي يا محمد ما وعدتني فقال له رسول الله صلى الله عليه وسلم أبشر فقال له الأعرابي أكثرت على من أبشر فأقبل رسول الله صلى الله عليه وسلم على أبي موسى وبلال كهيئة الغضبان فقال إن هذا قد رد البشرى فاقبلا أنتما فقالا قبلنا يا رسول الله ثم دعا رسول الله صلى الله عليه وسلم بقدح فيه ماء فغسل يديه ووجهه فيه ومج فيه ثم قال اشربا منه وأفرغا على وجوهكما ونحوركما وأبشرا فأخذا القدح ففعلا ما أمرهما به رسول الله صلى الله عليه وسلم فنادتهما أم سلمة من وراء الستر أفضلا لأمكما مما في إنائكما فأفضلا لها منه طائفة 	 Abu Musa reported: I was in the company of Allah's Apostle (SL3M) as he had been sitting in Ji'rana (a place) between Mecca and Medina and Bilal was also there, that there came to Allah's Apostle (SL3M) a desert Arab, and he said: Muhammad, fulfill your promise that you made with me. Allah's Messenger (SL3M) said to him: Accept glad tidings. Thereupon the desert Arab said: You shower glad tidings upon me very much; then Allah's Messenger (SL3M) turned towards Abu Musa and Bilal seemingly in a state of annoyance and said: Verily he has rejected glad tidings but you two should accept them. We said: Allah's Messenger, we have readily accepted them. Then Allah's Messenger (SL3M) called for a cup of water and washed his hands in that and face too and put the saliva in it and then said: Drink out of it and pour it over your faces and over your chest and gladden yourselves. They took hold of the cup and did as Allah's Messenger (SL3M) had commanded them to do. Thereupon Umm Salama called from behind the veil: Spare some water in your vessel for your mother also, and they also gave some water which had been spared for her. 
muslim44_366000	 حدثنا عبد الله بن	حدثنا براد أبو عامر الأشعري وأبو كريب محمد بن العلاء واللفظ لأبي عامر قالا حدثنا أبو أسامة عن بريد عن أبي بردة عن أبيه قال لما فرغ النبي صلى الله عليه وسلم من حنين بعث أبا عامر على جيش إلى أوطاس فلقي دريد بن الصمة فقتل دريد وهزم الله أصحابه فقال أبو موسى وبعثني مع أبي عامر قال فرمي أبو عامر في ركبته رماه رجل من بني جشم بسهم فأثبته في ركبته فانتهيت إليه فقلت يا عم من رماك فأشار أبو عامر إلى أبي موسى فقال إن ذاك قاتلي تراه ذلك الذي رماني قال أبو موسى فقصدت له فاعتمدته فلحقته فلما رآني ولى عني ذاهبا فاتبعته وجعلت أقول له ألا تستحيي ألست عربيا ألا تثبت فكف فالتقيت أنا وهو فاختلفنا أنا وهو ضربتين فضربته بالسيف فقتلته ثم رجعت إلى أبي عامر فقلت إن الله قد قتل صاحبك قال فانزع هذا السهم فنزعته فنزا منه الماء فقال يا ابن أخي انطلق إلى رسول الله صلى الله عليه وسلم فأقرئه مني السلام وقل له يقول لك أبو عامر استغفر لي قال واستعملني أبو عامر على الناس ومكث يسيرا ثم إنه مات فلما رجعت إلى النبي صلى الله عليه وسلم دخلت عليه وهو في بيت على سرير مرمل وعليه فراش وقد أثر رمال السرير بظهر رسول الله صلى الله عليه وسلم وجنبيه فأخبرته بخبرنا وخبر أبي عامر وقلت له قال قل له يستغفر لي فدعا رسول الله صلى الله عليه وسلم بماء فتوضأ منه ثم رفع يديه ثم قال اللهم اغفر لعبيد أبي عامر حتى رأيت بياض إبطيه ثم قال اللهم اجعله يوم القيامة فوق كثير من خلقك أو من الناس فقلت ولي يا رسول الله فاستغفر فقال النبي صلى الله عليه وسلم اللهم اغفر لعبد الله بن قيس ذنبه وأدخله يوم القيامة مدخلا كريما قال أبو بردة إحداهما لأبي عامر والأخرى لأبي موسى 	 حدثنا عبد الله بن براد أبو عامر الأشعري وأبو كريب محمد بن العلاء واللفظ لأبي عامر قالا حدثنا أبو أسامة عن بريد عن أبي بردة عن أبيه قال لما فرغ النبي صلى الله عليه وسلم من حنين بعث أبا عامر على جيش إلى أوطاس فلقي دريد بن الصمة فقتل دريد وهزم الله أصحابه فقال أبو موسى وبعثني مع أبي عامر قال فرمي أبو عامر في ركبته رماه رجل من بني جشم بسهم فأثبته في ركبته فانتهيت إليه فقلت يا عم من رماك فأشار أبو عامر إلى أبي موسى فقال إن ذاك قاتلي تراه ذلك الذي رماني قال أبو موسى فقصدت له فاعتمدته فلحقته فلما رآني ولى عني ذاهبا فاتبعته وجعلت أقول له ألا تستحيي ألست عربيا ألا تثبت فكف فالتقيت أنا وهو فاختلفنا أنا وهو ضربتين فضربته بالسيف فقتلته ثم رجعت إلى أبي عامر فقلت إن الله قد قتل صاحبك قال فانزع هذا السهم فنزعته فنزا منه الماء فقال يا ابن أخي انطلق إلى رسول الله صلى الله عليه وسلم فأقرئه مني السلام وقل له يقول لك أبو عامر استغفر لي قال واستعملني أبو عامر على الناس ومكث يسيرا ثم إنه مات فلما رجعت إلى النبي صلى الله عليه وسلم دخلت عليه وهو في بيت على سرير مرمل وعليه فراش وقد أثر رمال السرير بظهر رسول الله صلى الله عليه وسلم وجنبيه فأخبرته بخبرنا وخبر أبي عامر وقلت له قال قل له يستغفر لي فدعا رسول الله صلى الله عليه وسلم بماء فتوضأ منه ثم رفع يديه ثم قال اللهم اغفر لعبيد أبي عامر حتى رأيت بياض إبطيه ثم قال اللهم اجعله يوم القيامة فوق كثير من خلقك أو من الناس فقلت ولي يا رسول الله فاستغفر فقال النبي صلى الله عليه وسلم اللهم اغفر لعبد الله بن قيس ذنبه وأدخله يوم القيامة مدخلا كريما قال أبو بردة إحداهما لأبي عامر والأخرى لأبي موسى 	 Abu Burda reported on the authority of his father that when Allah's Apostle (SL3M) had been free from the Battle of Hunain, he sent Abu 'Amir as the head of the army of Autas. He had an encounter with Duraid b. as_Simma. Duraid was killed and Allah gave defeat to his friends. Abu Musa said: He (the Holy Prophet) sent me along with Abu 'Amir and Abu 'Amir received a wound in his knee from the arrow, (shot by) a person of Bani Jusham. It stuck in his knee. I went to him and said: Uncle, who shot an arrow upon you? Abu 'Amir pointed out to Abu Musa and said: Verily that one who shot an arrow upon me in fact killed me. Abu Musa said: I followed him with the determination to kill him and overtook him and when he saw me he turned upon his heels. I followed him and I said to him: Don't you feel ashamed (that you run), aren't you an Arab? Why don't you stop? He stopped and I had an encounter with him and we exchanged the strokes of (swords). I struck him with the sword and killed him. Then I came back to Abu Amir and said: Verily Allah has killed the one who killed you. And he said: Now draw out this arrow. I drew out the arrow and there came out from that (wound) water. Abu 'Amir said: My nephew, go to Allah's Messenger (SL3M) and convey my greetings to him and tell him that Abu Amir begs you to ask forgiveness for him. And Abu Amir appointed me as the chief of the people and he died after a short time. When I came to Allah's Apostle (SL3M) I visited him and he had been lying on the cot woven by strings and there was (no) bed over it and so there had been marks of the strings on the back of Allah's Messenger (SL3M) and on his sides. I narrated to him what had happened to us and narrated to him about Abu Amir and said to him that he had made a request to the effect that forgiveness should be sought for him (from Allah). Thereupon Allah's Messenger (may peace be. upon him) called for water and performed ablution with it. He then lifted his hands and said. O Allah, grant pardon to Thy servant Abu Amir. (The Prophet had raised his hands so high for supplication) that I saw the whiteness of his armpits. He again said: O Allah, grant him distinction amongst the majority of Thine created beings or from amongst the people. I said: Allah's Messenger, ask forgiveness for me too. Thereupon Allah's Apostle (SL3M) said: Allah, forgive the sins of Abdullah b. Qais (Abu Musa Ash'ari) and admit him to an elevated place on the Day of Resurrection. Abu Burda said: One prayer is for abu 'Amir and the other is tor Abu Musa. 
muslim44_366010	 حدثنا أبو كريب محمد بن العلاء حدثنا أبو أسامة حدثنا بريد عن أبي بردة عن	حدثنا أبي موسى قال قال رسول الله صلى الله عليه وسلم إني لأعرف أصوات رفقة الأشعريين بالقرآن حين يدخلون بالليل وأعرف منازلهم من أصواتهم بالقرآن بالليل وإن كنت لم أر منازلهم حين نزلوا بالنهار ومنهم حكيم إذا لقي الخيل أو قال العدو قال لهم إن أصحابي يأمرونكم أن تنظروهم 	 حدثنا أبو كريب محمد بن العلاء حدثنا أبو أسامة حدثنا بريد عن أبي بردة عن أبي موسى قال قال رسول الله صلى الله عليه وسلم إني لأعرف أصوات رفقة الأشعريين بالقرآن حين يدخلون بالليل وأعرف منازلهم من أصواتهم بالقرآن بالليل وإن كنت لم أر منازلهم حين نزلوا بالنهار ومنهم حكيم إذا لقي الخيل أو قال العدو قال لهم إن أصحابي يأمرونكم أن تنظروهم 	 Abu Musa reported that Allah's Messenger (SL3M) said: I recognise the voice of the Ash'arites while they recite the Qur'an as they arrive during the night and I also recognise their station from the recital of the Qur'an during the night time, although I have not seen their encampments as they encamp during the day time. And there is a person amongst them, Hakim; when he encounters the horsemen or the enemies he says to them: My friends command you to wait for them. 
