muslim47_369840	 حدثنا عبد الله بن مسلمة بن قعنب حدثنا يزيد بن	حدثنا إبراهيم التستري عن عبد الله بن أبي مليكة عن القاسم بن محمد عن عائشة قالت تلا رسول الله صلى الله عليه وسلم { هو الذي أنزل عليك الكتاب منه آيات محكمات هن أم الكتاب وأخر متشابهات فأما الذين في قلوبهم زيغ فيتبعون ما تشابه منه ابتغاء الفتنة وابتغاء تأويله وما يعلم تأويله إلا الله والراسخون في العلم يقولون آمنا به كل من عند ربنا وما يذكر إلا أولو الألباب} قالت قال رسول الله صلى الله عليه وسلم إذا رأيتم الذين يتبعون ما تشابه منه فأولئك الذين سمى الله فاحذروهم 	 حدثنا عبد الله بن مسلمة بن قعنب حدثنا يزيد بن إبراهيم التستري عن عبد الله بن أبي مليكة عن القاسم بن محمد عن عائشة قالت تلا رسول الله صلى الله عليه وسلم { هو الذي أنزل عليك الكتاب منه آيات محكمات هن أم الكتاب وأخر متشابهات فأما الذين في قلوبهم زيغ فيتبعون ما تشابه منه ابتغاء الفتنة وابتغاء تأويله وما يعلم تأويله إلا الله والراسخون في العلم يقولون آمنا به كل من عند ربنا وما يذكر إلا أولو الألباب} قالت قال رسول الله صلى الله عليه وسلم إذا رأيتم الذين يتبعون ما تشابه منه فأولئك الذين سمى الله فاحذروهم 	" 'A'isha reported that Allah's Messenger (SL3M) recited (these verses of the Qur'an): "" He it is Who revealed to thee (Muhammad) the Book (the Qur'an) wherein there are clear revelations-these are the substance of the Book and others are allegorical (verses). And as for those who have a yearning for error they go after the allegorical verses seeking (to cause) dissension, by seeking to explain them. And none knows their implications but Allah, and those who are sound in knowledge say: We affirm our faith in everything which is from our Lord. It is only the persons of understanding who really heed"" (iii. 6). 'A'isha (further) reported that Allah's Messenger (SL3M) said (in connection with these verses): When you see such verses, avoid them, for it is they whom Allah has pointed out (in the mentioned verses). "
muslim47_369850	 حدثنا أبو كامل فضيل بن حسين الجحدري حدثنا حماد بن	حدثنا زيد حدثنا أبو عمران الجوني قال كتب إلى عبد الله بن رباح الأنصاري أن عبد الله بن عمرو قال هجرت إلى رسول الله صلى الله عليه وسلم يوما قال فسمع أصوات رجلين اختلفا في آية فخرج علينا رسول الله صلى الله عليه وسلم يعرف في وجهه الغضب فقال إنما هلك من كان قبلكم باختلافهم في الكتاب 	 حدثنا أبو كامل فضيل بن حسين الجحدري حدثنا حماد بن زيد حدثنا أبو عمران الجوني قال كتب إلى عبد الله بن رباح الأنصاري أن عبد الله بن عمرو قال هجرت إلى رسول الله صلى الله عليه وسلم يوما قال فسمع أصوات رجلين اختلفا في آية فخرج علينا رسول الله صلى الله عليه وسلم يعرف في وجهه الغضب فقال إنما هلك من كان قبلكم باختلافهم في الكتاب 	 'Abdullah b. 'Umar reported: I went to Allah's Messenger (SL3M) in the morning and he heard the voice of two persons who had an argumentation with each other about a verse. Allah's Apostle (SL3M) came to us (and) the (signs) of anger could be seen on his face. He said: Verily, the (peoples) before you were ruined because of their disputation in the Book. 
muslim47_369860	 حدثنا يحيى بن يحيى أخبرنا أبو قدامة الحارث بن	حدثنا عبيد عن أبي عمران عن جندب بن عبد الله البجلي قال قال رسول الله صلى الله عليه وسلم اقرءوا القرآن ما ائتلفت عليه قلوبكم فإذا اختلفتم فيه فقوموا 	 حدثنا يحيى بن يحيى أخبرنا أبو قدامة الحارث بن عبيد عن أبي عمران عن جندب بن عبد الله البجلي قال قال رسول الله صلى الله عليه وسلم اقرءوا القرآن ما ائتلفت عليه قلوبكم فإذا اختلفتم فيه فقوموا 	 Jundub b. 'Abdullah al-Bajali reported Allah's Messenger (SL3M) as saying: Recite the Qur'an as long as your hearts agree to do so, and when you feel variance between them (between your hearts and tongues), then get up (and leave its recital for the time being). 
muslim47_369870	 حدثني إسحاق بن منصور أخبرنا عبد الصمد حدثنا همام حدثنا أبو عمران الجوني عن	حدثنا جندب يعني ابن عبد الله أن رسول الله صلى الله عليه وسلم قال اقرءوا القرآن ما ائتلفت عليه قلوبكم فإذا اختلفتم فقوموا 	 حدثني إسحاق بن منصور أخبرنا عبد الصمد حدثنا همام حدثنا أبو عمران الجوني عن جندب يعني ابن عبد الله أن رسول الله صلى الله عليه وسلم قال اقرءوا القرآن ما ائتلفت عليه قلوبكم فإذا اختلفتم فقوموا 	 Jundub (i. e. Ibn 'Abdullah) reported that Allah's Messenger (SL3M) said: Recite the Qur'an as long as your hearts agree to do so and when you find variance between them, then stand up. 
muslim47_369880	 حدثني أحمد بن سعيد بن صخر الدارمي حدثنا حبان حدثنا أبان حدثنا	حدثنا أبو عمران قال قال لنا جندب ونحن غلمان بالكوفة قال رسول الله صلى الله عليه وسلم اقرءوا القرآن بمثل حديثهما 	 حدثني أحمد بن سعيد بن صخر الدارمي حدثنا حبان حدثنا أبان حدثنا أبو عمران قال قال لنا جندب ونحن غلمان بالكوفة قال رسول الله صلى الله عليه وسلم اقرءوا القرآن بمثل حديثهما 	 Abu Imran reported that Jundub told us as we we-re young boys living in Kilfa, that Allah's Messenger (SL3M) had said: Recite the Qur'an. The rest of the hadith is the same. 
muslim47_369890	 حدثنا أبو بكر بن أبي شيبة حدثنا وكيع عن ابن جريج عن ابن أبي مليكة عن	عن عائشة قالت قال رسول الله صلى الله عليه وسلم إن أبغض الرجال إلى الله الألد الخصم 	 حدثنا أبو بكر بن أبي شيبة حدثنا وكيع عن ابن جريج عن ابن أبي مليكة عن عائشة قالت قال رسول الله صلى الله عليه وسلم إن أبغض الرجال إلى الله الألد الخصم 	 'A'isha reported Allah's Messenger (SL3M) as saying: The most despicable amongst persons in the eye of Allah is one who tries to fall into dispute with others (for nothing but only to display his knowledge and power of argumentation). 
muslim47_369900	 حدثني سويد بن سعيد حدثنا حفص بن ميسرة حدثني زيد بن أسلم عن عطاء بن يسار عن	حدثني أبي سعيد الخدري قال قال رسول الله صلى الله عليه وسلم لتتبعن سنن الذين من قبلكم شبرا بشبر وذراعا بذراع حتى لو دخلوا في جحر ضب لاتبعتموهم قلنا يا رسول الله آليهود والنصارى قال فمن 	 حدثني سويد بن سعيد حدثنا حفص بن ميسرة حدثني زيد بن أسلم عن عطاء بن يسار عن أبي سعيد الخدري قال قال رسول الله صلى الله عليه وسلم لتتبعن سنن الذين من قبلكم شبرا بشبر وذراعا بذراع حتى لو دخلوا في جحر ضب لاتبعتموهم قلنا يا رسول الله آليهود والنصارى قال فمن 	" Abu Sa'id al-Khudri reported Allah's Messenger (SL3M) as saying: You would tread the same path as was trodden by those before you inch by inch and step by step so much so that if they had entered into the hole of the lizard, you would follow them in this also. We said: Allah's Messenger, do you mean Jews and Christians (by your words)"" those before you""? He said: Who else (than those two religious groups)? "
muslim47_369910	not identified	 وحدثنا عدة من أصحابنا عن سعيد بن أبي مريم أخبرنا أبو غسان وهو محمد بن مطرف عن زيد بن أسلم بهذا الإسناد نحوه 	 وحدثنا عدة من أصحابنا عن سعيد بن أبي مريم أخبرنا أبو غسان وهو محمد بن مطرف عن زيد بن أسلم بهذا الإسناد نحوه 	 This hadith is reported through Muhammad bin Muttarif from Zayd bin Aslam with the same chain. 
muslim47_369920	not identified	 قال أبو إسحاق إبراهيم بن محمد حدثنا محمد بن يحيى حدثنا ابن أبي مريم حدثنا أبو غسان حدثنا زيد بن أسلم عن عطاء بن يسار وذكر الحديث نحوه 	 قال أبو إسحاق إبراهيم بن محمد حدثنا محمد بن يحيى حدثنا ابن أبي مريم حدثنا أبو غسان حدثنا زيد بن أسلم عن عطاء بن يسار وذكر الحديث نحوه 	 This hadith has been narrated on the authority of 'Ata' b. Yasir through another chain of transmitters. 
muslim47_369930	 حدثنا أبو بكر بن أبي شيبة حدثنا حفص بن	حدثنا غياث ويحيى بن سعيد عن ابن جريج عن سليمان بن عتيق عن طلق بن حبيب عن الأحنف بن قيس عن عبد الله قال قال رسول الله صلى الله عليه وسلم هلك المتنطعون قالها ثلاثا 	 حدثنا أبو بكر بن أبي شيبة حدثنا حفص بن غياث ويحيى بن سعيد عن ابن جريج عن سليمان بن عتيق عن طلق بن حبيب عن الأحنف بن قيس عن عبد الله قال قال رسول الله صلى الله عليه وسلم هلك المتنطعون قالها ثلاثا 	 Abdullah reported Allah's Messenger (SL3M) as saying: Ruined, were those who indulged in hair-splitting. He (the Holy Prophet) repeated this thrice. 
muslim47_369940	 حدثنا شيبان بن فروخ حدثنا عبد الوارث حدثنا أبو التياح حدثني أنس بن	حدثنا مالك قال قال رسول الله صلى الله عليه وسلم من أشراط الساعة أن يرفع العلم ويثبت الجهل ويشرب الخمر ويظهر الزنا 	 حدثنا شيبان بن فروخ حدثنا عبد الوارث حدثنا أبو التياح حدثني أنس بن مالك قال قال رسول الله صلى الله عليه وسلم من أشراط الساعة أن يرفع العلم ويثبت الجهل ويشرب الخمر ويظهر الزنا 	 Anas b. Malik reported Allah's Messenger (SL3M) as saying: It is from the conditions of the Last Hour that knowledge would be taken away and ignorance would prevail (upon the world), the liquor would be drunk, and adultery would become rampant. 
muslim47_369950	 حدثنا محمد بن المثنى وابن بشار قالا حدثنا محمد بن	حدثنا جعفر حدثنا شعبة سمعت قتادة يحدث عن أنس بن مالك قال ألا أحدثكم حديثا سمعته من رسول الله صلى الله عليه وسلم لا يحدثكم أحد بعدي سمعه منه إن من أشراط الساعة أن يرفع العلم ويظهر الجهل ويفشو الزنا ويشرب الخمر ويذهب الرجال وتبقى النساء حتى يكون لخمسين امرأة قيم واحد 	 حدثنا محمد بن المثنى وابن بشار قالا حدثنا محمد بن جعفر حدثنا شعبة سمعت قتادة يحدث عن أنس بن مالك قال ألا أحدثكم حديثا سمعته من رسول الله صلى الله عليه وسلم لا يحدثكم أحد بعدي سمعه منه إن من أشراط الساعة أن يرفع العلم ويظهر الجهل ويفشو الزنا ويشرب الخمر ويذهب الرجال وتبقى النساء حتى يكون لخمسين امرأة قيم واحد 	" Qatida reported that Anas b. Malik said: May I not narrate to you a hadith which I heard from Allah's Messenger (SL3M) which no one would narrate to you after me who would have personally heard it from him (the Holy Prophet) (as I have the good fortune to do so)? -"" It is from the signs of the Last Hour that knowledge would be taken away, ignorance would prevail upon (the world), adultery would become common, wine would be drunk, the number of men will fall short and the women would survive (and thus such a disparity would arise in the number of men and women) that there would be one man to look after fifty women. "
muslim47_369960	 حدثنا أبو بكر بن أبي شيبة حدثنا محمد بن	حدثنا بشر ح وحدثنا أبو كريب حدثنا عبدة وأبو أسامة كلهم عن سعيد بن أبي عروبة عن قتادة عن أنس بن مالك عن النبي صلى الله عليه وسلم وفي حديث ابن بشر وعبدة لا يحدثكموه أحد بعدي سمعت رسول الله صلى الله عليه وسلم يقول فذكر بمثله 	 حدثنا أبو بكر بن أبي شيبة حدثنا محمد بن بشر ح وحدثنا أبو كريب حدثنا عبدة وأبو أسامة كلهم عن سعيد بن أبي عروبة عن قتادة عن أنس بن مالك عن النبي صلى الله عليه وسلم وفي حديث ابن بشر وعبدة لا يحدثكموه أحد بعدي سمعت رسول الله صلى الله عليه وسلم يقول فذكر بمثله 	 This hadith has been transmitted on the authority of Anas b. Malik through another chain of narrators, but with a slight variation of wording. 
muslim47_369970	 حدثنا محمد بن عبد الله بن نمير حدثنا وكيع وأبي قالا حدثنا الأعمش ح وحدثني أبو سعيد الأشج واللفظ له حدثنا وكيع حدثنا الأعمش عن	حدثنا أبي وائل قال كنت جالسا مع عبد الله وأبي موسى فقالا قال رسول الله صلى الله عليه وسلم إن بين يدى الساعة أياما يرفع فيها العلم وينزل فيها الجهل ويكثر فيها الهرج والهرج القتل 	 حدثنا محمد بن عبد الله بن نمير حدثنا وكيع وأبي قالا حدثنا الأعمش ح وحدثني أبو سعيد الأشج واللفظ له حدثنا وكيع حدثنا الأعمش عن أبي وائل قال كنت جالسا مع عبد الله وأبي موسى فقالا قال رسول الله صلى الله عليه وسلم إن بين يدى الساعة أياما يرفع فيها العلم وينزل فيها الجهل ويكثر فيها الهرج والهرج القتل 	 Abu Wa'il reported: I was sitting with 'Abdullah and Abu Musa that they reported Allah's Messenger (SL3M) having said: Prior to the Last Hour, there would be a time when knowledge would be taken away, and ignorance would take its place and there would be bloodshed on a large scale. 
muslim47_369981	 حدثنا أبو بكر بن النضر بن أبي النضر حدثنا أبو النضر حدثنا عبيد الله الأشجعي عن سفيان عن الأعمش عن أبي وائل عن	عن عبد الله وأبي موسى الأشعري قالا قال رسول الله صلى الله عليه وسلم ح وحدثني القاسم بن زكرياء حدثنا حسين الجعفي عن زائدة عن سليمان عن شقيق قال كنت جالسا مع عبد الله وأبي موسى وهما يتحدثان فقالا قال رسول الله صلى الله عليه وسلم بمثل حديث وكيع وابن نمير 	 حدثنا أبو بكر بن النضر بن أبي النضر حدثنا أبو النضر حدثنا عبيد الله الأشجعي عن سفيان عن الأعمش عن أبي وائل عن عبد الله وأبي موسى الأشعري قالا قال رسول الله صلى الله عليه وسلم ح وحدثني القاسم بن زكرياء حدثنا حسين الجعفي عن زائدة عن سليمان عن شقيق قال كنت جالسا مع عبد الله وأبي موسى وهما يتحدثان فقالا قال رسول الله صلى الله عليه وسلم بمثل حديث وكيع وابن نمير 	 This hadith has been narrated on the authority of 'Abdullah (b. Mas'ud) and Abu Musa (al-Asha'ri) through other chains of transmitters. 
muslim47_370000	 حدثنا أبو بكر بن	حدثنا أبي شيبة وأبو كريب وابن نمير وإسحاق الحنظلي جميعا عن أبي معاوية عن الأعمش عن شقيق عن أبي موسى عن النبي صلى الله عليه وسلم بمثله 	 حدثنا أبو بكر بن أبي شيبة وأبو كريب وابن نمير وإسحاق الحنظلي جميعا عن أبي معاوية عن الأعمش عن شقيق عن أبي موسى عن النبي صلى الله عليه وسلم بمثله 	 A hadith like this has been narrated on the authority of Abu Musa through another chain of transmitters. 
muslim47_370010	 حدثنا إسحاق بن إبراهيم أخبرنا جرير عن الأعمش عن	حدثنا أبي وائل قال إني لجالس مع عبد الله وأبي موسى وهما يتحدثان فقال أبو موسى قال رسول الله صلى الله عليه وسلم بمثله 	 حدثنا إسحاق بن إبراهيم أخبرنا جرير عن الأعمش عن أبي وائل قال إني لجالس مع عبد الله وأبي موسى وهما يتحدثان فقال أبو موسى قال رسول الله صلى الله عليه وسلم بمثله 	 Abu Wa'il reported: I was sitting with Abu Musa and 'Abdullah and they were conversing with each other and Abu Musa reported Allah's Messenger (SL3M) as saying (that we find in the above-mentioned ahadith). 
muslim47_370020	 حدثني حرملة بن يحيى أخبرنا ابن وهب أخبرني يونس عن ابن شهاب حدثني حميد بن عبد الرحمن بن	عن عوف أن أبا هريرة قال قال رسول الله صلى الله عليه وسلم يتقارب الزمان ويقبض العلم وتظهر الفتن ويلقى الشح ويكثر الهرج قالوا وما الهرج قال القتل 	 حدثني حرملة بن يحيى أخبرنا ابن وهب أخبرني يونس عن ابن شهاب حدثني حميد بن عبد الرحمن بن عوف أن أبا هريرة قال قال رسول الله صلى الله عليه وسلم يتقارب الزمان ويقبض العلم وتظهر الفتن ويلقى الشح ويكثر الهرج قالوا وما الهرج قال القتل 	 Abu Huraira reported Allah's Messenger (SL3M) as saying: (When) the time would draw close to the Last Hour, knowledge would be snatched away, turmoil would be rampant, miserliness would be put (in the hearts of the people) and therewould be much bloodshed. They said: What is al-harj? Thereupon he said: It is bloodshed. 
muslim47_370030	 حدثنا عبد الله بن عبد الرحمن الدارمي أخبرنا أبو اليمان أخبرنا شعيب عن الزهري حدثني حميد بن	أخبرنا عبد الرحمن الزهري أن أبا هريرة قال قال رسول الله صلى الله عليه وسلم يتقارب الزمان ويقبض العلم ثم ذكر مثله 	 حدثنا عبد الله بن عبد الرحمن الدارمي أخبرنا أبو اليمان أخبرنا شعيب عن الزهري حدثني حميد بن عبد الرحمن الزهري أن أبا هريرة قال قال رسول الله صلى الله عليه وسلم يتقارب الزمان ويقبض العلم ثم ذكر مثله 	 This hadith has been transmitted on the authority of Abu Huraira with a slight variation of wording. 
muslim47_370040	 حدثنا أبو بكر بن أبي شيبة حدثنا عبد الأعلى عن معمر عن الزهري عن سعيد عن أبي هريرة عن	عن النبي صلى الله عليه وسلم قال يتقارب الزمان وينقص العلم ثم ذكر مثل حديثهما 	 حدثنا أبو بكر بن أبي شيبة حدثنا عبد الأعلى عن معمر عن الزهري عن سعيد عن أبي هريرة عن النبي صلى الله عليه وسلم قال يتقارب الزمان وينقص العلم ثم ذكر مثل حديثهما 	 Abu Huraira reported Allah's Messenger (SL3M) having said: The time would draw close to the Last Hour and knowledge would decrease. The rest of the hadith is the same. 
muslim47_370053	 حدثنا يحيى بن أيوب وقتيبة وابن حجر قالوا حدثنا إسماعيل يعنون ابن جعفر عن العلاء عن أبيه عن	حدثنا أبي هريرة ح وحدثنا ابن نمير وأبو كريب وعمرو الناقد قالوا حدثنا إسحاق بن سليمان عن حنظلة عن سالم عن أبي هريرة ح وحدثنا محمد بن رافع حدثنا عبد الرزاق حدثنا معمر عن همام بن منبه عن أبي هريرة ح وحدثني أبو الطاهر أخبرنا ابن وهب عن عمرو بن الحارث عن أبي يونس عن أبي هريرة كلهم قال عن النبي صلى الله عليه وسلم بمثل حديث الزهري عن حميد عن أبي هريرة غير أنهم لم يذكروا ويلقى الشح 	 حدثنا يحيى بن أيوب وقتيبة وابن حجر قالوا حدثنا إسماعيل يعنون ابن جعفر عن العلاء عن أبيه عن أبي هريرة ح وحدثنا ابن نمير وأبو كريب وعمرو الناقد قالوا حدثنا إسحاق بن سليمان عن حنظلة عن سالم عن أبي هريرة ح وحدثنا محمد بن رافع حدثنا عبد الرزاق حدثنا معمر عن همام بن منبه عن أبي هريرة ح وحدثني أبو الطاهر أخبرنا ابن وهب عن عمرو بن الحارث عن أبي يونس عن أبي هريرة كلهم قال عن النبي صلى الله عليه وسلم بمثل حديث الزهري عن حميد عن أبي هريرة غير أنهم لم يذكروا ويلقى الشح 	" This hadith has been transmitted on the authority of Abu Huraira through other chains of narrators and there is no mention of: "" Miserliness would be put (in the hearts of the people)."" "
muslim47_370090	 حدثنا قتيبة بن سعيد حدثنا جرير عن هشام بن	حدثنا عروة عن أبيه سمعت عبد الله بن عمرو بن العاص يقول سمعت رسول الله صلى الله عليه وسلم يقول إن الله لا يقبض العلم انتزاعا ينتزعه من الناس ولكن يقبض العلم بقبض العلماء حتى إذا لم يترك عالما اتخذ الناس رءوسا جهالا فسئلوا فأفتوا بغير علم فضلوا وأضلوا 	 حدثنا قتيبة بن سعيد حدثنا جرير عن هشام بن عروة عن أبيه سمعت عبد الله بن عمرو بن العاص يقول سمعت رسول الله صلى الله عليه وسلم يقول إن الله لا يقبض العلم انتزاعا ينتزعه من الناس ولكن يقبض العلم بقبض العلماء حتى إذا لم يترك عالما اتخذ الناس رءوسا جهالا فسئلوا فأفتوا بغير علم فضلوا وأضلوا 	 'Abdullah b. 'Amr b. al-'As reported Allah's Messenger (SL3M) as saying: Verily, Allah does not take away knowledge by snatching it from the people but He takes away knowledge by taking away the scholars, so that when He leaves no learned person, people turn to the ignorant as their leaders; then they are asked to deliver religious verdicts and they deliver them without knowledge, they go astray, and lead others astray. 
