muslim44_364380	not identified	 وحدثنا قتيبة بن سعيد حدثنا عبد العزيز يعني ابن محمد عن سهيل عن أبيه عن أبي هريرة أن رسول الله صلى الله عليه وسلم كان على حراء هو وأبو بكر وعمر وعثمان وعلي وطلحة والزبير فتحركت الصخرة فقال رسول الله صلى الله عليه وسلم اهدأ فما عليك إلا نبي أو صديق أو شهيد 	 وحدثنا قتيبة بن سعيد حدثنا عبد العزيز يعني ابن محمد عن سهيل عن أبيه عن أبي هريرة أن رسول الله صلى الله عليه وسلم كان على حراء هو وأبو بكر وعمر وعثمان وعلي وطلحة والزبير فتحركت الصخرة فقال رسول الله صلى الله عليه وسلم اهدأ فما عليك إلا نبي أو صديق أو شهيد 	 Abu Huraira reported: Allah's Messenger (SL3M) was upon the mountain of Hira, ' and there were along with him Abu Bakr, Umar, Uthman. 'Ali, Talha, 'Zubair, that the mountain stirred; thereupon Allah's Messenger (SL3M) said: Be calm, there is none upon you but a Prophet, a Fiddle (the testifier of truth) and a Martyr. 
muslim44_364390	 حدثنا عبيد الله بن محمد بن يزيد بن	حدثنا خنيس وأحمد بن يوسف الأزدي قالا حدثنا إسماعيل بن أبي أويس حدثني سليمان بن بلال عن يحيى بن سعيد عن سهيل بن أبي صالح عن أبيه عن أبي هريرة أن رسول الله صلى الله عليه وسلم كان على جبل حراء فتحرك فقال رسول الله صلى الله عليه وسلم اسكن حراء فما عليك إلا نبي أو صديق أو شهيد وعليه النبي صلى الله عليه وسلم وأبو بكر وعمر وعثمان وعلي وطلحة والزبير وسعد بن أبي وقاص رضى الله عنهم 	 حدثنا عبيد الله بن محمد بن يزيد بن خنيس وأحمد بن يوسف الأزدي قالا حدثنا إسماعيل بن أبي أويس حدثني سليمان بن بلال عن يحيى بن سعيد عن سهيل بن أبي صالح عن أبيه عن أبي هريرة أن رسول الله صلى الله عليه وسلم كان على جبل حراء فتحرك فقال رسول الله صلى الله عليه وسلم اسكن حراء فما عليك إلا نبي أو صديق أو شهيد وعليه النبي صلى الله عليه وسلم وأبو بكر وعمر وعثمان وعلي وطلحة والزبير وسعد بن أبي وقاص رضى الله عنهم 	 Abu Huraira reported that Allah's Messenger (SL3M) was on the mountain of Hira' that it stirred; thereupon Allah's Messenger (SL3M) said: Hira! be calm, for there is none upon you but a Prophet, a Siddiq, a Shahid, and there were upon it Allah's Prophet (SL3M), Abu Bakr, 'Umar, Uthman, 'Ali, Talha, Zubair, Sa'd b. Abi Waqqas (Allah be pleased witli them). 
muslim44_364400	 حدثنا أبو بكر بن أبي شيبة حدثنا ابن نمير وعبدة قالا حدثنا هشام عن	حدثنا أبيه قال قالت لي عائشة أبواك والله من الذين استجابوا لله والرسول من بعد ما أصابهم القرح 	 حدثنا أبو بكر بن أبي شيبة حدثنا ابن نمير وعبدة قالا حدثنا هشام عن أبيه قال قالت لي عائشة أبواك والله من الذين استجابوا لله والرسول من بعد ما أصابهم القرح 	" Hisham reported on the authority of his father ('Urwa b. Zubair) that A'isha said: BY Allah, both fathers of yours are amongst those who have been men. tioned in this verse:"" Those who responded to the call of Allah and the Messenger after the misfortune had fallen upon thein"". "
muslim44_364410	not identified	 وحدثناه أبو بكر بن أبي شيبة حدثنا أبو أسامة حدثنا هشام بهذا الإسناد وزاد تعني أبا بكر والزبير 	 وحدثناه أبو بكر بن أبي شيبة حدثنا أبو أسامة حدثنا هشام بهذا الإسناد وزاد تعني أبا بكر والزبير 	 This hadith has been narrated on the authority of Hishan through the same chain of transmitters but with this addition (that by both fathers of yours) he meant Abu Bakr and Zubair. 
muslim44_364420	 حدثنا أبو كريب محمد بن العلاء حدثنا وكيع حدثنا إسماعيل عن البهي عن	حدثنا عروة قال قالت لي عائشة كان أبواك من الذين استجابوا لله والرسول من بعد ما أصابهم القرح 	 حدثنا أبو كريب محمد بن العلاء حدثنا وكيع حدثنا إسماعيل عن البهي عن عروة قال قالت لي عائشة كان أبواك من الذين استجابوا لله والرسول من بعد ما أصابهم القرح 	" 'Urwa reported: 'Aisha said to me: Your fathers (Zubair and Abu Bakr) were amongst those about whom (it has been revealed):"" Those who responded to the call of Allah and His Messenger after the misfortune had fallen upon them."" "
muslim44_364430	 حدثنا أبو بكر بن أبي شيبة حدثنا إسماعيل ابن علية عن خالد ح وحدثني زهير بن	حدثنا حرب حدثنا إسماعيل ابن علية أخبرنا خالد عن أبي قلابة قال قال أنس قال رسول الله صلى الله عليه وسلم إن لكل أمة أمينا وإن أميننا أيتها الأمة أبو عبيدة بن الجراح 	 حدثنا أبو بكر بن أبي شيبة حدثنا إسماعيل ابن علية عن خالد ح وحدثني زهير بن حرب حدثنا إسماعيل ابن علية أخبرنا خالد عن أبي قلابة قال قال أنس قال رسول الله صلى الله عليه وسلم إن لكل أمة أمينا وإن أميننا أيتها الأمة أبو عبيدة بن الجراح 	 Anas reported Allah's Messenger (SL3M) as saying: For every Umma there is a man of trust and the man of trust of this Umma is Abu 'Ubaida b. Jarrah. 
muslim44_364440	 حدثني عمرو الناقد حدثنا عفان حدثنا حماد وهو ابن سلمة عن ثابت عن	حدثنا أنس أن أهل اليمن قدموا على رسول الله صلى الله عليه وسلم فقالوا ابعث معنا رجلا يعلمنا السنة والإسلام قال فأخذ بيد أبي عبيدة فقال هذا أمين هذه الأمة 	 حدثني عمرو الناقد حدثنا عفان حدثنا حماد وهو ابن سلمة عن ثابت عن أنس أن أهل اليمن قدموا على رسول الله صلى الله عليه وسلم فقالوا ابعث معنا رجلا يعلمنا السنة والإسلام قال فأخذ بيد أبي عبيدة فقال هذا أمين هذه الأمة 	 Anas reported that the people of Yemen came to Allah's Messenger (SL3M) and said: Send with us a person who should teach us Sunnah and al-Islam, whereupon he (the Holy Prophet) caught hold of the hand of Ubaida and said: He is a man of trust of this Umma. 
muslim44_364450	 حدثنا محمد بن	حدثنا المثنى وابن بشار واللفظ لابن المثنى قالا حدثنا محمد بن جعفر حدثنا شعبة قال سمعت أبا إسحاق يحدث عن صلة بن زفر عن حذيفة قال جاء أهل نجران إلى رسول الله صلى الله عليه وسلم فقالوا يا رسول الله ابعث إلينا رجلا أمينا فقال لأبعثن إليكم رجلا أمينا حق أمين حق أمين قال فاستشرف لها الناس قال فبعث أبا عبيدة بن الجراح 	 حدثنا محمد بن المثنى وابن بشار واللفظ لابن المثنى قالا حدثنا محمد بن جعفر حدثنا شعبة قال سمعت أبا إسحاق يحدث عن صلة بن زفر عن حذيفة قال جاء أهل نجران إلى رسول الله صلى الله عليه وسلم فقالوا يا رسول الله ابعث إلينا رجلا أمينا فقال لأبعثن إليكم رجلا أمينا حق أمين حق أمين قال فاستشرف لها الناس قال فبعث أبا عبيدة بن الجراح 	 Hudhaifa reported that the people of Najran came to Allah's Messenger (SL3M) and said: Allah's Messenger, send along with us a man of trust; whereupon he said: I would definitely send to you a man of trust, a man of trust in the true sense of the term. Thereupon his Companions looked up eagerly and he sent Abu Ubaida b. Jarrah. 
muslim44_364460	 حدثنا إسحاق بن إبراهيم أخبرنا أبو داود الحفري حدثنا سفيان عن	حدثنا أبي إسحاق بهذا الإسناد نحوه 	 حدثنا إسحاق بن إبراهيم أخبرنا أبو داود الحفري حدثنا سفيان عن أبي إسحاق بهذا الإسناد نحوه 	 This hadith has been reported on the authority of Abu Ishaq with the same chain of transmitters. 
muslim44_364470	 حدثني أحمد بن حنبل حدثنا سفيان بن عيينة حدثني عبيد الله بن أبي يزيد عن نافع بن	حدثني جبير عن أبي هريرة عن النبي صلى الله عليه وسلم أنه قال لحسن اللهم إني أحبه فأحبه وأحبب من يحبه 	 حدثني أحمد بن حنبل حدثنا سفيان بن عيينة حدثني عبيد الله بن أبي يزيد عن نافع بن جبير عن أبي هريرة عن النبي صلى الله عليه وسلم أنه قال لحسن اللهم إني أحبه فأحبه وأحبب من يحبه 	 Abu Huraira reported Allah's Messenger (SL3M) as saying to Hasan: O Allah, behold, I love him. Thou too love him and love one who loves him. 
muslim44_364480	 حدثنا ابن أبي عمر حدثنا سفيان عن عبيد الله بن	حدثنا أبي يزيد عن نافع بن جبير بن مطعم عن أبي هريرة قال خرجت مع رسول الله صلى الله عليه وسلم في طائفة من النهار لا يكلمني ولا أكلمه حتى جاء سوق بني قينقاع ثم انصرف حتى أتى خباء فاطمة فقال أثم لكع أثم لكع يعني حسنا فظننا أنه إنما تحبسه أمه لأن تغسله وتلبسه سخابا فلم يلبث أن جاء يسعى حتى اعتنق كل واحد منهما صاحبه فقال رسول الله صلى الله عليه وسلم اللهم إني أحبه فأحبه وأحبب من يحبه 	 حدثنا ابن أبي عمر حدثنا سفيان عن عبيد الله بن أبي يزيد عن نافع بن جبير بن مطعم عن أبي هريرة قال خرجت مع رسول الله صلى الله عليه وسلم في طائفة من النهار لا يكلمني ولا أكلمه حتى جاء سوق بني قينقاع ثم انصرف حتى أتى خباء فاطمة فقال أثم لكع أثم لكع يعني حسنا فظننا أنه إنما تحبسه أمه لأن تغسله وتلبسه سخابا فلم يلبث أن جاء يسعى حتى اعتنق كل واحد منهما صاحبه فقال رسول الله صلى الله عليه وسلم اللهم إني أحبه فأحبه وأحبب من يحبه 	 Abu Huraira reported: I went along with Allah's Messenger (SL3M) at a time during the day but he did not talk to me and I did not talk to him until he reached the market of Bani Qainuqa`. He came back to the tent of Fatima and said: Is the little chap (meaning Hasan) there? We were under the impression that his mother had detained him in order to bathe him and dress him and garland him with a sweet garland. Not much time had passed that he (Hasan) came running until both of them embraced each other, thereupon Allah's Messenger (SL3M) said: O Allah, I love him; love him Thou and love one who loves him (Hasan). 
muslim44_364490	 حدثنا عبيد الله بن معاذ حدثنا أبي حدثنا شعبة عن عدي وهو ابن ثابت حدثنا البراء بن	عن عازب قال رأيت الحسن بن علي على عاتق النبي صلى الله عليه وسلم وهو يقول اللهم إني أحبه فأحبه 	 حدثنا عبيد الله بن معاذ حدثنا أبي حدثنا شعبة عن عدي وهو ابن ثابت حدثنا البراء بن عازب قال رأيت الحسن بن علي على عاتق النبي صلى الله عليه وسلم وهو يقول اللهم إني أحبه فأحبه 	 Al-Bara' b. Azib reported: I saw Hasan b. 'Ali upon the shoulders of Allah's Apostle (SL3M) and he was saying: O Allah, I love him, and love him Thou. 
muslim44_364500	 حدثنا محمد بن بشار وأبو بكر بن	حدثنا نافع قال ابن نافع حدثنا غندر حدثنا شعبة عن عدي وهو ابن ثابت عن البراء قال رأيت رسول الله صلى الله عليه وسلم واضعا الحسن بن علي على عاتقه وهو يقول اللهم إني أحبه فأحبه 	 حدثنا محمد بن بشار وأبو بكر بن نافع قال ابن نافع حدثنا غندر حدثنا شعبة عن عدي وهو ابن ثابت عن البراء قال رأيت رسول الله صلى الله عليه وسلم واضعا الحسن بن علي على عاتقه وهو يقول اللهم إني أحبه فأحبه 	 Al-Bara' b. Azib reported: I saw the Messenger of Allah (SL3M) with Al-Hasan b. 'Ali placed upon his shoulders and he was saying: O Allah, I love him, and love him Thou. 
muslim44_364510	 حدثني عبد الله بن الرومي اليمامي وعباس بن	حدثني عبد العظيم العنبري قالا حدثنا النضر بن محمد حدثنا عكرمة وهو ابن عمار حدثنا إياس عن أبيه قال لقد قدت بنبي الله صلى الله عليه وسلم والحسن والحسين بغلته الشهباء حتى أدخلتهم حجرة النبي صلى الله عليه وسلم هذا قدامه وهذا خلفه 	 حدثني عبد الله بن الرومي اليمامي وعباس بن عبد العظيم العنبري قالا حدثنا النضر بن محمد حدثنا عكرمة وهو ابن عمار حدثنا إياس عن أبيه قال لقد قدت بنبي الله صلى الله عليه وسلم والحسن والحسين بغلته الشهباء حتى أدخلتهم حجرة النبي صلى الله عليه وسلم هذا قدامه وهذا خلفه 	 Iyas reported on the authority of his father: I (had the honour of) leading the white mule on which rode Allah's Apostle (SL3M) and with him were Hasan and Husain, till it reached the apartment of Allah's Apostle (SL3M). The one amongst them was seated before him and the other one was seated behind him. 
muslim44_364520	 حدثنا أبو بكر بن أبي شيبة ومحمد بن	حدثنا عبد الله بن نمير واللفظ لأبي بكر قالا حدثنا محمد بن بشر عن زكرياء عن مصعب بن شيبة عن صفية بنت شيبة قالت قالت عائشة خرج النبي صلى الله عليه وسلم غداة وعليه مرط مرحل من شعر أسود فجاء الحسن بن علي فأدخله ثم جاء الحسين فدخل معه ثم جاءت فاطمة فأدخلها ثم جاء علي فأدخله ثم قال { إنما يريد الله ليذهب عنكم الرجس أهل البيت ويطهركم تطهيرا} 	 حدثنا أبو بكر بن أبي شيبة ومحمد بن عبد الله بن نمير واللفظ لأبي بكر قالا حدثنا محمد بن بشر عن زكرياء عن مصعب بن شيبة عن صفية بنت شيبة قالت قالت عائشة خرج النبي صلى الله عليه وسلم غداة وعليه مرط مرحل من شعر أسود فجاء الحسن بن علي فأدخله ثم جاء الحسين فدخل معه ثم جاءت فاطمة فأدخلها ثم جاء علي فأدخله ثم قال { إنما يريد الله ليذهب عنكم الرجس أهل البيت ويطهركم تطهيرا} 	 'A'isha reported that Allah's Apostle (SL3M) went out one norning wearing a striped cloak of the black camel's hair that there came Hasan b. 'Ali. He wrapped hitn under it, then came Husain and he wrapped him under it along with the other one (Hasan). Then came Fatima and he took her under it, then came 'Ali and he also took him under it and then said: Allah only desires to take away any uncleanliness from you, O people of the household, and purify you (thorough purifying) 
muslim44_364530	 حدثنا قتيبة بن سعيد حدثنا يعقوب بن	حدثنا عبد الرحمن القاري عن موسى بن عقبة عن سالم بن عبد الله عن أبيه أنه كان يقول ما كنا ندعو زيد بن حارثة إلا زيد بن محمد حتى نزل القرآن { ادعوهم لآبائهم هو أقسط عند الله} قال الشيخ أبو أحمد محمد بن عيسى أخبرنا أبو العباس السراج ومحمد بن عبد الله بن يوسف الدويري قالا حدثنا قتيبة بن سعيد بهذا الحديث 	 حدثنا قتيبة بن سعيد حدثنا يعقوب بن عبد الرحمن القاري عن موسى بن عقبة عن سالم بن عبد الله عن أبيه أنه كان يقول ما كنا ندعو زيد بن حارثة إلا زيد بن محمد حتى نزل القرآن { ادعوهم لآبائهم هو أقسط عند الله} قال الشيخ أبو أحمد محمد بن عيسى أخبرنا أبو العباس السراج ومحمد بن عبد الله بن يوسف الدويري قالا حدثنا قتيبة بن سعيد بهذا الحديث 	" Salim b. 'Abdullah reported on the authority of his father: We were in the habit of calling Zaid b. Harith as Zaid b. Muhammad until it was revealed in the Qur'an:"" Call them by the names of their fathers. This is more equitable with Allah"" (This hadith has been transmitted on the authority of Qutaiba b. Sa'd) "
muslim44_364540	 حدثني أحمد بن سعيد الدارمي حدثنا حبان حدثنا وهيب حدثنا موسى بن عقبة حدثني سالم عن	حدثنا عبد الله بمثله 	 حدثني أحمد بن سعيد الدارمي حدثنا حبان حدثنا وهيب حدثنا موسى بن عقبة حدثني سالم عن عبد الله بمثله 	 This hadith has been narrated on the authority 'Abdullah through another chain of transmitters. 
muslim44_364550	 حدثنا يحيى بن يحيى ويحيى بن	حدثنا أيوب وقتيبة وابن حجر قال يحيى بن يحيى أخبرنا وقال الآخرون حدثنا إسماعيل يعنون ابن جعفر عن عبد الله بن دينار أنه سمع ابن عمر يقول بعث رسول الله صلى الله عليه وسلم بعثا وأمر عليهم أسامة بن زيد فطعن الناس في إمرته فقام رسول الله صلى الله عليه وسلم فقال إن تطعنوا في إمرته فقد كنتم تطعنون في إمرة أبيه من قبل وايم الله إن كان لخليقا للإمرة وإن كان لمن أحب الناس إلى وإن هذا لمن أحب الناس إلى بعده 	 حدثنا يحيى بن يحيى ويحيى بن أيوب وقتيبة وابن حجر قال يحيى بن يحيى أخبرنا وقال الآخرون حدثنا إسماعيل يعنون ابن جعفر عن عبد الله بن دينار أنه سمع ابن عمر يقول بعث رسول الله صلى الله عليه وسلم بعثا وأمر عليهم أسامة بن زيد فطعن الناس في إمرته فقام رسول الله صلى الله عليه وسلم فقال إن تطعنوا في إمرته فقد كنتم تطعنون في إمرة أبيه من قبل وايم الله إن كان لخليقا للإمرة وإن كان لمن أحب الناس إلى وإن هذا لمن أحب الناس إلى بعده 	 Ibn 'Umar reported that Allah's Messenger (SL3M) sent an expedition and appointed Usama b. Zaid as its chief. The people objected to his command, whereupon Allah's Messenger (SL3M) stood up and said: You object to his command and before this you objected to the command of his father (Zaid). By Allah, he was fit as the commander and he was one of the dearest of persons to me and after him, behold! this one (Usama) is one of the dearest of persons to me. 
muslim44_364560	 حدثنا أبو كريب محمد بن العلاء حدثنا أبو أسامة عن عمر يعني ابن حمزة عن سالم عن	عن أبيه أن رسول الله صلى الله عليه وسلم قال وهو على المنبر إن تطعنوا في إمارته يريد أسامة بن زيد فقد طعنتم في إمارة أبيه من قبله وايم الله إن كان لخليقا لها وايم الله إن كان لأحب الناس إلى وايم الله إن هذا لها لخليق يريد أسامة بن زيد وايم الله إن كان لأحبهم إلى من بعده فأوصيكم به فإنه من صالحيكم 	 حدثنا أبو كريب محمد بن العلاء حدثنا أبو أسامة عن عمر يعني ابن حمزة عن سالم عن أبيه أن رسول الله صلى الله عليه وسلم قال وهو على المنبر إن تطعنوا في إمارته يريد أسامة بن زيد فقد طعنتم في إمارة أبيه من قبله وايم الله إن كان لخليقا لها وايم الله إن كان لأحب الناس إلى وايم الله إن هذا لها لخليق يريد أسامة بن زيد وايم الله إن كان لأحبهم إلى من بعده فأوصيكم به فإنه من صالحيكم 	 Salim reported on the authority of his father that Allah's Messenger (SL3M) said on the pulpit: You object to the command of Usima b. Zaid as you had objected before to the command of his father (Zaid). By Allah, he was most competent for it and, by Allah, he was dearest to me amongst people and, by Allah, the same is the case with Usama b. Zaid. He is most dear to me after him and I advise you to treat him well for he is pious amongst you. 
muslim44_364570	 حدثنا أبو بكر بن أبي شيبة حدثنا إسماعيل ابن علية عن حبيب بن الشهيد عن عبد الله بن مليكة قال عبد الله بن	عن جعفر لابن الزبير أتذكر إذ تلقينا رسول الله صلى الله عليه وسلم أنا وأنت وابن عباس قال نعم فحملنا وتركك 	 حدثنا أبو بكر بن أبي شيبة حدثنا إسماعيل ابن علية عن حبيب بن الشهيد عن عبد الله بن مليكة قال عبد الله بن جعفر لابن الزبير أتذكر إذ تلقينا رسول الله صلى الله عليه وسلم أنا وأنت وابن عباس قال نعم فحملنا وتركك 	 Abdullah b. Abu Mulaika reported that Abdullah b. Jafar said to Ibn Zubair: Do you remember (the occasion) when we three (i. e. I, you and lbn 'Abbas) met Allah's Messenger (SL3M) and he mounted us (on his camel) but left you? He said: Yes. 
muslim44_364580	 حدثنا إسحاق بن إبراهيم أخبرنا أبو أسامة عن حبيب بن	حدثنا الشهيد بمثل حديث ابن علية وإسناده 	 حدثنا إسحاق بن إبراهيم أخبرنا أبو أسامة عن حبيب بن الشهيد بمثل حديث ابن علية وإسناده 	 This hadith has been transmitted on the authority of Habib b. Ash-Shahid. 
