muslim44_365270	 حدثنا قتيبة بن سعيد وزهير بن حرب وعثمان بن	حدثنا أبي شيبة قالوا حدثنا جرير عن الأعمش عن أبي وائل عن مسروق قال كنا عند عبد الله بن عمرو فذكرنا حديثا عن عبد الله بن مسعود فقال إن ذاك الرجل لا أزال أحبه بعد شىء سمعته من رسول الله صلى الله عليه وسلم يقوله سمعته يقول اقرءوا القرآن من أربعة نفر من ابن أم عبد فبدأ به ومن أبى بن كعب ومن سالم مولى أبي حذيفة ومن معاذ بن جبل وحرف لم يذكره زهير قوله يقوله 	 حدثنا قتيبة بن سعيد وزهير بن حرب وعثمان بن أبي شيبة قالوا حدثنا جرير عن الأعمش عن أبي وائل عن مسروق قال كنا عند عبد الله بن عمرو فذكرنا حديثا عن عبد الله بن مسعود فقال إن ذاك الرجل لا أزال أحبه بعد شىء سمعته من رسول الله صلى الله عليه وسلم يقوله سمعته يقول اقرءوا القرآن من أربعة نفر من ابن أم عبد فبدأ به ومن أبى بن كعب ومن سالم مولى أبي حذيفة ومن معاذ بن جبل وحرف لم يذكره زهير قوله يقوله 	 Masruq reported: We were in the company of Abdullah b 'Amr that we made a mention of a hadith from Abdullah b. Mas'ud; thereupon he said: That is a person whose love ever remains (fresh in my heart) after I heard Allah's Messenger (SL3M) as saying: Learn Qur'an from four persons: Ibn Umm 'Abd, i e. Abdullah b. Mas'ud and he started from his name-then Ubayy b. Ka'b and Mu'adh b Jabal. Zuhri did not make a mention of the words yaquluhu in his narration 
muslim44_365280	 حدثنا أبو بكر بن أبي شيبة وأبو كريب قالا حدثنا أبو معاوية عن الأعمش بإسناد جرير ووكيع في رواية أبي بكر عن	عن أبي معاوية قدم معاذا قبل أبى وفي رواية أبي كريب أبى قبل معاذ 	 حدثنا أبو بكر بن أبي شيبة وأبو كريب قالا حدثنا أبو معاوية عن الأعمش بإسناد جرير ووكيع في رواية أبي بكر عن أبي معاوية قدم معاذا قبل أبى وفي رواية أبي كريب أبى قبل معاذ 	 This hadith has been reported on the authority of Abu Bakr b. Abu Shaiba and Abu Kuraib, and both of them said: Abu Mu'awiya narrated to us from A'mash on the authority of Jarir and Waki', and in a narration of Abu Bakr transmitted on the authority of Abu Mu'awiya the mention of Mu'adh has preceded Ubayy's, and in the narration transmitted on the authority of Abu Kuraib, the name of Ubayy preceded Mu'ddh's. 
muslim44_365290	 حدثنا ابن المثنى وابن بشار قالا حدثنا ابن أبي عدي ح وحدثني بشر بن خالد أخبرنا محمد يعني ابن جعفر كلاهما عن شعبة عن الأعمش بإسنادهم واختلفا عن	عن شعبة في تنسيق الأربعة 	 حدثنا ابن المثنى وابن بشار قالا حدثنا ابن أبي عدي ح وحدثني بشر بن خالد أخبرنا محمد يعني ابن جعفر كلاهما عن شعبة عن الأعمش بإسنادهم واختلفا عن شعبة في تنسيق الأربعة 	 This tradition has been transmitted on the authority of Shu'ba through A'mash, but there is a difference of order of the four. 
muslim44_365300	 حدثنا محمد بن المثنى وابن بشار قالا حدثنا محمد بن	حدثنا جعفر حدثنا شعبة عن عمرو بن مرة عن إبراهيم عن مسروق قال ذكروا ابن مسعود عند عبد الله بن عمرو فقال ذاك رجل لا أزال أحبه بعد ما سمعت من رسول الله صلى الله عليه وسلم يقول استقرئوا القرآن من أربعة من ابن مسعود وسالم مولى أبي حذيفة وأبى بن كعب ومعاذ بن جبل 	 حدثنا محمد بن المثنى وابن بشار قالا حدثنا محمد بن جعفر حدثنا شعبة عن عمرو بن مرة عن إبراهيم عن مسروق قال ذكروا ابن مسعود عند عبد الله بن عمرو فقال ذاك رجل لا أزال أحبه بعد ما سمعت من رسول الله صلى الله عليه وسلم يقول استقرئوا القرآن من أربعة من ابن مسعود وسالم مولى أبي حذيفة وأبى بن كعب ومعاذ بن جبل 	 Masruq reported: They made a mention of Ibn Mas'ud before 'Abdullah b. Amr, whereupon he said: He is a person whose love is always fresh in my heart after I heard Allah's Messenger (SL3M) as saying: Learn the recita- tion of the Qur'an from four persons: from Ibn Mas'ud, Salim, the ally of Abu Hudhaifa, Ubayy b. Ka'b, Mu'adh b. Jabal. 
muslim44_365310	 حدثنا عبيد الله بن معاذ حدثنا أبي حدثنا	حدثنا شعبة بهذا الإسناد وزاد قال شعبة بدأ بهذين لا أدري بأيهما بدأ 	 حدثنا عبيد الله بن معاذ حدثنا أبي حدثنا شعبة بهذا الإسناد وزاد قال شعبة بدأ بهذين لا أدري بأيهما بدأ 	 Ubaidullah b. Mu'adh reported it on the authority of his father Shu'ba with the same chain of transmitters and he made this addition. He made a mention of these two names but I do not know whose name he mentioned first. 
muslim44_365320	 حدثنا محمد بن المثنى حدثنا أبو داود حدثنا شعبة عن	حدثنا قتادة قال سمعت أنسا يقول جمع القرآن على عهد رسول الله صلى الله عليه وسلم أربعة كلهم من الأنصار معاذ بن جبل وأبى بن كعب وزيد بن ثابت وأبو زيد قال قتادة قلت لأنس من أبو زيد قال أحد عمومتي 	 حدثنا محمد بن المثنى حدثنا أبو داود حدثنا شعبة عن قتادة قال سمعت أنسا يقول جمع القرآن على عهد رسول الله صلى الله عليه وسلم أربعة كلهم من الأنصار معاذ بن جبل وأبى بن كعب وزيد بن ثابت وأبو زيد قال قتادة قلت لأنس من أبو زيد قال أحد عمومتي 	 Anas is reported to have said: Four persons collected the Qur'an during the lifetime of Allah's Messenger (SL3M) and all of them were Ansar: Mu'adh b. Jabal, Ubayy b. Ka'b, Zaid b. Thabit, Abu Zaid. Qatada said: Anas, who was Abu Zaid? He said: He was one of my uncles. 
muslim44_365330	 حدثني أبو داود سليمان بن معبد حدثنا عمرو بن	حدثني عاصم حدثنا همام حدثنا قتادة قال قلت لأنس بن مالك من جمع القرآن على عهد رسول الله صلى الله عليه وسلم قال أربعة كلهم من الأنصار أبى بن كعب ومعاذ بن جبل وزيد بن ثابت ورجل من الأنصار يكنى أبا زيد 	 حدثني أبو داود سليمان بن معبد حدثنا عمرو بن عاصم حدثنا همام حدثنا قتادة قال قلت لأنس بن مالك من جمع القرآن على عهد رسول الله صلى الله عليه وسلم قال أربعة كلهم من الأنصار أبى بن كعب ومعاذ بن جبل وزيد بن ثابت ورجل من الأنصار يكنى أبا زيد 	 Hammam said: I said to Anas b. Malik: Who collected the Qur'an during the lifetime of Allah's Messenger (SL3M)? He said: Four (persons), all of them belonging to Ansir: Ubayy b. Ka'b, Mu'adh b. Jabal, Zaid b. Thabit and a person from the Ansar whose Kunya was Abu Zaid. 
muslim44_365340	 حدثنا هداب بن خالد حدثنا همام حدثنا قتادة عن أنس بن	عن مالك أن رسول الله صلى الله عليه وسلم قال لأبى إن الله عز وجل أمرني أن أقرأ عليك قال آلله سماني لك قال الله سماك لي قال فجعل أبى يبكي 	 حدثنا هداب بن خالد حدثنا همام حدثنا قتادة عن أنس بن مالك أن رسول الله صلى الله عليه وسلم قال لأبى إن الله عز وجل أمرني أن أقرأ عليك قال آلله سماني لك قال الله سماك لي قال فجعل أبى يبكي 	 Anas b. Malik reported that Allah's Messenger (SL3M) said to Ubayy: Verily Allah, the Exalted and Glorious, has commanded me to recite the Qur'an to you, whereupon he said: (Has) Allah mentioned my name to you? He said: Allah has mentioned your name to me. Thereupon he began to shed tears (of joy) 
muslim44_365350	 حدثنا محمد بن المثنى وابن بشار قالا حدثنا محمد بن	حدثنا جعفر حدثنا شعبة قال سمعت قتادة يحدث عن أنس بن مالك قال قال رسول الله صلى الله عليه وسلم لأبى بن كعب إن الله أمرني أن أقرأ عليك { لم يكن الذين كفروا} قال وسماني قال نعم قال فبكى 	 حدثنا محمد بن المثنى وابن بشار قالا حدثنا محمد بن جعفر حدثنا شعبة قال سمعت قتادة يحدث عن أنس بن مالك قال قال رسول الله صلى الله عليه وسلم لأبى بن كعب إن الله أمرني أن أقرأ عليك { لم يكن الذين كفروا} قال وسماني قال نعم قال فبكى 	 Anas b. Malik reported that Allah's Messenger (SL3M) said to Ubayy b. Ka'b: I have been commanded to recite to you the Sura (al- Bayyinah) which opens with these words (Lam Yakunil-ladhiyna Kafaruu) He said: Has he mentioned to you my name? He said: Yes; thereupon he shed tears of joy. 
muslim44_365360	not identified	 حدثنيه يحيى بن حبيب حدثنا خالد يعني ابن الحارث حدثنا شعبة عن قتادة قال سمعت أنسا يقول قال رسول الله صلى الله عليه وسلم لأبى بمثله 	 حدثنيه يحيى بن حبيب حدثنا خالد يعني ابن الحارث حدثنا شعبة عن قتادة قال سمعت أنسا يقول قال رسول الله صلى الله عليه وسلم لأبى بمثله 	 This hadith has been narrated on the authority of Anas through another chain of transmitters. 
muslim44_365370	 حدثنا عبد بن حميد أخبرنا عبد الرزاق أخبرنا ابن جريج أخبرني أبو الزبير أنه سمع جابر بن	أخبرنا عبد الله يقول قال رسول الله صلى الله عليه وسلم وجنازة سعد بن معاذ بين أيديهم اهتز لها عرش الرحمن 	 حدثنا عبد بن حميد أخبرنا عبد الرزاق أخبرنا ابن جريج أخبرني أبو الزبير أنه سمع جابر بن عبد الله يقول قال رسول الله صلى الله عليه وسلم وجنازة سعد بن معاذ بين أيديهم اهتز لها عرش الرحمن 	 Jabir b. 'Abdullah reported Allah's Messenger (SL3M) as saying while the bier of Sa'd b. Mu'adh was placed before them: The Throne of the most Gracious shook at the death of Sa'd b. Mu'adh. 
muslim44_365380	 حدثنا عمرو الناقد حدثنا عبد الله بن إدريس الأودي حدثنا الأعمش عن أبي سفيان عن	حدثنا جابر قال قال رسول الله صلى الله عليه وسلم اهتز عرش الرحمن لموت سعد بن معاذ 	 حدثنا عمرو الناقد حدثنا عبد الله بن إدريس الأودي حدثنا الأعمش عن أبي سفيان عن جابر قال قال رسول الله صلى الله عليه وسلم اهتز عرش الرحمن لموت سعد بن معاذ 	 Jabir reported that the Throne of the most Compassionate shook because of the death of Sa'd b. Mu'adh. 
muslim44_365390	 حدثنا محمد بن عبد الله الرزي حدثنا عبد الوهاب بن	حدثنا عطاء الخفاف عن سعيد عن قتادة حدثنا أنس بن مالك أن نبي الله صلى الله عليه وسلم قال وجنازته موضوعة يعني سعدا اهتز لها عرش الرحمن 	 حدثنا محمد بن عبد الله الرزي حدثنا عبد الوهاب بن عطاء الخفاف عن سعيد عن قتادة حدثنا أنس بن مالك أن نبي الله صلى الله عليه وسلم قال وجنازته موضوعة يعني سعدا اهتز لها عرش الرحمن 	 Anas b. Malik reported Allah's Messenger (SL3M) as say- ing: That his bier (that of Sa'd) was placed (before them) and the Throne of the most Compassionate shook. 
muslim44_365400	 حدثنا محمد بن المثنى وابن بشار قالا حدثنا محمد بن	حدثنا جعفر حدثنا شعبة عن أبي إسحاق قال سمعت البراء يقول أهديت لرسول الله صلى الله عليه وسلم حلة حرير فجعل أصحابه يلمسونها ويعجبون من لينها فقال أتعجبون من لين هذه لمناديل سعد بن معاذ في الجنة خير منها وألين 	 حدثنا محمد بن المثنى وابن بشار قالا حدثنا محمد بن جعفر حدثنا شعبة عن أبي إسحاق قال سمعت البراء يقول أهديت لرسول الله صلى الله عليه وسلم حلة حرير فجعل أصحابه يلمسونها ويعجبون من لينها فقال أتعجبون من لين هذه لمناديل سعد بن معاذ في الجنة خير منها وألين 	 Al-Bara' reported that a garment of silk was presented to Allah's Messenger (SL3M). His Companions touched it and admired its softness; there- upon he said: Do you admire the softness of this (cloth)? The handkerchiefs of Sa'd b. Mu'adh in Paradise are better than this. 
muslim44_365410	 حدثنا أحمد بن عبدة الضبي حدثنا أبو داود حدثنا شعبة أنبأني أبو إسحاق قال سمعت البراء بن	حدثنا عازب يقول أتي رسول الله صلى الله عليه وسلم بثوب حرير فذكر الحديث ثم قال ابن عبدة أخبرنا أبو داود حدثنا شعبة حدثني قتادة عن أنس بن مالك عن النبي صلى الله عليه وسلم بنحو هذا أو بمثله 	 حدثنا أحمد بن عبدة الضبي حدثنا أبو داود حدثنا شعبة أنبأني أبو إسحاق قال سمعت البراء بن عازب يقول أتي رسول الله صلى الله عليه وسلم بثوب حرير فذكر الحديث ثم قال ابن عبدة أخبرنا أبو داود حدثنا شعبة حدثني قتادة عن أنس بن مالك عن النبي صلى الله عليه وسلم بنحو هذا أو بمثله 	 This hadith has been narrated on the authority of Anas b. Malik through another chain of transmitters. 
muslim44_365420	 حدثنا محمد بن عمرو بن جبلة حدثنا أمية بن	حدثنا خالد حدثنا شعبة بهذا الحديث بالإسنادين جميعا كرواية أبي داود 	 حدثنا محمد بن عمرو بن جبلة حدثنا أمية بن خالد حدثنا شعبة بهذا الحديث بالإسنادين جميعا كرواية أبي داود 	 This hadith has been reported on the authority of Shu'ba combining the two chains of transmitters. 
muslim44_365430	 حدثنا زهير بن حرب حدثنا يونس بن محمد حدثنا شيبان عن قتادة حدثنا أنس بن	حدثنا مالك أنه أهدي لرسول الله صلى الله عليه وسلم جبة من سندس وكان ينهى عن الحرير فعجب الناس منها فقال والذي نفس محمد بيده إن مناديل سعد بن معاذ في الجنة أحسن من هذا 	 حدثنا زهير بن حرب حدثنا يونس بن محمد حدثنا شيبان عن قتادة حدثنا أنس بن مالك أنه أهدي لرسول الله صلى الله عليه وسلم جبة من سندس وكان ينهى عن الحرير فعجب الناس منها فقال والذي نفس محمد بيده إن مناديل سعد بن معاذ في الجنة أحسن من هذا 	 Anas b Malik reported that Allah's Messenger (SL3M) was presented a garment of sundus and he prohibited the use of silk. The persons admired it, whereupon he said: By Him in Whose Hand is the life of Muhammad, the kerchiefs of Sa'd b. Mu'adh in Paradise are better than this. 
muslim44_365440	not identified	 حدثناه محمد بن بشار حدثنا سالم بن نوح حدثنا عمر بن عامر عن قتادة عن أنس أن أكيدر دومة الجندل أهدى لرسول الله صلى الله عليه وسلم حلة فذكر نحوه ولم يذكر فيه وكان ينهى عن الحرير 	 حدثناه محمد بن بشار حدثنا سالم بن نوح حدثنا عمر بن عامر عن قتادة عن أنس أن أكيدر دومة الجندل أهدى لرسول الله صلى الله عليه وسلم حلة فذكر نحوه ولم يذكر فيه وكان ينهى عن الحرير 	 Anas reported the king of Dumat al-Jandal presented to Allah's Messenger (SL3M) the garment and lie made no mention (of the fact) that he prohibited the use of silk. 
muslim44_365450	 حدثنا أبو بكر بن أبي شيبة حدثنا عفان حدثنا حماد بن سلمة حدثنا ثابت عن	حدثنا أنس أن رسول الله صلى الله عليه وسلم أخذ سيفا يوم أحد فقال من يأخذ مني هذا فبسطوا أيديهم كل إنسان منهم يقول أنا أنا قال فمن يأخذه بحقه قال فأحجم القوم فقال سماك بن خرشة أبو دجانة أنا آخذه بحقه قال فأخذه ففلق به هام المشركين 	 حدثنا أبو بكر بن أبي شيبة حدثنا عفان حدثنا حماد بن سلمة حدثنا ثابت عن أنس أن رسول الله صلى الله عليه وسلم أخذ سيفا يوم أحد فقال من يأخذ مني هذا فبسطوا أيديهم كل إنسان منهم يقول أنا أنا قال فمن يأخذه بحقه قال فأحجم القوم فقال سماك بن خرشة أبو دجانة أنا آخذه بحقه قال فأخذه ففلق به هام المشركين 	 Anas reported that Allah's Messenger (SL3M) took hold of his sword on the Day of Uhud and said: Who would take it from me? All the persons stretched their hands saying: I would do it, I would do it. He (Allah's Apostle) said: Who would take it in order to fulfil its rights? Then the people withdrew their hands. Simak b. Kharasha Abu Dujana said: I am here to take it and fulfil its rights. He took it and struck the heads of the polytheists. 
muslim44_365460	 حدثنا عبيد الله بن عمر القواريري وعمرو الناقد كلاهما عن سفيان قال عبيد الله حدثنا سفيان بن	عن عيينة قال سمعت ابن المنكدر يقول سمعت جابر بن عبد الله يقول لما كان يوم أحد جيء بأبي مسجى وقد مثل به قال فأردت أن أرفع الثوب فنهاني قومي ثم أردت أن أرفع الثوب فنهاني قومي فرفعه رسول الله صلى الله عليه وسلم أو أمر به فرفع فسمع صوت باكية أو صائحة فقال من هذه فقالوا بنت عمرو أو أخت عمرو فقال ولم تبكي فما زالت الملائكة تظله بأجنحتها حتى رفع 	 حدثنا عبيد الله بن عمر القواريري وعمرو الناقد كلاهما عن سفيان قال عبيد الله حدثنا سفيان بن عيينة قال سمعت ابن المنكدر يقول سمعت جابر بن عبد الله يقول لما كان يوم أحد جيء بأبي مسجى وقد مثل به قال فأردت أن أرفع الثوب فنهاني قومي ثم أردت أن أرفع الثوب فنهاني قومي فرفعه رسول الله صلى الله عليه وسلم أو أمر به فرفع فسمع صوت باكية أو صائحة فقال من هذه فقالوا بنت عمرو أو أخت عمرو فقال ولم تبكي فما زالت الملائكة تظله بأجنحتها حتى رفع 	 Jabir b. 'Abdullah reported: The dead body of my father was brought and he was covered (with cloth) and it had been mutilated. I made an attempt to lift the cloth, but my people prohibited me to do so. I again made an attempt to lift the cloth, but my people prohibited me. Thereupon Allah's Messenger (SL3M) lifted it or he commanded it to be lifted. He heard the noise (of a loud) weeping, or the noise of a woman mourner. He inquired who she was. They said: The daughter of 'Amr or the sister of Amr, whereupon he said: Why does she weep? The Angels provide him shade with the help of their Wings until he would be lifted (to his heavenly abode) 
muslim44_365470	 حدثنا محمد بن المثنى حدثنا وهب بن جرير حدثنا شعبة عن محمد بن المنكدر عن جابر بن	حدثنا عبد الله قال أصيب أبي يوم أحد فجعلت أكشف الثوب عن وجهه وأبكي وجعلوا ينهونني ورسول الله صلى الله عليه وسلم لا ينهاني قال وجعلت فاطمة بنت عمرو تبكيه فقال رسول الله صلى الله عليه وسلم تبكيه أو لا تبكيه ما زالت الملائكة تظله بأجنحتها حتى رفعتموه 	 حدثنا محمد بن المثنى حدثنا وهب بن جرير حدثنا شعبة عن محمد بن المنكدر عن جابر بن عبد الله قال أصيب أبي يوم أحد فجعلت أكشف الثوب عن وجهه وأبكي وجعلوا ينهونني ورسول الله صلى الله عليه وسلم لا ينهاني قال وجعلت فاطمة بنت عمرو تبكيه فقال رسول الله صلى الله عليه وسلم تبكيه أو لا تبكيه ما زالت الملائكة تظله بأجنحتها حتى رفعتموه 	 Jabir b. 'Abdullah reported: My father fell as a martyr on the Day of Uhud and I attempted to uncover his face and weep, but they (the Companions of the Holy Prophet) forbade me to do this, whereas Allah's Messenger (SL3M) did not forbid me and Fatima bint Amr, the sister of my father, was also weeping There- upon Allah's Messenger (SL3M) said: You may weep or you may not weep; the Angels provide him shade with the help of their wings until you lift him (to be buried in the grave). 
muslim44_365480	 حدثنا عبد بن حميد حدثنا روح بن عبادة حدثنا ابن جريج ح وحدثنا إسحاق بن إبراهيم أخبرنا عبد الرزاق حدثنا معمر كلاهما عن محمد بن	أخبرنا المنكدر عن جابر بهذا الحديث غير أن ابن جريج ليس في حديثه ذكر الملائكة وبكاء الباكية 	 حدثنا عبد بن حميد حدثنا روح بن عبادة حدثنا ابن جريج ح وحدثنا إسحاق بن إبراهيم أخبرنا عبد الرزاق حدثنا معمر كلاهما عن محمد بن المنكدر عن جابر بهذا الحديث غير أن ابن جريج ليس في حديثه ذكر الملائكة وبكاء الباكية 	 This hadith has been narrated on the authority of Jabir through another chain of transmitters, but with this difference that there is no mention of the Angels and the weeping of a female mourner. 
muslim44_365490	 حدثنا محمد بن أحمد بن أبي خلف حدثنا زكرياء بن	حدثنا عدي أخبرنا عبيد الله بن عمرو عن عبد الكريم عن محمد بن المنكدر عن جابر قال جيء بأبي يوم أحد مجدعا فوضع بين يدى النبي صلى الله عليه وسلم فذكر نحو حديثهم 	 حدثنا محمد بن أحمد بن أبي خلف حدثنا زكرياء بن عدي أخبرنا عبيد الله بن عمرو عن عبد الكريم عن محمد بن المنكدر عن جابر قال جيء بأبي يوم أحد مجدعا فوضع بين يدى النبي صلى الله عليه وسلم فذكر نحو حديثهم 	 Jabir reported: My father was brought in a state that his ears had been cut off and (his dead body) was placed before Allah's Apostle (SL3M), the rest of the hadith is the same. 
