muslim35_352110	 حدثنا أحمد بن يونس حدثنا زهير حدثنا الأسود بن	حدثنا قيس ح وحدثناه يحيى بن يحيى أخبرنا أبو خيثمة عن الأسود بن قيس حدثني جندب بن سفيان قال شهدت الأضحى مع رسول الله صلى الله عليه وسلم فلم يعد أن صلى وفرغ من صلاته سلم فإذا هو يرى لحم أضاحي قد ذبحت قبل أن يفرغ من صلاته فقال من كان ذبح أضحيته قبل أن يصلي أو نصلي فليذبح مكانها أخرى ومن كان لم يذبح فليذبح باسم الله 	 حدثنا أحمد بن يونس حدثنا زهير حدثنا الأسود بن قيس ح وحدثناه يحيى بن يحيى أخبرنا أبو خيثمة عن الأسود بن قيس حدثني جندب بن سفيان قال شهدت الأضحى مع رسول الله صلى الله عليه وسلم فلم يعد أن صلى وفرغ من صلاته سلم فإذا هو يرى لحم أضاحي قد ذبحت قبل أن يفرغ من صلاته فقال من كان ذبح أضحيته قبل أن يصلي أو نصلي فليذبح مكانها أخرى ومن كان لم يذبح فليذبح باسم الله 	 Jundab b. Sufyan reported: I was with Allah's Messenger (SL3M) on the day of 'Id al-Adha. While he had not returned after having offered (the Id prayer) and finished it, he saw the flesh of the sacrificial animals which had been slaughtered before he had completed the prayer. Thereupon he (the Holy Prophet) said: One who slaughtered his sacrificial animal before his prayer or our prayer ('Id), he should slaughter another one in its stead, and he who did not slaughter, he should slaughter by reciting the name of Allah. 
muslim35_352120	not identified	 وحدثنا أبو بكر بن أبي شيبة حدثنا أبو الأحوص سلام بن سليم عن الأسود بن قيس عن جندب بن سفيان قال شهدت الأضحى مع رسول الله صلى الله عليه وسلم فلما قضى صلاته بالناس نظر إلى غنم قد ذبحت فقال من ذبح قبل الصلاة فليذبح شاة مكانها ومن لم يكن ذبح فليذبح على اسم الله 	 وحدثنا أبو بكر بن أبي شيبة حدثنا أبو الأحوص سلام بن سليم عن الأسود بن قيس عن جندب بن سفيان قال شهدت الأضحى مع رسول الله صلى الله عليه وسلم فلما قضى صلاته بالناس نظر إلى غنم قد ذبحت فقال من ذبح قبل الصلاة فليذبح شاة مكانها ومن لم يكن ذبح فليذبح على اسم الله 	 Jundab b. Sufyan reported: I was with Allah's Messenger (SL3M) (on the occasion) of 'Id al-Adha. After he had completed the prayer with people, he found that the goats had been slaughtered, whereupon he said: He who slaughtered sacrificial animal before the prayer should slaughter a goat (again) in its stead and he who has not slaughtered he should slaughter it by reciting the name of Allah. 
muslim35_352130	not identified	 وحدثناه قتيبة بن سعيد حدثنا أبو عوانة ح وحدثنا إسحاق بن إبراهيم وابن أبي عمر عن ابن عيينة كلاهما عن الأسود بن قيس بهذا الإسناد وقالا على اسم الله كحديث أبي الأحوص 	 وحدثناه قتيبة بن سعيد حدثنا أبو عوانة ح وحدثنا إسحاق بن إبراهيم وابن أبي عمر عن ابن عيينة كلاهما عن الأسود بن قيس بهذا الإسناد وقالا على اسم الله كحديث أبي الأحوص 	 This hadith has been narrated on the authority of al-Aswad b. Qais with the same chain of transmitters. 
muslim35_352140	 حدثنا عبيد الله بن معاذ حدثنا أبي حدثنا شعبة عن	حدثنا الأسود سمع جندبا البجلي قال شهدت رسول الله صلى الله عليه وسلم صلى يوم أضحى ثم خطب فقال من كان ذبح قبل أن يصلي فليعد مكانها ومن لم يكن ذبح فليذبح باسم الله 	 حدثنا عبيد الله بن معاذ حدثنا أبي حدثنا شعبة عن الأسود سمع جندبا البجلي قال شهدت رسول الله صلى الله عليه وسلم صلى يوم أضحى ثم خطب فقال من كان ذبح قبل أن يصلي فليعد مكانها ومن لم يكن ذبح فليذبح باسم الله 	 Jundab al-Bajali reported: I saw Allah's Messenger (SL3M) observing ('Id) prayer on the Day of Sacrifice (10th of Dhu'l-Hijja) and then delivering a sermon and he said: He who sacrificed the (animal) before offering ('Id) prayer, he should offer again in its stead, and he who did not sacrifice the animal should slaughter it by reciting the name of Allah. 
muslim35_352150	 حدثنا محمد بن المثنى وابن بشار قالا حدثنا محمد بن	حدثنا جعفر حدثنا شعبة بهذا الإسناد مثله 	 حدثنا محمد بن المثنى وابن بشار قالا حدثنا محمد بن جعفر حدثنا شعبة بهذا الإسناد مثله 	 This hadith has been narrated on the authority of Shu'ba through another chain of transmitters. 
muslim35_352160	not identified	 وحدثنا يحيى بن يحيى أخبرنا خالد بن عبد الله عن مطرف عن عامر عن البراء قال ضحى خالي أبو بردة قبل الصلاة فقال رسول الله صلى الله عليه وسلم تلك شاة لحم فقال يا رسول الله إن عندي جذعة من المعز فقال ضح بها ولا تصلح لغيرك ثم قال من ضحى قبل الصلاة فإنما ذبح لنفسه ومن ذبح بعد الصلاة فقد تم نسكه وأصاب سنة المسلمين 	 وحدثنا يحيى بن يحيى أخبرنا خالد بن عبد الله عن مطرف عن عامر عن البراء قال ضحى خالي أبو بردة قبل الصلاة فقال رسول الله صلى الله عليه وسلم تلك شاة لحم فقال يا رسول الله إن عندي جذعة من المعز فقال ضح بها ولا تصلح لغيرك ثم قال من ضحى قبل الصلاة فإنما ذبح لنفسه ومن ذبح بعد الصلاة فقد تم نسكه وأصاب سنة المسلمين 	 Al-Bara' reported: My maternal uncle Abu Burda sacrificed his animal before ('Id) prayer. Thereupon Allah's Messenger (SL3M) said: That is a goat (slaughtered for the sake of) flesh (and not as a sacrifice on the day of Adha). He said: I have a lamb of six months. Thereupon he said: Offer it as a sacrifice, but it will not justify for anyone except you, and then said: He who sacrificed (the animal) before ('Id) prayer, he in fact slaughtered it for his own self, and he who slaughtered after prayer, his ritual of sacrifice became complete and he in fact observed the religious practice of the Muslims. 
muslim35_352170	 حدثنا يحيى بن يحيى أخبرنا هشيم عن داود عن الشعبي عن البراء بن	عن عازب أن خاله أبا بردة بن نيار ذبح قبل أن يذبح النبي صلى الله عليه وسلم فقال يا رسول الله إن هذا يوم اللحم فيه مكروه وإني عجلت نسيكتي لأطعم أهلي وجيراني وأهل داري فقال رسول الله صلى الله عليه وسلم أعد نسكا فقال يا رسول الله إن عندي عناق لبن هي خير من شاتى لحم فقال هي خير نسيكتيك ولا تجزي جذعة عن أحد بعدك 	 حدثنا يحيى بن يحيى أخبرنا هشيم عن داود عن الشعبي عن البراء بن عازب أن خاله أبا بردة بن نيار ذبح قبل أن يذبح النبي صلى الله عليه وسلم فقال يا رسول الله إن هذا يوم اللحم فيه مكروه وإني عجلت نسيكتي لأطعم أهلي وجيراني وأهل داري فقال رسول الله صلى الله عليه وسلم أعد نسكا فقال يا رسول الله إن عندي عناق لبن هي خير من شاتى لحم فقال هي خير نسيكتيك ولا تجزي جذعة عن أحد بعدك 	 Al-Bara' b. 'Azib reported that his maternal'uncle Abu Burda b. Niyar sacrificed his animal earlier than the Prophet (SL3M) had sacrificed. Thereupon he said: Apostle of Allah, it is the day of meat and it is not desirable (to have longing for it and not to make use of it immediately), so I hastened in offering my animal as a sacrifice, so that I might feed my family and neighbours and my kith and kin. Thereupon Allah's Messenger (SL3M) said: Offer again your sacrifice. He said: Messenger of Allah, I have a small milch goat of less than one year, and that is better than two dry goats (from which only) meat (can be acquired). Thereupon he said: That is better than the two animals of sacrifice on your behalf, and the sacrifice of a goat, of less than six months shall not be accepted as a sacrifice on behalf of anyone after your (sacrifice). 
muslim35_352180	 حدثنا محمد بن المثنى حدثنا ابن أبي عدي عن داود عن الشعبي عن البراء بن	عن عازب قال خطبنا رسول الله صلى الله عليه وسلم يوم النحر فقال لا يذبحن أحد حتى يصلي قال فقال خالي يا رسول الله إن هذا يوم اللحم فيه مكروه ثم ذكر بمعنى حديث هشيم 	 حدثنا محمد بن المثنى حدثنا ابن أبي عدي عن داود عن الشعبي عن البراء بن عازب قال خطبنا رسول الله صلى الله عليه وسلم يوم النحر فقال لا يذبحن أحد حتى يصلي قال فقال خالي يا رسول الله إن هذا يوم اللحم فيه مكروه ثم ذكر بمعنى حديث هشيم 	 Al-Bara' b. 'Azib reported: Allah's Messenger (SL3M) delivered an address on the day (of Nahr) in which he said: None of you should offer sacrifice of animals until he has completed the ('Id) prayer. Thereupon my maternal uncle said: Messenger of Allah, it is the day of meat, so it is not desirable (to keep my family in the state of longing). The rest of the hadith is the same. 
muslim35_352190	not identified	 وحدثنا أبو بكر بن أبي شيبة حدثنا عبد الله بن نمير ح وحدثنا ابن نمير حدثنا أبي حدثنا زكرياء عن فراس عن عامر عن البراء قال قال رسول الله صلى الله عليه وسلم من صلى صلاتنا ووجه قبلتنا ونسك نسكنا فلا يذبح حتى يصلي فقال خالي يا رسول الله قد نسكت عن ابن لي فقال ذاك شىء عجلته لأهلك فقال إن عندي شاة خير من شاتين قال ضح بها فإنها خير نسيكة 	 وحدثنا أبو بكر بن أبي شيبة حدثنا عبد الله بن نمير ح وحدثنا ابن نمير حدثنا أبي حدثنا زكرياء عن فراس عن عامر عن البراء قال قال رسول الله صلى الله عليه وسلم من صلى صلاتنا ووجه قبلتنا ونسك نسكنا فلا يذبح حتى يصلي فقال خالي يا رسول الله قد نسكت عن ابن لي فقال ذاك شىء عجلته لأهلك فقال إن عندي شاة خير من شاتين قال ضح بها فإنها خير نسيكة 	 Al-Bara' reported Allah's Messenger (SL3M) having said: He who observes prayer like our prayer and turns his face towards our Qibla (in prayer) and who offers sacrifices (of animals) as we do, he must not slaughter the (animal as a sacrifice) until he has completed the prayer. Thereupon my maternal uncle said: Messenger of Allah, I have sacrificed the animal on behalf of my son. The Messenger of Allah (SL3M) said: This is the thing in which you have made haste for your family. He said: I have a goat with me better than two goats. Thereupon he said: Sacrifice it for that is the best. 
muslim35_352200	not identified	 وحدثنا محمد بن المثنى وابن بشار واللفظ لابن المثنى قالا حدثنا محمد بن جعفر حدثنا شعبة عن زبيد الإيامي عن الشعبي عن البراء بن عازب قال قال رسول الله صلى الله عليه وسلم إن أول ما نبدأ به في يومنا هذا نصلي ثم نرجع فننحر فمن فعل ذلك فقد أصاب سنتنا ومن ذبح فإنما هو لحم قدمه لأهله ليس من النسك في شىء وكان أبو بردة بن نيار قد ذبح فقال عندي جذعة خير من مسنة فقال اذبحها ولن تجزي عن أحد بعدك 	 وحدثنا محمد بن المثنى وابن بشار واللفظ لابن المثنى قالا حدثنا محمد بن جعفر حدثنا شعبة عن زبيد الإيامي عن الشعبي عن البراء بن عازب قال قال رسول الله صلى الله عليه وسلم إن أول ما نبدأ به في يومنا هذا نصلي ثم نرجع فننحر فمن فعل ذلك فقد أصاب سنتنا ومن ذبح فإنما هو لحم قدمه لأهله ليس من النسك في شىء وكان أبو بردة بن نيار قد ذبح فقال عندي جذعة خير من مسنة فقال اذبحها ولن تجزي عن أحد بعدك 	 Al-Bara' b. 'Azib reported Allah's Messenger (SL3M) having said: The first (act) with which we started our day (the day of 'Id-ul Adha) was that we offered prayer. We then returned and sacrificed the animals and he who did that in fact adhered to our Sunnah (practice). And he who slaughtered the (animal on that day before the 'Id prayer), for him (the slaughtering of animal was directed to the acquiring of) meat for his family, and there is nothing of the sort of sacrifice in it. It was Abu Burda b. Niyar who had slaughtered (the animal before the 'Id prayer). He said: I have a small lamb, of less than one year, but better than that of more than a year. Thereupon Allah's Messenger (SL3M) qaid: Sacrifice it, but it will not suffice (as a sacrifice) for anyone after you. 
muslim35_352210	 حدثنا عبيد الله بن معاذ حدثنا أبي حدثنا شعبة عن زبيد سمع الشعبي عن البراء بن عازب عن	عن النبي صلى الله عليه وسلم مثله 	 حدثنا عبيد الله بن معاذ حدثنا أبي حدثنا شعبة عن زبيد سمع الشعبي عن البراء بن عازب عن النبي صلى الله عليه وسلم مثله 	 A hadith like this has been narrated on the authority of al-Bara' b. 'Azib through another chain of transmitters. 
muslim35_352220	not identified	 وحدثنا قتيبة بن سعيد وهناد بن السري قالا حدثنا أبو الأحوص ح وحدثنا عثمان بن أبي شيبة وإسحاق بن إبراهيم جميعا عن جرير كلاهما عن منصور عن الشعبي عن البراء بن عازب قال خطبنا رسول الله صلى الله عليه وسلم في يوم النحر بعد الصلاة ثم ذكر نحو حديثهم 	 وحدثنا قتيبة بن سعيد وهناد بن السري قالا حدثنا أبو الأحوص ح وحدثنا عثمان بن أبي شيبة وإسحاق بن إبراهيم جميعا عن جرير كلاهما عن منصور عن الشعبي عن البراء بن عازب قال خطبنا رسول الله صلى الله عليه وسلم في يوم النحر بعد الصلاة ثم ذكر نحو حديثهم 	 al-Bara' b. 'Azib reported: Allah's Messenger (SL3M) addressed us on the day of Nahr after the ('Id) prayer. The rest of the hadith is the same. 
muslim35_352230	not identified	 وحدثني أحمد بن سعيد بن صخر الدارمي حدثنا أبو النعمان عارم بن الفضل حدثنا عبد الواحد يعني ابن زياد حدثنا عاصم الأحول عن الشعبي حدثني البراء بن عازب قال خطبنا رسول الله صلى الله عليه وسلم في يوم نحر فقال لا يضحين أحد حتى يصلي قال رجل عندي عناق لبن هي خير من شاتى لحم قال فضح بها ولا تجزي جذعة عن أحد بعدك 	 وحدثني أحمد بن سعيد بن صخر الدارمي حدثنا أبو النعمان عارم بن الفضل حدثنا عبد الواحد يعني ابن زياد حدثنا عاصم الأحول عن الشعبي حدثني البراء بن عازب قال خطبنا رسول الله صلى الله عليه وسلم في يوم نحر فقال لا يضحين أحد حتى يصلي قال رجل عندي عناق لبن هي خير من شاتى لحم قال فضح بها ولا تجزي جذعة عن أحد بعدك 	 Al-Bara' b. 'Azib reported: Allah's Messenger (SL3M) addressed us on the day of Nahr and said: None should sacrifice the animal unless he has completed the ('Id) prayer. A person said: I have a milch goat of less than one year, better than two fat goats. Thereupon he said: Sacrifice it, and no goat of less than a year of age will be accepted as sacrifice after you. 
muslim35_352240	 حدثنا محمد بن بشار حدثنا محمد يعني ابن جعفر حدثنا شعبة عن سلمة عن أبي جحيفة عن البراء بن	حدثنا عازب قال ذبح أبو بردة قبل الصلاة فقال النبي صلى الله عليه وسلم أبدلها فقال يا رسول الله ليس عندي إلا جذعة قال شعبة وأظنه قال وهي خير من مسنة فقال رسول الله صلى الله عليه وسلم اجعلها مكانها ولن تجزي عن أحد بعدك 	 حدثنا محمد بن بشار حدثنا محمد يعني ابن جعفر حدثنا شعبة عن سلمة عن أبي جحيفة عن البراء بن عازب قال ذبح أبو بردة قبل الصلاة فقال النبي صلى الله عليه وسلم أبدلها فقال يا رسول الله ليس عندي إلا جذعة قال شعبة وأظنه قال وهي خير من مسنة فقال رسول الله صلى الله عليه وسلم اجعلها مكانها ولن تجزي عن أحد بعدك 	 Al-Bara' b. 'Azib reported that Abu Burda slaughtered the animal as a sacrifice before the ('Id) prayer. Thereupon Allah's Apostle (SL3M) said: Offer a substitute for it (since it does not absolve you of the responsibility of sacrifice). Thereupon he said: Allah's Messenger. I have nothing with me but a goat of less than six months. Shu'ba (one of the narrators) said: I think he (al-Bara' b. 'Azib also) said: And it is better than a goat of one year. Thereupon Allah's Messenger (SL3M) said: Make it a substitute for that (and sacrifice it), but it will not suffice for anyone (as a sacrifice) after you. 
muslim35_352250	not identified	 وحدثناه ابن المثنى حدثني وهب بن جرير ح وحدثنا إسحاق بن إبراهيم أخبرنا أبو عامر العقدي حدثنا شعبة بهذا الإسناد ولم يذكر الشك في قوله هي خير من مسنة 	 وحدثناه ابن المثنى حدثني وهب بن جرير ح وحدثنا إسحاق بن إبراهيم أخبرنا أبو عامر العقدي حدثنا شعبة بهذا الإسناد ولم يذكر الشك في قوله هي خير من مسنة 	 This hadith has been narrated on the authority of Shu'ba with the same chain of transmitters, but did not mention tht doubt (expressed in his statement) That is (the goat of less than a year) is better than a goat of more than one year. 
muslim35_352260	not identified	 وحدثني يحيى بن أيوب وعمرو الناقد وزهير بن حرب جميعا عن ابن علية واللفظ لعمرو قال حدثنا إسماعيل بن إبراهيم عن أيوب عن محمد عن أنس قال قال رسول الله صلى الله عليه وسلم يوم النحر من كان ذبح قبل الصلاة فليعد فقام رجل فقال يا رسول الله هذا يوم يشتهى فيه اللحم وذكر هنة من جيرانه كأن رسول الله صلى الله عليه وسلم صدقه قال وعندي جذعة هي أحب إلى من شاتى لحم أفأذبحها قال فرخص له فقال لا أدري أبلغت رخصته من سواه أم لا قال وانكفأ رسول الله صلى الله عليه وسلم إلى كبشين فذبحهما فقام الناس إلى غنيمة فتوزعوها أو قال فتجزعوها 	 وحدثني يحيى بن أيوب وعمرو الناقد وزهير بن حرب جميعا عن ابن علية واللفظ لعمرو قال حدثنا إسماعيل بن إبراهيم عن أيوب عن محمد عن أنس قال قال رسول الله صلى الله عليه وسلم يوم النحر من كان ذبح قبل الصلاة فليعد فقام رجل فقال يا رسول الله هذا يوم يشتهى فيه اللحم وذكر هنة من جيرانه كأن رسول الله صلى الله عليه وسلم صدقه قال وعندي جذعة هي أحب إلى من شاتى لحم أفأذبحها قال فرخص له فقال لا أدري أبلغت رخصته من سواه أم لا قال وانكفأ رسول الله صلى الله عليه وسلم إلى كبشين فذبحهما فقام الناس إلى غنيمة فتوزعوها أو قال فتجزعوها 	 Anas (b. Malik) reported Allah's Messenger (SL3M) having said on the day of Nahr (Sacrifice): He who slaughtered (the animal as a sacrifice) before the ('Id) prayer. should repeat it (i. e. offer another animal). Thereupon a person stood up and said: Messenger of Allah, that is the day when meat is much desired, and he also made a mention of the need of his neighbour, and perhaps Allah's Messenger (SL3M) attested it. He (the person who had sacrificed the animal before the 'Id prayer) said: I have a goat of less than one year of age with me and I like it more than two fleshy goats; should I offer it as a sacrifice? He permitted him to do so. He (the narrator) said: I do not know whether this permission was granted to anyone else besides him or not. Allah's Messenger (SL3M) then turned towards two rams. and he slaughtered them, and the people' came to the goats and got them distributed amongst themselves (for offering them as sacrifice). 
muslim35_352270	 حدثنا محمد بن عبيد الغبري حدثنا حماد بن زيد حدثنا أيوب وهشام عن محمد عن أنس بن	حدثنا مالك أن رسول الله صلى الله عليه وسلم صلى ثم خطب فأمر من كان ذبح قبل الصلاة أن يعيد ذبحا ثم ذكر بمثل حديث ابن علية 	 حدثنا محمد بن عبيد الغبري حدثنا حماد بن زيد حدثنا أيوب وهشام عن محمد عن أنس بن مالك أن رسول الله صلى الله عليه وسلم صلى ثم خطب فأمر من كان ذبح قبل الصلاة أن يعيد ذبحا ثم ذكر بمثل حديث ابن علية 	 Anas b. Malik reported that Allah's Messenger (SL3M) offered the 'Id prayer and then delivered the sermon giving the command: He who slaughtered the animal before prayer should slaughter (another animal as a sacrifice). The rest of the hadith is the same. 
muslim35_352280	not identified	 وحدثني زياد بن يحيى الحساني حدثنا حاتم يعني ابن وردان حدثنا أيوب عن محمد بن سيرين عن أنس بن مالك قال خطبنا رسول الله صلى الله عليه وسلم يوم أضحى قال فوجد ريح لحم فنهاهم أن يذبحوا قال من كان ضحى فليعد ثم ذكر بمثل حديثهما 	 وحدثني زياد بن يحيى الحساني حدثنا حاتم يعني ابن وردان حدثنا أيوب عن محمد بن سيرين عن أنس بن مالك قال خطبنا رسول الله صلى الله عليه وسلم يوم أضحى قال فوجد ريح لحم فنهاهم أن يذبحوا قال من كان ضحى فليعد ثم ذكر بمثل حديثهما 	 Anas b. Malik reported: Allah's Messenger (SL3M) addressed us on the day of 'Id al-Adha. He smelt the odour of flesh and he prohibited thern from slaughtering (the animals before the 'Id prayer), saying: He who slaughtered the animals (before the 'Id prayer) should do that again (as it is not valid as a sacrifice). 
muslim35_352290	 حدثنا أحمد بن يونس حدثنا زهير حدثنا أبو الزبير عن	حدثنا جابر قال قال رسول الله صلى الله عليه وسلم لا تذبحوا إلا مسنة إلا أن يعسر عليكم فتذبحوا جذعة من الضأن 	 حدثنا أحمد بن يونس حدثنا زهير حدثنا أبو الزبير عن جابر قال قال رسول الله صلى الله عليه وسلم لا تذبحوا إلا مسنة إلا أن يعسر عليكم فتذبحوا جذعة من الضأن 	 Jabir reported Allah's Messenger (SL3M) as saying: Sacrifice only a grown-up animal, unless it is difficult for you, in which case sacrifice a ram (of even less than a year, but more than six months' age). 
