muslim35_352300	not identified	 وحدثني محمد بن حاتم حدثنا محمد بن بكر أخبرنا ابن جريج أخبرني أبو الزبير أنه سمع جابر بن عبد الله يقول صلى بنا النبي صلى الله عليه وسلم يوم النحر بالمدينة فتقدم رجال فنحروا وظنوا أن النبي صلى الله عليه وسلم قد نحر فأمر النبي صلى الله عليه وسلم من كان نحر قبله أن يعيد بنحر آخر ولا ينحروا حتى ينحر النبي صلى الله عليه وسلم 	 وحدثني محمد بن حاتم حدثنا محمد بن بكر أخبرنا ابن جريج أخبرني أبو الزبير أنه سمع جابر بن عبد الله يقول صلى بنا النبي صلى الله عليه وسلم يوم النحر بالمدينة فتقدم رجال فنحروا وظنوا أن النبي صلى الله عليه وسلم قد نحر فأمر النبي صلى الله عليه وسلم من كان نحر قبله أن يعيد بنحر آخر ولا ينحروا حتى ينحر النبي صلى الله عليه وسلم 	 Jabir b. 'Abdullah reported: Allah's Messenger (SL3M) led us in the 'Id prayer in Medina on the Day of Sacrifice. Some persons slaughtered their animals ahead of him under the impression that Allah's Apostle (SL3M) had-already offered sacrifice. Thereupon Allah's Apostle (SL3M) said: Those who had slaughtered their animals ahead of him should slaughter the other ones in their stead. And they should not sacrifice the animal before Allah's Messenger (SL3M) had sacrificed (his animal) 
muslim35_352310	not identified	 وحدثنا قتيبة بن سعيد حدثنا ليث ح وحدثنا محمد بن رمح أخبرنا الليث عن يزيد بن أبي حبيب عن أبي الخير عن عقبة بن عامر أن رسول الله صلى الله عليه وسلم أعطاه غنما يقسمها على أصحابه ضحايا فبقي عتود فذكره لرسول الله صلى الله عليه وسلم فقال ضح به أنت قال قتيبة على صحابته 	 وحدثنا قتيبة بن سعيد حدثنا ليث ح وحدثنا محمد بن رمح أخبرنا الليث عن يزيد بن أبي حبيب عن أبي الخير عن عقبة بن عامر أن رسول الله صلى الله عليه وسلم أعطاه غنما يقسمها على أصحابه ضحايا فبقي عتود فذكره لرسول الله صلى الله عليه وسلم فقال ضح به أنت قال قتيبة على صحابته 	 Uqba b. 'Amir reported that Allah's Messenger (SL3M) gave the gifts of goats to be distributed amongst his Companions. They sacrificed them, but a lamb of one year of age was left. (Someone) made a mention of that to the Messenger of Allah (SL3M), whereupon he said: You sacrifice it. 
muslim35_352320	 حدثنا أبو بكر بن أبي شيبة حدثنا يزيد بن	حدثنا هارون عن هشام الدستوائي عن يحيى بن أبي كثير عن بعجة الجهني عن عقبة بن عامر الجهني قال قسم رسول الله صلى الله عليه وسلم فينا ضحايا فأصابني جذع فقلت يا رسول الله إنه أصابني جذع فقال ضح به 	 حدثنا أبو بكر بن أبي شيبة حدثنا يزيد بن هارون عن هشام الدستوائي عن يحيى بن أبي كثير عن بعجة الجهني عن عقبة بن عامر الجهني قال قسم رسول الله صلى الله عليه وسلم فينا ضحايا فأصابني جذع فقلت يا رسول الله إنه أصابني جذع فقال ضح به 	 Amir al-Juhani reported: Allah's Messenger (SL3M) distributed sacrificial animals (amongst us for sacrificing them on 'Id al-Adha). So we sacrificed them. There fell to my lot a lamb of less than one year I said: Allah's Messenger, there has fallen to my lot a lamb (Jadha'a), whereupon he said: Sacrifice that. 
muslim35_352330	not identified	 وحدثني عبد الله بن عبد الرحمن الدارمي حدثنا يحيى يعني ابن حسان أخبرنا معاوية وهو ابن سلام حدثني يحيى بن أبي كثير أخبرني بعجة بن عبد الله أن عقبة بن عامر الجهني أخبره أن رسول الله صلى الله عليه وسلم قسم ضحايا بين أصحابه بمثل معناه 	 وحدثني عبد الله بن عبد الرحمن الدارمي حدثنا يحيى يعني ابن حسان أخبرنا معاوية وهو ابن سلام حدثني يحيى بن أبي كثير أخبرني بعجة بن عبد الله أن عقبة بن عامر الجهني أخبره أن رسول الله صلى الله عليه وسلم قسم ضحايا بين أصحابه بمثل معناه 	 This hadith has been transmitted on the authority of 'Uqba b. 'Amir al-Juhan with a slight change of wording. 
muslim35_352340	 حدثنا قتيبة بن سعيد حدثنا أبو عوانة عن قتادة عن	حدثنا أنس قال ضحى النبي صلى الله عليه وسلم بكبشين أملحين أقرنين ذبحهما بيده وسمى وكبر ووضع رجله على صفاحهما 	 حدثنا قتيبة بن سعيد حدثنا أبو عوانة عن قتادة عن أنس قال ضحى النبي صلى الله عليه وسلم بكبشين أملحين أقرنين ذبحهما بيده وسمى وكبر ووضع رجله على صفاحهما 	 Anas reported that Allah's Messenger (SL3M) sacrificed with his own hands two horned rams which were white with black markings reciting the name of Allah and glorifying Him (saying Allah-o-Akbar). He placed his foot on their sides (while sacrificing). 
muslim35_352350	 حدثنا يحيى بن يحيى أخبرنا وكيع عن شعبة عن قتادة عن	عن أنس قال ضحى رسول الله صلى الله عليه وسلم بكبشين أملحين أقرنين قال ورأيته يذبحهما بيده ورأيته واضعا قدمه على صفاحهما قال وسمى وكبر 	 حدثنا يحيى بن يحيى أخبرنا وكيع عن شعبة عن قتادة عن أنس قال ضحى رسول الله صلى الله عليه وسلم بكبشين أملحين أقرنين قال ورأيته يذبحهما بيده ورأيته واضعا قدمه على صفاحهما قال وسمى وكبر 	 Anas reported that Allah's Messenger (SL3M) sacrificed two horned rams of white colour with black markings over them. He also stated: I saw him sacrificing them with his own hand and saw him placing his foot on their sides, and recited the name of Allah and Glorified Him. 
muslim35_352360	not identified	 وحدثنا يحيى بن حبيب حدثنا خالد يعني ابن الحارث حدثنا شعبة أخبرني قتادة قال سمعت أنسا يقول ضحى رسول الله صلى الله عليه وسلم بمثله قال قلت آنت سمعته من أنس قال نعم 	 وحدثنا يحيى بن حبيب حدثنا خالد يعني ابن الحارث حدثنا شعبة أخبرني قتادة قال سمعت أنسا يقول ضحى رسول الله صلى الله عليه وسلم بمثله قال قلت آنت سمعته من أنس قال نعم 	 Shu'ba reported: Qatada informed me that he had heard Anas saying that Allah's Messenger (may peace be npon him) sacrificed (the horned rams) and like that. I said: Did you (Qatada) hear from Anas? He said. Yes. 
muslim35_352370	 حدثنا محمد بن المثنى حدثنا ابن أبي عدي عن سعيد عن قتادة عن أنس عن	عن النبي صلى الله عليه وسلم بمثله غير أنه قال ويقول باسم الله والله أكبر 	 حدثنا محمد بن المثنى حدثنا ابن أبي عدي عن سعيد عن قتادة عن أنس عن النبي صلى الله عليه وسلم بمثله غير أنه قال ويقول باسم الله والله أكبر 	 This hadith has been transmitted on the authority of Anas with a slight variation of wording. 
muslim35_352380	 حدثنا هارون بن معروف حدثنا عبد الله بن	حدثنا وهب قال قال حيوة أخبرني أبو صخر عن يزيد بن قسيط عن عروة بن الزبير عن عائشة أن رسول الله صلى الله عليه وسلم أمر بكبش أقرن يطأ في سواد ويبرك في سواد وينظر في سواد فأتي به ليضحي به فقال لها يا عائشة هلمي المدية ثم قال اشحذيها بحجر ففعلت ثم أخذها وأخذ الكبش فأضجعه ثم ذبحه ثم قال باسم الله اللهم تقبل من محمد وآل محمد ومن أمة محمد ثم ضحى به 	 حدثنا هارون بن معروف حدثنا عبد الله بن وهب قال قال حيوة أخبرني أبو صخر عن يزيد بن قسيط عن عروة بن الزبير عن عائشة أن رسول الله صلى الله عليه وسلم أمر بكبش أقرن يطأ في سواد ويبرك في سواد وينظر في سواد فأتي به ليضحي به فقال لها يا عائشة هلمي المدية ثم قال اشحذيها بحجر ففعلت ثم أخذها وأخذ الكبش فأضجعه ثم ذبحه ثم قال باسم الله اللهم تقبل من محمد وآل محمد ومن أمة محمد ثم ضحى به 	" 'A'isha reported that Allah's Messenger (SL3M) commanded that a ram with black legs, black belly and black (circles) round the eyes should be brought to him, so that he should sacrifice it. He said to 'A'isha: Give me the large knife, and then said: Sharpen it on a stone. She did that. He then took it (the knife) and then the ram; he placed it on the ground and then sacrificed it, saying: Bismillah, Allah-humma Taqabbal min Muhammadin wa Al-i-Muhammadin, wa min Ummati Muhammadin (In the name of Allah,"" O Allah, accept [this sacrifice] on behalf of Muhammad and the family of Muhammad and the Umma of Muhammad"" ). "
muslim35_352390	 حدثنا محمد بن المثنى العنزي حدثنا يحيى بن سعيد عن سفيان حدثني أبي عن عباية بن رفاعة بن	عن رافع بن خديج عن رافع بن خديج قلت يا رسول الله إنا لاقو العدو غدا وليست معنا مدى قال صلى الله عليه وسلم أعجل أو أرني ما أنهر الدم وذكر اسم الله فكل ليس السن والظفر وسأحدثك أما السن فعظم وأما الظفر فمدى الحبشة قال وأصبنا نهب إبل وغنم فند منها بعير فرماه رجل بسهم فحبسه فقال رسول الله صلى الله عليه وسلم إن لهذه الإبل أوابد كأوابد الوحش فإذا غلبكم منها شىء فاصنعوا به هكذا 	 حدثنا محمد بن المثنى العنزي حدثنا يحيى بن سعيد عن سفيان حدثني أبي عن عباية بن رفاعة بن رافع بن خديج عن رافع بن خديج قلت يا رسول الله إنا لاقو العدو غدا وليست معنا مدى قال صلى الله عليه وسلم أعجل أو أرني ما أنهر الدم وذكر اسم الله فكل ليس السن والظفر وسأحدثك أما السن فعظم وأما الظفر فمدى الحبشة قال وأصبنا نهب إبل وغنم فند منها بعير فرماه رجل بسهم فحبسه فقال رسول الله صلى الله عليه وسلم إن لهذه الإبل أوابد كأوابد الوحش فإذا غلبكم منها شىء فاصنعوا به هكذا 	 Rafi' b. Khadij is reported to have said: Allah's Messenger, we are going to encounter the enemy tomorrow, but we have no knives with us. Thereupon Allah's Messenger (SL3M) said: Make haste or be careful (in making arrangements for procuring knives) which would let the blood flow (and along with it) the name of Allah is also to be recited. Then eat, but not the tooth or nail. And I am going to tell you why it is not permissible to slaughter the animal with the help of tooth and bone; and as for the nail. it is a bone, and the bone is the knife of Abyssinians. He (the narrator) said: There fell to our lot as spoils of war camels and goats, and one of the camels among them became wild. A person (amongst usl struck It with an arrow which brought it under control. whereupon Allah's Messenger (SL3M) said: This camel became wild like wild animals, so if you find any animal getting wild, you do the same with that 
muslim35_352400	not identified	 وحدثنا إسحاق بن إبراهيم أخبرنا وكيع حدثنا سفيان بن سعيد بن مسروق عن أبيه عن عباية بن رفاعة بن رافع بن خديج عن رافع بن خديج قال كنا مع رسول الله صلى الله عليه وسلم بذي الحليفة من تهامة فأصبنا غنما وإبلا فعجل القوم فأغلوا بها القدور فأمر بها فكفئت ثم عدل عشرا من الغنم بجزور وذكر باقي الحديث كنحو حديث يحيى بن سعيد 	 وحدثنا إسحاق بن إبراهيم أخبرنا وكيع حدثنا سفيان بن سعيد بن مسروق عن أبيه عن عباية بن رفاعة بن رافع بن خديج عن رافع بن خديج قال كنا مع رسول الله صلى الله عليه وسلم بذي الحليفة من تهامة فأصبنا غنما وإبلا فعجل القوم فأغلوا بها القدور فأمر بها فكفئت ثم عدل عشرا من الغنم بجزور وذكر باقي الحديث كنحو حديث يحيى بن سعيد 	 Rafi' b. Khadij reported: While we were with Allah's Messenger (may peace he upon him) in Dhu'I-Hulaifa in Tihama, we got hold of goats and camels. Some persons (amongst us) made haste and boiled (the flesh of goats and camels) in their earthen pots. He then commanded and these were turned over; then he equalised ten goats for a camel. The rest of the hadith is the same. 
muslim35_352410	not identified	 وحدثنا ابن أبي عمر حدثنا سفيان عن إسماعيل بن مسلم عن سعيد بن مسروق عن عباية عن جده رافع ثم حدثنيه عمر بن سعيد بن مسروق عن أبيه عن عباية بن رفاعة بن رافع بن خديج عن جده قال قلنا يا رسول الله إنا لاقو العدو غدا وليس معنا مدى فنذكي بالليط وذكر الحديث بقصته وقال فند علينا بعير منها فرميناه بالنبل حتى وهصناه 	 وحدثنا ابن أبي عمر حدثنا سفيان عن إسماعيل بن مسلم عن سعيد بن مسروق عن عباية عن جده رافع ثم حدثنيه عمر بن سعيد بن مسروق عن أبيه عن عباية بن رفاعة بن رافع بن خديج عن جده قال قلنا يا رسول الله إنا لاقو العدو غدا وليس معنا مدى فنذكي بالليط وذكر الحديث بقصته وقال فند علينا بعير منها فرميناه بالنبل حتى وهصناه 	" Rafi' b. Khadij reported from his grandfather that he said: Allah's Messenger, we are going to encounter the enemy tomorrow, but we do not have long knives with us, should we then slaughter them with the peel of the reed? The rest of the hadith is the same. (And at the end the words are):"" A camel became wild (and got out of our control). We attacked it with arrows until we made it fall down."" "
muslim35_352420	not identified	 وحدثنيه القاسم بن زكرياء حدثنا حسين بن علي عن زائدة عن سعيد بن مسروق بهذا الإسناد الحديث إلى آخره بتمامه وقال فيه وليست معنا مدى أفنذبح بالقصب 	 وحدثنيه القاسم بن زكرياء حدثنا حسين بن علي عن زائدة عن سعيد بن مسروق بهذا الإسناد الحديث إلى آخره بتمامه وقال فيه وليست معنا مدى أفنذبح بالقصب 	 This hadith has been narrated on the authority of Sa'id b. Masruq with the same chain of transmitters with a slight variation of words. 
muslim35_352430	not identified	 وحدثنا محمد بن الوليد بن عبد الحميد حدثنا محمد بن جعفر حدثنا شعبة عن سعيد بن مسروق عن عباية بن رفاعة بن رافع عن رافع بن خديج أنه قال يا رسول الله إنا لاقو العدو غدا وليس معنا مدى وساق الحديث ولم يذكر فعجل القوم فأغلوا بها القدور فأمر بها فكفئت وذكر سائر القصة 	 وحدثنا محمد بن الوليد بن عبد الحميد حدثنا محمد بن جعفر حدثنا شعبة عن سعيد بن مسروق عن عباية بن رفاعة بن رافع عن رافع بن خديج أنه قال يا رسول الله إنا لاقو العدو غدا وليس معنا مدى وساق الحديث ولم يذكر فعجل القوم فأغلوا بها القدور فأمر بها فكفئت وذكر سائر القصة 	" Rafi' b. Khadij reported that he said: Allah's Messenger, we are going to encounter the enemy tomorrow. and we do not have large knives with us. The rest of the hadith is the same, but no mention is made of this:"" The people hastened and they boiled (flesh) in the earthen pots. He (the Holy Prophet), cammanded and these were turned over and the narrator narrated the whole event. "
muslim35_352440	 حدثني عبد الجبار بن العلاء حدثنا سفيان حدثنا الزهري عن أبي عبيد قال شهدت العيد مع علي بن	عن أبي طالب فبدأ بالصلاة قبل الخطبة وقال إن رسول الله صلى الله عليه وسلم نهانا أن نأكل من لحوم نسكنا بعد ثلاث 	 حدثني عبد الجبار بن العلاء حدثنا سفيان حدثنا الزهري عن أبي عبيد قال شهدت العيد مع علي بن أبي طالب فبدأ بالصلاة قبل الخطبة وقال إن رسول الله صلى الله عليه وسلم نهانا أن نأكل من لحوم نسكنا بعد ثلاث 	 Abu Ubaid reported: I was with 'Ali b. Abi Talib on the occasion of the 'Id day. He started with the 'Id prayer before delivering the sermon, and said: Allah's Messenger (SL3M) forbade us to eat the flesh of our sacrificial animals beyond three days. 
muslim35_352450	 حدثني حرملة بن يحيى أخبرنا ابن وهب حدثني يونس عن ابن شهاب حدثني	عن أبو عبيد مولى ابن أزهر أنه شهد العيد مع عمر بن الخطاب قال ثم صليت مع علي بن أبي طالب قال فصلى لنا قبل الخطبة ثم خطب الناس فقال إن رسول الله صلى الله عليه وسلم قد نهاكم أن تأكلوا لحوم نسككم فوق ثلاث ليال فلا تأكلوا 	 حدثني حرملة بن يحيى أخبرنا ابن وهب حدثني يونس عن ابن شهاب حدثني أبو عبيد مولى ابن أزهر أنه شهد العيد مع عمر بن الخطاب قال ثم صليت مع علي بن أبي طالب قال فصلى لنا قبل الخطبة ثم خطب الناس فقال إن رسول الله صلى الله عليه وسلم قد نهاكم أن تأكلوا لحوم نسككم فوق ثلاث ليال فلا تأكلوا 	 Abu 'Ubaid, the freed slave of Ibn Azhar, reported that he said 'Id (prayer) with Umar b. al-Khattab, and then said the 'Id (prayer) with 'Ali b. Abu Talib. He (the narrator further) reported: He led us in prayer before delivering the sermon and then addressed the people saying: Allah's Messenger (SL3M) has forbidden you to eat the flesh of your sacrificial animals beyond three nights, so do not eat that. 
muslim35_352460	not identified	 وحدثني زهير بن حرب حدثنا يعقوب بن إبراهيم حدثنا ابن أخي ابن شهاب ح وحدثنا حسن الحلواني حدثنا يعقوب بن إبراهيم حدثنا أبي عن صالح ح وحدثنا عبد بن حميد أخبرنا عبد الرزاق أخبرنا معمر كلهم عن الزهري بهذا الإسناد مثله 	 وحدثني زهير بن حرب حدثنا يعقوب بن إبراهيم حدثنا ابن أخي ابن شهاب ح وحدثنا حسن الحلواني حدثنا يعقوب بن إبراهيم حدثنا أبي عن صالح ح وحدثنا عبد بن حميد أخبرنا عبد الرزاق أخبرنا معمر كلهم عن الزهري بهذا الإسناد مثله 	 This hadith has been narrated on the authority of Zuhri with the same chain of transmitters. 
muslim35_352470	not identified	 وحدثنا قتيبة بن سعيد حدثنا ليث ح وحدثني محمد بن رمح أخبرنا الليث عن نافع عن ابن عمر عن النبي صلى الله عليه وسلم أنه قال لا يأكل أحد من لحم أضحيته فوق ثلاثة أيام 	 وحدثنا قتيبة بن سعيد حدثنا ليث ح وحدثني محمد بن رمح أخبرنا الليث عن نافع عن ابن عمر عن النبي صلى الله عليه وسلم أنه قال لا يأكل أحد من لحم أضحيته فوق ثلاثة أيام 	 Ibn 'Umar reported Allah's Apostle (SL3M) having said: None of you should eat the flesh of his sacrificial animal beyond three days. 
muslim35_352480	not identified	 وحدثني محمد بن حاتم حدثنا يحيى بن سعيد عن ابن جريج ح وحدثني محمد بن رافع حدثنا ابن أبي فديك أخبرنا الضحاك يعني ابن عثمان كلاهما عن نافع عن ابن عمر عن النبي صلى الله عليه وسلم بمثل حديث الليث 	 وحدثني محمد بن حاتم حدثنا يحيى بن سعيد عن ابن جريج ح وحدثني محمد بن رافع حدثنا ابن أبي فديك أخبرنا الضحاك يعني ابن عثمان كلاهما عن نافع عن ابن عمر عن النبي صلى الله عليه وسلم بمثل حديث الليث 	 This hadith has been narrated on the authority of Ibn Umar through another chain of transmitters. 
muslim35_352490	not identified	 وحدثنا ابن أبي عمر وعبد بن حميد قال ابن أبي عمر حدثنا وقال عبد أخبرنا عبد الرزاق أخبرنا معمر عن الزهري عن سالم عن ابن عمر أن رسول الله صلى الله عليه وسلم نهى أن تؤكل لحوم الأضاحي بعد ثلاث قال سالم فكان ابن عمر لا يأكل لحوم الأضاحي فوق ثلاث وقال ابن أبي عمر بعد ثلاث 	 وحدثنا ابن أبي عمر وعبد بن حميد قال ابن أبي عمر حدثنا وقال عبد أخبرنا عبد الرزاق أخبرنا معمر عن الزهري عن سالم عن ابن عمر أن رسول الله صلى الله عليه وسلم نهى أن تؤكل لحوم الأضاحي بعد ثلاث قال سالم فكان ابن عمر لا يأكل لحوم الأضاحي فوق ثلاث وقال ابن أبي عمر بعد ثلاث 	" Ibn 'Umar reported that Allah's Messenger (SL3M) forbade that the flesh of sacrificial animals be eaten beyond three (days) Salim (son of Ibn Umar) said: Ibn 'Umar did not eat the flesh of the sacrificial animals beyond three (days). Ibn Abu 'Umar said:"" Beyond three days."" "
