nasai22_1122520	 أخبرنا عمرو بن زرارة قال أنبأنا إسماعيل قال حدثنا يونس عن أبي معشر عن إبراهيم عن	حدثنا علقمة قال كنت مع ابن مسعود وهو عند عثمان فقال عثمان خرج رسول الله صلى الله عليه وسلم على فتية فقال من كان منكم ذا طول فليتزوج فإنه أغض للبصر وأحصن للفرج ومن لا فالصوم له وجاء قال أبو عبد الرحمن أبو معشر هذا اسمه زياد بن كليب وهو ثقة وهو صاحب إبراهيم روى عنه منصور ومغيرة وشعبة وأبو معشر المدني اسمه نجيح وهو ضعيف ومع ضعفه أيضا كان قد اختلط عنده أحاديث مناكير منها محمد بن عمرو عن أبي سلمة عن أبي هريرة عن النبي صلى الله عليه وسلم قال ما بين المشرق والمغرب قبلة ومنها هشام بن عروة عن أبيه عن عائشة عن النبي صلى الله عليه وسلم لا تقطعوا اللحم بالسكين ولكن انهسوا نهسا 	 أخبرنا عمرو بن زرارة قال أنبأنا إسماعيل قال حدثنا يونس عن أبي معشر عن إبراهيم عن علقمة قال كنت مع ابن مسعود وهو عند عثمان فقال عثمان خرج رسول الله صلى الله عليه وسلم على فتية فقال من كان منكم ذا طول فليتزوج فإنه أغض للبصر وأحصن للفرج ومن لا فالصوم له وجاء قال أبو عبد الرحمن أبو معشر هذا اسمه زياد بن كليب وهو ثقة وهو صاحب إبراهيم روى عنه منصور ومغيرة وشعبة وأبو معشر المدني اسمه نجيح وهو ضعيف ومع ضعفه أيضا كان قد اختلط عنده أحاديث مناكير منها محمد بن عمرو عن أبي سلمة عن أبي هريرة عن النبي صلى الله عليه وسلم قال ما بين المشرق والمغرب قبلة ومنها هشام بن عروة عن أبيه عن عائشة عن النبي صلى الله عليه وسلم لا تقطعوا اللحم بالسكين ولكن انهسوا نهسا 	" It was narrated that 'Alqamah said: ""I was with Ibn Masud when he was with ""uthman, and 'Uthman said: 'Whoever among you has the means, let him get married, for it is more effective in lowering the gaze and guarding one's chastity. And whoever cannot, then fasting will be a shield for him."" (Sahih)Abu 'Abdur-Rahman (An-Nasai) said: This (narrator) is Abu Mashar, his name is Ziyad bin Kulaib, and he is trustworthy. He was a companion of Ibrahim. Mansur, Mughirah, and Shubah reported from him. (As for) Abu Mashar AL-Madini; his name is Najih and he is weak, and with his weakness, he also became confused, he narrated Munkar narrations, among them: Muhammad bin 'Amr from Abu Salamah, from Abu Hurairah, from the Prophet, who said: ""What is between the east and the west is the Qiblah. And among them: Hisham bin 'Urwah, from his father, from 'Aishah, from the Prophet: ""Do not cut meat with the knife, rather gnaw at it."" "
nasai22_1122530	 أخبرنا يونس بن عبد الأعلى قال أخبرني أنس عن سهيل بن أبي صالح عن أبيه عن أبي هريرة عن	عن رسول الله صلى الله عليه وسلم قال من صام يوما في سبيل الله عز وجل زحزح الله وجهه عن النار بذلك اليوم سبعين خريفا 	 أخبرنا يونس بن عبد الأعلى قال أخبرني أنس عن سهيل بن أبي صالح عن أبيه عن أبي هريرة عن رسول الله صلى الله عليه وسلم قال من صام يوما في سبيل الله عز وجل زحزح الله وجهه عن النار بذلك اليوم سبعين خريفا 	" It was narrated from Abu Hurairah that the Messenger of Allah said: ""Whoever fasts one day in the cause of Allah, the Mighty and sublime, Allah will remove his face away from the fire in return for the day (the distance of) seventy autumns. (Sahih) "
nasai22_1122540	 أخبرنا داود بن سليمان بن حفص قال حدثنا أبو معاوية الضرير عن سهيل عن المقبري عن	حدثنا أبي سعيد الخدري قال قال رسول الله صلى الله عليه وسلم من صام يوما في سبيل الله باعد الله بينه وبين النار بذلك اليوم سبعين خريفا 	 أخبرنا داود بن سليمان بن حفص قال حدثنا أبو معاوية الضرير عن سهيل عن المقبري عن أبي سعيد الخدري قال قال رسول الله صلى الله عليه وسلم من صام يوما في سبيل الله باعد الله بينه وبين النار بذلك اليوم سبعين خريفا 	" It was narrated that Abu Saeed Al-Khudri said: ""The Messenger of Allah said: 'Whoever fasts one day in the cause of Allah, Allah will separate between his face and the fire by (a distance of) seventy autumns in return for that day.""' (Sahih) "
nasai22_1122550	 أخبرنا إبراهيم بن يعقوب قال حدثنا ابن أبي مريم قال حدثنا سعيد بن	حدثنا عبد الرحمن قال أخبرني سهيل عن أبيه عن أبي هريرة قال قال رسول الله صلى الله عليه وسلم من صام يوما في سبيل الله باعد الله عز وجل وجهه عن النار سبعين خريفا 	 أخبرنا إبراهيم بن يعقوب قال حدثنا ابن أبي مريم قال حدثنا سعيد بن عبد الرحمن قال أخبرني سهيل عن أبيه عن أبي هريرة قال قال رسول الله صلى الله عليه وسلم من صام يوما في سبيل الله باعد الله عز وجل وجهه عن النار سبعين خريفا 	" It was narrated that Abu Hurairah said: ""The Messenger of Allah said: 'Whoever fasts one day in the cause of Allah, Allah, the mighty and sublime, will separate his face from the fire by (a distance of)seventy autumns.""' (Sahih) "
nasai22_1122560	 أخبرنا محمد بن بشار قال حدثنا محمد قال حدثنا شعبة عن سهيل عن صفوان عن أبي سعيد عن	حدثنا النبي صلى الله عليه وسلم قال من صام يوما في سبيل الله عز وجل باعد الله وجهه من جهنم سبعين عاما 	 أخبرنا محمد بن بشار قال حدثنا محمد قال حدثنا شعبة عن سهيل عن صفوان عن أبي سعيد عن النبي صلى الله عليه وسلم قال من صام يوما في سبيل الله عز وجل باعد الله وجهه من جهنم سبعين عاما 	" It was narrated from Abu Saeed that the Prophet said: ""Whoever fasts one day in the cause of Allah, the mighty and sublime, Allahwill separate his face from the fire by (a distance of) seventy years."" (Sahih) "
nasai22_1122570	 أخبرنا محمد بن عبد الله بن عبد الحكم عن شعيب قال أنبأنا الليث عن ابن الهاد عن سهيل عن ابن أبي عياش عن	عن أبي سعيد أنه سمع رسول الله صلى الله عليه وسلم يقول ما من عبد يصوم يوما في سبيل الله عز وجل إلا بعد الله عز وجل بذلك اليوم وجهه عن النار سبعين خريفا 	 أخبرنا محمد بن عبد الله بن عبد الحكم عن شعيب قال أنبأنا الليث عن ابن الهاد عن سهيل عن ابن أبي عياش عن أبي سعيد أنه سمع رسول الله صلى الله عليه وسلم يقول ما من عبد يصوم يوما في سبيل الله عز وجل إلا بعد الله عز وجل بذلك اليوم وجهه عن النار سبعين خريفا 	" It was narrated from Abu Saeed that he heard the Messenger of Allah say: ""There is no worshipper who fasts a day in the cause of Allah, the mighty and sublime, but Allah the mighty and sublime, will separate his face from the fire by (a distance of) seventy autumns in return for that day."" (Sahih) "
nasai22_1122580	 أخبرنا الحسن بن قزعة عن حميد بن الأسود قال حدثنا سهيل عن النعمان بن	حدثنا أبي عياش قال سمعت أبا سعيد الخدري قال قال رسول الله صلى الله عليه وسلم من صام يوما في سبيل الله عز وجل باعده الله عن النار سبعين خريفا 	 أخبرنا الحسن بن قزعة عن حميد بن الأسود قال حدثنا سهيل عن النعمان بن أبي عياش قال سمعت أبا سعيد الخدري قال قال رسول الله صلى الله عليه وسلم من صام يوما في سبيل الله عز وجل باعده الله عن النار سبعين خريفا 	" It was narrated that An-Numan bin Abi 'Ayyash said: ""I heard Abu Saeed Al-Khudri say: 'The Messenger of Allah said: Whoever fasts one day in the cause of Allah will separate his face from the fire by (a distance of) seventy autumns.""' (Sahih) "
nasai22_1122590	 أخبرنا مؤمل بن إهاب قال حدثنا	أخبرنا عبد الرزاق قال أنبأنا ابن جريج قال أخبرني يحيى بن سعيد وسهيل بن أبي صالح سمعا النعمان بن أبي عياش قال سمعت أبا سعيد الخدري يقول سمعت رسول الله صلى الله عليه وسلم يقول من صام يوما في سبيل الله تبارك وتعالى باعد الله وجهه عن النار سبعين خريفا 	 أخبرنا مؤمل بن إهاب قال حدثنا عبد الرزاق قال أنبأنا ابن جريج قال أخبرني يحيى بن سعيد وسهيل بن أبي صالح سمعا النعمان بن أبي عياش قال سمعت أبا سعيد الخدري يقول سمعت رسول الله صلى الله عليه وسلم يقول من صام يوما في سبيل الله تبارك وتعالى باعد الله وجهه عن النار سبعين خريفا 	" Abu Saeed Al-Khudi said: ""I heard the Messenger of Allah say: 'Whoever fasts one day in the cause of Allah, Allah will separate his face from the Fire by (a distance of) seventy autumns.""' (Sahih) "
nasai22_1122600	 أخبرنا عبد الله بن منير نيسابوري قال حدثنا يزيد العدني قال حدثنا سفيان عن سهيل بن	حدثنا أبي صالح عن النعمان بن أبي عياش عن أبي سعيد الخدري قال قال رسول الله صلى الله عليه وسلم لا يصوم عبد يوما في سبيل الله إلا باعد الله تعالى بذلك اليوم النار عن وجهه سبعين خريفا 	 أخبرنا عبد الله بن منير نيسابوري قال حدثنا يزيد العدني قال حدثنا سفيان عن سهيل بن أبي صالح عن النعمان بن أبي عياش عن أبي سعيد الخدري قال قال رسول الله صلى الله عليه وسلم لا يصوم عبد يوما في سبيل الله إلا باعد الله تعالى بذلك اليوم النار عن وجهه سبعين خريفا 	" It was narrated that Abu Saeed Al-khudi said: ""The Messenger of Allah: 'There is no worshipper who fasts a day in the cause of Allah, but Allah, the most high, will separate (a distance of) seventy autumns between his face and the fire in return for that day.""' (Sahih) "
nasai22_1122610	 أخبرنا أحمد بن حرب قال حدثنا قاسم عن سفيان عن سهيل بن أبي صالح عن النعمان بن	عن أبي عياش عن أبي سعيد الخدري عن النبي صلى الله عليه وسلم قال من صام يوما في سبيل الله باعد الله بذلك اليوم حر جهنم عن وجهه سبعين خريفا 	 أخبرنا أحمد بن حرب قال حدثنا قاسم عن سفيان عن سهيل بن أبي صالح عن النعمان بن أبي عياش عن أبي سعيد الخدري عن النبي صلى الله عليه وسلم قال من صام يوما في سبيل الله باعد الله بذلك اليوم حر جهنم عن وجهه سبعين خريفا 	" It was narrated from Abu Saeed Al-Khudri that the Prophet said: ""Whoever fasts a day in the cause of Allah, Allah will separate his face from the heat of Hell (a distance of) seventy autumns."" (Sahih) "
nasai22_1122620	 أخبرنا عبد الله بن أحمد بن محمد بن	أخبرنا حنبل قال قرأت على أبي حدثكم ابن نمير قال حدثنا سفيان عن سمى عن النعمان بن أبي عياش عن أبي سعيد الخدري قال قال رسول الله صلى الله عليه وسلم من صام يوما في سبيل الله باعد الله بذلك اليوم النار عن وجهه سبعين خريفا 	 أخبرنا عبد الله بن أحمد بن محمد بن حنبل قال قرأت على أبي حدثكم ابن نمير قال حدثنا سفيان عن سمى عن النعمان بن أبي عياش عن أبي سعيد الخدري قال قال رسول الله صلى الله عليه وسلم من صام يوما في سبيل الله باعد الله بذلك اليوم النار عن وجهه سبعين خريفا 	" It was narrated that Abu Saeed Al-Khudri said: ""The Messenger of Allah said: Whoever fasts a day in the cause of Allah, Allah will separate his face (a distance of) seventy autumns from the fire in return for that day."" (Sahih) "
nasai22_1122630	 أخبرنا محمود بن خالد عن محمد بن	أخبرنا شعيب قال أخبرني يحيى بن الحارث عن القاسم أبي عبد الرحمن أنه حدثه عن عقبة بن عامر عن رسول الله صلى الله عليه وسلم قال من صام يوما في سبيل الله عز وجل باعد الله منه جهنم مسيرة مائة عام 	 أخبرنا محمود بن خالد عن محمد بن شعيب قال أخبرني يحيى بن الحارث عن القاسم أبي عبد الرحمن أنه حدثه عن عقبة بن عامر عن رسول الله صلى الله عليه وسلم قال من صام يوما في سبيل الله عز وجل باعد الله منه جهنم مسيرة مائة عام 	" It was narrated from 'Uqbah bin 'Amir that the Messenger of Allah said: ""Whoever fasts one day in the cause of Allah, the mighty and sublime, Allah will separate him the distance of one hundred years from the fire."" (Hasan) "
nasai22_1122640	 أخبرنا إسحاق بن إبراهيم قال أنبأنا سفيان عن الزهري عن صفوان بن عبد الله عن أم الدرداء عن كعب بن	عن عاصم قال سمعت رسول الله صلى الله عليه وسلم يقول ليس من البر الصيام في السفر 	 أخبرنا إسحاق بن إبراهيم قال أنبأنا سفيان عن الزهري عن صفوان بن عبد الله عن أم الدرداء عن كعب بن عاصم قال سمعت رسول الله صلى الله عليه وسلم يقول ليس من البر الصيام في السفر 	" It was narrated that Kab bin 'Asim said: ""I heard the Messenger of Allah say; 'It is not righteousness to fast when traveling.""' (Sahih) "
nasai22_1122650	not identified	 أخبرني إبراهيم بن يعقوب قال حدثنا محمد بن كثير عن الأوزاعي عن الزهري عن سعيد بن المسيب قال قال رسول الله صلى الله عليه وسلم ليس من البر الصيام في السفر قال أبو عبد الرحمن هذا خطأ والصواب الذي قبله لا نعلم أحدا تابع ابن كثير عليه 	 أخبرني إبراهيم بن يعقوب قال حدثنا محمد بن كثير عن الأوزاعي عن الزهري عن سعيد بن المسيب قال قال رسول الله صلى الله عليه وسلم ليس من البر الصيام في السفر قال أبو عبد الرحمن هذا خطأ والصواب الذي قبله لا نعلم أحدا تابع ابن كثير عليه 	" It was narrated that Saeed bin Al-Musayyab said: ""The Messenger of Allah said: 'It is not righteousness to fast when traveling.""' (Sahih)Abu 'Abdur-Rahman (An-Nasai) said: This is a mistake, and what is correct is the one that is before it. We do not know of anyone who followed up Ibn Kathir. "
nasai22_1122660	 أخبرنا قتيبة قال حدثنا بكر عن عمارة بن غزية عن محمد بن عبد الرحمن عن جابر بن	عن عبد الله أن رسول الله صلى الله عليه وسلم رأى ناسا مجتمعين على رجل فسأل فقالوا رجل أجهده الصوم قال رسول الله صلى الله عليه وسلم ليس من البر الصيام في السفر 	 أخبرنا قتيبة قال حدثنا بكر عن عمارة بن غزية عن محمد بن عبد الرحمن عن جابر بن عبد الله أن رسول الله صلى الله عليه وسلم رأى ناسا مجتمعين على رجل فسأل فقالوا رجل أجهده الصوم قال رسول الله صلى الله عليه وسلم ليس من البر الصيام في السفر 	" It was narrated from Jabir bin 'Abdullah that: the Messenger of Allah saw some people gathered around a man, so he asked (what was happening) and they said: ""It is a man who is exhausted because of fasting."" The Messenger of Allah said: ""It is not righteousness to fast when traveling."" (Sahih) "
nasai22_1122670	not identified	 أخبرني شعيب بن شعيب بن إسحاق قال حدثنا عبد الوهاب بن سعيد قال حدثنا شعيب قال حدثنا الأوزاعي قال حدثني يحيى بن أبي كثير قال أخبرني محمد بن عبد الرحمن قال أخبرني جابر بن عبد الله أن رسول الله صلى الله عليه وسلم مر برجل في ظل شجرة يرش عليه الماء قال ما بال صاحبكم هذا قالوا يا رسول الله صائم قال إنه ليس من البر أن تصوموا في السفر وعليكم برخصة الله التي رخص لكم فاقبلوها 	 أخبرني شعيب بن شعيب بن إسحاق قال حدثنا عبد الوهاب بن سعيد قال حدثنا شعيب قال حدثنا الأوزاعي قال حدثني يحيى بن أبي كثير قال أخبرني محمد بن عبد الرحمن قال أخبرني جابر بن عبد الله أن رسول الله صلى الله عليه وسلم مر برجل في ظل شجرة يرش عليه الماء قال ما بال صاحبكم هذا قالوا يا رسول الله صائم قال إنه ليس من البر أن تصوموا في السفر وعليكم برخصة الله التي رخص لكم فاقبلوها 	" Jabir bin 'Abdullah narrated that: the Messenger of Allah passed by a man in the shade of a tree on whom water was being sprinkled. He said: ""What is the matter with your companion?"" They said: ""O Messenger of Allah, he is fasting."" He said: ""It is not righteousness to fast when traveling. Take to the concession which Allah has granted you, accept it."" (Sahih) "
nasai22_1122680	 أخبرنا محمود بن خالد قال حدثنا الفريابي قال حدثنا الأوزاعي قال حدثني يحيى قال أخبرني محمد بن	حدثنا عبد الرحمن قال حدثني من سمع جابرا نحوه 	 أخبرنا محمود بن خالد قال حدثنا الفريابي قال حدثنا الأوزاعي قال حدثني يحيى قال أخبرني محمد بن عبد الرحمن قال حدثني من سمع جابرا نحوه 	" Muhammad bin 'Abdur-Rahman said: ""Someone who heard it from Jabir told me something similar."" (Sahih) "
nasai22_1122690	 أخبرنا إسحاق بن إبراهيم قال أنبأنا وكيع قال حدثنا علي بن المبارك عن يحيى بن أبي كثير عن محمد بن عبد الرحمن بن ثوبان عن جابر بن	عن عبد الله رضى الله عنهما عن رسول الله صلى الله عليه وسلم قال ليس من البر الصيام في السفر عليكم برخصة الله عز وجل فاقبلوها 	 أخبرنا إسحاق بن إبراهيم قال أنبأنا وكيع قال حدثنا علي بن المبارك عن يحيى بن أبي كثير عن محمد بن عبد الرحمن بن ثوبان عن جابر بن عبد الله رضى الله عنهما عن رسول الله صلى الله عليه وسلم قال ليس من البر الصيام في السفر عليكم برخصة الله عز وجل فاقبلوها 	" It was narrated from Jabir bin 'Abdullah that the Messenger of Allah said: ""It is not righteousness to fast when traveling. Take to the concession which Allah, the mighty and sublime, has granted you, accept it."" (Sahih) "
nasai22_1122700	 أخبرنا محمد بن المثنى عن عثمان بن	أخبرنا عمر قال أنبأنا علي بن المبارك عن يحيى عن محمد بن عبد الرحمن عن رجل عن جابر أن رسول الله صلى الله عليه وسلم قال ليس من البر الصيام في السفر 	 أخبرنا محمد بن المثنى عن عثمان بن عمر قال أنبأنا علي بن المبارك عن يحيى عن محمد بن عبد الرحمن عن رجل عن جابر أن رسول الله صلى الله عليه وسلم قال ليس من البر الصيام في السفر 	" It was narrated from a man, from Jabir that the Messenger of Allah said: ""It is not righteousness to fast when traveling."" (Sahih) "
nasai22_1122710	 أخبرنا عمرو بن علي قال حدثنا يحيى بن	أخبرنا سعيد وخالد بن الحارث عن شعبة عن محمد بن عبد الرحمن عن محمد بن عمرو بن حسن عن جابر بن عبد الله أن رسول الله صلى الله عليه وسلم رأى رجلا قد ظلل عليه في السفر فقال ليس من البر الصيام في السفر 	 أخبرنا عمرو بن علي قال حدثنا يحيى بن سعيد وخالد بن الحارث عن شعبة عن محمد بن عبد الرحمن عن محمد بن عمرو بن حسن عن جابر بن عبد الله أن رسول الله صلى الله عليه وسلم رأى رجلا قد ظلل عليه في السفر فقال ليس من البر الصيام في السفر 	" It was narrated from Jabir bin Abdullah that: the Messenger of Allah saw a man who was being shaded on a journey. He said: ""It is not righteousness to fast when traveling."" (Sahih) "
nasai22_1122720	 أخبرنا محمد بن عبد الله بن عبد الحكم عن شعيب قال أنبأنا الليث عن ابن الهاد عن جعفر بن محمد عن أبيه عن	عن جابر قال خرج رسول الله صلى الله عليه وسلم إلى مكة عام الفتح في رمضان فصام حتى بلغ كراع الغميم فصام الناس فبلغه أن الناس قد شق عليهم الصيام فدعا بقدح من الماء بعد العصر فشرب والناس ينظرون فأفطر بعض الناس وصام بعض فبلغه أن ناسا صاموا فقال أولئك العصاة 	 أخبرنا محمد بن عبد الله بن عبد الحكم عن شعيب قال أنبأنا الليث عن ابن الهاد عن جعفر بن محمد عن أبيه عن جابر قال خرج رسول الله صلى الله عليه وسلم إلى مكة عام الفتح في رمضان فصام حتى بلغ كراع الغميم فصام الناس فبلغه أن الناس قد شق عليهم الصيام فدعا بقدح من الماء بعد العصر فشرب والناس ينظرون فأفطر بعض الناس وصام بعض فبلغه أن ناسا صاموا فقال أولئك العصاة 	" It was narrated that Jabir said: ""The Messenger of Allah went out to Makkah in the year of the Conquest in Ramadan. He fasted until he reached Kura Al-Ghamim, and the people fast, so he called for a vessel of water after 'Asr and drank it while the people were looking on. Then some of the people broke their fast and some continued to fast. He heard that some people were still fasting and he said: 'Those are the disobedient ones. (Sahih) "
