nasai22_1121710	 أخبرنا إسحاق بن منصور قال أنبأنا عبد الرحمن قال حدثنا شعبة عن عبد الحميد صاحب الزيادي قال سمعت عبد الله بن	عن الحارث يحدث عن رجل من أصحاب النبي صلى الله عليه وسلم قال دخلت على النبي صلى الله عليه وسلم وهو يتسحر فقال إنها بركة أعطاكم الله إياها فلا تدعوه 	 أخبرنا إسحاق بن منصور قال أنبأنا عبد الرحمن قال حدثنا شعبة عن عبد الحميد صاحب الزيادي قال سمعت عبد الله بن الحارث يحدث عن رجل من أصحاب النبي صلى الله عليه وسلم قال دخلت على النبي صلى الله عليه وسلم وهو يتسحر فقال إنها بركة أعطاكم الله إياها فلا تدعوه 	" 'Abdullah bin Al-Harith narrated that a man from among the Companions of th Prophet said: ""I entered upon the Prophet when he was having Sahur. He sadi: 'It is a blessing that Allah has given to you, so do not neglect it."" (Sahih) "
nasai22_1121720	 أخبرنا شعيب بن يوسف بصري قال حدثنا عبد الرحمن عن معاوية بن صالح عن يونس بن سيف عن الحارث بن زياد عن أبي رهم عن العرباض بن	عن سارية قال سمعت رسول الله صلى الله عليه وسلم وهو يدعو إلى السحور في شهر رمضان وقال هلموا إلى الغداء المبارك 	 أخبرنا شعيب بن يوسف بصري قال حدثنا عبد الرحمن عن معاوية بن صالح عن يونس بن سيف عن الحارث بن زياد عن أبي رهم عن العرباض بن سارية قال سمعت رسول الله صلى الله عليه وسلم وهو يدعو إلى السحور في شهر رمضان وقال هلموا إلى الغداء المبارك 	" It was narrated that AL-'Irbad bin Sariyah said: ""I heard the Messenger of Allah inviting people to have Sahur in Ramadan. He said: 'Come to the blessed breakfast."" (Hasan)Chatper 26. Calling Sahur ""Ghada"" (Breakfast) "
nasai22_1121730	 أخبرنا سويد بن نصر قال أنبأنا عبد الله عن بقية بن الوليد قال أخبرني بحير بن سعد عن خالد بن معدان عن المقدام بن معديكرب عن	عن النبي صلى الله عليه وسلم قال عليكم بغداء السحور فإنه هو الغداء المبارك 	 أخبرنا سويد بن نصر قال أنبأنا عبد الله عن بقية بن الوليد قال أخبرني بحير بن سعد عن خالد بن معدان عن المقدام بن معديكرب عن النبي صلى الله عليه وسلم قال عليكم بغداء السحور فإنه هو الغداء المبارك 	" It was narrated from Al-Miqdam bin Madikarib that the Prophet said: ""You should take Sahur for it is the blessed breakfast."" (Sahih) "
nasai22_1121740	 أخبرنا عمرو بن علي قال حدثنا عبد الرحمن قال حدثنا سفيان عن ثور عن خالد بن	حدثنا معدان قال قال رسول الله صلى الله عليه وسلم لرجل هلم إلى الغداء المبارك يعني السحور 	 أخبرنا عمرو بن علي قال حدثنا عبد الرحمن قال حدثنا سفيان عن ثور عن خالد بن معدان قال قال رسول الله صلى الله عليه وسلم لرجل هلم إلى الغداء المبارك يعني السحور 	" It was narrated that Khalid bin Ma'dan said: ""The Messenger of Allah said to a man: 'Come to the blessed breakfast, - meaning Sahur."" ' (Sahih) "
nasai22_1121750	 أخبرنا قتيبة قال حدثنا الليث عن موسى بن على عن أبيه عن أبي قيس عن عمرو بن	عن العاص قال قال رسول الله صلى الله عليه وسلم إن فصل ما بين صيامنا وصيام أهل الكتاب أكلة السحور 	 أخبرنا قتيبة قال حدثنا الليث عن موسى بن على عن أبيه عن أبي قيس عن عمرو بن العاص قال قال رسول الله صلى الله عليه وسلم إن فصل ما بين صيامنا وصيام أهل الكتاب أكلة السحور 	" It was narrated that 'Amr bin Al-As said: ""The Messenger of Allah said: 'The difference between our fasting and the fasting of the people of the Book, is eating Sahur.""' ' (Sahih) "
nasai22_1121760	 أخبرنا إسحاق بن	أخبرنا إبراهيم قال أنبأنا عبد الرزاق قال أنبأنا معمر عن قتادة عن أنس قال قال رسول الله صلى الله عليه وسلم وذلك عند السحور يا أنس إني أريد الصيام أطعمني شيئا فأتيته بتمر وإناء فيه ماء وذلك بعد ما أذن بلال فقال يا أنس انظر رجلا يأكل معي فدعوت زيد بن ثابت فجاء فقال إني قد شربت شربة سويق وأنا أريد الصيام فقال رسول الله صلى الله عليه وسلم وأنا أريد الصيام فتسحر معه ثم قام فصلى ركعتين ثم خرج إلى الصلاة 	 أخبرنا إسحاق بن إبراهيم قال أنبأنا عبد الرزاق قال أنبأنا معمر عن قتادة عن أنس قال قال رسول الله صلى الله عليه وسلم وذلك عند السحور يا أنس إني أريد الصيام أطعمني شيئا فأتيته بتمر وإناء فيه ماء وذلك بعد ما أذن بلال فقال يا أنس انظر رجلا يأكل معي فدعوت زيد بن ثابت فجاء فقال إني قد شربت شربة سويق وأنا أريد الصيام فقال رسول الله صلى الله عليه وسلم وأنا أريد الصيام فتسحر معه ثم قام فصلى ركعتين ثم خرج إلى الصلاة 	" It was narrated that Anas said: ""The Messenger of Allah said, at the time of Sahur. 'O Anas, I want to fast, so give me something to eat.' So I brought him some dates and a vessel of water. That was after the Adhan of Bilal. He said: 'O Anas, find a man to come and eat with me.' So I called Zaid bin Thabit, who came and said: ""I drank some Sawiq and I want to fast.' The Messenger of Allah said: ""I also want to fast.' So he ate Sahr with him, then he got up and prayed two Rak'ahs, then he went out to the prayer."" (Da'if) "
nasai22_1121770	not identified	 أخبرني هلال بن العلاء بن هلال قال حدثنا حسين بن عياش قال حدثنا زهير قال حدثنا أبو إسحاق عن البراء بن عازب أن أحدهم كان إذا نام قبل أن يتعشى لم يحل له أن يأكل شيئا ولا يشرب ليلته ويومه من الغد حتى تغرب الشمس حتى نزلت هذه الآية { وكلوا واشربوا } إلى { الخيط الأسود } قال ونزلت في أبي قيس بن عمرو أتى أهله وهو صائم بعد المغرب فقال هل من شىء فقالت امرأته ما عندنا شىء ولكن أخرج ألتمس لك عشاء فخرجت ووضع رأسه فنام فرجعت إليه فوجدته نائما وأيقظته فلم يطعم شيئا وبات وأصبح صائما حتى انتصف النهار فغشي عليه وذلك قبل أن تنزل هذه الآية فأنزل الله فيه 	 أخبرني هلال بن العلاء بن هلال قال حدثنا حسين بن عياش قال حدثنا زهير قال حدثنا أبو إسحاق عن البراء بن عازب أن أحدهم كان إذا نام قبل أن يتعشى لم يحل له أن يأكل شيئا ولا يشرب ليلته ويومه من الغد حتى تغرب الشمس حتى نزلت هذه الآية { وكلوا واشربوا } إلى { الخيط الأسود } قال ونزلت في أبي قيس بن عمرو أتى أهله وهو صائم بعد المغرب فقال هل من شىء فقالت امرأته ما عندنا شىء ولكن أخرج ألتمس لك عشاء فخرجت ووضع رأسه فنام فرجعت إليه فوجدته نائما وأيقظته فلم يطعم شيئا وبات وأصبح صائما حتى انتصف النهار فغشي عليه وذلك قبل أن تنزل هذه الآية فأنزل الله فيه 	" It was narrated from Al-Bara bin Azib that: if one of them went to sleep before eating supper, it was not permissible for him to eat or drink anything that night or the following day, until the sun had set. (That continued) until this Verse was revealed: ""And eat and drink until the white thread (light) of dawn appears to you distinct from the black thread (darkness of night)."" He said: ""This was revealed concerning Abu Qais bin 'Amr who came to his family after Maghrib when he was fasting, and said: 'Is there anything to eat?"" His wife said: 'No , but I will go out, and he lay down and slept. She came back and found him sleeping, so she woke him up, but he did not eat anything. He spent the night fasting and woke up the next day fasting, until he passed out at midday. That was before this Verse was revealed, and Allah revealed it concerning him."" ' (Sahih) "
nasai22_1121780	 أخبرنا علي بن حجر قال حدثنا جرير عن مطرف عن الشعبي عن عدي بن	عن حاتم أنه سأل رسول الله صلى الله عليه وسلم عن قوله تعالى { حتى يتبين لكم الخيط الأبيض من الخيط الأسود } قال هو سواد الليل وبياض النهار 	 أخبرنا علي بن حجر قال حدثنا جرير عن مطرف عن الشعبي عن عدي بن حاتم أنه سأل رسول الله صلى الله عليه وسلم عن قوله تعالى { حتى يتبين لكم الخيط الأبيض من الخيط الأسود } قال هو سواد الليل وبياض النهار 	" It was narrated from 'Adiyy bin Hatim that: he asked the Messenger of Allah about the verse ""Until the white thread (light) of dawn appears to you distinct from the black thread (darkness of night)."" He said: ""It is the blackness of the night and the whiteness of the day."" ' (Sahih) "
nasai22_1121790	 أخبرنا عمرو بن علي قال حدثنا يحيى قال حدثنا التيمي عن أبي عثمان عن ابن مسعود عن	حدثنا النبي صلى الله عليه وسلم قال إن بلالا يؤذن بليل لينبه نائمكم ويرجع قائمكم وليس الفجر أن يقول هكذا وأشار بكفه ولكن الفجر أن يقول هكذا وأشار بالسبابتين 	 أخبرنا عمرو بن علي قال حدثنا يحيى قال حدثنا التيمي عن أبي عثمان عن ابن مسعود عن النبي صلى الله عليه وسلم قال إن بلالا يؤذن بليل لينبه نائمكم ويرجع قائمكم وليس الفجر أن يقول هكذا وأشار بكفه ولكن الفجر أن يقول هكذا وأشار بالسبابتين 	" It was narrated from Ibn Mas'ud that the Prophet said: ""Bilal calls the Adhan at night to awaken those of you who are asleep, and so that those who are praying Qiyam cam return. Dawn is not when the light appears like this"" - and he gestured with his hand - ""rather dawn is when it appears like this: - and he gestured with his two forefingers. ' (Sahih) "
nasai22_1121800	 أخبرنا محمود بن غيلان قال حدثنا أبو داود قال حدثنا شعبة أنبأنا سوادة بن	حدثنا حنظلة قال سمعت سمرة يقول قال رسول الله صلى الله عليه وسلم لا يغرنكم أذان بلال ولا هذا البياض حتى ينفجر الفجر هكذا وهكذا يعني معترضا قال أبو داود وبسط بيديه يمينا وشمالا مادا يديه 	 أخبرنا محمود بن غيلان قال حدثنا أبو داود قال حدثنا شعبة أنبأنا سوادة بن حنظلة قال سمعت سمرة يقول قال رسول الله صلى الله عليه وسلم لا يغرنكم أذان بلال ولا هذا البياض حتى ينفجر الفجر هكذا وهكذا يعني معترضا قال أبو داود وبسط بيديه يمينا وشمالا مادا يديه 	" Samurah said: ""The Messenger of Allah said; 'DO not be confused by the Adhan of Bilal, or by this whiteness, until dawn appears like this"" - meaning horizontally. (One of the narrators) Abu Dawud said: ""And he spread out his hands gesturing to the right and left."" (Sahih) "
nasai22_1121810	 أخبرنا إسحاق بن إبراهيم قال أنبأنا الوليد عن الأوزاعي عن يحيى عن أبي سلمة عن أبي هريرة عن	عن رسول الله صلى الله عليه وسلم قال لا تقدموا قبل الشهر بصيام إلا رجل كان يصوم صياما أتى ذلك اليوم على صيامه 	 أخبرنا إسحاق بن إبراهيم قال أنبأنا الوليد عن الأوزاعي عن يحيى عن أبي سلمة عن أبي هريرة عن رسول الله صلى الله عليه وسلم قال لا تقدموا قبل الشهر بصيام إلا رجل كان يصوم صياما أتى ذلك اليوم على صيامه 	" It was narrated from Abu Hurairah that the Messenger of Allah said: ""Do not fast ahead of the month, except for a man who habitually fasts, and that day happenes to be one of his regular fasts."" ' (Sahih) "
nasai22_1121820	not identified	 أخبرني عمران بن يزيد بن خالد قال حدثنا محمد بن شعيب قال أنبأنا الأوزاعي عن يحيى قال حدثني أبو سلمة قال أخبرني أبو هريرة أن رسول الله صلى الله عليه وسلم قال لا يتقدمن أحد الشهر بيوم ولا يومين إلا أحد كان يصوم صياما قبله فليصمه 	 أخبرني عمران بن يزيد بن خالد قال حدثنا محمد بن شعيب قال أنبأنا الأوزاعي عن يحيى قال حدثني أبو سلمة قال أخبرني أبو هريرة أن رسول الله صلى الله عليه وسلم قال لا يتقدمن أحد الشهر بيوم ولا يومين إلا أحد كان يصوم صياما قبله فليصمه 	" Abu Hurairah narrated that the Messengre of Allah said: ""None should fast one or two days ahead of the month except, someone who had a prior habit for fasting, in which case let him fast."" ' (Sahih) "
nasai22_1121830	 أخبرنا محمد بن العلاء قال حدثنا أبو خالد عن محمد بن عمرو عن أبي سلمة عن	عن ابن عباس قال قال رسول الله صلى الله عليه وسلم لا تتقدموا الشهر بصيام يوم ولا يومين إلا أن يوافق ذلك يوما كان يصومه أحدكم قال أبو عبد الرحمن هذا خطأ 	 أخبرنا محمد بن العلاء قال حدثنا أبو خالد عن محمد بن عمرو عن أبي سلمة عن ابن عباس قال قال رسول الله صلى الله عليه وسلم لا تتقدموا الشهر بصيام يوم ولا يومين إلا أن يوافق ذلك يوما كان يصومه أحدكم قال أبو عبد الرحمن هذا خطأ 	" It was narrated that Ibn 'Abbas said: ""The messenger of Allah said: 'Do not fast one or two days ahead of the month, unless that happens to be a day that one of you habitually fasts.""' Abu 'Abdur-Rahman (An-Nasai) said: This is a mistake. ' (Sahih) "
nasai22_1121840	 أخبرنا شعيب بن يوسف ومحمد بن	أخبرنا بشار واللفظ له قالا حدثنا عبد الرحمن قال حدثنا سفيان عن منصور عن سالم عن أبي سلمة عن أم سلمة قالت ما رأيت رسول الله صلى الله عليه وسلم يصوم شهرين متتابعين إلا أنه كان يصل شعبان برمضان 	 أخبرنا شعيب بن يوسف ومحمد بن بشار واللفظ له قالا حدثنا عبد الرحمن قال حدثنا سفيان عن منصور عن سالم عن أبي سلمة عن أم سلمة قالت ما رأيت رسول الله صلى الله عليه وسلم يصوم شهرين متتابعين إلا أنه كان يصل شعبان برمضان 	" It was narrated from Abu Salamah that Umm Salamah said: ""U never saw the Messenger of Allah fast two consecutive months, but he used to join shaban to Ramadan."" ' (Sahih) "
nasai22_1121850	 أخبرنا إسحاق بن	أخبرنا إبراهيم قال أنبأنا النضر قال أنبأنا شعبة عن توبة العنبري عن محمد بن إبراهيم عن أبي سلمة عن أم سلمة قالت كان رسول الله صلى الله عليه وسلم يصل شعبان برمضان 	 أخبرنا إسحاق بن إبراهيم قال أنبأنا النضر قال أنبأنا شعبة عن توبة العنبري عن محمد بن إبراهيم عن أبي سلمة عن أم سلمة قالت كان رسول الله صلى الله عليه وسلم يصل شعبان برمضان 	" It was narrated that Umm Salamah said: ""The Messenger of Allah used to join Shaban to Ramadan."" ' (Sahih) "
nasai22_1121860	 أخبرنا الربيع بن سليمان قال حدثنا ابن وهب قال أخبرني أسامة بن	حدثنا زيد أن محمد بن إبراهيم حدثه عن أبي سلمة بن عبد الرحمن أنه سأل عائشة عن صيام رسول الله صلى الله عليه وسلم فقالت كان رسول الله صلى الله عليه وسلم يصوم حتى نقول لا يفطر ويفطر حتى نقول لا يصوم وكان يصوم شعبان أو عامة شعبان 	 أخبرنا الربيع بن سليمان قال حدثنا ابن وهب قال أخبرني أسامة بن زيد أن محمد بن إبراهيم حدثه عن أبي سلمة بن عبد الرحمن أنه سأل عائشة عن صيام رسول الله صلى الله عليه وسلم فقالت كان رسول الله صلى الله عليه وسلم يصوم حتى نقول لا يفطر ويفطر حتى نقول لا يصوم وكان يصوم شعبان أو عامة شعبان 	" It was narrated from Abu Salamah bin 'Abdur-Rahman that he asked Aishah about the fasting of the Messenger of Allah. She said: ""The Messenger of Allah used to fast until we said: 'He will not fast.' And he used to fast Shaban, or most of Shaban.""' ' (Sahih) "
nasai22_1121870	 أخبرنا أحمد بن سعد بن الحكم قال حدثنا عمي قال حدثنا نافع بن	حدثنا يزيد أن ابن الهاد حدثه أن محمد بن إبراهيم حدثه عن أبي سلمة يعني ابن عبد الرحمن عن عائشة قالت لقد كانت إحدانا تفطر في رمضان فما تقدر على أن تقضي حتى يدخل شعبان وما كان رسول الله صلى الله عليه وسلم يصوم في شهر ما يصوم في شعبان كان يصومه كله إلا قليلا بل كان يصومه كله 	 أخبرنا أحمد بن سعد بن الحكم قال حدثنا عمي قال حدثنا نافع بن يزيد أن ابن الهاد حدثه أن محمد بن إبراهيم حدثه عن أبي سلمة يعني ابن عبد الرحمن عن عائشة قالت لقد كانت إحدانا تفطر في رمضان فما تقدر على أن تقضي حتى يدخل شعبان وما كان رسول الله صلى الله عليه وسلم يصوم في شهر ما يصوم في شعبان كان يصومه كله إلا قليلا بل كان يصومه كله 	" It was narrated that Aishah said: ""One of us (women) would miss some fasts in Ramadan and she would not be able to make it up until Shaban began, and the Messenger of Allah did not fast in any month as he fasted in Shaban; he used to fast all of it, except a little, he used to fast all of it."" ' (Sahih) "
nasai22_1121880	 أخبرنا محمد بن عبد الله بن يزيد قال حدثنا سفيان عن عبد الله بن أبي لبيد عن أبي سلمة قال سألت عائشة فقلت أخبريني عن	عن صيام رسول الله صلى الله عليه وسلم قالت كان يصوم حتى نقول قد صام ويفطر حتى نقول قد أفطر ولم يكن يصوم شهرا أكثر من شعبان كان يصوم شعبان إلا قليلا كان يصوم شعبان كله 	 أخبرنا محمد بن عبد الله بن يزيد قال حدثنا سفيان عن عبد الله بن أبي لبيد عن أبي سلمة قال سألت عائشة فقلت أخبريني عن صيام رسول الله صلى الله عليه وسلم قالت كان يصوم حتى نقول قد صام ويفطر حتى نقول قد أفطر ولم يكن يصوم شهرا أكثر من شعبان كان يصوم شعبان إلا قليلا كان يصوم شعبان كله 	" It was narrated that Abu Salamah said: ""I asked Aishah: 'Tell me about the fasting of the Messenger of Allah.' She said: 'he used to fast until we said: he is going to fast until we said: He is not going to fast. He never fasted any month more than Shaban. He used to fast (all) of Shaban except a little, he used to fast all of Shaban.""' ' (Sahih) "
nasai22_1121890	 أخبرنا إسحاق بن إبراهيم قال أنبأنا معاذ بن	أخبرنا هشام قال حدثني أبي عن يحيى بن أبي كثير قال حدثني أبو سلمة بن عبد الرحمن عن عائشة قالت لم يكن رسول الله صلى الله عليه وسلم في شهر من السنة أكثر صياما منه في شعبان كان يصوم شعبان كله 	 أخبرنا إسحاق بن إبراهيم قال أنبأنا معاذ بن هشام قال حدثني أبي عن يحيى بن أبي كثير قال حدثني أبو سلمة بن عبد الرحمن عن عائشة قالت لم يكن رسول الله صلى الله عليه وسلم في شهر من السنة أكثر صياما منه في شعبان كان يصوم شعبان كله 	" It was narrated that Aishah said: ""The Messenger of Allah did not fast in any month of the year more than he did in Shaban. He used to fast all of Shaban."" (' (Sahih) "
nasai22_1121900	 أخبرنا أحمد بن سليمان قال حدثنا أبو داود عن سفيان عن منصور عن خالد بن سعد عن	عن عائشة قالت كان النبي صلى الله عليه وسلم يصوم شعبان 	 أخبرنا أحمد بن سليمان قال حدثنا أبو داود عن سفيان عن منصور عن خالد بن سعد عن عائشة قالت كان النبي صلى الله عليه وسلم يصوم شعبان 	" It was narrated that Aishah said: ""The Prophet used to fast Shaban."" ' (Sahih) "
nasai22_1121910	 أخبرنا هارون بن إسحاق عن عبدة عن سعيد عن قتادة عن زرارة بن أوفى عن سعد بن	عن هشام عن عائشة قالت لا أعلم رسول الله صلى الله عليه وسلم قرأ القرآن كله في ليلة ولا قام ليلة حتى الصباح ولا صام شهرا كاملا قط غير رمضان 	 أخبرنا هارون بن إسحاق عن عبدة عن سعيد عن قتادة عن زرارة بن أوفى عن سعد بن هشام عن عائشة قالت لا أعلم رسول الله صلى الله عليه وسلم قرأ القرآن كله في ليلة ولا قام ليلة حتى الصباح ولا صام شهرا كاملا قط غير رمضان 	" It was narrated that Aishah said: ""I do not know that the Messenger of Allah recited the whole Quran in one night, or prayed Qiyam until morning, or ever fasted an entire month except Ramadan."" ' (Sahih) "
nasai22_1121920	 أخبرنا محمد بن أحمد بن	أخبرنا أبي يوسف الصيدلاني حراني قال حدثنا محمد بن سلمة عن هشام عن ابن سيرين عن عبد الله بن شقيق عن عائشة قال سألتها عن صيام رسول الله صلى الله عليه وسلم قالت كان رسول الله صلى الله عليه وسلم يصوم حتى نقول قد صام ويفطر حتى نقول قد أفطر ولم يصم شهرا تاما منذ أتى المدينة إلا أن يكون رمضان 	 أخبرنا محمد بن أحمد بن أبي يوسف الصيدلاني حراني قال حدثنا محمد بن سلمة عن هشام عن ابن سيرين عن عبد الله بن شقيق عن عائشة قال سألتها عن صيام رسول الله صلى الله عليه وسلم قالت كان رسول الله صلى الله عليه وسلم يصوم حتى نقول قد صام ويفطر حتى نقول قد أفطر ولم يصم شهرا تاما منذ أتى المدينة إلا أن يكون رمضان 	" It was narrated that 'Abdullah bin Shaqiq said: """"I asked 'Aishah about the fasting of the Messenger of Allah. She said: 'The Messenger of Allah used to fast until we said that he is going to fast (continually), and he used not to fast until we said: he is not going to fast. And he did not fast for a whole month from the time he came to Al-Madinah, apart from Ramadan.""' ' (Sahih) "
