nasai45_1147210	 أخبرنا محمد بن يحيى قال حدثنا أبو معمر قال حدثنا عبد الوارث قال حدثنا قطن أبو الهيثم قال حدثنا أبو يزيد المدني عن عكرمة عن	حدثنا ابن عباس قال أول قسامة كانت في الجاهلية كان رجل من بني هاشم استأجر رجلا من قريش من فخذ أحدهم قال فانطلق معه في إبله فمر به رجل من بني هاشم قد انقطعت عروة جوالقه فقال أغثني بعقال أشد به عروة جوالقي لا تنفر الإبل فأعطاه عقالا يشد به عروة جوالقه فلما نزلوا وعقلت الإبل إلا بعيرا واحدا فقال الذي استأجره ما شأن هذا البعير لم يعقل من بين الإبل قال ليس له عقال قال فأين عقاله قال مر بي رجل من بني هاشم قد انقطعت عروة جوالقه فاستغاثني فقال أغثني بعقال أشد به عروة جوالقي لا تنفر الإبل فأعطيته عقالا فحذفه بعصا كان فيها أجله فمر به رجل من أهل اليمن فقال أتشهد الموسم قال ما أشهد وربما شهدت قال هل أنت مبلغ عني رسالة مرة من الدهر قال نعم قال إذا شهدت الموسم فناد يا آل قريش فإذا أجابوك فناد يا آل هاشم فإذا أجابوك فسل عن أبي طالب فأخبره أن فلانا قتلني في عقال ومات المستأجر فلما قدم الذي استأجره أتاه أبو طالب فقال ما فعل صاحبنا قال مرض فأحسنت القيام عليه ثم مات فنزلت فدفنته فقال كان ذا أهل ذاك منك فمكث حينا ثم إن الرجل اليماني الذي كان أوصى إليه أن يبلغ عنه وافى الموسم قال يا آل قريش قالوا هذه قريش قال يا آل بني هاشم قالوا هذه بنو هاشم قال أين أبو طالب قال هذا أبو طالب قال أمرني فلان أن أبلغك رسالة أن فلانا قتله في عقال فأتاه أبو طالب فقال اختر منا إحدى ثلاث إن شئت أن تؤدي مائة من الإبل فإنك قتلت صاحبنا خطأ وإن شئت يحلف خمسون من قومك أنك لم تقتله فإن أبيت قتلناك به فأتى قومه فذكر ذلك لهم فقالوا نحلف فأتته امرأة من بني هاشم كانت تحت رجل منهم قد ولدت له فقالت يا أبا طالب أحب أن تجيز ابني هذا برجل من الخمسين ولا تصبر يمينه ففعل فأتاه رجل منهم فقال يا أبا طالب أردت خمسين رجلا أن يحلفوا مكان مائة من الإبل يصيب كل رجل بعيران فهذان بعيران فاقبلهما عني ولا تصبر يميني حيث تصبر الأيمان فقبلهما وجاء ثمانية وأربعون رجلا حلفوا قال ابن عباس فوالذي نفسي بيده ما حال الحول ومن الثمانية والأربعين عين تطرف 	 أخبرنا محمد بن يحيى قال حدثنا أبو معمر قال حدثنا عبد الوارث قال حدثنا قطن أبو الهيثم قال حدثنا أبو يزيد المدني عن عكرمة عن ابن عباس قال أول قسامة كانت في الجاهلية كان رجل من بني هاشم استأجر رجلا من قريش من فخذ أحدهم قال فانطلق معه في إبله فمر به رجل من بني هاشم قد انقطعت عروة جوالقه فقال أغثني بعقال أشد به عروة جوالقي لا تنفر الإبل فأعطاه عقالا يشد به عروة جوالقه فلما نزلوا وعقلت الإبل إلا بعيرا واحدا فقال الذي استأجره ما شأن هذا البعير لم يعقل من بين الإبل قال ليس له عقال قال فأين عقاله قال مر بي رجل من بني هاشم قد انقطعت عروة جوالقه فاستغاثني فقال أغثني بعقال أشد به عروة جوالقي لا تنفر الإبل فأعطيته عقالا فحذفه بعصا كان فيها أجله فمر به رجل من أهل اليمن فقال أتشهد الموسم قال ما أشهد وربما شهدت قال هل أنت مبلغ عني رسالة مرة من الدهر قال نعم قال إذا شهدت الموسم فناد يا آل قريش فإذا أجابوك فناد يا آل هاشم فإذا أجابوك فسل عن أبي طالب فأخبره أن فلانا قتلني في عقال ومات المستأجر فلما قدم الذي استأجره أتاه أبو طالب فقال ما فعل صاحبنا قال مرض فأحسنت القيام عليه ثم مات فنزلت فدفنته فقال كان ذا أهل ذاك منك فمكث حينا ثم إن الرجل اليماني الذي كان أوصى إليه أن يبلغ عنه وافى الموسم قال يا آل قريش قالوا هذه قريش قال يا آل بني هاشم قالوا هذه بنو هاشم قال أين أبو طالب قال هذا أبو طالب قال أمرني فلان أن أبلغك رسالة أن فلانا قتله في عقال فأتاه أبو طالب فقال اختر منا إحدى ثلاث إن شئت أن تؤدي مائة من الإبل فإنك قتلت صاحبنا خطأ وإن شئت يحلف خمسون من قومك أنك لم تقتله فإن أبيت قتلناك به فأتى قومه فذكر ذلك لهم فقالوا نحلف فأتته امرأة من بني هاشم كانت تحت رجل منهم قد ولدت له فقالت يا أبا طالب أحب أن تجيز ابني هذا برجل من الخمسين ولا تصبر يمينه ففعل فأتاه رجل منهم فقال يا أبا طالب أردت خمسين رجلا أن يحلفوا مكان مائة من الإبل يصيب كل رجل بعيران فهذان بعيران فاقبلهما عني ولا تصبر يميني حيث تصبر الأيمان فقبلهما وجاء ثمانية وأربعون رجلا حلفوا قال ابن عباس فوالذي نفسي بيده ما حال الحول ومن الثمانية والأربعين عين تطرف 	" It was narrated that Ibn 'Abbas said: ""The first instance of Qasamah during the Jahiliyyah involved a man from Banu Hashim who was employed by a man from Quraish, from another branch of the tribe. He went out with him, driving his camels and another man from Banu Hashim passed by them. The leather rope of that man's bag broke, so he said (to the hired worker): 'Help me by giving me a rope with which to tie the handle of my bag, lest the camels run away from me. 'So he gave him a rope and he tied his gab with it. When they halted, all the camels' legs were hobbled except one camel. The one who had hired him said: 'Why is his camel, out of all of them, not hobbled? He said: 'There is no rope for it. He said: 'Where is its rope? He said: A man from Banu Hashim passed by and the leather rope of his bag had broken, and he asked me to help him; he said: ""Help me by giving me a rope with which to tie the handle of my bag lest the camels run away from me, so I gave him a rope . "" He struck him with a stick, which led to his death.Then a man from Yemen passed by him (the man from Banu Hashim, (the man from Banu Hashim, just before he died) and he (the Hashimi man) said: 'Are you going to attend the Pilgrimage? He said: 'I do not think I will attend it, but perhaps I will attend it.' He said: 'Will you convey a message from me once in your lifetime? He said: 'Yes. 'He said: 'If you attend the pilgrimage, then call out, O family of Quraish! If they respond, then call out, O family of Hashim! If they respond, then ask for Abu Talib, and tell him that so and so killed me for a rope.' Then the hired worker died. When the one who had hired him cam, Abu Talib went to him and said: 'What happened to our companion? He said: 'He fell sick and I took good care of him, but he died, so I stopped and buried him.' He said: 'He deserved that from you. 'Some time passed, then the Yemeni man who had been asked to convey the message arrived at the time of the pilgrimage. He said: 'O family of Quraish! And they said: 'Here is Quraish.' He said: 'O family of Banu Hashim! They said: 'Here is Banu Hashim.' He said"" 'Where is Abu Talib? He said: 'Here is Abu Talib.' He said: 'so and so asked me to convey a message to you, that so and so killed him for a camel's rope.' Abu Talib went to him and said"" 'Choose one of three alternatives that we are offering you. If you wish, you may give us one hundred camels, because you killed our companion by mistake: or if you wish, fifty of your men may swear an oath that you did not kill him; or if you wish, we will kill you in retaliation. 'He went to his people and told them about that, and they said: 'We will swear the oath.' Then a woman from Banu Hashim, who was married to one of their men and had born him a child, came to Abu Talib and said:' O Abu Talib, I wish that my son, who is one of these fifty men, should be excused from having to take the oath., So the excused him. Then one of the men came to him and said: 'O Abu Talib, you want fifty men to take the oath in lieu of one hundred camels, which means that each man may give two camels instead, so here are two camels; take them from me, and do not make me take the oath.' So he accepted them, and did not make him take the oath. Then forty-eight men came and took the oath."" Ibn 'Abbas said: ""By the One in Whose hand is my soul, by the time a year has passed, none of those forty-eight men remained alive."" (Sahih) "
nasai45_1147220	 أخبرنا أحمد بن عمرو بن السرح ويونس بن	أخبرنا عبد الأعلى قال أنبأنا ابن وهب قال أخبرني يونس عن ابن شهاب قال أحمد بن عمرو قال أخبرني أبو سلمة وسليمان بن يسار عن رجل من أصحاب رسول الله صلى الله عليه وسلم من الأنصار أن رسول الله صلى الله عليه وسلم أقر القسامة على ما كانت عليه في الجاهلية 	 أخبرنا أحمد بن عمرو بن السرح ويونس بن عبد الأعلى قال أنبأنا ابن وهب قال أخبرني يونس عن ابن شهاب قال أحمد بن عمرو قال أخبرني أبو سلمة وسليمان بن يسار عن رجل من أصحاب رسول الله صلى الله عليه وسلم من الأنصار أن رسول الله صلى الله عليه وسلم أقر القسامة على ما كانت عليه في الجاهلية 	 Abu Salamah and Sulaiman bin Yasar narrated from one of the Companions of the Messenger of Allah, one of the Ansar, that: the Messenger or Allah approved of Qasamah as it had been during the Jahiliyyah. (Sahih) 
nasai45_1147230	 أخبرنا محمد بن هاشم قال حدثنا الوليد قال حدثنا الأوزاعي عن ابن شهاب عن أبي سلمة وسليمان بن	حدثنا يسار عن أناس من أصحاب رسول الله صلى الله عليه وسلم أن القسامة كانت في الجاهلية فأقرها رسول الله صلى الله عليه وسلم على ما كانت عليه في الجاهلية وقضى بها بين أناس من الأنصار في قتيل ادعوه على يهود خيبر خالفهما معمر 	 أخبرنا محمد بن هاشم قال حدثنا الوليد قال حدثنا الأوزاعي عن ابن شهاب عن أبي سلمة وسليمان بن يسار عن أناس من أصحاب رسول الله صلى الله عليه وسلم أن القسامة كانت في الجاهلية فأقرها رسول الله صلى الله عليه وسلم على ما كانت عليه في الجاهلية وقضى بها بين أناس من الأنصار في قتيل ادعوه على يهود خيبر خالفهما معمر 	 it was narrated from Abu Salamah and Sulaiman bin Yasar, from some of the Companions of the Messenger of Allah, that: Qasamah existed during the Jahiliyyah and the Messenger of Allah approved of it as it had been during the Jahiliyyah, and he ruled accordingly among some of the Ansar concerning a victim whom they claimed the Jews of Khaibar had Killed. (Sahih)Ma'mar contradicted the two of them. 
nasai45_1147240	 أخبرنا محمد بن رافع قال حدثنا عبد الرزاق قال أنبأنا معمر عن الزهري عن	حدثنا ابن المسيب قال كانت القسامة في الجاهلية ثم أقرها رسول الله صلى الله عليه وسلم في الأنصاري الذي وجد مقتولا في جب اليهود فقالت الأنصار اليهود قتلوا صاحبنا 	 أخبرنا محمد بن رافع قال حدثنا عبد الرزاق قال أنبأنا معمر عن الزهري عن ابن المسيب قال كانت القسامة في الجاهلية ثم أقرها رسول الله صلى الله عليه وسلم في الأنصاري الذي وجد مقتولا في جب اليهود فقالت الأنصار اليهود قتلوا صاحبنا 	" It was narrated that Ibn Al-Musayyab said: ""Qasamah existed during the Jahiliyyah, then the Messenger of Allah confirmed it in the case of an Ansari who was found slain in the dry well of the jews, and Ansar said: ""The Jews kill our companion.""' (Sahih) "
nasai45_1147250	 أخبرنا أحمد بن عمرو بن	أخبرنا السرح قال أنبأنا ابن وهب قال أخبرني مالك بن أنس عن أبي ليلى بن عبد الله بن عبد الرحمن الأنصاري أن سهل بن أبي حثمة أخبره أن عبد الله بن سهل ومحيصة خرجا إلى خيبر من جهد أصابهما فأتي محيصة فأخبر أن عبد الله بن سهل قد قتل وطرح في فقير أو عين فأتى يهود فقال أنتم والله قتلتموه فقالوا والله ما قتلناه ثم أقبل حتى قدم على رسول الله صلى الله عليه وسلم فذكر ذلك له ثم أقبل هو وحويصة وهو أخوه أكبر منه وعبد الرحمن بن سهل فذهب محيصة ليتكلم وهو الذي كان بخيبر فقال رسول الله صلى الله عليه وسلم كبر كبر وتكلم حويصة ثم تكلم محيصة فقال رسول الله صلى الله عليه وسلم إما أن يدوا صاحبكم وإما أن يؤذنوا بحرب فكتب النبي صلى الله عليه وسلم في ذلك فكتبوا إنا والله ما قتلناه فقال رسول الله صلى الله عليه وسلم لحويصة ومحيصة وعبد الرحمن تحلفون وتستحقون دم صاحبكم قالوا لا قال فتحلف لكم يهود قالوا ليسوا مسلمين فوداه رسول الله صلى الله عليه وسلم من عنده فبعث إليهم بمائة ناقة حتى أدخلت عليهم الدار قال سهل لقد ركضتني منها ناقة حمراء 	 أخبرنا أحمد بن عمرو بن السرح قال أنبأنا ابن وهب قال أخبرني مالك بن أنس عن أبي ليلى بن عبد الله بن عبد الرحمن الأنصاري أن سهل بن أبي حثمة أخبره أن عبد الله بن سهل ومحيصة خرجا إلى خيبر من جهد أصابهما فأتي محيصة فأخبر أن عبد الله بن سهل قد قتل وطرح في فقير أو عين فأتى يهود فقال أنتم والله قتلتموه فقالوا والله ما قتلناه ثم أقبل حتى قدم على رسول الله صلى الله عليه وسلم فذكر ذلك له ثم أقبل هو وحويصة وهو أخوه أكبر منه وعبد الرحمن بن سهل فذهب محيصة ليتكلم وهو الذي كان بخيبر فقال رسول الله صلى الله عليه وسلم كبر كبر وتكلم حويصة ثم تكلم محيصة فقال رسول الله صلى الله عليه وسلم إما أن يدوا صاحبكم وإما أن يؤذنوا بحرب فكتب النبي صلى الله عليه وسلم في ذلك فكتبوا إنا والله ما قتلناه فقال رسول الله صلى الله عليه وسلم لحويصة ومحيصة وعبد الرحمن تحلفون وتستحقون دم صاحبكم قالوا لا قال فتحلف لكم يهود قالوا ليسوا مسلمين فوداه رسول الله صلى الله عليه وسلم من عنده فبعث إليهم بمائة ناقة حتى أدخلت عليهم الدار قال سهل لقد ركضتني منها ناقة حمراء 	" It was narrated from Sahl bin Abi Hathmah that: 'Abdullah bin Sahl and Muhayysah set out for Khaibar because of some problem that had arisen. Someone came to Muhayysah and he told him that 'Abdullah bin Sahl had been Killed and thrown into a pit, or a well. He came to the Jews and said: ""By Allah, you killed him. "" They said: ""By Allah, we did not kill him.""Then he went back to the Messenger of Allah and told him about that. Then he and Huwayysah - his brother who was older than him - and 'Abdur-Rahman bin Sahl, came (to the Prophet). Muhayysah, who was the one who had been at Khaibar, began to speak, but the messenger of Allah said: ""Let the elder speak first,"" So Huwayysah elder speaks first."" So Huwayysah spoke, then Muhayysah spoke. The Messenger of Allah said: ""Either (the Jews) will pay the Diyah for your comanion, or war will be declared on them."" The Messenger of Allah sent a letter to that effect (to the Jews) and they wrote back saying: ""By Allah, we did not kill him."" The Messenger of Allah said to Huwayysah. Muhayysah and 'Abdur-Rahman: ""Will you swear an oath establishing your claim to the blood money of your companion?"" They said: ""No."" He said: ""Should the jews swear an oath for you? They said: ""They are not Muslims."" So the Messenger of Allah paid (the Diyah) himself, and he sent one hundred she-camels to their abodes. Sahl said: ""A red she-camel from among them kicked me."" (Sahih) "
nasai45_1147260	 أخبرنا محمد بن سلمة قال أنبأنا ابن القاسم قال حدثني مالك عن أبي ليلى بن عبد الله بن	حدثني عبد الرحمن بن سهل عن سهل بن أبي حثمة أنه أخبره ورجال من كبراء قومه أن عبد الله بن سهل ومحيصة خرجا إلى خيبر من جهد أصابهم فأتي محيصة فأخبر أن عبد الله بن سهل قد قتل وطرح في فقير أو عين فأتى يهود وقال أنتم والله قتلتموه قالوا والله ما قتلناه فأقبل حتى قدم على قومه فذكر لهم ثم أقبل هو وأخوه حويصة وهو أكبر منه وعبد الرحمن بن سهل فذهب محيصة ليتكلم وهو الذي كان بخيبر فقال رسول الله صلى الله عليه وسلم لمحيصة كبر كبر يريد السن فتكلم حويصة ثم تكلم محيصة فقال رسول الله صلى الله عليه وسلم إما أن يدوا صاحبكم وإما أن يؤذنوا بحرب فكتب إليهم رسول الله صلى الله عليه وسلم في ذلك فكتبوا إنا والله ما قتلناه فقال رسول الله صلى الله عليه وسلم لحويصة ومحيصة وعبد الرحمن أتحلفون وتستحقون دم صاحبكم قالوا لا قال فتحلف لكم يهود قالوا ليسوا بمسلمين فوداه رسول الله صلى الله عليه وسلم من عنده فبعث إليهم بمائة ناقة حتى أدخلت عليهم الدار قال سهل لقد ركضتني منها ناقة حمراء 	 أخبرنا محمد بن سلمة قال أنبأنا ابن القاسم قال حدثني مالك عن أبي ليلى بن عبد الله بن عبد الرحمن بن سهل عن سهل بن أبي حثمة أنه أخبره ورجال من كبراء قومه أن عبد الله بن سهل ومحيصة خرجا إلى خيبر من جهد أصابهم فأتي محيصة فأخبر أن عبد الله بن سهل قد قتل وطرح في فقير أو عين فأتى يهود وقال أنتم والله قتلتموه قالوا والله ما قتلناه فأقبل حتى قدم على قومه فذكر لهم ثم أقبل هو وأخوه حويصة وهو أكبر منه وعبد الرحمن بن سهل فذهب محيصة ليتكلم وهو الذي كان بخيبر فقال رسول الله صلى الله عليه وسلم لمحيصة كبر كبر يريد السن فتكلم حويصة ثم تكلم محيصة فقال رسول الله صلى الله عليه وسلم إما أن يدوا صاحبكم وإما أن يؤذنوا بحرب فكتب إليهم رسول الله صلى الله عليه وسلم في ذلك فكتبوا إنا والله ما قتلناه فقال رسول الله صلى الله عليه وسلم لحويصة ومحيصة وعبد الرحمن أتحلفون وتستحقون دم صاحبكم قالوا لا قال فتحلف لكم يهود قالوا ليسوا بمسلمين فوداه رسول الله صلى الله عليه وسلم من عنده فبعث إليهم بمائة ناقة حتى أدخلت عليهم الدار قال سهل لقد ركضتني منها ناقة حمراء 	" It was narrated from Abu Laila bin 'Abdullah bin 'Abdur-Rahman bin Sahl, from Sahl bin Abi Hathmah, that: he informed him, ans some men among the elders of his people, that ""Abdullah bin Sahl and Muhayysah set out for Khaibar because of some problem that had arisen. Someone came to Muhayysah, and he told him that 'Abdullah bin Sahl had been killed and thrown into a pit or well. He came to the Jews and said: ""By Allah, you killed him."" They said: ""By Allah, we did not kill him."" Then he went baack to his people and told them about that. Then he and his brother Huwayysah, who was older than him, and 'Abdur-Rahman bin Sahl, came (to the prophet). Muhayysah, who was the one who had been at Khaibar, bnegan to speak, but the Messenger of Allah said: ""Let the elder speak first."" So Huwayysah spoke, then Muhayysah spoke. The Messenger of Allah said: ""Either (the Jews) will pay the Diyah for your companion, or war will be declared on them."" The Messenger of Allah sent a letter to that effect (to the Jews) and they wrote back saying: ""By Allah, we did not kill him."" The Messenger of Allah and 'Abdur-Rahman: ""Will you swear an oath establishing your claim to the blood money of your companion?"" They said: ""No."" He said: ""Should the Jews swear an oath for you?"" They said: ""They are not Muslims."" So the Messenger of Allah paid it himself, and he sent one hundred she-camels to their abodes. Sahl said: ""A red she-camel from among them kicked me."" (Sahih) "
