nasai16_1114990	 أخبرنا عمران بن موسى قال حدثنا عبد الوارث قال حدثنا يونس عن الحسن عن	حدثنا أبي بكرة قال كنا عند رسول الله صلى الله عليه وسلم فانكسفت الشمس فخرج رسول الله صلى الله عليه وسلم يجر رداءه حتى انتهى إلى المسجد وثاب إليه الناس فصلى بنا ركعتين فلما انكشفت الشمس قال إن الشمس والقمر آيتان من آيات الله يخوف الله عز وجل بهما عباده وإنهما لا يخسفان لموت أحد ولا لحياته فإذا رأيتم ذلك فصلوا حتى يكشف ما بكم وذلك أن ابنا له مات يقال له إبراهيم فقال له ناس في ذلك 	 أخبرنا عمران بن موسى قال حدثنا عبد الوارث قال حدثنا يونس عن الحسن عن أبي بكرة قال كنا عند رسول الله صلى الله عليه وسلم فانكسفت الشمس فخرج رسول الله صلى الله عليه وسلم يجر رداءه حتى انتهى إلى المسجد وثاب إليه الناس فصلى بنا ركعتين فلما انكشفت الشمس قال إن الشمس والقمر آيتان من آيات الله يخوف الله عز وجل بهما عباده وإنهما لا يخسفان لموت أحد ولا لحياته فإذا رأيتم ذلك فصلوا حتى يكشف ما بكم وذلك أن ابنا له مات يقال له إبراهيم فقال له ناس في ذلك 	" It was narrated that Abu Bakrah said: ""We were with the Messenger of Allah (SL3M) when the sun became eclipsed. The Messenger of Allah (SL3M) went out dragging his garment, until he came to the masjid, and the people gathered around him. He led us in praying two rak'ahs and when (the eclipse) ended he said: 'The sun and the moon are two of the signs of Allah (SWT) by means of which Allah (SWT), the Mighty and Sublime, strikes fear into His slaves. They do not become eclipsed for the death or birth of anyone. If you see that, then pray until Allah (SWT)r relieves you of fear.' That was because his son named Ibrahim had died, and the people suggested to him that (the eclipse) happened because of that."" (Sahih) "
nasai16_1115000	 أخبرنا إسماعيل بن مسعود قال حدثنا خالد عن أشعث عن الحسن عن	عن أبي بكرة أن رسول الله صلى الله عليه وسلم صلى ركعتين مثل صلاتكم هذه وذكر كسوف الشمس 	 أخبرنا إسماعيل بن مسعود قال حدثنا خالد عن أشعث عن الحسن عن أبي بكرة أن رسول الله صلى الله عليه وسلم صلى ركعتين مثل صلاتكم هذه وذكر كسوف الشمس 	 It was narrated from Abu Bakrah that: The Messenger of Allah (SL3M) prayed two rak'ahs like this prayer of yours, and he mentioned the eclipse of the sun. (Sahih) 
nasai16_1115010	 أخبرنا محمد بن سلمة قال حدثنا ابن القاسم عن مالك قال حدثني زيد بن أسلم عن عطاء بن	عن يسار عن عبد الله بن عباس قال خسفت الشمس فصلى رسول الله صلى الله عليه وسلم والناس معه فقام قياما طويلا قرأ نحوا من سورة البقرة قال ثم ركع ركوعا طويلا ثم رفع فقام قياما طويلا وهو دون القيام الأول ثم ركع ركوعا طويلا وهو دون الركوع الأول ثم سجد ثم قام قياما طويلا وهو دون القيام الأول ثم ركع ركوعا طويلا وهو دون الركوع الأول ثم رفع فقام قياما طويلا وهو دون القيام الأول ثم ركع ركوعا طويلا وهو دون الركوع الأول ثم سجد ثم انصرف وقد تجلت الشمس فقال إن الشمس والقمر آيتان من آيات الله لا يخسفان لموت أحد ولا لحياته فإذا رأيتم ذلك فاذكروا الله عز وجل قالوا يا رسول الله رأيناك تناولت شيئا في مقامك هذا ثم رأيناك تكعكعت قال إني رأيت الجنة أو أريت الجنة فتناولت منها عنقودا ولو أخذته لأكلتم منه ما بقيت الدنيا ورأيت النار فلم أر كاليوم منظرا قط ورأيت أكثر أهلها النساء قالوا لم يا رسول الله قال بكفرهن قيل يكفرن بالله قال يكفرن العشير ويكفرن الإحسان لو أحسنت إلى إحداهن الدهر ثم رأت منك شيئا قالت ما رأيت منك خيرا قط 	 أخبرنا محمد بن سلمة قال حدثنا ابن القاسم عن مالك قال حدثني زيد بن أسلم عن عطاء بن يسار عن عبد الله بن عباس قال خسفت الشمس فصلى رسول الله صلى الله عليه وسلم والناس معه فقام قياما طويلا قرأ نحوا من سورة البقرة قال ثم ركع ركوعا طويلا ثم رفع فقام قياما طويلا وهو دون القيام الأول ثم ركع ركوعا طويلا وهو دون الركوع الأول ثم سجد ثم قام قياما طويلا وهو دون القيام الأول ثم ركع ركوعا طويلا وهو دون الركوع الأول ثم رفع فقام قياما طويلا وهو دون القيام الأول ثم ركع ركوعا طويلا وهو دون الركوع الأول ثم سجد ثم انصرف وقد تجلت الشمس فقال إن الشمس والقمر آيتان من آيات الله لا يخسفان لموت أحد ولا لحياته فإذا رأيتم ذلك فاذكروا الله عز وجل قالوا يا رسول الله رأيناك تناولت شيئا في مقامك هذا ثم رأيناك تكعكعت قال إني رأيت الجنة أو أريت الجنة فتناولت منها عنقودا ولو أخذته لأكلتم منه ما بقيت الدنيا ورأيت النار فلم أر كاليوم منظرا قط ورأيت أكثر أهلها النساء قالوا لم يا رسول الله قال بكفرهن قيل يكفرن بالله قال يكفرن العشير ويكفرن الإحسان لو أحسنت إلى إحداهن الدهر ثم رأت منك شيئا قالت ما رأيت منك خيرا قط 	" It was narrated that 'Abdullah bin Abbas said: ""There was an eclipse of the sun and the Messenger of Allah (SL3M) prayed and the people with him. He stood for long time reciting something like Surah Al-Baqarah, then he raised (his head) and stood for a long time, then he raised (his head) and stood for a long time which was shorter than the first time. Then he bowed for a long time, which was shorter than the first time, then he prostrated. Then he got up and stood for a long time, which was shorter than the first time, then he bowed for a long time, which was shorter than the first time, then he raised (his head) and stood for a long time, which was shorter than the first time. Then he bowed for a long time, which was shorter than the first time, then he prostrated, then he finished (his prayer) and the sun had been clear. He said: 'The sun and the moon are two of the signs of Allah (SWT) and they do not become eclipsed for the death or birth of anyone. If you see that then remember Allah (SWT) the Mighty and Sublime.' They said: 'O Messenger of Allah (SL3M), we saw you stretching out your hand when you were standing, then we saw you moving backward. He said: 'I saw Paradise-or it was shown to me- and I reached out to a take a bunch of its fruits. If I ha taken it you would have eaten from it for as long as this world lasts. And I saw Hell and I have never seen anything like it, and I saw that most of its inhabitants are women.' They said: ""Why, O Messenger of Allah (SL3M)? He said: 'Because of their ingratitude.' It was said: 'Are they ungrateful to Allah?' He said: 'They are ungrateful to their husbands and they are ungrateful for kind treatment. If you are kind to one of them for a lifetime, then she sees (one) bad thing from you, she will say: I have never seen anything good from you.'"" (Sahih) "
nasai16_1115020	 أخبرنا إسحاق بن إبراهيم قال أنبأنا الوليد قال حدثنا عبد الرحمن بن نمر أنه سمع الزهري يحدث عن عروة عن عائشة عن	عن رسول الله صلى الله عليه وسلم أنه صلى أربع ركعات في أربع سجدات وجهر فيها بالقراءة كلما رفع رأسه قال سمع الله لمن حمده ربنا ولك الحمد 	 أخبرنا إسحاق بن إبراهيم قال أنبأنا الوليد قال حدثنا عبد الرحمن بن نمر أنه سمع الزهري يحدث عن عروة عن عائشة عن رسول الله صلى الله عليه وسلم أنه صلى أربع ركعات في أربع سجدات وجهر فيها بالقراءة كلما رفع رأسه قال سمع الله لمن حمده ربنا ولك الحمد 	" It was narrated from Aishah that: The Messenger of Allah (SL3M) prayed, bowing four times, and he recited loudly, and every time he raised his head he said: ""Sami Allahu liman hamidah. Rabbana wa lakal-hamd (Allah hears those who praise Him, Our Lord to You be praise.)."" "
nasai16_1115030	 أخبرنا عمرو بن منصور قال حدثنا أبو نعيم قال حدثنا سفيان عن الأسود بن قيس عن ابن عباد رجل من بني عبد القيس عن	عن سمرة أن النبي صلى الله عليه وسلم صلى بهم في كسوف الشمس لا نسمع له صوتا 	 أخبرنا عمرو بن منصور قال حدثنا أبو نعيم قال حدثنا سفيان عن الأسود بن قيس عن ابن عباد رجل من بني عبد القيس عن سمرة أن النبي صلى الله عليه وسلم صلى بهم في كسوف الشمس لا نسمع له صوتا 	 It was narrated from Samurah that: The Prophet (SL3M) led them in prayer during an eclipse of the sun, and we did not hear him say anything. (Hasan) 
nasai16_1115040	 أخبرنا عبد الله بن محمد بن عبد الرحمن بن	أخبرنا المسور الزهري قال حدثنا غندر عن شعبة عن عطاء بن السائب عن أبيه عن عبد الله بن عمرو قال كسفت الشمس على عهد رسول الله صلى الله عليه وسلم فصلى رسول الله صلى الله عليه وسلم فأطال القيام ثم ركع فأطال الركوع ثم رفع فأطال قال شعبة وأحسبه قال في السجود نحو ذلك وجعل يبكي في سجوده وينفخ ويقول رب لم تعدني هذا وأنا أستغفرك لم تعدني هذا وأنا فيهم فلما صلى قال عرضت على الجنة حتى لو مددت يدي تناولت من قطوفها وعرضت على النار فجعلت أنفخ خشية أن يغشاكم حرها ورأيت فيها سارق بدنتى رسول الله صلى الله عليه وسلم ورأيت فيها أخا بني دعدع سارق الحجيج فإذا فطن له قال هذا عمل المحجن ورأيت فيها امرأة طويلة سوداء تعذب في هرة ربطتها فلم تطعمها ولم تسقها ولم تدعها تأكل من خشاش الأرض حتى ماتت وإن الشمس والقمر لا ينكسفان لموت أحد ولا لحياته ولكنهما آيتان من آيات الله فإذا انكسفت إحداهما أو قال فعل أحدهما شيئا من ذلك فاسعوا إلى ذكر الله عز وجل 	 أخبرنا عبد الله بن محمد بن عبد الرحمن بن المسور الزهري قال حدثنا غندر عن شعبة عن عطاء بن السائب عن أبيه عن عبد الله بن عمرو قال كسفت الشمس على عهد رسول الله صلى الله عليه وسلم فصلى رسول الله صلى الله عليه وسلم فأطال القيام ثم ركع فأطال الركوع ثم رفع فأطال قال شعبة وأحسبه قال في السجود نحو ذلك وجعل يبكي في سجوده وينفخ ويقول رب لم تعدني هذا وأنا أستغفرك لم تعدني هذا وأنا فيهم فلما صلى قال عرضت على الجنة حتى لو مددت يدي تناولت من قطوفها وعرضت على النار فجعلت أنفخ خشية أن يغشاكم حرها ورأيت فيها سارق بدنتى رسول الله صلى الله عليه وسلم ورأيت فيها أخا بني دعدع سارق الحجيج فإذا فطن له قال هذا عمل المحجن ورأيت فيها امرأة طويلة سوداء تعذب في هرة ربطتها فلم تطعمها ولم تسقها ولم تدعها تأكل من خشاش الأرض حتى ماتت وإن الشمس والقمر لا ينكسفان لموت أحد ولا لحياته ولكنهما آيتان من آيات الله فإذا انكسفت إحداهما أو قال فعل أحدهما شيئا من ذلك فاسعوا إلى ذكر الله عز وجل 	" It was narrated that Abdullah bin Amr said: ""The sun eclipsed during the time of the Messenger of Allah (SL3M). The Messenger of Allah (SL3M) prayed and stood for a long time, then he bowed for a long time, then he stood up and (remained standing) for a long time."" (One of the narrators) Shu'bh said: ""I think he said something similar concerning prostration.""- ""He started weeping and blowing during his prostration and said: 'Lord, You did not tell me that You would do that while I am asking You for forgiveness; You did not tell me that You would do that while I was still among them.' When he finished praying he said: ""Paradise was shown to me, and if I had stretched forth my hand I could have taken some of its fruits. And Hell was shown to me, so I started blowing for fear that its heat might overwhelm you. I saw therein the thief who stole the two camels of the Messenger of Allah (SL3M); and I saw therein the brother of Banu As-Du'du; the thief who stole from the pilgrims, and when he was caught he said: The crooked stick did it; and I saw therein a tall black woman who was being punished because of a cat she tied up and did not feed or give it water, and she did not let it eat of the vermin of the earth, until it died. Then sun and the moon do not become eclipsed for the death or birth of anyone, but they are two of the signs of Allah. If one of them becomes eclipsed'- or he said: 'if one of them does anything like that'- 'then hasten to remember Allah, the Mighty and Sublime.'"" (Sahih) "
nasai16_1115050	not identified	 أخبرني عمرو بن عثمان بن سعيد بن كثير عن الوليد عن عبد الرحمن بن نمر أنه سأل الزهري عن سنة صلاة الكسوف فقال أخبرني عروة بن الزبير عن عائشة قالت كسفت الشمس فأمر رسول الله صلى الله عليه وسلم رجلا فنادى أن الصلاة جامعة فاجتمع الناس فصلى بهم رسول الله صلى الله عليه وسلم فكبر ثم قرأ قراءة طويلة ثم كبر فركع ركوعا طويلا مثل قيامه أو أطول ثم رفع رأسه وقال سمع الله لمن حمده ثم قرأ قراءة طويلة هي أدنى من القراءة الأولى ثم كبر فركع ركوعا طويلا هو أدنى من الركوع الأول ثم رفع رأسه فقال سمع الله لمن حمده ثم كبر فسجد سجودا طويلا مثل ركوعه أو أطول ثم كبر فرفع رأسه ثم كبر فسجد ثم كبر فقام فقرأ قراءة طويلة هي أدنى من الأولى ثم كبر ثم ركع ركوعا طويلا هو أدنى من الركوع الأول ثم رفع رأسه فقال سمع الله لمن حمده ثم قرأ قراءة طويلة وهي أدنى من القراءة الأولى في القيام الثاني ثم كبر فركع ركوعا طويلا دون الركوع الأول ثم كبر فرفع رأسه فقال سمع الله لمن حمده ثم كبر فسجد أدنى من سجوده الأول ثم تشهد ثم سلم فقام فيهم فحمد الله وأثنى عليه ثم قال إن الشمس والقمر لا ينخسفان لموت أحد ولا لحياته ولكنهما آيتان من آيات الله فأيهما خسف به أو بأحدهما فافزعوا إلى الله عز وجل بذكر الصلاة 	 أخبرني عمرو بن عثمان بن سعيد بن كثير عن الوليد عن عبد الرحمن بن نمر أنه سأل الزهري عن سنة صلاة الكسوف فقال أخبرني عروة بن الزبير عن عائشة قالت كسفت الشمس فأمر رسول الله صلى الله عليه وسلم رجلا فنادى أن الصلاة جامعة فاجتمع الناس فصلى بهم رسول الله صلى الله عليه وسلم فكبر ثم قرأ قراءة طويلة ثم كبر فركع ركوعا طويلا مثل قيامه أو أطول ثم رفع رأسه وقال سمع الله لمن حمده ثم قرأ قراءة طويلة هي أدنى من القراءة الأولى ثم كبر فركع ركوعا طويلا هو أدنى من الركوع الأول ثم رفع رأسه فقال سمع الله لمن حمده ثم كبر فسجد سجودا طويلا مثل ركوعه أو أطول ثم كبر فرفع رأسه ثم كبر فسجد ثم كبر فقام فقرأ قراءة طويلة هي أدنى من الأولى ثم كبر ثم ركع ركوعا طويلا هو أدنى من الركوع الأول ثم رفع رأسه فقال سمع الله لمن حمده ثم قرأ قراءة طويلة وهي أدنى من القراءة الأولى في القيام الثاني ثم كبر فركع ركوعا طويلا دون الركوع الأول ثم كبر فرفع رأسه فقال سمع الله لمن حمده ثم كبر فسجد أدنى من سجوده الأول ثم تشهد ثم سلم فقام فيهم فحمد الله وأثنى عليه ثم قال إن الشمس والقمر لا ينخسفان لموت أحد ولا لحياته ولكنهما آيتان من آيات الله فأيهما خسف به أو بأحدهما فافزعوا إلى الله عز وجل بذكر الصلاة 	" It was narrated that Aishah said: ""There was an eclipse of the sun and the Messenger of Allah (SL3M) ordered a man to call out: As-salatu jami'ah (prayer is about to begin in congregation). The people gathered and the Messenger of Allah (SL3M) led them in prayer. He said the takbir, then he recited at length. Then he said the takbir and bowed for a long time, as long as he had recited or longer. Then he raised his head and said: Sami Allahu liman hamidah (Allah hears those who praise Him) Then he recited at length, but it was shorter than the first time, then he said the takbir and bowed for a long time, but it was shorter than the first time. Then he raised his head and said: 'Sami Allahu liman hamidah (Allah hears those who praise Him). Then he said the takbir and prostrated for a long time, as long as he had bowed or longer. Then he said the takbir and raised his head, then he said the takbir and prostrated. Then he said the takbir and stood up, and recited for a long time that was shorter than the first time. Then he said the takbir and bowed for a long time that was shorter than the first time. Then he raised his head and said: Sami' Allahu liman hamidah. (Allah hears those who praise Him). Then he recited for a long time that was shorter than the first recitation in the second standing. Then he said the takbir and bowed for a long time that was shorter than the first time. Then he raised his head and said: Sami Allahu liman hamidah (Allah hears those who praise Him). Then he said the takbir and prostrated for a long time that was shorter than the first time. Then he recited the tashahhud, then he said the taslim. Then he stood before them and praised and glorified Allah, then he said: 'The sun and the moon do not become eclipsed for the death or birth of anyone, but they are two of the signs of Allah (SWT). Whichever of them becomes eclipsed, turn to Allah (SWT), the Mighty and Sublime, and pray.'"" (Sahih) "
nasai16_1115060	not identified	 أخبرني إبراهيم بن يعقوب قال حدثنا موسى بن داود قال حدثنا نافع بن عمر عن ابن أبي مليكة عن أسماء بنت أبي بكر قالت صلى رسول الله صلى الله عليه وسلم في الكسوف فقام فأطال القيام ثم ركع فأطال الركوع ثم رفع فأطال القيام ثم ركع فأطال الركوع ثم رفع ثم سجد فأطال السجود ثم رفع ثم سجد فأطال السجود ثم قام فأطال القيام ثم ركع فأطال الركوع ثم رفع فأطال القيام ثم ركع فأطال الركوع ثم رفع ثم سجد فأطال السجود ثم رفع ثم سجد فأطال السجود ثم رفع ثم انصرف 	 أخبرني إبراهيم بن يعقوب قال حدثنا موسى بن داود قال حدثنا نافع بن عمر عن ابن أبي مليكة عن أسماء بنت أبي بكر قالت صلى رسول الله صلى الله عليه وسلم في الكسوف فقام فأطال القيام ثم ركع فأطال الركوع ثم رفع فأطال القيام ثم ركع فأطال الركوع ثم رفع ثم سجد فأطال السجود ثم رفع ثم سجد فأطال السجود ثم قام فأطال القيام ثم ركع فأطال الركوع ثم رفع فأطال القيام ثم ركع فأطال الركوع ثم رفع ثم سجد فأطال السجود ثم رفع ثم سجد فأطال السجود ثم رفع ثم انصرف 	" It was narrated that Asma' bint Abi Bakr said: The Messenger of Allah (SL3M) prayed during an eclipse. He stood for a long time, then he bowed for a long time, then he stood up and (remained standing) for a long time, then he bowed for a long time, then he stood up, then he prostrated for a long time, then he stood up and (remained standing) for a long time, then he bowed for a long time, then he stood up, then he prostrated for a long time, then he sat up, then he prostrated for a long time, then he sat up and then he finished."" (Sahih) "
nasai16_1115070	 أخبرنا محمد بن سلمة عن ابن وهب عن عمرو بن	أخبرنا الحارث عن يحيى بن سعيد أن عمرة حدثته أن عائشة قالت إن النبي صلى الله عليه وسلم خرج مخرجا فخسف بالشمس فخرجنا إلى الحجرة فاجتمع إلينا نساء وأقبل إلينا رسول الله صلى الله عليه وسلم وذلك ضحوة فقام قياما طويلا ثم ركع ركوعا طويلا ثم رفع رأسه فقام دون القيام الأول ثم ركع دون ركوعه ثم سجد ثم قام الثانية فصنع مثل ذلك إلا أن قيامه وركوعه دون الركعة الأولى ثم سجد وتجلت الشمس فلما انصرف قعد على المنبر فقال فيما يقول إن الناس يفتنون في قبورهم كفتنة الدجال مختصر 	 أخبرنا محمد بن سلمة عن ابن وهب عن عمرو بن الحارث عن يحيى بن سعيد أن عمرة حدثته أن عائشة قالت إن النبي صلى الله عليه وسلم خرج مخرجا فخسف بالشمس فخرجنا إلى الحجرة فاجتمع إلينا نساء وأقبل إلينا رسول الله صلى الله عليه وسلم وذلك ضحوة فقام قياما طويلا ثم ركع ركوعا طويلا ثم رفع رأسه فقام دون القيام الأول ثم ركع دون ركوعه ثم سجد ثم قام الثانية فصنع مثل ذلك إلا أن قيامه وركوعه دون الركعة الأولى ثم سجد وتجلت الشمس فلما انصرف قعد على المنبر فقال فيما يقول إن الناس يفتنون في قبورهم كفتنة الدجال مختصر 	" 'Aishah said: ""The Prophet (SL3M) went out and the sun became eclipsed. We went out to the apartment and some women gathered around us. The Messenger of Allah (SL3M) turned to us, and that was at the time of the forenoon. He stood for a long time, then he bowed for a long time, then he raised his head and stood for a shorter time than the first, then he bowed for a shorter time than the first, then he prostrated. Then he stood up again and did the same, except that he stood and bowed for a shorter time than in the first rak'ah. Then he prostrated and the eclipse ended. When he had finished he sat on the minbar and among the things he said was : 'The people will be tried in their graves like the trial of the Dajjal.'"" (Sahih) "
