nasai34_1137610	 أخبرنا محمد بن عبد الله بن عبد الحكم عن ابن أبي فديك قال حدثنا ابن أبي ذئب عن ابن شهاب عن أبي سلمة عن	عن جابر أن رسول الله صلى الله عليه وسلم قضى فيمن أعمر عمرى له ولعقبه فهي له بتلة لا يجوز للمعطي منها شرط ولا ثنيا قال أبو سلمة لأنه أعطى عطاء وقعت فيه المواريث فقطعت المواريث شرطه 	 أخبرنا محمد بن عبد الله بن عبد الحكم عن ابن أبي فديك قال حدثنا ابن أبي ذئب عن ابن شهاب عن أبي سلمة عن جابر أن رسول الله صلى الله عليه وسلم قضى فيمن أعمر عمرى له ولعقبه فهي له بتلة لا يجوز للمعطي منها شرط ولا ثنيا قال أبو سلمة لأنه أعطى عطاء وقعت فيه المواريث فقطعت المواريث شرطه 	" Ibn Abi Dhi'b narrated from Ibn Shihab, from Abu Salamah, from Jabir, that the Messenger of Allah ruled -concerning a person who has been given a lifelong gift ('Umra)- that it belongs to him and to his descendants: ""It is undoubtedly his, and it is not permissible for the giver to stipulate any conditions or exceptions."" Abu Salamah said: ""Because he gave it as a gift and thus, it is subject to the same ruling as the estate, and the condition (that it will revert to the giver on the death of recipient) has become invalid."" "
nasai34_1137620	 أخبرنا أبو داود سليمان بن سيف قال حدثنا يعقوب قال حدثنا أبي عن صالح عن ابن شهاب أن أبا سلمة أخبره عن	عن جابر أن رسول الله صلى الله عليه وسلم قال أيما رجل أعمر رجلا عمرى له ولعقبه قال قد أعطيتكها وعقبك ما بقي منكم أحد فإنها لمن أعطيها وإنها لا ترجع إلى صاحبها من أجل أنه أعطاها عطاء وقعت فيه المواريث 	 أخبرنا أبو داود سليمان بن سيف قال حدثنا يعقوب قال حدثنا أبي عن صالح عن ابن شهاب أن أبا سلمة أخبره عن جابر أن رسول الله صلى الله عليه وسلم قال أيما رجل أعمر رجلا عمرى له ولعقبه قال قد أعطيتكها وعقبك ما بقي منكم أحد فإنها لمن أعطيها وإنها لا ترجع إلى صاحبها من أجل أنه أعطاها عطاء وقعت فيه المواريث 	" Salih narrated from Ibn Shihab, that Abu Salamah informed him from Jabir, that the Messenger of Allah said: ""Any man who gives a lifelong gift to another man, it belongs to him (the recipient) and his descendants. He said: 'I have given it to you and to your descendants so long as any of you are still alive.' So it belongs to the one to whom it was given, and it cannot revert to the first owner, since he has given it as a gift, and as such, it becomes subject to the same ruling as the estate."" "
nasai34_1137630	 أخبرنا محمد بن عبد الله بن يزيد قال حدثنا أبي قال حدثنا سعيد قال حدثني يزيد بن	حدثنا أبي حبيب عن ابن شهاب عن أبي سلمة عن جابر أن رسول الله صلى الله عليه وسلم قضى بالعمرى أن يهب الرجل للرجل ولعقبه الهبة ويستثني إن حدث بك حدث وبعقبك فهو إلى وإلى عقبي إنها لمن أعطيها ولعقبه 	 أخبرنا محمد بن عبد الله بن يزيد قال حدثنا أبي قال حدثنا سعيد قال حدثني يزيد بن أبي حبيب عن ابن شهاب عن أبي سلمة عن جابر أن رسول الله صلى الله عليه وسلم قضى بالعمرى أن يهب الرجل للرجل ولعقبه الهبة ويستثني إن حدث بك حدث وبعقبك فهو إلى وإلى عقبي إنها لمن أعطيها ولعقبه 	" Yazid bin Abi Habib narrated from Ibn Shihab, from Abu Salamah, from Jabir, that the Messenger of Allah ruled concerning 'Umra -when a man gives a gift to another man, and his descendants, but stipulates that if something happens to you and your descendants, then it will belong to me and my descendants- ""It belongs to the one to whom it was given, and to his descendants."" "
nasai34_1137640	 أخبرنا محمد بن عبد الأعلى قال حدثنا خالد بن	أخبرنا الحارث قال حدثنا هشام قال حدثنا يحيى بن أبي كثير قال حدثني أبو سلمة قال سمعت جابرا يقول قال رسول الله صلى الله عليه وسلم العمرى لمن وهبت له 	 أخبرنا محمد بن عبد الأعلى قال حدثنا خالد بن الحارث قال حدثنا هشام قال حدثنا يحيى بن أبي كثير قال حدثني أبو سلمة قال سمعت جابرا يقول قال رسول الله صلى الله عليه وسلم العمرى لمن وهبت له 	" Hisham said: ""Yahya bin Abi Kathir narrated to us, he said: 'Abu Salamah bin 'Abdur-Rahman narrated to me, he said: ""I heard Jabir say: 'The Messenger of Allah said: ""A lifelong gift belongs to the one to whom it was given.""'""'"" "
nasai34_1137650	 أخبرنا يحيى بن درست قال حدثنا أبو إسماعيل قال حدثنا يحيى أن أبا سلمة حدثه عن جابر بن	حدثنا عبد الله عن نبي الله صلى الله عليه وسلم قال العمرى لمن وهبت له 	 أخبرنا يحيى بن درست قال حدثنا أبو إسماعيل قال حدثنا يحيى أن أبا سلمة حدثه عن جابر بن عبد الله عن نبي الله صلى الله عليه وسلم قال العمرى لمن وهبت له 	" Abu Isma'il said: ""Yahya narrated to us that Abu Salamah narrated to him, from Jabir bin 'Abdullah, from the Prophet of Allah who said: 'A lifelong gift belongs to the one to whom it was given.'"" "
nasai34_1137660	 أخبرنا علي بن حجر قال أنبأنا إسماعيل عن محمد عن أبي سلمة عن	عن أبي هريرة أن رسول الله صلى الله عليه وسلم قال لا عمرى فمن أعمر شيئا فهو له 	 أخبرنا علي بن حجر قال أنبأنا إسماعيل عن محمد عن أبي سلمة عن أبي هريرة أن رسول الله صلى الله عليه وسلم قال لا عمرى فمن أعمر شيئا فهو له 	" Isma'il narrated from Muhammad, from Abu Salamah, from Abu Hurairah, that the Messenger of Allah said: ""There is no lifelong gift. Whoever is given something as a lifelong gift, it belongs to him."" "
nasai34_1137670	 أخبرنا إسحاق بن إبراهيم قال حدثنا عيسى وعبدة بن	أخبرنا سليمان قالا حدثنا محمد بن عمرو قال حدثنا أبو سلمة عن أبي هريرة عن رسول الله صلى الله عليه وسلم قال من أعمر شيئا فهو له 	 أخبرنا إسحاق بن إبراهيم قال حدثنا عيسى وعبدة بن سليمان قالا حدثنا محمد بن عمرو قال حدثنا أبو سلمة عن أبي هريرة عن رسول الله صلى الله عليه وسلم قال من أعمر شيئا فهو له 	" Muhammad bin 'Amr said: ""Abu Salamah narrated to us, from Abu Hurairah that the Messenger of Allah said: 'Whoever is given something as a lifelong gift, it belongs to him.'"" "
nasai34_1137680	 أخبرنا محمد بن المثنى قال حدثنا محمد قال حدثنا شعبة عن قتادة عن النضر بن أنس عن بشير بن نهيك عن أبي هريرة عن	عن النبي صلى الله عليه وسلم قال العمرى جائزة 	 أخبرنا محمد بن المثنى قال حدثنا محمد قال حدثنا شعبة عن قتادة عن النضر بن أنس عن بشير بن نهيك عن أبي هريرة عن النبي صلى الله عليه وسلم قال العمرى جائزة 	" Bashir bin Nahik narrated from Abu Hurairah that the Prophet said: ""A lifelong gift ('Umra) is permissible."" "
nasai34_1137690	 أخبرنا محمد بن المثنى قال حدثنا معاذ بن	أخبرنا هشام قال حدثني أبي عن قتادة قال سألني سليمان بن هشام عن العمرى فقلت حدث محمد بن سيرين عن شريح قال قضى نبي الله صلى الله عليه وسلم أن العمرى جائزة قال قتادة وقلت حدثني النضر بن أنس عن بشير بن نهيك عن أبي هريرة أن نبي الله صلى الله عليه وسلم قال العمرى جائزة قال قتادة وقلت كان الحسن يقول العمرى جائزة قال قتادة فقال الزهري إنما العمرى إذا أعمر وعقبه من بعده فإذا لم يجعل عقبه من بعده كان للذي يجعل شرطه قال قتادة فسئل عطاء بن أبي رباح فقال حدثني جابر بن عبد الله أن رسول الله صلى الله عليه وسلم قال العمرى جائزة قال قتادة فقال الزهري كان الخلفاء لا يقضون بهذا قال عطاء قضى بها عبد الملك بن مروان 	 أخبرنا محمد بن المثنى قال حدثنا معاذ بن هشام قال حدثني أبي عن قتادة قال سألني سليمان بن هشام عن العمرى فقلت حدث محمد بن سيرين عن شريح قال قضى نبي الله صلى الله عليه وسلم أن العمرى جائزة قال قتادة وقلت حدثني النضر بن أنس عن بشير بن نهيك عن أبي هريرة أن نبي الله صلى الله عليه وسلم قال العمرى جائزة قال قتادة وقلت كان الحسن يقول العمرى جائزة قال قتادة فقال الزهري إنما العمرى إذا أعمر وعقبه من بعده فإذا لم يجعل عقبه من بعده كان للذي يجعل شرطه قال قتادة فسئل عطاء بن أبي رباح فقال حدثني جابر بن عبد الله أن رسول الله صلى الله عليه وسلم قال العمرى جائزة قال قتادة فقال الزهري كان الخلفاء لا يقضون بهذا قال عطاء قضى بها عبد الملك بن مروان 	" It was narrated that Qatadah said: ""Sulaiman bin Hisham asked me about a lifelong gift. I said: 'Muhammad bin Sirin narrated that Shuraih said: ""The Prophet of Allah ruled that a lifelong gift is permissible.""'"" Qatadah said: ""I said: 'And An-Nadr bin Anas narrated to me, from Bashir bin Nahik, from Abu Hurairah, that the Prophet of Allah said: ""A lifelong gift is permissible.""'"" Qatadah said: ""I said: 'Al-Hasan used to say: ""A lifelong gift is permissible.""'"" Qatadah said: ""Az-Zuhri said: 'A lifelong gift is when it is stipulated that it is for the one to whom it is given and his descendants, but if his descendants were not mentioned then the condition is valid (and it reverts to the one who gave it).'"" Qatadah said: ""So 'Ata' bin Abi Rabah was asked, and he said: 'Jabir bin Abdullah narrated to me that Allah's Messenger said: ""Umra is permissible.""'"" Qatadah said: ""Az-Zuhri said: 'The Caliphs (Khulafa') did not rule according to this.'"" 'Ata' said: ""Abdul-Malik bin Marwan ruled according to this."" "
nasai34_1137700	 أخبرنا محمد بن معمر قال حدثنا حبان قال حدثنا حماد بن سلمة ح وأخبرني إبراهيم بن يونس بن	حدثنا محمد قال حدثنا أبي قال حدثنا حماد بن سلمة عن داود وهو ابن أبي هند وحبيب المعلم عن عمرو بن شعيب عن أبيه عن جده أن رسول الله صلى الله عليه وسلم قال لا يجوز لامرأة هبة في مالها إذا ملك زوجها عصمتها اللفظ لمحمد 	 أخبرنا محمد بن معمر قال حدثنا حبان قال حدثنا حماد بن سلمة ح وأخبرني إبراهيم بن يونس بن محمد قال حدثنا أبي قال حدثنا حماد بن سلمة عن داود وهو ابن أبي هند وحبيب المعلم عن عمرو بن شعيب عن أبيه عن جده أن رسول الله صلى الله عليه وسلم قال لا يجوز لامرأة هبة في مالها إذا ملك زوجها عصمتها اللفظ لمحمد 	" It was narrated from 'Amr bin Shu'aib, from his father, from his grandfather, that the Messenger of Allah said: ""It is not permissible for a woman to give a gift from her wealth, once her husband has marital authority over her."" This is the wording of (one of the narrators) Muhammad. "
nasai34_1137710	 أخبرنا إسماعيل بن مسعود قال حدثنا خالد قال حدثنا حسين المعلم عن عمرو بن	حدثنا شعيب أن أباه حدثه عن عبد الله بن عمرو ح وأخبرنا حميد بن مسعدة قال حدثنا يزيد بن زريع قال حدثنا حسين المعلم عن عمرو بن شعيب عن أبيه عن جده قال لما فتح رسول الله صلى الله عليه وسلم مكة قام خطيبا فقال في خطبته لا يجوز لامرأة عطية إلا بإذن زوجها 	 أخبرنا إسماعيل بن مسعود قال حدثنا خالد قال حدثنا حسين المعلم عن عمرو بن شعيب أن أباه حدثه عن عبد الله بن عمرو ح وأخبرنا حميد بن مسعدة قال حدثنا يزيد بن زريع قال حدثنا حسين المعلم عن عمرو بن شعيب عن أبيه عن جده قال لما فتح رسول الله صلى الله عليه وسلم مكة قام خطيبا فقال في خطبته لا يجوز لامرأة عطية إلا بإذن زوجها 	" It was narrated from 'Amr bin Shu'aib, from his father, that his grandfather said: ""When the Messenger of Allah conquered Makkah, he stood up to address (the people) and said in his Khutbah: 'It is not permissible for a woman to give (a gift) except with her husband's permission.'"" "
nasai34_1137720	 أخبرنا هناد بن السري قال حدثنا أبو بكر بن	أخبرنا عياش عن يحيى بن هانئ عن أبي حذيفة عن عبد الملك بن محمد بن بشير عن عبد الرحمن بن علقمة الثقفي قال قدم وفد ثقيف على رسول الله صلى الله عليه وسلم ومعهم هدية فقال أهدية أم صدقة فإن كانت هدية فإنما يبتغى بها وجه رسول الله صلى الله عليه وسلم وقضاء الحاجة وإن كانت صدقة فإنما يبتغى بها وجه الله عز وجل قالوا لا بل هدية فقبلها منهم وقعد معهم يسائلهم ويسائلونه حتى صلى الظهر مع العصر 	 أخبرنا هناد بن السري قال حدثنا أبو بكر بن عياش عن يحيى بن هانئ عن أبي حذيفة عن عبد الملك بن محمد بن بشير عن عبد الرحمن بن علقمة الثقفي قال قدم وفد ثقيف على رسول الله صلى الله عليه وسلم ومعهم هدية فقال أهدية أم صدقة فإن كانت هدية فإنما يبتغى بها وجه رسول الله صلى الله عليه وسلم وقضاء الحاجة وإن كانت صدقة فإنما يبتغى بها وجه الله عز وجل قالوا لا بل هدية فقبلها منهم وقعد معهم يسائلهم ويسائلونه حتى صلى الظهر مع العصر 	" It was narrated that 'Abdur-Rahman bin 'Alqamah Ath-Thaqafi said: ""The delegation of Thaqif came to the Messenger of Allah, bringing a gift with them. He said: 'Is it a gift or charity?' If it was a gift it would be for the sake of the Messenger of Allah and to have their needs met, and if it was charity then it would be in the cause of Allah. They said: 'It is a gift.' So he accepted it from them, and sat with them, and they asked questions, until he prayed Zuhr with 'Asr."" "
nasai34_1137730	 أخبرنا أبو عاصم خشيش بن أصرم قال حدثنا عبد الرزاق قال أنبأنا معمر عن ابن عجلان عن سعيد عن	عن أبي هريرة أن رسول الله صلى الله عليه وسلم قال لقد هممت أن لا أقبل هدية إلا من قرشي أو أنصاري أو ثقفي أو دوسي 	 أخبرنا أبو عاصم خشيش بن أصرم قال حدثنا عبد الرزاق قال أنبأنا معمر عن ابن عجلان عن سعيد عن أبي هريرة أن رسول الله صلى الله عليه وسلم قال لقد هممت أن لا أقبل هدية إلا من قرشي أو أنصاري أو ثقفي أو دوسي 	" It was narrated from Abu Hurairah that the Messenger of Allah said: ""I was thinking of not accepting gifts except from a Quraishi, an Ansari, a Thaqafi or a Dawsi."" "
nasai34_1137740	 أخبرنا إسحاق بن إبراهيم قال حدثنا وكيع قال حدثنا شعبة عن قتادة عن	حدثنا أنس أن رسول الله صلى الله عليه وسلم أتي بلحم فقال ما هذا فقيل تصدق به على بريرة فقال هو لها صدقة ولنا هدية 	 أخبرنا إسحاق بن إبراهيم قال حدثنا وكيع قال حدثنا شعبة عن قتادة عن أنس أن رسول الله صلى الله عليه وسلم أتي بلحم فقال ما هذا فقيل تصدق به على بريرة فقال هو لها صدقة ولنا هدية 	" It was narrated from Anas that some meat was brought to the Messenger of Allah and he said: ""What is this?"" It was said: ""It was given in charity to Barirah."" He said: ""It is charity for her and a gift for us."" "
