nasai46_1148850	 أخبرنا الربيع بن سليمان قال حدثنا شعيب بن	أخبرنا الليث قال حدثنا الليث عن ابن عجلان عن القعقاع عن أبي صالح عن أبي هريرة عن رسول الله صلى الله عليه وسلم قال لا يزني الزاني حين يزني وهو مؤمن ولا يسرق السارق حين يسرق وهو مؤمن ولا يشرب الخمر حين يشربها وهو مؤمن ولا ينتهب نهبة ذات شرف يرفع الناس إليها أبصارهم وهو مؤمن 	 أخبرنا الربيع بن سليمان قال حدثنا شعيب بن الليث قال حدثنا الليث عن ابن عجلان عن القعقاع عن أبي صالح عن أبي هريرة عن رسول الله صلى الله عليه وسلم قال لا يزني الزاني حين يزني وهو مؤمن ولا يسرق السارق حين يسرق وهو مؤمن ولا يشرب الخمر حين يشربها وهو مؤمن ولا ينتهب نهبة ذات شرف يرفع الناس إليها أبصارهم وهو مؤمن 	" It was narrated from abu Hurairah that the Messenger of Allah said: ""No one who commits Zina is a believer at the moment when he is committing Zina; no one who steals is a believe at the moment when he is stealing; no one who drinks wine is a believer at the moment when he is drinking it; and no robber is a believer at the moment when he is robbing and the people are looking on. (Sahih) "
nasai46_1148860	 أخبرنا محمد بن المثنى قال حدثنا ابن أبي عدي عن شعبة عن سليمان ح وأنبأنا أحمد بن	عن سيار قال حدثنا عبد الله بن عثمان عن أبي حمزة عن الأعمش عن أبي صالح عن أبي هريرة عن النبي صلى الله عليه وسلم وقال أحمد في حديثه قال قال رسول الله صلى الله عليه وسلم لا يزني الزاني حين يزني وهو مؤمن ولا يسرق حين يسرق وهو مؤمن ولا يشرب الخمر حين يشرب وهو مؤمن ثم التوبة معروضة بعد 	 أخبرنا محمد بن المثنى قال حدثنا ابن أبي عدي عن شعبة عن سليمان ح وأنبأنا أحمد بن سيار قال حدثنا عبد الله بن عثمان عن أبي حمزة عن الأعمش عن أبي صالح عن أبي هريرة عن النبي صلى الله عليه وسلم وقال أحمد في حديثه قال قال رسول الله صلى الله عليه وسلم لا يزني الزاني حين يزني وهو مؤمن ولا يسرق حين يسرق وهو مؤمن ولا يشرب الخمر حين يشرب وهو مؤمن ثم التوبة معروضة بعد 	" It was narrated from abu Hurairah that the Prophet - and Ahmad said in his Hadith: ""The Messenger of Allah said: 'No one who commits Zina is a believer at the moment when he is committing Zina; no one who steals is a believer at the moment when he is stealing; no one who drinks wine is a believer at the moment when he is drinking it; but repentance is available to him after that. (Sahih) "
nasai46_1148870	 أخبرنا محمد بن يحيى المروزي أبو علي قال حدثنا عبد الله بن عثمان عن أبي حمزة عن يزيد وهو ابن أبي زياد عن أبي صالح عن	عن أبي هريرة قال لا يزني الزاني حين يزني وهو مؤمن ولا يسرق وهو مؤمن ولا يشرب الخمر وهو مؤمن وذكر رابعة فنسيتها فإذا فعل ذلك خلع ربقة الإسلام من عنقه فإن تاب تاب الله عليه 	 أخبرنا محمد بن يحيى المروزي أبو علي قال حدثنا عبد الله بن عثمان عن أبي حمزة عن يزيد وهو ابن أبي زياد عن أبي صالح عن أبي هريرة قال لا يزني الزاني حين يزني وهو مؤمن ولا يسرق وهو مؤمن ولا يشرب الخمر وهو مؤمن وذكر رابعة فنسيتها فإذا فعل ذلك خلع ربقة الإسلام من عنقه فإن تاب تاب الله عليه 	" It was narrated that Abu Hurairah said: ""No one who commits Zina is a believer at the moment when he is committing Zina; no one who steals is a believer at the moment when he is stealing; no one who drinks wine is a believer at the moment when he is drinking it."" - And he mentioned a fourth but I (the narrator) have forgotten it - ""When he does that the yoke of Islam is shed from his neck, but if he repents, Allah accepts his repentance."" (Da'if) "
nasai46_1148880	 أخبرنا محمد بن عبد الله بن المبارك المخرمي قال حدثنا أبو معاوية قال حدثنا الأعمش ح وأنبأنا أحمد بن	حدثنا حرب عن أبي معاوية عن الأعمش عن أبي صالح عن أبي هريرة رضى الله عنه قال قال رسول الله صلى الله عليه وسلم لعن الله السارق يسرق البيضة فتقطع يده ويسرق الحبل فتقطع يده 	 أخبرنا محمد بن عبد الله بن المبارك المخرمي قال حدثنا أبو معاوية قال حدثنا الأعمش ح وأنبأنا أحمد بن حرب عن أبي معاوية عن الأعمش عن أبي صالح عن أبي هريرة رضى الله عنه قال قال رسول الله صلى الله عليه وسلم لعن الله السارق يسرق البيضة فتقطع يده ويسرق الحبل فتقطع يده 	" It was narrated that Abu Hurairah, may Allah be pleased with him, said: ""The Messenger of Allah said; 'Allah curses the thief who steals an egg and had his hand cut off, and who steals a rope and has his hand cut off."" (Sahih) "
nasai46_1148890	 أخبرنا إسحاق بن إبراهيم قال حدثنا بقية بن	أخبرنا الوليد قال حدثني صفوان بن عمرو قال حدثني أزهر بن عبد الله الحرازي عن النعمان بن بشير أنه رفع إليه نفر من الكلاعيين أن حاكة سرقوا متاعا فحبسهم أياما ثم خلى سبيلهم فأتوه فقالوا خليت سبيل هؤلاء بلا امتحان ولا ضرب فقال النعمان ما شئتم إن شئتم أضربهم فإن أخرج الله متاعكم فذاك وإلا أخذت من ظهوركم مثله قالوا هذا حكمك قال هذا حكم الله عز وجل ورسوله صلى الله عليه وسلم 	 أخبرنا إسحاق بن إبراهيم قال حدثنا بقية بن الوليد قال حدثني صفوان بن عمرو قال حدثني أزهر بن عبد الله الحرازي عن النعمان بن بشير أنه رفع إليه نفر من الكلاعيين أن حاكة سرقوا متاعا فحبسهم أياما ثم خلى سبيلهم فأتوه فقالوا خليت سبيل هؤلاء بلا امتحان ولا ضرب فقال النعمان ما شئتم إن شئتم أضربهم فإن أخرج الله متاعكم فذاك وإلا أخذت من ظهوركم مثله قالوا هذا حكمك قال هذا حكم الله عز وجل ورسوله صلى الله عليه وسلم 	" It was narrated from An-Nu'man bin Bashir that: a group of the Kala'iyin complaned to him about some people who had stolen some goods, shoe detained them for several days, and then he let them go. They came and said: ""You let them go without any pressure (to make them admit to their crime) or beating?"" An-Nu'man said: ""What do you want? If you wish, I will beat them, and if Allah brings back your goods thereby, all well and good. Otherwise I will take retaliation from your backs (by beating you) likewise."" They said: ""is this your ruling?"" He said: ""This is the ruling of Allah and His Messenger ""(Daif) "
nasai46_1148900	 أخبرنا عبد الرحمن بن محمد بن سلام قال حدثنا أبو أسامة قال أخبرني ابن المبارك عن معمر عن بهز بن حكيم عن أبيه عن	عن جده أن رسول الله صلى الله عليه وسلم حبس ناسا في تهمة 	 أخبرنا عبد الرحمن بن محمد بن سلام قال حدثنا أبو أسامة قال أخبرني ابن المبارك عن معمر عن بهز بن حكيم عن أبيه عن جده أن رسول الله صلى الله عليه وسلم حبس ناسا في تهمة 	 It was narrated from Bahz bin Hakim, from his father, from his grandfather, that: the Messenger of Allah detained some people who were under suspicion (Hasan) 
nasai46_1148910	 أخبرنا علي بن سعيد بن مسروق قال حدثنا عبد الله بن المبارك عن معمر عن بهز بن	حدثنا حكيم عن أبيه عن جده أن رسول الله صلى الله عليه وسلم حبس رجلا في تهمة ثم خلى سبيله 	 أخبرنا علي بن سعيد بن مسروق قال حدثنا عبد الله بن المبارك عن معمر عن بهز بن حكيم عن أبيه عن جده أن رسول الله صلى الله عليه وسلم حبس رجلا في تهمة ثم خلى سبيله 	 It was narrated from Bahz bin Hakim, from his father, from his grandfather, that: the Messenger of Allah detained a man who was under suspicion, and then he let him go. (Hssan) 
nasai46_1148920	 أخبرنا سويد بن نصر قال حدثنا عبد الله بن	أخبرنا المبارك عن حماد بن سلمة عن إسحاق بن عبد الله بن أبي طلحة عن أبي المنذر مولى أبي ذر عن أبي أمية المخزومي أن رسول الله صلى الله عليه وسلم أتي بلص اعترف اعترافا ولم يوجد معه متاع فقال له رسول الله صلى الله عليه وسلم ما إخالك سرقت قال بلى قال اذهبوا به فاقطعوه ثم جيئوا به فقطعوه ثم جاءوا به فقال له قل أستغفر الله وأتوب إليه فقال أستغفر الله وأتوب إليه قال اللهم تب عليه 	 أخبرنا سويد بن نصر قال حدثنا عبد الله بن المبارك عن حماد بن سلمة عن إسحاق بن عبد الله بن أبي طلحة عن أبي المنذر مولى أبي ذر عن أبي أمية المخزومي أن رسول الله صلى الله عليه وسلم أتي بلص اعترف اعترافا ولم يوجد معه متاع فقال له رسول الله صلى الله عليه وسلم ما إخالك سرقت قال بلى قال اذهبوا به فاقطعوه ثم جيئوا به فقطعوه ثم جاءوا به فقال له قل أستغفر الله وأتوب إليه فقال أستغفر الله وأتوب إليه قال اللهم تب عليه 	" It was narrated from abu Umayah Al-Makhzumi that: a thief who confused to a crime but with whom no stolen goods has been found, was brought to the Messenger of Allah. The Messenger of Allah said to him: ""I do not think that you stole anything.""He He said: ""Yes I did."" He said: ""Take him and cut off his hands, then bring him here, ""So they cut off his hand then they brought him to him. He said to him; ""Say: I seek the forgiveness of Allah and I repent to Him."" He said: ""I seek the forgiveness of Allah and I repent to Him."" He said:: ""O Allah, accept his repentance.""(Daif) "
nasai46_1148930	 أخبرنا هلال بن العلاء قال حدثني أبي قال حدثنا يزيد بن زريع عن سعيد عن قتادة عن عطاء عن صفوان بن	عن أمية أن رجلا سرق بردة له فرفعه إلى النبي صلى الله عليه وسلم فأمر بقطعه فقال يا رسول الله قد تجاوزت عنه فقال أبا وهب أفلا كان قبل أن تأتينا به فقطعه رسول الله صلى الله عليه وسلم 	 أخبرنا هلال بن العلاء قال حدثني أبي قال حدثنا يزيد بن زريع عن سعيد عن قتادة عن عطاء عن صفوان بن أمية أن رجلا سرق بردة له فرفعه إلى النبي صلى الله عليه وسلم فأمر بقطعه فقال يا رسول الله قد تجاوزت عنه فقال أبا وهب أفلا كان قبل أن تأتينا به فقطعه رسول الله صلى الله عليه وسلم 	" It was narrated from Safwan bin Umayyah, that: a man stole a Burdah of his, so he brought him before the Messenger of Allah, who ordered that his hand be cut off. He said: ""O Messenger of Allah, I will let him have it."" He said: ""Abu Wahb! Why didn't you do that before you brought him to us?"" And the Messenger of Allah had (the man's) hand cut off. (Hasan) "
nasai46_1148940	not identified	 أخبرني عبد الله بن أحمد بن محمد بن حنبل قال حدثنا أبي قال حدثنا محمد بن جعفر قال حدثنا سعيد عن قتادة عن عطاء عن طارق بن مرقع عن صفوان بن أمية أن رجلا سرق بردة فرفعه إلى النبي صلى الله عليه وسلم فأمر بقطعه فقال يا رسول الله قد تجاوزت عنه قال فلولا كان هذا قبل أن تأتيني به يا أبا وهب فقطعه رسول الله صلى الله عليه وسلم 	 أخبرني عبد الله بن أحمد بن محمد بن حنبل قال حدثنا أبي قال حدثنا محمد بن جعفر قال حدثنا سعيد عن قتادة عن عطاء عن طارق بن مرقع عن صفوان بن أمية أن رجلا سرق بردة فرفعه إلى النبي صلى الله عليه وسلم فأمر بقطعه فقال يا رسول الله قد تجاوزت عنه قال فلولا كان هذا قبل أن تأتيني به يا أبا وهب فقطعه رسول الله صلى الله عليه وسلم 	" It was narrated from Safwan bin Umayyah that: a man stole his Burdah, so he brought him before the Prophet, who ordered that his hand be cut off. He said: ""O Messenger of Allah, I will let him have it."" He said: ""O Abu Wahb! Why didn't you do that before you brought him to me?"" And the Messenger of Allah had (the man's) hand cut off. (Hasan) "
nasai46_1148950	 أخبرنا محمد بن حاتم بن	أخبرنا نعيم قال أنبأنا حبان قال حدثنا عبد الله عن الأوزاعي قال حدثني عطاء بن أبي رباح أن رجلا سرق ثوبا فأتي به رسول الله صلى الله عليه وسلم فأمر بقطعه فقال الرجل يا رسول الله هو له قال فهلا قبل الآن 	 أخبرنا محمد بن حاتم بن نعيم قال أنبأنا حبان قال حدثنا عبد الله عن الأوزاعي قال حدثني عطاء بن أبي رباح أن رجلا سرق ثوبا فأتي به رسول الله صلى الله عليه وسلم فأمر بقطعه فقال الرجل يا رسول الله هو له قال فهلا قبل الآن 	" 'Ata' bin Abi Rabah narrated that: a man stole a garment, and was brought before the Messenger of Allah, who order that his hand be cut off. The man said: ""O Messenger of Allah, he can keep it."" He said: ""Why (did you not say that) before now?"" (Hasan) "
nasai46_1148960	not identified	 أخبرني هلال بن العلاء قال حدثنا حسين قال حدثنا زهير قال حدثنا عبد الملك هو ابن أبي بشير قال حدثني عكرمة عن صفوان بن أمية أنه طاف بالبيت وصلى ثم لف رداء له من برد فوضعه تحت رأسه فنام فأتاه لص فاستله من تحت رأسه فأخذه فأتى به النبي صلى الله عليه وسلم فقال إن هذا سرق ردائي فقال له النبي صلى الله عليه وسلم أسرقت رداء هذا قال نعم قال اذهبا به فاقطعا يده قال صفوان ما كنت أريد أن تقطع يده في ردائي فقال له فلو ما قبل هذا خالفه أشعث بن سوار 	 أخبرني هلال بن العلاء قال حدثنا حسين قال حدثنا زهير قال حدثنا عبد الملك هو ابن أبي بشير قال حدثني عكرمة عن صفوان بن أمية أنه طاف بالبيت وصلى ثم لف رداء له من برد فوضعه تحت رأسه فنام فأتاه لص فاستله من تحت رأسه فأخذه فأتى به النبي صلى الله عليه وسلم فقال إن هذا سرق ردائي فقال له النبي صلى الله عليه وسلم أسرقت رداء هذا قال نعم قال اذهبا به فاقطعا يده قال صفوان ما كنت أريد أن تقطع يده في ردائي فقال له فلو ما قبل هذا خالفه أشعث بن سوار 	" It was narrated from Safwan bin Umayyah that: he circumambulated theKa'bah and prayed, then he rolled up a Rid' of his and placed it beneath his head, and slept. A thief came and slid it out from beneath his head and took it. He brought him to the Prophet and said: ""This man stole my Rida. The Prophet said to him: Did you steal this man's Rida?"" He said: ""Yes."" He said: ""Take him away and cut his hand off."" Safwan said: ""I* did not want to have his hand cut off for my Rida'."" He said: ""Why (did you not say that) before now?"" (Hasan) "
nasai46_1148970	 أخبرنا محمد بن هشام يعني ابن أبي خيرة قال حدثنا الفضل يعني ابن العلاء الكوفي قال حدثنا أشعث عن عكرمة عن	عن ابن عباس قال كان صفوان نائما في المسجد ورداؤه تحته فسرق فقام وقد ذهب الرجل فأدركه فأخذه فجاء به إلى النبي صلى الله عليه وسلم فأمر بقطعه قال صفوان يا رسول الله ما بلغ ردائي أن يقطع فيه رجل قال هلا كان هذا قبل أن تأتينا به قال أبو عبد الرحمن أشعث ضعيف 	 أخبرنا محمد بن هشام يعني ابن أبي خيرة قال حدثنا الفضل يعني ابن العلاء الكوفي قال حدثنا أشعث عن عكرمة عن ابن عباس قال كان صفوان نائما في المسجد ورداؤه تحته فسرق فقام وقد ذهب الرجل فأدركه فأخذه فجاء به إلى النبي صلى الله عليه وسلم فأمر بقطعه قال صفوان يا رسول الله ما بلغ ردائي أن يقطع فيه رجل قال هلا كان هذا قبل أن تأتينا به قال أبو عبد الرحمن أشعث ضعيف 	" It narrated that Ibn 'Abbas said: ""Safwina was slleping in the Masjid with his Rida' beneath him, and it was stolen. He got up, and the man had gone, but he caught up with him, and took him to the prophet, who ordered that his hand be cut off. Safwan said; 'O Messenger of Allah, my Rida 'is not worth cutting off a man's hand for. 'He said 'Why did you not say that before you brought him to me (Sahih) "
nasai46_1148980	not identified	 أخبرني أحمد بن عثمان بن حكيم قال حدثنا عمرو عن أسباط عن سماك عن حميد بن أخت صفوان عن صفوان بن أمية قال كنت نائما في المسجد على خميصة لي ثمنها ثلاثون درهما فجاء رجل فاختلسها مني فأخذ الرجل فأتي به النبي صلى الله عليه وسلم فأمر به ليقطع فأتيته فقلت أتقطعه من أجل ثلاثين درهما أنا أبيعه وأنسئه ثمنها قال فهلا كان هذا قبل أن تأتيني به 	 أخبرني أحمد بن عثمان بن حكيم قال حدثنا عمرو عن أسباط عن سماك عن حميد بن أخت صفوان عن صفوان بن أمية قال كنت نائما في المسجد على خميصة لي ثمنها ثلاثون درهما فجاء رجل فاختلسها مني فأخذ الرجل فأتي به النبي صلى الله عليه وسلم فأمر به ليقطع فأتيته فقلت أتقطعه من أجل ثلاثين درهما أنا أبيعه وأنسئه ثمنها قال فهلا كان هذا قبل أن تأتيني به 	" It was knarrated that Safwan bin Umayyah said: ""I was sleeping in the Masjid on a Khmaishah of mine that was worth thirty dirhams, and a man came and stole it from me. The man was caught and taken to the Prophet, who ordered that his hand be cut off. I came to him and said: ""Will you cut off his hand for the sake of only thirty Dirhams? I will sell it to him on credit."" He said:"" Why did you not say this before you brought him to me?"" (Hasan) "
nasai46_1148990	 أخبرنا محمد بن عبد الله بن عبد الرحيم قال حدثنا أسد بن موسى قال حدثنا وذكر حماد بن	حدثنا سلمة عن عمرو بن دينار عن طاوس عن صفوان بن أمية أنه سرقت خميصته من تحت رأسه وهو نائم في مسجد النبي صلى الله عليه وسلم فأخذ اللص فجاء به إلى النبي صلى الله عليه وسلم فأمر بقطعه فقال صفوان أتقطعه قال فهلا قبل أن تأتيني به تركته 	 أخبرنا محمد بن عبد الله بن عبد الرحيم قال حدثنا أسد بن موسى قال حدثنا وذكر حماد بن سلمة عن عمرو بن دينار عن طاوس عن صفوان بن أمية أنه سرقت خميصته من تحت رأسه وهو نائم في مسجد النبي صلى الله عليه وسلم فأخذ اللص فجاء به إلى النبي صلى الله عليه وسلم فأمر بقطعه فقال صفوان أتقطعه قال فهلا قبل أن تأتيني به تركته 	" It was narrated from Safwan bin Umayyah that: a Khamisah was stolen from beneath his head while he slept in the Masjid of the Prophet. He caught there thief and brought him to the Prophet, who ordered that his hand be cut off. Safwan said: ""Are you going to cut off his hand?"" He said ""Why didn't you let him go before you b brought him to me?"" (Daif) "
nasai46_1149000	 أخبرنا محمد بن هاشم قال حدثنا الوليد قال حدثنا ابن جريج عن عمرو بن شعيب عن أبيه عن جده عن	عن النبي صلى الله عليه وسلم قال تعافوا الحدود قبل أن تأتوني به فما أتاني من حد فقد وجب 	 أخبرنا محمد بن هاشم قال حدثنا الوليد قال حدثنا ابن جريج عن عمرو بن شعيب عن أبيه عن جده عن النبي صلى الله عليه وسلم قال تعافوا الحدود قبل أن تأتوني به فما أتاني من حد فقد وجب 	" It was narrated form 'Amr bin Shu'ainb, from his father, from his grandfather, that the Prophet said: ""Pardon matters that may deserve a Hadd punishment before you bring it to my attention, for whatever is brought to my attention, the Hadd punishment becomes binding."" (Saif) "
nasai46_1149010	not identified	 قال الحارث بن مسكين قراءة عليه وأنا أسمع عن ابن وهب قال سمعت ابن جريج يحدث عن عمرو بن شعيب عن أبيه عن عبد الله بن عمرو أن رسول الله صلى الله عليه وسلم قال تعافوا الحدود فيما بينكم فما بلغني من حد فقد وجب 	 قال الحارث بن مسكين قراءة عليه وأنا أسمع عن ابن وهب قال سمعت ابن جريج يحدث عن عمرو بن شعيب عن أبيه عن عبد الله بن عمرو أن رسول الله صلى الله عليه وسلم قال تعافوا الحدود فيما بينكم فما بلغني من حد فقد وجب 	" It was narrated from 'Amr bin Shu'aib from his father, from' Abdullah bin 'Amr that the Messenger of Allah said: ""Pardon matters among yourselves that may deserve a Hadd punishment, for whatever is brought to my attention, the Hadd punishment b becomes binding."" (Daif) "
nasai46_1149020	 أخبرنا محمود بن غيلان قال حدثنا عبد الرزاق قال أنبأنا معمر عن أيوب عن نافع عن	عن ابن عمر رضى الله عنهما أن امرأة مخزومية كانت تستعير المتاع فتجحده فأمر النبي صلى الله عليه وسلم بقطع يدها 	 أخبرنا محمود بن غيلان قال حدثنا عبد الرزاق قال أنبأنا معمر عن أيوب عن نافع عن ابن عمر رضى الله عنهما أن امرأة مخزومية كانت تستعير المتاع فتجحده فأمر النبي صلى الله عليه وسلم بقطع يدها 	 It was narrated from Ibn 'Umar, may Allah be pleased with them both, that a Makhzumi woman used to borrow things then deny that she had borrowed them, so the Prophet (SL3M) ordered that her hand be cut off. (Sahih) 
