nasai45_1148290	 أخبرنا أحمد بن يحيى قال حدثنا أبو نعيم قال حدثنا يوسف بن صهيب قال حدثني عبد الله بن	حدثنا بريدة أن امرأة خذفت امرأة فأسقطت المخذوفة فرفع ذلك إلى النبي صلى الله عليه وسلم فجعل عقل ولدها خمسمائة من الغر ونهى يومئذ عن الخذف قال أبو عبد الرحمن هذا وهم وينبغي أن يكون أراد مائة من الغر وقد روي النهى عن الخذف عن عبد الله بن بريدة عن عبد الله بن مغفل 	 أخبرنا أحمد بن يحيى قال حدثنا أبو نعيم قال حدثنا يوسف بن صهيب قال حدثني عبد الله بن بريدة أن امرأة خذفت امرأة فأسقطت المخذوفة فرفع ذلك إلى النبي صلى الله عليه وسلم فجعل عقل ولدها خمسمائة من الغر ونهى يومئذ عن الخذف قال أبو عبد الرحمن هذا وهم وينبغي أن يكون أراد مائة من الغر وقد روي النهى عن الخذف عن عبد الله بن بريدة عن عبد الله بن مغفل 	" ""Abdullah bin Buraidah narrated that: a woman threw pebbles at another woman and the woman who was struck miscarried. The matter was referred to the prophet and he set the blood money for her child at five hundred sheep. And on that day, he forbade throwing pebbles. (Sahih) Abu 'Abdur-Rahman (An-Nasa'i) said: This is an error, and it must be that the intent was one hundred camels. And the prohibition of throwing pebbles has been related from 'Abdullah bin Buraidah, from 'Abdullah bin Mughaffal. "
nasai45_1148300	 أخبرنا أحمد بن سليمان قال حدثنا يزيد قال أنبأنا كهمس عن عبد الله بن	حدثنا بريدة عن عبد الله بن مغفل أنه رأى رجلا يخذف فقال لا تخذف فإن نبي الله صلى الله عليه وسلم كان ينهى عن الخذف أو يكره الخذف شك كهمس 	 أخبرنا أحمد بن سليمان قال حدثنا يزيد قال أنبأنا كهمس عن عبد الله بن بريدة عن عبد الله بن مغفل أنه رأى رجلا يخذف فقال لا تخذف فإن نبي الله صلى الله عليه وسلم كان ينهى عن الخذف أو يكره الخذف شك كهمس 	" It was narrated from 'Abdullah bin Mughaffal that he saw a man throwing pebbles and he said: ""Do not throw pebbles, for the Prophet of Allah forbade throwing pebbles,"" or ""he disliked the throwing of pebbles."" Kahmas (one of the narrators) was not sure. (Sahih) "
nasai45_1148310	 أخبرنا قتيبة قال حدثنا حماد عن عمرو عن	أخبرنا طاوس أن عمر استشار الناس في الجنين فقال حمل بن مالك قضى رسول الله صلى الله عليه وسلم في الجنين غرة قال طاوس إن الفرس غرة 	 أخبرنا قتيبة قال حدثنا حماد عن عمرو عن طاوس أن عمر استشار الناس في الجنين فقال حمل بن مالك قضى رسول الله صلى الله عليه وسلم في الجنين غرة قال طاوس إن الفرس غرة 	" Hamal bin Malik said: ""The Messenger of Allah ruled that a slave (should be given as Diyah) for a fetus."" Tawus said: ""A horse would do in place of a slave."" (Sahih) "
nasai45_1148320	 أخبرنا قتيبة قال حدثنا الليث عن ابن شهاب عن ابن المسيب عن	عن أبي هريرة قال قضى رسول الله صلى الله عليه وسلم في جنين امرأة من بني لحيان سقط ميتا بغرة عبد أو أمة ثم إن المرأة التي قضى عليها بالغرة توفيت فقضى رسول الله صلى الله عليه وسلم بأن ميراثها لبنيها وزوجها وأن العقل على عصبتها 	 أخبرنا قتيبة قال حدثنا الليث عن ابن شهاب عن ابن المسيب عن أبي هريرة قال قضى رسول الله صلى الله عليه وسلم في جنين امرأة من بني لحيان سقط ميتا بغرة عبد أو أمة ثم إن المرأة التي قضى عليها بالغرة توفيت فقضى رسول الله صلى الله عليه وسلم بأن ميراثها لبنيها وزوجها وأن العقل على عصبتها 	" It was narrated that Abu Hurairah said: ""The Messenger of Allah ruled that a male or female slave should be given (as Diyah) to a woman of Banu Lihyah whosw child was miscarried and died. Then the woman to whom he had decreed that the slave should be given died, and the Messenger of Allah ruled that her estate belonged to the children and husband, and that the blood money was to be paid by her 'Asabah."" (Sahih) "
nasai45_1148330	 أخبرنا أحمد بن عمرو بن السرح قال حدثنا عبد الله بن وهب قال أخبرني يونس عن ابن شهاب عن أبي سلمة وسعيد بن المسيب عن	عن أبي هريرة أنه قال اقتتلت امرأتان من هذيل فرمت إحداهما الأخرى بحجر وذكر كلمة معناها فقتلتها وما في بطنها فاختصموا إلى رسول الله صلى الله عليه وسلم فقضى رسول الله صلى الله عليه وسلم أن دية جنينها غرة عبد أو وليدة وقضى بدية المرأة على عاقلتها وورثها ولدها ومن معهم فقال حمل بن مالك بن النابغة الهذلي يا رسول الله كيف أغرم من لا شرب ولا أكل ولا نطق ولا استهل فمثل ذلك يطل فقال رسول الله صلى الله عليه وسلم إنما هذا من إخوان الكهان من أجل سجعه الذي سجع 	 أخبرنا أحمد بن عمرو بن السرح قال حدثنا عبد الله بن وهب قال أخبرني يونس عن ابن شهاب عن أبي سلمة وسعيد بن المسيب عن أبي هريرة أنه قال اقتتلت امرأتان من هذيل فرمت إحداهما الأخرى بحجر وذكر كلمة معناها فقتلتها وما في بطنها فاختصموا إلى رسول الله صلى الله عليه وسلم فقضى رسول الله صلى الله عليه وسلم أن دية جنينها غرة عبد أو وليدة وقضى بدية المرأة على عاقلتها وورثها ولدها ومن معهم فقال حمل بن مالك بن النابغة الهذلي يا رسول الله كيف أغرم من لا شرب ولا أكل ولا نطق ولا استهل فمثل ذلك يطل فقال رسول الله صلى الله عليه وسلم إنما هذا من إخوان الكهان من أجل سجعه الذي سجع 	" It was narrated that Abu Hurairah said: ""Two women of Hudhail had a fight, and one of them threw a rock at the other and killed her and the child in her womb. They referred the dispute to the Messenger of Allah, and the Messenger of Allah ruled that the Diyah for her fetus was a male or female slave, and that the Diyah of the woman be paid by her 'Aqilah (male relatives on the father's side). And he made her children and those who were with them her heirs. Hamal bin Malik bin An-Nabighah Al-Hudhali said: ""O Messenger of Allah, how can I pay blood money for one who neither ate nor drank, or shouted such a one should be over looked."" The Messenger of Allah said: ""This is one of the brothers of the soothsayers"" because of the rhyming way in which he spoke. (Sahih) "
nasai45_1148340	 أخبرنا أحمد بن عمرو بن السرح قال حدثنا ابن وهب قال أخبرني مالك عن ابن شهاب عن أبي سلمة بن عبد الرحمن عن	عن أبي هريرة أن امرأتين من هذيل في زمان رسول الله صلى الله عليه وسلم رمت إحداهما الأخرى فطرحت جنينها فقضى فيه رسول الله صلى الله عليه وسلم بغرة عبد أو وليدة 	 أخبرنا أحمد بن عمرو بن السرح قال حدثنا ابن وهب قال أخبرني مالك عن ابن شهاب عن أبي سلمة بن عبد الرحمن عن أبي هريرة أن امرأتين من هذيل في زمان رسول الله صلى الله عليه وسلم رمت إحداهما الأخرى فطرحت جنينها فقضى فيه رسول الله صلى الله عليه وسلم بغرة عبد أو وليدة 	 It was narrated from Abu Hurairah that: there were two women of Hudhail during the time of the Messenger of Allah, one of whom threw something at the other and caused her to miscarry. The Messenger of Allah ruled that (Diyah of ) a male or female slave be paid for that. (Sahih) 
nasai45_1148350	not identified	 قال الحارث بن مسكين قراءة عليه وأنا أسمع عن ابن القاسم قال حدثني مالك عن ابن شهاب عن سعيد بن المسيب أن رسول الله صلى الله عليه وسلم قضى في الجنين يقتل في بطن أمه بغرة عبد أو وليدة فقال الذي قضى عليه كيف أغرم من لا شرب ولا أكل ولا استهل ولا نطق فمثل ذلك يطل فقال رسول الله صلى الله عليه وسلم إنما هذا من الكهان 	 قال الحارث بن مسكين قراءة عليه وأنا أسمع عن ابن القاسم قال حدثني مالك عن ابن شهاب عن سعيد بن المسيب أن رسول الله صلى الله عليه وسلم قضى في الجنين يقتل في بطن أمه بغرة عبد أو وليدة فقال الذي قضى عليه كيف أغرم من لا شرب ولا أكل ولا استهل ولا نطق فمثل ذلك يطل فقال رسول الله صلى الله عليه وسلم إنما هذا من الكهان 	" It was narrated from Sa'eed bin Al-Musayyab that: the Messenger of Allah ruled that for a fetus which is killed in the mother's womb, a male or female slave be given (as Diyah). The one against whom he passed this ruling said: ""How can I pay blood money for one who neither ate nor drank, or shouted or cried (at the moment of birth)? Such a one should be overlooked."" The Messenger of Allah said: ""This is one of the soothsayers.""'(Sahih) "
nasai45_1148360	 أخبرنا علي بن محمد بن علي قال حدثنا خلف وهو ابن تميم قال حدثنا زائدة عن منصور عن إبراهيم عن عبيد بن نضيلة عن المغيرة بن	عن شعبة أن امرأة ضربت ضرتها بعمود فسطاط فقتلتها وهي حبلى فأتي فيها النبي صلى الله عليه وسلم فقضى رسول الله صلى الله عليه وسلم على عصبة القاتلة بالدية وفي الجنين غرة فقال عصبتها أدي من لا طعم ولا شرب ولا صاح فاستهل فمثل هذا يطل فقال النبي صلى الله عليه وسلم أسجع كسجع الأعراب 	 أخبرنا علي بن محمد بن علي قال حدثنا خلف وهو ابن تميم قال حدثنا زائدة عن منصور عن إبراهيم عن عبيد بن نضيلة عن المغيرة بن شعبة أن امرأة ضربت ضرتها بعمود فسطاط فقتلتها وهي حبلى فأتي فيها النبي صلى الله عليه وسلم فقضى رسول الله صلى الله عليه وسلم على عصبة القاتلة بالدية وفي الجنين غرة فقال عصبتها أدي من لا طعم ولا شرب ولا صاح فاستهل فمثل هذا يطل فقال النبي صلى الله عليه وسلم أسجع كسجع الأعراب 	" It was narrated from Al-Mughirah bin Shu'bah that: a woman struck her co-wife with a tent pole and killed her, and she (the slain woman) was pregnant. She was brought to the Prophet, and the Messenger of Allah ruled that the 'Asabah of the killer should pay the Diyah , and a slavae (should be paid) for the fetus. Her 'Asabah said: ""Should Diyah be paid for one who neither ate nor drank, or shouted or cried (at the moment of birth)? Such a one should be overlooked."" The prophet said: ""Rhyming verse like the verse of the Bedouins."" (Sahih) "
nasai45_1148370	 أخبرنا محمد بن قدامة قال حدثنا جرير عن منصور عن إبراهيم عن عبيد بن نضيلة الخزاعي عن المغيرة بن	عن شعبة قال ضربت امرأة ضرتها بعمود الفسطاط وهي حبلى فقتلتها فجعل رسول الله صلى الله عليه وسلم دية المقتولة على عصبة القاتلة وغرة لما في بطنها فقال رجل من عصبة القاتلة أنغرم دية من لا أكل ولا شرب ولا استهل فمثل ذلك يطل فقال رسول الله صلى الله عليه وسلم أسجع كسجع الأعراب فجعل عليهم الدية 	 أخبرنا محمد بن قدامة قال حدثنا جرير عن منصور عن إبراهيم عن عبيد بن نضيلة الخزاعي عن المغيرة بن شعبة قال ضربت امرأة ضرتها بعمود الفسطاط وهي حبلى فقتلتها فجعل رسول الله صلى الله عليه وسلم دية المقتولة على عصبة القاتلة وغرة لما في بطنها فقال رجل من عصبة القاتلة أنغرم دية من لا أكل ولا شرب ولا استهل فمثل ذلك يطل فقال رسول الله صلى الله عليه وسلم أسجع كسجع الأعراب فجعل عليهم الدية 	" It was narrated that Al-Mughirah bin Shu'bah said: ""A woman struck her co-wife, who was pregnant, with a tent pole and Killed her, The Messenger of Allah ruled that the 'Asahab of the Killer was to pay the Diyah and to give a slave (as Diyah for ) the child in her womb. One of the'Asabah of the killer said: 'Am I to pay blood money for one whom neither ate nor drank, or shouted or cried (at the moment of birth)? Such a one should be overlooked. The Messenger of Allah said: 'Rhyming verse like the verse of the Bedouin?' and he made them pay the Diyah (Sahih) "
nasai45_1148380	 أخبرنا محمد بن بشار قال حدثنا عبد الرحمن قال حدثنا سفيان عن منصور عن إبراهيم عن عبيد بن	حدثنا نضيلة عن المغيرة بن شعبة أن ضرتين ضربت إحداهما الأخرى بعمود فسطاط فقتلتها فقضى رسول الله صلى الله عليه وسلم بالدية على عصبة القاتلة وقضى لما في بطنها بغرة فقال الأعرابي تغرمني من لا أكل ولا شرب ولا صاح فاستهل فمثل ذلك يطل فقال سجع كسجع الجاهلية وقضى لما في بطنها بغرة 	 أخبرنا محمد بن بشار قال حدثنا عبد الرحمن قال حدثنا سفيان عن منصور عن إبراهيم عن عبيد بن نضيلة عن المغيرة بن شعبة أن ضرتين ضربت إحداهما الأخرى بعمود فسطاط فقتلتها فقضى رسول الله صلى الله عليه وسلم بالدية على عصبة القاتلة وقضى لما في بطنها بغرة فقال الأعرابي تغرمني من لا أكل ولا شرب ولا صاح فاستهل فمثل ذلك يطل فقال سجع كسجع الجاهلية وقضى لما في بطنها بغرة 	" It was narrated from Al-Mughirah bin shu'bah that: there were two co-wives, one of whom struck the other with a tent people and killed her. The Messenger of Allah ruled that the Diyah was to be paid by the 'Asabah of the killer, and that a slave should be given (as diyah) for the child in her womb. The Bedouin Said: ""Are you penalizing me for one who neither ate nor drank, or shouted or cried (at the moment of birth)? Such a one should be overlooked/"" He said: ""Rhyming verse like the verse of the Jahiliyyah,"" and he ruled that a slave should e given (as Diyah) for the child in her womb. (Sahih) "
nasai45_1148390	 أخبرنا علي بن سعيد بن مسروق قال حدثنا يحيى بن	أخبرنا أبي زائدة عن إسرائيل عن منصور عن إبراهيم عن عبيد بن نضيلة عن المغيرة بن شعبة قال ضربت امرأة من بني لحيان ضرتها بعمود الفسطاط فقتلتها وكان بالمقتولة حمل فقضى رسول الله صلى الله عليه وسلم على عصبة القاتلة بالدية ولما في بطنها بغرة 	 أخبرنا علي بن سعيد بن مسروق قال حدثنا يحيى بن أبي زائدة عن إسرائيل عن منصور عن إبراهيم عن عبيد بن نضيلة عن المغيرة بن شعبة قال ضربت امرأة من بني لحيان ضرتها بعمود الفسطاط فقتلتها وكان بالمقتولة حمل فقضى رسول الله صلى الله عليه وسلم على عصبة القاتلة بالدية ولما في بطنها بغرة 	" It was narrated that Al-Muhgirah bin Shu'bah said: ""A woman of Banu Lihyan struck her co-wife with a tent pole and killed her, and the slain woman was pregnant. The Messenger of Allah ruled that the Diyah was to be paid by the'Asbah of the killer, and that a slave should be given (as Diyah) for the child in her womb"". (Sahih) "
nasai45_1148400	 أخبرنا سويد بن نصر قال أنبأنا عبد الله عن شعبة عن منصور عن إبراهيم عن عبيد بن	عن نضيلة عن المغيرة بن شعبة أن امرأتين كانتا تحت رجل من هذيل فرمت إحداهما الأخرى بعمود فسطاط فأسقطت فاختصما إلى النبي صلى الله عليه وسلم فقالوا كيف ندي من لا صاح ولا استهل ولا شرب ولا أكل فقال النبي صلى الله عليه وسلم أسجع كسجع الأعراب فقضى بالغرة على عاقلة المرأة 	 أخبرنا سويد بن نصر قال أنبأنا عبد الله عن شعبة عن منصور عن إبراهيم عن عبيد بن نضيلة عن المغيرة بن شعبة أن امرأتين كانتا تحت رجل من هذيل فرمت إحداهما الأخرى بعمود فسطاط فأسقطت فاختصما إلى النبي صلى الله عليه وسلم فقالوا كيف ندي من لا صاح ولا استهل ولا شرب ولا أكل فقال النبي صلى الله عليه وسلم أسجع كسجع الأعراب فقضى بالغرة على عاقلة المرأة 	" It was narrated from Al-Muhgirah b in Shu'bad that: two woman were married to a man of Hudhail, and one of them threw tent pole at the other and caused her to miscarry. They referred the dispute to the Prophet and they said: ""how can we pay the Diyah for one who neither shouted nor cried (at the moment of birth), or ate or drank? Such a one should be overlooked."" He said: ""Rhyming verse like the verse of the Bedouins?"" And the ruled that the 'Aqilah of the women should give a slave 9asdiyah). (Sahih) "
nasai45_1148410	 أخبرنا محمود بن غيلان قال حدثنا أبو داود قال حدثنا شعبة عن منصور قال سمعت إبراهيم عن عبيد بن	حدثنا نضيلة عن المغيرة بن شعبة أن رجلا من هذيل كان له امرأتان فرمت إحداهما الأخرى بعمود الفسطاط فأسقطت فقيل أرأيت من لا أكل ولا شرب ولا صاح فاستهل فقال أسجع كسجع الأعراب فقضى فيه رسول الله صلى الله عليه وسلم بغرة عبد أو أمة وجعلت على عاقلة المرأة أرسله الأعمش 	 أخبرنا محمود بن غيلان قال حدثنا أبو داود قال حدثنا شعبة عن منصور قال سمعت إبراهيم عن عبيد بن نضيلة عن المغيرة بن شعبة أن رجلا من هذيل كان له امرأتان فرمت إحداهما الأخرى بعمود الفسطاط فأسقطت فقيل أرأيت من لا أكل ولا شرب ولا صاح فاستهل فقال أسجع كسجع الأعراب فقضى فيه رسول الله صلى الله عليه وسلم بغرة عبد أو أمة وجعلت على عاقلة المرأة أرسله الأعمش 	" It was narrated form Al-Mughirahbin shu'bah that: a man of Hudhail had two wives, and one of them threw a tent pole at the o0ther and caused her to miscarry. It was said: ""What do you think of one who neither ate nor drank, or shouted nor cried (at the moment of birth)?"" he said: (Rhyming verse like the verse of the Bedouins. ""And the Messenger of Allah ruled that a make or female slave shouted be given (as dihahj) for him (the unborn child), to be paid but the'Aqila h of the woman. (Sahih) "
nasai45_1148420	 أخبرنا محمد بن رافع قال حدثنا مصعب قال حدثنا داود عن الأعمش عن	حدثنا إبراهيم قال ضربت امرأة ضرتها بحجر وهي حبلى فقتلتها فجعل رسول الله صلى الله عليه وسلم ما في بطنها غرة وجعل عقلها على عصبتها فقالوا نغرم من لا شرب ولا أكل ولا استهل فمثل ذلك يطل فقال أسجع كسجع الأعراب هو ما أقول لكم 	 أخبرنا محمد بن رافع قال حدثنا مصعب قال حدثنا داود عن الأعمش عن إبراهيم قال ضربت امرأة ضرتها بحجر وهي حبلى فقتلتها فجعل رسول الله صلى الله عليه وسلم ما في بطنها غرة وجعل عقلها على عصبتها فقالوا نغرم من لا شرب ولا أكل ولا استهل فمثل ذلك يطل فقال أسجع كسجع الأعراب هو ما أقول لكم 	" It was narrated from al-a'mash from Ibrahim who said: ""I woman struck her co-wife, who was pregnant, with a rock and killed her Messenger of Allah ruled that a slave should be given (as Diyah) for the child in her woman, and that her Diyah should be paid by her 'Asabah. They said:' should we be penalized for one who neither after nor drank, or shouted or cried (at the moment of birth)? Such a one should be overlooked.' He said: 'Rhyming vase like the vase of the Bedouisn? It is what I say to (sahih) "
nasai45_1148430	 أخبرنا أحمد بن عثمان بن حكيم قال حدثنا عمرو عن أسباط عن سماك عن عكرمة عن	عن ابن عباس قال كانت امرأتان جارتان كان بينهما صخب فرمت إحداهما الأخرى بحجر فأسقطت غلاما قد نبت شعره ميتا وماتت المرأة فقضى على العاقلة الدية فقال عمها إنها قد أسقطت يا رسول الله غلاما قد نبت شعره فقال أبو القاتلة إنه كاذب إنه والله ما استهل ولا شرب ولا أكل فمثله يطل قال النبي صلى الله عليه وسلم أسجع كسجع الجاهلية وكهانتها إن في الصبي غرة قال ابن عباس كانت إحداهما مليكة والأخرى أم غطيف 	 أخبرنا أحمد بن عثمان بن حكيم قال حدثنا عمرو عن أسباط عن سماك عن عكرمة عن ابن عباس قال كانت امرأتان جارتان كان بينهما صخب فرمت إحداهما الأخرى بحجر فأسقطت غلاما قد نبت شعره ميتا وماتت المرأة فقضى على العاقلة الدية فقال عمها إنها قد أسقطت يا رسول الله غلاما قد نبت شعره فقال أبو القاتلة إنه كاذب إنه والله ما استهل ولا شرب ولا أكل فمثله يطل قال النبي صلى الله عليه وسلم أسجع كسجع الجاهلية وكهانتها إن في الصبي غرة قال ابن عباس كانت إحداهما مليكة والأخرى أم غطيف 	" It was narrated that Ibn 'Abbas said;""There were two women neighbors between whom there was some trouble. One of them threw a rock at the other a she miscarried a boy - whose hair had already grown -0 who was or dead, and the woman died too. He ruled that the 'Aqilah had to pay the Diyah. Her paternal uncle said: 'O Messenger of Allah, she miscarried a boy whose hair had grown.' The father of the killer said: ""He is lying. By Allah he never cried or shouted (at the moment of birth), nor drank nor ate. Such a one should be overlooked.' The Prophet said: 'rhyming verse like the verse of the Jahiliyyah and of its soothsayers? A slave must be given (as Diyah) for the boy, ''' Ibn 'Abbes said; ""One of then was Mulaikah and the other was Umm Ghatif."" (Sahih) "
