nasai34_1137330	 أخبرنا محمد بن عبد الأعلى قال حدثنا خالد قال حدثنا شعبة عن عمرو بن	حدثنا دينار قال سمعت طاوسا يحدث عن زيد بن ثابت عن النبي صلى الله عليه وسلم قال العمرى هي للوارث 	 أخبرنا محمد بن عبد الأعلى قال حدثنا خالد قال حدثنا شعبة عن عمرو بن دينار قال سمعت طاوسا يحدث عن زيد بن ثابت عن النبي صلى الله عليه وسلم قال العمرى هي للوارث 	" It was narrated from Zaid bin Thabit that the Prophet said: ""'Umra (a gift given for life) belongs to the heir."" "
nasai34_1137340	 أخبرنا عمرو بن علي قال حدثنا أبو داود قال حدثنا شعبة قال أخبرني عمرو بن	حدثنا دينار قال سمعت طاوسا يحدث عن حجر المدري عن زيد بن ثابت أن رسول الله صلى الله عليه وسلم قال العمرى للوارث 	 أخبرنا عمرو بن علي قال حدثنا أبو داود قال حدثنا شعبة قال أخبرني عمرو بن دينار قال سمعت طاوسا يحدث عن حجر المدري عن زيد بن ثابت أن رسول الله صلى الله عليه وسلم قال العمرى للوارث 	" It was narrated from Zaid bin Thabit that the Messenger of Allah said: ""'Umra (a gift given for life) belongs to the heir."" "
nasai34_1137360	 أخبرنا محمد بن عبد الله بن يزيد عن سفيان عن عمرو عن طاوس عن حجر المدري عن زيد بن	عن ثابت أن النبي صلى الله عليه وسلم قضى بالعمرى للوارث 	 أخبرنا محمد بن عبد الله بن يزيد عن سفيان عن عمرو عن طاوس عن حجر المدري عن زيد بن ثابت أن النبي صلى الله عليه وسلم قضى بالعمرى للوارث 	 It was narrated from Zaid bin Thabit that the Prophet ruled that 'Umra (a gift given for life) belongs to the heir. 
nasai34_1137350	 أخبرنا محمد بن المثنى عن سفيان عن عمرو عن طاوس عن حجر المدري عن زيد بن	عن ثابت أن النبي صلى الله عليه وسلم قضى بالعمرى للوارث 	 أخبرنا محمد بن المثنى عن سفيان عن عمرو عن طاوس عن حجر المدري عن زيد بن ثابت أن النبي صلى الله عليه وسلم قضى بالعمرى للوارث 	 It was narrated from Zaid bin Thabit that the Prophet ruled that 'Umra (a gift given for life) belongs to the heir. 
nasai34_1137370	 أخبرنا محمد بن عبيد الله بن يزيد بن	أخبرنا إبراهيم قال أخبرني أبي أنه عرض على معقل عن عمرو بن دينار عن حجر المدري عن زيد بن ثابت قال قال رسول الله صلى الله عليه وسلم من أعمر شيئا فهو لمعمره محياه ومماته ولا ترقبوا فمن أرقب شيئا فهو لسبيله 	 أخبرنا محمد بن عبيد الله بن يزيد بن إبراهيم قال أخبرني أبي أنه عرض على معقل عن عمرو بن دينار عن حجر المدري عن زيد بن ثابت قال قال رسول الله صلى الله عليه وسلم من أعمر شيئا فهو لمعمره محياه ومماته ولا ترقبوا فمن أرقب شيئا فهو لسبيله 	" It was narrated that Zaid bin Thabit said: The Messenger of Allah said: ""Whoever gives a life-long gift, it belongs to the one to whom he gave it, both during his life and after his death. And do not give things on the basis of Ruqba, for whoever is given something on the basis of Ruqba, it becomes part of his estate."" "
nasai34_1137380	not identified	 أخبرني زكريا بن يحيى قال حدثنا زيد بن أخزم قال أنبأنا معاذ بن هشام قال حدثني أبي عن قتادة قال حدثنا عمرو بن دينار عن طاوس عن الحجوري عن عبد الله بن عباس عن النبي صلى الله عليه وسلم قال العمرى جائزة 	 أخبرني زكريا بن يحيى قال حدثنا زيد بن أخزم قال أنبأنا معاذ بن هشام قال حدثني أبي عن قتادة قال حدثنا عمرو بن دينار عن طاوس عن الحجوري عن عبد الله بن عباس عن النبي صلى الله عليه وسلم قال العمرى جائزة 	" It was narrated from 'Abdullah bin 'Abbas that the Prophet said: ""'Umra is permissible."" "
nasai34_1137390	 أخبرنا هارون بن محمد بن بكار بن بلال قال حدثنا أبي قال حدثنا سعيد هو ابن بشير عن عمرو بن دينار عن طاوس عن ابن عباس عن	عن النبي صلى الله عليه وسلم قال إن العمرى جائزة 	 أخبرنا هارون بن محمد بن بكار بن بلال قال حدثنا أبي قال حدثنا سعيد هو ابن بشير عن عمرو بن دينار عن طاوس عن ابن عباس عن النبي صلى الله عليه وسلم قال إن العمرى جائزة 	" It was narrated from Ibn 'Abbas that the Prophet said: ""Indeed 'Umra is permissible."" "
nasai34_1137400	 أخبرنا محمد بن حاتم قال حدثنا حبان قال أنبأنا عبد الله عن محمد بن	حدثنا إسحاق قال حدثنا مكحول عن طاوس بتل رسول الله صلى الله عليه وسلم العمرى والرقبى 	 أخبرنا محمد بن حاتم قال حدثنا حبان قال أنبأنا عبد الله عن محمد بن إسحاق قال حدثنا مكحول عن طاوس بتل رسول الله صلى الله عليه وسلم العمرى والرقبى 	 It was narrated from Tawus that the Messenger of Allah made 'Umra and Ruqba binding. 
nasai34_1137410	 أخبرنا عمرو بن علي قال حدثنا أبو داود قال حدثنا بسطام بن مسلم قال حدثنا مالك بن دينار عن عطاء عن	عن جابر أن رسول الله صلى الله عليه وسلم خطبهم فقال العمرى جائزة 	 أخبرنا عمرو بن علي قال حدثنا أبو داود قال حدثنا بسطام بن مسلم قال حدثنا مالك بن دينار عن عطاء عن جابر أن رسول الله صلى الله عليه وسلم خطبهم فقال العمرى جائزة 	" Malik bin Dinar narrated from 'Ata', from Jabir that the Messenger of Allah addressed them one day and said: ""'Umra is permissible."" "
nasai34_1137420	 أخبرنا أحمد بن سليمان قال أنبأنا عبيد الله عن إسرائيل عن عبد الكريم عن	عن عطاء قال نهى رسول الله صلى الله عليه وسلم عن العمرى والرقبى قلت وما الرقبى قال يقول الرجل للرجل هي لك حياتك فإن فعلتم فهو جائزة 	 أخبرنا أحمد بن سليمان قال أنبأنا عبيد الله عن إسرائيل عن عبد الكريم عن عطاء قال نهى رسول الله صلى الله عليه وسلم عن العمرى والرقبى قلت وما الرقبى قال يقول الرجل للرجل هي لك حياتك فإن فعلتم فهو جائزة 	" 'Abdul-Karim narrated from 'Ata', who said: ""The Messenger of Allah forbade 'Umra and Ruqba."" I said: ""What is Ruqba?"" He said: ""When one man says to another: 'This belongs to you for the rest of your life.' But if you do that, it is permissible."" "
nasai34_1137430	 أخبرنا محمد بن المثنى قال حدثنا محمد قال حدثنا شعبة قال سمعت قتادة يحدث عن عطاء عن جابر عن	عن النبي صلى الله عليه وسلم قال العمرى جائزة 	 أخبرنا محمد بن المثنى قال حدثنا محمد قال حدثنا شعبة قال سمعت قتادة يحدث عن عطاء عن جابر عن النبي صلى الله عليه وسلم قال العمرى جائزة 	" Shu'bah said: ""I heard Qatadah narrating from 'Ata', from Jabir that the Prophet said: 'Umra is permissible.'"" "
nasai34_1137440	 أخبرنا محمد بن	أخبرنا حاتم قال أنبأنا حبان قال أنبأنا عبد الله عن عبد الملك بن أبي سليمان عن عطاء قال قال رسول الله صلى الله عليه وسلم من أعطي شيئا حياته فهو له حياته وموته 	 أخبرنا محمد بن حاتم قال أنبأنا حبان قال أنبأنا عبد الله عن عبد الملك بن أبي سليمان عن عطاء قال قال رسول الله صلى الله عليه وسلم من أعطي شيئا حياته فهو له حياته وموته 	" 'Abdul-Malik bin Abi Sulaiman narrated from 'Ata' who said: ""The Messenger of Allah said: 'Whoever is given something for the rest of his life, it belongs to him for as long as he lives and after he dies.'"" "
nasai34_1137450	 أخبرنا محمد بن عبد الله بن يزيد عن سفيان عن ابن جريج عن عطاء عن	عن جابر رضى الله عنه أن رسول الله صلى الله عليه وسلم قال لا ترقبوا ولا تعمروا فمن أرقب أو أعمر شيئا فهو لورثته 	 أخبرنا محمد بن عبد الله بن يزيد عن سفيان عن ابن جريج عن عطاء عن جابر رضى الله عنه أن رسول الله صلى الله عليه وسلم قال لا ترقبوا ولا تعمروا فمن أرقب أو أعمر شيئا فهو لورثته 	" Sufyan narrated from Ibn Juraij, from 'Ata', from Jabir that the Messenger of Allah said: ""Do not give things on the basis of Ruqba or 'Umra. Whoever is given something on the basis of Ruqba or 'Umra, it belongs to his heirs."" "
nasai34_1137460	 أخبرنا إسحاق بن	أخبرنا إبراهيم قال أنبأنا عبد الرزاق قال أنبأنا ابن جريج عن عطاء أنبأنا حبيب بن أبي ثابت عن ابن عمر أن رسول الله صلى الله عليه وسلم قال لا عمرى ولا رقبى فمن أعمر شيئا أو أرقبه فهو له حياته ومماته 	 أخبرنا إسحاق بن إبراهيم قال أنبأنا عبد الرزاق قال أنبأنا ابن جريج عن عطاء أنبأنا حبيب بن أبي ثابت عن ابن عمر أن رسول الله صلى الله عليه وسلم قال لا عمرى ولا رقبى فمن أعمر شيئا أو أرقبه فهو له حياته ومماته 	" Ibn Juraij narrated from 'Ata': ""Habib bin Abi Thabit informed us from Ibn 'Umar, that the Messenger of Allah said: 'There is no 'Umra and no Ruqba. Whoever is given something on the basis of 'Umra or Ruqba, it belongs to him for the rest of his life and after he dies.'"" "
nasai34_1137470	 أخبرنا عبيد الله بن سعيد قال حدثنا محمد بن	أخبرنا بكر { قال أنبأنا ابن جريج } قال أخبرني عطاء عن حبيب بن أبي ثابت عن ابن عمر ولم يسمعه منه قال قال رسول الله صلى الله عليه وسلم لا عمرى ولا رقبى فمن أعمر شيئا أو أرقبه فهو له حياته ومماته قال عطاء هو للآخر 	 أخبرنا عبيد الله بن سعيد قال حدثنا محمد بن بكر { قال أنبأنا ابن جريج } قال أخبرني عطاء عن حبيب بن أبي ثابت عن ابن عمر ولم يسمعه منه قال قال رسول الله صلى الله عليه وسلم لا عمرى ولا رقبى فمن أعمر شيئا أو أرقبه فهو له حياته ومماته قال عطاء هو للآخر 	" Ibn Juraij said: 'Ata' informed me, from Habib bin Abi Thabit, from Ibn 'Umar -and he did not hear it from him- he said: 'Allah's Messenger said: ""There is no 'Umra and no Ruqba. Whoever is given something on the basis of 'Umra or Ruqba, it belongs to him for the rest of his life and after he dies.""' 'Ata' said: ""It belongs to the other."" "
nasai34_1137480	not identified	 أخبرني عبدة بن عبد الرحيم قال أنبأنا وكيع عن يزيد بن زياد بن أبي الجعد عن حبيب بن أبي ثابت قال سمعت ابن عمر يقول نهى رسول الله صلى الله عليه وسلم عن الرقبى وقال من أرقب رقبى فهو له 	 أخبرني عبدة بن عبد الرحيم قال أنبأنا وكيع عن يزيد بن زياد بن أبي الجعد عن حبيب بن أبي ثابت قال سمعت ابن عمر يقول نهى رسول الله صلى الله عليه وسلم عن الرقبى وقال من أرقب رقبى فهو له 	" Yazid bin Ziyad bin Abi Al-Ja'd narrated from Habib bin Abi Thabit, who said: ""I heard Ibn 'Umar say: 'The Messenger of Allah forbade Ruqba and said: ""Whoever is given something on the basis of Ruqba, it belongs to him.""'"" "
nasai34_1137490	 أخبرنا عمرو بن علي قال حدثنا أبو عاصم قال حدثنا	أخبرنا ابن جريج قال أخبرني أبو الزبير أنه سمع جابرا يقول قال رسول الله صلى الله عليه وسلم من أعمر شيئا فهو له حياته ومماته 	 أخبرنا عمرو بن علي قال حدثنا أبو عاصم قال حدثنا ابن جريج قال أخبرني أبو الزبير أنه سمع جابرا يقول قال رسول الله صلى الله عليه وسلم من أعمر شيئا فهو له حياته ومماته 	" Ibn Juraij said: ""Abu Az-Zubair informed me that he heard Jabir saying: 'The Messenger of Allah said: ""Whoever is given something on the basis of 'Umra it belongs to him for the rest of his life and after he dies.""'"" "
nasai34_1137500	not identified	 أخبرني محمد بن إبراهيم بن صدران عن بشر بن المفضل قال حدثنا الحجاج الصواف عن أبي الزبير قال حدثنا جابر قال قال رسول الله صلى الله عليه وسلم يا معشر الأنصار امسكوا عليكم يعني أموالكم لا تعمروها فإنه من أعمر شيئا فإنه لمن أعمره حياته ومماته 	 أخبرني محمد بن إبراهيم بن صدران عن بشر بن المفضل قال حدثنا الحجاج الصواف عن أبي الزبير قال حدثنا جابر قال قال رسول الله صلى الله عليه وسلم يا معشر الأنصار امسكوا عليكم يعني أموالكم لا تعمروها فإنه من أعمر شيئا فإنه لمن أعمره حياته ومماته 	" Al-Hajjaj bin As-Sawwaf narrated from Abu Az-Zubair, who said: ""Jabir said: 'The Messenger of Allah said: ""O Ansar! Hold on to your wealth, and do not give it on the basis of 'Umra. For whoever gives something on the basis of 'Umra, it belongs to the one to whom he gave it on that basis, for the rest of his life and after he dies.""'"" "
nasai34_1137510	 أخبرنا محمد بن عبد الأعلى قال حدثنا خالد عن هشام عن أبي الزبير عن	عن جابر أن رسول الله صلى الله عليه وسلم قال امسكوا عليكم أموالكم ولا تعمروها فمن أعمر شيئا حياته فهو له حياته وبعد موته 	 أخبرنا محمد بن عبد الأعلى قال حدثنا خالد عن هشام عن أبي الزبير عن جابر أن رسول الله صلى الله عليه وسلم قال امسكوا عليكم أموالكم ولا تعمروها فمن أعمر شيئا حياته فهو له حياته وبعد موته 	" Hisham narrated from Abu Az-Zubair, from Jabir, that the Messenger of Allah said: ""Hold on to your wealth and do not give it on the basis of 'Umra. For whoever is given something on the basis of 'Umra for the rest of his life, it belongs to him for the rest of his life and after his death."" "
nasai34_1137520	 أخبرنا محمد بن عبد الأعلى قال حدثنا خالد عن داود بن أبي هند عن أبي الزبير عن	عن جابر قال قال رسول الله صلى الله عليه وسلم الرقبى لمن أرقبها 	 أخبرنا محمد بن عبد الأعلى قال حدثنا خالد عن داود بن أبي هند عن أبي الزبير عن جابر قال قال رسول الله صلى الله عليه وسلم الرقبى لمن أرقبها 	" Khalid narrated from Dawud bin Abi Hind, from Abu Az-Zubair, from Jabir, who said: ""The Messenger of Allah said: 'Ruqba belongs to the one to whom it is given.'"" "
nasai34_1137530	 أخبرنا علي بن حجر قال حدثنا هشيم عن داود عن أبي الزبير عن	عن جابر قال قال رسول الله صلى الله عليه وسلم العمرى جائزة لأهلها والرقبى جائزة لأهلها 	 أخبرنا علي بن حجر قال حدثنا هشيم عن داود عن أبي الزبير عن جابر قال قال رسول الله صلى الله عليه وسلم العمرى جائزة لأهلها والرقبى جائزة لأهلها 	" Hushaim narrated from Dawud, from Abu Az-Zubair, from Jabir, who said: ""The Messenger of Allah said: 'Umra is permissible for the one to whom it is given, and Ruqba is permissible for the one to whom it is given.'"" "
nasai34_1137540	 أخبرنا محمود بن خالد قال حدثنا عمر عن الأوزاعي حدثنا ابن شهاب قال وأخبرني عمرو بن	حدثنا عثمان أنبأنا بقية بن الوليد عن الأوزاعي عن الزهري عن عروة عن جابر قال قال رسول الله صلى الله عليه وسلم من أعمر عمرى فهي له ولعقبه يرثها من يرثه من عقبه 	 أخبرنا محمود بن خالد قال حدثنا عمر عن الأوزاعي حدثنا ابن شهاب قال وأخبرني عمرو بن عثمان أنبأنا بقية بن الوليد عن الأوزاعي عن الزهري عن عروة عن جابر قال قال رسول الله صلى الله عليه وسلم من أعمر عمرى فهي له ولعقبه يرثها من يرثه من عقبه 	" Al-Awza'i narrated from Az-Zuhri, from 'Urwah, from Jabir, who said: ""The Messenger of Allah said: 'Whoever is given something on the basis of 'Umra, it belongs to him and to his descendants, and is inherited by those who inherit from him.'"" "
nasai34_1137550	 أخبرنا عيسى بن مساور قال حدثنا الوليد قال حدثنا أبو عمرو عن ابن شهاب عن أبي سلمة عن	حدثنا جابر قال قال رسول الله صلى الله عليه وسلم العمرى لمن أعمرها هي له ولعقبه يرثها من يرثه من عقبه 	 أخبرنا عيسى بن مساور قال حدثنا الوليد قال حدثنا أبو عمرو عن ابن شهاب عن أبي سلمة عن جابر قال قال رسول الله صلى الله عليه وسلم العمرى لمن أعمرها هي له ولعقبه يرثها من يرثه من عقبه 	" (A different chain) from Abu 'Amr, from Ibn Shihab, from Abu Salamah, from Jabir, who said: ""The Messenger of Allah said: 'Umra (a lifelong gift) belongs to the one to whom it was given; it belongs to him and to his heirs, and is inherited by those among his descendants who inherit from him.'"" "
nasai34_1137560	 أخبرنا محمد بن هاشم البعلبكي قال حدثنا الوليد قال حدثنا الأوزاعي عن الزهري عن عروة وأبي سلمة عن	حدثنا جابر قال قال رسول الله صلى الله عليه وسلم العمرى لمن أعمرها هي له ولعقبه يرثها من يرثه من عقبه 	 أخبرنا محمد بن هاشم البعلبكي قال حدثنا الوليد قال حدثنا الأوزاعي عن الزهري عن عروة وأبي سلمة عن جابر قال قال رسول الله صلى الله عليه وسلم العمرى لمن أعمرها هي له ولعقبه يرثها من يرثه من عقبه 	" (A different chain) from Al-Awza'i, from Az-Zuhri, from 'Urwah and Abu Salamah, from Jabir, who said: ""The Messenger of Allah said: 'Umra (a lifelong gift) belongs to the one to whom it was given; it belongs to him and to his descendants, and is inherited by those who inherit from him.'"" "
nasai34_1137570	not identified	 أخبرني محمد بن عبد الله بن عبد الرحيم قال حدثنا عمرو بن أبي سلمة الدمشقي عن أبي عمر الصنعاني عن هشام بن عروة عن أبيه عن عبد الله بن الزبير أن رسول الله صلى الله عليه وسلم قال أيما رجل أعمر رجلا عمرى له ولعقبه فهي له ولمن يرثه من عقبه موروثة 	 أخبرني محمد بن عبد الله بن عبد الرحيم قال حدثنا عمرو بن أبي سلمة الدمشقي عن أبي عمر الصنعاني عن هشام بن عروة عن أبيه عن عبد الله بن الزبير أن رسول الله صلى الله عليه وسلم قال أيما رجل أعمر رجلا عمرى له ولعقبه فهي له ولمن يرثه من عقبه موروثة 	" It was narrated from Hisham bin 'Urwah, from his father, from 'Abdullah bin Az-Zubair, that the Messenger of Allah said: ""Any man who gives a lifelong gift to another man, it belongs to him (the recipient) and to his descendants, and to those who inherit from him."" "
nasai34_1137580	 أخبرنا قتيبة بن سعيد قال حدثنا الليث عن ابن شهاب عن أبي سلمة بن عبد الرحمن عن	عن جابر قال سمعت رسول الله صلى الله عليه وسلم يقول من أعمر رجلا عمرى له ولعقبه فقد قطع قوله حقه وهي لمن أعمر ولعقبه 	 أخبرنا قتيبة بن سعيد قال حدثنا الليث عن ابن شهاب عن أبي سلمة بن عبد الرحمن عن جابر قال سمعت رسول الله صلى الله عليه وسلم يقول من أعمر رجلا عمرى له ولعقبه فقد قطع قوله حقه وهي لمن أعمر ولعقبه 	" Al-Laith narrated from Ibn Shihab, from Abu Salamah bin 'Abdur-Rahman, from Jabir, who said: ""I heard the Messenger of Allah say: 'Whoever gives a life-long gift to a man, it belongs to him and to his heirs; his words (when he gave the gift) put an end to his rights over it, and it belongs to the one to whom it was given on the basis of 'Umra, and to his heirs.'"" "
nasai34_1137590	 أخبرنا محمد بن سلمة والحارث بن	أخبرنا مسكين قراءة عليه وأنا أسمع عن ابن القاسم عن مالك عن ابن شهاب عن أبي سلمة عن جابر أن رسول الله صلى الله عليه وسلم قال أيما رجل أعمر عمرى له ولعقبه فإنها للذي يعطاها لا ترجع إلى الذي أعطاها لأنه أعطى عطاء وقعت فيه المواريث 	 أخبرنا محمد بن سلمة والحارث بن مسكين قراءة عليه وأنا أسمع عن ابن القاسم عن مالك عن ابن شهاب عن أبي سلمة عن جابر أن رسول الله صلى الله عليه وسلم قال أيما رجل أعمر عمرى له ولعقبه فإنها للذي يعطاها لا ترجع إلى الذي أعطاها لأنه أعطى عطاء وقعت فيه المواريث 	" Malik narrated from Ibn Shihab, from Abu Salamah, from Jabir that the Messenger of Allah said: ""Any man who is given a gift on the basis of 'Umra, it belongs to him and to his descendants. It belongs to the one to whom he gave it, and it cannot be taken back by the one who gave it, because he has given a gift, and it comes to the heirs of the one to whom it was given."" "
nasai34_1137600	 أخبرنا عمران بن بكار قال حدثنا أبو اليمان قال حدثنا شعيب عن الزهري قال حدثني أبو سلمة بن	حدثنا عبد الرحمن أن جابرا أخبره أن رسول الله صلى الله عليه وسلم قضى أنه من أعمر رجلا عمرى له ولعقبه فإنها للذي أعمرها يرثها من صاحبها الذي أعطاها ما وقع من مواريث الله وحقه 	 أخبرنا عمران بن بكار قال حدثنا أبو اليمان قال حدثنا شعيب عن الزهري قال حدثني أبو سلمة بن عبد الرحمن أن جابرا أخبره أن رسول الله صلى الله عليه وسلم قضى أنه من أعمر رجلا عمرى له ولعقبه فإنها للذي أعمرها يرثها من صاحبها الذي أعطاها ما وقع من مواريث الله وحقه 	" Shua'ib narrated from Az-Zuhri, who said: ""Abu Salamah bin 'Abdur-Rahman narrated to me, that Jabir told him: 'The Messenger of Allah ruled that whoever gives a lifelong gift to a man, it belongs to him and to his heirs. It belongs to the one to whom it was given, on the basis of 'Umra. It will be inherited from its recipient according to Allah's (injunctions on) inheritance and its rights.'"" "
