nasai22_1123640	not identified	 أخبرني عمرو بن هشام قال حدثنا محمد بن سلمة عن ابن إسحاق عن يحيى بن سعيد عن أبي سلمة عن عائشة قالت كان رسول الله صلى الله عليه وسلم يصوم شعبان إلا قليلا 	 أخبرني عمرو بن هشام قال حدثنا محمد بن سلمة عن ابن إسحاق عن يحيى بن سعيد عن أبي سلمة عن عائشة قالت كان رسول الله صلى الله عليه وسلم يصوم شعبان إلا قليلا 	" It was narrated that 'Aishah said: ""The Messenger of Allah used to fast (all of) Shaban except a little."" (Sahih) "
nasai22_1123650	 أخبرنا عمرو بن عثمان قال حدثنا بقية قال حدثنا بحير عن خالد بن معدان عن جبير بن	حدثنا نفير أن عائشة قالت إن رسول الله صلى الله عليه وسلم كان يصوم شعبان كله 	 أخبرنا عمرو بن عثمان قال حدثنا بقية قال حدثنا بحير عن خالد بن معدان عن جبير بن نفير أن عائشة قالت إن رسول الله صلى الله عليه وسلم كان يصوم شعبان كله 	" It was narrated from Jubair bin Nufair that 'Aishah said: ""The Messenger of Allah used to fast all of Shaban."" (Sahih) "
nasai22_1123660	 أخبرنا عمرو بن علي عن عبد الرحمن قال حدثنا ثابت بن	حدثنا قيس أبو الغصن شيخ من أهل المدينة قال حدثني أبو سعيد المقبري قال حدثني أسامة بن زيد قال قلت يا رسول الله لم أرك تصوم شهرا من الشهور ما تصوم من شعبان قال ذلك شهر يغفل الناس عنه بين رجب ورمضان وهو شهر ترفع فيه الأعمال إلى رب العالمين فأحب أن يرفع عملي وأنا صائم 	 أخبرنا عمرو بن علي عن عبد الرحمن قال حدثنا ثابت بن قيس أبو الغصن شيخ من أهل المدينة قال حدثني أبو سعيد المقبري قال حدثني أسامة بن زيد قال قلت يا رسول الله لم أرك تصوم شهرا من الشهور ما تصوم من شعبان قال ذلك شهر يغفل الناس عنه بين رجب ورمضان وهو شهر ترفع فيه الأعمال إلى رب العالمين فأحب أن يرفع عملي وأنا صائم 	" Usamah bin Zaid said: ""I said: 'O Messenger of Allah, I do not see you fasting any month as much as Shaban.' He said: 'That is a month to which people do not pay much attention, between Rajab and Ramadan. It is a month in which the deeds are taken up to the Lord of the worlds, and I like that my deeds be taken up when I am fasting.""' (Hasan) "
nasai22_1123670	 أخبرنا عمرو بن علي عن عبد الرحمن قال حدثنا ثابت بن	حدثنا قيس أبو الغصن شيخ من أهل المدينة قال حدثني أبو سعيد المقبري قال حدثني أسامة بن زيد قال قلت يا رسول الله إنك تصوم حتى لا تكاد تفطر وتفطر حتى لا تكاد أن تصوم إلا يومين إن دخلا في صيامك وإلا صمتهما قال أى يومين قلت يوم الاثنين ويوم الخميس قال ذانك يومان تعرض فيهما الأعمال على رب العالمين فأحب أن يعرض عملي وأنا صائم 	 أخبرنا عمرو بن علي عن عبد الرحمن قال حدثنا ثابت بن قيس أبو الغصن شيخ من أهل المدينة قال حدثني أبو سعيد المقبري قال حدثني أسامة بن زيد قال قلت يا رسول الله إنك تصوم حتى لا تكاد تفطر وتفطر حتى لا تكاد أن تصوم إلا يومين إن دخلا في صيامك وإلا صمتهما قال أى يومين قلت يوم الاثنين ويوم الخميس قال ذانك يومان تعرض فيهما الأعمال على رب العالمين فأحب أن يعرض عملي وأنا صائم 	" Usamah bin Zaid said: ""I said: 'O Messenger of Allah, sometimes you fast, and you hardly ever break your hardly ever fast, except two days which, if you are fasting, you include them in your fast, and if you are not fasting, then you fast them on your own.' He said: 'Which two days?' I said: 'Monday and Thursday.' He said: 'Those are two days in which deeds are shown to the Lord of the worlds, and I like my deeds to be shown (to Him) when I am fasting.""'(Hasan) "
nasai22_1123680	 أخبرنا أحمد بن سليمان قال حدثنا زيد بن	أخبرنا الحباب قال أخبرني ثابت بن قيس الغفاري قال حدثني أبو سعيد المقبري قال حدثني أبو هريرة عن أسامة بن زيد أن رسول الله صلى الله عليه وسلم كان يسرد الصوم فيقال لا يفطر ويفطر فيقال لا يصوم 	 أخبرنا أحمد بن سليمان قال حدثنا زيد بن الحباب قال أخبرني ثابت بن قيس الغفاري قال حدثني أبو سعيد المقبري قال حدثني أبو هريرة عن أسامة بن زيد أن رسول الله صلى الله عليه وسلم كان يسرد الصوم فيقال لا يفطر ويفطر فيقال لا يصوم 	 It was narrated from Usamah bin Zaid: That the Messenger of Allah used to fast continually and it ws said that he would not break his fast, and he used not to fast and it was said that he would not fast. (Hasan) 
nasai22_1123690	 أخبرنا عمرو بن عثمان عن بقية قال حدثنا بحير عن خالد بن معدان عن جبير بن	عن نفير أن عائشة قالت إن رسول الله صلى الله عليه وسلم كان يتحرى صيام الاثنين والخميس 	 أخبرنا عمرو بن عثمان عن بقية قال حدثنا بحير عن خالد بن معدان عن جبير بن نفير أن عائشة قالت إن رسول الله صلى الله عليه وسلم كان يتحرى صيام الاثنين والخميس 	" It was narrate from Jubair bin Nufair that 'Aishah said: ""The Messenger of Allah used to be keen to fast on Mondays and Thursday."" (Hasan) "
nasai22_1123700	 أخبرنا عمرو بن علي قال حدثنا عبد الله بن	أخبرنا داود قال أخبرني ثور عن خالد بن معدان عن ربيعة الجرشي عن عائشة قالت كان رسول الله صلى الله عليه وسلم يتحرى يوم الاثنين والخميس 	 أخبرنا عمرو بن علي قال حدثنا عبد الله بن داود قال أخبرني ثور عن خالد بن معدان عن ربيعة الجرشي عن عائشة قالت كان رسول الله صلى الله عليه وسلم يتحرى يوم الاثنين والخميس 	" It was narrated that 'Aishah said: ""The Messenger of Allah used to be keen to fast on Mondays and Thursday."" (Hasan) "
nasai22_1123710	 أخبرنا إسحاق بن إبراهيم قال أنبأنا عبيد الله بن	أخبرنا سعيد الأموي قال حدثنا سفيان عن ثور عن خالد بن معدان عن عائشة قالت كان رسول الله صلى الله عليه وسلم يتحرى الاثنين والخميس 	 أخبرنا إسحاق بن إبراهيم قال أنبأنا عبيد الله بن سعيد الأموي قال حدثنا سفيان عن ثور عن خالد بن معدان عن عائشة قالت كان رسول الله صلى الله عليه وسلم يتحرى الاثنين والخميس 	" It was narrated that 'Aishah said: ""The Messenger of Allah used to be keen to fast on Mondays and Thursday."" (Hasan) "
nasai22_1123720	 أخبرنا أحمد بن سليمان قال حدثنا أبو داود عن سفيان عن منصور عن خالد بن سعد عن	عن عائشة قالت كان رسول الله صلى الله عليه وسلم يتحرى يوم الاثنين والخميس 	 أخبرنا أحمد بن سليمان قال حدثنا أبو داود عن سفيان عن منصور عن خالد بن سعد عن عائشة قالت كان رسول الله صلى الله عليه وسلم يتحرى يوم الاثنين والخميس 	" It was narrated that 'Aishah said: ""The Messenger of Allah used to be keen to fast on Mondays and Thursday."" (Hasan) "
nasai22_1123730	 أخبرنا إسحاق بن إبراهيم بن حبيب بن الشهيد قال حدثنا يحيى بن يمان عن سفيان عن عاصم عن المسيب بن رافع عن سواء الخزاعي عن	عن عائشة قالت كان النبي صلى الله عليه وسلم يصوم الاثنين والخميس 	 أخبرنا إسحاق بن إبراهيم بن حبيب بن الشهيد قال حدثنا يحيى بن يمان عن سفيان عن عاصم عن المسيب بن رافع عن سواء الخزاعي عن عائشة قالت كان النبي صلى الله عليه وسلم يصوم الاثنين والخميس 	" It was narrated that 'Aishah said: ""The Messenger of Allah used to be keen to fast on Mondays and Thursday."" (Hasan) "
nasai22_1123740	not identified	 أخبرني أبو بكر بن علي قال حدثنا أبو نصر التمار قال حدثنا حماد بن سلمة عن عاصم عن سواء عن أم سلمة قالت كان رسول الله صلى الله عليه وسلم يصوم من كل شهر ثلاثة أيام الاثنين والخميس من هذه الجمعة والاثنين من المقبلة 	 أخبرني أبو بكر بن علي قال حدثنا أبو نصر التمار قال حدثنا حماد بن سلمة عن عاصم عن سواء عن أم سلمة قالت كان رسول الله صلى الله عليه وسلم يصوم من كل شهر ثلاثة أيام الاثنين والخميس من هذه الجمعة والاثنين من المقبلة 	" It was narrated that Umm Salamah said: ""The Messenger of Allah used to fast three days of every month: the Monday and Thursday of the first week and the Monday of the following week."" (Sahih) "
nasai22_1123750	not identified	 أخبرني زكريا بن يحيى قال حدثنا إسحاق قال أنبأنا النضر قال أنبأنا حماد عن عاصم بن أبي النجود عن سواء عن حفصة قالت كان رسول الله صلى الله عليه وسلم يصوم من كل شهر يوم الخميس ويوم الاثنين ومن الجمعة الثانية يوم الاثنين 	 أخبرني زكريا بن يحيى قال حدثنا إسحاق قال أنبأنا النضر قال أنبأنا حماد عن عاصم بن أبي النجود عن سواء عن حفصة قالت كان رسول الله صلى الله عليه وسلم يصوم من كل شهر يوم الخميس ويوم الاثنين ومن الجمعة الثانية يوم الاثنين 	" It was narrated that Hafsah said: ""The Messenger of Allah used to fast Thursday and Monday of each month, and Monday of the following week."" (Hasan) "
nasai22_1123760	 أخبرنا القاسم بن زكريا بن دينار قال حدثنا حسين عن زائدة عن عاصم عن المسيب عن	عن حفصة قالت كان رسول الله صلى الله عليه وسلم إذا أخذ مضجعه جعل كفه اليمنى تحت خده الأيمن وكان يصوم الاثنين والخميس 	 أخبرنا القاسم بن زكريا بن دينار قال حدثنا حسين عن زائدة عن عاصم عن المسيب عن حفصة قالت كان رسول الله صلى الله عليه وسلم إذا أخذ مضجعه جعل كفه اليمنى تحت خده الأيمن وكان يصوم الاثنين والخميس 	" It was narrated that Hafsah said: ""When the Messenger of Allah would lie down, he would place his right hand under his right cheek, and he used to fast on Mondays and Thursday."" (Sahih) "
nasai22_1123770	 أخبرنا محمد بن علي بن الحسن بن	أخبرنا شقيق قال أبي أنبأنا أبو حمزة عن عاصم عن زر عن عبد الله بن مسعود قال كان رسول الله صلى الله عليه وسلم يصوم ثلاثة أيام من غرة كل شهر وقلما يفطر يوم الجمعة 	 أخبرنا محمد بن علي بن الحسن بن شقيق قال أبي أنبأنا أبو حمزة عن عاصم عن زر عن عبد الله بن مسعود قال كان رسول الله صلى الله عليه وسلم يصوم ثلاثة أيام من غرة كل شهر وقلما يفطر يوم الجمعة 	" It was narrated that 'Abdullah bin Masud said: ""The Messenger of Allah used to fast three days in the middle of every month, and he rarely did not fast on Friday."" (Hasan) "
nasai22_1123780	 أخبرنا زكريا بن يحيى قال حدثنا أبو كامل قال حدثنا أبو عوانة عن عاصم بن بهدلة عن رجل عن الأسود بن هلال عن	عن أبي هريرة قال أمرني رسول الله صلى الله عليه وسلم بركعتى الضحى وأن لا أنام إلا على وتر وصيام ثلاثة أيام من الشهر 	 أخبرنا زكريا بن يحيى قال حدثنا أبو كامل قال حدثنا أبو عوانة عن عاصم بن بهدلة عن رجل عن الأسود بن هلال عن أبي هريرة قال أمرني رسول الله صلى الله عليه وسلم بركعتى الضحى وأن لا أنام إلا على وتر وصيام ثلاثة أيام من الشهر 	" It was narrated that Abu Hurairah said: ""The Messenger of Allah commanded me to pray two Rakahs of Duha, and not to sleep until I had prayed witr, and to fast here days each month."" (Sahih) "
nasai22_1123790	 أخبرنا قتيبة قال حدثنا سفيان عن عبيد الله أنه سمع ابن عباس وسئل عن	عن صيام عاشوراء قال ما علمت النبي صلى الله عليه وسلم صام يوما يتحرى فضله على الأيام إلا هذا اليوم يعني شهر رمضان ويوم عاشوراء 	 أخبرنا قتيبة قال حدثنا سفيان عن عبيد الله أنه سمع ابن عباس وسئل عن صيام عاشوراء قال ما علمت النبي صلى الله عليه وسلم صام يوما يتحرى فضله على الأيام إلا هذا اليوم يعني شهر رمضان ويوم عاشوراء 	" It was narrated from 'Ubaidullah that: he heard Ibn 'Abbas, when he was asked about the fast of 'Ashura' say: ""I do not know that the Prophet fasted any day because of its virtue, except this day"" meaning the month of Ramadan and the day of Ashura.' (Sahih) "
nasai22_1123800	 أخبرنا قتيبة عن سفيان عن الزهري عن حميد بن	أخبرنا عبد الرحمن بن عوف قال سمعت معاوية يوم عاشوراء وهو على المنبر يقول يا أهل المدينة أين علماؤكم سمعت رسول الله صلى الله عليه وسلم يقول في هذا اليوم إني صائم فمن شاء أن يصوم فليصم 	 أخبرنا قتيبة عن سفيان عن الزهري عن حميد بن عبد الرحمن بن عوف قال سمعت معاوية يوم عاشوراء وهو على المنبر يقول يا أهل المدينة أين علماؤكم سمعت رسول الله صلى الله عليه وسلم يقول في هذا اليوم إني صائم فمن شاء أن يصوم فليصم 	" It was narrated that Humaid bin 'Abdur-Rahman bin 'Awf said: ""I heard Mu'awiyah say on the day of 'Ashura when he was on the Mindar: O people of Al-Madinah, where are your scholars? I heard the Messenger of Allah say on this day: ""I am fasting, so whoever wants to fast let him do so."" (Sahih) "
nasai22_1123810	not identified	 أخبرني زكريا بن يحيى قال حدثنا شيبان قال حدثنا أبو عوانة عن الحر بن صياح عن هنيدة بن خالد عن امرأته قالت حدثتني بعض نساء النبي صلى الله عليه وسلم أن النبي صلى الله عليه وسلم كان يصوم يوم عاشوراء وتسعا من ذي الحجة وثلاثة أيام من الشهر أول اثنين من الشهر وخميسين 	 أخبرني زكريا بن يحيى قال حدثنا شيبان قال حدثنا أبو عوانة عن الحر بن صياح عن هنيدة بن خالد عن امرأته قالت حدثتني بعض نساء النبي صلى الله عليه وسلم أن النبي صلى الله عليه وسلم كان يصوم يوم عاشوراء وتسعا من ذي الحجة وثلاثة أيام من الشهر أول اثنين من الشهر وخميسين 	" It was narrated from Hunaidah bin Khalid that his wife said: ""One of the wives of the Prophet said: ""The Prophet used to fast on the day of 'Ashura, nine days of Dhul-Hijjiah and three days each month: The first Monday of the month, and two Thursday."" (Sahih) "
nasai22_1123820	not identified	 أخبرني حاجب بن سليمان قال حدثنا الحارث بن عطية قال حدثنا الأوزاعي عن عطاء بن أبي رباح عن عبد الله بن عمر قال قال رسول الله صلى الله عليه وسلم من صام الأبد فلا صام 	 أخبرني حاجب بن سليمان قال حدثنا الحارث بن عطية قال حدثنا الأوزاعي عن عطاء بن أبي رباح عن عبد الله بن عمر قال قال رسول الله صلى الله عليه وسلم من صام الأبد فلا صام 	" It was narrated that 'Abdullah bin 'Umar said: ""The Messenger of Allah said: 'Whoever fasts every day of his life, then he has not fasted.""' (Sahih) "
nasai22_1123830	 حدثنا عيسى بن مساور عن الوليد قال حدثنا الأوزاعي قال أخبرني عطاء عن عبد الله ح وأنبأنا محمد بن	عن عبد الله قال حدثني الوليد عن الأوزاعي قال حدثنا عطاء عن عبد الله بن عمر قال قال رسول الله صلى الله عليه وسلم من صام الأبد فلا صام ولا أفطر 	 حدثنا عيسى بن مساور عن الوليد قال حدثنا الأوزاعي قال أخبرني عطاء عن عبد الله ح وأنبأنا محمد بن عبد الله قال حدثني الوليد عن الأوزاعي قال حدثنا عطاء عن عبد الله بن عمر قال قال رسول الله صلى الله عليه وسلم من صام الأبد فلا صام ولا أفطر 	" It was narrated that 'Abdullah bin 'Umar said: ""The Messenger of Allah said: 'Whoever fasts every day of is life, then he has neither fasted, nor broken the fast."" (Sahih) "
nasai22_1123840	 أخبرنا العباس بن الوليد قال حدثنا أبي وعقبة عن الأوزاعي قال حدثني عطاء قال حدثني	عن من سمع ابن عمر يقول قال النبي صلى الله عليه وسلم من صام الأبد فلا صام 	 أخبرنا العباس بن الوليد قال حدثنا أبي وعقبة عن الأوزاعي قال حدثني عطاء قال حدثني من سمع ابن عمر يقول قال النبي صلى الله عليه وسلم من صام الأبد فلا صام 	" 'Ata said: ""someone who heard him told me that Ibn 'Umar (said) that the Prophet said: 'Whoever fasts every day of his life, then he has not fasted."" (Sahih) "
nasai22_1123850	 أخبرنا إسماعيل بن يعقوب قال حدثنا محمد بن	أخبرنا موسى قال حدثنا أبي عن الأوزاعي عن عطاء قال حدثني من سمع ابن عمر أن النبي صلى الله عليه وسلم قال من صام الأبد فلا صام 	 أخبرنا إسماعيل بن يعقوب قال حدثنا محمد بن موسى قال حدثنا أبي عن الأوزاعي عن عطاء قال حدثني من سمع ابن عمر أن النبي صلى الله عليه وسلم قال من صام الأبد فلا صام 	" 'Ata said: ""someone who heard him told me that Ibn 'Umar (said) that the Prophet said: 'Whoever fasts every day of his life, then he has not fasted."" (Sahih) "
nasai22_1123860	 أخبرنا أحمد بن إبراهيم بن محمد قال حدثنا ابن عائذ قال حدثنا يحيى عن الأوزاعي عن عطاء أنه حدثه قال حدثني من سمع عبد الله بن عمرو بن	حدثني العاص قال قال رسول الله صلى الله عليه وسلم من صام الأبد فلا صام ولا أفطر 	 أخبرنا أحمد بن إبراهيم بن محمد قال حدثنا ابن عائذ قال حدثنا يحيى عن الأوزاعي عن عطاء أنه حدثه قال حدثني من سمع عبد الله بن عمرو بن العاص قال قال رسول الله صلى الله عليه وسلم من صام الأبد فلا صام ولا أفطر 	" It was narrated from 'Ata that he narrated that someone who heard him said that 'Abdullah bin 'Amr bin AL-As said: ""The Messenger of Allah said: 'The one who fasts every day of his life has neither fasted, nor broken the fast.""' 'Ata said: ""someone who heard him told me that Ibn 'Umar (said) that the Prophet said: 'Whoever fasts every day of his life, then he has not fasted."" (Sahih) "
nasai22_1123870	not identified	 أخبرني إبراهيم بن الحسن قال حدثنا حجاج بن محمد قال قال ابن جريج سمعت عطاء أن أبا العباس الشاعر أخبره أنه سمع عبد الله بن عمرو بن العاص قال بلغ النبي صلى الله عليه وسلم أني أصوم أسرد الصوم وساق الحديث قال قال عطاء لا أدري كيف ذكر صيام الأبد لا صام من صام الأبد 	 أخبرني إبراهيم بن الحسن قال حدثنا حجاج بن محمد قال قال ابن جريج سمعت عطاء أن أبا العباس الشاعر أخبره أنه سمع عبد الله بن عمرو بن العاص قال بلغ النبي صلى الله عليه وسلم أني أصوم أسرد الصوم وساق الحديث قال قال عطاء لا أدري كيف ذكر صيام الأبد لا صام من صام الأبد 	" 'Abdullah bin 'Amr bin Al-As said: ""The Prophet heard that I was fasting continually,"" and he quoted this Hadith. 'Ata said: ""I am not sure how he put it, but I think he said: 'There is no fast for one who fats continually."" 'Ata said: ""someone who heard him told me that Ibn 'Umar (said) that the Prophet said: 'Whoever fasts every day of his life, then he has not fasted."" (Sahih) "
nasai22_1123880	 أخبرنا علي بن حجر قال أنبأنا إسماعيل عن الجريري عن يزيد بن عبد الله بن الشخير عن أخيه مطرف عن	عن عمران قال قيل يا رسول الله إن فلانا لا يفطر نهارا الدهر قال لا صام ولا أفطر 	 أخبرنا علي بن حجر قال أنبأنا إسماعيل عن الجريري عن يزيد بن عبد الله بن الشخير عن أخيه مطرف عن عمران قال قيل يا رسول الله إن فلانا لا يفطر نهارا الدهر قال لا صام ولا أفطر 	" It was narrated that 'Imran said: ""It was said: 'O Messenger of Allah, so and so never broke his fast, even for one day for the rest of his life.' He said: 'He has neither fasted nor broken his fast."""" 'Ata said: ""someone who heard him told me that Ibn 'Umar (said) that the Prophet said: 'Whoever fasts every day of his life, then he has not fasted."" (Sahih) "
nasai22_1123890	not identified	 أخبرني عمرو بن هشام قال حدثنا مخلد عن الأوزاعي عن قتادة عن مطرف بن عبد الله بن الشخير أخبرني أبي أنه سمع رسول الله صلى الله عليه وسلم وذكر عنده رجل يصوم الدهر قال لا صام ولا أفطر 	 أخبرني عمرو بن هشام قال حدثنا مخلد عن الأوزاعي عن قتادة عن مطرف بن عبد الله بن الشخير أخبرني أبي أنه سمع رسول الله صلى الله عليه وسلم وذكر عنده رجل يصوم الدهر قال لا صام ولا أفطر 	" It was narrated from Mutarrif bin 'Abdullah bin 'Abdullah bin Ash-Shikhkhir: ""My father told me that he heard the Messenger of Allah say, when mention was made in his presence of a man who fasted for the rest of his life: 'He neither fasted nor broke his fast.""' 'Ata said: ""someone who heard him told me that Ibn 'Umar (said) that the Prophet said: 'Whoever fasts every day of his life, then he has not fasted."" (Sahih) "
