nasai46_1149700	 أخبرنا عبد الحميد بن محمد قال حدثنا مخلد قال حدثنا ابن جريج عن عطاء عن أيمن مولى ابن عمر عن تبيع عن	عن كعب قال من توضأ فأحسن وضوءه ثم شهد صلاة العتمة في جماعة ثم صلى إليها أربعا مثلها يقرأ فيها ويتم ركوعها وسجودها كان له من الأجر مثل ليلة القدر 	 أخبرنا عبد الحميد بن محمد قال حدثنا مخلد قال حدثنا ابن جريج عن عطاء عن أيمن مولى ابن عمر عن تبيع عن كعب قال من توضأ فأحسن وضوءه ثم شهد صلاة العتمة في جماعة ثم صلى إليها أربعا مثلها يقرأ فيها ويتم ركوعها وسجودها كان له من الأجر مثل ليلة القدر 	" It was narrated that Ka'b said: ""Whoever performs Wudu and performs Wudu well, then attends Isha prayer in congregation, then prays four similar Rakahs after that, reciting therein and bowing and prostrating perfectly, that will bring him a reward like that of (praying) Lailat Al-Qadar."" (Hasan Maqtu) "
nasai46_1149710	 أخبرنا خلاد بن أسلم عن عبد الله بن إدريس عن محمد بن إسحاق عن عمرو بن شعيب عن أبيه عن	عن جده قال كان ثمن المجن على عهد رسول الله صلى الله عليه وسلم عشرة دراهم 	 أخبرنا خلاد بن أسلم عن عبد الله بن إدريس عن محمد بن إسحاق عن عمرو بن شعيب عن أبيه عن جده قال كان ثمن المجن على عهد رسول الله صلى الله عليه وسلم عشرة دراهم 	" It was narrated from 'Amr bin Shuaib, from his father, that his grandfather said: ""The price of a shield at the time of the Messenger of Allah was ten Dirhams."" (Hasan) "
nasai46_1149720	 أخبرنا قتيبة قال حدثنا أبو عوانة عن عبيد الله بن	أخبرنا الأخنس عن عمرو بن شعيب عن أبيه عن جده قال سئل رسول الله صلى الله عليه وسلم في كم تقطع اليد قال لا تقطع اليد في ثمر معلق فإذا ضمه الجرين قطعت في ثمن المجن ولا تقطع في حريسة الجبل فإذا آوى المراح قطعت في ثمن المجن 	 أخبرنا قتيبة قال حدثنا أبو عوانة عن عبيد الله بن الأخنس عن عمرو بن شعيب عن أبيه عن جده قال سئل رسول الله صلى الله عليه وسلم في كم تقطع اليد قال لا تقطع اليد في ثمر معلق فإذا ضمه الجرين قطعت في ثمن المجن ولا تقطع في حريسة الجبل فإذا آوى المراح قطعت في ثمن المجن 	" It was narrated from 'Amr bin Shuaib, from his father, that his grandfather said: ""The Messenger of Allah was asked: 'For how much is the hand (of the thief) to be cut off?' He said: 'The hand (of the thief) is not to be cut off for (stealing) fruit on the tree, but if (the fruit) has been taken to the place where it is stored to dry, then the (thief's) hand is to be cut off (if what is stolen is equivalent to) the price of a shield. The (thief's) hand is not to be cut off for a sheep (stolen) from the grazing land, but if it had been put in the pen, then the (thief's) hand is to be cut off (if what is stolen is equivalent to) the price of a shield.""' (Hasan) "
nasai46_1149730	 أخبرنا قتيبة قال حدثنا الليث عن ابن عجلان عن عمرو بن شعيب عن أبيه عن جده عبد الله بن عمرو عن رسول الله صلى الله عليه وسلم أنه سئل عن	عن الثمر المعلق فقال ما أصاب من ذي حاجة غير متخذ خبنة فلا شىء عليه ومن خرج بشىء منه فعليه غرامة مثليه والعقوبة ومن سرق شيئا منه بعد أن يئويه الجرين فبلغ ثمن المجن فعليه القطع ومن سرق دون ذلك فعليه غرامة مثليه والعقوبة 	 أخبرنا قتيبة قال حدثنا الليث عن ابن عجلان عن عمرو بن شعيب عن أبيه عن جده عبد الله بن عمرو عن رسول الله صلى الله عليه وسلم أنه سئل عن الثمر المعلق فقال ما أصاب من ذي حاجة غير متخذ خبنة فلا شىء عليه ومن خرج بشىء منه فعليه غرامة مثليه والعقوبة ومن سرق شيئا منه بعد أن يئويه الجرين فبلغ ثمن المجن فعليه القطع ومن سرق دون ذلك فعليه غرامة مثليه والعقوبة 	" It was narrated from 'Amr bin Shuaib, from his father, that his grandfather 'Abdullah bin 'Amr, that the Messenger of Allah wsa asked about fruit on the tree. He said: ""Whatever a needy person takes without putting any in his pocket (and taking it away), there is no penalty on him. But whoever takes anything away, he must pay a penalty of twice its value, and be punished. Whoever steals something after it has been stored properly, and its value is equal to that of a shield, his hand must be cut off. Whoever steals something worth less than that, he must pay a penalty of twice its value and be punished."" (Hasan) "
nasai46_1149740	not identified	 قال الحارث بن مسكين قراءة عليه وأنا أسمع عن ابن وهب قال أخبرني عمرو بن الحارث وهشام بن سعد عن عمرو بن شعيب عن أبيه عن جده عبد الله بن عمرو أن رجلا من مزينة أتى رسول الله صلى الله عليه وسلم فقال يا رسول الله كيف ترى في حريسة الجبل فقال هي ومثلها والنكال وليس في شىء من الماشية قطع إلا فيما آواه المراح فبلغ ثمن المجن ففيه قطع اليد وما لم يبلغ ثمن المجن ففيه غرامة مثليه وجلدات نكال قال يا رسول الله كيف ترى في الثمر المعلق قال هو ومثله معه والنكال وليس في شىء من الثمر المعلق قطع إلا فيما آواه الجرين فما أخذ من الجرين فبلغ ثمن المجن ففيه القطع وما لم يبلغ ثمن المجن ففيه غرامة مثليه وجلدات نكال 	 قال الحارث بن مسكين قراءة عليه وأنا أسمع عن ابن وهب قال أخبرني عمرو بن الحارث وهشام بن سعد عن عمرو بن شعيب عن أبيه عن جده عبد الله بن عمرو أن رجلا من مزينة أتى رسول الله صلى الله عليه وسلم فقال يا رسول الله كيف ترى في حريسة الجبل فقال هي ومثلها والنكال وليس في شىء من الماشية قطع إلا فيما آواه المراح فبلغ ثمن المجن ففيه قطع اليد وما لم يبلغ ثمن المجن ففيه غرامة مثليه وجلدات نكال قال يا رسول الله كيف ترى في الثمر المعلق قال هو ومثله معه والنكال وليس في شىء من الثمر المعلق قطع إلا فيما آواه الجرين فما أخذ من الجرين فبلغ ثمن المجن ففيه القطع وما لم يبلغ ثمن المجن ففيه غرامة مثليه وجلدات نكال 	" It was narrated from 'Amr bin Shuaib, from his father, that his grandfather 'Abdullah bin 'Amr, that a man from Muzainah came to the Messenger of Allah and said: 'O Messenger of Allah, what do you think about a sheep stolen from the pasture?"" He said: ""(The thief must pay) double and be punished. There is no cutting off of the hand for (stealing) livestock, except what which has been put in the pen, if its value is equal to that of a shield, in which case the (thief's) hand is to be cut off. If its value is not equal to that of a shield, then he should pay a penalty of twice its value and be flogged as a punishment."" He said: ""O Messenger of Allah! What do you think about fruit on the tree?"" He said: ""(The thief must pay) double and be punished. There is no cutting off of the hand for (stealing) fruit on the tree, except for that which has been stored properly if its value is equal to that of a shield, in which case the (thief's) hand is not equal to that of a shield, then he should pay a penalty of twice its value and be flogged as a punishment."" (Hasan) "
nasai46_1149750	 أخبرنا محمد بن خالد بن خلي قال حدثنا أبي قال حدثنا سلمة يعني ابن عبد الملك العوصي عن الحسن وهو ابن صالح عن يحيى بن سعيد عن القاسم بن محمد بن أبي بكر عن رافع بن	عن خديج قال سمعت رسول الله صلى الله عليه وسلم يقول لا قطع في ثمر ولا كثر 	 أخبرنا محمد بن خالد بن خلي قال حدثنا أبي قال حدثنا سلمة يعني ابن عبد الملك العوصي عن الحسن وهو ابن صالح عن يحيى بن سعيد عن القاسم بن محمد بن أبي بكر عن رافع بن خديج قال سمعت رسول الله صلى الله عليه وسلم يقول لا قطع في ثمر ولا كثر 	" It was narrated that Rafi bin Khadij said: ""I heard the Messenger of Allah say: 'The hand is not to be cut off for (stealing) produce or the spadix of palm trees.""' (Hasan) "
nasai46_1149760	 أخبرنا عمرو بن علي قال سمعت يحيى بن	أخبرنا سعيد القطان يقول حدثنا يحيى بن سعيد عن محمد بن يحيى بن حبان عن رافع بن خديج قال سمعت رسول الله صلى الله عليه وسلم يقول لا قطع في ثمر ولا كثر 	 أخبرنا عمرو بن علي قال سمعت يحيى بن سعيد القطان يقول حدثنا يحيى بن سعيد عن محمد بن يحيى بن حبان عن رافع بن خديج قال سمعت رسول الله صلى الله عليه وسلم يقول لا قطع في ثمر ولا كثر 	" It was narrated that Rafi bin Khadij said: ""I heard the Messenger of Allah say: 'The hand is not to be cut off for (stealing) produce or the spadix of palm trees.""' (Sahih) "
nasai46_1149770	not identified	 أخبرني يحيى بن حبيب بن عربي قال حدثنا حماد عن يحيى عن محمد بن يحيى بن حبان عن رافع بن خديج قال سمعت رسول الله صلى الله عليه وسلم يقول لا قطع في ثمر ولا كثر 	 أخبرني يحيى بن حبيب بن عربي قال حدثنا حماد عن يحيى عن محمد بن يحيى بن حبان عن رافع بن خديج قال سمعت رسول الله صلى الله عليه وسلم يقول لا قطع في ثمر ولا كثر 	" It was narrated that Rafi bin Khadij said: ""I heard the Messenger of Allah say: 'The hand is not to be cut off for (stealing) produce or the spadix of palm trees.""' (Sahih) "
nasai46_1149780	 أخبرنا عبد الرحمن بن محمد بن سلام قال حدثنا أبو معاوية عن يحيى بن سعيد عن محمد بن	حدثنا يحيى بن حبان عن رافع بن خديج قال قال رسول الله صلى الله عليه وسلم لا قطع في ثمر ولا كثر 	 أخبرنا عبد الرحمن بن محمد بن سلام قال حدثنا أبو معاوية عن يحيى بن سعيد عن محمد بن يحيى بن حبان عن رافع بن خديج قال قال رسول الله صلى الله عليه وسلم لا قطع في ثمر ولا كثر 	" It was narrated that Rafi bin Khadij said: ""I heard the Messenger of Allah say: 'The hand is not to be cut off for (stealing) produce or the spadix of palm trees.""' (Sahih) "
nasai46_1149790	 أخبرنا عبد الحميد بن محمد قال حدثنا مخلد قال حدثنا سفيان عن يحيى عن محمد بن يحيى بن	حدثنا حبان عن رافع بن خديج عن النبي صلى الله عليه وسلم قال لا قطع في ثمر ولا كثر 	 أخبرنا عبد الحميد بن محمد قال حدثنا مخلد قال حدثنا سفيان عن يحيى عن محمد بن يحيى بن حبان عن رافع بن خديج عن النبي صلى الله عليه وسلم قال لا قطع في ثمر ولا كثر 	" It was narrated that Rafi bin Khadij said: ""I heard the Messenger of Allah say: 'The hand is not to be cut off for (stealing) produce or the spadix of palm trees.""' (Sahih) "
nasai46_1149800	 أخبرنا محمد بن إسماعيل بن إبراهيم قال حدثنا أبو نعيم عن سفيان عن يحيى عن محمد بن	حدثنا يحيى بن حبان عن رافع بن خديج قال قال رسول الله صلى الله عليه وسلم لا قطع في ثمر ولا كثر 	 أخبرنا محمد بن إسماعيل بن إبراهيم قال حدثنا أبو نعيم عن سفيان عن يحيى عن محمد بن يحيى بن حبان عن رافع بن خديج قال قال رسول الله صلى الله عليه وسلم لا قطع في ثمر ولا كثر 	" It was narrated that Rafi bin Khadij said: ""I heard the Messenger of Allah say: 'The hand is not to be cut off for (stealing) produce or the spadix of palm trees.""' (Sahih) "
nasai46_1149810	 أخبرنا أحمد بن محمد بن	أخبرنا عبيد الله هو ابن أبي رجاء قال حدثنا وكيع عن سفيان عن يحيى بن سعيد عن محمد بن يحيى بن حبان عن عمه واسع عن رافع بن خديج قال قال رسول الله صلى الله عليه وسلم لا قطع في ثمر ولا كثر 	 أخبرنا أحمد بن محمد بن عبيد الله هو ابن أبي رجاء قال حدثنا وكيع عن سفيان عن يحيى بن سعيد عن محمد بن يحيى بن حبان عن عمه واسع عن رافع بن خديج قال قال رسول الله صلى الله عليه وسلم لا قطع في ثمر ولا كثر 	" It was narrated that Rafi bin Khadij said: ""I heard the Messenger of Allah say: 'The hand is not to be cut off for (stealing) produce or the spadix of palm trees.""' (Sahih) "
nasai46_1149820	 أخبرنا قتيبة قال حدثنا الليث عن يحيى بن سعيد عن محمد بن يحيى بن حبان عن عمه أن رافع بن	عن خديج قال سمعت رسول الله صلى الله عليه وسلم يقول لا قطع في ثمر ولا كثر والكثر الجمار 	 أخبرنا قتيبة قال حدثنا الليث عن يحيى بن سعيد عن محمد بن يحيى بن حبان عن عمه أن رافع بن خديج قال سمعت رسول الله صلى الله عليه وسلم يقول لا قطع في ثمر ولا كثر والكثر الجمار 	" Rafi bin Khadij said: ""I heard the Messenger of Allah say: 'The hand is not be cut off for (stealing) produce or the spadix of palm trees.""' (Sahih) "
nasai46_1149830	 أخبرنا محمد بن علي بن ميمون قال حدثنا سعيد بن	أخبرنا منصور قال حدثنا عبد العزيز بن محمد عن يحيى بن سعيد عن محمد بن يحيى بن حبان عن أبي ميمون عن رافع بن خديج أن رسول الله صلى الله عليه وسلم قال لا قطع في ثمر ولا كثر قال أبو عبد الرحمن هذا خطأ أبو ميمون لا أعرفه 	 أخبرنا محمد بن علي بن ميمون قال حدثنا سعيد بن منصور قال حدثنا عبد العزيز بن محمد عن يحيى بن سعيد عن محمد بن يحيى بن حبان عن أبي ميمون عن رافع بن خديج أن رسول الله صلى الله عليه وسلم قال لا قطع في ثمر ولا كثر قال أبو عبد الرحمن هذا خطأ أبو ميمون لا أعرفه 	" It was narrated that Rafi bin Khadij said: ""I heard the Messenger of Allah say: 'The hand is not to be cut off for (stealing) produce or the spadix of palm trees.""' (Sahih) Abu 'Abdur-Rahman (An-Nasai) said: This is a mistake, and I do not know who Abu Maimun (one of the narrators) is. "
nasai46_1149840	 أخبرنا الحسين بن منصور قال حدثنا أبو أسامة قال حدثنا يحيى بن سعيد عن محمد بن يحيى بن	حدثنا حبان عن رجل من قومه عن رافع بن خديج قال سمعت رسول الله صلى الله عليه وسلم يقول لا قطع في ثمر ولا كثر 	 أخبرنا الحسين بن منصور قال حدثنا أبو أسامة قال حدثنا يحيى بن سعيد عن محمد بن يحيى بن حبان عن رجل من قومه عن رافع بن خديج قال سمعت رسول الله صلى الله عليه وسلم يقول لا قطع في ثمر ولا كثر 	" It was narrated that Rafi bin Khadij said: ""I heard the Messenger of Allah say: 'The hand is not to be cut off for (stealing) produce or the spadix of palm trees.""' (Sahih) "
nasai46_1149850	 أخبرنا عمرو بن علي قال حدثنا بشر قال حدثنا يحيى بن سعيد أن رجلا من قومه حدثه عن عم له أن رافع بن	عن خديج قال سمعت رسول الله صلى الله عليه وسلم يقول لا قطع في ثمر ولا كثر 	 أخبرنا عمرو بن علي قال حدثنا بشر قال حدثنا يحيى بن سعيد أن رجلا من قومه حدثه عن عم له أن رافع بن خديج قال سمعت رسول الله صلى الله عليه وسلم يقول لا قطع في ثمر ولا كثر 	" It was narrated that Rafi bin Khadij said: ""I heard the Messenger of Allah say: 'The hand is not to be cut off for (stealing) produce or the spadix of palm trees.""' (Sahih) "
nasai46_1149860	 أخبرنا عبد الله بن عبد الصمد بن علي عن مخلد عن سفيان عن أبي الزبير عن جابر عن	عن رسول الله صلى الله عليه وسلم قال ليس على خائن ولا منتهب ولا مختلس قطع لم يسمعه سفيان من أبي الزبير 	 أخبرنا عبد الله بن عبد الصمد بن علي عن مخلد عن سفيان عن أبي الزبير عن جابر عن رسول الله صلى الله عليه وسلم قال ليس على خائن ولا منتهب ولا مختلس قطع لم يسمعه سفيان من أبي الزبير 	" It was narrated from Sufyan, from Abu Az-Zubair, from Jabir that: the Messenger of Allah robber and pilferer is not to be cut off."" (Sahih) Sufyan did not hear it from Abu Az-Zubair. "
nasai46_1149870	 أخبرنا محمود بن غيلان قال حدثنا أبو داود الحفري عن سفيان عن ابن جريج عن أبي الزبير عن	عن جابر قال قال رسول الله صلى الله عليه وسلم ليس على خائن ولا منتهب ولا مختلس قطع ولم يسمعه أيضا ابن جريج من أبي الزبير 	 أخبرنا محمود بن غيلان قال حدثنا أبو داود الحفري عن سفيان عن ابن جريج عن أبي الزبير عن جابر قال قال رسول الله صلى الله عليه وسلم ليس على خائن ولا منتهب ولا مختلس قطع ولم يسمعه أيضا ابن جريج من أبي الزبير 	" It was narrated from Sufyan, from Abu Az-Zubair, that Jabir said: ""The Messenger of Allah said: 'The pilferer is not to be cut off.""' (Sahih) Ibn Juraij also did not hear it from Abu Az-Zubair. Ibn Juraij also did not hear it from Abu Az-Zubair. "
nasai46_1149880	not identified	 أخبرني إبراهيم بن الحسن عن حجاج قال قال ابن جريج قال أبو الزبير عن جابر عن رسول الله صلى الله عليه وسلم ليس على المختلس قطع 	 أخبرني إبراهيم بن الحسن عن حجاج قال قال ابن جريج قال أبو الزبير عن جابر عن رسول الله صلى الله عليه وسلم ليس على المختلس قطع 	" It was narrated from Jabir that the Messenger of Allah said: ""The hand of the pilferer is not to be cut off."" (Sahih) "
nasai46_1149890	not identified	 أخبرني إبراهيم بن الحسن عن حجاج قال قال ابن جريج قال أبو الزبير قال جابر ليس على الخائن قطع قال أبو عبد الرحمن وقد روى هذا الحديث عن ابن جريج عيسى بن يونس والفضل بن موسى وابن وهب ومحمد بن ربيعة ومخلد بن يزيد وسلمة بن سعيد بصري ثقة قال ابن أبي صفوان وكان خير أهل زمانه فلم يقل أحد منهم حدثني أبو الزبير ولا أحسبه سمعه من أبي الزبير والله تعالى أعلم 	 أخبرني إبراهيم بن الحسن عن حجاج قال قال ابن جريج قال أبو الزبير قال جابر ليس على الخائن قطع قال أبو عبد الرحمن وقد روى هذا الحديث عن ابن جريج عيسى بن يونس والفضل بن موسى وابن وهب ومحمد بن ربيعة ومخلد بن يزيد وسلمة بن سعيد بصري ثقة قال ابن أبي صفوان وكان خير أهل زمانه فلم يقل أحد منهم حدثني أبو الزبير ولا أحسبه سمعه من أبي الزبير والله تعالى أعلم 	" It was narrated from Hajjaj from Ibn Juraij from Abu Az-Zubair, that Jabir said: ""The hands of the traitor is not to be cut off."" (Sahih) Abu 'Abdur-Rahman (An-Nasai) said: This Hadith had been reported from Ibn Juraij by 'Isa bin Yunus, Al-Fadl bin Musa, Ibn Wahb, Muhammad bin Rabiah, Makhlad bin Yazid, and Salamah bin Saeed from Al-Basrah, who is trustworthy and Ibn Abi Safwan said: ""He was the best of the people of his time"" and not one of them said: ""Abu Az-Zubair narrated to me"" and I do not think that he heard it from Abu Az-Zubair, and Allah knows best. "
nasai46_1149900	 أخبرنا خالد بن روح الدمشقي قال حدثنا يزيد يعني ابن خالد بن يزيد بن	حدثنا عبد الله بن موهب قال حدثنا شبابة عن المغيرة بن مسلم عن أبي الزبير عن جابر قال قال رسول الله صلى الله عليه وسلم ليس على مختلس ولا منتهب ولا خائن قطع 	 أخبرنا خالد بن روح الدمشقي قال حدثنا يزيد يعني ابن خالد بن يزيد بن عبد الله بن موهب قال حدثنا شبابة عن المغيرة بن مسلم عن أبي الزبير عن جابر قال قال رسول الله صلى الله عليه وسلم ليس على مختلس ولا منتهب ولا خائن قطع 	" It was narrated that Jabir said: ""The Messenger of Allah said: 'The hand of the pilferer, robber and traitor is not to be cut off.""' (Sahih) "
nasai46_1149910	 أخبرنا محمد بن العلاء قال حدثنا أبو خالد عن أشعث عن أبي الزبير عن	عن جابر قال ليس على خائن قطع قال أبو عبد الرحمن أشعث بن سوار ضعيف 	 أخبرنا محمد بن العلاء قال حدثنا أبو خالد عن أشعث عن أبي الزبير عن جابر قال ليس على خائن قطع قال أبو عبد الرحمن أشعث بن سوار ضعيف 	" It was narrated that Jabir said: ""The hand of the traitor is not to be cut off."" (Sahih) Abu 'Abdur-Rahman (An-Nasai) said: Ashath bin Sawwar (one of its narrators) is weak. "
