nasai45_1147440	 أخبرنا محمد بن معمر قال حدثنا يحيى بن حماد عن أبي عوانة عن إسماعيل بن سالم عن علقمة بن	عن وائل أن أباه حدثهم أن النبي صلى الله عليه وسلم أتي برجل قد قتل رجلا فدفعه إلى ولي المقتول يقتله فقال النبي صلى الله عليه وسلم لجلسائه القاتل والمقتول في النار قال فاتبعه رجل فأخبره فلما أخبره تركه قال فلقد رأيته يجر نسعته حين تركه يذهب فذكرت ذلك لحبيب فقال حدثني سعيد بن أشوع قال وذكر أن النبي صلى الله عليه وسلم أمر الرجل بالعفو 	 أخبرنا محمد بن معمر قال حدثنا يحيى بن حماد عن أبي عوانة عن إسماعيل بن سالم عن علقمة بن وائل أن أباه حدثهم أن النبي صلى الله عليه وسلم أتي برجل قد قتل رجلا فدفعه إلى ولي المقتول يقتله فقال النبي صلى الله عليه وسلم لجلسائه القاتل والمقتول في النار قال فاتبعه رجل فأخبره فلما أخبره تركه قال فلقد رأيته يجر نسعته حين تركه يذهب فذكرت ذلك لحبيب فقال حدثني سعيد بن أشوع قال وذكر أن النبي صلى الله عليه وسلم أمر الرجل بالعفو 	" It was narrated from 'Alqamah bin Wa'il that: his father told them that a man who had killed another man was brought to the Prophet and he handed him over to their of the victim to kill him. Then the Prophet said to those who were sitting with him: ""The killer and the slain will both be in Fire. ""A man went after him and told him that, and when he told him that, he left him (let him go). He (the narrator) said: ""I saw him dragging his string when he let him go. I mentioned that the Habib and he said: 'Sa'eed bin Ashwa' told me that the Prophet commanded the man to forgive him.""' (Sahih) "
nasai45_1147450	 أخبرنا عيسى بن يونس قال حدثنا ضمرة عن عبد الله بن شوذب عن ثابت البناني عن أنس بن	عن مالك أن رجلا أتى بقاتل وليه رسول الله صلى الله عليه وسلم فقال النبي صلى الله عليه وسلم اعف عنه فأبى فقال خذ الدية فأبى قال اذهب فاقتله فإنك مثله فذهب فلحق الرجل فقيل له إن رسول الله صلى الله عليه وسلم قال اقتله فإنك مثله فخلى سبيله فمر بي الرجل وهو يجر نسعته 	 أخبرنا عيسى بن يونس قال حدثنا ضمرة عن عبد الله بن شوذب عن ثابت البناني عن أنس بن مالك أن رجلا أتى بقاتل وليه رسول الله صلى الله عليه وسلم فقال النبي صلى الله عليه وسلم اعف عنه فأبى فقال خذ الدية فأبى قال اذهب فاقتله فإنك مثله فذهب فلحق الرجل فقيل له إن رسول الله صلى الله عليه وسلم قال اقتله فإنك مثله فخلى سبيله فمر بي الرجل وهو يجر نسعته 	" It was narrated from Ans bin Malik that a man brought the killer of his kinsman to the Messenger of Allah and the Prophet said: ""Forgive him."" But he refused. He said: ""Take the Diyah,"" but he refused. He said: ""Go and kill him then, for you are just like him."" So he went away, but some people caught up with the man and told him that the Messenger of Allah had said: ""Messenger of Allah had said: ""Kill him for you are just like him."" So he let him go, and the man passed by me dragging his string. (Sahih) "
nasai45_1147460	 أخبرنا الحسن بن إسحاق المروزي قال حدثني خالد بن	أخبرنا خداش قال حدثنا حاتم بن إسماعيل عن بشير بن المهاجر عن عبد الله بن بريدة عن أبيه أن رجلا جاء إلى النبي صلى الله عليه وسلم فقال إن هذا الرجل قتل أخي قال اذهب فاقتله كما قتل أخاك فقال له الرجل اتق الله واعف عني فإنه أعظم لأجرك وخير لك ولأخيك يوم القيامة قال فخلى عنه قال فأخبر النبي صلى الله عليه وسلم فسأله فأخبره بما قال له قال فأعنفه أما إنه كان خيرا مما هو صانع بك يوم القيامة يقول يا رب سل هذا فيم قتلني 	 أخبرنا الحسن بن إسحاق المروزي قال حدثني خالد بن خداش قال حدثنا حاتم بن إسماعيل عن بشير بن المهاجر عن عبد الله بن بريدة عن أبيه أن رجلا جاء إلى النبي صلى الله عليه وسلم فقال إن هذا الرجل قتل أخي قال اذهب فاقتله كما قتل أخاك فقال له الرجل اتق الله واعف عني فإنه أعظم لأجرك وخير لك ولأخيك يوم القيامة قال فخلى عنه قال فأخبر النبي صلى الله عليه وسلم فسأله فأخبره بما قال له قال فأعنفه أما إنه كان خيرا مما هو صانع بك يوم القيامة يقول يا رب سل هذا فيم قتلني 	" It was narrated from 'Abdullah bin Buraidah, from the father, that a man came to the Prophet and said: ""This man killed my brother."" He said: ""Go and kill him as he killed your brother."" The man said to him: ""Fear Allah and let me go, for that will bring you a greater reward and will be better for you and your brother on the Day of Resurrection."" So he let him go. The Prophet was told about that, so he asked him about it, and he told him what he had said. He said: ""Pardoning him would be better for you than what he would have done for you on the Day of Resurrection when he said: 'O Lord, ask him why he killed me.""' (Hasan) "
nasai45_1147470	 أخبرنا القاسم بن زكريا بن دينار قال حدثنا عبيد الله بن	حدثنا موسى قال أنبأنا علي وهو ابن صالح عن سماك عن عكرمة عن ابن عباس قال كان قريظة والنضير وكان النضير أشرف من قريظة وكان إذا قتل رجل من قريظة رجلا من النضير قتل به وإذا قتل رجل من النضير رجلا من قريظة أدى مائة وسق من تمر فلما بعث النبي صلى الله عليه وسلم قتل رجل من النضير رجلا من قريظة فقالوا ادفعوه إلينا نقتله فقالوا بيننا وبينكم النبي صلى الله عليه وسلم فأتوه فنزلت { وإن حكمت فاحكم بينهم بالقسط } والقسط النفس بالنفس ثم نزلت { أفحكم الجاهلية يبغون } 	 أخبرنا القاسم بن زكريا بن دينار قال حدثنا عبيد الله بن موسى قال أنبأنا علي وهو ابن صالح عن سماك عن عكرمة عن ابن عباس قال كان قريظة والنضير وكان النضير أشرف من قريظة وكان إذا قتل رجل من قريظة رجلا من النضير قتل به وإذا قتل رجل من النضير رجلا من قريظة أدى مائة وسق من تمر فلما بعث النبي صلى الله عليه وسلم قتل رجل من النضير رجلا من قريظة فقالوا ادفعوه إلينا نقتله فقالوا بيننا وبينكم النبي صلى الله عليه وسلم فأتوه فنزلت { وإن حكمت فاحكم بينهم بالقسط } والقسط النفس بالنفس ثم نزلت { أفحكم الجاهلية يبغون } 	" It was narrated from Simak, from 'Ikrimah, that Ibn 'Abbas said: ""There were (the two tribes of) Quraizah and An-Nadir, and An-Nadir was nobler than Quraiaah. If a man of Quraizah Killed a man of An-Nadir, he would be killed in return, but if a man of An-Nadir killed a man of Quraizah, he would pay a Diyah of one hundred Wasqs of dates. When An-Nadir killed a man of Quraizah, and they said: 'Hand him over to us and we will kill him.' They said: 'Between us and you (as judge) is the Prophet.' So they came to him, then the following was revealed: ""And if you judge, judge with justice between them.""[3] Al-Qisl (justice) means a soul for a soul. Then the following was revealed: ""Do they then seek the judgment of (the days of) Ignorance?""[4] (Da'if) "
nasai45_1147480	 أخبرنا عبيد الله بن سعد قال حدثنا عمي قال حدثنا أبي عن ابن إسحاق أخبرني داود بن الحصين عن عكرمة عن	عن ابن عباس أن الآيات التي في المائدة التي قالها الله عز وجل { فاحكم بينهم أو أعرض عنهم } إلى { المقسطين } إنما نزلت في الدية بين النضير وبين قريظة وذلك أن قتلى النضير كان لهم شرف يودون الدية كاملة وأن بني قريظة كانوا يودون نصف الدية فتحاكموا في ذلك إلى رسول الله صلى الله عليه وسلم فأنزل الله عز وجل ذلك فيهم فحملهم رسول الله صلى الله عليه وسلم على الحق في ذلك فجعل الدية سواء 	 أخبرنا عبيد الله بن سعد قال حدثنا عمي قال حدثنا أبي عن ابن إسحاق أخبرني داود بن الحصين عن عكرمة عن ابن عباس أن الآيات التي في المائدة التي قالها الله عز وجل { فاحكم بينهم أو أعرض عنهم } إلى { المقسطين } إنما نزلت في الدية بين النضير وبين قريظة وذلك أن قتلى النضير كان لهم شرف يودون الدية كاملة وأن بني قريظة كانوا يودون نصف الدية فتحاكموا في ذلك إلى رسول الله صلى الله عليه وسلم فأنزل الله عز وجل ذلك فيهم فحملهم رسول الله صلى الله عليه وسلم على الحق في ذلك فجعل الدية سواء 	" It was narrated from Dawud hin Al-Husain, from 'Ikrimah, from Ibn 'Abbas, that the Verses in AL-Ma'idah, in which Allah, the Mighty and Sublime, says: ""Either judge between them, or turn away from them. If you turn away from then up to: those who act justly.""[1] - were revealed concerning the matter of blood money between An-Nadir and Quraizah. That was because the slain of An-Nadir were of noble status, so the blood money would be paid in full for them, but for Banu Quraizah only half of the blood money would be paid. They referred the matter to the Messenger of Allah for judgment, then Allah, the Mighty and Sublime, revealed that concerning them, so the Messenger of Allah told them to do the right thing and he made the blood money equal. (Da'if) "
nasai45_1147490	not identified	 أخبرني محمد بن المثنى قال حدثنا يحيى بن سعيد قال حدثنا سعيد عن قتادة عن الحسن عن قيس بن عباد قال انطلقت أنا والأشتر إلى علي رضى الله عنه فقلنا هل عهد إليك نبي الله صلى الله عليه وسلم شيئا لم يعهده إلى الناس عامة قال لا إلا ما كان في كتابي هذا فأخرج كتابا من قراب سيفه فإذا فيه المؤمنون تكافأ دماؤهم وهم يد على من سواهم ويسعى بذمتهم أدناهم ألا لا يقتل مؤمن بكافر ولا ذو عهد بعهده من أحدث حدثا فعلى نفسه أو آوى محدثا فعليه لعنة الله والملائكة والناس أجمعين 	 أخبرني محمد بن المثنى قال حدثنا يحيى بن سعيد قال حدثنا سعيد عن قتادة عن الحسن عن قيس بن عباد قال انطلقت أنا والأشتر إلى علي رضى الله عنه فقلنا هل عهد إليك نبي الله صلى الله عليه وسلم شيئا لم يعهده إلى الناس عامة قال لا إلا ما كان في كتابي هذا فأخرج كتابا من قراب سيفه فإذا فيه المؤمنون تكافأ دماؤهم وهم يد على من سواهم ويسعى بذمتهم أدناهم ألا لا يقتل مؤمن بكافر ولا ذو عهد بعهده من أحدث حدثا فعلى نفسه أو آوى محدثا فعليه لعنة الله والملائكة والناس أجمعين 	" It was narrated that Qais bin 'Ubad said: ""Al-Ashtar and I went to 'Ali, may Allah be pleased with him, and said: Did the Prophet of Allah tell you anything that he did not tell to all the people?' He said: 'No, except what is in this letter of mine.' He brought out a letter from the sheath of his sword and it said therein: ""The lives of the believers are equal in value, and they are one against others, and they hasten to support the asylum granted by the least of them. But no believer may be killed in return for a disbeliever, nor one with a covenant while his convenant is in effect. Whoever commits an offense then the blame is on himself, and whoever gives sanctuary to an offender, then upon him will be the curse of Allah, the angels and all the people."" (Sahih) "
nasai45_1147500	not identified	 أخبرني أبو بكر بن علي قال حدثنا القواريري قال حدثنا محمد بن عبد الواحد قال حدثنا عمر بن عامر عن قتادة عن أبي حسان عن علي رضى الله عنه أن النبي صلى الله عليه وسلم قال المؤمنون تكافأ دماؤهم وهم يد على من سواهم يسعى بذمتهم أدناهم لا يقتل مؤمن بكافر ولا ذو عهد في عهده 	 أخبرني أبو بكر بن علي قال حدثنا القواريري قال حدثنا محمد بن عبد الواحد قال حدثنا عمر بن عامر عن قتادة عن أبي حسان عن علي رضى الله عنه أن النبي صلى الله عليه وسلم قال المؤمنون تكافأ دماؤهم وهم يد على من سواهم يسعى بذمتهم أدناهم لا يقتل مؤمن بكافر ولا ذو عهد في عهده 	" It was narrated from 'Ali, may Allah be please with him that the Prophet said: ""The lives of the believers are equal in value, and they are one against others, and they hasten to support the asylum granted by the least of them. But no believer may be killed in return for a disbeliever, nor one with a covenant while his covenant is in effect."" (Sahih) "
nasai45_1147510	 أخبرنا محمود بن غيلان هو المروزي قال حدثنا أبو داود الطيالسي قال حدثنا هشام عن قتادة عن الحسن عن	عن سمرة أن رسول الله صلى الله عليه وسلم قال من قتل عبده قتلناه ومن جدعه جدعناه ومن أخصاه أخصيناه 	 أخبرنا محمود بن غيلان هو المروزي قال حدثنا أبو داود الطيالسي قال حدثنا هشام عن قتادة عن الحسن عن سمرة أن رسول الله صلى الله عليه وسلم قال من قتل عبده قتلناه ومن جدعه جدعناه ومن أخصاه أخصيناه 	" It was narrated from Samurah that the Messenger of Allah said: ""Whoever kills his slave, we will kill him: whoever mutilates (his slave). We will mutilate him, and whoever castrates (his slave), we will castrate him."" (Hasan) "
nasai45_1147520	 أخبرنا نصر بن علي قال حدثنا خالد قال حدثنا سعيد عن قتادة عن الحسن عن سمرة عن	حدثنا النبي صلى الله عليه وسلم قال من قتل عبده قتلناه ومن جدع عبده جدعناه 	 أخبرنا نصر بن علي قال حدثنا خالد قال حدثنا سعيد عن قتادة عن الحسن عن سمرة عن النبي صلى الله عليه وسلم قال من قتل عبده قتلناه ومن جدع عبده جدعناه 	" It was narrated from Samurah that the Prophet said: ""Whoever kills his slave, we will kill him, and whoever mutilates his slave, we will mutilate him."" (Hasan) "
nasai45_1147530	 أخبرنا قتيبة قال حدثنا أبو عوانة عن قتادة عن الحسن عن	عن سمرة قال قال رسول الله صلى الله عليه وسلم من قتل عبده قتلناه ومن جدع عبده جدعناه 	 أخبرنا قتيبة قال حدثنا أبو عوانة عن قتادة عن الحسن عن سمرة قال قال رسول الله صلى الله عليه وسلم من قتل عبده قتلناه ومن جدع عبده جدعناه 	" It was narrated that Samurah said: ""The Prophet said: 'Whoever kills his slave, we will kill him, and whoever mutilates his slave, we will mutilate him.""' (Hasan) "
nasai45_1147540	 أخبرنا يوسف بن سعيد قال حدثنا حجاج بن محمد عن ابن جريج قال أخبرني عمرو بن	عن دينار أنه سمع طاوسا يحدث عن ابن عباس عن عمر رضى الله عنه أنه نشد قضاء رسول الله صلى الله عليه وسلم في ذلك فقام حمل بن مالك فقال كنت بين حجرتى امرأتين فضربت إحداهما الأخرى بمسطح فقتلتها وجنينها فقضى النبي صلى الله عليه وسلم في جنينها بغرة وأن تقتل بها 	 أخبرنا يوسف بن سعيد قال حدثنا حجاج بن محمد عن ابن جريج قال أخبرني عمرو بن دينار أنه سمع طاوسا يحدث عن ابن عباس عن عمر رضى الله عنه أنه نشد قضاء رسول الله صلى الله عليه وسلم في ذلك فقام حمل بن مالك فقال كنت بين حجرتى امرأتين فضربت إحداهما الأخرى بمسطح فقتلتها وجنينها فقضى النبي صلى الله عليه وسلم في جنينها بغرة وأن تقتل بها 	" 'Amr bin Dinar narrated that: he heard Tawus narrate from Ibn 'Abbas, from 'Umar, may Allah be pleased with him, that he asked about the ruling of the Messenger of Allah concerning that. Hamal bin Malik stood up and said: ""I was married to two women, and one of them struck the other with a tent pole and killed her and her fetus. The Prophet ruled that a slave be given (as Diyah) for her fetus and that she be killed (for killing the other woman)."" (Sahih) "
nasai45_1147550	 أخبرنا إسحاق بن إبراهيم قال أنبأنا عبدة عن سعيد عن قتادة عن	عن أنس رضى الله عنه أن يهوديا قتل جارية على أوضاح لها فأقاده رسول الله صلى الله عليه وسلم بها 	 أخبرنا إسحاق بن إبراهيم قال أنبأنا عبدة عن سعيد عن قتادة عن أنس رضى الله عنه أن يهوديا قتل جارية على أوضاح لها فأقاده رسول الله صلى الله عليه وسلم بها 	 It was narrated from Anas that: a Jew killed a young girl for her jewelry, so the Messenger of Allah killed him in retaliation for her. (Sahih) 
nasai45_1147560	 أخبرنا محمد بن عبد الله بن المبارك قال حدثنا أبو هشام قال حدثنا أبان بن يزيد عن قتادة عن أنس بن	عن مالك أن يهوديا أخذ أوضاحا من جارية ثم رضخ رأسها بين حجرين فأدركوها وبها رمق فجعلوا يتبعون بها الناس هو هذا هو هذا قالت نعم فأمر رسول الله صلى الله عليه وسلم فرضخ رأسه بين حجرين 	 أخبرنا محمد بن عبد الله بن المبارك قال حدثنا أبو هشام قال حدثنا أبان بن يزيد عن قتادة عن أنس بن مالك أن يهوديا أخذ أوضاحا من جارية ثم رضخ رأسها بين حجرين فأدركوها وبها رمق فجعلوا يتبعون بها الناس هو هذا هو هذا قالت نعم فأمر رسول الله صلى الله عليه وسلم فرضخ رأسه بين حجرين 	" It was narrated from Anas bin Malik that: a Jew took some jewelry from a girl, then he crushed her head between two rocks. They found her as she was breathing her last, and they took her around among the people (saying); ""Was it this one? Was it this one?"" (When) she said yes, the Messenger of Allah ordered that his head be crushed between two rocks. (Sahih) "
nasai45_1147570	 أخبرنا علي بن حجر قال أنبأنا يزيد بن هارون عن همام عن قتادة عن أنس بن	عن مالك قال خرجت جارية عليها أوضاح فأخذها يهودي فرضخ رأسها وأخذ ما عليها من الحلي فأدركت وبها رمق فأتي بها رسول الله صلى الله عليه وسلم فقال من قتلك فلان قالت برأسها لا قال فلان قال حتى سمى اليهودي قالت برأسها نعم فأخذ فاعترف فأمر به رسول الله صلى الله عليه وسلم فرضخ رأسه بين حجرين 	 أخبرنا علي بن حجر قال أنبأنا يزيد بن هارون عن همام عن قتادة عن أنس بن مالك قال خرجت جارية عليها أوضاح فأخذها يهودي فرضخ رأسها وأخذ ما عليها من الحلي فأدركت وبها رمق فأتي بها رسول الله صلى الله عليه وسلم فقال من قتلك فلان قالت برأسها لا قال فلان قال حتى سمى اليهودي قالت برأسها نعم فأخذ فاعترف فأمر به رسول الله صلى الله عليه وسلم فرضخ رأسه بين حجرين 	" It was narrated that Anas bin Malik said: ""A girl went out wearing some jewelry and a Jew caught her, crushed her head between two rocks and took the jewelry that she was wearing. She was found as she was breathing her last, and she was brought to the Messenger of Allah who said: 'Who killed you? Was it so and so?' She gestured no with her head, and he continued asking until he named the Jew, and she gestured yes with her head. He was caught and he confessed (to his crime), then the Messenger of Allah ordered that his head be crushed between two rocks."" (Sahih) "
nasai45_1147580	 أخبرنا أحمد بن حفص بن عبد الله قال حدثني أبي قال حدثني إبراهيم عن عبد العزيز بن	حدثني رفيع عن عبيد بن عمير عن عائشة أم المؤمنين عن رسول الله صلى الله عليه وسلم أنه قال لا يحل قتل مسلم إلا في إحدى ثلاث خصال زان محصن فيرجم ورجل يقتل مسلما متعمدا ورجل يخرج من الإسلام فيحارب الله عز وجل ورسوله فيقتل أو يصلب أو ينفى من الأرض 	 أخبرنا أحمد بن حفص بن عبد الله قال حدثني أبي قال حدثني إبراهيم عن عبد العزيز بن رفيع عن عبيد بن عمير عن عائشة أم المؤمنين عن رسول الله صلى الله عليه وسلم أنه قال لا يحل قتل مسلم إلا في إحدى ثلاث خصال زان محصن فيرجم ورجل يقتل مسلما متعمدا ورجل يخرج من الإسلام فيحارب الله عز وجل ورسوله فيقتل أو يصلب أو ينفى من الأرض 	" It was narrated from 'Aishah, the Mother of the Believers, that the Messenger of Allah said: ""It is not permissible to kill a Muslim except in one of three cases: A adulterer who has been married, who is to be stoned; a man who kills a Muslim deliberately; and a man who leaves Islam and wages war against Allah, the Mighty and Sublime, and His Messenger, who is to be killed, crucified or banished from the land."" (Sahih) "
