nasai45_1147930	 أخبرنا محمد بن رافع قال حدثنا عبد الرزاق عن معمر عن الزهري عن عروة عن	عن عائشة أن النبي صلى الله عليه وسلم بعث أبا جهم بن حذيفة مصدقا فلاحه رجل في صدقته فضربه أبو جهم فأتوا النبي صلى الله عليه وسلم فقال القود يا رسول الله فقال لكم كذا وكذا فلم يرضوا به فقال لكم كذا وكذا فرضوا به فقال رسول الله صلى الله عليه وسلم إني خاطب على الناس ومخبرهم برضاكم قالوا نعم فخطب النبي صلى الله عليه وسلم فقال إن هؤلاء أتوني يريدون القود فعرضت عليهم كذا وكذا فرضوا قالوا لا فهم المهاجرون بهم فأمرهم رسول الله صلى الله عليه وسلم أن يكفوا فكفوا ثم دعاهم قال أرضيتم قالوا نعم قال فإني خاطب على الناس ومخبرهم برضاكم قالوا نعم فخطب الناس ثم قال أرضيتم قالوا نعم 	 أخبرنا محمد بن رافع قال حدثنا عبد الرزاق عن معمر عن الزهري عن عروة عن عائشة أن النبي صلى الله عليه وسلم بعث أبا جهم بن حذيفة مصدقا فلاحه رجل في صدقته فضربه أبو جهم فأتوا النبي صلى الله عليه وسلم فقال القود يا رسول الله فقال لكم كذا وكذا فلم يرضوا به فقال لكم كذا وكذا فرضوا به فقال رسول الله صلى الله عليه وسلم إني خاطب على الناس ومخبرهم برضاكم قالوا نعم فخطب النبي صلى الله عليه وسلم فقال إن هؤلاء أتوني يريدون القود فعرضت عليهم كذا وكذا فرضوا قالوا لا فهم المهاجرون بهم فأمرهم رسول الله صلى الله عليه وسلم أن يكفوا فكفوا ثم دعاهم قال أرضيتم قالوا نعم قال فإني خاطب على الناس ومخبرهم برضاكم قالوا نعم فخطب الناس ثم قال أرضيتم قالوا نعم 	" It was narrated from 'Aishah that: the Messenger of Allah sent Abu Jahm bin Hudhaifah to collect Zakah and a man argued with him about his Sadaqah, so Abu Jahm struck him. They came to the prophet and he said: ""Diyah, O Messenger of Allah."" He said: ""You will have such and such,"" but they did not accept it. The Messenger of Allah said: ""You will have such and such,"" and they accepted it. The Messenger of Allah said: ""I am going to address the people and tell them that you accepted it."" They said: ""Yes."" So the Prophet addressed (the people) and said: ""Those people came to me seeking compensation, and I offered them such as such, and they accepted."" They said: ""No."" The Muhajirun wanted to attack them, but the Messenger of Allah ordered them to refrain, so they refrained. Then he called them and said: ""Do you accept?"" They said:"" Yes."" He said: ""I and going to address the people and tell them that you accepted it."" They said: ""Yes."" So the Prophet addressed (the people), then he said: ""Do you accept?"" They said: ""Yes."" (Da'if) "
nasai45_1147940	 أخبرنا إسماعيل بن مسعود قال حدثنا خالد عن شعبة عن هشام بن زيد عن	عن أنس أن يهوديا رأى على جارية أوضاحا فقتلها بحجر فأتي بها النبي صلى الله عليه وسلم وبها رمق فقال أقتلك فلان فأشار شعبة برأسه يحكيها أن لا فقال أقتلك فلان فأشار شعبة برأسه يحكيها أن لا قال أقتلك فلان فأشار شعبة برأسه يحكيها أن نعم فدعا به رسول الله صلى الله عليه وسلم فقتله بين حجرين 	 أخبرنا إسماعيل بن مسعود قال حدثنا خالد عن شعبة عن هشام بن زيد عن أنس أن يهوديا رأى على جارية أوضاحا فقتلها بحجر فأتي بها النبي صلى الله عليه وسلم وبها رمق فقال أقتلك فلان فأشار شعبة برأسه يحكيها أن لا فقال أقتلك فلان فأشار شعبة برأسه يحكيها أن لا قال أقتلك فلان فأشار شعبة برأسه يحكيها أن نعم فدعا به رسول الله صلى الله عليه وسلم فقتله بين حجرين 	" It was narrated from Anas, that: a Jew saw some jewelry on a girl, so he killed her with a rock. She was brought to the Prophet as she was breathing her last, and he said: ""Did so and so kill you?"" - Shu'bah (one of the narrators) gestured with his head, to show that she had gestured no. - He said: ""Did so and so kill you?"" - Shu'bah (one of the narrators) gestured with his head to show that she had gestured no. - He said: ""Did so and so kill you?"" - Shu'bah (one of the narrators) gestured with his head to show that she had gestured yes. - So the Messenger of Allah called for him, and killed him with two rocks. (Sahih) "
nasai45_1147950	 أخبرنا محمد بن العلاء قال حدثنا أبو خالد عن إسماعيل عن	عن قيس أن رسول الله صلى الله عليه وسلم بعث سرية إلى قوم من خثعم فاستعصموا بالسجود فقتلوا فقضى رسول الله صلى الله عليه وسلم بنصف العقل وقال إني بريء من كل مسلم مع مشرك ثم قال رسول الله صلى الله عليه وسلم ألا لا تراءى ناراهما 	 أخبرنا محمد بن العلاء قال حدثنا أبو خالد عن إسماعيل عن قيس أن رسول الله صلى الله عليه وسلم بعث سرية إلى قوم من خثعم فاستعصموا بالسجود فقتلوا فقضى رسول الله صلى الله عليه وسلم بنصف العقل وقال إني بريء من كل مسلم مع مشرك ثم قال رسول الله صلى الله عليه وسلم ألا لا تراءى ناراهما 	" It was narrated from Anas that: the Messenger of Allah sent a detachment jof troops to some people of Khath'am, who sought to protect themselves by prostrating (to demonstrate that they were Muslims), but they were killed. The Messenger of Allah ruled that half the Diyah should be paid, and said: ""I am innocent of any Muslim who (lives with) a Mushrik.' Then the Messenger of Allah said: ""Their fires should not be visible to one another.""' (Da'if) "
nasai45_1147960	not identified	 قال الحارث بن مسكين قراءة عليه وأنا أسمع عن سفيان عن عمرو عن مجاهد عن ابن عباس قال كان في بني إسرائيل القصاص ولم تكن فيهم الدية فأنزل الله عز وجل { كتب عليكم القصاص في القتلى الحر بالحر والعبد بالعبد والأنثى بالأنثى } إلى قوله { فمن عفي له من أخيه شىء فاتباع بالمعروف وأداء إليه بإحسان } فالعفو أن يقبل الدية في العمد واتباع بمعروف يقول يتبع هذا بالمعروف وأداء بإحسان ويؤدي هذا بإحسان { ذلك تخفيف من ربكم ورحمة } مما كتب على من كان قبلكم إنما هو القصاص ليس الدية 	 قال الحارث بن مسكين قراءة عليه وأنا أسمع عن سفيان عن عمرو عن مجاهد عن ابن عباس قال كان في بني إسرائيل القصاص ولم تكن فيهم الدية فأنزل الله عز وجل { كتب عليكم القصاص في القتلى الحر بالحر والعبد بالعبد والأنثى بالأنثى } إلى قوله { فمن عفي له من أخيه شىء فاتباع بالمعروف وأداء إليه بإحسان } فالعفو أن يقبل الدية في العمد واتباع بمعروف يقول يتبع هذا بالمعروف وأداء بإحسان ويؤدي هذا بإحسان { ذلك تخفيف من ربكم ورحمة } مما كتب على من كان قبلكم إنما هو القصاص ليس الدية 	" It was narrated that Ibn 'Abbas said: ""There was Qisas among the Children of Israel, but Diyah was unknown among them. Then Allah, the Mighty and Sublime, revealed: ""Al-Qisas (the law of equality in punishment) is prescribed for your in case of murder: the free for the free, the slave for the slave, and the female for the female."" Up to His saying: ""But if the killer is forgiven by the brother 9or the relatives) of the killed against blood money, then adhering to it with fairness and payment of the blood money to the heir should be made in fairness.""[2] Forgiveness means accepting the Diyah in the case of deliberate killing. Adhering to it in fairness means asking him to pay the Diyah in a fair manner, and payment in fairness means giving the Diyah in a fair manner. This is and alleviation and a mercy from you Lord,[1] means: This is easier thanthat which was prescribed for those who came before you, which was Qisas and not Diyah."" (Sahih) "
nasai45_1147970	 أخبرنا محمد بن إسماعيل بن إبراهيم قال حدثنا علي بن	أخبرنا حفص قال حدثنا ورقاء عن عمرو عن مجاهد قال { كتب عليكم القصاص في القتلى الحر بالحر } قال كان بنو إسرائيل عليهم القصاص وليس عليهم الدية فأنزل الله عز وجل عليهم الدية فجعلها على هذه الأمة تخفيفا على ما كان على بني إسرائيل 	 أخبرنا محمد بن إسماعيل بن إبراهيم قال حدثنا علي بن حفص قال حدثنا ورقاء عن عمرو عن مجاهد قال { كتب عليكم القصاص في القتلى الحر بالحر } قال كان بنو إسرائيل عليهم القصاص وليس عليهم الدية فأنزل الله عز وجل عليهم الدية فجعلها على هذه الأمة تخفيفا على ما كان على بني إسرائيل 	" It was narrated that Mujahid said: ""Al-Qisas (the Law of Equality in punishment) is prescribed for you in case of murder: the free for the free[2] The rule for the Children of Israel was Qisas, and not Diyah. Then Allah, the Mighty and Sublime, revealed the Diyah to them, and He revealed this ruling to this Ummah as an alleviation of the ruling that applied to the Children of Israel."" (Sahih) "
nasai45_1147980	 أخبرنا إسحاق بن إبراهيم قال أنبأنا عبد الرحمن قال حدثنا عبد الله وهو ابن بكر بن	حدثنا عبد الله المزني عن عطاء بن أبي ميمونة عن أنس قال أتي رسول الله صلى الله عليه وسلم في قصاص فأمر فيه بالعفو 	 أخبرنا إسحاق بن إبراهيم قال أنبأنا عبد الرحمن قال حدثنا عبد الله وهو ابن بكر بن عبد الله المزني عن عطاء بن أبي ميمونة عن أنس قال أتي رسول الله صلى الله عليه وسلم في قصاص فأمر فيه بالعفو 	" It was narrated that Anas said: ""A case requiring Qisas was brought to the Messenger of Allah and he enjoined them to pardon."" (Sahih) "
nasai45_1147990	 أخبرنا محمد بن بشار قال حدثنا عبد الرحمن بن	أخبرنا مهدي وبهز بن أسد وعفان بن مسلم قالوا حدثنا عبد الله بن بكر المزني قال حدثنا عطاء بن أبي ميمونة ولا أعلمه إلا عن أنس بن مالك قال ما أتي النبي صلى الله عليه وسلم في شىء فيه قصاص إلا أمر فيه بالعفو 	 أخبرنا محمد بن بشار قال حدثنا عبد الرحمن بن مهدي وبهز بن أسد وعفان بن مسلم قالوا حدثنا عبد الله بن بكر المزني قال حدثنا عطاء بن أبي ميمونة ولا أعلمه إلا عن أنس بن مالك قال ما أتي النبي صلى الله عليه وسلم في شىء فيه قصاص إلا أمر فيه بالعفو 	" It was narrated that Anas bin Malik said: ""No case requiring Qisas was ever brought to the Messenger of Allah but he would enjoin pardoning."" (Sahih) "
nasai45_1148000	 أخبرنا محمد بن عبد الرحمن بن أشعث قال حدثنا أبو مسهر قال حدثنا إسماعيل وهو ابن عبد الله بن	حدثنا سماعة قال أنبأنا الأوزاعي قال أخبرني يحيى قال حدثني أبو سلمة قال حدثني أبو هريرة قال قال رسول الله صلى الله عليه وسلم من قتل له قتيل فهو بخير النظرين إما أن يقاد وإما أن يفدى 	 أخبرنا محمد بن عبد الرحمن بن أشعث قال حدثنا أبو مسهر قال حدثنا إسماعيل وهو ابن عبد الله بن سماعة قال أنبأنا الأوزاعي قال أخبرني يحيى قال حدثني أبو سلمة قال حدثني أبو هريرة قال قال رسول الله صلى الله عليه وسلم من قتل له قتيل فهو بخير النظرين إما أن يقاد وإما أن يفدى 	" Abu Hurairah said: ""The Messenger of Allah said: 'If a person's relative is killed, he has the choice of two things: Either he may retaliate, or he may take the ransom.""'(Sahih) "
nasai45_1148010	 أخبرنا العباس بن الوليد بن	أخبرنا مزيد قال أخبرني أبي قال حدثنا الأوزاعي قال حدثني يحيى بن أبي كثير قال حدثني أبو سلمة قال حدثنا أبو هريرة قال قال رسول الله صلى الله عليه وسلم من قتل له قتيل فهو بخير النظرين إما أن يقاد وإما أن يفدى 	 أخبرنا العباس بن الوليد بن مزيد قال أخبرني أبي قال حدثنا الأوزاعي قال حدثني يحيى بن أبي كثير قال حدثني أبو سلمة قال حدثنا أبو هريرة قال قال رسول الله صلى الله عليه وسلم من قتل له قتيل فهو بخير النظرين إما أن يقاد وإما أن يفدى 	" Abu Hurairah said: ""The Messenger of Allah said: 'If a person's relative is killed, he has the choice of two things: Either he may retaliate, or he may take the ransom.""'(Sahih) "
nasai45_1148020	not identified	 أخبرنا { أحمد بن } إبراهيم بن محمد قال أنبأنا ابن عائذ قال حدثنا يحيى هو ابن حمزة قال حدثنا الأوزاعي قال حدثنا يحيى بن أبي كثير قال حدثني أبو سلمة أن رسول الله صلى الله عليه وسلم قال من قتل له قتيل مرسل 	 أخبرنا { أحمد بن } إبراهيم بن محمد قال أنبأنا ابن عائذ قال حدثنا يحيى هو ابن حمزة قال حدثنا الأوزاعي قال حدثنا يحيى بن أبي كثير قال حدثني أبو سلمة أن رسول الله صلى الله عليه وسلم قال من قتل له قتيل مرسل 	" Abu Salamah narrated that the Messenger of Allah said: ""If a person's relative is killed."" In Mursal form. (Shah) "
nasai45_1148030	 أخبرنا إسحاق بن إبراهيم قال حدثنا الوليد عن الأوزاعي قال حدثني حصن قال حدثني أبو سلمة ح وأنبأنا الحسين بن حريث قال حدثنا الوليد قال حدثنا الأوزاعي قال حدثني حصن أنه سمع أبا سلمة يحدث عن	حدثني عائشة أن رسول الله صلى الله عليه وسلم قال وعلى المقتتلين أن ينحجزوا الأول فالأول وإن كانت امرأة 	 أخبرنا إسحاق بن إبراهيم قال حدثنا الوليد عن الأوزاعي قال حدثني حصن قال حدثني أبو سلمة ح وأنبأنا الحسين بن حريث قال حدثنا الوليد قال حدثنا الأوزاعي قال حدثني حصن أنه سمع أبا سلمة يحدث عن عائشة أن رسول الله صلى الله عليه وسلم قال وعلى المقتتلين أن ينحجزوا الأول فالأول وإن كانت امرأة 	" It was narrated from 'Aishah that the Messenger of Allah said: ""And it is upon those (relatives) of the killed one to block (any punishment) the first (in line) then the first, even if that one is a woman."" (Da'if) "
nasai45_1148040	 أخبرنا هلال بن العلاء بن هلال قال حدثنا سعيد بن	أخبرنا سليمان قال أنبأنا سليمان بن كثير قال حدثنا عمرو بن دينار عن طاوس عن ابن عباس قال قال رسول الله صلى الله عليه وسلم من قتل في عميا أو رميا تكون بينهم بحجر أو سوط أو بعصا فعقله عقل خطإ ومن قتل عمدا فقود يده فمن حال بينه وبينه فعليه لعنة الله والملائكة والناس أجمعين لا يقبل منه صرف ولا عدل 	 أخبرنا هلال بن العلاء بن هلال قال حدثنا سعيد بن سليمان قال أنبأنا سليمان بن كثير قال حدثنا عمرو بن دينار عن طاوس عن ابن عباس قال قال رسول الله صلى الله عليه وسلم من قتل في عميا أو رميا تكون بينهم بحجر أو سوط أو بعصا فعقله عقل خطإ ومن قتل عمدا فقود يده فمن حال بينه وبينه فعليه لعنة الله والملائكة والناس أجمعين لا يقبل منه صرف ولا عدل 	" It was narrated that Ibn 'Abbas said: ""The Messenger of Allah said: 'Whoever is killed in the blind or by something thrown, while between them is a rock, a wipe, or a stick, then the blood money of be paid for him is the blood money for accidental killing. Whoever kills deliberately, then retaliation is upon him, and whoever tries to prevent that, upon him is the curse of Allah, the Angels, and all the people, and neither Sarf nor Adl will be accepted from him."" (Sahih) "
nasai45_1148050	 أخبرنا محمد بن معمر قال حدثنا محمد بن	أخبرنا كثير قال حدثنا سليمان بن كثير عن عمرو بن دينار عن طاوس عن ابن عباس يرفعه قال من قتل في عمية أو رمية بحجر أو سوط أو عصا فعقله عقل الخطإ ومن قتل عمدا فهو قود ومن حال بينه وبينه فعليه لعنة الله والملائكة والناس أجمعين لا يقبل الله منه صرفا ولا عدلا 	 أخبرنا محمد بن معمر قال حدثنا محمد بن كثير قال حدثنا سليمان بن كثير عن عمرو بن دينار عن طاوس عن ابن عباس يرفعه قال من قتل في عمية أو رمية بحجر أو سوط أو عصا فعقله عقل الخطإ ومن قتل عمدا فهو قود ومن حال بينه وبينه فعليه لعنة الله والملائكة والناس أجمعين لا يقبل الله منه صرفا ولا عدلا 	" It was narrated that Ibn 'Abbad, who attributed it to the prophet, said: ""Whoever is killed in the blind or by something thrown, with a rock, a whip, or a stick, then the blood money to be paid for him is the blood money for accidental killing. Whoever kills deliberately, then retaliation is upon him, and whoever tries to prevent that, upon him is the curse of Allah, the Angels and all the people, and Allah will not accept any Sarf nor 'Adl from him."" (Sahih) "
nasai45_1148060	 أخبرنا محمد بن بشار قال حدثنا عبد الرحمن قال حدثنا شعبة عن أيوب السختياني عن القاسم بن ربيعة عن عبد الله بن عمرو عن	عن النبي صلى الله عليه وسلم قال قتيل الخطإ شبه العمد بالسوط أو العصا مائة من الإبل أربعون منها في بطونها أولادها 	 أخبرنا محمد بن بشار قال حدثنا عبد الرحمن قال حدثنا شعبة عن أيوب السختياني عن القاسم بن ربيعة عن عبد الله بن عمرو عن النبي صلى الله عليه وسلم قال قتيل الخطإ شبه العمد بالسوط أو العصا مائة من الإبل أربعون منها في بطونها أولادها 	" It was narrated from Al-Qasim bin Rabi'ah, from 'Abdullah bin 'Amr, the Prophet said: ""The accidental killing, which seems intentional, with a whip or stick, (the Diyah) is one hundred camels, of which forty should be (she-camels) which their young in their wombs."" (Sahih) "
nasai45_1148070	not identified	 أخبرني محمد بن إسماعيل بن إبراهيم قال حدثنا يونس قال حدثنا حماد عن أيوب عن القاسم بن ربيعة أن رسول الله صلى الله عليه وسلم خطب يوم الفتح مرسل 	 أخبرني محمد بن إسماعيل بن إبراهيم قال حدثنا يونس قال حدثنا حماد عن أيوب عن القاسم بن ربيعة أن رسول الله صلى الله عليه وسلم خطب يوم الفتح مرسل 	 It was narrated from Al-Qasim bin Rabi'ah that: the Messenger of Allah delivered a speech on the Day of the Conquest. (And he mentioned it) in Mursal from. (Sahih) 
nasai45_1148080	not identified	 أخبرني يحيى بن حبيب بن عربي قال أنبأنا حماد عن خالد يعني الحذاء عن القاسم بن ربيعة عن عقبة بن أوس عن عبد الله أن رسول الله صلى الله عليه وسلم قال ألا وإن قتيل الخطإ شبه العمد ما كان بالسوط والعصا مائة من الإبل أربعون في بطونها أولادها 	 أخبرني يحيى بن حبيب بن عربي قال أنبأنا حماد عن خالد يعني الحذاء عن القاسم بن ربيعة عن عقبة بن أوس عن عبد الله أن رسول الله صلى الله عليه وسلم قال ألا وإن قتيل الخطإ شبه العمد ما كان بالسوط والعصا مائة من الإبل أربعون في بطونها أولادها 	" It was narrated from Abdullah bin 'Amr that the prophet said: ""Indeed the accidental killing, which seems intentional, with a whip or a stick, (the Diyah) is one hundred camels, of which forty should be (she-camels) with their young in their wombs."" (Sahih) "
nasai45_1148090	 حدثنا محمد بن كامل قال حدثنا هشيم عن خالد عن القاسم بن ربيعة عن عقبة بن أوس عن	عن رجل من أصحاب النبي صلى الله عليه وسلم قال خطب النبي صلى الله عليه وسلم يوم فتح مكة فقال ألا وإن قتيل الخطإ شبه العمد بالسوط والعصا والحجر مائة من الإبل فيها أربعون ثنية إلى بازل عامها كلهن خلفة 	 حدثنا محمد بن كامل قال حدثنا هشيم عن خالد عن القاسم بن ربيعة عن عقبة بن أوس عن رجل من أصحاب النبي صلى الله عليه وسلم قال خطب النبي صلى الله عليه وسلم يوم فتح مكة فقال ألا وإن قتيل الخطإ شبه العمد بالسوط والعصا والحجر مائة من الإبل فيها أربعون ثنية إلى بازل عامها كلهن خلفة 	" It was narrated from 'Uqbah bin Aws, that: a man from among the Companions of the Prophet delivered a speech on the Day of the Conquest of Makkah and said: 'Indeed the accidental killing, which seems international, with a whip, a stick, or a rock, (the Diyah) is one hundred camels, of which forty should be pregnant she-camels between the ages of six and nine years old, all in the middle of their pregnancies."" (Sahih) "
nasai45_1148100	 أخبرنا محمد بن بشار عن ابن أبي عدي عن خالد عن القاسم عن عقبة بن	عن أوس أن رسول الله صلى الله عليه وسلم قال ألا إن قتيل الخطإ قتيل السوط والعصا فيه مائة من الإبل مغلظة أربعون منها في بطونها أولادها 	 أخبرنا محمد بن بشار عن ابن أبي عدي عن خالد عن القاسم عن عقبة بن أوس أن رسول الله صلى الله عليه وسلم قال ألا إن قتيل الخطإ قتيل السوط والعصا فيه مائة من الإبل مغلظة أربعون منها في بطونها أولادها 	" It was narrated from 'Uqbah bin 'Aws, that the Mssenger of Allah said: ""Indeed the accidental killing, the killing with a whip or stick, for it (the Diyah) is one hundred camels - a severe penalty - of which forty should be (she-camels) with their young in their wombs."" (Sahih) "
