nasai46_1149030	 أخبرنا إسحاق بن	أخبرنا إبراهيم قال أنبأنا عبد الرزاق قال أنبأنا معمر عن أيوب عن نافع عن ابن عمر رضى الله عنهما قال كانت امرأة مخزومية تستعير متاعا على ألسنة جاراتها وتجحده فأمر رسول الله صلى الله عليه وسلم بقطع يدها 	 أخبرنا إسحاق بن إبراهيم قال أنبأنا عبد الرزاق قال أنبأنا معمر عن أيوب عن نافع عن ابن عمر رضى الله عنهما قال كانت امرأة مخزومية تستعير متاعا على ألسنة جاراتها وتجحده فأمر رسول الله صلى الله عليه وسلم بقطع يدها 	" It was narrated that Ibn 'Umar, may Allah be pleased with them said: ""There was a Makhzumi woman who used to borrow things, saying that her neighbors needed the, then she would deny that she had borrowed the, so the Messenger of Allah ordered that her hand be cut off (Sahih) "
nasai46_1149040	 أخبرنا عثمان بن عبد الله قال حدثني الحسن بن	أخبرنا حماد قال حدثنا عمرو بن هاشم الجنبي أبو مالك عن عبيد الله بن عمر عن نافع عن ابن عمر رضى الله عنهما أن امرأة كانت تستعير الحلي للناس ثم تمسكه فقال رسول الله صلى الله عليه وسلم لتتب هذه المرأة إلى الله ورسوله وترد ما تأخذ على القوم ثم قال رسول الله صلى الله عليه وسلم قم يا بلال فخذ بيدها فاقطعها 	 أخبرنا عثمان بن عبد الله قال حدثني الحسن بن حماد قال حدثنا عمرو بن هاشم الجنبي أبو مالك عن عبيد الله بن عمر عن نافع عن ابن عمر رضى الله عنهما أن امرأة كانت تستعير الحلي للناس ثم تمسكه فقال رسول الله صلى الله عليه وسلم لتتب هذه المرأة إلى الله ورسوله وترد ما تأخذ على القوم ثم قال رسول الله صلى الله عليه وسلم قم يا بلال فخذ بيدها فاقطعها 	" It was narrated from Ibn 'Umar, may Allah be pleased with them both, that: a woman used, to borrow jewelry from people then keep it. The Messenger of Allah said: ""Let this woman repent to Allah and His Messenger and give back to people what she has taken."" Then the Messenge of Allah said ""Get up, O Bilal, take her hand and cut it off."" (Sahih) "
nasai46_1149050	not identified	 أخبرني محمد بن الخليل عن شعيب بن إسحاق عن عبيد الله عن نافع أن امرأة كانت تستعير الحلي في زمان رسول الله صلى الله عليه وسلم فاستعارت من ذلك حليا فجمعته ثم أمسكته فقال رسول الله صلى الله عليه وسلم لتتب هذه المرأة وتؤدي ما عندها مرارا فلم تفعل فأمر بها فقطعت 	 أخبرني محمد بن الخليل عن شعيب بن إسحاق عن عبيد الله عن نافع أن امرأة كانت تستعير الحلي في زمان رسول الله صلى الله عليه وسلم فاستعارت من ذلك حليا فجمعته ثم أمسكته فقال رسول الله صلى الله عليه وسلم لتتب هذه المرأة وتؤدي ما عندها مرارا فلم تفعل فأمر بها فقطعت 	" It was narrated from Nafi that: a woman used to borrow jewelry during the time of the Messenger of Allah. She borrowed some jewelry, collected it and kept it. The Messenger of Allah said: ""Let this woman repent and give back what she has,"" several times, but she did not do that, so he ordered that her hand be cut off. (Sahih) "
nasai46_1149060	 أخبرنا محمد بن معدان بن عيسى قال حدثنا الحسن بن	أخبرنا أعين قال حدثنا معقل عن أبي الزبير عن جابر أن امرأة من بني مخزوم سرقت فأتي بها النبي صلى الله عليه وسلم فعاذت بأم سلمة فقال النبي صلى الله عليه وسلم لو كانت فاطمة بنت محمد لقطعت يدها فقطعت يدها 	 أخبرنا محمد بن معدان بن عيسى قال حدثنا الحسن بن أعين قال حدثنا معقل عن أبي الزبير عن جابر أن امرأة من بني مخزوم سرقت فأتي بها النبي صلى الله عليه وسلم فعاذت بأم سلمة فقال النبي صلى الله عليه وسلم لو كانت فاطمة بنت محمد لقطعت يدها فقطعت يدها 	" It was narrated from Jabir that: a woman from Banu Makhzum stole (something), and she was brought to the Prophet. She sought the protection of Umm Salamah, but the Prophet said: ""If Fatimah bint Muhammad were to steal, I would cut off her hand."" And he ordered that her hand be cut off. (Sahih) "
nasai46_1149070	 أخبرنا محمد بن المثنى قال حدثنا معاذ بن	أخبرنا هشام قال حدثني أبي عن قتادة عن سعيد بن يزيد عن سعيد بن المسيب أن امرأة من بني مخزوم استعارت حليا على لسان أناس فجحدتها فأمر بها النبي صلى الله عليه وسلم فقطعت 	 أخبرنا محمد بن المثنى قال حدثنا معاذ بن هشام قال حدثني أبي عن قتادة عن سعيد بن يزيد عن سعيد بن المسيب أن امرأة من بني مخزوم استعارت حليا على لسان أناس فجحدتها فأمر بها النبي صلى الله عليه وسلم فقطعت 	 It was narrated from Saeed bin AL-Musayyab that: a woman from Banu Makhzum borrowed some jewelry, asking on behalf of others, then she denied (having done) that, and the Prophet ordered that her hand be cut off. (Sahih) 
nasai46_1149080	 أخبرنا محمد بن المثنى قال حدثنا عبد الصمد قال حدثنا همام قال حدثنا قتادة عن داود بن	حدثنا أبي عاصم أن سعيد بن المسيب حدثه نحوه 	 أخبرنا محمد بن المثنى قال حدثنا عبد الصمد قال حدثنا همام قال حدثنا قتادة عن داود بن أبي عاصم أن سعيد بن المسيب حدثه نحوه 	 It was narrated from Dawud bin Abi Asim that: Saeed bin Al-Musayyb narrated something similar to that. (Sahih) 
nasai46_1149090	 أخبرنا إسحاق بن	أخبرنا إبراهيم قال أنبأنا سفيان قال كانت مخزومية تستعير متاعا وتجحده فرفعت إلى رسول الله صلى الله عليه وسلم وكلم فيها فقال لو كانت فاطمة لقطعت يدها قيل لسفيان من ذكره قال أيوب بن موسى عن الزهري عن عروة عن عائشة إن شاء الله تعالى 	 أخبرنا إسحاق بن إبراهيم قال أنبأنا سفيان قال كانت مخزومية تستعير متاعا وتجحده فرفعت إلى رسول الله صلى الله عليه وسلم وكلم فيها فقال لو كانت فاطمة لقطعت يدها قيل لسفيان من ذكره قال أيوب بن موسى عن الزهري عن عروة عن عائشة إن شاء الله تعالى 	" Sufyan said: ""There was a Makhzumi woman who used to borrow things then deny that. She was brought to the Messenger of Allah and he was told about her. He said: 'If it were Fatimah (who stole), I would cut off her hand.""' It was said to Sufyan: ""Who told you that?"" He said: ""Ayyub bin Musa, from Az-Zuhri, from 'Urwah, from 'Aishah, if Allah the mighty and Sublime, wills."" (Sahih) "
nasai46_1149100	 أخبرنا محمد بن منصور قال حدثنا سفيان عن أيوب بن	أخبرنا موسى عن الزهري عن عروة عن عائشة أن امرأة سرقت فأتي بها النبي صلى الله عليه وسلم فقالوا من يجترئ على رسول الله صلى الله عليه وسلم إلا أن يكون أسامة فكلموا أسامة فكلمه فقال النبي صلى الله عليه وسلم يا أسامة إنما هلكت بنو إسرائيل حين كانوا إذا أصاب الشريف فيهم الحد تركوه ولم يقيموا عليه وإذا أصاب الوضيع أقاموا عليه لو كانت فاطمة بنت محمد لقطعتها 	 أخبرنا محمد بن منصور قال حدثنا سفيان عن أيوب بن موسى عن الزهري عن عروة عن عائشة أن امرأة سرقت فأتي بها النبي صلى الله عليه وسلم فقالوا من يجترئ على رسول الله صلى الله عليه وسلم إلا أن يكون أسامة فكلموا أسامة فكلمه فقال النبي صلى الله عليه وسلم يا أسامة إنما هلكت بنو إسرائيل حين كانوا إذا أصاب الشريف فيهم الحد تركوه ولم يقيموا عليه وإذا أصاب الوضيع أقاموا عليه لو كانت فاطمة بنت محمد لقطعتها 	" It was narrated from 'Aishah that: a woman stole (something) and she was brought to the Prophet. They said: ""Who would dare to speak to the Messenger of Allah except Usamah. ""So they spoke to Usamah and he spoke to (the Prophet. The Prophet said: ""O Usamah, the Children of Israel were destroyed because whenever a noble person among them committed a crime, for which a Hadd punishment was deserved, they would let him go. But if a low-class person among them committed such a crime, they would carry out the punishment on him. If Fatimah bint Muhammad were to steal, I would cut off hre hand."" (Sahih) "
nasai46_1149110	 أخبرنا رزق الله بن موسى قال حدثنا سفيان عن أيوب بن موسى عن الزهري عن عروة عن	عن عائشة قالت أتي النبي صلى الله عليه وسلم بسارق فقطعه قالوا ما كنا نريد أن يبلغ منه هذا قال لو كانت فاطمة لقطعتها 	 أخبرنا رزق الله بن موسى قال حدثنا سفيان عن أيوب بن موسى عن الزهري عن عروة عن عائشة قالت أتي النبي صلى الله عليه وسلم بسارق فقطعه قالوا ما كنا نريد أن يبلغ منه هذا قال لو كانت فاطمة لقطعتها 	" It was narrated that 'Aishah said: ""A thief was brought to the hand."" They said: ""We did not think that you would take it so far."" He said: ""If it were Fatimah (who stole), I would cut off her hand."" (Sahih) "
nasai46_1149120	 أخبرنا علي بن سعيد بن مسروق قال حدثنا يحيى بن	أخبرنا زكريا بن أبي زائدة عن سفيان بن عيينة عن الزهري عن عروة عن عائشة أن امرأة سرقت على عهد رسول الله صلى الله عليه وسلم فقالوا ما نكلمه فيها ما من أحد يكلمه إلا حبه أسامة فكلمه فقال يا أسامة إن بني إسرائيل هلكوا بمثل هذا كان إذا سرق فيهم الشريف تركوه وإن سرق فيهم الدون قطعوه وإنها لو كانت فاطمة بنت محمد لقطعتها 	 أخبرنا علي بن سعيد بن مسروق قال حدثنا يحيى بن زكريا بن أبي زائدة عن سفيان بن عيينة عن الزهري عن عروة عن عائشة أن امرأة سرقت على عهد رسول الله صلى الله عليه وسلم فقالوا ما نكلمه فيها ما من أحد يكلمه إلا حبه أسامة فكلمه فقال يا أسامة إن بني إسرائيل هلكوا بمثل هذا كان إذا سرق فيهم الشريف تركوه وإن سرق فيهم الدون قطعوه وإنها لو كانت فاطمة بنت محمد لقطعتها 	" It was narrated from 'Aishah that: a woman stole at the time of Messenger of Allah and they said: ""We cannot speak to him concerning her; there is no one who can speak to him except his beloved, Usamah."" So he spoke to him, and he said""O Usamah, the Children of Israel were destroyed for such a thing. Whenever a noble person among them stole, they would let him go, but if a low-class person among them stole, they would cut off his hand. If it were Fatimah bint Muhammad (who stole), I would cut off her hand."" (Sahih) "
nasai46_1149130	 أخبرنا عمران بن بكار قال حدثنا بشر بن	أخبرنا شعيب قال أخبرني أبي عن الزهري عن عروة عن عائشة قالت استعارت امرأة على ألسنة أناس يعرفون وهي لا تعرف حليا فباعته وأخذت ثمنه فأتي بها رسول الله صلى الله عليه وسلم فسعى أهلها إلى أسامة بن زيد فكلم رسول الله صلى الله عليه وسلم فيها فتلون وجه رسول الله صلى الله عليه وسلم وهو يكلمه ثم قال له رسول الله صلى الله عليه وسلم أتشفع إلى في حد من حدود الله فقال أسامة استغفر لي يا رسول الله ثم قام رسول الله صلى الله عليه وسلم عشيتئذ فأثنى على الله عز وجل بما هو أهله ثم قال أما بعد فإنما هلك الناس قبلكم أنهم كانوا إذا سرق الشريف فيهم تركوه وإذا سرق الضعيف فيهم أقاموا عليه الحد والذي نفس محمد بيده لو أن فاطمة بنت محمد سرقت لقطعت يدها ثم قطع تلك المرأة 	 أخبرنا عمران بن بكار قال حدثنا بشر بن شعيب قال أخبرني أبي عن الزهري عن عروة عن عائشة قالت استعارت امرأة على ألسنة أناس يعرفون وهي لا تعرف حليا فباعته وأخذت ثمنه فأتي بها رسول الله صلى الله عليه وسلم فسعى أهلها إلى أسامة بن زيد فكلم رسول الله صلى الله عليه وسلم فيها فتلون وجه رسول الله صلى الله عليه وسلم وهو يكلمه ثم قال له رسول الله صلى الله عليه وسلم أتشفع إلى في حد من حدود الله فقال أسامة استغفر لي يا رسول الله ثم قام رسول الله صلى الله عليه وسلم عشيتئذ فأثنى على الله عز وجل بما هو أهله ثم قال أما بعد فإنما هلك الناس قبلكم أنهم كانوا إذا سرق الشريف فيهم تركوه وإذا سرق الضعيف فيهم أقاموا عليه الحد والذي نفس محمد بيده لو أن فاطمة بنت محمد سرقت لقطعت يدها ثم قطع تلك المرأة 	" It was narrated that 'Aishah said: ""A woman borrowed some jewelry, saying that other people whose names were known but hers was not then she sold it and kept the money. She was brought to the Messenger of Allah, and her people went to Usamah bin Zaid, who spoke to the Messenger of Allah concerning her. The face of ht Messenger of Allah changed color while he was speaking to him. Then the Messenger of Allah said to him: 'Are you interceding with me concerning one of ht Hadd punishments decreed by Allah?' Usamah said: 'Pray for forgiveness for me, O Messenger of Allah! Then the Messenger of Allah stood up that evening, he praised and glorified Allah, the mighty and sublime, as he deserves, then he said: 'The people who came before you were destroyed because, whenever a noble person among them stole, they let him go. But if a low-class person stole, they would carry out the punishment on him. By the One in whose hand is the soul of Muhammad, if Fatimah bint Muhammad were to steal, I would cut off her hand.' Then he cut off that woman."" (Sahih) "
nasai46_1149140	 أخبرنا قتيبة قال حدثنا الليث عن ابن شهاب عن عروة عن	عن عائشة أن قريشا أهمهم شأن المخزومية التي سرقت فقالوا من يكلم فيها رسول الله صلى الله عليه وسلم قالوا ومن يجترئ عليه إلا أسامة بن زيد حب رسول الله صلى الله عليه وسلم فكلمه أسامة فقال رسول الله صلى الله عليه وسلم أتشفع في حد من حدود الله ثم قام فخطب فقال إنما هلك الذين قبلكم أنهم كانوا إذا سرق فيهم الشريف تركوه وإذا سرق فيهم الضعيف أقاموا عليه الحد وايم الله لو أن فاطمة بنت محمد سرقت لقطعت يدها 	 أخبرنا قتيبة قال حدثنا الليث عن ابن شهاب عن عروة عن عائشة أن قريشا أهمهم شأن المخزومية التي سرقت فقالوا من يكلم فيها رسول الله صلى الله عليه وسلم قالوا ومن يجترئ عليه إلا أسامة بن زيد حب رسول الله صلى الله عليه وسلم فكلمه أسامة فقال رسول الله صلى الله عليه وسلم أتشفع في حد من حدود الله ثم قام فخطب فقال إنما هلك الذين قبلكم أنهم كانوا إذا سرق فيهم الشريف تركوه وإذا سرق فيهم الضعيف أقاموا عليه الحد وايم الله لو أن فاطمة بنت محمد سرقت لقطعت يدها 	" It was narrated from 'Aishah that Quraish were worried about the Mkahzumi woman who had stolen. They said;Who will speak to the Messenger of Allah concerning her?"" They said: ""Who would dare to do that except Usamah bin Zaid, the beloved of the Messenger of Allah?"" so Usamah spoke to him and the Messenger of Allah said: ""Are you interceding concerning one of the Hadd punishments decreed by Allah?"" Then he stood up and addressed (the people) and said: ""Those who came before you were destroyed because, whenever a noble person among them stole, they would let him go. But if a person who was weak stole, they would carry out the punishment on him. By Allah, if Fatimah the daughter of Muhammad were to steal, I would cut off her hnad."" (Sahih) "
nasai46_1149150	 أخبرنا أبو بكر بن إسحاق قال حدثنا أبو الجواب قال حدثنا عمار بن رزيق عن محمد بن عبد الرحمن بن أبي ليلى عن إسماعيل بن أمية عن محمد بن مسلم عن عروة عن	عن عائشة قالت سرقت امرأة من قريش من بني مخزوم فأتي بها النبي صلى الله عليه وسلم فقالوا من يكلمه فيها قالوا أسامة بن زيد فأتاه فكلمه فزبره وقال إن بني إسرائيل كانوا إذا سرق فيهم الشريف تركوه وإذا سرق الوضيع قطعوه والذي نفسي بيده لو أن فاطمة بنت محمد سرقت لقطعتها 	 أخبرنا أبو بكر بن إسحاق قال حدثنا أبو الجواب قال حدثنا عمار بن رزيق عن محمد بن عبد الرحمن بن أبي ليلى عن إسماعيل بن أمية عن محمد بن مسلم عن عروة عن عائشة قالت سرقت امرأة من قريش من بني مخزوم فأتي بها النبي صلى الله عليه وسلم فقالوا من يكلمه فيها قالوا أسامة بن زيد فأتاه فكلمه فزبره وقال إن بني إسرائيل كانوا إذا سرق فيهم الشريف تركوه وإذا سرق الوضيع قطعوه والذي نفسي بيده لو أن فاطمة بنت محمد سرقت لقطعتها 	" It was narrated that 'Aishah said: ""A woman of Quraish, from banu Makhzum, stole, and she was brought to the Prophet. They said: 'Who will speak to him concerning her?' They said: 'Usamah bin Zaid.' So he came to the Prophet and spoke to him. But he rebuked him, and he said; 'Among the Children of Israel, if a noble person stole, they would let him go. But if a low-class person stole, they would cut off his hand. By the One in whose hand is the soul of Muhammad, if Fatimah bint Muhammad were to steal, I would cut off her hand."""" (Sahih) "
nasai46_1149160	 أخبرنا محمد بن جبلة قال حدثنا محمد بن موسى بن	أخبرنا أعين قال حدثنا أبي عن إسحاق بن راشد عن الزهري عن عروة عن عائشة أن قريشا أهمهم شأن المخزومية التي سرقت فقالوا من يكلم فيها قالوا من يجترئ عليه إلا أسامة بن زيد حب رسول الله صلى الله عليه وسلم فكلمه أسامة فقال رسول الله صلى الله عليه وسلم إنما هلك الذين من قبلكم أنهم كانوا إذا سرق فيهم الشريف تركوه وإذا سرق فيهم الضعيف أقاموا عليه الحد وايم الله لو سرقت فاطمة بنت محمد لقطعت يدها 	 أخبرنا محمد بن جبلة قال حدثنا محمد بن موسى بن أعين قال حدثنا أبي عن إسحاق بن راشد عن الزهري عن عروة عن عائشة أن قريشا أهمهم شأن المخزومية التي سرقت فقالوا من يكلم فيها قالوا من يجترئ عليه إلا أسامة بن زيد حب رسول الله صلى الله عليه وسلم فكلمه أسامة فقال رسول الله صلى الله عليه وسلم إنما هلك الذين من قبلكم أنهم كانوا إذا سرق فيهم الشريف تركوه وإذا سرق فيهم الضعيف أقاموا عليه الحد وايم الله لو سرقت فاطمة بنت محمد لقطعت يدها 	" It was narrated from 'Aishah the Quraish were worried about the case of the Makhzumi woman who stole, and they said: ""Who will speak concerning her?"" They said: ""Who would dare to do that except Usamah bin Zaid, the beloved of the Messenger of Allah?"" said: ""Those who came before you were destroyed because whenever a noble person among them stole they would let him go. But if a person who was weak stole, they would carry out the Hadd punishment. By Allah, if Fatimah, the daughter of Muhammad, were to steal, I would ct off her hand."" (Sahih) "
