tirmidhi09_709300	 حدثنا محمد بن بشار حدثنا عبد الرحمن بن مهدي حدثنا سفيان عن أبي الزبير عن	حدثنا ابن عباس وعائشة أن النبي صلى الله عليه وسلم أخر طواف الزيارة إلى الليل قال أبو عيسى هذا حديث حسن صحيح وقد رخص بعض أهل العلم في أن يؤخر طواف الزيارة إلى الليل واستحب بعضهم أن يزور يوم النحر ووسع بعضهم أن يؤخر ولو إلى آخر أيام منى 	 حدثنا محمد بن بشار حدثنا عبد الرحمن بن مهدي حدثنا سفيان عن أبي الزبير عن ابن عباس وعائشة أن النبي صلى الله عليه وسلم أخر طواف الزيارة إلى الليل قال أبو عيسى هذا حديث حسن صحيح وقد رخص بعض أهل العلم في أن يؤخر طواف الزيارة إلى الليل واستحب بعضهم أن يزور يوم النحر ووسع بعضهم أن يؤخر ولو إلى آخر أيام منى 	" Aishah narrated: ""The Prophet delayed the visiting Tawaf until the night."" (Da'if) "
tirmidhi09_709310	 حدثنا إسحاق بن منصور أخبرنا عبد الرزاق أخبرنا عبيد الله بن عمر عن نافع عن	أخبرنا ابن عمر قال كان النبي صلى الله عليه وسلم وأبو بكر وعمر وعثمان ينزلون الأبطح قال وفي الباب عن عائشة وأبي رافع وابن عباس قال أبو عيسى حديث ابن عمر حديث صحيح حسن غريب إنما نعرفه من حديث عبد الرزاق عن عبيد الله بن عمر وقد استحب بعض أهل العلم نزول الأبطح من غير أن يروا ذلك واجبا إلا من أحب ذلك قال الشافعي ونزول الأبطح ليس من النسك في شيء إنما هو منزل نزله النبي صلى الله عليه وسلم 	 حدثنا إسحاق بن منصور أخبرنا عبد الرزاق أخبرنا عبيد الله بن عمر عن نافع عن ابن عمر قال كان النبي صلى الله عليه وسلم وأبو بكر وعمر وعثمان ينزلون الأبطح قال وفي الباب عن عائشة وأبي رافع وابن عباس قال أبو عيسى حديث ابن عمر حديث صحيح حسن غريب إنما نعرفه من حديث عبد الرزاق عن عبيد الله بن عمر وقد استحب بعض أهل العلم نزول الأبطح من غير أن يروا ذلك واجبا إلا من أحب ذلك قال الشافعي ونزول الأبطح ليس من النسك في شيء إنما هو منزل نزله النبي صلى الله عليه وسلم 	" Ibn Umar narrated: ""The Prophet, Abu Bakr, Umar, and Uthman would camp at Al-Abtah."" (Sahih) "
tirmidhi09_709320	 حدثنا ابن أبي عمر حدثنا سفيان عن عمرو بن	حدثنا دينار عن عطاء عن ابن عباس قال ليس التحصيب بشيء إنما هو منزل نزله رسول الله صلى الله عليه وسلم قال أبو عيسى التحصيب نزول الأبطح قال أبو عيسى هذا حديث حسن صحيح 	 حدثنا ابن أبي عمر حدثنا سفيان عن عمرو بن دينار عن عطاء عن ابن عباس قال ليس التحصيب بشيء إنما هو منزل نزله رسول الله صلى الله عليه وسلم قال أبو عيسى التحصيب نزول الأبطح قال أبو عيسى هذا حديث حسن صحيح 	" Ibn Abbas narrated: ""At-Tahsib is nothing, it is only a place that the Messenger of Allah camped at."" (Sahih) "
tirmidhi09_709330	 حدثنا محمد بن عبد الأعلى حدثنا يزيد بن زريع حدثنا حبيب المعلم عن هشام بن عروة عن أبيه عن	حدثنا عائشة قالت إنما نزل رسول الله صلى الله عليه وسلم الأبطح لأنه كان أسمح لخروجه قال أبو عيسى هذا حديث حسن صحيح حدثنا ابن أبي عمر حدثنا سفيان عن هشام بن عروة نحوه 	 حدثنا محمد بن عبد الأعلى حدثنا يزيد بن زريع حدثنا حبيب المعلم عن هشام بن عروة عن أبيه عن عائشة قالت إنما نزل رسول الله صلى الله عليه وسلم الأبطح لأنه كان أسمح لخروجه قال أبو عيسى هذا حديث حسن صحيح حدثنا ابن أبي عمر حدثنا سفيان عن هشام بن عروة نحوه 	" Aishah narrated: ""The Messenger of Allah only camped at Al-Abtah because it was easier for his departure."" (Sahih) "
tirmidhi09_709350	 حدثنا محمد بن طريف الكوفي حدثنا أبو معاوية عن محمد بن سوقة عن محمد بن المنكدر عن جابر بن	عن عبد الله قال رفعت امرأة صبيا لها إلى رسول الله صلى الله عليه وسلم فقالت يا رسول الله ألهذا حج قال نعم ولك أجر قال وفي الباب عن ابن عباس حديث جابر حديث غريب 	 حدثنا محمد بن طريف الكوفي حدثنا أبو معاوية عن محمد بن سوقة عن محمد بن المنكدر عن جابر بن عبد الله قال رفعت امرأة صبيا لها إلى رسول الله صلى الله عليه وسلم فقالت يا رسول الله ألهذا حج قال نعم ولك أجر قال وفي الباب عن ابن عباس حديث جابر حديث غريب 	" Jabir bin Abdullah narrated: ""A woman held a boy of hers up for the Messenger of Allah and said: 'O Messenger of Allah! Is there Hajj for this one' He said: 'Yes, and you will be rewarded.'"" (Sahih) "
tirmidhi09_709360	 حدثنا قتيبة بن سعيد حدثنا حاتم بن إسماعيل عن محمد بن يوسف عن السائب بن	عن يزيد قال حج بي أبي مع رسول الله صلى الله عليه وسلم في حجة الوداع وأنا ابن سبع سنين قال أبو عيسى هذا حديث حسن صحيح 	 حدثنا قتيبة بن سعيد حدثنا حاتم بن إسماعيل عن محمد بن يوسف عن السائب بن يزيد قال حج بي أبي مع رسول الله صلى الله عليه وسلم في حجة الوداع وأنا ابن سبع سنين قال أبو عيسى هذا حديث حسن صحيح 	" As-Sa'ib bin Yazid narrated: ""My father took me for Hajj with the Messenger of Allah during the Farewell Hajj, and I was seven years old."" (Sahih) "
tirmidhi09_709370	 حدثنا قتيبة حدثنا قزعة بن سويد الباهلي عن محمد بن	حدثنا المنكدر عن جابر بن عبد الله عن النبي صلى الله عليه وسلم نحوه يعني حديث محمد بن طريف قال أبو عيسى وقد روي عن محمد بن المنكدر عن النبي صلى الله عليه وسلم مرسلا وقد أجمع أهل العلم أن الصبي إذا حج قبل أن يدرك فعليه الحج إذا أدرك لا تجزئ عنه تلك الحجة عن حجة الإسلام وكذلك المملوك إذا حج في رقه ثم أعتق فعليه الحج إذا وجد إلى ذلك سبيلا ولا يجزئ عنه ما حج في حال رقه وهو قول سفيان الثوري والشافعي وأحمد وإسحاق 	 حدثنا قتيبة حدثنا قزعة بن سويد الباهلي عن محمد بن المنكدر عن جابر بن عبد الله عن النبي صلى الله عليه وسلم نحوه يعني حديث محمد بن طريف قال أبو عيسى وقد روي عن محمد بن المنكدر عن النبي صلى الله عليه وسلم مرسلا وقد أجمع أهل العلم أن الصبي إذا حج قبل أن يدرك فعليه الحج إذا أدرك لا تجزئ عنه تلك الحجة عن حجة الإسلام وكذلك المملوك إذا حج في رقه ثم أعتق فعليه الحج إذا وجد إلى ذلك سبيلا ولا يجزئ عنه ما حج في حال رقه وهو قول سفيان الثوري والشافعي وأحمد وإسحاق 	 (Another chain) from Jabir bin Abdullah: From the Prophet, with similar (Hadith of Muhammad bin Tarif no. 924). (Sahih) 
tirmidhi09_709380	 حدثنا محمد بن إسماعيل الواسطي قال سمعت ابن نمير عن أشعث بن سوار عن أبي الزبير عن	عن جابر قال كنا إذا حججنا مع النبي صلى الله عليه وسلم فكنا نلبي عن النساء ونرمي عن الصبيان قال أبو عيسى هذا حديث غريب لا نعرفه إلا من هذا الوجه وقد أجمع أهل العلم على أن المرأة لا يلبي عنها غيرها بل هي تلبي عن نفسها ويكره لها رفع الصوت بالتلبية 	 حدثنا محمد بن إسماعيل الواسطي قال سمعت ابن نمير عن أشعث بن سوار عن أبي الزبير عن جابر قال كنا إذا حججنا مع النبي صلى الله عليه وسلم فكنا نلبي عن النساء ونرمي عن الصبيان قال أبو عيسى هذا حديث غريب لا نعرفه إلا من هذا الوجه وقد أجمع أهل العلم على أن المرأة لا يلبي عنها غيرها بل هي تلبي عن نفسها ويكره لها رفع الصوت بالتلبية 	" Jabir narrated: ""When we performed our Hajj with the Prophet we would say the Talbiyah for the women and we would stone for the boys."" (Da'if) "
tirmidhi09_709390	 حدثنا أحمد بن منيع حدثنا روح بن عبادة حدثنا ابن جريج أخبرني ابن شهاب قال حدثني سليمان بن	حدثنا يسار عن عبد الله بن عباس عن الفضل بن عباس أن امرأة من خثعم قالت يا رسول الله إن أبي أدركته فريضة الله في الحج وهو شيخ كبير لا يستطيع أن يستوي على ظهر البعير قال حجي عنه قال وفي الباب عن علي وبريدة وحصين بن عوف وأبي رزين العقيلي وسودة بنت زمعة وابن عباس قال أبو عيسى حديث الفضل بن عباس حديث حسن صحيح وروي عن ابن عباس عن حصين بن عوف المزني عن النبي صلى الله عليه وسلم وروي عن ابن عباس أيضا عن سنان بن عبد الله الجهني عن عمته عن النبي صلى الله عليه وسلم وروي عن ابن عباس عن النبي صلى الله عليه وسلم قال وسألت محمدا عن هذه الروايات فقال أصح شيء في هذا الباب ما روى ابن عباس عن الفضل بن عباس عن النبي صلى الله عليه وسلم قال محمد ويحتمل أن يكون ابن عباس سمعه من الفضل وغيره عن النبي صلى الله عليه وسلم ثم روى هذا عن النبي صلى الله عليه وسلم وأرسله ولم يذكر الذي سمعه منه قال أبو عيسى وقد صح عن النبي صلى الله عليه وسلم في هذا الباب غير حديث والعمل على هذا عند أهل العلم من أصحاب النبي صلى الله عليه وسلم وغيرهم وبه يقول الثوري وابن المبارك والشافعي وأحمد وإسحاق يرون أن يحج عن الميت وقال مالك إذا أوصى أن يحج عنه حج عنه وقد رخص بعضهم أن يحج عن الحى إذا كان كبيرا أو بحال لا يقدر أن يحج وهو قول ابن المبارك والشافعي 	 حدثنا أحمد بن منيع حدثنا روح بن عبادة حدثنا ابن جريج أخبرني ابن شهاب قال حدثني سليمان بن يسار عن عبد الله بن عباس عن الفضل بن عباس أن امرأة من خثعم قالت يا رسول الله إن أبي أدركته فريضة الله في الحج وهو شيخ كبير لا يستطيع أن يستوي على ظهر البعير قال حجي عنه قال وفي الباب عن علي وبريدة وحصين بن عوف وأبي رزين العقيلي وسودة بنت زمعة وابن عباس قال أبو عيسى حديث الفضل بن عباس حديث حسن صحيح وروي عن ابن عباس عن حصين بن عوف المزني عن النبي صلى الله عليه وسلم وروي عن ابن عباس أيضا عن سنان بن عبد الله الجهني عن عمته عن النبي صلى الله عليه وسلم وروي عن ابن عباس عن النبي صلى الله عليه وسلم قال وسألت محمدا عن هذه الروايات فقال أصح شيء في هذا الباب ما روى ابن عباس عن الفضل بن عباس عن النبي صلى الله عليه وسلم قال محمد ويحتمل أن يكون ابن عباس سمعه من الفضل وغيره عن النبي صلى الله عليه وسلم ثم روى هذا عن النبي صلى الله عليه وسلم وأرسله ولم يذكر الذي سمعه منه قال أبو عيسى وقد صح عن النبي صلى الله عليه وسلم في هذا الباب غير حديث والعمل على هذا عند أهل العلم من أصحاب النبي صلى الله عليه وسلم وغيرهم وبه يقول الثوري وابن المبارك والشافعي وأحمد وإسحاق يرون أن يحج عن الميت وقال مالك إذا أوصى أن يحج عنه حج عنه وقد رخص بعضهم أن يحج عن الحى إذا كان كبيرا أو بحال لا يقدر أن يحج وهو قول ابن المبارك والشافعي 	" Al-Fadl bin Abbas narrated: ""A woman from Khath'am said: 'O Messenger of Allah! My father has lived until Allah has made Hajj obligatory, and he is an elderly man who is not able to sit on the back of a camel.' So he (pbuh) said: 'Perform Hajj for him.'"" (Sahih) "
tirmidhi09_709400	 حدثنا محمد بن عبد الأعلى حدثنا عبد الرزاق عن سفيان الثوري عن عبد الله بن	عن عطاء قال وحدثنا علي بن حجر حدثنا علي بن مسهر عن عبد الله بن عطاء عن عبد الله بن بريدة عن أبيه قال جاءت امرأة إلى النبي صلى الله عليه وسلم فقالت إن أمي ماتت ولم تحج أفأحج عنها قال نعم حجي عنها قال أبو عيسى وهذا حديث حسن صحيح 	 حدثنا محمد بن عبد الأعلى حدثنا عبد الرزاق عن سفيان الثوري عن عبد الله بن عطاء قال وحدثنا علي بن حجر حدثنا علي بن مسهر عن عبد الله بن عطاء عن عبد الله بن بريدة عن أبيه قال جاءت امرأة إلى النبي صلى الله عليه وسلم فقالت إن أمي ماتت ولم تحج أفأحج عنها قال نعم حجي عنها قال أبو عيسى وهذا حديث حسن صحيح 	" Abdullah bin Buraidah narrated from his father who said: ""A woman came to the Prophet and said: 'My mother died and she did not perform Hajj should I perform Hajj on her behalf?' He said: 'Yes, perform Hajj on her behalf.'"" (Sahih) "
tirmidhi09_709410	 حدثنا يوسف بن عيسى حدثنا وكيع عن شعبة عن النعمان بن سالم عن عمرو بن أوس عن	عن أبي رزين العقيلي أنه أتى النبي صلى الله عليه وسلم فقال يا رسول الله إن أبي شيخ كبير لا يستطيع الحج ولا العمرة ولا الظعن قال حج عن أبيك واعتمر قال أبو عيسى هذا حديث حسن صحيح وإنما ذكرت العمرة عن النبي صلى الله عليه وسلم في هذا الحديث أن يعتمر الرجل عن غيره وأبو رزين العقيلي اسمه لقيط بن عامر 	 حدثنا يوسف بن عيسى حدثنا وكيع عن شعبة عن النعمان بن سالم عن عمرو بن أوس عن أبي رزين العقيلي أنه أتى النبي صلى الله عليه وسلم فقال يا رسول الله إن أبي شيخ كبير لا يستطيع الحج ولا العمرة ولا الظعن قال حج عن أبيك واعتمر قال أبو عيسى هذا حديث حسن صحيح وإنما ذكرت العمرة عن النبي صلى الله عليه وسلم في هذا الحديث أن يعتمر الرجل عن غيره وأبو رزين العقيلي اسمه لقيط بن عامر 	" Abu Razin Al-Uqaili narrated: That he went to the Prophet and said: ""O Messenger of Allah! My father is an elderly man who is not able to perform Hajj nor Umrah nor undertake a journey.' He said: 'Perform Hajj on behalf of your father and perform Umrah.'"" (Sahih) "
tirmidhi09_709420	 حدثنا محمد بن عبد الأعلى الصنعاني حدثنا عمر بن	حدثنا علي عن الحجاج عن محمد بن المنكدر عن جابر أن النبي صلى الله عليه وسلم سئل عن العمرة أواجبة هي قال لا وأن تعتمروا هو أفضل قال أبو عيسى هذا حديث حسن صحيح وهو قول بعض أهل العلم قالوا العمرة ليست بواجبة وكان يقال هما حجان الحج الأكبر يوم النحر والحج الأصغر العمرة وقال الشافعي العمرة سنة لا نعلم أحدا رخص في تركها وليس فيها شيء ثابت بأنها تطوع وقد روي عن النبي صلى الله عليه وسلم بإسناد وهو ضعيف لا تقوم بمثله الحجة وقد بلغنا عن ابن عباس أنه كان يوجبها قال أبو عيسى كله كلام الشافعي 	 حدثنا محمد بن عبد الأعلى الصنعاني حدثنا عمر بن علي عن الحجاج عن محمد بن المنكدر عن جابر أن النبي صلى الله عليه وسلم سئل عن العمرة أواجبة هي قال لا وأن تعتمروا هو أفضل قال أبو عيسى هذا حديث حسن صحيح وهو قول بعض أهل العلم قالوا العمرة ليست بواجبة وكان يقال هما حجان الحج الأكبر يوم النحر والحج الأصغر العمرة وقال الشافعي العمرة سنة لا نعلم أحدا رخص في تركها وليس فيها شيء ثابت بأنها تطوع وقد روي عن النبي صلى الله عليه وسلم بإسناد وهو ضعيف لا تقوم بمثله الحجة وقد بلغنا عن ابن عباس أنه كان يوجبها قال أبو عيسى كله كلام الشافعي 	" Jabir narrated that: The Prophet was asked about whether Umrah was obligatory? He said: ""No. But if you perform Umrah it is more virtuous."" (Da'if) "
tirmidhi09_709430	 حدثنا أحمد بن عبدة الضبي حدثنا زياد بن	حدثنا عبد الله عن يزيد بن أبي زياد عن مجاهد عن ابن عباس عن النبي صلى الله عليه وسلم قال دخلت العمرة في الحج إلى يوم القيامة قال وفي الباب عن سراقة بن مالك بن جعشم وجابر بن عبد الله قال أبو عيسى حديث ابن عباس حديث حسن ومعنى هذا الحديث أن لا بأس بالعمرة في أشهر الحج وهكذا قال الشافعي وأحمد وإسحاق ومعنى هذا الحديث أن أهل الجاهلية كانوا لا يعتمرون في أشهر الحج فلما جاء الإسلام رخص النبي صلى الله عليه وسلم في ذلك فقال دخلت العمرة في الحج إلى يوم القيامة يعني لا بأس بالعمرة في أشهر الحج وأشهر الحج شوال وذو القعدة وعشر من ذي الحجة لا ينبغي للرجل أن يهل بالحج إلا في أشهر الحج وأشهر الحرم رجب وذو القعدة وذو الحجة والمحرم هكذا قال غير واحد من أهل العلم من أصحاب النبي صلى الله عليه وسلم وغيرهم 	 حدثنا أحمد بن عبدة الضبي حدثنا زياد بن عبد الله عن يزيد بن أبي زياد عن مجاهد عن ابن عباس عن النبي صلى الله عليه وسلم قال دخلت العمرة في الحج إلى يوم القيامة قال وفي الباب عن سراقة بن مالك بن جعشم وجابر بن عبد الله قال أبو عيسى حديث ابن عباس حديث حسن ومعنى هذا الحديث أن لا بأس بالعمرة في أشهر الحج وهكذا قال الشافعي وأحمد وإسحاق ومعنى هذا الحديث أن أهل الجاهلية كانوا لا يعتمرون في أشهر الحج فلما جاء الإسلام رخص النبي صلى الله عليه وسلم في ذلك فقال دخلت العمرة في الحج إلى يوم القيامة يعني لا بأس بالعمرة في أشهر الحج وأشهر الحج شوال وذو القعدة وعشر من ذي الحجة لا ينبغي للرجل أن يهل بالحج إلا في أشهر الحج وأشهر الحرم رجب وذو القعدة وذو الحجة والمحرم هكذا قال غير واحد من أهل العلم من أصحاب النبي صلى الله عليه وسلم وغيرهم 	" Ibn Abbas narrated: That the Prophet said: ""Umrah has been entered into Hajj until the Day of Resurrection."" (Sahih) "
tirmidhi09_709440	 حدثنا أبو كريب حدثنا وكيع عن سفيان عن سمى عن أبي صالح عن	عن أبي هريرة قال قال رسول الله صلى الله عليه وسلم العمرة إلى العمرة تكفر ما بينهما والحج المبرور ليس له جزاء إلا الجنة قال أبو عيسى هذا حديث حسن صحيح 	 حدثنا أبو كريب حدثنا وكيع عن سفيان عن سمى عن أبي صالح عن أبي هريرة قال قال رسول الله صلى الله عليه وسلم العمرة إلى العمرة تكفر ما بينهما والحج المبرور ليس له جزاء إلا الجنة قال أبو عيسى هذا حديث حسن صحيح 	" Abu Hurairah narrated thatthe Messenger of Allahsaid: ""Umrah to 'Umrah atones for thesins between them, and for A1-HajjAl-Mabrur there is no rewardexcept Paradise."" "
tirmidhi09_709450	 حدثنا يحيى بن موسى وابن أبي عمر قالا حدثنا سفيان بن عيينة عن عمرو بن دينار عن عمرو بن أوس عن عبد الرحمن بن	عن أبي بكر أن النبي صلى الله عليه وسلم أمر عبد الرحمن بن أبي بكر أن يعمر عائشة من التنعيم قال أبو عيسى هذا حديث حسن صحيح 	 حدثنا يحيى بن موسى وابن أبي عمر قالا حدثنا سفيان بن عيينة عن عمرو بن دينار عن عمرو بن أوس عن عبد الرحمن بن أبي بكر أن النبي صلى الله عليه وسلم أمر عبد الرحمن بن أبي بكر أن يعمر عائشة من التنعيم قال أبو عيسى هذا حديث حسن صحيح 	" Amr bin Aws narrated from Abdur-Rahman bin Abi Bakr: ""The Prophet ordered Abdur-RAhman bin Abi Bakr to (accompany) Aishah to perform Umrah from At-Tan'im."" (Sahih) "
