tirmidhi16_714600	 حدثنا أبو سعيد الأشج حدثنا الأحمر عن الحجاج بن	حدثنا أرطاة عن عمرو بن شعيب عن أبيه عن جده عن عمر بن الخطاب قال سمعت رسول الله صلى الله عليه وسلم يقول لا يقاد الوالد بالولد 	 حدثنا أبو سعيد الأشج حدثنا الأحمر عن الحجاج بن أرطاة عن عمرو بن شعيب عن أبيه عن جده عن عمر بن الخطاب قال سمعت رسول الله صلى الله عليه وسلم يقول لا يقاد الوالد بالولد 	" Narrated 'Umar bin Al-Khattab: that the Messenger of Allah (SL3M) said: ""The father does not suffer retaliation for [killing] the son."" "
tirmidhi16_714610	 حدثنا محمد بن بشار حدثنا ابن أبي عدي عن إسماعيل بن مسلم عن عمرو بن دينار عن طاوس عن ابن عباس عن	عن النبي صلى الله عليه وسلم قال لا تقام الحدود في المساجد ولا يقتل الوالد بالولد قال أبو عيسى هذا حديث لا نعرفه بهذا الإسناد مرفوعا إلا من حديث إسماعيل بن مسلم وإسماعيل بن مسلم المكي قد تكلم فيه بعض أهل العلم من قبل حفظه 	 حدثنا محمد بن بشار حدثنا ابن أبي عدي عن إسماعيل بن مسلم عن عمرو بن دينار عن طاوس عن ابن عباس عن النبي صلى الله عليه وسلم قال لا تقام الحدود في المساجد ولا يقتل الوالد بالولد قال أبو عيسى هذا حديث لا نعرفه بهذا الإسناد مرفوعا إلا من حديث إسماعيل بن مسلم وإسماعيل بن مسلم المكي قد تكلم فيه بعض أهل العلم من قبل حفظه 	" Narrated Ibn 'Abbas: that the Prophet (SL3M) said: 'The Hudud are not carried in the Masjid, and the father is not killed for the son."" "
tirmidhi16_714620	 حدثنا هناد حدثنا أبو معاوية عن الأعمش عن عبد الله بن مرة عن مسروق عن عبد الله بن	عن مسعود قال قال رسول الله صلى الله عليه وسلم لا يحل دم امرئ مسلم يشهد أن لا إله إلا الله وأني رسول الله إلا بإحدى ثلاث الثيب الزاني والنفس بالنفس والتارك لدينه المفارق للجماعة قال وفي الباب عن عثمان وعائشة وابن عباس قال أبو عيسى حديث ابن مسعود حديث حسن صحيح 	 حدثنا هناد حدثنا أبو معاوية عن الأعمش عن عبد الله بن مرة عن مسروق عن عبد الله بن مسعود قال قال رسول الله صلى الله عليه وسلم لا يحل دم امرئ مسلم يشهد أن لا إله إلا الله وأني رسول الله إلا بإحدى ثلاث الثيب الزاني والنفس بالنفس والتارك لدينه المفارق للجماعة قال وفي الباب عن عثمان وعائشة وابن عباس قال أبو عيسى حديث ابن مسعود حديث حسن صحيح 	" Narrated 'Abdullah bin Mas'ud: that the Messenger of Allah (SL3M) said: ""The blood of a Muslim man, who testifies that none has the right to be worshipped Allah, is not lawful except for one of three cases: The (previously married or) married adulterer, a life for a life, and the one who leaves the religion and parts from the Jama'ah (the community of Muslims.) "
tirmidhi16_714630	 حدثنا محمد بن بشار حدثنا معدي بن	حدثنا سليمان هو البصري عن ابن عجلان عن أبيه عن أبي هريرة عن النبي صلى الله عليه وسلم قال ألا من قتل نفسا معاهدة له ذمة الله وذمة رسوله فقد أخفر بذمة الله فلا يرح رائحة الجنة وإن ريحها ليوجد من مسيرة سبعين خريفا قال وفي الباب عن أبي بكرة قال أبو عيسى حديث أبي هريرة حديث حسن صحيح وقد روي من غير وجه عن أبي هريرة عن النبي صلى الله عليه وسلم 	 حدثنا محمد بن بشار حدثنا معدي بن سليمان هو البصري عن ابن عجلان عن أبيه عن أبي هريرة عن النبي صلى الله عليه وسلم قال ألا من قتل نفسا معاهدة له ذمة الله وذمة رسوله فقد أخفر بذمة الله فلا يرح رائحة الجنة وإن ريحها ليوجد من مسيرة سبعين خريفا قال وفي الباب عن أبي بكرة قال أبو عيسى حديث أبي هريرة حديث حسن صحيح وقد روي من غير وجه عن أبي هريرة عن النبي صلى الله عليه وسلم 	" Narrated Abu Hurairah: that the Prophet (SL3M) said: ""Indeed, whoever kills a Mu'ahid that has a covenant from Allah and a covenant from His Messenger (SL3M), then he has violated the covenant with Allah and the covenant of His Messenger, so he shall not smell the fragrance of Paradise; even though its fragrance can be sensed from the distance of seventy autumns."" "
tirmidhi16_714640	 حدثنا أبو كريب حدثنا يحيى بن آدم عن أبي بكر بن عياش عن أبي سعد عن عكرمة عن	عن ابن عباس أن النبي صلى الله عليه وسلم ودى العامريين بدية المسلمين وكان لهما عهد من رسول الله صلى الله عليه وسلم قال أبو عيسى هذا حديث غريب لا نعرفه إلا من هذا الوجه وأبو سعد البقال اسمه سعيد بن المرزبان 	 حدثنا أبو كريب حدثنا يحيى بن آدم عن أبي بكر بن عياش عن أبي سعد عن عكرمة عن ابن عباس أن النبي صلى الله عليه وسلم ودى العامريين بدية المسلمين وكان لهما عهد من رسول الله صلى الله عليه وسلم قال أبو عيسى هذا حديث غريب لا نعرفه إلا من هذا الوجه وأبو سعد البقال اسمه سعيد بن المرزبان 	" Narrated Ibn 'Abbas: ""The Prophet (SL3M) assigned the same blood-money for the two 'Amiris as that of the Muslims, and they had covenant from the Messenger of Allah (SL3M)."" "
tirmidhi16_714650	 حدثنا محمود بن غيلان ويحيى بن موسى قالا حدثنا الوليد بن مسلم حدثنا الأوزاعي حدثني يحيى بن	حدثنا أبي كثير حدثني أبو سلمة حدثني أبو هريرة قال لما فتح الله على رسوله مكة قام في الناس فحمد الله وأثنى عليه ثم قال ومن قتل له قتيل فهو بخير النظرين إما أن يعفو وإما أن يقتل قال وفي الباب عن وائل بن حجر وأنس وأبي شريح خويلد بن عمرو 	 حدثنا محمود بن غيلان ويحيى بن موسى قالا حدثنا الوليد بن مسلم حدثنا الأوزاعي حدثني يحيى بن أبي كثير حدثني أبو سلمة حدثني أبو هريرة قال لما فتح الله على رسوله مكة قام في الناس فحمد الله وأثنى عليه ثم قال ومن قتل له قتيل فهو بخير النظرين إما أن يعفو وإما أن يقتل قال وفي الباب عن وائل بن حجر وأنس وأبي شريح خويلد بن عمرو 	" Narrated Abu Hurairah: ""When Allah granted His Messenger (SL3M) victory over Makkah, he stood (to deliver an address) among the people. He thanked and praised Allah, then he said: 'And from whomever (one of his relatives) was killed, then he has two options to choose from: Either to pardon or that he be killed.'"" "
tirmidhi16_714660	 حدثنا محمد بن بشار حدثنا يحيى بن سعيد حدثنا ابن أبي ذئب حدثني سعيد بن	حدثنا أبي سعيد المقبري عن أبي شريح الكعبي أن رسول الله صلى الله عليه وسلم قال إن الله حرم مكة ولم يحرمها الناس من كان يؤمن بالله واليوم الآخر فلا يسفكن فيها دما ولا يعضدن فيها شجرا فإن ترخص مترخص فقال أحلت لرسول الله صلى الله عليه وسلم فإن الله أحلها لي ولم يحلها للناس وإنما أحلت لي ساعة من نهار ثم هي حرام إلى يوم القيامة ثم إنكم معشر خزاعة قتلتم هذا الرجل من هذيل وإني عاقله فمن قتل له قتيل بعد اليوم فأهله بين خيرتين إما أن يقتلوا أو يأخذوا العقل قال أبو عيسى هذا حديث حسن صحيح وحديث أبي هريرة حديث حسن صحيح ورواه شيبان أيضا عن يحيى بن أبي كثير مثل هذا وروي عن أبي شريح الخزاعي عن النبي صلى الله عليه وسلم قال من قتل له قتيل فله أن يقتل أو يعفو أو يأخذ الدية وذهب إلى هذا بعض أهل العلم وهو قول أحمد وإسحاق 	 حدثنا محمد بن بشار حدثنا يحيى بن سعيد حدثنا ابن أبي ذئب حدثني سعيد بن أبي سعيد المقبري عن أبي شريح الكعبي أن رسول الله صلى الله عليه وسلم قال إن الله حرم مكة ولم يحرمها الناس من كان يؤمن بالله واليوم الآخر فلا يسفكن فيها دما ولا يعضدن فيها شجرا فإن ترخص مترخص فقال أحلت لرسول الله صلى الله عليه وسلم فإن الله أحلها لي ولم يحلها للناس وإنما أحلت لي ساعة من نهار ثم هي حرام إلى يوم القيامة ثم إنكم معشر خزاعة قتلتم هذا الرجل من هذيل وإني عاقله فمن قتل له قتيل بعد اليوم فأهله بين خيرتين إما أن يقتلوا أو يأخذوا العقل قال أبو عيسى هذا حديث حسن صحيح وحديث أبي هريرة حديث حسن صحيح ورواه شيبان أيضا عن يحيى بن أبي كثير مثل هذا وروي عن أبي شريح الخزاعي عن النبي صلى الله عليه وسلم قال من قتل له قتيل فله أن يقتل أو يعفو أو يأخذ الدية وذهب إلى هذا بعض أهل العلم وهو قول أحمد وإسحاق 	" Narrated Abu Shuraih Al-Ka'bi: that the Messenger of Allah (SL3M) said: ""Indeed Allah made Makkah sacred, it was not made sacred by the people. Whoever believes in Allah, and the Last Day, then let them not shed blood in it, nor cut down any of its trees. If one tries to make an excuse by saying: 'It was made lawful for the Messenger of Allah (SL3M)' then indeed Allah made it lawful for me but He did not make it lawful for the people, and it was only made lawful for me for an hour of a day. Then it is returned to being sacred until the Day of Judgement. Then, to you people of Khuza'ah who killed this man from Hudhail: I am his 'Aqil, so whomever (one of his relatives) is killed after today, then his people have two options; either they have him killed, or they take the blood-money from him.'"" "
tirmidhi16_714670	 حدثنا أبو كريب حدثنا أبو معاوية عن الأعمش عن أبي صالح عن	عن أبي هريرة قال قتل رجل على عهد رسول الله صلى الله عليه وسلم فدفع القاتل إلى وليه فقال القاتل يا رسول الله والله ما أردت قتله فقال رسول الله صلى الله عليه وسلم أما إنه إن كان صادقا فقتلته دخلت النار فخلى عنه الرجل قال وكان مكتوفا بنسعة قال فخرج يجر نسعته قال فكان يسمى ذا النسعة قال أبو عيسى هذا حديث حسن صحيح والنسعة حبل 	 حدثنا أبو كريب حدثنا أبو معاوية عن الأعمش عن أبي صالح عن أبي هريرة قال قتل رجل على عهد رسول الله صلى الله عليه وسلم فدفع القاتل إلى وليه فقال القاتل يا رسول الله والله ما أردت قتله فقال رسول الله صلى الله عليه وسلم أما إنه إن كان صادقا فقتلته دخلت النار فخلى عنه الرجل قال وكان مكتوفا بنسعة قال فخرج يجر نسعته قال فكان يسمى ذا النسعة قال أبو عيسى هذا حديث حسن صحيح والنسعة حبل 	" Narrated Abu Hurairah: ""A man was killed during the time of the Messenger of Allah (SL3M), so the killer was brought to the man's guardian. The killer said: 'O Messenger of Allah! By Allah! I did not mean to kill him.' So the Messenger of Allah (SL3M) said: 'Then if what he is saying is true, and you kill him, you would enter the Fire.' So he let the man go."" He said: ""His hands were bound behind him with a Nis'ah."" He said: ""So he left, dragging his Nis'ah."" [He said:] ""So he was called Dhan-Nis'ah'."" "
tirmidhi16_714680	 حدثنا محمد بن بشار حدثنا عبد الرحمن بن مهدي حدثنا سفيان عن علقمة بن مرثد عن سليمان بن	حدثنا بريدة عن أبيه قال كان رسول الله صلى الله عليه وسلم إذا بعث أميرا على جيش أوصاه في خاصة نفسه بتقوى الله ومن معه من المسلمين خيرا فقال اغزوا بسم الله وفي سبيل الله قاتلوا من كفر بالله اغزوا ولا تغلوا ولا تغدروا ولا تمثلوا ولا تقتلوا وليدا وفي الحديث قصة قال وفي الباب عن عبد الله بن مسعود وشداد بن أوس وعمران بن حصين وأنس وسمرة والمغيرة ويعلى بن مرة وأبي أيوب قال أبو عيسى حديث بريدة حديث حسن صحيح وكره أهل العلم المثلة 	 حدثنا محمد بن بشار حدثنا عبد الرحمن بن مهدي حدثنا سفيان عن علقمة بن مرثد عن سليمان بن بريدة عن أبيه قال كان رسول الله صلى الله عليه وسلم إذا بعث أميرا على جيش أوصاه في خاصة نفسه بتقوى الله ومن معه من المسلمين خيرا فقال اغزوا بسم الله وفي سبيل الله قاتلوا من كفر بالله اغزوا ولا تغلوا ولا تغدروا ولا تمثلوا ولا تقتلوا وليدا وفي الحديث قصة قال وفي الباب عن عبد الله بن مسعود وشداد بن أوس وعمران بن حصين وأنس وسمرة والمغيرة ويعلى بن مرة وأبي أيوب قال أبو عيسى حديث بريدة حديث حسن صحيح وكره أهل العلم المثلة 	" Narrated Buraidah: from his father who said: ""Whenever the Messenger of Allah (SL3M) dispatched a commander of an army he would exhort him personally; that he should have Taqwa of Allah, and regarding those of the Muslims who are with him; that he should be good to them. He would say: 'Fight in the Name of Allah and in Allah's curse. Fight those who disbelieve in Allah and fight, do not be treacherous, nor mutilate, nor kill a child."" "
tirmidhi16_714690	 حدثنا أحمد بن منيع حدثنا هشيم حدثنا خالد عن أبي قلابة عن أبي الأشعث الصنعاني عن شداد بن	عن أوس أن النبي صلى الله عليه وسلم قال إن الله كتب الإحسان على كل شيء فإذا قتلتم فأحسنوا القتلة وإذا ذبحتم فأحسنوا الذبحة وليحد أحدكم شفرته وليرح ذبيحته قال هذا حديث حسن صحيح أبو الأشعث الصنعاني اسمه شرحبيل بن آدة 	 حدثنا أحمد بن منيع حدثنا هشيم حدثنا خالد عن أبي قلابة عن أبي الأشعث الصنعاني عن شداد بن أوس أن النبي صلى الله عليه وسلم قال إن الله كتب الإحسان على كل شيء فإذا قتلتم فأحسنوا القتلة وإذا ذبحتم فأحسنوا الذبحة وليحد أحدكم شفرته وليرح ذبيحته قال هذا حديث حسن صحيح أبو الأشعث الصنعاني اسمه شرحبيل بن آدة 	" Narrated Shaddad bin Aws: that the Prophet (SL3M) said: ""Indeed Allah has decreed Ihsan in everything. So when you kill, then do the killing well, and when you slaughter, then do the slaughtering well. Let one of you sharpen his blade, and let him comfort his animal (before slaughtering)."" "
tirmidhi16_714700	 حدثنا علي بن سعيد الكندي الكوفي حدثنا ابن أبي زائدة عن محمد بن عمرو عن أبي سلمة عن	عن أبي هريرة قال قضى رسول الله صلى الله عليه وسلم في الجنين بغرة عبد أو أمة فقال الذي قضي عليه أنعطي من لا شرب ولا أكل ولا صاح فاستهل فمثل ذلك يطل فقال النبي صلى الله عليه وسلم إن هذا ليقول بقول شاعر بل فيه غرة عبد أو أمة وفي الباب عن حمل بن مالك بن النابغة والمغيرة بن شعبة قال أبو عيسى حديث أبي هريرة حديث حسن صحيح والعمل على هذا عند أهل العلم وقال بعضهم الغرة عبد أو أمة أو خمسمائة درهم وقال بعضهم أو فرس أو بغل 	 حدثنا علي بن سعيد الكندي الكوفي حدثنا ابن أبي زائدة عن محمد بن عمرو عن أبي سلمة عن أبي هريرة قال قضى رسول الله صلى الله عليه وسلم في الجنين بغرة عبد أو أمة فقال الذي قضي عليه أنعطي من لا شرب ولا أكل ولا صاح فاستهل فمثل ذلك يطل فقال النبي صلى الله عليه وسلم إن هذا ليقول بقول شاعر بل فيه غرة عبد أو أمة وفي الباب عن حمل بن مالك بن النابغة والمغيرة بن شعبة قال أبو عيسى حديث أبي هريرة حديث حسن صحيح والعمل على هذا عند أهل العلم وقال بعضهم الغرة عبد أو أمة أو خمسمائة درهم وقال بعضهم أو فرس أو بغل 	" Narrated Abu Hurairah: ""The Messenger of Allah (SL3M) judged that a Ghurrah male slave or female slave be given in the case of a fetus. The one of the judgement was made against said: 'Should we give something for one who did not drink, not eat, nor cry out to shed a tear, the likes of which is useless?' So the Prophet (SL3M) said: 'This is the speech of a poet. Rather it requires a Ghurrah: a male slave or a female slave.'"" "
tirmidhi16_714711	 حدثنا الحسن بن علي الخلال حدثنا وهب بن جرير حدثنا شعبة عن منصور عن إبراهيم عن عبيد بن	حدثنا نضلة عن المغيرة بن شعبة أن امرأتين كانتا ضرتين فرمت إحداهما الأخرى بحجر أو عمود فسطاط فألقت جنينها فقضى رسول الله صلى الله عليه وسلم في الجنين غرة عبد أو أمة وجعله على عصبة المرأة قال الحسن وأخبرنا زيد بن حباب عن سفيان عن منصور بهذا الحديث نحوه هذا حديث حسن صحيح 	 حدثنا الحسن بن علي الخلال حدثنا وهب بن جرير حدثنا شعبة عن منصور عن إبراهيم عن عبيد بن نضلة عن المغيرة بن شعبة أن امرأتين كانتا ضرتين فرمت إحداهما الأخرى بحجر أو عمود فسطاط فألقت جنينها فقضى رسول الله صلى الله عليه وسلم في الجنين غرة عبد أو أمة وجعله على عصبة المرأة قال الحسن وأخبرنا زيد بن حباب عن سفيان عن منصور بهذا الحديث نحوه هذا حديث حسن صحيح 	" Narrated Al-Mughirah bin Shu'bah: ""Two women co-wives, (were fighting), and one of them hit the other with a stone or a tent post, causing her to have a miscarriage. The Messenger of Allah (SL3M) judged that a Ghurrah male or female slave should be given for fetus, and he required it from the Asabah of the woman.""(Another Chain) for this Hadith [and it is similar to this]. "
tirmidhi16_714730	 حدثنا أحمد بن منيع حدثنا هشيم أنبأنا مطرف عن الشعبي حدثنا	عن أبو جحيفة قال قلت لعلي يا أمير المؤمنين هل عندكم سوداء في بيضاء ليس في كتاب الله قال لا والذي فلق الحبة وبرأ النسمة ما علمته إلا فهما يعطيه الله رجلا في القرآن وما في الصحيفة قلت وما في الصحيفة قال فيها العقل وفكاك الأسير وأن لا يقتل مؤمن بكافر قال وفي الباب عن عبد الله بن عمرو قال أبو عيسى حديث علي حديث حسن صحيح والعمل على هذا عند بعض أهل العلم وهو قول سفيان الثوري ومالك بن أنس والشافعي وأحمد وإسحاق قالوا لا يقتل مؤمن بكافر وقال بعض أهل العلم يقتل المسلم بالمعاهد والقول الأول أصح 	 حدثنا أحمد بن منيع حدثنا هشيم أنبأنا مطرف عن الشعبي حدثنا أبو جحيفة قال قلت لعلي يا أمير المؤمنين هل عندكم سوداء في بيضاء ليس في كتاب الله قال لا والذي فلق الحبة وبرأ النسمة ما علمته إلا فهما يعطيه الله رجلا في القرآن وما في الصحيفة قلت وما في الصحيفة قال فيها العقل وفكاك الأسير وأن لا يقتل مؤمن بكافر قال وفي الباب عن عبد الله بن عمرو قال أبو عيسى حديث علي حديث حسن صحيح والعمل على هذا عند بعض أهل العلم وهو قول سفيان الثوري ومالك بن أنس والشافعي وأحمد وإسحاق قالوا لا يقتل مؤمن بكافر وقال بعض أهل العلم يقتل المسلم بالمعاهد والقول الأول أصح 	" Abu Juhaifah said: ""I said to 'Ali: O Commander of the Believers! Do you have anything written that is not in Allah's Book?' He said: 'By the One Who splits the seed and creates the soul, I have not learned from it except what understanding of the Qur'an Allah gives to a man, and what is in this sheet of paper.' I said: 'What is in the paper?' He said: 'It is the 'Aql, the (ransom for) release of captives, and the judgement that no believer is killed for a disbeliever.'"" "
