tirmidhi15_714242	 حدثنا يوسف بن عيسى حدثنا الفضل بن موسى عن أبي حمزة السكري عن عبد العزيز بن رفيع عن ابن أبي مليكة عن	عن ابن عباس قال قال رسول الله صلى الله عليه وسلم الشريك شفيع والشفعة في كل شيء قال أبو عيسى هذا حديث لا نعرفه مثل هذا إلا من حديث أبي حمزة السكري وقد روى غير واحد هذا الحديث عن عبد العزيز بن رفيع عن ابن أبي مليكة عن النبي صلى الله عليه وسلم مرسلا وهذا أصح حدثنا هناد حدثنا أبو بكر بن عياش عن عبد العزيز بن رفيع عن ابن أبي مليكة عن النبي صلى الله عليه وسلم نحوه بمعناه وليس فيه عن ابن عباس وهكذا روى غير واحد عن عبد العزيز بن رفيع مثل هذا ليس فيه عن ابن عباس وهذا أصح من حديث أبي حمزة وأبو حمزة ثقة يمكن أن يكون الخطأ من غير أبي حمزة حدثنا هناد حدثنا أبو الأحوص عن عبد العزيز بن رفيع عن ابن أبي مليكة عن النبي صلى الله عليه وسلم نحو حديث أبي بكر بن عياش وقال أكثر أهل العلم إنما تكون الشفعة في الدور والأرضين ولم يروا الشفعة في كل شيء وقال بعض أهل العلم الشفعة في كل شيء والقول الأول أصح 	 حدثنا يوسف بن عيسى حدثنا الفضل بن موسى عن أبي حمزة السكري عن عبد العزيز بن رفيع عن ابن أبي مليكة عن ابن عباس قال قال رسول الله صلى الله عليه وسلم الشريك شفيع والشفعة في كل شيء قال أبو عيسى هذا حديث لا نعرفه مثل هذا إلا من حديث أبي حمزة السكري وقد روى غير واحد هذا الحديث عن عبد العزيز بن رفيع عن ابن أبي مليكة عن النبي صلى الله عليه وسلم مرسلا وهذا أصح حدثنا هناد حدثنا أبو بكر بن عياش عن عبد العزيز بن رفيع عن ابن أبي مليكة عن النبي صلى الله عليه وسلم نحوه بمعناه وليس فيه عن ابن عباس وهكذا روى غير واحد عن عبد العزيز بن رفيع مثل هذا ليس فيه عن ابن عباس وهذا أصح من حديث أبي حمزة وأبو حمزة ثقة يمكن أن يكون الخطأ من غير أبي حمزة حدثنا هناد حدثنا أبو الأحوص عن عبد العزيز بن رفيع عن ابن أبي مليكة عن النبي صلى الله عليه وسلم نحو حديث أبي بكر بن عياش وقال أكثر أهل العلم إنما تكون الشفعة في الدور والأرضين ولم يروا الشفعة في كل شيء وقال بعض أهل العلم الشفعة في كل شيء والقول الأول أصح 	" Narrated Ibn Abbas: that the Messenger of Allah (SL3M) said: ""The partner is the preemptor, and preemption is in everything."" "
tirmidhi15_714271	 حدثنا قتيبة حدثنا إسماعيل بن جعفر عن ربيعة بن	حدثنا أبي عبد الرحمن عن يزيد مولى المنبعث عن زيد بن خالد الجهني أن رجلا سأل رسول الله صلى الله عليه وسلم عن اللقطة فقال عرفها سنة ثم اعرف وكاءها ووعاءها وعفاصها ثم استنفق بها فإن جاء ربها فأدها إليه فقال له يا رسول الله فضالة الغنم فقال خذها فإنما هي لك أو لأخيك أو للذئب فقال يا رسول الله فضالة الإبل قال فغضب النبي صلى الله عليه وسلم حتى احمرت وجنتاه أو احمر وجهه فقال ما لك ولها معها حذاؤها وسقاؤها حتى تلقى ربها حديث زيد بن خالد حديث حسن صحيح وقد روي عنه من غير وجه وحديث يزيد مولى المنبعث عن زيد بن خالد حديث حسن صحيح وقد روي عنه من غير وجه قال وفي الباب عن أبى بن كعب وعبد الله بن عمرو والجارود بن المعلى وعياض بن حمار وجرير بن عبد الله والعمل على هذا عند بعض أهل العلم من أصحاب النبي صلى الله عليه وسلم وغيرهم ورخصوا في اللقطة إذا عرفها سنة فلم يجد من يعرفها أن ينتفع بها وهو قول الشافعي وأحمد وإسحاق وقال بعض أهل العلم من أصحاب النبي صلى الله عليه وسلم وغيرهم يعرفها سنة فإن جاء صاحبها وإلا تصدق بها وهو قول سفيان الثوري وعبد الله بن المبارك وهو قول أهل الكوفة لم يروا لصاحب اللقطة أن ينتفع بها إذا كان غنيا وقال الشافعي ينتفع بها وإن كان غنيا لأن أبى بن كعب أصاب على عهد رسول الله صلى الله عليه وسلم صرة فيها مائة دينار فأمره رسول الله صلى الله عليه وسلم أن يعرفها ثم ينتفع بها وكان أبى كثير المال من مياسير أصحاب رسول الله صلى الله عليه وسلم فأمره النبي صلى الله عليه وسلم أن يعرفها فلم يجد من يعرفها فأمره النبي صلى الله عليه وسلم أن يأكلها فلو كانت اللقطة لم تحل إلا لمن تحل له الصدقة لم تحل لعلي بن أبي طالب لأن علي بن أبي طالب أصاب دينارا على عهد النبي صلى الله عليه وسلم فعرفه فلم يجد من يعرفه فأمره النبي صلى الله عليه وسلم بأكله وكان لا يحل له الصدقة وقد رخص بعض أهل العلم إذا كانت اللقطة يسيرة أن ينتفع بها ولا يعرفها وقال بعضهم إذا كان دون دينار يعرفها قدر جمعة وهو قول إسحاق بن إبراهيم 	 حدثنا قتيبة حدثنا إسماعيل بن جعفر عن ربيعة بن أبي عبد الرحمن عن يزيد مولى المنبعث عن زيد بن خالد الجهني أن رجلا سأل رسول الله صلى الله عليه وسلم عن اللقطة فقال عرفها سنة ثم اعرف وكاءها ووعاءها وعفاصها ثم استنفق بها فإن جاء ربها فأدها إليه فقال له يا رسول الله فضالة الغنم فقال خذها فإنما هي لك أو لأخيك أو للذئب فقال يا رسول الله فضالة الإبل قال فغضب النبي صلى الله عليه وسلم حتى احمرت وجنتاه أو احمر وجهه فقال ما لك ولها معها حذاؤها وسقاؤها حتى تلقى ربها حديث زيد بن خالد حديث حسن صحيح وقد روي عنه من غير وجه وحديث يزيد مولى المنبعث عن زيد بن خالد حديث حسن صحيح وقد روي عنه من غير وجه قال وفي الباب عن أبى بن كعب وعبد الله بن عمرو والجارود بن المعلى وعياض بن حمار وجرير بن عبد الله والعمل على هذا عند بعض أهل العلم من أصحاب النبي صلى الله عليه وسلم وغيرهم ورخصوا في اللقطة إذا عرفها سنة فلم يجد من يعرفها أن ينتفع بها وهو قول الشافعي وأحمد وإسحاق وقال بعض أهل العلم من أصحاب النبي صلى الله عليه وسلم وغيرهم يعرفها سنة فإن جاء صاحبها وإلا تصدق بها وهو قول سفيان الثوري وعبد الله بن المبارك وهو قول أهل الكوفة لم يروا لصاحب اللقطة أن ينتفع بها إذا كان غنيا وقال الشافعي ينتفع بها وإن كان غنيا لأن أبى بن كعب أصاب على عهد رسول الله صلى الله عليه وسلم صرة فيها مائة دينار فأمره رسول الله صلى الله عليه وسلم أن يعرفها ثم ينتفع بها وكان أبى كثير المال من مياسير أصحاب رسول الله صلى الله عليه وسلم فأمره النبي صلى الله عليه وسلم أن يعرفها فلم يجد من يعرفها فأمره النبي صلى الله عليه وسلم أن يأكلها فلو كانت اللقطة لم تحل إلا لمن تحل له الصدقة لم تحل لعلي بن أبي طالب لأن علي بن أبي طالب أصاب دينارا على عهد النبي صلى الله عليه وسلم فعرفه فلم يجد من يعرفه فأمره النبي صلى الله عليه وسلم بأكله وكان لا يحل له الصدقة وقد رخص بعض أهل العلم إذا كانت اللقطة يسيرة أن ينتفع بها ولا يعرفها وقال بعضهم إذا كان دون دينار يعرفها قدر جمعة وهو قول إسحاق بن إبراهيم 	" Narrated Zaid bin Khalid Al-Juhni: ""A man asked the Messenger of Allah (SL3M) about lost items. So he said: 'Make a public announcement about it for one year. Remember its string, its contained, and its sack. Then use it, and if its owner comes then give it to him.' So he said to him: 'O Messenger of Allah! What about the stray sheep?' He said:'Take it, for it is either for you, your brother, or the wolf.' He said: 'O Messenger of Allah! What about stray camel?'"" He said: ""Then the Prophet (SL3M) got angry until his cheeks became red or his face became red. He said: 'What concern is it of yours? It has its feet and its water reserve until it reaches its owner.'"" "
tirmidhi15_714282	 حدثنا محمد بن بشار حدثنا أبو بكر الحنفي أخبرنا الضحاك بن عثمان حدثني سالم أبو النضر عن بسر بن سعيد عن زيد بن	عن خالد الجهني أن رسول الله صلى الله عليه وسلم سئل عن اللقطة فقال عرفها سنة فإن اعترفت فأدها وإلا فاعرف وعاءها وعفاصها ووكاءها وعددها ثم كلها فإذا جاء صاحبها فأدها قال أبو عيسى حديث زيد بن خالد حديث حسن صحيح غريب من هذا الوجه قال أحمد أصح شيء في هذا الباب هذا الحديث 	 حدثنا محمد بن بشار حدثنا أبو بكر الحنفي أخبرنا الضحاك بن عثمان حدثني سالم أبو النضر عن بسر بن سعيد عن زيد بن خالد الجهني أن رسول الله صلى الله عليه وسلم سئل عن اللقطة فقال عرفها سنة فإن اعترفت فأدها وإلا فاعرف وعاءها وعفاصها ووكاءها وعددها ثم كلها فإذا جاء صاحبها فأدها قال أبو عيسى حديث زيد بن خالد حديث حسن صحيح غريب من هذا الوجه قال أحمد أصح شيء في هذا الباب هذا الحديث 	" Zaid bin Khalid Al-Juhni narrated that the Messenger of Allah (SL3M) was asked about the lost item. He said: ""Make a public announcement about it for one year, if it is claimed then give it to him. Otherwise remember its sack, string, and its count. Then use it, and if its owner comes, give it to him."" "
tirmidhi15_714290	 حدثنا الحسن بن علي الخلال حدثنا عبد الله بن	حدثنا نمير ويزيد بن هارون عن سفيان الثوري عن سلمة بن كهيل عن سويد بن غفلة قال خرجت مع زيد بن صوحان وسلمان بن ربيعة فوجدت سوطا قال ابن نمير في حديثه فالتقطت سوطا فأخذته قالا دعه فقلت لا أدعه تأكله السباع لآخذنه فلأستمتعن به فقدمت على أبى بن كعب فسألته عن ذلك وحدثته الحديث فقال أحسنت أنا وجدت على عهد رسول الله صلى الله عليه وسلم صرة فيها مائة دينار قال فأتيته بها فقال لي عرفها حولا فعرفتها حولا فما أجد من يعرفها ثم أتيته بها فقال عرفها حولا آخر فعرفتها ثم أتيته بها فقال عرفها حولا آخر وقال أحص عدتها ووعاءها ووكاءها فإن جاء طالبها فأخبرك بعدتها ووعائها ووكائها فادفعها إليه وإلا فاستمتع بها قال هذا حديث حسن صحيح 	 حدثنا الحسن بن علي الخلال حدثنا عبد الله بن نمير ويزيد بن هارون عن سفيان الثوري عن سلمة بن كهيل عن سويد بن غفلة قال خرجت مع زيد بن صوحان وسلمان بن ربيعة فوجدت سوطا قال ابن نمير في حديثه فالتقطت سوطا فأخذته قالا دعه فقلت لا أدعه تأكله السباع لآخذنه فلأستمتعن به فقدمت على أبى بن كعب فسألته عن ذلك وحدثته الحديث فقال أحسنت أنا وجدت على عهد رسول الله صلى الله عليه وسلم صرة فيها مائة دينار قال فأتيته بها فقال لي عرفها حولا فعرفتها حولا فما أجد من يعرفها ثم أتيته بها فقال عرفها حولا آخر فعرفتها ثم أتيته بها فقال عرفها حولا آخر وقال أحص عدتها ووعاءها ووكاءها فإن جاء طالبها فأخبرك بعدتها ووعائها ووكائها فادفعها إليه وإلا فاستمتع بها قال هذا حديث حسن صحيح 	" Suwaid bin Ghafalah said: ""I went out with Zaid bin Suhan and Salman bin Rabi'ah, and found a whip."" In his narration Ibn Numair (one of the narrators) said: ""I found a lost whip and took it. They said: 'Leave it'. I said: 'I will not leave it to be eaten by predators. I will take it to make use of it.' So I met up with Ubayy bin Ka'b and asked him about that. So he narrated the Hadith, he said: 'That is fine. I found a sack containing one hundred Dinar during the lifetime of the Messenger of Allah (SL3M)' He said: 'So I brought it to him. He said to me: ""Make a public announcement about it for one year."" So I announced it for a year but did not find anyone to claim it. Then I brought it to him. He said to me: ""Make a public announcement about it for another year."" So I announced it for a year but did not find anyone to claim it. Then I brought it to him. He said: ""Make a public announcement about if for another year."" And he said: ""Remember its amount, its container and its string. If someone comes seeking it and informs you of its amount and its string, then give it to him, otherwise use it."" "
tirmidhi15_714300	 حدثنا علي بن حجر أنبأنا إسماعيل بن إبراهيم عن ابن عون عن نافع عن	عن ابن عمر قال أصاب عمر أرضا بخيبر فقال يا رسول الله أصبت مالا بخيبر لم أصب مالا قط أنفس عندي منه فما تأمرني قال إن شئت حبست أصلها وتصدقت بها فتصدق بها عمر أنها لا يباع أصلها ولا يوهب ولا يورث تصدق بها في الفقراء والقربى وفي الرقاب وفي سبيل الله وابن السبيل والضيف لا جناح على من وليها أن يأكل منها بالمعروف أو يطعم صديقا غير متمول فيه قال فذكرته لمحمد بن سيرين فقال غير متأثل مالا قال ابن عون فحدثني به رجل آخر أنه قرأها في قطعة أديم أحمر غير متأثل مالا قال إسماعيل وأنا قرأتها عند ابن عبيد الله بن عمر فكان فيه غير متأثل مالا قال أبو عيسى هذا حديث حسن صحيح والعمل على هذا عند أهل العلم من أصحاب النبي صلى الله عليه وسلم وغيرهم لا نعلم بين المتقدمين منهم في ذلك اختلافا في إجازة وقف الأرضين وغير ذلك 	 حدثنا علي بن حجر أنبأنا إسماعيل بن إبراهيم عن ابن عون عن نافع عن ابن عمر قال أصاب عمر أرضا بخيبر فقال يا رسول الله أصبت مالا بخيبر لم أصب مالا قط أنفس عندي منه فما تأمرني قال إن شئت حبست أصلها وتصدقت بها فتصدق بها عمر أنها لا يباع أصلها ولا يوهب ولا يورث تصدق بها في الفقراء والقربى وفي الرقاب وفي سبيل الله وابن السبيل والضيف لا جناح على من وليها أن يأكل منها بالمعروف أو يطعم صديقا غير متمول فيه قال فذكرته لمحمد بن سيرين فقال غير متأثل مالا قال ابن عون فحدثني به رجل آخر أنه قرأها في قطعة أديم أحمر غير متأثل مالا قال إسماعيل وأنا قرأتها عند ابن عبيد الله بن عمر فكان فيه غير متأثل مالا قال أبو عيسى هذا حديث حسن صحيح والعمل على هذا عند أهل العلم من أصحاب النبي صلى الله عليه وسلم وغيرهم لا نعلم بين المتقدمين منهم في ذلك اختلافا في إجازة وقف الأرضين وغير ذلك 	" Narrated Isma'il bin Ibrahim: from Ibn 'Awn, from Nafi' that Ibn 'Umar said: ""Umar got some land from Khaibar and said: 'O Messenger of Allah! I got some wealth from Khaibar and I never ever had any wealth as plentiful as it, so what do you order me (to do with it)?' He said: 'If you wish, make it a grant and give charity from it.' So 'Umar gave it in charity: That is not be sold entirely, nor given away, nor inherited, to be used to produce charity for the needy, those who are near it, for freeing slaves, for the cause of Allah, the wayfarer, the guest, and that there is no harm on its custodian consuming what is customary from it, or eating from its charity, without trying to amass wealth from it."" "
tirmidhi15_714310	 حدثنا علي بن حجر أخبرنا إسماعيل بن جعفر عن العلاء بن عبد الرحمن عن أبيه عن	عن أبي هريرة رضى الله عنه أن رسول الله صلى الله عليه وسلم قال إذا مات الإنسان انقطع عمله إلا من ثلاث صدقة جارية وعلم ينتفع به وولد صالح يدعو له قال أبو عيسى هذا حديث حسن صحيح 	 حدثنا علي بن حجر أخبرنا إسماعيل بن جعفر عن العلاء بن عبد الرحمن عن أبيه عن أبي هريرة رضى الله عنه أن رسول الله صلى الله عليه وسلم قال إذا مات الإنسان انقطع عمله إلا من ثلاث صدقة جارية وعلم ينتفع به وولد صالح يدعو له قال أبو عيسى هذا حديث حسن صحيح 	" Abu Hurairah, may Allah be pleased with him, narrated that the Messenger of Allah (SL3M) said: ""When a person dies, his deeds are cut off except for three: Continuing charity, knowledge that others benefited from, and a righteous son who supplicates for him."" "
tirmidhi15_714321	 حدثنا أحمد بن منيع حدثنا سفيان عن الزهري عن سعيد بن المسيب عن	عن أبي هريرة قال قال رسول الله صلى الله عليه وسلم العجماء جرحها جبار والبئر جبار والمعدن جبار وفي الركاز الخمس حدثنا قتيبة حدثنا الليث عن ابن شهاب عن سعيد بن المسيب وأبي سلمة بن عبد الرحمن عن أبي هريرة عن النبي صلى الله عليه وسلم نحوه قال وفي الباب عن جابر وعمرو بن عوف المزني وعبادة بن الصامت قال أبو عيسى حديث أبي هريرة حديث حسن صحيح حدثنا الأنصاري حدثنا معن قال أخبرنا مالك بن أنس وتفسير حديث النبي صلى الله عليه وسلم العجماء جرحها جبار يقول هدر لا دية فيه قال أبو عيسى ومعنى قوله العجماء جرحها جبار فسر ذلك بعض أهل العلم قالوا العجماء الدابة المنفلتة من صاحبها فما أصابت في انفلاتها فلا غرم على صاحبها والمعدن جبار يقول إذا احتفر الرجل معدنا فوقع فيها إنسان فلا غرم عليه وكذلك البئر إذا احتفرها الرجل للسبيل فوقع فيها إنسان فلا غرم على صاحبها وفي الركاز الخمس والركاز ما وجد في دفن أهل الجاهلية فمن وجد ركازا أدى منه الخمس إلى السلطان وما بقي فهو له 	 حدثنا أحمد بن منيع حدثنا سفيان عن الزهري عن سعيد بن المسيب عن أبي هريرة قال قال رسول الله صلى الله عليه وسلم العجماء جرحها جبار والبئر جبار والمعدن جبار وفي الركاز الخمس حدثنا قتيبة حدثنا الليث عن ابن شهاب عن سعيد بن المسيب وأبي سلمة بن عبد الرحمن عن أبي هريرة عن النبي صلى الله عليه وسلم نحوه قال وفي الباب عن جابر وعمرو بن عوف المزني وعبادة بن الصامت قال أبو عيسى حديث أبي هريرة حديث حسن صحيح حدثنا الأنصاري حدثنا معن قال أخبرنا مالك بن أنس وتفسير حديث النبي صلى الله عليه وسلم العجماء جرحها جبار يقول هدر لا دية فيه قال أبو عيسى ومعنى قوله العجماء جرحها جبار فسر ذلك بعض أهل العلم قالوا العجماء الدابة المنفلتة من صاحبها فما أصابت في انفلاتها فلا غرم على صاحبها والمعدن جبار يقول إذا احتفر الرجل معدنا فوقع فيها إنسان فلا غرم عليه وكذلك البئر إذا احتفرها الرجل للسبيل فوقع فيها إنسان فلا غرم على صاحبها وفي الركاز الخمس والركاز ما وجد في دفن أهل الجاهلية فمن وجد ركازا أدى منه الخمس إلى السلطان وما بقي فهو له 	" Narrated Abu Hurairah: that the Messenger of Allah (SL3M) said: ""The injuries caused by the animal are without liability, and wells are without liability, and mines are without liability, and the Khumus is due on Rikaz.""(Another Chain) from Abu Hurairah, from the Prophet (SL3M) with similar meaning. "
