tirmidhi27_720130	 حدثنا محمد بن بشار أخبرنا يحيى بن سعيد أخبرنا بهز بن حكيم حدثني أبي عن	أخبرنا جدي قال قلت يا رسول الله من أبر قال أمك قال قلت ثم من قال أمك قال قلت ثم من قال أمك قال قلت ثم من قال ثم أباك ثم الأقرب فالأقرب قال وفي الباب عن أبي هريرة وعبد الله بن عمر وعائشة وأبي الدرداء قال أبو عيسى وبهز بن حكيم هو ابن معاوية بن حيدة القشيري وهذا حديث حسن وقد تكلم شعبة في بهز بن حكيم وهو ثقة عند أهل الحديث وروى عنه معمر والثوري وحماد بن سلمة وغير واحد من الأئمة 	 حدثنا محمد بن بشار أخبرنا يحيى بن سعيد أخبرنا بهز بن حكيم حدثني أبي عن جدي قال قلت يا رسول الله من أبر قال أمك قال قلت ثم من قال أمك قال قلت ثم من قال أمك قال قلت ثم من قال ثم أباك ثم الأقرب فالأقرب قال وفي الباب عن أبي هريرة وعبد الله بن عمر وعائشة وأبي الدرداء قال أبو عيسى وبهز بن حكيم هو ابن معاوية بن حيدة القشيري وهذا حديث حسن وقد تكلم شعبة في بهز بن حكيم وهو ثقة عند أهل الحديث وروى عنه معمر والثوري وحماد بن سلمة وغير واحد من الأئمة 	" Bahz bin Hakim narrated from his father, from his grandfather who said: ""I said: 'O Messenger of Allah! Who most deserves(my) reverence?' He said: 'Your mother.'"" He said: ""I said: 'Then who?' He said: 'Your mother.'""He said: ""I said: 'Then who?' He said: 'Your mother.'""He said: ""I said: 'Then who?' He said: 'Then your father, then the nearest relatives, then the nearest relatives.'""(Hasan) "
tirmidhi27_720140	 حدثنا أحمد بن محمد أخبرنا عبد الله بن المبارك عن المسعودي عن الوليد بن العيزار عن أبي عمرو الشيباني عن	عن ابن مسعود قال سألت رسول الله صلى الله عليه وسلم فقلت يا رسول الله أى الأعمال أفضل قال الصلاة لميقاتها قلت ثم ماذا يا رسول الله قال بر الوالدين قلت ثم ماذا يا رسول الله قال الجهاد في سبيل الله ثم سكت عني رسول الله صلى الله عليه وسلم ولو استزدته لزادني قال أبو عيسى وهذا حديث حسن صحيح رواه الشيباني وشعبة وغير واحد عن الوليد بن العيزار وقد روي هذا الحديث من غير وجه عن أبي عمرو الشيباني عن ابن مسعود وأبو عمرو الشيباني اسمه سعد بن إياس 	 حدثنا أحمد بن محمد أخبرنا عبد الله بن المبارك عن المسعودي عن الوليد بن العيزار عن أبي عمرو الشيباني عن ابن مسعود قال سألت رسول الله صلى الله عليه وسلم فقلت يا رسول الله أى الأعمال أفضل قال الصلاة لميقاتها قلت ثم ماذا يا رسول الله قال بر الوالدين قلت ثم ماذا يا رسول الله قال الجهاد في سبيل الله ثم سكت عني رسول الله صلى الله عليه وسلم ولو استزدته لزادني قال أبو عيسى وهذا حديث حسن صحيح رواه الشيباني وشعبة وغير واحد عن الوليد بن العيزار وقد روي هذا الحديث من غير وجه عن أبي عمرو الشيباني عن ابن مسعود وأبو عمرو الشيباني اسمه سعد بن إياس 	" Ibn Mas'ud said: ""I asked the Messenger of Allah: 'O Messenger of Allah! Which is the most virtuous of deeds?' He said: 'Salat during its appropriate time.'I said: 'Then what, O Messenger of Allah?' He said: 'Being dutiful to ones parents.' I said: 'Then what, O Messenger of Allah?' He said: 'Jihad in the cause of Allah.'Then the messenger of Allah was silent, and if I had asked him more, he would have tol me more.'""(Sahih) "
tirmidhi27_720150	 حدثنا أبو حفص عمرو بن علي حدثنا خالد بن	حدثنا الحارث حدثنا شعبة عن يعلى بن عطاء عن أبيه عن عبد الله بن عمرو عن النبي صلى الله عليه وسلم قال رضا الرب في رضا الوالد وسخط الرب في سخط الوالد 	 حدثنا أبو حفص عمرو بن علي حدثنا خالد بن الحارث حدثنا شعبة عن يعلى بن عطاء عن أبيه عن عبد الله بن عمرو عن النبي صلى الله عليه وسلم قال رضا الرب في رضا الوالد وسخط الرب في سخط الوالد 	" Abdullah bin Amr narrated that: the Prophet said: ""The Lord's pleasure is in the parent's pleasure, and the Lord's anger is in the parent's anger.""(Hasan). "
tirmidhi27_720160	 حدثنا محمد بن بشار حدثنا محمد بن جعفر عن شعبة عن يعلى بن عطاء عن أبيه عن عبد الله بن	عن عمرو نحوه ولم يرفعه وهذا أصح قال أبو عيسى وهكذا روى أصحاب شعبة عن شعبة عن يعلى بن عطاء عن أبيه عن عبد الله بن عمرو موقوفا ولا نعلم أحدا رفعه غير خالد بن الحارث عن شعبة وخالد بن الحارث ثقة مأمون قال سمعت محمد بن المثنى يقول ما رأيت بالبصرة مثل خالد بن الحارث ولا بالكوفة مثل عبد الله بن إدريس قال وفي الباب عن عبد الله بن مسعود 	 حدثنا محمد بن بشار حدثنا محمد بن جعفر عن شعبة عن يعلى بن عطاء عن أبيه عن عبد الله بن عمرو نحوه ولم يرفعه وهذا أصح قال أبو عيسى وهكذا روى أصحاب شعبة عن شعبة عن يعلى بن عطاء عن أبيه عن عبد الله بن عمرو موقوفا ولا نعلم أحدا رفعه غير خالد بن الحارث عن شعبة وخالد بن الحارث ثقة مأمون قال سمعت محمد بن المثنى يقول ما رأيت بالبصرة مثل خالد بن الحارث ولا بالكوفة مثل عبد الله بن إدريس قال وفي الباب عن عبد الله بن مسعود 	 
tirmidhi27_720170	 حدثنا ابن أبي عمر حدثنا سفيان بن عيينة عن عطاء بن السائب الهجيمي عن أبي عبد الرحمن السلمي عن	عن أبي الدرداء أن رجلا أتاه فقال إن لي امرأة وإن أمي تأمرني بطلاقها قال أبو الدرداء سمعت رسول الله صلى الله عليه وسلم يقول الوالد أوسط أبواب الجنة فإن شئت فأضع ذلك الباب أو احفظه قال وقال ابن أبي عمر وربما قال سفيان إن أمي وربما قال أبي وهذا حديث صحيح وأبو عبد الرحمن السلمي اسمه عبد الله بن حبيب 	 حدثنا ابن أبي عمر حدثنا سفيان بن عيينة عن عطاء بن السائب الهجيمي عن أبي عبد الرحمن السلمي عن أبي الدرداء أن رجلا أتاه فقال إن لي امرأة وإن أمي تأمرني بطلاقها قال أبو الدرداء سمعت رسول الله صلى الله عليه وسلم يقول الوالد أوسط أبواب الجنة فإن شئت فأضع ذلك الباب أو احفظه قال وقال ابن أبي عمر وربما قال سفيان إن أمي وربما قال أبي وهذا حديث صحيح وأبو عبد الرحمن السلمي اسمه عبد الله بن حبيب 	" Abu 'Abdur-Rahman As-Sulami narrated from Abu Ad Darda'.: He said that a man came and said : ""I have a wife whom my mother has ordered me to divorce."" So Abu Ad-Darda said: "" I heard the Messenger of Allah saying: 'The father is the middle gate to Paradise. So if you wish, then neglect that door, or protect it.'""(Hasan) "
tirmidhi27_720180	 حدثنا حميد بن مسعدة حدثنا بشر بن المفضل حدثنا الجريري عن عبد الرحمن بن أبي بكرة عن	حدثنا أبيه قال قال رسول الله صلى الله عليه وسلم ألا أحدثكم بأكبر الكبائر قالوا بلى يا رسول الله قال الإشراك بالله وعقوق الوالدين قال وجلس وكان متكئا فقال وشهادة الزور أو قول الزور فما زال رسول الله صلى الله عليه وسلم يقولها حتى قلنا ليته سكت قال وفي الباب عن أبي سعيد قال أبو عيسى هذا حديث حسن صحيح وأبو بكرة اسمه نفيع بن الحارث 	 حدثنا حميد بن مسعدة حدثنا بشر بن المفضل حدثنا الجريري عن عبد الرحمن بن أبي بكرة عن أبيه قال قال رسول الله صلى الله عليه وسلم ألا أحدثكم بأكبر الكبائر قالوا بلى يا رسول الله قال الإشراك بالله وعقوق الوالدين قال وجلس وكان متكئا فقال وشهادة الزور أو قول الزور فما زال رسول الله صلى الله عليه وسلم يقولها حتى قلنا ليته سكت قال وفي الباب عن أبي سعيد قال أبو عيسى هذا حديث حسن صحيح وأبو بكرة اسمه نفيع بن الحارث 	" 'Abdur-Rahman bin Abi Bakrah narrated from his father who said: "" The messenger of Allah said: 'Shall I not tell you of the biggest of the major sins?' they said : 'Of course! O Messenger of Allah!' He said: 'To join partners with Allah, and disobeying one's parents.'""He said : "" He sat up, and he had been reclining. He said: 'And false testimony, or false speech.' And the Messenger of Allah would not stop saying it until we said (to ourselves): 'I wish that he would stop.'""(Sahih) "
tirmidhi27_720190	 حدثنا قتيبة حدثنا الليث بن سعد عن ابن الهاد عن سعد بن إبراهيم عن حميد بن عبد الرحمن عن عبد الله بن	عن عمرو قال قال رسول الله صلى الله عليه وسلم من الكبائر أن يشتم الرجل والديه قالوا يا رسول الله وهل يشتم الرجل والديه قال نعم يسب أبا الرجل فيشتم أباه ويشتم أمه فيسب أمه قال أبو عيسى هذا حديث حسن صحيح 	 حدثنا قتيبة حدثنا الليث بن سعد عن ابن الهاد عن سعد بن إبراهيم عن حميد بن عبد الرحمن عن عبد الله بن عمرو قال قال رسول الله صلى الله عليه وسلم من الكبائر أن يشتم الرجل والديه قالوا يا رسول الله وهل يشتم الرجل والديه قال نعم يسب أبا الرجل فيشتم أباه ويشتم أمه فيسب أمه قال أبو عيسى هذا حديث حسن صحيح 	" 'Abdullah bin 'Amr narrated that : the Messenger of Allah said: ""It is among the greatest of sins that a man should curse his parents."" They said: ""O Messenger of Allah! Does a man curse his parents?"" He said: ""Yes. He verbally abuses the father of a man, who in turn, verbally abuses his father, and he (retaliates and) curses his mother , so he curses his mother."" (Sahih) "
tirmidhi27_720200	 حدثنا أحمد بن محمد أخبرنا عبد الله بن المبارك أخبرنا حيوة بن شريح أخبرني الوليد بن أبي الوليد عن عبد الله بن دينار عن	عن ابن عمر قال سمعت رسول الله صلى الله عليه وسلم يقول إن أبر البر أن يصل الرجل أهل ود أبيه قال وفي الباب عن أبي أسيد قال أبو عيسى هذا إسناد صحيح وقد روي هذا الحديث عن ابن عمر من غير وجه 	 حدثنا أحمد بن محمد أخبرنا عبد الله بن المبارك أخبرنا حيوة بن شريح أخبرني الوليد بن أبي الوليد عن عبد الله بن دينار عن ابن عمر قال سمعت رسول الله صلى الله عليه وسلم يقول إن أبر البر أن يصل الرجل أهل ود أبيه قال وفي الباب عن أبي أسيد قال أبو عيسى هذا إسناد صحيح وقد روي هذا الحديث عن ابن عمر من غير وجه 	" Ibn 'Umar narrated that : the Prophet said: ""Among the most dutiful of deeds is that a man nurture relations with the people his father was friends with.""(Sahih) "
tirmidhi27_720210	 حدثنا سفيان بن وكيع حدثنا أبي عن إسرائيل ح قال وحدثنا محمد بن	عن أحمد وهو ابن مدويه حدثنا عبيد الله بن موسى عن إسرائيل واللفظ لحديث عبيد الله عن أبي إسحاق الهمداني عن البراء بن عازب عن النبي صلى الله عليه وسلم قال الخالة بمنزلة الأم وفي الحديث قصة طويلة وهذا حديث صحيح 	 حدثنا سفيان بن وكيع حدثنا أبي عن إسرائيل ح قال وحدثنا محمد بن أحمد وهو ابن مدويه حدثنا عبيد الله بن موسى عن إسرائيل واللفظ لحديث عبيد الله عن أبي إسحاق الهمداني عن البراء بن عازب عن النبي صلى الله عليه وسلم قال الخالة بمنزلة الأم وفي الحديث قصة طويلة وهذا حديث صحيح 	" Al-Bara' bin Azib narrated that : the Prophet said: ""The maternal aunt holds the same status as the mother."" (Sahih) "
tirmidhi27_720220	 حدثنا أبو كريب حدثنا أبو معاوية عن محمد بن	حدثنا سوقة عن أبي بكر بن حفص عن ابن عمر أن رجلا أتى النبي صلى الله عليه وسلم فقال يا رسول الله إني أصبت ذنبا عظيما فهل لي من توبة قال هل لك من أم قال لا قال هل لك من خالة قال نعم قال فبرها وفي الباب عن علي والبراء بن عازب 	 حدثنا أبو كريب حدثنا أبو معاوية عن محمد بن سوقة عن أبي بكر بن حفص عن ابن عمر أن رجلا أتى النبي صلى الله عليه وسلم فقال يا رسول الله إني أصبت ذنبا عظيما فهل لي من توبة قال هل لك من أم قال لا قال هل لك من خالة قال نعم قال فبرها وفي الباب عن علي والبراء بن عازب 	 
tirmidhi27_720230	 حدثنا ابن أبي عمر حدثنا سفيان بن عيينة عن محمد بن سوقة عن أبي بكر بن حفص بن	عن عمر عن النبي صلى الله عليه وسلم نحوه ولم يذكر فيه عن ابن عمر وهذا أصح من حديث أبي معاوية وأبو بكر بن حفص هو ابن عمر بن سعد بن أبي وقاص 	 حدثنا ابن أبي عمر حدثنا سفيان بن عيينة عن محمد بن سوقة عن أبي بكر بن حفص بن عمر عن النبي صلى الله عليه وسلم نحوه ولم يذكر فيه عن ابن عمر وهذا أصح من حديث أبي معاوية وأبو بكر بن حفص هو ابن عمر بن سعد بن أبي وقاص 	 
tirmidhi27_720240	 حدثنا علي بن حجر أخبرنا إسماعيل بن إبراهيم عن هشام الدستوائي عن يحيى بن أبي كثير عن أبي جعفر عن	عن أبي هريرة قال قال رسول الله صلى الله عليه وسلم ثلاث دعوات مستجابات لا شك فيهن دعوة المظلوم ودعوة المسافر ودعوة الوالد على ولده قال أبو عيسى وقد روى الحجاج الصواف هذا الحديث عن يحيى بن أبي كثير نحو حديث هشام وأبو جعفر الذي روى عن أبي هريرة يقال له أبو جعفر المؤذن ولا نعرف اسمه وقد روى عنه يحيى بن أبي كثير غير حديث 	 حدثنا علي بن حجر أخبرنا إسماعيل بن إبراهيم عن هشام الدستوائي عن يحيى بن أبي كثير عن أبي جعفر عن أبي هريرة قال قال رسول الله صلى الله عليه وسلم ثلاث دعوات مستجابات لا شك فيهن دعوة المظلوم ودعوة المسافر ودعوة الوالد على ولده قال أبو عيسى وقد روى الحجاج الصواف هذا الحديث عن يحيى بن أبي كثير نحو حديث هشام وأبو جعفر الذي روى عن أبي هريرة يقال له أبو جعفر المؤذن ولا نعرف اسمه وقد روى عنه يحيى بن أبي كثير غير حديث 	" Abu Harairah narrated that the Messenger of Allah said: ""Three supplications are accepted , there is no doubt in them (about them being accepted): The supplication of the oppressed, the supplication of the traveler, and the supplication of his father against his son.""(Hasan) "
tirmidhi27_720250	 حدثنا أحمد بن محمد بن موسى أخبرنا جرير عن سهيل بن أبي صالح عن أبيه عن	عن أبي هريرة قال قال رسول الله صلى الله عليه وسلم لا يجزي ولد والدا إلا أن يجده مملوكا فيشتريه فيعتقه قال أبو عيسى هذا حديث حسن صحيح لا نعرفه إلا من حديث سهيل بن أبي صالح وقد روى سفيان الثوري وغير واحد عن سهيل بن أبي صالح هذا الحديث 	 حدثنا أحمد بن محمد بن موسى أخبرنا جرير عن سهيل بن أبي صالح عن أبيه عن أبي هريرة قال قال رسول الله صلى الله عليه وسلم لا يجزي ولد والدا إلا أن يجده مملوكا فيشتريه فيعتقه قال أبو عيسى هذا حديث حسن صحيح لا نعرفه إلا من حديث سهيل بن أبي صالح وقد روى سفيان الثوري وغير واحد عن سهيل بن أبي صالح هذا الحديث 	" Abu Hurairah narrated that: the Messenger of Allah said: ""A son could not do enough for his father, unless he found him as a slave and purchased him to set him free."" (Sahih) "
tirmidhi27_720260	 حدثنا ابن أبي عمر وسعيد بن	حدثنا عبد الرحمن المخزومي قالا حدثنا سفيان بن عيينة عن الزهري عن أبي سلمة قال اشتكى أبو الرداد الليثي فعاده عبد الرحمن بن عوف فقال خيرهم وأوصلهم ما علمت أبا محمد فقال عبد الرحمن سمعت رسول الله صلى الله عليه وسلم يقول قال الله أنا الله وأنا الرحمن خلقت الرحم وشققت لها من اسمي فمن وصلها وصلته ومن قطعها بتته وفي الباب عن أبي سعيد وابن أبي أوفى وعامر بن ربيعة وأبي هريرة وجبير بن مطعم قال أبو عيسى حديث سفيان عن الزهري حديث صحيح وروى معمر هذا الحديث عن الزهري عن أبي سلمة عن رداد الليثي عن عبد الرحمن بن عوف ومعمر كذا يقول قال محمد وحديث معمر خطأ 	 حدثنا ابن أبي عمر وسعيد بن عبد الرحمن المخزومي قالا حدثنا سفيان بن عيينة عن الزهري عن أبي سلمة قال اشتكى أبو الرداد الليثي فعاده عبد الرحمن بن عوف فقال خيرهم وأوصلهم ما علمت أبا محمد فقال عبد الرحمن سمعت رسول الله صلى الله عليه وسلم يقول قال الله أنا الله وأنا الرحمن خلقت الرحم وشققت لها من اسمي فمن وصلها وصلته ومن قطعها بتته وفي الباب عن أبي سعيد وابن أبي أوفى وعامر بن ربيعة وأبي هريرة وجبير بن مطعم قال أبو عيسى حديث سفيان عن الزهري حديث صحيح وروى معمر هذا الحديث عن الزهري عن أبي سلمة عن رداد الليثي عن عبد الرحمن بن عوف ومعمر كذا يقول قال محمد وحديث معمر خطأ 	" Abu Salamah said: "" Abu[Ar-Raddad] Al-Laithi complained(of an illness). So 'Abdur-Rahman bin 'Awf visited him. He said: 'The best of you, and the most apt to maintain good relations, as far as I know, is Abu Muhammad('Abdur-Rahman bin 'Awf). So 'Abdur-Rahman bin 'Awf' said: 'I heard the Messenger of Allah saying : ""Allah, Most Blessed and Most High, said: 'I am Allah, and I am Ar-Rahman. I created the Rahim(womb), and named it after My Name. So whoever keeps good relations with it, I keep good relation with him, and whoever severs it, I am finished with him.'""(Sahih) "
tirmidhi27_720270	 حدثنا ابن أبي عمر حدثنا سفيان حدثنا بشير أبو إسماعيل وفطر بن خليفة عن مجاهد عن عبد الله بن عمرو عن	عن النبي صلى الله عليه وسلم قال ليس الواصل بالمكافئ ولكن الواصل الذي إذا انقطعت رحمه وصلها قال أبو عيسى هذا حديث حسن صحيح وفي الباب عن سلمان وعائشة وعبد الله بن عمر 	 حدثنا ابن أبي عمر حدثنا سفيان حدثنا بشير أبو إسماعيل وفطر بن خليفة عن مجاهد عن عبد الله بن عمرو عن النبي صلى الله عليه وسلم قال ليس الواصل بالمكافئ ولكن الواصل الذي إذا انقطعت رحمه وصلها قال أبو عيسى هذا حديث حسن صحيح وفي الباب عن سلمان وعائشة وعبد الله بن عمر 	" 'Abdullah bin Amr narrated that: the Prophet said: ""Merely maintaining the ties of kinship is not adequate. But connecting the ties of kinship is when his ties to the womb are severed and he connects it."" (Sahih) "
tirmidhi27_720280	 حدثنا ابن أبي عمر ونصر بن علي وسعيد بن	حدثنا عبد الرحمن المخزومي قالوا حدثنا سفيان عن الزهري عن محمد بن جبير بن مطعم عن أبيه قال قال رسول الله صلى الله عليه وسلم لا يدخل الجنة قاطع قال ابن أبي عمر قال سفيان يعني قاطع رحم قال أبو عيسى هذا حديث حسن صحيح 	 حدثنا ابن أبي عمر ونصر بن علي وسعيد بن عبد الرحمن المخزومي قالوا حدثنا سفيان عن الزهري عن محمد بن جبير بن مطعم عن أبيه قال قال رسول الله صلى الله عليه وسلم لا يدخل الجنة قاطع قال ابن أبي عمر قال سفيان يعني قاطع رحم قال أبو عيسى هذا حديث حسن صحيح 	" Muhammad bin Jubair bin Mut'im narrated from his father, that: the Messenger of Allah said: ""The one who severs ties will not enter Paradise."" Ibn Abi 'Umar said: ""Sufyan said: 'Meaning: Ties of the womb."" (Sahih) "
tirmidhi27_720290	 حدثنا ابن أبي عمر حدثنا سفيان عن إبراهيم بن	حدثنا ميسرة قال سمعت ابن أبي سويد يقول سمعت عمر بن عبد العزيز يقول زعمت المرأة الصالحة خولة بنت حكيم قالت خرج رسول الله صلى الله عليه وسلم ذات يوم وهو محتضن أحد ابنى ابنته وهو يقول إنكم لتبخلون وتجبنون وتجهلون وإنكم لمن ريحان الله قال وفي الباب عن ابن عمر والأشعث بن قيس قال أبو عيسى حديث ابن عيينة عن إبراهيم بن ميسرة لا نعرفه إلا من حديثه ولا نعرف لعمر بن عبد العزيز سماعا من خولة 	 حدثنا ابن أبي عمر حدثنا سفيان عن إبراهيم بن ميسرة قال سمعت ابن أبي سويد يقول سمعت عمر بن عبد العزيز يقول زعمت المرأة الصالحة خولة بنت حكيم قالت خرج رسول الله صلى الله عليه وسلم ذات يوم وهو محتضن أحد ابنى ابنته وهو يقول إنكم لتبخلون وتجبنون وتجهلون وإنكم لمن ريحان الله قال وفي الباب عن ابن عمر والأشعث بن قيس قال أبو عيسى حديث ابن عيينة عن إبراهيم بن ميسرة لا نعرفه إلا من حديثه ولا نعرف لعمر بن عبد العزيز سماعا من خولة 	" 'Umar bin 'Abdul-'Aziz said: 'a righteous woman, Khawlah bint Hakim said: ""The Messenger of Allah came out during the middle of the day, while holding one of the sons of his daughter in his arms. He was saying: 'You are what makes them stingy, cowardly and ignorant. And you are but Raihanillah (Da'if) "
