tirmidhi15_713870	 حدثنا أبو بكر محمد بن عبد الله بن بزيع حدثنا بشر بن المفضل حدثنا سعيد عن قتادة عن أنس بن	عن مالك قال قال رسول الله صلى الله عليه وسلم لو أهدي إلى كراع لقبلت ولو دعيت عليه لأجبت قال وفي الباب عن علي وعائشة والمغيرة بن شعبة وسلمان ومعاوية بن حيدة وعبد الرحمن بن علقمة قال أبو عيسى حديث أنس حديث حسن صحيح 	 حدثنا أبو بكر محمد بن عبد الله بن بزيع حدثنا بشر بن المفضل حدثنا سعيد عن قتادة عن أنس بن مالك قال قال رسول الله صلى الله عليه وسلم لو أهدي إلى كراع لقبلت ولو دعيت عليه لأجبت قال وفي الباب عن علي وعائشة والمغيرة بن شعبة وسلمان ومعاوية بن حيدة وعبد الرحمن بن علقمة قال أبو عيسى حديث أنس حديث حسن صحيح 	" Anas bin Malik narrated that Messenger of Allah (SL3M) said: ""If trotter (lacking meat) were given to me I would accept it, and if I was invited to (a meal of) it I would accept."" "
tirmidhi15_713880	 حدثنا هارون بن إسحاق الهمداني حدثنا عبدة بن سليمان عن هشام بن عروة عن أبيه عن زينب بنت أم سلمة عن	عن أم سلمة قالت قال رسول الله صلى الله عليه وسلم إنكم تختصمون إلى وإنما أنا بشر ولعل بعضكم أن يكون ألحن بحجته من بعض فإن قضيت لأحد منكم بشيء من حق أخيه فإنما أقطع له قطعة من النار فلا يأخذ منه شيئا قال وفي الباب عن أبي هريرة وعائشة قال أبو عيسى حديث أم سلمة حديث حسن صحيح 	 حدثنا هارون بن إسحاق الهمداني حدثنا عبدة بن سليمان عن هشام بن عروة عن أبيه عن زينب بنت أم سلمة عن أم سلمة قالت قال رسول الله صلى الله عليه وسلم إنكم تختصمون إلى وإنما أنا بشر ولعل بعضكم أن يكون ألحن بحجته من بعض فإن قضيت لأحد منكم بشيء من حق أخيه فإنما أقطع له قطعة من النار فلا يأخذ منه شيئا قال وفي الباب عن أبي هريرة وعائشة قال أبو عيسى حديث أم سلمة حديث حسن صحيح 	" Umm Salamah narrated that the Messenger of Allah (SL3M) said: ""Indeed you come to me with your disputes, and I am only a human being, perhaps one of you is more eloquent at presenting his argument than the other. If I judge for one of you, giving him something from the rights of his brother, then it is only a piece of the Fire that I am giving him, so do not take anything from it."" "
tirmidhi15_713890	 حدثنا قتيبة حدثنا أبو الأحوص عن سماك بن حرب عن علقمة بن وائل بن حجر عن	عن أبيه قال جاء رجل من حضرموت ورجل من كندة إلى النبي صلى الله عليه وسلم فقال الحضرمي يا رسول الله إن هذا غلبني على أرض لي فقال الكندي هي أرضي وفي يدي ليس له فيها حق فقال النبي صلى الله عليه وسلم للحضرمي ألك بينة قال لا قال فلك يمينه قال يا رسول الله إن الرجل فاجر لا يبالي على ما حلف عليه وليس يتورع من شيء قال ليس لك منه إلا ذلك قال فانطلق الرجل ليحلف له فقال رسول الله صلى الله عليه وسلم لما أدبر لئن حلف على مالك ليأكله ظلما ليلقين الله وهو عنه معرض قال وفي الباب عن عمر وابن عباس وعبد الله بن عمرو والأشعث بن قيس قال أبو عيسى حديث وائل بن حجر حديث حسن صحيح 	 حدثنا قتيبة حدثنا أبو الأحوص عن سماك بن حرب عن علقمة بن وائل بن حجر عن أبيه قال جاء رجل من حضرموت ورجل من كندة إلى النبي صلى الله عليه وسلم فقال الحضرمي يا رسول الله إن هذا غلبني على أرض لي فقال الكندي هي أرضي وفي يدي ليس له فيها حق فقال النبي صلى الله عليه وسلم للحضرمي ألك بينة قال لا قال فلك يمينه قال يا رسول الله إن الرجل فاجر لا يبالي على ما حلف عليه وليس يتورع من شيء قال ليس لك منه إلا ذلك قال فانطلق الرجل ليحلف له فقال رسول الله صلى الله عليه وسلم لما أدبر لئن حلف على مالك ليأكله ظلما ليلقين الله وهو عنه معرض قال وفي الباب عن عمر وابن عباس وعبد الله بن عمرو والأشعث بن قيس قال أبو عيسى حديث وائل بن حجر حديث حسن صحيح 	" 'Alqamah bin Wa'il [bin Hujr] narrated from his father who said: ""A man from Hadramawt and a man from Kindah came to the Prophet (SL3M). The Hadrami said: 'O Messenger of Allah! This person took some land of mine.' The Kindi said:'It is my land, It is in my possession, and he has no right to it.' So the Prophet (SL3M) said to the Hadrami:'Do you have proof?' He said: 'No.' He said: 'Then you will have the oath.' He said: 'O Messenger of Allah! This man is a liar, it makes not difference what he takes an oath for, he is not ashamed of doing anything!' He said: 'There is nothing you deserve from him except that.' He said: So the man was left to take an oath for it, and in the meantime, the Messenger of Allah (SL3M) said: 'If he takes an oath [for your property] to wrongfully consume it, He will meet Allah while He is angry with him."" "
tirmidhi15_713900	 حدثنا علي بن حجر أنبأنا علي بن مسهر وغيره عن محمد بن عبيد الله عن عمرو بن شعيب عن أبيه عن	عن جده أن النبي صلى الله عليه وسلم قال في خطبته البينة على المدعي واليمين على المدعى عليه هذا حديث في إسناده مقال ومحمد بن عبيد الله العرزمي يضعف في الحديث من قبل حفظه ضعفه ابن المبارك وغيره 	 حدثنا علي بن حجر أنبأنا علي بن مسهر وغيره عن محمد بن عبيد الله عن عمرو بن شعيب عن أبيه عن جده أن النبي صلى الله عليه وسلم قال في خطبته البينة على المدعي واليمين على المدعى عليه هذا حديث في إسناده مقال ومحمد بن عبيد الله العرزمي يضعف في الحديث من قبل حفظه ضعفه ابن المبارك وغيره 	" 'Amr bin Shu'aib narrated from his father, from his grandfather, that during a Khutbah, the Prophet (SL3M) said: ""The proof is due from the claimant, and the oath is due from the one the claim is made against."" "
tirmidhi15_713910	 حدثنا محمد بن سهل بن عسكر البغدادي حدثنا محمد بن	حدثنا يوسف حدثنا نافع بن عمر الجمحي عن عبد الله بن أبي مليكة عن ابن عباس أن رسول الله صلى الله عليه وسلم قضى أن اليمين على المدعى عليه قال أبو عيسى هذا حديث حسن صحيح والعمل على هذا عند أهل العلم من أصحاب النبي صلى الله عليه وسلم وغيرهم أن البينة على المدعي واليمين على المدعى عليه 	 حدثنا محمد بن سهل بن عسكر البغدادي حدثنا محمد بن يوسف حدثنا نافع بن عمر الجمحي عن عبد الله بن أبي مليكة عن ابن عباس أن رسول الله صلى الله عليه وسلم قضى أن اليمين على المدعى عليه قال أبو عيسى هذا حديث حسن صحيح والعمل على هذا عند أهل العلم من أصحاب النبي صلى الله عليه وسلم وغيرهم أن البينة على المدعي واليمين على المدعى عليه 	 Ibn 'Abbas narrated that the Messenger of Allah (SL3M) judged that the oath is due from the one the claim is made against. 
tirmidhi15_713920	 حدثنا يعقوب بن إبراهيم الدورقي حدثنا عبد العزيز بن	حدثنا محمد قال حدثني ربيعة بن أبي عبد الرحمن عن سهيل بن أبي صالح عن أبيه عن أبي هريرة قال قضى رسول الله صلى الله عليه وسلم باليمين مع الشاهد الواحد قال ربيعة وأخبرني ابن لسعد بن عبادة قال وجدنا في كتاب سعد أن النبي صلى الله عليه وسلم قضى باليمين مع الشاهد قال وفي الباب عن علي وجابر وابن عباس وسرق قال أبو عيسى حديث أبي هريرة أن النبي صلى الله عليه وسلم قضى باليمين مع الشاهد الواحد حديث حسن غريب 	 حدثنا يعقوب بن إبراهيم الدورقي حدثنا عبد العزيز بن محمد قال حدثني ربيعة بن أبي عبد الرحمن عن سهيل بن أبي صالح عن أبيه عن أبي هريرة قال قضى رسول الله صلى الله عليه وسلم باليمين مع الشاهد الواحد قال ربيعة وأخبرني ابن لسعد بن عبادة قال وجدنا في كتاب سعد أن النبي صلى الله عليه وسلم قضى باليمين مع الشاهد قال وفي الباب عن علي وجابر وابن عباس وسرق قال أبو عيسى حديث أبي هريرة أن النبي صلى الله عليه وسلم قضى باليمين مع الشاهد الواحد حديث حسن غريب 	" Abu Hurairah narrated: ""The Messenger of Allah (SL3M) passed judgement based on an oath along with one witness."" Rabi'ah (one of the narrators) said: ""A son of Ibn Sa'd bin 'Ubadah informed me saying: 'We found in a book of Sa'd that the Prophet (SL3M) passed judgement based on an oath along with a witness.'"" "
tirmidhi15_713930	 حدثنا محمد بن بشار ومحمد بن أبان قالا حدثنا عبد الوهاب الثقفي عن جعفر بن محمد عن أبيه عن	عن جابر أن النبي صلى الله عليه وسلم قضى باليمين مع الشاهد 	 حدثنا محمد بن بشار ومحمد بن أبان قالا حدثنا عبد الوهاب الثقفي عن جعفر بن محمد عن أبيه عن جابر أن النبي صلى الله عليه وسلم قضى باليمين مع الشاهد 	" Jabir narrated: ""The Prophet (SL3M) passed judgement based on oath along with a witness."" "
tirmidhi15_713940	 حدثنا علي بن حجر أخبرنا إسماعيل بن جعفر حدثنا جعفر بن محمد عن	حدثنا أبيه أن النبي صلى الله عليه وسلم قضى باليمين مع الشاهد الواحد قال وقضى بها علي فيكم قال أبو عيسى وهذا أصح وهكذا روى سفيان الثوري عن جعفر بن محمد عن أبيه عن النبي صلى الله عليه وسلم مرسلا وروى عبد العزيز بن أبي سلمة ويحيى بن سليم هذا الحديث عن جعفر بن محمد عن أبيه عن علي عن النبي صلى الله عليه وسلم والعمل على هذا عند بعض أهل العلم من أصحاب النبي صلى الله عليه وسلم وغيرهم رأوا أن اليمين مع الشاهد الواحد جائز في الحقوق والأموال وهو قول مالك بن أنس والشافعي وأحمد وإسحاق وقالوا لا يقضى باليمين مع الشاهد الواحد إلا في الحقوق والأموال ولم ير بعض أهل العلم من أهل الكوفة وغيرهم أن يقضى باليمين مع الشاهد الواحد 	 حدثنا علي بن حجر أخبرنا إسماعيل بن جعفر حدثنا جعفر بن محمد عن أبيه أن النبي صلى الله عليه وسلم قضى باليمين مع الشاهد الواحد قال وقضى بها علي فيكم قال أبو عيسى وهذا أصح وهكذا روى سفيان الثوري عن جعفر بن محمد عن أبيه عن النبي صلى الله عليه وسلم مرسلا وروى عبد العزيز بن أبي سلمة ويحيى بن سليم هذا الحديث عن جعفر بن محمد عن أبيه عن علي عن النبي صلى الله عليه وسلم والعمل على هذا عند بعض أهل العلم من أصحاب النبي صلى الله عليه وسلم وغيرهم رأوا أن اليمين مع الشاهد الواحد جائز في الحقوق والأموال وهو قول مالك بن أنس والشافعي وأحمد وإسحاق وقالوا لا يقضى باليمين مع الشاهد الواحد إلا في الحقوق والأموال ولم ير بعض أهل العلم من أهل الكوفة وغيرهم أن يقضى باليمين مع الشاهد الواحد 	" Ja'far bin Muhammad narrated from his father: ""The Prophet (SL3M) passed judgement based on an oath along with one witness."" He said: ""And 'Ali judged between you based on it."" "
tirmidhi15_713950	 حدثنا أحمد بن منيع حدثنا إسماعيل بن إبراهيم عن أيوب عن نافع عن ابن عمر عن	عن النبي صلى الله عليه وسلم قال من أعتق نصيبا أو قال شقصا أو قال شركا له في عبد فكان له من المال ما يبلغ ثمنه بقيمة العدل فهو عتيق وإلا فقد عتق منه ما عتق قال أيوب وربما قال نافع في هذا الحديث يعني فقد عتق منه ما عتق قال أبو عيسى حديث ابن عمر حديث حسن صحيح وقد رواه سالم عن أبيه عن النبي صلى الله عليه وسلم نحوه 	 حدثنا أحمد بن منيع حدثنا إسماعيل بن إبراهيم عن أيوب عن نافع عن ابن عمر عن النبي صلى الله عليه وسلم قال من أعتق نصيبا أو قال شقصا أو قال شركا له في عبد فكان له من المال ما يبلغ ثمنه بقيمة العدل فهو عتيق وإلا فقد عتق منه ما عتق قال أيوب وربما قال نافع في هذا الحديث يعني فقد عتق منه ما عتق قال أبو عيسى حديث ابن عمر حديث حسن صحيح وقد رواه سالم عن أبيه عن النبي صلى الله عليه وسلم نحوه 	" Ibn 'Umar narrated that the Prophet (SL3M) said: ""Whoever frees a portion"" or, he said: ""a part"" or he said: ""a share he owns of a slave, then he can afford the remainder of the price according to the reasonable price, then he will be free. Otherwise he has freed as much as he has freed (only)."" Ayyub (one of the narrators) said: ""Perhaps Nafi said in this Hadith: 'Meaning he has freed as much of him as he has freed.'"" "
tirmidhi15_713960	 حدثنا بذلك الحسن بن علي الخلال الحلواني حدثنا عبد الرزاق أخبرنا معمر عن الزهري عن سالم عن أبيه عن	عن النبي صلى الله عليه وسلم قال من أعتق نصيبا له في عبد فكان له من المال ما يبلغ ثمنه فهو عتيق من ماله قال أبو عيسى هذا حديث صحيح 	 حدثنا بذلك الحسن بن علي الخلال الحلواني حدثنا عبد الرزاق أخبرنا معمر عن الزهري عن سالم عن أبيه عن النبي صلى الله عليه وسلم قال من أعتق نصيبا له في عبد فكان له من المال ما يبلغ ثمنه فهو عتيق من ماله قال أبو عيسى هذا حديث صحيح 	" Salim narrated from his father that the Prophet (SL3M) said: ""Whoever frees a portion of a slave he owns, then he can afford the remainder of the price, then he should free him with his wealth."" "
tirmidhi15_713971	 حدثنا علي بن خشرم أخبرنا عيسى بن يونس عن سعيد بن أبي عروبة عن قتادة عن النضر بن	عن أنس عن بشير بن نهيك عن أبي هريرة قال قال رسول الله صلى الله عليه وسلم من أعتق نصيبا أو قال شقصا في مملوك فخلاصه في ماله إن كان له مال فإن لم يكن له مال قوم قيمة عدل ثم يستسعى في نصيب الذي لم يعتق غير مشقوق عليه قال وفي الباب عن عبد الله بن عمرو حدثنا محمد بن بشار حدثنا يحيى بن سعيد عن سعيد بن أبي عروبة نحوه وقال شقيصا قال أبو عيسى وهذا حديث حسن صحيح وهكذا روى أبان بن يزيد عن قتادة مثل رواية سعيد بن أبي عروبة وروى شعبة هذا الحديث عن قتادة ولم يذكر فيه أمر السعاية واختلف أهل العلم في السعاية فرأى بعض أهل العلم السعاية في هذا وهو قول سفيان الثوري وأهل الكوفة وبه يقول إسحاق وقد قال بعض أهل العلم إذا كان العبد بين الرجلين فأعتق أحدهما نصيبه فإن كان له مال غرم نصيب صاحبه وعتق العبد من ماله وإن لم يكن له مال عتق من العبد ما عتق ولا يستسعى وقالوا بما روي عن ابن عمر عن النبي صلى الله عليه وسلم وهذا قول أهل المدينة وبه يقول مالك بن أنس والشافعي وأحمد 	 حدثنا علي بن خشرم أخبرنا عيسى بن يونس عن سعيد بن أبي عروبة عن قتادة عن النضر بن أنس عن بشير بن نهيك عن أبي هريرة قال قال رسول الله صلى الله عليه وسلم من أعتق نصيبا أو قال شقصا في مملوك فخلاصه في ماله إن كان له مال فإن لم يكن له مال قوم قيمة عدل ثم يستسعى في نصيب الذي لم يعتق غير مشقوق عليه قال وفي الباب عن عبد الله بن عمرو حدثنا محمد بن بشار حدثنا يحيى بن سعيد عن سعيد بن أبي عروبة نحوه وقال شقيصا قال أبو عيسى وهذا حديث حسن صحيح وهكذا روى أبان بن يزيد عن قتادة مثل رواية سعيد بن أبي عروبة وروى شعبة هذا الحديث عن قتادة ولم يذكر فيه أمر السعاية واختلف أهل العلم في السعاية فرأى بعض أهل العلم السعاية في هذا وهو قول سفيان الثوري وأهل الكوفة وبه يقول إسحاق وقد قال بعض أهل العلم إذا كان العبد بين الرجلين فأعتق أحدهما نصيبه فإن كان له مال غرم نصيب صاحبه وعتق العبد من ماله وإن لم يكن له مال عتق من العبد ما عتق ولا يستسعى وقالوا بما روي عن ابن عمر عن النبي صلى الله عليه وسلم وهذا قول أهل المدينة وبه يقول مالك بن أنس والشافعي وأحمد 	" Abu Hurairah narrated that the Messenger of Allah (SL3M) said: ""Whoever frees a portion"" or he said: ""a part of a slave, then he should finish paying his price if he can afford it. If he can not afford to pay reasonable price then he should be allowed to work to earn the amount that will free him without overburdening him.""(Another chain) similar, and he said: ""a part"". "
tirmidhi15_713990	 حدثنا محمد بن المثنى حدثنا ابن أبي عدي عن سعيد عن قتادة عن الحسن عن	عن سمرة أن نبي الله صلى الله عليه وسلم قال العمرى جائزة لأهلها أو ميراث لأهلها قال وفي الباب عن زيد بن ثابت وجابر وأبي هريرة وعائشة وابن الزبير ومعاوية 	 حدثنا محمد بن المثنى حدثنا ابن أبي عدي عن سعيد عن قتادة عن الحسن عن سمرة أن نبي الله صلى الله عليه وسلم قال العمرى جائزة لأهلها أو ميراث لأهلها قال وفي الباب عن زيد بن ثابت وجابر وأبي هريرة وعائشة وابن الزبير ومعاوية 	" Samurah narrated that the Prophet (SL3M) said: ""The lifelong gift is permitted for its inhabitant"" or:""is an inheritance for its inhabitant."" "
tirmidhi15_714000	 حدثنا الأنصاري حدثنا معن حدثنا مالك عن ابن شهاب عن أبي سلمة عن	عن جابر أن النبي صلى الله عليه وسلم قال أيما رجل أعمر عمرى له ولعقبه فإنها للذي يعطاها لا ترجع إلى الذي أعطاها لأنه أعطى عطاء وقعت فيه المواريث قال أبو عيسى هذا حديث حسن صحيح وهكذا روى معمر وغير واحد عن الزهري مثل رواية مالك وروى بعضهم عن الزهري ولم يذكر فيه ولعقبه والعمل على هذا عند بعض أهل العلم قالوا إذا قال هي لك حياتك ولعقبك فإنها لمن أعمرها لا ترجع إلى الأول وإذا لم يقل لعقبك فهي راجعة إلى الأول إذا مات المعمر وهو قول مالك بن أنس والشافعي وروي من غير وجه عن النبي صلى الله عليه وسلم قال العمرى جائزة لأهلها والعمل على هذا عند بعض أهل العلم قالوا إذا مات المعمر فهي لورثته وإن لم تجعل لعقبه وهو قول سفيان الثوري وأحمد وإسحاق 	 حدثنا الأنصاري حدثنا معن حدثنا مالك عن ابن شهاب عن أبي سلمة عن جابر أن النبي صلى الله عليه وسلم قال أيما رجل أعمر عمرى له ولعقبه فإنها للذي يعطاها لا ترجع إلى الذي أعطاها لأنه أعطى عطاء وقعت فيه المواريث قال أبو عيسى هذا حديث حسن صحيح وهكذا روى معمر وغير واحد عن الزهري مثل رواية مالك وروى بعضهم عن الزهري ولم يذكر فيه ولعقبه والعمل على هذا عند بعض أهل العلم قالوا إذا قال هي لك حياتك ولعقبك فإنها لمن أعمرها لا ترجع إلى الأول وإذا لم يقل لعقبك فهي راجعة إلى الأول إذا مات المعمر وهو قول مالك بن أنس والشافعي وروي من غير وجه عن النبي صلى الله عليه وسلم قال العمرى جائزة لأهلها والعمل على هذا عند بعض أهل العلم قالوا إذا مات المعمر فهي لورثته وإن لم تجعل لعقبه وهو قول سفيان الثوري وأحمد وإسحاق 	" Jabir narrated that the Prophet (SL3M) said: ""Whichever man is given a lifelong gift for himself and his offspring, then it belongs to the one whom it was given, it does not return to the one who gave it, for he has given a gift which shall be included in the inheritance."" "
