tirmidhi27_720830	 حدثنا الحسن بن عرفة حدثنا سعيد بن محمد الوراق عن يحيى بن سعيد عن الأعرج عن أبي هريرة عن	عن النبي صلى الله عليه وسلم قال السخي قريب من الله قريب من الجنة قريب من الناس بعيد من النار والبخيل بعيد من الله بعيد من الجنة بعيد من الناس قريب من النار ولجاهل سخي أحب إلى الله عز وجل من عابد بخيل قال أبو عيسى هذا حديث غريب لا نعرفه من حديث يحيى بن سعيد عن الأعرج عن أبي هريرة إلا من حديث سعيد بن محمد وقد خولف سعيد بن محمد في رواية هذا الحديث عن يحيى بن سعيد إنما يروى عن يحيى بن سعيد عن عائشة شيء مرسل 	 حدثنا الحسن بن عرفة حدثنا سعيد بن محمد الوراق عن يحيى بن سعيد عن الأعرج عن أبي هريرة عن النبي صلى الله عليه وسلم قال السخي قريب من الله قريب من الجنة قريب من الناس بعيد من النار والبخيل بعيد من الله بعيد من الجنة بعيد من الناس قريب من النار ولجاهل سخي أحب إلى الله عز وجل من عابد بخيل قال أبو عيسى هذا حديث غريب لا نعرفه من حديث يحيى بن سعيد عن الأعرج عن أبي هريرة إلا من حديث سعيد بن محمد وقد خولف سعيد بن محمد في رواية هذا الحديث عن يحيى بن سعيد إنما يروى عن يحيى بن سعيد عن عائشة شيء مرسل 	" Abu Hurairah narrated that the Prophet said: ""Generosity is close to the people and far from the Fire. Stinginess is far from Allah, far from Paradise, far from the people and close to the Fire. The ignorant generous person, is more beloved to Allah than the worshiping stingy person.""(Da'if) "
tirmidhi27_720840	 حدثنا أبو حفص عمرو بن علي أخبرنا أبو داود حدثنا صدقة بن موسى حدثنا مالك بن دينار عن عبد الله بن غالب الحداني عن	عن أبي سعيد الخدري قال قال رسول الله صلى الله عليه وسلم خصلتان لا تجتمعان في مؤمن البخل وسوء الخلق قال أبو عيسى هذا حديث غريب لا نعرفه إلا من حديث صدقة بن موسى وفي الباب عن أبي هريرة 	 حدثنا أبو حفص عمرو بن علي أخبرنا أبو داود حدثنا صدقة بن موسى حدثنا مالك بن دينار عن عبد الله بن غالب الحداني عن أبي سعيد الخدري قال قال رسول الله صلى الله عليه وسلم خصلتان لا تجتمعان في مؤمن البخل وسوء الخلق قال أبو عيسى هذا حديث غريب لا نعرفه إلا من حديث صدقة بن موسى وفي الباب عن أبي هريرة 	" Abu Sa'eed Al-Khudri narrated that the Messenger of Allah said: ""Two traits are not combined in a believer: Stinginess and bad manners.""(Da'if) "
tirmidhi27_720850	 حدثنا أحمد بن منيع حدثنا يزيد بن هارون حدثنا صدقة بن موسى عن فرقد السبخي عن مرة الطيب عن أبي بكر الصديق عن	عن النبي صلى الله عليه وسلم قال لا يدخل الجنة خب ولا منان ولا بخيل قال أبو عيسى هذا حديث حسن غريب 	 حدثنا أحمد بن منيع حدثنا يزيد بن هارون حدثنا صدقة بن موسى عن فرقد السبخي عن مرة الطيب عن أبي بكر الصديق عن النبي صلى الله عليه وسلم قال لا يدخل الجنة خب ولا منان ولا بخيل قال أبو عيسى هذا حديث حسن غريب 	" -Abu Bakr As-Siddiq narrated that the Messenger of Allah said: ""The swindler, the stingy person, and the Mannan shall not enter Paradise.""(Da'if) "
tirmidhi27_720860	 حدثنا محمد بن رافع حدثنا عبد الرزاق عن بشر بن	حدثنا رافع عن يحيى بن أبي كثير عن أبي سلمة عن أبي هريرة قال قال رسول الله صلى الله عليه وسلم المؤمن غر كريم والفاجر خب لئيم قال أبو عيسى هذا حديث غريب لا نعرفه إلا من هذا الوجه 	 حدثنا محمد بن رافع حدثنا عبد الرزاق عن بشر بن رافع عن يحيى بن أبي كثير عن أبي سلمة عن أبي هريرة قال قال رسول الله صلى الله عليه وسلم المؤمن غر كريم والفاجر خب لئيم قال أبو عيسى هذا حديث غريب لا نعرفه إلا من هذا الوجه 	" Abu Hurairah narrated that the Messenger of Allah said: ""The believer is naively noble and the stingy person is deceitfully treacherous.""(Da'if) "
tirmidhi27_720870	 حدثنا أحمد بن محمد أخبرنا عبد الله بن المبارك عن شعبة عن عدي بن ثابت عن عبد الله بن	عن يزيد عن أبي مسعود الأنصاري عن النبي صلى الله عليه وسلم قال نفقة الرجل على أهله صدقة وفي الباب عن عبد الله بن عمرو وعمرو بن أمية الضمري وأبي هريرة قال أبو عيسى هذا حديث حسن صحيح 	 حدثنا أحمد بن محمد أخبرنا عبد الله بن المبارك عن شعبة عن عدي بن ثابت عن عبد الله بن يزيد عن أبي مسعود الأنصاري عن النبي صلى الله عليه وسلم قال نفقة الرجل على أهله صدقة وفي الباب عن عبد الله بن عمرو وعمرو بن أمية الضمري وأبي هريرة قال أبو عيسى هذا حديث حسن صحيح 	" Abu Mas'ud Al-Ansari narrated that the Messenger of Allah said: ""A man's spending on his family is charity.""(Sahih) "
tirmidhi27_720880	 حدثنا قتيبة حدثنا حماد بن زيد عن أيوب عن أبي قلابة عن أبي أسماء عن	عن ثوبان أن النبي صلى الله عليه وسلم قال أفضل الدينار دينار ينفقه الرجل على عياله ودينار ينفقه الرجل على دابته في سبيل الله ودينار ينفقه الرجل على أصحابه في سبيل الله قال أبو قلابة بدأ بالعيال ثم قال فأى رجل أعظم أجرا من رجل ينفق على عيال له صغار يعفهم الله به ويغنيهم الله به قال أبو عيسى هذا حديث حسن صحيح 	 حدثنا قتيبة حدثنا حماد بن زيد عن أيوب عن أبي قلابة عن أبي أسماء عن ثوبان أن النبي صلى الله عليه وسلم قال أفضل الدينار دينار ينفقه الرجل على عياله ودينار ينفقه الرجل على دابته في سبيل الله ودينار ينفقه الرجل على أصحابه في سبيل الله قال أبو قلابة بدأ بالعيال ثم قال فأى رجل أعظم أجرا من رجل ينفق على عيال له صغار يعفهم الله به ويغنيهم الله به قال أبو عيسى هذا حديث حسن صحيح 	" Thawban narrated that the Messenger of Allah said: ""The most virtuous of the Dinar is the Dinar spent by a man on his dependants, and the Dinar spent by a man on his beast in the Cause of Allah, and the Dinar spent by a man on his companions in the Cause of Allah."" Abu Qilabah (one of the narrators) said: "" He began with the dependants."" Then he said: ""And which man is greater in reward than a man who spends upon his depandants, having little ones by which Allah causes him to abstain (from the unlawful) and by which Allah enriches him."" (Sahih) "
tirmidhi27_720890	 حدثنا قتيبة حدثنا الليث بن سعد عن سعيد بن	حدثنا أبي سعيد المقبري عن أبي شريح العدوي أنه قال أبصرت عيناى رسول الله صلى الله عليه وسلم وسمعته أذناى حين تكلم به قال من كان يؤمن بالله واليوم الآخر فليكرم ضيفه جائزته قالوا وما جائزته قال يوم وليلة والضيافة ثلاثة أيام وما كان بعد ذلك فهو صدقة ومن كان يؤمن بالله واليوم الآخر فليقل خيرا أو ليسكت قال أبو عيسى هذا حديث حسن صحيح 	 حدثنا قتيبة حدثنا الليث بن سعد عن سعيد بن أبي سعيد المقبري عن أبي شريح العدوي أنه قال أبصرت عيناى رسول الله صلى الله عليه وسلم وسمعته أذناى حين تكلم به قال من كان يؤمن بالله واليوم الآخر فليكرم ضيفه جائزته قالوا وما جائزته قال يوم وليلة والضيافة ثلاثة أيام وما كان بعد ذلك فهو صدقة ومن كان يؤمن بالله واليوم الآخر فليقل خيرا أو ليسكت قال أبو عيسى هذا حديث حسن صحيح 	" Abu Shuraih Al-'Adawf said: ""My eyes saw the Messenger of Allah, and my ears heard him speaking when he was speaking and he said: 'Whoever believes in Allah and the Last Day, then let him honor his guest with his reward.' They said: 'What is the reward?' He said: ' A day and a night.' He said: 'And hospitality is for three days, whatever is beyond that is charity. And whoever believes in Allah and the Last Day, then let him say what is good or keep silent."" (Sahih) "
tirmidhi27_720900	 حدثنا ابن أبي عمر حدثنا سفيان عن ابن عجلان عن سعيد المقبري عن	عن أبي شريح الكعبي أن رسول الله صلى الله عليه وسلم قال الضيافة ثلاثة أيام وجائزته يوم وليلة وما أنفق عليه بعد ذلك فهو صدقة ولا يحل له أن يثوي عنده حتى يحرجه وفي الباب عن عائشة وأبي هريرة وقد رواه مالك بن أنس والليث بن سعد عن سعيد المقبري قال أبو عيسى هذا حديث حسن صحيح وأبو شريح الخزاعي هو الكعبي وهو العدوي اسمه خويلد بن عمرو ومعنى قوله لا يثوي عنده يعني الضيف لا يقيم عنده حتى يشتد على صاحب المنزل والحرج هو الضيق إنما قوله حتى يحرجه يقول حتى يضيق عليه 	 حدثنا ابن أبي عمر حدثنا سفيان عن ابن عجلان عن سعيد المقبري عن أبي شريح الكعبي أن رسول الله صلى الله عليه وسلم قال الضيافة ثلاثة أيام وجائزته يوم وليلة وما أنفق عليه بعد ذلك فهو صدقة ولا يحل له أن يثوي عنده حتى يحرجه وفي الباب عن عائشة وأبي هريرة وقد رواه مالك بن أنس والليث بن سعد عن سعيد المقبري قال أبو عيسى هذا حديث حسن صحيح وأبو شريح الخزاعي هو الكعبي وهو العدوي اسمه خويلد بن عمرو ومعنى قوله لا يثوي عنده يعني الضيف لا يقيم عنده حتى يشتد على صاحب المنزل والحرج هو الضيق إنما قوله حتى يحرجه يقول حتى يضيق عليه 	" Abu Shuraih Al-Kabi narrated that the Messenger of Allah said: :""Hospitality is for three days, and his reward is a day and a night, and whatever is spent on him after that is charity. And it is not lawful for him (the guest) to stay so long as to cause him harm."" (Sahih) "
tirmidhi27_720910	 حدثنا الأنصاري حدثنا معن حدثنا مالك عن صفوان بن	حدثنا سليم يرفعه إلى النبي صلى الله عليه وسلم قال الساعي على الأرملة والمسكين كالمجاهد في سبيل الله أو كالذي يصوم النهار ويقوم الليل 	 حدثنا الأنصاري حدثنا معن حدثنا مالك عن صفوان بن سليم يرفعه إلى النبي صلى الله عليه وسلم قال الساعي على الأرملة والمسكين كالمجاهد في سبيل الله أو كالذي يصوم النهار ويقوم الليل 	" Safwan bin Sulaim narrated that the Prophet said: ""The one who looks after a widow and a poor person is like the Mujahid in the cause of Allah, or like the one who fasts all the day and stands (in prayer) all the night."" (Sahih) "
tirmidhi27_720920	 حدثنا الأنصاري حدثنا معن حدثنا مالك عن ثور بن	حدثنا زيد الديلي عن أبي الغيث عن أبي هريرة عن النبي صلى الله عليه وسلم مثل ذلك وهذا الحديث حديث حسن غريب صحيح وأبو الغيث اسمه سالم مولى عبد الله بن مطيع وثور بن زيد مدني وثور بن يزيد شامي 	 حدثنا الأنصاري حدثنا معن حدثنا مالك عن ثور بن زيد الديلي عن أبي الغيث عن أبي هريرة عن النبي صلى الله عليه وسلم مثل ذلك وهذا الحديث حديث حسن غريب صحيح وأبو الغيث اسمه سالم مولى عبد الله بن مطيع وثور بن زيد مدني وثور بن يزيد شامي 	 
tirmidhi27_720930	 حدثنا قتيبة حدثنا المنكدر بن محمد بن المنكدر عن أبيه عن جابر بن	عن عبد الله قال قال رسول الله صلى الله عليه وسلم كل معروف صدقة وإن من المعروف أن تلقى أخاك بوجه طلق وأن تفرغ من دلوك في إناء أخيك وفي الباب عن أبي ذر قال أبو عيسى هذا حديث حسن 	 حدثنا قتيبة حدثنا المنكدر بن محمد بن المنكدر عن أبيه عن جابر بن عبد الله قال قال رسول الله صلى الله عليه وسلم كل معروف صدقة وإن من المعروف أن تلقى أخاك بوجه طلق وأن تفرغ من دلوك في إناء أخيك وفي الباب عن أبي ذر قال أبو عيسى هذا حديث حسن 	" Jabir bin Abdullah narrated that the Messenger of Allah said: ""Every good is charity. Indeed among the good is to meet your brother with a smiling face, and to pour what is left in your bucket into the vessel of your brother.""(Sahih) "
tirmidhi27_720940	 حدثنا هناد حدثنا أبو معاوية عن الأعمش عن شقيق بن	حدثنا سلمة عن عبد الله بن مسعود قال قال رسول الله صلى الله عليه وسلم عليكم بالصدق فإن الصدق يهدي إلى البر وإن البر يهدي إلى الجنة وما يزال الرجل يصدق ويتحرى الصدق حتى يكتب عند الله صديقا وإياكم والكذب فإن الكذب يهدي إلى الفجور وإن الفجور يهدي إلى النار وما يزال العبد يكذب ويتحرى الكذب حتى يكتب عند الله كذابا وفي الباب عن أبي بكر الصديق وعمر وعبد الله بن الشخير وابن عمر قال أبو عيسى هذا حديث حسن صحيح 	 حدثنا هناد حدثنا أبو معاوية عن الأعمش عن شقيق بن سلمة عن عبد الله بن مسعود قال قال رسول الله صلى الله عليه وسلم عليكم بالصدق فإن الصدق يهدي إلى البر وإن البر يهدي إلى الجنة وما يزال الرجل يصدق ويتحرى الصدق حتى يكتب عند الله صديقا وإياكم والكذب فإن الكذب يهدي إلى الفجور وإن الفجور يهدي إلى النار وما يزال العبد يكذب ويتحرى الكذب حتى يكتب عند الله كذابا وفي الباب عن أبي بكر الصديق وعمر وعبد الله بن الشخير وابن عمر قال أبو عيسى هذا حديث حسن صحيح 	" Abdullah bin Mas'ud narrated that the Messenger of Allah said: ""Abide by truthfulness. For indeed truthfulness leads to righteousness. And indeed righteousness leads to Paradise. A man continues telling the truth and trying hard to tell he truth until he is recorded with Allah as a truthful person. Refrain from falsehood. For indeed falsehood leads to the wickedness, and wickedness leads to Fire. A slave (of Allah) continues lying and trying hard to lie, until he is recorded with Allah as a liar."" (Sahih) "
tirmidhi27_720950	 حدثنا يحيى بن موسى قال قلت لعبد الرحيم بن	حدثنا هارون الغساني حدثكم عبد العزيز بن أبي رواد عن نافع عن ابن عمر أن النبي صلى الله عليه وسلم قال إذا كذب العبد تباعد عنه الملك ميلا من نتن ما جاء به قال يحيى فأقر به عبد الرحيم بن هارون فقال نعم قال أبو عيسى هذا حديث حسن غريب لا نعرفه إلا من هذا الوجه تفرد به عبد الرحيم بن هارون 	 حدثنا يحيى بن موسى قال قلت لعبد الرحيم بن هارون الغساني حدثكم عبد العزيز بن أبي رواد عن نافع عن ابن عمر أن النبي صلى الله عليه وسلم قال إذا كذب العبد تباعد عنه الملك ميلا من نتن ما جاء به قال يحيى فأقر به عبد الرحيم بن هارون فقال نعم قال أبو عيسى هذا حديث حسن غريب لا نعرفه إلا من هذا الوجه تفرد به عبد الرحيم بن هارون 	" Ibn 'Umar narrated that the Messenger of Allah said: ""When the slave (of Allah) lies, the angel goes a mile away from him because of the stench of what he has done.""Yahya said: ""(I asked) 'Abdur-Rahim bin Harun if he approved of it,and he said 'Yes'."" (Da'if) "
tirmidhi27_720960	 حدثنا يحيى بن موسى حدثنا عبد الرزاق عن معمر عن أيوب عن ابن أبي مليكة عن	عن عائشة قالت ما كان خلق أبغض إلى رسول الله صلى الله عليه وسلم من الكذب ولقد كان الرجل يحدث عند النبي صلى الله عليه وسلم بالكذبة فما يزال في نفسه حتى يعلم أنه قد أحدث منها توبة قال أبو عيسى هذا حديث حسن 	 حدثنا يحيى بن موسى حدثنا عبد الرزاق عن معمر عن أيوب عن ابن أبي مليكة عن عائشة قالت ما كان خلق أبغض إلى رسول الله صلى الله عليه وسلم من الكذب ولقد كان الرجل يحدث عند النبي صلى الله عليه وسلم بالكذبة فما يزال في نفسه حتى يعلم أنه قد أحدث منها توبة قال أبو عيسى هذا حديث حسن 	" Aishah narrated: ""There was no behavior more hated to the Messenger of Allah than lying. A man would lie in narrating something in the presence of the Prophet, and he would not be content until he knew that he had repented.""(Hasan) "
tirmidhi27_720970	 حدثنا محمد بن عبد الأعلى الصنعاني وغير واحد قالوا حدثنا عبد الرزاق عن معمر عن ثابت عن	حدثنا أنس قال قال رسول الله صلى الله عليه وسلم ما كان الفحش في شيء إلا شانه وما كان الحياء في شيء إلا زانه وفي الباب عن عائشة قال أبو عيسى هذا حديث حسن غريب لا نعرفه إلا من حديث عبد الرزاق 	 حدثنا محمد بن عبد الأعلى الصنعاني وغير واحد قالوا حدثنا عبد الرزاق عن معمر عن ثابت عن أنس قال قال رسول الله صلى الله عليه وسلم ما كان الفحش في شيء إلا شانه وما كان الحياء في شيء إلا زانه وفي الباب عن عائشة قال أبو عيسى هذا حديث حسن غريب لا نعرفه إلا من حديث عبد الرزاق 	" Anas narrated that the Messenger of Allah said: ""Al-Fuhsh is not present in anything but it mars it, and Al-Haya' is not present in anything but it beautifies it.""(Sahih) "
tirmidhi27_720980	 حدثنا محمود بن غيلان حدثنا أبو داود قال أنبأنا شعبة عن الأعمش قال سمعت أبا وائل يحدث عن مسروق عن عبد الله بن	عن عمرو قال قال رسول الله صلى الله عليه وسلم خياركم أحاسنكم أخلاقا ولم يكن النبي صلى الله عليه وسلم فاحشا ولا متفحشا قال أبو عيسى هذا حديث حسن صحيح 	 حدثنا محمود بن غيلان حدثنا أبو داود قال أنبأنا شعبة عن الأعمش قال سمعت أبا وائل يحدث عن مسروق عن عبد الله بن عمرو قال قال رسول الله صلى الله عليه وسلم خياركم أحاسنكم أخلاقا ولم يكن النبي صلى الله عليه وسلم فاحشا ولا متفحشا قال أبو عيسى هذا حديث حسن صحيح 	" 'Abdullah bin 'Amr said; ""The Messenger of Allah said: ""The best of you are those best in conduct.' And the Prophet was not one who was obscene, nor one who uttered obscenities.""(Sahih) "
tirmidhi27_720990	 حدثنا محمد بن المثنى حدثنا عبد الرحمن بن مهدي حدثنا هشام عن قتادة عن الحسن عن سمرة بن	حدثنا جندب قال قال رسول الله صلى الله عليه وسلم لا تلاعنوا بلعنة الله ولا بغضبه ولا بالنار قال وفي الباب عن ابن عباس وأبي هريرة وابن عمر وعمران بن حصين قال أبو عيسى هذا حديث حسن صحيح 	 حدثنا محمد بن المثنى حدثنا عبد الرحمن بن مهدي حدثنا هشام عن قتادة عن الحسن عن سمرة بن جندب قال قال رسول الله صلى الله عليه وسلم لا تلاعنوا بلعنة الله ولا بغضبه ولا بالنار قال وفي الباب عن ابن عباس وأبي هريرة وابن عمر وعمران بن حصين قال أبو عيسى هذا حديث حسن صحيح 	" 'Samurah bin Jundab narrated that the Messenger of Allah said: ""Do not curse yourselves with Allah's curse, nor with His anger, nor with the Fire."" (Da'if) "
tirmidhi27_721000	 حدثنا محمد بن يحيى الأزدي البصري حدثنا محمد بن	حدثنا سابق عن إسرائيل عن الأعمش عن إبراهيم عن علقمة عن عبد الله قال قال رسول الله صلى الله عليه وسلم ليس المؤمن بالطعان ولا اللعان ولا الفاحش ولا البذيء قال أبو عيسى هذا حديث حسن غريب وقد روي عن عبد الله من غير هذا الوجه 	 حدثنا محمد بن يحيى الأزدي البصري حدثنا محمد بن سابق عن إسرائيل عن الأعمش عن إبراهيم عن علقمة عن عبد الله قال قال رسول الله صلى الله عليه وسلم ليس المؤمن بالطعان ولا اللعان ولا الفاحش ولا البذيء قال أبو عيسى هذا حديث حسن غريب وقد روي عن عبد الله من غير هذا الوجه 	" 'Abdullah narrated that the Messenger of Allah said: ""The believer does not insult the honor of others, nor curse, nor commit Fahishah, nor is he foul.""(Hasan) "
tirmidhi27_721010	 حدثنا زيد بن أخزم الطائي البصري حدثنا بشر بن	حدثنا عمر حدثنا أبان بن يزيد عن قتادة عن أبي العالية عن ابن عباس أن رجلا لعن الريح عند النبي صلى الله عليه وسلم فقال لا تلعن الريح فإنها مأمورة وإنه من لعن شيئا ليس له بأهل رجعت اللعنة عليه قال أبو عيسى هذا حديث حسن غريب لا نعلم أحدا أسنده غير بشر بن عمر 	 حدثنا زيد بن أخزم الطائي البصري حدثنا بشر بن عمر حدثنا أبان بن يزيد عن قتادة عن أبي العالية عن ابن عباس أن رجلا لعن الريح عند النبي صلى الله عليه وسلم فقال لا تلعن الريح فإنها مأمورة وإنه من لعن شيئا ليس له بأهل رجعت اللعنة عليه قال أبو عيسى هذا حديث حسن غريب لا نعلم أحدا أسنده غير بشر بن عمر 	" 'Ibn 'Abbas narrated that a man cursed the wind in the presence of the Prophet, so he said: ""Do not curse the wind, for it is merely doing as ordered , and whoever curses something undeservingly, then the curse returns upon him."" (Da'if) "
