tirmidhi09_708880	 حدثنا أبو سعيد الأشج حدثنا عبد الله بن الأجلح عن الأعمش عن الحكم عن مقسم عن	عن ابن عباس أن النبي صلى الله عليه وسلم صلى بمنى الظهر والفجر ثم غدا إلى عرفات قال وفي الباب عن عبد الله بن الزبير وأنس قال أبو عيسى حديث مقسم عن ابن عباس قال علي بن المديني قال يحيى قال شعبة لم يسمع الحكم من مقسم إلا خمسة أشياء وعدها وليس هذا الحديث فيما عد شعبة 	 حدثنا أبو سعيد الأشج حدثنا عبد الله بن الأجلح عن الأعمش عن الحكم عن مقسم عن ابن عباس أن النبي صلى الله عليه وسلم صلى بمنى الظهر والفجر ثم غدا إلى عرفات قال وفي الباب عن عبد الله بن الزبير وأنس قال أبو عيسى حديث مقسم عن ابن عباس قال علي بن المديني قال يحيى قال شعبة لم يسمع الحكم من مقسم إلا خمسة أشياء وعدها وليس هذا الحديث فيما عد شعبة 	 Al-Hakam reported from Miqsam, that Ibn Abbas narrated: That the Prophet prayed Zuhr and Fajr in Mina, then he left in the morning to Arafat. (Sahih) 
tirmidhi09_708890	 حدثنا يوسف بن عيسى ومحمد بن أبان قالا حدثنا وكيع عن إسرائيل عن إبراهيم بن مهاجر عن يوسف بن ماهك عن أمه مسيكة عن	عن عائشة قالت قلنا يا رسول الله ألا نبني لك بيتا يظلك بمنى قال لا منى مناخ من سبق قال أبو عيسى هذا حديث حسن 	 حدثنا يوسف بن عيسى ومحمد بن أبان قالا حدثنا وكيع عن إسرائيل عن إبراهيم بن مهاجر عن يوسف بن ماهك عن أمه مسيكة عن عائشة قالت قلنا يا رسول الله ألا نبني لك بيتا يظلك بمنى قال لا منى مناخ من سبق قال أبو عيسى هذا حديث حسن 	" Aishah said: ""We said: 'O Messenger of Allah! Shall we build a structure to shade you at Mina? He said: 'No., Mina is a resting place for whoever arrives.'"" (Hasan) "
tirmidhi09_708900	 حدثنا قتيبة حدثنا أبو الأحوص عن أبي إسحاق عن حارثة بن	عن وهب قال صليت مع النبي صلى الله عليه وسلم بمنى آمن ما كان الناس وأكثره ركعتين قال وفي الباب عن ابن مسعود وابن عمر وأنس قال أبو عيسى حديث حارثة بن وهب حديث حسن صحيح وروي عن ابن مسعود أنه قال صليت مع النبي صلى الله عليه وسلم بمنى ركعتين ومع أبي بكر ومع عمر ومع عثمان ركعتين صدرا من إمارته وقد اختلف أهل العلم في تقصير الصلاة بمنى لأهل مكة فقال بعض أهل العلم ليس لأهل مكة أن يقصروا الصلاة بمنى إلا من كان بمنى مسافرا وهو قول ابن جريج وسفيان الثوري ويحيى بن سعيد القطان والشافعي وأحمد وإسحاق وقال بعضهم لا بأس لأهل مكة أن يقصروا الصلاة بمنى وهو قول الأوزاعي ومالك وسفيان بن عيينة وعبد الرحمن بن مهدي 	 حدثنا قتيبة حدثنا أبو الأحوص عن أبي إسحاق عن حارثة بن وهب قال صليت مع النبي صلى الله عليه وسلم بمنى آمن ما كان الناس وأكثره ركعتين قال وفي الباب عن ابن مسعود وابن عمر وأنس قال أبو عيسى حديث حارثة بن وهب حديث حسن صحيح وروي عن ابن مسعود أنه قال صليت مع النبي صلى الله عليه وسلم بمنى ركعتين ومع أبي بكر ومع عمر ومع عثمان ركعتين صدرا من إمارته وقد اختلف أهل العلم في تقصير الصلاة بمنى لأهل مكة فقال بعض أهل العلم ليس لأهل مكة أن يقصروا الصلاة بمنى إلا من كان بمنى مسافرا وهو قول ابن جريج وسفيان الثوري ويحيى بن سعيد القطان والشافعي وأحمد وإسحاق وقال بعضهم لا بأس لأهل مكة أن يقصروا الصلاة بمنى وهو قول الأوزاعي ومالك وسفيان بن عيينة وعبد الرحمن بن مهدي 	" Harithah bin Wahb said: ""I prayed two Rak'ah with the Prophet at Mina, and the people were as secure as they ever were, and even more so."" (Sahih) "
tirmidhi09_708910	 حدثنا قتيبة حدثنا سفيان بن عيينة عن عمرو بن	حدثنا دينار عن عمرو بن عبد الله بن صفوان عن يزيد بن شيبان قال أتانا ابن مربع الأنصاري ونحن وقوف بالموقف مكانا يباعده عمرو فقال إني رسول رسول الله صلى الله عليه وسلم إليكم يقول كونوا على مشاعركم فإنكم على إرث من إرث إبراهيم قال وفي الباب عن علي وعائشة وجبير بن مطعم والشريد بن سويد الثقفي قال أبو عيسى حديث ابن مربع الأنصاري حديث حسن لا نعرفه إلا من حديث ابن عيينة عن عمرو بن دينار وابن مربع اسمه يزيد بن مربع الأنصاري وإنما يعرف له هذا الحديث الواحد 	 حدثنا قتيبة حدثنا سفيان بن عيينة عن عمرو بن دينار عن عمرو بن عبد الله بن صفوان عن يزيد بن شيبان قال أتانا ابن مربع الأنصاري ونحن وقوف بالموقف مكانا يباعده عمرو فقال إني رسول رسول الله صلى الله عليه وسلم إليكم يقول كونوا على مشاعركم فإنكم على إرث من إرث إبراهيم قال وفي الباب عن علي وعائشة وجبير بن مطعم والشريد بن سويد الثقفي قال أبو عيسى حديث ابن مربع الأنصاري حديث حسن لا نعرفه إلا من حديث ابن عيينة عن عمرو بن دينار وابن مربع اسمه يزيد بن مربع الأنصاري وإنما يعرف له هذا الحديث الواحد 	" Amr bin Dinar narrated from Amr bin Abdulah bin Safwan, that Yazid bin Shaiban said: ""Ibn Mirba Al-Ansari came to us while we were standing at our places"" (Amr bin Sinar said:) a place that Amr (bin Abdullah) indicated was far - ""and he said: 'I am a messenger whom the Messenger of Allah sent to you to say: 'Stay with your (Hajj) rites, for indeed you are following a legacy left by Ibrahim.'"" (Sahih) "
tirmidhi09_708920	 حدثنا محمد بن عبد الأعلى الصنعاني البصري حدثنا محمد بن	حدثنا عبد الرحمن الطفاوي حدثنا هشام بن عروة عن أبيه عن عائشة قالت كانت قريش ومن كان على دينها وهم الحمس يقفون بالمزدلفة يقولون نحن قطين الله وكان من سواهم يقفون بعرفة فأنزل الله تعالى : (ثم أفيضوا من حيث أفاض الناس ) قال أبو عيسى هذا حديث حسن صحيح قال ومعنى هذا الحديث أن أهل مكة كانوا لا يخرجون من الحرم وعرفة خارج من الحرم وأهل مكة كانوا يقفون بالمزدلفة ويقولون نحن قطين الله يعني سكان الله ومن سوى أهل مكة كانوا يقفون بعرفات فأنزل الله تعالى: (ثم أفيضوا من حيث أفاض الناس ) والحمس هم أهل الحرم 	 حدثنا محمد بن عبد الأعلى الصنعاني البصري حدثنا محمد بن عبد الرحمن الطفاوي حدثنا هشام بن عروة عن أبيه عن عائشة قالت كانت قريش ومن كان على دينها وهم الحمس يقفون بالمزدلفة يقولون نحن قطين الله وكان من سواهم يقفون بعرفة فأنزل الله تعالى : (ثم أفيضوا من حيث أفاض الناس ) قال أبو عيسى هذا حديث حسن صحيح قال ومعنى هذا الحديث أن أهل مكة كانوا لا يخرجون من الحرم وعرفة خارج من الحرم وأهل مكة كانوا يقفون بالمزدلفة ويقولون نحن قطين الله يعني سكان الله ومن سوى أهل مكة كانوا يقفون بعرفات فأنزل الله تعالى: (ثم أفيضوا من حيث أفاض الناس ) والحمس هم أهل الحرم 	" Aishah narrated: ""The Quraish and those who followed their religion - and they were called Al-Hums - would stand at Al-Muzdalifah, and they would say: 'We are the people of Allah.' The others would stand at Arafat, so Allah the Mighty and Sublime revealed: Then depart from where the people depart."" (Sahih) "
tirmidhi09_708930	 حدثنا محمد بن بشار حدثنا أبو أحمد الزبيري حدثنا سفيان عن عبد الرحمن بن الحارث بن عياش بن	حدثنا أبي ربيعة عن زيد بن علي عن أبيه عن عبيد الله بن أبي رافع عن علي بن أبي طالب رضى الله عنه قال وقف رسول الله صلى الله عليه وسلم بعرفة فقال هذه عرفة وهذا هو الموقف وعرفة كلها موقف ثم أفاض حين غربت الشمس وأردف أسامة بن زيد وجعل يشير بيده على هيئته والناس يضربون يمينا وشمالا يلتفت إليهم ويقول يا أيها الناس عليكم السكينة ثم أتى جمعا فصلى بهم الصلاتين جميعا فلما أصبح أتى قزح فوقف عليه وقال هذا قزح وهو الموقف وجمع كلها موقف ثم أفاض حتى انتهى إلى وادي محسر فقرع ناقته فخبت حتى جاوز الوادي فوقف وأردف الفضل ثم أتى الجمرة فرماها ثم أتى المنحر فقال هذا المنحر ومنى كلها منحر واستفتته جارية شابة من خثعم فقالت إن أبي شيخ كبير قد أدركته فريضة الله في الحج أفيجزئ أن أحج عنه قال حجي عن أبيك قال ولوى عنق الفضل فقال العباس يا رسول الله لم لويت عنق ابن عمك قال رأيت شابا وشابة فلم آمن الشيطان عليهما ثم أتاه رجل فقال يا رسول الله إني أفضت قبل أن أحلق قال احلق أو قصر ولا حرج قال وجاء آخر فقال يا رسول الله إني ذبحت قبل أن أرمي قال ارم ولا حرج قال ثم أتى البيت فطاف به ثم أتى زمزم فقال يا بني عبد المطلب لولا أن يغلبكم الناس عنه لنزعت قال وفي الباب عن جابر قال أبو عيسى حديث علي حديث حسن صحيح لا نعرفه من حديث علي إلا من هذا الوجه من حديث عبد الرحمن بن الحارث بن عياش وقد رواه غير واحد عن الثوري مثل هذا والعمل على هذا عند أهل العلم رأوا أن يجمع بين الظهر والعصر بعرفة في وقت الظهر وقال بعض أهل العلم إذا صلى الرجل في رحله ولم يشهد الصلاة مع الإمام إن شاء جمع هو بين الصلاتين مثل ما صنع الإمام قال وزيد بن علي هو ابن حسين بن علي بن أبي طالب عليه السلام 	 حدثنا محمد بن بشار حدثنا أبو أحمد الزبيري حدثنا سفيان عن عبد الرحمن بن الحارث بن عياش بن أبي ربيعة عن زيد بن علي عن أبيه عن عبيد الله بن أبي رافع عن علي بن أبي طالب رضى الله عنه قال وقف رسول الله صلى الله عليه وسلم بعرفة فقال هذه عرفة وهذا هو الموقف وعرفة كلها موقف ثم أفاض حين غربت الشمس وأردف أسامة بن زيد وجعل يشير بيده على هيئته والناس يضربون يمينا وشمالا يلتفت إليهم ويقول يا أيها الناس عليكم السكينة ثم أتى جمعا فصلى بهم الصلاتين جميعا فلما أصبح أتى قزح فوقف عليه وقال هذا قزح وهو الموقف وجمع كلها موقف ثم أفاض حتى انتهى إلى وادي محسر فقرع ناقته فخبت حتى جاوز الوادي فوقف وأردف الفضل ثم أتى الجمرة فرماها ثم أتى المنحر فقال هذا المنحر ومنى كلها منحر واستفتته جارية شابة من خثعم فقالت إن أبي شيخ كبير قد أدركته فريضة الله في الحج أفيجزئ أن أحج عنه قال حجي عن أبيك قال ولوى عنق الفضل فقال العباس يا رسول الله لم لويت عنق ابن عمك قال رأيت شابا وشابة فلم آمن الشيطان عليهما ثم أتاه رجل فقال يا رسول الله إني أفضت قبل أن أحلق قال احلق أو قصر ولا حرج قال وجاء آخر فقال يا رسول الله إني ذبحت قبل أن أرمي قال ارم ولا حرج قال ثم أتى البيت فطاف به ثم أتى زمزم فقال يا بني عبد المطلب لولا أن يغلبكم الناس عنه لنزعت قال وفي الباب عن جابر قال أبو عيسى حديث علي حديث حسن صحيح لا نعرفه من حديث علي إلا من هذا الوجه من حديث عبد الرحمن بن الحارث بن عياش وقد رواه غير واحد عن الثوري مثل هذا والعمل على هذا عند أهل العلم رأوا أن يجمع بين الظهر والعصر بعرفة في وقت الظهر وقال بعض أهل العلم إذا صلى الرجل في رحله ولم يشهد الصلاة مع الإمام إن شاء جمع هو بين الصلاتين مثل ما صنع الإمام قال وزيد بن علي هو ابن حسين بن علي بن أبي طالب عليه السلام 	" Ali bin Abi Talib, may Allah be pleased with him, narrated: ""The Messenger of Allah stopped at Arafat and said: 'This is Arafah and it is a place of standing. And all of Arafat is a place for standing.' Then he departed when the sun had set and took Usamah bin Zaid as a companion rider, and he was motioning with his hand as was his custom, and the people were striking (their camels) on the right and the left to try and catch them, so he said: 'O you people! Be calmm.' Then he came to Jama and performed the two Salat there combined. When the morning came, he went to Quzah and stood there and said: 'This is Quzah, and it is a place of standing, and all of Jama is a place for standing.' Then he departed until he arrived at Wadi Muhassir. Then he stuck his she-camel and she trotted until he passed the valley. Then he stopped and took Al-Fadl as a companion rider and went to the Jamrah to stone it. Then he went to Al-Manhar and said: 'This is Al-Manhar, and all of Mina is a place for sacrifice.' A young girl from Khath'am came to ask him for a verdict, she said: 'Indeed my father is an elderly man who has lived until Allah has made Hajj obligatory, so would he be rewarded if I perform Hajj for him? He said: 'Perform Hajj for your father.'"" He said: ""And he turned the neck of Al Fadl. So Al-Abbas said: 'O Messenger of Allah! Why did you turn the neck of your cousin?' He said: 'I saw a young man and a young woman, and they were not safe from Shaitan.' A man came to him and said, 'O Messenger of Allah! I performed (Tawaf) Al-Ifadah before shaving.' He said: 'Shave, and there is no harm'"" - or: 'Clip and there is no harm'"" He said: ""Someone else came and said: 'O Messenger of Allah! I did the sacrifice before stoning.' So he said: 'Stone, and there is no harm.'"" He said: ""Then he went to the House (Ka'bah) to perform Tawaf around it, then he went to Zamzam and said: 'O tribe of Abdul-Muttalib! If it were not that the people would rush upon you then I would remove it.'"" (Da'if) "
tirmidhi09_708940	 حدثنا محمود بن غيلان حدثنا وكيع وبشر بن	حدثنا السري وأبو نعيم قالوا حدثنا سفيان عن أبي الزبير عن جابر أن النبي صلى الله عليه وسلم أوضع في وادي محسر وزاد فيه بشر وأفاض من جمع وعليه السكينة وأمرهم بالسكينة وزاد فيه أبو نعيم وأمرهم أن يرموا بمثل حصى الخذف وقال لعلي لا أراكم بعد عامي هذا قال وفي الباب عن أسامة بن زيد قال أبو عيسى حديث جابر حديث حسن صحيح 	 حدثنا محمود بن غيلان حدثنا وكيع وبشر بن السري وأبو نعيم قالوا حدثنا سفيان عن أبي الزبير عن جابر أن النبي صلى الله عليه وسلم أوضع في وادي محسر وزاد فيه بشر وأفاض من جمع وعليه السكينة وأمرهم بالسكينة وزاد فيه أبو نعيم وأمرهم أن يرموا بمثل حصى الخذف وقال لعلي لا أراكم بعد عامي هذا قال وفي الباب عن أسامة بن زيد قال أبو عيسى حديث جابر حديث حسن صحيح 	" Jabir narrated: ""The Prophet hurried through Wadi Muhassir."" Bishr (one of the narrators) added: ""He departed from Jam calmly and he ordered them (the people) to be calm."" And Abu Nu'aim (one of the narrators) added: ""And he ordered them to do the stoning with what was similar to pebbles for Al-Khadhf' And he said: ""Perhaps I will not see you after this year."" (Sahih) "
tirmidhi09_708950	 حدثنا محمد بن بشار حدثنا يحيى بن سعيد القطان حدثنا سفيان الثوري عن أبي إسحاق عن عبد الله بن	حدثنا مالك أن ابن عمر صلى بجمع فجمع بين الصلاتين بإقامة وقال رأيت رسول الله صلى الله عليه وسلم فعل مثل هذا في هذا المكان 	 حدثنا محمد بن بشار حدثنا يحيى بن سعيد القطان حدثنا سفيان الثوري عن أبي إسحاق عن عبد الله بن مالك أن ابن عمر صلى بجمع فجمع بين الصلاتين بإقامة وقال رأيت رسول الله صلى الله عليه وسلم فعل مثل هذا في هذا المكان 	" Abdullah bin Malik narrated: ""Ibn Umar prayed at Jam (Muzdalifah), so he combined two prayers with the Iqamah, and he said: 'I saw the Messenger of Allah doing the same as this at the place.'"" (Da'if) "
tirmidhi09_708960	 حدثنا محمد بن بشار حدثنا يحيى بن سعيد عن إسماعيل بن أبي خالد عن أبي إسحاق عن سعيد بن جبير عن ابن عمر عن النبي صلى الله عليه وسلم بمثله قال محمد بن	عن بشار قال يحيى والصواب حديث سفيان قال وفي الباب عن علي وأبي أيوب وعبد الله بن مسعود وجابر وأسامة بن زيد قال أبو عيسى حديث ابن عمر في رواية سفيان أصح من رواية إسماعيل بن أبي خالد وحديث سفيان حديث صحيح حسن قال أبو عيسى وروى إسرائيل هذا الحديث عن أبي إسحاق عن عبد الله وخالد ابنى مالك عن ابن عمر وحديث سعيد بن جبير عن ابن عمر هو حديث حسن صحيح أيضا رواه سلمة بن كهيل عن سعيد بن جبير وأما أبو إسحاق فرواه عن عبد الله وخالد ابنى مالك عن ابن عمر والعمل على هذا عند أهل العلم لأنه لا تصلى صلاة المغرب دون جمع فإذا أتى جمعا وهو المزدلفة جمع بين الصلاتين بإقامة واحدة ولم يتطوع فيما بينهما وهو الذي اختاره بعض أهل العلم وذهب إليه وهو قول سفيان الثوري قال سفيان وإن شاء صلى المغرب ثم تعشى ووضع ثيابه ثم أقام فصلى العشاء وقال بعض أهل العلم يجمع بين المغرب والعشاء بالمزدلفة بأذان وإقامتين يؤذن لصلاة المغرب ويقيم ويصلي المغرب ثم يقيم ويصلي العشاء وهو قول الشافعي قال أبو عيسى وروى إسرائيل هذا الحديث عن أبي إسحق عن عبد الله وخالد ابني مالك عن ابن عمر وحديث سعيد بن جبير عن ابن عمر هو حديث حسن صحيح أيضا رواه سلمة بن كهيل عن سعيد بن جبير وأما أبو إسحق فرواه عن عبد الله وخالد ابني مالك عن ابن عمر 	 حدثنا محمد بن بشار حدثنا يحيى بن سعيد عن إسماعيل بن أبي خالد عن أبي إسحاق عن سعيد بن جبير عن ابن عمر عن النبي صلى الله عليه وسلم بمثله قال محمد بن بشار قال يحيى والصواب حديث سفيان قال وفي الباب عن علي وأبي أيوب وعبد الله بن مسعود وجابر وأسامة بن زيد قال أبو عيسى حديث ابن عمر في رواية سفيان أصح من رواية إسماعيل بن أبي خالد وحديث سفيان حديث صحيح حسن قال أبو عيسى وروى إسرائيل هذا الحديث عن أبي إسحاق عن عبد الله وخالد ابنى مالك عن ابن عمر وحديث سعيد بن جبير عن ابن عمر هو حديث حسن صحيح أيضا رواه سلمة بن كهيل عن سعيد بن جبير وأما أبو إسحاق فرواه عن عبد الله وخالد ابنى مالك عن ابن عمر والعمل على هذا عند أهل العلم لأنه لا تصلى صلاة المغرب دون جمع فإذا أتى جمعا وهو المزدلفة جمع بين الصلاتين بإقامة واحدة ولم يتطوع فيما بينهما وهو الذي اختاره بعض أهل العلم وذهب إليه وهو قول سفيان الثوري قال سفيان وإن شاء صلى المغرب ثم تعشى ووضع ثيابه ثم أقام فصلى العشاء وقال بعض أهل العلم يجمع بين المغرب والعشاء بالمزدلفة بأذان وإقامتين يؤذن لصلاة المغرب ويقيم ويصلي المغرب ثم يقيم ويصلي العشاء وهو قول الشافعي قال أبو عيسى وروى إسرائيل هذا الحديث عن أبي إسحق عن عبد الله وخالد ابني مالك عن ابن عمر وحديث سعيد بن جبير عن ابن عمر هو حديث حسن صحيح أيضا رواه سلمة بن كهيل عن سعيد بن جبير وأما أبو إسحق فرواه عن عبد الله وخالد ابني مالك عن ابن عمر 	 (Another chain) that Sa'eed bin Jubair narrated : Similarly from Ibn Umar, from the Prophet. (Sahih) 
tirmidhi09_708970	 حدثنا محمد بن بشار حدثنا يحيى بن	حدثنا سعيد وعبد الرحمن بن مهدي قالا حدثنا سفيان عن بكير بن عطاء عن عبد الرحمن بن يعمر أن ناسا من أهل نجد أتوا رسول الله صلى الله عليه وسلم وهو بعرفة فسألوه فأمر مناديا فنادى الحج عرفة من جاء ليلة جمع قبل طلوع الفجر فقد أدرك الحج أيام منى ثلاثة فمن تعجل في يومين فلا إثم عليه ومن تأخر فلا إثم عليه قال محمد وزاد يحيى وأردف رجلا فنادى 	 حدثنا محمد بن بشار حدثنا يحيى بن سعيد وعبد الرحمن بن مهدي قالا حدثنا سفيان عن بكير بن عطاء عن عبد الرحمن بن يعمر أن ناسا من أهل نجد أتوا رسول الله صلى الله عليه وسلم وهو بعرفة فسألوه فأمر مناديا فنادى الحج عرفة من جاء ليلة جمع قبل طلوع الفجر فقد أدرك الحج أيام منى ثلاثة فمن تعجل في يومين فلا إثم عليه ومن تأخر فلا إثم عليه قال محمد وزاد يحيى وأردف رجلا فنادى 	" Abdur-Rahman bin Ya'mar narrated that: Some people among the residents of Najd came to the Messenger of Allah while he was at Arafat. They were questioning him, so he ordered a caller to proclaim: ""The Hajj is Arafah. Whoever came to Jam during the night, before the time of Fajr, then he has attended the Hajj. The days of Mina are three, so whoever hastens (leaving after) two days, then there is no sin upon him, and whoever delays, then there is no sin upon him."" Muhammad said: ""Yahya added: 'And he took a companion rider to proclaim it.'"" (Sahih) "
