tirmidhi27_721230	 حدثنا أبو كريب حدثنا سويد بن عمرو الكلبي عن حماد بن سلمة عن أيوب عن محمد بن	عن سيرين عن أبي هريرة أراه رفعه قال أحبب حبيبك هونا ما عسى أن يكون بغيضك يوما ما وأبغض بغيضك هونا ما عسى أن يكون حبيبك يوما ما قال أبو عيسى هذا حديث غريب لا نعرفه بهذا الإسناد إلا من هذا الوجه وقد روي هذا الحديث عن أيوب بإسناد غير هذا رواه الحسن بن أبي جعفر وهو حديث ضعيف أيضا بإسناد له عن علي عن النبي صلى الله عليه وسلم والصحيح عن علي موقوف قوله 	 حدثنا أبو كريب حدثنا سويد بن عمرو الكلبي عن حماد بن سلمة عن أيوب عن محمد بن سيرين عن أبي هريرة أراه رفعه قال أحبب حبيبك هونا ما عسى أن يكون بغيضك يوما ما وأبغض بغيضك هونا ما عسى أن يكون حبيبك يوما ما قال أبو عيسى هذا حديث غريب لا نعرفه بهذا الإسناد إلا من هذا الوجه وقد روي هذا الحديث عن أيوب بإسناد غير هذا رواه الحسن بن أبي جعفر وهو حديث ضعيف أيضا بإسناد له عن علي عن النبي صلى الله عليه وسلم والصحيح عن علي موقوف قوله 	 Muhammad bin Sirlin narrated from Abu Hurairah 
tirmidhi27_721240	 حدثنا أبو هشام الرفاعي حدثنا أبو بكر بن عياش عن الأعمش عن إبراهيم عن علقمة عن	عن عبد الله قال قال رسول الله صلى الله عليه وسلم لا يدخل الجنة من كان في قلبه مثقال حبة من خردل من كبر ولا يدخل النار من كان في قلبه مثقال حبة من إيمان وفي الباب عن أبي هريرة وابن عباس وسلمة بن الأكوع وأبي سعيد قال أبو عيسى هذا حديث حسن صحيح 	 حدثنا أبو هشام الرفاعي حدثنا أبو بكر بن عياش عن الأعمش عن إبراهيم عن علقمة عن عبد الله قال قال رسول الله صلى الله عليه وسلم لا يدخل الجنة من كان في قلبه مثقال حبة من خردل من كبر ولا يدخل النار من كان في قلبه مثقال حبة من إيمان وفي الباب عن أبي هريرة وابن عباس وسلمة بن الأكوع وأبي سعيد قال أبو عيسى هذا حديث حسن صحيح 	" Abdullah narrated that the Messenger of Allah said: ""Whoever has a mustard seed's weight of pride (arrogance) in his heart, shall not be admitted into Paradise. And whoever has a mustard seed's weight of faith in his heart, shall not be admitted into the Fire.""(Sahih) "
tirmidhi27_721250	 حدثنا محمد بن المثنى وعبد الله بن	حدثنا عبد الرحمن قالا حدثنا يحيى بن حماد حدثنا شعبة عن أبان بن تغلب عن فضيل بن عمرو عن إبراهيم عن علقمة عن عبد الله عن النبي صلى الله عليه وسلم قال لا يدخل الجنة من كان في قلبه مثقال ذرة من كبر ولا يدخل النار يعني من كان في قلبه مثقال ذرة من إيمان قال فقال له رجل إنه يعجبني أن يكون ثوبي حسنا ونعلي حسنة قال إن الله يحب الجمال ولكن الكبر من بطر الحق وغمص الناس قال أبو عيسى هذا حديث حسن صحيح غريب وقال بعض أهل العلم في تفسير هذا الحديث لا يدخل النار من كان في قلبه مثقال ذرة من إيمان إنما معناه لا يخلد في النار وهكذا روي عن أبي سعيد الخدري عن النبي صلى الله عليه وسلم قال يخرج من النار من كان في قلبه مثقال ذرة من إيمان وقد فسر غير واحد من التابعين هذه الآية : (ربنا إنك من تدخل النار فقد أخزيته ) فقال من تخلد في النار فقد أخزيته 	 حدثنا محمد بن المثنى وعبد الله بن عبد الرحمن قالا حدثنا يحيى بن حماد حدثنا شعبة عن أبان بن تغلب عن فضيل بن عمرو عن إبراهيم عن علقمة عن عبد الله عن النبي صلى الله عليه وسلم قال لا يدخل الجنة من كان في قلبه مثقال ذرة من كبر ولا يدخل النار يعني من كان في قلبه مثقال ذرة من إيمان قال فقال له رجل إنه يعجبني أن يكون ثوبي حسنا ونعلي حسنة قال إن الله يحب الجمال ولكن الكبر من بطر الحق وغمص الناس قال أبو عيسى هذا حديث حسن صحيح غريب وقال بعض أهل العلم في تفسير هذا الحديث لا يدخل النار من كان في قلبه مثقال ذرة من إيمان إنما معناه لا يخلد في النار وهكذا روي عن أبي سعيد الخدري عن النبي صلى الله عليه وسلم قال يخرج من النار من كان في قلبه مثقال ذرة من إيمان وقد فسر غير واحد من التابعين هذه الآية : (ربنا إنك من تدخل النار فقد أخزيته ) فقال من تخلد في النار فقد أخزيته 	" Abdullah narrated: ""The Messenger of Allah said:'Whoever has a speck of pride (arrogance) in his heart, shall not be admitted into Paradise. And whoever has a speck of faith in his heart, shall not be admitted in to the Fire.'"" Ha said: ""So a man said to him: 'I like for my clothes to be nice, and my sandals to be nice?' So he said: 'Indeed Allah loves beauty. But pride is refusing the truth and betelling the people.'""(Sahih) "
tirmidhi27_721260	 حدثنا أبو كريب حدثنا أبو معاوية عن عمر بن	حدثنا راشد عن إياس بن سلمة بن الأكوع عن أبيه قال قال رسول الله صلى الله عليه وسلم لا يزال الرجل يذهب بنفسه حتى يكتب في الجبارين فيصيبه ما أصابهم قال أبو عيسى هذا حديث حسن غريب 	 حدثنا أبو كريب حدثنا أبو معاوية عن عمر بن راشد عن إياس بن سلمة بن الأكوع عن أبيه قال قال رسول الله صلى الله عليه وسلم لا يزال الرجل يذهب بنفسه حتى يكتب في الجبارين فيصيبه ما أصابهم قال أبو عيسى هذا حديث حسن غريب 	" Iylas bin Salamah bin Al-Akwa' narrated from his father that the Messenger of Allah said: ""A man shall remain exalting himself until he is written among the tyrants, so that he suffers from their afflictions."" (Da'if) "
tirmidhi27_721270	 حدثنا علي بن عيسى البغدادي حدثنا شبابة بن سوار حدثنا ابن أبي ذئب عن القاسم بن عباس عن نافع بن جبير بن مطعم عن	عن أبيه قال تقولون لي في التيه وقد ركبت الحمار ولبست الشملة وقد حلبت الشاة وقد قال رسول الله صلى الله عليه وسلم من فعل هذا فليس فيه من الكبر شيء قال أبو عيسى هذا حديث حسن صحيح غريب 	 حدثنا علي بن عيسى البغدادي حدثنا شبابة بن سوار حدثنا ابن أبي ذئب عن القاسم بن عباس عن نافع بن جبير بن مطعم عن أبيه قال تقولون لي في التيه وقد ركبت الحمار ولبست الشملة وقد حلبت الشاة وقد قال رسول الله صلى الله عليه وسلم من فعل هذا فليس فيه من الكبر شيء قال أبو عيسى هذا حديث حسن صحيح غريب 	" Jubair bin Mut'im narrated from his father who said: ""They (meaning the people in general) told me that I was proud, while I rode a donkey, wore a cloak, and I milked the sheep. And the Messenger of Allah said to me:""Whoever does these, then there is no pride (arrogance) in him.'"" (Sahih) "
tirmidhi27_721280	 حدثنا ابن أبي عمر حدثنا سفيان حدثنا عمرو بن	حدثنا دينار عن ابن أبي مليكة عن يعلى بن مملك عن أم الدرداء عن أبي الدرداء أن النبي صلى الله عليه وسلم قال ما شيء أثقل في ميزان المؤمن يوم القيامة من خلق حسن وإن الله ليبغض الفاحش البذيء قال أبو عيسى وفي الباب عن عائشة وأبي هريرة وأنس وأسامة بن شريك وهذا حديث حسن صحيح 	 حدثنا ابن أبي عمر حدثنا سفيان حدثنا عمرو بن دينار عن ابن أبي مليكة عن يعلى بن مملك عن أم الدرداء عن أبي الدرداء أن النبي صلى الله عليه وسلم قال ما شيء أثقل في ميزان المؤمن يوم القيامة من خلق حسن وإن الله ليبغض الفاحش البذيء قال أبو عيسى وفي الباب عن عائشة وأبي هريرة وأنس وأسامة بن شريك وهذا حديث حسن صحيح 	" Abu Ad-Dardh narrated that the Messenger of Allah said: ""Nothing is heavier on the believer's Scale on the Day of Judgment than good character. For indeed Allah, Most High, is angered by the shameless obscene person."" (Sahih) "
tirmidhi27_721290	 حدثنا أبو كريب حدثنا قبيصة بن الليث الكوفي عن مطرف عن عطاء عن أم الدرداء عن	عن أبي الدرداء قال سمعت النبي صلى الله عليه وسلم يقول ما من شيء يوضع في الميزان أثقل من حسن الخلق وإن صاحب حسن الخلق ليبلغ به درجة صاحب الصوم والصلاة قال أبو عيسى هذا حديث غريب من هذا الوجه 	 حدثنا أبو كريب حدثنا قبيصة بن الليث الكوفي عن مطرف عن عطاء عن أم الدرداء عن أبي الدرداء قال سمعت النبي صلى الله عليه وسلم يقول ما من شيء يوضع في الميزان أثقل من حسن الخلق وإن صاحب حسن الخلق ليبلغ به درجة صاحب الصوم والصلاة قال أبو عيسى هذا حديث غريب من هذا الوجه 	" Abu Ad-Dardh narrated that the Messenger of Allah said: ""Nothing is placed on the Scale that is heavier than good character. Indeed the person with good character will have attained the rank of the person of fasting and prayer.""(Hasan) "
tirmidhi27_721300	 حدثنا أبو كريب محمد بن العلاء حدثنا عبد الله بن	حدثنا إدريس حدثني أبي عن جدي عن أبي هريرة قال سئل رسول الله صلى الله عليه وسلم عن أكثر ما يدخل الناس الجنة فقال تقوى الله وحسن الخلق وسئل عن أكثر ما يدخل الناس النار فقال الفم والفرج قال أبو عيسى هذا حديث صحيح غريب وعبد الله بن إدريس هو ابن يزيد بن عبد الرحمن الأودي 	 حدثنا أبو كريب محمد بن العلاء حدثنا عبد الله بن إدريس حدثني أبي عن جدي عن أبي هريرة قال سئل رسول الله صلى الله عليه وسلم عن أكثر ما يدخل الناس الجنة فقال تقوى الله وحسن الخلق وسئل عن أكثر ما يدخل الناس النار فقال الفم والفرج قال أبو عيسى هذا حديث صحيح غريب وعبد الله بن إدريس هو ابن يزيد بن عبد الرحمن الأودي 	" Abu Hurairah narrated that the Messenger of Allah was asked about that for which people are admitted into Paradise the most, so he said: ""Taqwa of Allah, and good character."" And he was asked about that for which people are admitted into the Fire the most, and he said: "" The mouth and the private parts."" (Sahih) "
tirmidhi27_721310	 حدثنا أحمد بن عبدة الضبي حدثنا أبو وهب عن عبد الله بن	عن المبارك أنه وصف حسن الخلق فقال هو بسط الوجه وبذل المعروف وكف الأذى 	 حدثنا أحمد بن عبدة الضبي حدثنا أبو وهب عن عبد الله بن المبارك أنه وصف حسن الخلق فقال هو بسط الوجه وبذل المعروف وكف الأذى 	" Abu Wahb narrated that : 'Abdullah bin Al-Mubarak explained good character, and then he said: ""It is a smiling face, doing one's best in good, and refraining from harm."" (Sahih) "
tirmidhi27_721320	 حدثنا بندار وأحمد بن منيع ومحمود بن غيلان قالوا حدثنا أبو أحمد الزبيري عن سفيان عن أبي إسحاق عن أبي الأحوص عن	عن أبيه قال قلت يا رسول الله الرجل أمر به فلا يقريني ولا يضيفني فيمر بي أفأجزيه قال لا أقره قال ورآني رث الثياب فقال هل لك من مال قلت من كل المال قد أعطاني الله من الإبل والغنم قال فلير عليك قال أبو عيسى وفي الباب عن عائشة وجابر وأبي هريرة وهذا حديث حسن صحيح وأبو الأحوص اسمه عوف بن مالك بن نضلة الجشمي ومعنى قوله أقره أضفه والقرى هو الضيافة 	 حدثنا بندار وأحمد بن منيع ومحمود بن غيلان قالوا حدثنا أبو أحمد الزبيري عن سفيان عن أبي إسحاق عن أبي الأحوص عن أبيه قال قلت يا رسول الله الرجل أمر به فلا يقريني ولا يضيفني فيمر بي أفأجزيه قال لا أقره قال ورآني رث الثياب فقال هل لك من مال قلت من كل المال قد أعطاني الله من الإبل والغنم قال فلير عليك قال أبو عيسى وفي الباب عن عائشة وجابر وأبي هريرة وهذا حديث حسن صحيح وأبو الأحوص اسمه عوف بن مالك بن نضلة الجشمي ومعنى قوله أقره أضفه والقرى هو الضيافة 	" Abu Al-Ahwas narrated from his father who said: ""I said: 'O Messenger of Allah! I stayed with a man who did not entertain me nor behave hospitably with me. Then he came to stay with me, shall I reciprocate the same to him?' He (SL3M said: 'No, entertain him."" He said: 'He (SL3M saw me wearing tattered clothes and said:'(Do you have any wealth?' I said: 'Allah has given me various kinds of wealth through camels and goats.' He said: 'Then let it be seen on you.'"" (Sahih) "
tirmidhi27_721330	 حدثنا أبو هشام الرفاعي محمد بن يزيد حدثنا محمد بن	حدثنا فضيل عن الوليد بن عبد الله بن جميع عن أبي الطفيل عن حذيفة قال قال رسول الله صلى الله عليه وسلم لا تكونوا إمعة تقولون إن أحسن الناس أحسنا وإن ظلموا ظلمنا ولكن وطنوا أنفسكم إن أحسن الناس أن تحسنوا وإن أساءوا فلا تظلموا قال أبو عيسى هذا حديث حسن غريب لا نعرفه إلا من هذا الوجه 	 حدثنا أبو هشام الرفاعي محمد بن يزيد حدثنا محمد بن فضيل عن الوليد بن عبد الله بن جميع عن أبي الطفيل عن حذيفة قال قال رسول الله صلى الله عليه وسلم لا تكونوا إمعة تقولون إن أحسن الناس أحسنا وإن ظلموا ظلمنا ولكن وطنوا أنفسكم إن أحسن الناس أن تحسنوا وإن أساءوا فلا تظلموا قال أبو عيسى هذا حديث حسن غريب لا نعرفه إلا من هذا الوجه 	" Hudhaifah narrated that the Messenger of Allah said: ""Do not let yourselves be 'yes-men', saying: 'If the people are good then we will be good, and if they are wrong then we will be wrong.'Rather, make up your own minds, if the people are good then you are good, and if they are evil, then do not behave unjustly."" (Hasan) "
tirmidhi27_721340	 حدثنا محمد بن بشار والحسين بن	حدثنا أبي كبشة البصري قالا حدثنا يوسف بن يعقوب السدوسي حدثنا أبو سنان القسملي هو الشامي عن عثمان بن أبي سودة عن أبي هريرة قال قال رسول الله صلى الله عليه وسلم من عاد مريضا أو زار أخا له في الله ناداه مناد أن طبت وطاب ممشاك وتبوأت من الجنة منزلا قال أبو عيسى هذا حديث حسن غريب وأبو سنان اسمه عيسى بن سنان وقد روى حماد بن سلمة عن ثابت عن أبي رافع عن أبي هريرة عن النبي صلى الله عليه وسلم شيئا من هذا 	 حدثنا محمد بن بشار والحسين بن أبي كبشة البصري قالا حدثنا يوسف بن يعقوب السدوسي حدثنا أبو سنان القسملي هو الشامي عن عثمان بن أبي سودة عن أبي هريرة قال قال رسول الله صلى الله عليه وسلم من عاد مريضا أو زار أخا له في الله ناداه مناد أن طبت وطاب ممشاك وتبوأت من الجنة منزلا قال أبو عيسى هذا حديث حسن غريب وأبو سنان اسمه عيسى بن سنان وقد روى حماد بن سلمة عن ثابت عن أبي رافع عن أبي هريرة عن النبي صلى الله عليه وسلم شيئا من هذا 	" Abu Hurairah narrated that the Messenger of Allah said: ""Whoever visits the sick, or visits his brother in Allah (faith), a caller calls out: 'May you have goodness and livelihood be good, and may you dwell in an adobe in Paradise.'""(Da'if) "
tirmidhi27_721350	 حدثنا أبو كريب حدثنا عبدة بن	حدثنا سليمان وعبد الرحيم ومحمد بن بشر عن محمد بن عمرو حدثنا أبو سلمة عن أبي هريرة قال قال رسول الله صلى الله عليه وسلم الحياء من الإيمان والإيمان في الجنة والبذاء من الجفاء والجفاء في النار قال أبو عيسى وفي الباب عن ابن عمر وأبي بكرة وأبي أمامة وعمران بن حصين هذا حديث حسن صحيح 	 حدثنا أبو كريب حدثنا عبدة بن سليمان وعبد الرحيم ومحمد بن بشر عن محمد بن عمرو حدثنا أبو سلمة عن أبي هريرة قال قال رسول الله صلى الله عليه وسلم الحياء من الإيمان والإيمان في الجنة والبذاء من الجفاء والجفاء في النار قال أبو عيسى وفي الباب عن ابن عمر وأبي بكرة وأبي أمامة وعمران بن حصين هذا حديث حسن صحيح 	" Abu Hurairah narrated that the Messenger of Allah said: ""Al-Haya is from faith, and faith is in Paradise. Obscenity is from rudeness, and rudeness is in the Fire.""(Hasan) "
tirmidhi27_721360	 حدثنا نصر بن علي الجهضمي حدثنا نوح بن قيس عن عبد الله بن عمران عن عاصم الأحول عن عبد الله بن	عن سرجس المزني أن النبي صلى الله عليه وسلم قال السمت الحسن والتؤدة والاقتصاد جزء من أربعة وعشرين جزءا من النبوة وفي الباب عن ابن عباس وهذا حديث حسن غريب 	 حدثنا نصر بن علي الجهضمي حدثنا نوح بن قيس عن عبد الله بن عمران عن عاصم الأحول عن عبد الله بن سرجس المزني أن النبي صلى الله عليه وسلم قال السمت الحسن والتؤدة والاقتصاد جزء من أربعة وعشرين جزءا من النبوة وفي الباب عن ابن عباس وهذا حديث حسن غريب 	" Abdullah bin Sarjis Al-Muzam narrated that the Messenger of Allah said: ""Taking the good route is a part of the twenty-four parts of Prophethood.""(Hasan) "
tirmidhi27_721370	 حدثنا قتيبة حدثنا نوح بن قيس عن عبد الله بن	حدثنا عمران عن عبد الله بن سرجس عن النبي صلى الله عليه وسلم نحوه ولم يذكر فيه عن عاصم والصحيح حديث نصر بن علي 	 حدثنا قتيبة حدثنا نوح بن قيس عن عبد الله بن عمران عن عبد الله بن سرجس عن النبي صلى الله عليه وسلم نحوه ولم يذكر فيه عن عاصم والصحيح حديث نصر بن علي 	 
tirmidhi27_721380	 حدثنا محمد بن عبد الله بن بزيع حدثنا بشر بن	حدثنا المفضل عن قرة بن خالد عن أبي جمرة عن ابن عباس أن النبي صلى الله عليه وسلم قال لأشج عبد القيس إن فيك خصلتين يحبهما الله الحلم والأناة قال أبو عيسى هذا حديث حسن صحيح غريب وفي الباب عن الأشج العصري 	 حدثنا محمد بن عبد الله بن بزيع حدثنا بشر بن المفضل عن قرة بن خالد عن أبي جمرة عن ابن عباس أن النبي صلى الله عليه وسلم قال لأشج عبد القيس إن فيك خصلتين يحبهما الله الحلم والأناة قال أبو عيسى هذا حديث حسن صحيح غريب وفي الباب عن الأشج العصري 	" Ibn 'Abbas narrated that the Messenger of Allah said to the Ashajj 'Abdul-Qais: ""Indeed there are two traits in you that Allah loves: Forbearance, and deliberateness.""(Sahih) "
tirmidhi27_721390	 حدثنا أبو مصعب المدني حدثنا عبد المهيمن بن عباس بن	حدثنا سهل بن سعد الساعدي عن أبيه عن جده قال قال رسول الله صلى الله عليه وسلم الأناة من الله والعجلة من الشيطان قال أبو عيسى هذا حديث غريب وقد تكلم بعض أهل الحديث في عبد المهيمن بن عباس بن سهل وضعفه من قبل حفظه والأشج بن عبد القيس اسمه المنذر بن عائذ 	 حدثنا أبو مصعب المدني حدثنا عبد المهيمن بن عباس بن سهل بن سعد الساعدي عن أبيه عن جده قال قال رسول الله صلى الله عليه وسلم الأناة من الله والعجلة من الشيطان قال أبو عيسى هذا حديث غريب وقد تكلم بعض أهل الحديث في عبد المهيمن بن عباس بن سهل وضعفه من قبل حفظه والأشج بن عبد القيس اسمه المنذر بن عائذ 	" Abdullah-Muhaimin bin 'Abbas bin Sahl bin Sa'd As-Saidi narrated from his father, from his grandfather, who said that the Messenger of Allah said: ""Deliberateness is from Allah, and haste is from the Ash-shaitan.""(Da'if) "
tirmidhi27_721400	 حدثنا ابن أبي عمر حدثنا سفيان بن عيينة عن عمرو بن دينار عن ابن أبي مليكة عن يعلى بن مملك عن أم الدرداء عن أبي الدرداء عن	عن النبي صلى الله عليه وسلم قال من أعطي حظه من الرفق فقد أعطي حظه من الخير ومن حرم حظه من الرفق فقد حرم حظه من الخير قال أبو عيسى وفي الباب عن عائشة وجرير بن عبد الله وأبي هريرة وهذا حديث حسن صحيح 	 حدثنا ابن أبي عمر حدثنا سفيان بن عيينة عن عمرو بن دينار عن ابن أبي مليكة عن يعلى بن مملك عن أم الدرداء عن أبي الدرداء عن النبي صلى الله عليه وسلم قال من أعطي حظه من الرفق فقد أعطي حظه من الخير ومن حرم حظه من الرفق فقد حرم حظه من الخير قال أبو عيسى وفي الباب عن عائشة وجرير بن عبد الله وأبي هريرة وهذا حديث حسن صحيح 	" Abu Ad-Darda narrated that the Messenger of Allah said: ""Whoever was given his share of gentleness, then he has been given a share of good. And whoever has been prevented from his share of gentleness, then he has been prevented from his share of good.""(Hasan) "
